제목,내용,날짜,추천수,조회수
"법원 ""교통사고 가해측 보험사는 피해차 가치 하락도 배상해야""",,05/03,5,692
"에디슨EV ""채권자가 법원에 파산 신청…채권액 36억원""",,05/06,3,1266
"기아, 신형 니로 EV 사전계약 실시…1회 충전에 401㎞ 주..",,05/03,2,1452
"현대차, 3년 만에 유관중으로 `현대 N 페스티벌` 개최",,05/03,1,260
호세 무뇨스 현대차 사장 이사회 합류…글로벌시장 챙긴다,,05/04,1,274
원자잿값 상승? “당분간 요소수 가격 재인상 없다”,"요소수 대란 6개월, 요소수 업계대란 후 가격 인상…추가 인상엔 ‘신중’“일부 요소수 판매업체가 불안감 조성”시중에 불량 요소수 만연…순정품 확인해야최근 국제 원자재가 상승과 러시아-우크라..",09:26,0,17
"현대차, 제2회 `히어 커스터마이징 아이디어 공모전` 개최",(서울=연합뉴스) 김보경 기자 = 현대차는 고객 맞춤형 아이디어를 모집하는 '히어(H-ear) 커스터마이징 아이디어 공모전'을 연다고 9일 밝혔다.히어는 상품·서비스 개발 초기 단계에서부터..,09:24,0,11
"EV6 등 현대차그룹 전용 전기차, 내수 5만대·수출 10만대 돌파","인니서 아이오닉 5 인기·GV60 美시장 출시로 하반기 판매 확대 전망기아 EV6[기아 제공. DB 및 재판매 금지](서울=연합뉴스) 박성민 기자 = 현대차 아이오닉 5와 기아 EV6, 제..",09:21,0,6
"현대차, 울산공장에 LNG 열병합발전소 건설 추진",한전에서 받는 전력량 72% 자체 생산 계획현대차 울산공장[연합뉴스 자료사진](서울=연합뉴스) 박성민 기자 = 현대차가 메인 공장인 울산공장에 액화천연가스(LNG) 열병합 발전소를 건설해 ..,09:19,0,8
"""2028년까지 미래차 기술인력 약 4만명 더 필요…인재양성 시급""","자동차산업 인적자원개발위 ""내연기관차 부품 기업 2030년까지 500개 줄어""""한국 친환경차 관련 인력 5만명…6년 뒤 인력 수요 8만9천69명에 달할 것""미래차 (CG)[연합뉴스TV 제공..",09:17,0,3
포터·봉고 `잘나가네`…승용차 누르고 판매 1·2위 달린다,반도체난·EV인기에 이례적으로 가장 많이 팔려불황보단 구매환경 변화 따른 복합적 요인 작용(서울=연합뉴스) 김보경 기자 = 차량용 반도체 수급난 여파로 국내 자동차 판매 순위가 뒤바뀌고 있..,09:15,0,8
3억원 이상 국내 법인명의 `슈퍼카` 5천대 넘어…6년새 4배로,"정우택 의원실 분석…""2억∼3억원 법인 수입차는 2만1천여대""독일-영국 등은 법인차 사적용도 사용시 소득세 부과…""제도개선 필요""람보르기니 우라칸 테크니카[연합뉴스 자료사진](서울=연합뉴스..",09:14,0,5
쌍용차 인수 중도포기 없다…인수후보 4곳 인수제안서 제출 방침,2주간 예비실사 종료…다음달 11일까지 인수제안서 접수침묵에 휩싸인 쌍용차 평택공장[쌍용차 제공. 재판매 및 DB 금지] photo@yna.co.kr(서울=연합뉴스) 최평천 기자 = 쌍용차..,05/06,1,1709
"에디슨EV ""채권자가 법원에 파산 신청…채권액 36억원""","파산 선고되면 즉시 상폐…거래소 ""관리종목 지정 사유 추가""에디슨모터스[에디슨모터스 제공. 재판매 및 DB 금지](서울=연합뉴스) 최평천 이미령 기자 = 쌍용차 인수에 나섰다가 실패한 에디..",05/06,3,1299
"광명시, 기아차 공장 인근에 `수소전기복합충전소` 준공",(광명=연합뉴스) 김인유 기자 = 경기 광명시는 4일 소하동 기아 AutoLand 광명(옛 기아자동차 소하리공장) 정문 앞에서 '수소전기복합충전소' 준공식을 했다.광명 기아차 공장 인근에 ..,05/06,0,238
"LG전자, 차량용 반도체 내재화 추진…개발 기술 인증받아","MCU·PMIC 등 차량용 반도체 개발 프로세스 구축…""사업화 검토 단계""LG전자, 차량용 반도체 내재화 추진[LG전자 제공. DB 및 재판매 금지](서울=연합뉴스) 김철선 기자 = LG전..",05/06,1,446
"자동차부품업체 다스, 자율주행차용 충돌안전 시트 등 개발",자율주행차 대응 편의내장 부품산업 고도화[다스 제공. 재판매 및 DB 금지](경주=연합뉴스) 손대성 기자 = 이명박 전 대통령이 실소유주라는 논란이 일었던 자동차 부품회사인 다스가 정부 지..,05/06,0,231
"일진머티리얼즈, 폭스바겐그룹의 스페인 전기차 프로젝트 참여",일진머티리얼즈 로고[일진머티리얼즈 제공](서울=연합뉴스) 김철선 기자 = 이차전지 소재기업 일진머티리얼즈[020150]는 폭스바겐그룹의 스페인 전기차 프로젝트 '퓨처 패스트 포워드'(Fut..,05/06,1,96
"벤처협회, 현대차·기아 1차 협력사와 기술협력할 벤처 모집",㈔벤처기업협회 로고[벤처기업협회 제공. 재판매 및 DB 금지](서울=연합뉴스) 이영섭 기자 = ㈔벤처기업협회는 오는 20일까지 현대자동차와 기아 1차 협력사와의 기술협력을 희망하는 벤처기업..,05/06,0,62
"고유가 시대 ‘만 트럭 연비’, ‘신기술’로 극복한다",화물차 연료비가 수입의 절반 가량 차지러-우크라 전쟁에 경유가 폭등…부담 가중만트럭버스코리아화물차주 연비 개선 절실한 점 감안GPS 기반 예측 주행 및 기어변속 제공만트럭버스코리아가 지난해..,05/06,0,202
4월 수입차 판매 2만3천70대…반도체 수급난에 작년보다 9.8%↓,"디젤·가솔린차 줄고 전기차 늘어…벤츠·BMW, 1·2위 차지수입차 시장(CG)[연합뉴스TV 제공](서울=연합뉴스) 최평천 기자 = 차량용 반도체 수급난이 장기화하면서 지난달 수입차 판매가 ..",05/04,0,586
"군산시, 슈퍼커패시터 융합 특수목적 모빌리티 산업 육성",산업부의 스마트 특성화 기반구축사업에 선정…86억 투입무인 자율주행 특장차(노면 청소차)[중소벤처기업부 제공. 재판매 및 DB금지](군산=연합뉴스) 홍인철 기자 = 전북 군산시는 '슈퍼커패..,05/04,0,470
호세 무뇨스 현대차 사장 이사회 합류…글로벌시장 챙긴다,(서울=연합뉴스) 김보경 기자 = 현대자동차 호세 무뇨스 글로벌 최고운영책임자(COO) 겸 미주대권역담당 사장이 현대차 이사회 멤버로 합류한다.현대차 미국법인이 2일(현지시간) 배포한 자료..,05/04,1,274
반도체난에 완성차업계 4월 판매 4.9%↓…르노·쌍용차는 선전,"현대차·기아 판매감소로 실적 주춤…르노코리아차, 수출 364%↑쌍용차, 뉴 렉스턴 스포츠&칸 활약에 호실적(서울=연합뉴스) 김보경 권희원 기자 = 차량용 반도체 수급난에 따른 생산 ..",05/04,0,394
"코오롱, 세계 최대 복합소재 전시회 참가…모빌리티 솔루션 소개",코오롱그룹 'JEC 월드 2022' 참가[코오롱 제공. DB 및 재판매 금지](서울=연합뉴스) 김철선 기자 = 코오롱그룹은 프랑스 파리에서 열리는 세계 최대 복합소재 전시회 'JEC 월드 ..,05/04,0,96
‘만트럭버스 부산신항 서비스센터’ 신규 오픈,동남권 물류의 허브인 부산 신항에서만트럭버스코리아 서비스 거점 마련 의미총 8개 워크베이를 통한 신속한 서비스 제공전국 23개 서비스 센터 확보…고객 서비스 더욱 강화만트럭버스 부산신항 서..,05/04,0,146
"""기아, 기후 위기 대응에 함께합니다""…지구 살리기 프로젝트",광주 민관기업 협력 네트워크 기반…기후 위기 대응·실천(광주=연합뉴스) 송형일 기자 = 기아 오토랜드(AutoLand)광주가 지난해에 이어 올해도 기후 위기에 대응하기 위한 지구 살리기 프..,05/04,0,64
4월 신차 등록 작년 동기보다 10.6%↓…국산·수입 모두 줄어,"카이즈유데이터연구소 집계…벤츠, 수입차 등록 대수 1위 고수자동차[연합뉴스TV 제공](서울=연합뉴스) 권희원 기자 = 차량용 반도체 수급난이 지속되면서 국내 신차 등록 대수도 계속 감소하고..",05/04,0,75
김제시 `상용 특수차량 자율주행 플랫폼 개발`…국비 220억 확보,김제시청[연합뉴스 자료사진](김제=연합뉴스) 백도인 기자 = 전북 김제시는 '데이터 기반 상용 특수차량 위험환경 극복 자율주행 협업 플랫폼 개발 및 실증사업'이 산업통상자원부 공모에 선정됐..,05/04,0,106
"기아, 신형 니로 EV 사전계약 실시…1회 충전에 401㎞ 주행",64.8kWh 배터리로 5.3Km/kWh 전비 구현…3세대 플랫폼 적용(서울=연합뉴스) 김보경 기자 = 기아가 친환경 전용 스포츠유틸리티차(SUV) '디 올 뉴 기아 니로'(신형 니로)의 ..,05/03,2,1455
"법원 ""교통사고 가해측 보험사는 피해차 가치 하락도 배상해야""",[권도윤 제작] 일러스트(대구=연합뉴스) 이강일 기자 = 교통사고 가해자 측 보험사는 피해 차량 수리비뿐만 아니라 사고에 따른 차량 교환가치 하락에 대해서도 배상해야 한다는 판결이 나왔다...,05/03,5,697
유류세 인하+유가연동보조금? 유류비 더 들 수도,"작년 상반기 유류비 232만 원, 올해는 400만 원 예상연말~올초 유류세 20% 내려도 한달 유류비 398만 원5월 유류세 30%인하+유가연동보조금 적용 시 396만 원정부는 지난달 ‘고..",05/03,0,310
`e-모빌리티의 올림픽` 제9회 국제전기차엑스포 서귀포서 개막,"테슬라, 폴스타, 초소형 전기차 마이브 전시·시승 기회 제공전기차 산업 관련 비즈니스·학술·정책 등 100여개 콘퍼런스도 열려(서귀포=연합뉴스) 박지호 기자 = 'e-모빌리티의 올림픽'을 ..",05/03,0,145
"고장 잇따르는 중국산 전기버스...국토부, 안전 검증 강화한다","피라인모터스 전기버스 2개 차종 리콜비상탈출장치 미설치 등...2일부터 수리국토부, 중저가 수입산 전기상용차 대상안전 검사 강화 및 신속한 후속조치 예고중저가 중국산 전기버스의 안전 결함 ..",05/03,0,221
"현대차, 피치스와 어린이날 행사 `칠드런스 데이` 개최",(서울=연합뉴스) 김보경 기자 = 현대차가 라이프스타일·패션브랜드 피치스와 손잡고 N 브랜드를 체험할 수 있는 어린이날 행사를 연다.현대차는 오는 5∼8일 서울 성수동에 있는 복합문화공간 ..,05/03,0,201
"현대차, 3년 만에 유관중으로 `현대 N 페스티벌` 개최",6∼8일 개막해 7개월간 7라운드 진행…'아반떼 N컵' 신설(서울=연합뉴스) 김보경 기자 = 현대차는 3일 국내 최대 규모의 원메이크(단일차종) 레이싱 대회인 '현대 N 페스티벌'(Hyun..,05/03,1,263
"현대차, 넥쏘 판매 감소에도 1분기 전세계 수소차 시장 1위",2021 상하이 국제수소자동차대회에 전시된 현대차 넥쏘[촬영 차대운](서울=연합뉴스) 권희원 기자 = 현대차가 올해 1분기(1∼3월)에 전 세계 수소전기차 판매량 1위를 차지했다.3일 에너..,05/03,0,206
"포항시, 차량용 전력반도체 거점도시 도약…산업부 공모 선정",자동차 출고센터[연합뉴스 자료사진](포항=연합뉴스) 손대성 기자 = 경북 포항시는 산업통상자원부가 추진한 '와이드밴드갭 소재 기반 차량용 전력반도체 제조공정 기반구축 공모사업'에 선정됐다고..,05/03,0,84
기아 4월 판매 5.8%↓…RV 인기에 1년만에 내수 5만대 돌파,스포티지·셀토스·K3 순으로 잘 팔려(서울=연합뉴스) 김보경 기자 = 지난해부터 계속된 차량용 반도체 수급난 여파로 기아의 지난달 판매 실적이 작년 같은 기간 대비 소폭 감소했다하지만 국내..,05/03,0,83
현대차 4월판매 반도체난에 주춤…30만8천여대로 작년보다 11.6%↓,현대차[현대차 제공. 재판매 및 DB 금지](서울=연합뉴스) 박성민 기자 = 현대차의 올해 4월 판매실적이 차량용 반도체 공급난에 발목을 잡히면서 지난해 같은 기간보다 10% 이상 감소했다..,05/03,0,81
작년 중고 상용차 수출 호조로 18%↑,"중고 트럭 수출 작년 8만 1,066대…전년比 20.0%↑해상운임 낮은 5톤 이하와 트랙터 위주 수출 증가중고 버스, 동남아 일대에 소형급 위주로 수출 회복수출용 중고 트럭 선적하는 모습(..",05/03,0,127
"기아, 연식변경 `더 2023 K8` 출시…일부 선택사양 기본 적용","(서울=연합뉴스) 김보경 기자 = 기아는 준대형 세단 K8의 연식 변경 모델 '더(The) 2023 K8'을 출시하고 판매를 개시한다고 2일 밝혔다.기아, 'The 2023 K8' 출시[기..",05/02,0,2013
"현대모비스, 스마트키를 디지털키로 바꾸는 `브링앤티` 출시","현대모비스, 스마트키→디지털키 변환 '브링앤티' 출시[현대모비스 제공. 재판매 및 DB 금지](서울=연합뉴스) 박성민 기자 = 현대모비스는 자동차 스마트키를 스마트폰과 연동시켜 디지털키로 ..",05/02,0,1156
"운전자 없이 빈공간 자동주차…벤츠코리아, `파크 파일럿` 시연",애플리케이션 통한 자동 발렛주차 기술(서울=연합뉴스) 김보경 기자 = 메르세데스-벤츠 코리아는 자동차가 알아서 주차장을 찾아 이동하는 자동 발렛 주차(대리 주차) 기술인 '인텔리전트 파크 ..,05/02,0,703
외면받는 2천㏄급 중형차…9년 연속 비중 하락,엔진 효율 높아져 다운사이징 가속화되고 SUV 선호 등 영향자동차 엔진[촬영 안 철 수](서울=연합뉴스) 박성민 기자 = 한국을 대표하던 배기량 2천㏄급 중형 자동차가 갈수록 쇠락의 길을 ..,05/02,0,890
`K배터리` 1분기 점유율 26.3%…중국기업 약진으로 점유율 하락,CATL 등 중국 업체 점유율 절반 넘어…LG엔솔 15.9%로 2위'K배터리' 1분기 점유율 26.3%…중국기업 약진으로 점유율 하락 (CG)[연합뉴스TV 제공](서울=연합뉴스) 김기훈 기..,05/02,0,156
"삼성SDI, 제주 전기차 엑스포서 새 배터리 라인업 선보인다",'프라이맥스' 브랜드·'젠6' 등 소개삼성SDI제9회 국제전기차 엑스포에 참가한 삼성SDI 부스 조감도. [사진제공=삼성SDI. 재판매 및 DB 금지](서울=연합뉴스) 김기훈 기자 = 삼성..,05/02,0,123
"LG엔솔, 호주 라이온타온과 `리튬 정광` 최종 공급계약 체결",LG에너지솔루션[LG에너지솔루션 제공](서울=연합뉴스) 조재영 기자 = LG에너지솔루션이 호주 광산업체 '라이온타운(Liontown)'으로부터 5년간 리튬 정광 70만t(톤)을 공급받는다...,05/02,0,85
"SK케미칼, 옥수수로 만든 친환경 폴리올 양산 돌입",제네시스 GV60 인조가죽 시트에 적용SK케미칼 바이오 폴리올 준공식[SK케미칼 제공. DB 및 재판매 금지](서울=연합뉴스) 김철선 기자 = SK케미칼이 옥수수로 만든 친환경 폴리올 신소..,05/02,0,120
"현대차, 아마추어 레이싱팀 `TEAM HMC` 6년 연속 후원","현대차, 아마추어 레이싱팀 'TEAM HMC' 6년 연속 후원[현대차 제공. 재판매 및 DB 금지](서울=연합뉴스) 박성민 기자 = 현대차는 6년 연속으로 아마추어 동호회 레이싱팀인 'TE..",05/02,1,191
수소충전소 관련 세계 5대 특허청 특허출원 연평균 15% 늘어,"중국, 일본, 미국, 한국, 유럽 순기체수소충전소 개념도. 출처 한국가스기술공사[특허청 제공. 재판매 및 DB 금지](대전=연합뉴스) 유의주 기자 = 수소차 시장이 커지면서 수소충전소에 관..",05/02,0,88
"현대차, 아이오닉5로 인니 전기차시장 선점…작년 판매량의 2배 계약",사전계약대수 1천587대…'일본차 텃밭' 인니 시장 전기차로 공략(서울=연합뉴스) 김보경 기자 = 현대자동차가 아이오닉5를 내세워 인도네시아 전기차 시장 공략에 박차를 가하고 있다.아이오닉..,05/02,0,113
"현대차·기아, 전기차 앞세워 1분기 친환경차 수출 10만대 돌파",전기차 수출 80.5%↑…아이오닉5·EV6 각각 1만5천여대플러그인하이브리드 47.8% 늘고 하이브리드는 2.8% 줄어아이오닉 5[연합뉴스 자료사진](서울=연합뉴스) 권희원 기자 = 차량용..,05/02,0,79
"친환경 버금가는 ‘유로6D’ 시대 돌입 국산·수입 트럭 8사, 시장공략에 박차","올해부터 유로6D 본격 시행…신모델 잇따라편의·안전·첨단기술 사양 확대로 상품성 강화엔진 출력 유로6A와 비교해 10~30마력 증대배기량 13ℓ급 400마력대 축소, 500마력대 집중친환경..",04/29,2,1288
"제네시스 GV70, 美자동차전문지 평가서 BMW·렉서스 제쳐",(서울=연합뉴스) 최평천 기자 = 제네시스 GV70 스포츠 모델이 미국 자동차 전문지 '카앤드라이버' 비교평가에서 BMW와 렉서스를 제치고 1위를 차지했다.29일 현대차에 따르면 GV70 ..,04/29,9,1411
"히노 준중형 전기트럭 ‘듀트로 Z EV’, 일본서 실증사업 돌입","히노는 자사 준중형 전기트럭 ‘듀트로 Z EV’를 아스쿨, 큐브링크스, 히노자동차 등 3사에 도입, 실증사업을 진행한다고 최근 밝혔다.듀트로 Z EV는 차량 총중량 3.5톤에 전장, 전폭,..",04/29,0,513
"여기서 잠깐! 왜 이런 모습이지? 미 트럭, 진짜 미국풍스럽네!","트럭은 각 국가의 화물운송 환경에 맞춰 발달한다. 가령 일본의 경우 데이캡(Day Cab, 침대 공간이 없는 캡)과 저상캡(차고를 낮춘 캡)의 선호도가 높다. 한국과 유럽은 슬리퍼캡(Sle..",04/29,0,1232
[속초소식] 내달부터 전기자동차 충전구역 불법주차 단속,(속초=연합뉴스) 강원 속초시는 다음 달 1일부터 지역 내 모든 전기자동차 충전 및 전용주차구역 내 불법주차와 충전방해 행위에 대해 단속한다고 29일 밝혔다.전기차 충전소[서울시 제공. 재..,04/29,0,245
제주 국제전기자동차엑스포 내달 3일 개막…테슬라·폴스타 참가,"40여 개국서 2만여 명 참가, 100여 개 세션 진행(제주=연합뉴스) 고성식 기자 = 제9회 국제전기자동차엑스포(IEVE)가 다음 달 3일 제주에서 개막한다.전기차 엑스포 퍼레이드(CG)..",04/29,0,154
"SKB 자회사 홈앤서비스, AJ대원과 공동주택 전기차 충전기 확대",[홈앤서비스 제공. 재판매 및 DB 금지](서울=연합뉴스) 조성흠 기자 = SK브로드밴드의 자회사 홈앤서비스는 공동주택 내 전기차 충전기 설치 확대를 위해 건물시설 관리업체 AJ대원과 업무..,04/29,0,96
"GM, 지속가능경영 보고서 발간…""기후형평성기금 5천만달러 조성""",GM 2021 지속가능경영 연간보고서[한국GM 제공. 재판매 및 DB 금지](서울=연합뉴스) 권희원 기자 = 한국GM은 본사인 제네럴모터스(GM)가 5천만달러(약 630억원) 규모의 '기후..,04/29,0,105
"다임러트럭 자회사 토크로보틱스,독일 슈투트가르트에 자율주행 연구센터 설립",토크 로보틱스는 지난 4월 독일 슈투트가르트(Stuttgart)에 자율주행 연구센터를 설립한다고 밝혔다. 이곳에선 운전자가 개입하지 않는 수준인 대형트럭 레벨4 자율주행이 연구될 예정이다...,04/29,0,266
"두산퓨얼셀, 2년 내 국내 수소버스 출시한다",발라드파워시스템즈 및 하이엑시엄과 협력두산퓨얼셀이 현대자동차의 주력 무대인 수소버스 시장에 뛰어든다. 2년 내 차량용 수소연료전지를 탑재한 수소버스를 국내 시장에 선보인다는 구상이다.28일..,04/29,0,165
"용인시, 2022년 전기버스 지원 사업 시행","용인시가 오는 5월 3일부터 2022년도 전기버스 구매 지원 사업을 시행한다.지원 차량은 1층 전기버스 44대, 2층 전기버스 6대 등 50대다. 신청 자격은 보조금 신청 3개월 이전부터 ..",04/29,0,91
"트라톤, 전기트럭 개발에 대대적 투자",2026년까지 26억 유로 투자기존 16억 유로보다 대폭 증액순수 배터리 전기트럭에 집중트라톤그룹의 전동화 구상을 그린 영상의 한 장면독일 폭스바겐 산하 상용차 그룹인 트라톤은 지난달 전기..,04/29,0,177
"현대차, 경형 전기 SUV 개발중…2024년 유럽 출시할듯",현대차 아이오닉 5[현대차 제공. 재판매 및 DB 금지](서울=연합뉴스) 최평천 기자 = 현대차가 유럽 출시를 목표로 경형 전기 SUV(스포츠유틸리티차)를 개발 중이다.27일 업계에 따르면..,04/28,2,
"캐딜락, 쇼트트랙 금메달리스트 최민정·황대헌에 SUV 지원",(서울=연합뉴스) 박성민 기자 = 캐딜락은 2022 베이징동계올림픽 쇼트트랙 금메달리스트 최민정(성남시청)과 황대헌(강원도청) 선수에게 럭셔리 스포츠유틸리티차(SUV) 'XT5'를 지원한다..,04/28,1,
"르노코리아차, 2022 협력업체 컨퍼런스…""친환경차 개발 합심""","르노코리아차, 2022 협력업체 컨퍼런스[르노코리아차 제공. 재판매 및 DB 금지](서울=연합뉴스) 권희원 기자 = 르노코리아자동차는 27일 부산시 파라다이스[034230] 호텔에서 친환경..",04/28,0,315
"정부, `산업혁신기반구축 로드맵` 수립…52개 과제 R&D 투자",수송·전자전기·바이오·기계로봇 등 6개 분야별 신규과제 선정연구개발(R&D)(PG)[이태호 제작] 사진합성·일러스트(서울=연합뉴스) 권혜진 기자 = 정부가 중소·중견기업이 활용할 수..,04/28,0,107
"현대자동차, 어린이통학차량 ‘무상 케어 서비스’ 실시","현대자동차는 향균, 점검, 에어컨 필터 교환 등의 서비스를 무상으로 제공하는 어린이 통학차량 ‘무상 케어 서비스’를 실시한다고 21일 밝혔다.구체적으로 현대자동차는 ▲차량 실내 살균 및 피..",04/28,0,130
"금호타이어, 내달 독일·이탈리아 타이어 전시회 참가",(서울=연합뉴스) 박성민 기자 = 금호타이어는 다음 달 24일(현지시간)부터 사흘간 독일 쾰른에서 열리는 국제 타이어 전시회 '더 타이어 쾰른(The Tire Cologne) 2022'와 ..,04/28,0,125
"기아, 네덜란드 환경단체와 바다 플라스틱 제거·활용 `맞손`",'오션클린업'과 파트너십 체결…자원순환체계 구축 일환(서울=연합뉴스) 김보경 기자 = 기아는 네덜란드의 비영리 환경단체인 '오션클린업'(The Ocean Cleanup)과 지속가능한 지구를..,04/28,0,97
"현대차·기아, 국내 대학과 손잡고 전기차 소프트웨어 개발한다","'지능 제어 공동연구실' 설립…서울대·연세대·광운대 참여현대차그룹 지능제어 공동연구실 설립왼쪽부터 현대엔지비 강성원 상무, 현대차·기아 김치경 상무, 현대차·기아 연구개발본부장 박정국 사장..",04/28,1,102
"`수소모빌리티+쇼` 조직위, 다음달 프랑스 수소산업전 참여",현대차 아이오닉 5[현대차 제공. 재판매 및 DB 금지](서울=연합뉴스) 최평천 기자 = 현대차가 유럽 출시를 목표로 경형 전기 SUV(스포츠유틸리티차)를 개발 중이다.27일 업계에 따르면..,04/28,0,89
"금호타이어, 순천교통과 버스 모니터링서비스 시범운행 완료","금호타이어(대표 정일택)는 전라남도 운수업체인 순천교통과 버스 모니터링 서비스(이하 KBM, Kumho Bus Management System) 시범운행을 완료했다고 20일 밝혔다.금호타이..",04/28,0,135
"기아, 첫 PBV `니로 플러스` 공개…다음달부터 사전계약",주요 고객 대상 설명회 개최…택시·일반모델 2가지로 출시전고·전장 키운 설계로 공간감 최대화(서울=연합뉴스) 김보경 기자 = 기아가 '니로 플러스'로 목적 기반 모빌리티(PBV) 시장 진출..,04/27,0,1834
"중국, ‘배터리 교체식’ 전기트럭 대세","전기차 한계 ‘긴 충전시간’해결하며 보급에 속도올 1월 친환경 대형트럭판매량 2,283대의 99%‘배터리 교체식’ 전기트럭이 중국에서 선풍적인 인기를 끌고 있다. 배터리 교체식 전기트럭은 ..",04/27,5,1850
`상암 자율차 지구` 가상현실로…모의주행 시뮬레이터 개방,"SK텔레콤 등 국내기업 제작…서울시 ""기업·연구소 등 활용해 산업화 촉진될 것""자율차 모의주행 사진[서울시 제공. 재판매 및 DB 금지](서울=연합뉴스) 임미나 기자 = 서울시는 가상현실로..",04/27,0,203
"현대모비스, 미쓰비시 출신 임원 영입…일본 시장 공략 `본격화`",자율주행·전동화 부품 수주 활동 강화…현대차도 일본 진출(서울=연합뉴스) 최평천 기자 = 현대모비스가 일본 미쓰비시자동차 임원 출신을 영입하며 일본 시장 공략에 나섰다.현대차가 올해 2월 ..,04/27,0,363
핸들 안 잡았는데 경고음 안 울려…벤츠 E 250 등 3만991대 리콜,"국토부, 벤츠·랜드로버·기아 등 5개사 총 4만7천173대 리콜벤츠 리콜 차량[국토교통부 제공. 재판매 및 DB 금지](서울=연합뉴스) 최평천 기자 = 국토교통부는 메르세데스-벤츠코리아, ..",04/27,0,261
