car_brand,car_model,comments,likes
현대,i40,i30와 i40의 실패원인은 우리나라 사람이 해치백과 왜건을 싫어해서가 아니라 현대가 어설픈 고가 전략을 펼쳤기 때문이라 생각합니다. i30에 관심이 많았지만 견적 한번 내보면 살 마음이 싹~사라집니다. 동급 대비 프리미엄이 아니라 다른 스타일의 대안으로 접근했었으면 나름 성공했겠지요. 1세대 i30가 제법 인기있었지만 2세대 i30가 PYL 외치며 비싸게 판 이후 망했듯이 말이죠. 이번 i40도 끝물되니 가격경쟁력이 좀 생기네요. 하지만 안타깝게도 이미 늦은 듯 합니다.,7
현대,i40,i40은 쏘나타크기로 나오면서 앞면 디자인만 바꿨어도 대박났을차인데 현대가 안티임,1
현대,i40,"아이가 있어 짐을 많이 실어야하는데,  SUV 의 껑충한 승차감은 싫고....대안은 웨건차량입니다.",4
현대,i40,"시승해보면 압니다. 이차는 k5, 쏘나타가 비빌수준이 아님 크기랑 전면디자인이 너무 아쉬움 그리고 편의사항은 왜 없는거여",1
현대,i40,"우리나라는 왜 이렇게 왜건,해치백을 선호하지 않죠?",2
현대,i40,연비가 5.2 이게 중요한거죠 ㅋㅋㅋ,3
현대,i40,좋은 차 같습니다....,1
현대,i40,"지금 사기는 너무 애매함. 급이 낮아서 싼마이 재료에서 오는 실망감이아니라 그냥 디자인이 옛날꺼라 자체가 구려보임. 옵션도 지금 소나타보다도 못함. 아반떼, i30처럼 옵션이 소나타보다 i40이 더 좋아야 되는데 하도 옛날차라 지금 소나타보다도 못함. 그리고 내년이면 소나타 풀체인지인데 답이 없음. 그랜저도 하체랑 바디 살짝만 손보고 실내외 디자인 확 바꿔서 풀체인지 한거처럼 i40도 그렇게 나오면 될꺼같은데  i40은 i30처럼 외국에서 잘 안팔리는가 생각보다 안바꿔주네 i30은 유럽에서 잘팔리니까 제때제때 페리도 하고 풀체인지도 다 했는데",4
현대,i40,이놈에도 n 을 적용해주면 어떨까요? 엔진도 큰놈까지 적용해주고.,1
현대,i40,"가솔린 살룬PYL오너로서 너무 좋게 평가하셔서 놀랐네요. 편집장님차를 k7로 뽑으신거 보면 취향과도 전혀 다른 차인데. i40는 그런 느낌 같아요.사람들이 한두번 타보면 좋게 평가하는데 막상 본인들은 이 차를 절대 안 사는 그런 차..제가 타면서 느낀 단점만 써보면(장점은영상에 나와있고), 살룬의 경우 아반떼로 인식함(그래서 살려면 왜건사야함), 노면소음,풍절음 심함(동급이라고하는소나타가더좋음), 승차감너무딱딱함(2열승차감너무나쁨), 자동6단미션(저단에서바보임.완전구형세팅임.기어비너무타이트해서RPM너무많이쓰니연비는둘째치고소음이심함), 실내(정말옛날느낌에촌스러움), 옵션구성(18년형도측후방경보는아예없음.메모리시트도사이드미러는빠짐.락폴딩도없음.전반적으로옛날옵션구성그대로임). 낮은등급 재고할인받으면 아반떼 높은등급가격인데, 아반떼 사는게 나음. 높은 등급 살바엔 소나타 풀옵이 훨 나음. 물론 왜건을 꼭 사고 싶다면 이차밖에 없으니 추천함.",3
현대,i40,실내에서 올드한 느낌과 와 3~4년 정도 타면 바디에 변형이 오는 당싱의 프레임은 지금 시대에는 좀 문제가 있지요.세타2는 설계부터 이미 에러가 있는 엔진이라 아무리 가격적으로 가성비 높아도 구입하기에는...10만 타고 보링하는 시대도 아니고...몇 가지 단점만 없다면 가족용 자동차 구매 예정이라 개인적으로 i40 좋은 선택중 한가지도 다가오는군요.,4
현대,i40,잘보고갑니다 항상 응원합니다,1
현대,i40,i40 2세대 해외서 위장막으로 돌아다니고 있습니다.^^,3
현대,i40,왜건 좋아하는 1인 추가요~,84
현대,i40,중고차 가격방어는 엄청 쎄던데,4
현대,i40,페페리 오너입니다.실내는 센터페시아만 빼면 괜찮은거 같습니다.제 개인적인 의견이지만 센터페시아 셋팅이 살짝 기울어져있어서 조작?하기가 쉬운 느낌이 듭니다. 물론 잘 안팔려서 실내까지 투자하기에는 어려웠나봅니다.하지만 대륙의실수?라는 제품들이 있듯이제가 일본에 살았었을때 여러차 시승해봤고한국에 와서도 우리나라 브랜드 왠만한건 다 시승해봤지만 이차만큼은 현대의실수?인잘 만들어진 차 같습니다.추신:일본사람중 우리나라 자동차 대표적인 브랜드가 현대 기아인지 대부분 모르지만여러나라 여행다니는  분들이나  학회 겸 출장으로 많이 가시는 고학력자 교수님들이나 현지 일본대표 브랜드 딜러분들 얘기 들어보면현대 기아 칭찬하던데 왜 유독 우리나라에서 계속 까이는지 모르겠네요...물론 엔진 급발진 등등 대처문제 때문에 개선이 필요하지만 넓은 시야에서 보면 점점 개선되는모습이 보입니다.,1
현대,i40,"가격이 이제 살만해진거지 출시할땐 할인없으면 소나타위 그렌져사이라 그렌져 포기하고 사기가 어려웠음, 친구녀석은 아반떼신형이냐는 소리도 들음",6
현대,i40,지금은 i30를 타고있는데요~I30하고 i40특별한 차이점이 있나요???,1
현대,i40,i30 중고차 첫차로 생각중인데 i40 끌리네요..,1
현대,i40,11년식 살룬도 비슷한 느낌인가요?,1
현대,i40,현대가 실수로 잘만든차 ㅋㅋㅋㅋㅋㅋㅋㅋㅋㅋㅋㅋㅋㅋㅋㅋㅋㅋㅋㅋㅋㅋ그런데 정작 대한민국에서 가장 안팔린차 꼴찌.....ㅋㅋㅋㅋㅋㅋㅋㅋㅋㅋㅋㅋ아반떼 소나트같은 똥차만 찾는 대한민국 돈을 쬐금더 주고서라도 이런140를 사야합니다,11
현대,i40,몇년뒤면 인테리어 테슬라 모델3 스타일로 갈거 같음 ;;;,1
현대,i40,이차는 왜건이라 안팔리고 세단도 애매해서 안팔리고.. 참 국내에서 상품성은 떨어지는듯,3
현대,i40,악셀 그 느낌 정비공장 들어갔다 나오면 사라져요.그러니 가능하면 현대써비스 입고는 고려하세요.제 i40 경험 입니다.,1
현대,i40,보고나서 사고싶어도 전시차 없고 시승차도 없어요. 팔기싫은가 싶을정도,1
현대,i40,"이해가 안가는게 투싼 페리는 인테리어 바꿔서 내놓으면서, 왜 i40페페리는 인테리어 안바꾸고 내놓는거냐....새차사면서도 재고사는 느낌을 지울 수가 없을 듯한데,차가 좋고 나쁘고 따지기 전에ㅠ 옛날차 내지는 중고차 사는 기분들듯",3
현대,i40,볼보 왜건을 잡아버리자! 현대! 언젠간..,1
현대,i40,진짜 내가... 지금 스파크 모는데 결혼하면 진짜   i40왜건 사려고 돈모으는중 ㅠㅠ 4년만 기다려줘요.. 제발..,1
현대,i40,그랜저ig가 i40보다 더 단단하다는데 진짜인가요??,1
현대,i40,"디젤 프리미엄을 타다,  디젤특유의 공명음과 저속 꿀렁거림 소음 진동, 무튼 디젤이 너무 안맞아 휘발 프리미엄으로 갈아탔다. 다 좋았다, 근데 초기 gdi 엔진 스크레치로  8만에 ㅅㅂㅅㅂ 하며 오바홀 그렇게 10만까지 타다 다른 차량으로 넘어왔다. i40 가솔린을 마지막으로 와이프 차까지 3대의 차량을 거쳐왔지만, 왠지 모르게 i40가 다시 타고싶네, ㅅㅂ꺼,,,,,",2
현대,i40,자도 14년식 i40랑 18년식 그렌저 보유하고 있지만 i40타다가 그렌저 타면 나무 붕 뜨는 느낌이.나요,1
현대,i40,yf차체... 물론 yf보단 좋아도 아무래도 고속안전성은 lf대비 떨어질수밖에없지,2
현대,i40,김송은 기자님 팬으로서 삑사리 치료(?)^^ 도와드리고 싶네요.ㅎㅎㅎ그나저나 i40는 나라를 잘못 만난듯요.^^ 유럽 사람들은 완전 좋아하지 않을까요?,4
현대,i40,"아, 디젤 오너는 이거 보고 갈등 생깁니다.",1
현대,i40,마지막에 약간 대사가 꼬이는것같았는데 기분이져? ㅋㅋ i40은 차는 좋지만 우리나라에서는 인기가 ㅋ,2
현대,i40,I40 차 좋은건 아는데 앞디자인이 아반떼라서 돈은 그랜져값주고 샀는데 앞지다인은 아반떼 ..,2
현대,i40,I40세단이 많이 팔렸다는 근거는요??,3
현대,i40,왜건 굿,1
현대,i40,근데 왜 디젤은 안나왔나요 ㅜㅜ,3
현대,i40,시승기 는 보증기간 지난걸 로 하시길요.,1
현대,i40,i40살룬 3년타고 뉴라이즈로 2년타고있는데 하체라던지 세팅이 뉴라이즈가 더낫습니다  그당시 yf나k5보다낫지 다음세대 소나타나k5보다는 이제 아래라고느껴지네요,4
현대,i40,모터리언기자분들부터 한대씩 구매하시죠ㅋ,1
현대,i40,이차는 빨아준다고 살수있는 한계를 넘었음. 실내봐라 저게 언제적실내인데... 사실상 현기에서 버린거지,4
현대,i40,I40 왜건 페페리 사고싶은데 매물이 없음 ㅠㅠ,2
현대,i40,음  좋아하면서도 왜 그걸사 라는말 듣기 싫어서 안사는 분들도 있죠...,6
현대,i40,계기판 1도 안바뀜,1
현대,i40,I40 슬라럼테스트 보고 오세요......살 차가 아닙니다,2
현대,i40,사골 중의 사골. 진국입니다.,1
현대,i40,싸운드는 엔진 소리가 아니네,1
현대,i40,감사합니다,1
현대,i40,살룬도 ㅠㅠ,1
현대,i40,송은기자 왜케 이쁨?,8
현대,i40,보링포티 2.0 혹시나 특이한거 찾다가 사면 잣됨 조올라게 안나감 진짜 풀악셀 안치면 모닝은 커녕 죠스바한테 스타트 털림 4700알피엠이 최대토크 6500알피엠에서 최대마력이 나와서 폐차까지 몇번 쓸일도 없음 3천 아래서는 차가 비실비실 걍 병신임 게다가 사운드 자체도 3천 가까이 가면 엔진 터질거 같은 소리나서 불안감 마저 듬 이 차산게 제일 후회될 정도,2
현대,i40,진짜 ..... 전문성 1도 없다...,2
현대,i40,언니가 이뿌네...ㅋ,1
현대,i40,지금은 현대가 싫은거 보다  아마 현.기.노조를 싫어해서 현대차를 깔겁니다저도.현.기.1992년부터 탔는데 삼성  SM5 3년탄거 빼고는 아직도 현대차 타고있음.저는 기아 카스타도 한 2년탔음그런데 카스타도 왜건?,1
현대,i40,3등~~^^,1
현대,i40,신고충들 때문에 속도계 가린거 칭찬해,1
현대,i40,1등이요,1
현대,i40,저분 기자의 개인적인 취향도 무시하는 꼰대 인증 반말 간간이 섞는것도 불편하고 노잼은 용서가 되지만 무례는ㅡㅡㅡ,1
현대,i40,돈받고 광고하는거아님?계속 구독해서봤는데 이번은 심한것같은데,11
현대,i40,이건 거의 두명의 쇼호스트가 나와서 현기차 광고방송 하는 것같다. 그리고 마지막에 '모터리언입니다' 이거 정말 마음에 안드는데 할려면 두분의 음정을 맞추세요. 편집장님이 장5도 정도 음정을 높이면 어울릴 지도...녹음기 틀어놓고 연습하세요.,6
현대,i40,아..진짜 서우토반의 차주 인터뷰는 독보적이네요..차주님 맘아프신 일도 담담하게 풀어내서 말씀하시는 부분이 참 좋았습니다..,76
현대,i40,i40 정말 좋은차지만 가격에 외면되서 아쉬운 차네요. 차주분이 정말 좋아해서 구매하신게 영상미로 너무 잘 느껴지네요. 단점이 다소 자극적이지만 저 역시 단점은 많지만 애정으로 타는 차가 있어 공감이 너무 가는 영상이라 생각해요.,19
현대,i40,전 서우토반님 구독자로 새로운영상보면항상보는데 이번화가 가장 좋았어요차주분의 솔직하면서 개그감있으신 언변과뭉클한얘기도 어색하지않게 마무리해주시는 서우토반님도 너무 좋았어요항상 채널 흥하고 다음기회있으면 저도 출연해보고 싶다는 생각이 들었네요 ^^,6
현대,i40,"I40 4년 조금 넘게 몰다가 아버지가 필요하시대서 드리고 다른차로 넘어갔었는데 진짜 타는 동안 만족하면서 탔던 차입니다. 당시 기준으로 옵션도 되게 좋았고 승차감, 연비 다 잡은 차였었죠. 현대가 국내차가 어쩌구하던 편견 싹 날려준 차였습니다. 그 후로 아버지는 지금까지 타고 계신데 얼추 10년 넘게 타는 동안 디스크, 패드만 갈고 최근 인젝터 하나 나가서 교환한 거 말곤 고장도 없는 괜찮은 차같아요.",6
현대,i40,차주님의 차량에 대한 애정과 신념이 보기 좋습니다^^,8
현대,i40,20대 중반까지는 차에 대해 전혀 관심이 없었는데 후반 넘어갈때쯤 차에 관심이 생겼던 계기가 i40 뭔가 일반 세단은 스타일이 아니고 짐을 싣거나 차박하기에도 왜건이 편한거 같아 보여서첫차는 무조건 i40 왜건이나 suv 쪽으로 보고 있음,6
현대,i40,차주분 정말 차를 이동수단으로서 충실하게 타는게 멋진거같습니다,2
현대,i40,"다양한 차종, 차주들의 일반인 시각의 리뷰, 서우토반 리뷰가 최고",17
현대,i40,13년 i40 웨건타고 있습니다. 잔고장없이 잘타고있습니다. 왜건이 찬밥대우 받는게 아쉽긴하지만 일단 왜건사는 차주들은 다들 만족하며 타고있는것 같습니다.,4
현대,i40,12년식 왜건 디젤 파썬만 빠진 풀옵 다음달이면 10년차입니다잔고장도 없고 진짜 괜찮은 차입니다쫙 빠진 디자인은 아직도 질리질 않습니다,5
현대,i40,i40 살룬 디젤 몰고 있는데 디젤만 안나가는 줄 알았더니 가솔린도 똑같이 안나가나 보네요 ㅋㅋ 안나가서 답답하다는거에는 매우 공감합니다. ㅋㅋ 그 외에는 딱히 흠잡을때 없는차라고 생각합니다.,2
현대,i40,왜건 좋아하는데 마지막엔 변절을 해서 308 해치백을 사버렸습니다.제 명의 첫차라 짜세에 그만 변절을....왜건 정말 좋아하시는게 영상을 통해 느껴집니다.귀한 i40왜건 영상 잘 봤습니다.,12
현대,i40,우리나라가 왜건 무덤이라 그렇지 실생활에서는 매우 유용하죠! 이런 희귀차종까지 역시 서우토반,8
현대,i40,I40 가 최근 가성비 중고차로 각광받으면서 중고가가 오히려 오르고 있더라구요,5
현대,i40,"I40 패리 디젤 차주로서 느낀장점1. 중고로 사면 가성비 개꿀2. Suv와 비교불가한 좋은 주행감3. 엄청난 적재공간, 놀라운 실연비단점1. 시내 저속주행의 dct 고질적 단점들2. 잡소리(저도 동호회 정보를 통해 다 잡음)3. 사람들 인식(아반떼, i30 소리 많이 들어봄)총평: 패밀리카로 여행(장거리, 캠핑, 차박)가기 좋은 자동차",6
현대,i40,역시 서우토반은 광고보다 운전자 리뷰지..,27
현대,i40,저도 왜건 넘 좋아하는데 현실과 타협했습니다 차주님 멋지십니다,28
현대,i40,i40 당시 제품기획팀에 있던 후배가 정말 신경썼던 차라고 극찬을 했는데 울나라는 웨건 안팔릴거라 힘들지 않냐 했는데 역시나.후배는 뉘르가서 직접 테스트도 했다는데.대신 오리지날 뉘르스티커 받았네요.짭이랑 구분은 안가지만요ㅋㅋ,4
현대,i40,해치백만 20년 타고 있고 앞으로도 해치백이나 왜건으로 바꿀 예정인데 ..현재는 K3GT밖에 선택지가 없어서 매우 아쉽습니다아반떼 투어링도 V60cc처럼 부활시켜 줬으면 좋겠습니다..잘보고 가겠습니다..,2
현대,i40,2012년식 i40 소유하다가 지금은 팔았는데 주행감각도 좋았고 그당시 제가 몰았던 비슷한 연식 현기차중에 브레이크 가장 안밀리고 잘 들어서 좋았구요넓찍한 트렁크로 애들 장난감 엄청 싣어오고 잘 다녔습니다. 웨건이 그립습니더,3
현대,i40,차주분 인성이 느껴지십니다.말씀도 잘 해주시고 사람 자체가 좋아 보이십니다 ㅎㅎ,3
현대,i40,크 저도 i30pd타면서 도로에서 i40 보기힘든데 볼때마다 이쁘더라구요 해치백이랑 왜건 타입이 좋습니다 ,14
현대,i40,이차는 진짜 진국인데가격이 좀 높은게 아쉬운차.. 차는 ㅇㅈ .,3
현대,i40,왜건이 요즘 나오는 소형suv보다 경쟁력 더 좋고 승차감도 좋은데... 안팔리는게 문제,13
현대,i40,"13년 12월에 출고한 vgt i40 를 이제 31만km 타는동안 u2엔진의 신뢰성은 정말 만족하면서 타고있습니다. ^^  핸들가죽9만원/운전석시트 부분교체 40만원(등받이,아래가죽 및 스폰지 교체)/ 수술형 삭스쇼바 앞뒤 한대분 50만원대 저렴한가격탓에 10만km단위마다 교체해주면서 신차처럼 컨디션 유지해주면서 타고있습니다 ^^ 혹시 중고로 i40 생각중이신분들은 꼭 한번 거쳐가보실 추천드립니다",2
현대,i40,2014년도 i40 디스펙 오너 입니다신형의 옵션을 느끼고 싶다가도대체할만한 차가 없네요이차를 정말 폐차 할때까지 탈거 같네요,3
현대,i40,현재 i30 pd를 타고 다니고 있습니다 벌써 40300km 넘겼네요 전 이 녀석으로 가족여행 다니며 추억을 만들고 있네요 돈으로 살 수가 없는 것이 추억이잖아요 원래 살 때 i40도 고려했지만 그 때 딜러가 차가 워낙 노후되어서 추천하지 않는다고 하더라구요 나온지 6년이고 풀체인지가 안된 모델이라고... 그래서 제가 원래 살려고 한 i30을 샀죠,3
현대,i40,12년식 타는데 여전히 앞모습만 보면 아반떼인줄 아는 사람때문에 슬픔+1 고질병과 D모드 딸딸이.. 그거외에는 정말 좋습니다.제가 느끼는 단점들이 차주분도 동일하네요 ㅎㅎ,1
현대,i40,3gt 오너인데 웨건이나 bmwgt차량 같은 차량은 해치백과다르게  세단타면서 suv와 비슷한공간활용성을 이용할수 있는 최고장점  인듯합니다,1
현대,i40,i40 실제로 봤는데 진짜 멋 있어라구여~근데 한국선 안팔림 ㅋㅋ우리나에선 산타모 말고 성공한적이 없네 ㅎㅎㅎ,1
현대,i40,왜건은 사랑이죠 ㅎ 전 비엠320투어링 3개월째 타는데 너무 만족하면서 탑니다 ㅎ 기회되면 저도 인터뷰 하고싶네요 ㅋ 왜건찬양!!,2
현대,i40,12년식 왜건탑니다.당근으로 12키로 통돌이 세탁기를 구매하려고 갔는데 승용차를 가지고 왔냐며 걱정 하길래 이차는 실을수있어요 했더니 못믿더군요.막상 싣고보니 이런차가 있네 하더군요.차 크기가 엄연히 다름에도 불구하고 앞에서만 보고 아반떼 소리 가끔 들어요.i40라고 하면 열에 아홉은 첨들어본다 해요.아주가끔 배기량이 4000cc냐고도 물어봐요.인지도는 딱 이정도인듯해요. 잘몰라요.근데 저는 개인적으로 국산차 중에는 갈아타고 싶은 차가 없을 정도로 좋아요.무사히 20만 찍고 볼보v90cc로 가고싶네요.하늘이 허락한다면 아우디rs6아반트 까지는 가보고 싶네요.,7
현대,i40,I40디젤 오너입니다.왜건은 사랑이라는 말씀에 공감합니다!,2
현대,i40,저도 호주에서 현대 웨건 타고있습니다. GDI라서 옥탄가 98 넣고 6000마다 엔진오일 넣어주고있어요. 좋은 인터뷰 감사합니다,1
현대,i40,라인은 참 잘빠졌는데 한국정서엔 안맞는차... 왜건수요가 그래도 어느정도 있는데 아쉽네요..,3
현대,i40,예전에 집에 몰던 자동차가 프라이드 왜건이라 왜건이 너무 몰고 싶네요지금은 k3지만 여유가 되서 차를 바꿀때쯤엔 현기도 왜건 모델이 활성화 되길 ㅠ ㅠ,1
현대,i40,3:26 디자인 진짜 최고네요.,1
현대,i40,"참 안타까운 모델임 현재 5년째 타는데 굉장히 좋은 차지만 너무 구형 모델이라 바꾸고 싶은데 딱히 대체할만한게 없음. 이차는 당시 기준으로 비싸고 애매한 포지션에 세단이 대세라 망한건데 지금 풀체인지 해서 재출시 하면 시장성 있음. i40장점은 디젤기준 연비, 적재용량 그리고 당시기준 나쁘지않은 옵션. 디젤모델 20km나옴. 적재용량은 싼타폐 수준임. suv보다 차체가 낮아 짐싣기도 편함. 세단의 편함과 suv의 적재용량. 이거타고 가족여행 하면 너무 좋음.   그리고 지금 기준으론 단점인데 디딸(14만인데 경운기 수준임. ㅋ).이거빼면 타봄 너무 만족 함. 그래서 g70왜건 기대했는데 너무 실망임. 일단 디자인은 제쳐두고 i40을 만들어본 회사임에도 트렁크에 턱을 만들어 놓음. 이게 뭐냐면 보통의 suv나 왜건은 트렁크 열면 뒷범퍼랑 트렁크 공간이 평평함. 그래서 짐싣는게 편함. 그냥 밀어 넣으면 되니까 근데 세단은 트렁크 바닥이 움푹들어간 형태 인데 이러면 짐을 들어 트렁크 문턱을  넘어야 해서 짐싣는게 힘든데 g70은 이런식으로 디자인함. 물론 일반 세단보단 낮긴한데 이러면 왜건을 만든 의미가 없음.그리고 테일램프쪽도 트렁크 공간을 침범해 입구가 굉장히 좁음. 다른브랜드는 이런식으로 안함. bmw나 볼보는 완벽하게 실용적으로 트렁크 입구 뚷려있음.   아쉬움 어짜피 패밀리카라 성능은 기분만 나오면 되기에 값비싼 고성능은 필요치 않고 고급스러움과 기능을 원해 기대했는데 실망ㅜ아우디도 일반 모델 출시할줄 알았는데 그냥 rs만 나오네요 ㅜㅜ근데 현대가 g70이랑 현대 모델 2가지로 선택폭을 주고 출시 된다면 요즘 시대에는 분명 시장성 있음. 볼보,bmw에서 보듯 시장성은 있음. 경쟁자가 없으니 팔림. 고성능에 프리미엄 원하는 고객층이랑 정말 실용성 추구한 고객층 2부류 노려 g70 풀체인지랑 i40후속 출시한다면 시장성은 있지만 시대가 또 변하네요  전기차가  왜건 시장 장악 할듯합니다. 이미 왜건같은 디자인으로 출시해서 왜건 와벽 대체할듯 합니다. 여튼 i40은 비운의 차량임.",2
현대,i40,이 차주분과 비슷한 이유로 차는 세단도 해치백스타일로 열리는 차를 무조건 선호하게 되더군요.,1
현대,i40,개인적으로 국산차중에 가장 좋아하는 차,2
현대,i40,차주님 마음 잘 추스르시길 바래요,1
현대,i40,"i40 7년 가솔린 차주로.. 그냥 나쁘지 않았습니다 누GDI 리콜 누락된거 빼면...저도 13만 넘어가면서 느꼇는데 일단 엔진오일 감소 이슈, 그 쯤되면 엔진 운명 직전 오버홀 필수 개인적으로 페리전이 더 이뻣..제차라 그런가.. 여튼 나쁘지 않습니다 나가는거도 빠른진 않아도 지치지 않게 나가는 느낌이구요. 노면 잘타는건? 개인적으로 그렇게 느낀적은 없습니다",2
현대,i40,"웨건 진짜 매력적인 차량입니다. 저도 i40 차주인데, 이런 영상 귀하고 너무 반가워서 좋네요 ㅎㅎ",4
현대,i40,좋은 웨건 신차좀 만들어줬으면 합니다.  웨건 러버,9
현대,i40,"2012년부터 i40 GDI 몰고 있습니다. 영상 거의 없는데, 반갑네요... 20만 바라보고 있는데 잘 타다 헤어져야죠. 역대급으로 실용적인 차입니다.",1
현대,i40,아버님 좋은데 가셨을거라 생각합니다. 덕분에 잘 봤습니다! 해치백과 왜건의 무덤이 안타까워요ㅜ 왜건과 해치백은 사랑입니다♡,33
현대,i40,바디라인은 i40가 전세계 웨건중 최고라고 생각하는 i40 1세대 차주입니다. 디젤은 겨울되면 괴로워져요.,4
현대,i40,차는 진짜 좋았는데 이쁘고..가격책정이 그랜져보다 비쌌었죠..,1
현대,i40,말씀을 조리있게 잘하시네요. i40 관심있었는데 좋은 정보 잘 얻고 갑니다!,1
현대,i40,i40 16년형 웨건 디젤 중고로 업어와서 6개월차 모는중인데 ㅎ 아주 만족중입니다 웨건 많이 사랑해주세요 ㅋㅋㅋ,3
현대,i40,현대 6단 미션 진짜 끔찍한게... 킥다운 하려고 풀악셀 밟고 킥다운 스위치 밟으면 딜레이가 한 3초 정도 됩니다 ㅋㅋㅋ,1
현대,i40,말씀 정말 편하게 잘하시고  애정이 느껴지심 ㅋ,1
현대,i40,영상잘보고있습니다 서우토반님즐추되세요~!,1
현대,i40,와...아니서우토반님 왜 이렇게 갈수록 잘생겨지시는거죠영상 업로드될때마다 더 멋있어지시네용,2
현대,i40,진짜 진심 저 당시에 웨건 지나가는거 보고 왜이리 길어??이 생각에 뻑가서 사고 싶었는데 가격이...쏘나타보다 비싸버려 ㅠ,3
현대,i40,차주님 인터뷰되게 잘하시네요 ㅋㅋ,3
현대,i40,나도 어려서부터 웨건타는게 꿈이라 이차 출시되자마자 알아보고 사려고했었는데..금전의 압박에 못샀는데 승용차의승차감에 suv의 적재성 이점이 가장큰 매력이지요지금은 단종도되고 주차장도 작아서 SUV로 왔지만 한번쯤 타보고싶은 차량입니다 ㅎ오래오래 잘 타세요~^^,1
현대,i40,"그런데, i40 (OO2) 풀체인지 출시했으면 좋겠어요가솔린, 하이브리드, LPG[LPi], EV 4가지엔진모델로 나왔으면 좋겠어요",5
현대,i40,최초에 차 살 수 있는 여력이 됐을때 사고싶던 차였어요 ㅠㅠ 부럽습니다 차주님!! 잘봤습니다 ㅎㅎ 지금은 최근에 CR-V 끌고있습니다 서우토반님 출연 신청해도 될까요?,4
현대,i40,I40 는 사랑입니다.,3
현대,i40,진짜 이제까지 나온차주분중 젤 귀엽네 ㅋㅋ,1
현대,i40,서우토반 보며 오늘도 즐거운 시간!,2
