car_brand,car_model,comments,likes
도요타,RAV 4,"코란도와 비교하면 어떤가요??요새 폭풍할인하면서 셀토스보다 저렴하던데, 어째뜬 투싼이랑 경쟁하던 모델인지라 기준점(?)인 Rav4와 차이가 궁금하네요(코란도가 하이브리드는 없지만 준중형suv로서의 비교가 긍금합니다)",3
도요타,RAV 4,오토-뷰!!!!!,3
도요타,RAV 4,오랜만의 일본차!! 저도 렉서스를 타고 있지만.. 참 자동차는 잘 만들어요..!안녕하세요 자동차 그리는 카드로잉이라고 합니다!😍🥰좋은 영상 감사합니다!,36
도요타,RAV 4,1년넘게 일본차를 리뷰 안하셨다니.. 눈치보고 알아서 잘 기어야되는 나라가 과연 정상적인 나라인지 의문입니다. 시승기 잘 보았습니다. 감사합니다.,52
도요타,RAV 4,이게 nx300과 같은 플랫폼 파워트래인인가요?,1
도요타,RAV 4,불매불매하는데 오히려 이런 리뷰를 통해서 국산차가 다른 차량들에 비해 얼마나 경쟁력을 잘 갖췄는지를 알려준다고 생각해요.일본꺼다~ 하면서 무작정 달려들기만 하면 오히려 도움이 안 될 뿐이죠.비교라는 것을 통해 발전을 해 나가는 것이지 이런 비교조차 싫다면 결국 도태되는 것이라고 봐요.,24
도요타,RAV 4,도요타가최고지,12
도요타,RAV 4,"일본차인걸 떠나서 특히나 실내외 디자인과 소재가 한국시장에서 크게 어필될 차는 아니죠... 단, 이 신형 라브4가  북미시장에서는 전체 SUV중 판매 1위에요 ㅎㅎ",34
도요타,RAV 4,"이차 정보 없어도 ,충분히 비교대상 많은데...",1
도요타,RAV 4,일본차는 내구성으로 타는 겁니다 .. 흉기는 껍대기 모양으로만 타는 거구요 ..,25
도요타,RAV 4,현 세계최고의 수소차 넥쏘도 리뷰 부탁드립니다!!,2
도요타,RAV 4,일본차좋은데 가격도싸고,2
도요타,RAV 4,현대가 디자인은 정말잘하는듯...,7
도요타,RAV 4,들창코 같네요 하이브리드 기술력은 인정이죠다만 너무 하이브리드에 집중하느라 하이브리드 그 이후에 대해서는 조금 의문인게 현 일본 제조사들의 걱정거리 아닐까요,4
도요타,RAV 4,툭별한 장점도 없지만 특별한 단점도 없는 차,18
도요타,RAV 4,"한국차 하이브리드는 일본차 하이브리드 못따라가죠. 이건 인정해야함. 쏘렌토 하이브리드 친환경 인증도 못받은 무늬만 하이브리드이고 쏘렌토, 투싼 하이브리드 둘다 1.6 터보... 엔진에 터보들어가면 신경쓸께 하나 더 있는만큼 내구성에도 미칠 영향이 큼",11
도요타,RAV 4,왜 싫어요가 이렇게 많이 눌린지 했더니 ㅋㅋㅋㅋㅋㅋㅋㅋㅋㅋㅋㅋ,36
도요타,RAV 4,여러모로 투싼 하브가 나아보이네요..,3
도요타,RAV 4,다소 높은 가격 + 각종 블박신고 교통범칙금 = BMW X3 가격 될겁니다. 가성비 생각하시면 맘 편히 국산SUV으로 사시는게...,11
도요타,RAV 4,잘보고갑니다,7
도요타,RAV 4,국내에 투싼 하이브리드가 나온 상황이라 사실상 경쟁력이 많이 떨어지긴 했네요,9
도요타,RAV 4,현대 기아 살빠에는 혼다 토요타 사지.. 10년은 고장 없고 서비스 센터 갈일 없음.,15
도요타,RAV 4,"일본(차)에 대한 거부감이 없지않지만, 리뷰는 리뷰일뿐...욕 먹어도 국뽕! 국산차가 최고! 힘내라! 현대기아차 화이팅!",7
도요타,RAV 4,일단 이시국에 남의 시선 개의치않고 일본차 사는 분 정말 용기가... ㅎㄷㄷ한 분들...ㅋㅋㅋㅋㅋ,3
도요타,RAV 4,하이브리드 차량을 소렌토와 비교하는 것은 좀~,1
도요타,RAV 4,살생각 1도 없지만 리뷰는 잘보겠습니다. 세상 돌아가는건 알아야하니깐요~ 차는 경재에 미치는 영향이 큰 소비제라 일본차 구매는 꺼려지네요. 축구는 져도 경제에서 이기고싶네요. 대일 무역 흑자를 위하여!!,8
도요타,RAV 4,현대 as센타 가면 사람 완전 개취급. 요즘은 예약 자체가 불가. 삼성이 자동차를 했어야 하는데.,27
도요타,RAV 4,오토뷰 항상 응원하고 잘 보고 있습니다. 하지만!!! 일본차 리뷰는 지양해 주셨으면 좋겠네요!!!,3
도요타,RAV 4,"현기차 하는 꼬라지보면 답도 안나온다,,,기본기에 충실하지 못하고 전자사양만 5지게 넣고 일본불매가 한창인 시절 때도 값올릴 생각만 하고,,,사람들이 일본제품이라도 욕해도 현기차 하는 꼬라지보면 차라리 안전을 위해서 일본차사겠음",27
도요타,RAV 4,내가 어제 쏘하 지금 신청하면언제 받을 수 있는지 카마스터 유툽한테 물어 봤는데 된장 이런식으로 생산되면 내년 11월은되야 받을 수 있다네 ㅋㅋ 까딱하면이 시국에 니뽄차 살지도 모르겠음,1
도요타,RAV 4,일본은싫어도 차는 잘만든다 자국민 개호구로 아는 흉기차보단 100배 더좋음 일본차타는게 애국이겠구나 ㅋ,20
도요타,RAV 4,일본차는 디자인이 참,1
도요타,RAV 4,NX300H는 언제 하시죠?,1
도요타,RAV 4,요즘은 토요타가 원가절감을 심하게 해서 실내 파츠를 소프트 파츠를 줄이고 걍 하드 플래스틱 파츠를 써서 찌그덕거리는 잡소리와 내선 부딪히는 소리는 기본옵션으로 따라옴;; 일본놈들도 자국민 눈탱이 칠려고 고급을 원하면 럭세스를 선택해야함,3
도요타,RAV 4,하...쏘렌토 더럽게 생산 느려서 그냥 라브4 살까 하고 봤는데내부 디스플레이 버튼 무슨 2000년도에 나온 차 같네...,4
도요타,RAV 4,자발적 호구취급 그만당하고 기본기좋은 일본차 사자!,5
도요타,RAV 4,이거 엄청 싸던데 ....,2
도요타,RAV 4,감사합하니다.,6
도요타,RAV 4,차값은요?,1
도요타,RAV 4,"일본차 내구성 안전성이 객관적으로 더 좋은데, 애국심으로 꼭 현기 사야하나요? 이시국하시는분들은 초밥도 안드시고, 카메라도 캐논 소니안쓰시죠?",13
도요타,RAV 4,좋아요,3
도요타,RAV 4,다좋은데 네비가 진짜 에라네.....하...,1
도요타,RAV 4,편안들 하십니까?,1
도요타,RAV 4,전일본서 회사다니는데 이차는 저희회사서 영업용으로쓰고있는데 개인적으로 차량실내가 가격대비싼티가 너무심합니다오히려 요새는 국산suv가 훨씬나은것같습니다 카탈로그스펙이 일제가더나을지몰라도 일반인이그걸다느끼면서 몰일이없죠 2000년대초반suv같습니다 도요타는 요새 크라운이하를타보면 원가절감인지 싼티가너무많이나서 도요타는별로타고싶지않아지더군요저도최근 차를바꾸려고 rav4랑 스바루 포레스터를 비교하다가 포레스터에기울었다가 어느새 랭글러까지 맘이가기시작하네요  이차의 경쟁모델인 스바루 포레스터가 훠얼씬좋은것같습니다,2
도요타,RAV 4,Honda ㅡ crv 부탁 합니다라브랑.crv  지금 구매 비교중입니다,12
도요타,RAV 4,"독일차는 브랜드빨이 너무 심함.잔고장과 결함 등이 은근히 많음.서비스 센터가 악명이 높다고 함.(물론 다 그런건 아님)특히 고장 주기가 나름 정해져 있다고 함.고질병도 무시 못함.독일차는 무조건 좋다?글쎄?국산차는 거지들이나 타는 차라고 욕먹음.반일로 애국 구매를 많이 하는 거 같은 데, 결함 문제가 잦고 기업의 태도에 개빡쳐 하는 피해자 많음.국산차 대부분이 GDI엔진을 쓰는 데,GDI엔진이 논란이 많음.특히, 국산 경차와 소형차 개무시 심함.일본차도 거지들이나 타는 차라고 욕먹음.요즘은 반일 문제로 욕 더 처먹음.기술적으로 봤을 때, 차는 좋은 거 같음.독일차와 견주어도 손색이 없음.일본차는 컨셉이 다름.독일차 처럼 성능과 재미 등 즐기는 차는 아님.스웨덴차 볼보는 중국차라고 맹목적으로 비난함.이유 없음. 그냥 깜.차는 나름 괜찮은 거 같은데, 안전과 관련된 거 외에는 호불호가 많이 갈림.미국차는 실내 인테리어와 연비로 욕먹음.그리고 서비스 센터 부족과 대응이 개차반이라고 욕먹음.물론 일부 센터는 괜찮다고는 함. 다 그런 건 아님.영국차는 사는 게 아니라고 욕먹음. 개빡쳐함. 결함률이 개인적 체감상 제일 안 좋은 거 같음.프랑스차도 웬만하면 안 사는 걸 추천 많이 함.굳이 이유를 들자면 기반이 열세임.중국차 동풍소콘차는 오리지널중국차라 한국인이라면 그냥 안 삼.이유 없음. 모험하고 싶은 사람이 없을 거임.호기심에 사는 사람은 있을 수 있음.일본사람이 한국차를 안 사는 이유가이런 이유와 비슷하지 않을까 생각해 봄.물론 일본에 대한 판매 전략 실패가 제일 큰 걸로 알고 있음.그 외 고가의 차량들은 금수저들의 장난감이라 패스.-----------------------------------------------어떤 차를 사더라도 그냥 욕처먹게 되어 있음.도대체 뭘 사라는 겁니까?불매운동 하실 분들은 열심히 하시고,일본차나 일본 제품에 끌리는 사람은 눈치 보지 말고 구매하시고,삐뚤어진 애국심에 일본차주에 대한 ""명예신고"" 좀 그만 하시고,남 차 사는 데 오지랖 좀 그만 하시고,자신의 인생과 소중한 사람에게 더 신경을 쓰시기 바랍니다.",26
도요타,RAV 4,현기아는 결함 많아서 싫고... 일본차는 디자인이 너무... 우야노...,8
도요타,RAV 4,쏘렌토  살  빠엔  라브4사세요. 쏘렌토 차주인데  친구놈  라브 4타보고  후회  하고있네요 ㅠㅠ,10
도요타,RAV 4,리뷰는 리뷰고 불매는 불매죠 리뷰하는게 죄는 아닌듯,21
도요타,RAV 4,정권 바뀌니 이제 좀 일본차 구매 가능하겠네오,2
도요타,RAV 4,반팔 입으신 걸 보니 이미 예전에 찍어 놓은 건가…,26
도요타,RAV 4,다좋은데 디스플레이..,3
도요타,RAV 4,일본 차 품질 좋다는건...이미 소문이 자 자 합니다매국이니 애국이니 가문제가 아니고 현실적으로한일감정 폭팔하면애지중지 하는 내차테러 당할까봐구매 못하고 있습니다.,2
도요타,RAV 4,"이차가격은요,",1
도요타,RAV 4,불매운동으로 반사이득은 현기차가 다 누렸지.. 현기차는 경쟁자가 없어지니 가격은 맘대로 올리고 조립은 노조원이 유튜브 보고 조립하느라 불량률 치솟지.. 결국 불매운동해서 소비자만 손해,67
도요타,RAV 4,차량계약했는데 걱정됩니다...,8
도요타,RAV 4,일본 싫다..일본 제품 싫다..일제 좋아하는 사람들 별로다. 하지만 차는 일본 차 사도 뭐라 하고 싶지 않다. 생명과 관련된 부분이니...현기 차도 좀 배웠으면 좋겠는데 관연?,1
도요타,RAV 4,저 큰 차에 파노라마가 없는게 많이 아쉽네요...,7
도요타,RAV 4,흉기 하는 꼬라지보면 일본차 구매량을 늘리는게 애국이다. 눈치 보지말고 일본차 시승기 부탁합니다!!,18
도요타,RAV 4,토요타 명차인데,29
도요타,RAV 4,주행실연비는 왜 안알려주삼?????,7
도요타,RAV 4,렉서스 2021 es300h도 해주세요~~~,25
도요타,RAV 4,실외는 그렇다 쳐도  실내가 넘모 하자너...,18
도요타,RAV 4,"홍콩, 마카오 갔을때 굉장히 많이 보이더라구요.인테리어는 한세대 뒤쳐진 것 같습니다...",10
도요타,RAV 4,애국 이랍시고 이득본건 누구인지?,34
도요타,RAV 4,하 일본차는 신차 사도 중고차 느낌이다 유럽 애들 좀 데려다가 디자인 좀 하자,1
도요타,RAV 4,차는 좋은데 디자인은 좀 퇴화한듯,1
도요타,RAV 4,나도 일본차 별로 안좋아하지만 열심히 만든 영상에 무조건 싫어요는 뭐냐 사라고 홍보하는것도 아닌데...,20
도요타,RAV 4,일본차 불매하자는 사람들 스시 플스 .단무지 먹지도 사지도 마라,4
도요타,RAV 4,아니 그냥 일본차라고 싫어요 누르는거? 햐 어이없는 사람들 많구만 ㅋㅋㅋ,13
도요타,RAV 4,일본차가 아까운건 성능은 진짜 좋은데 문제는 디자인이..영.......,2
도요타,RAV 4,현기는 언제 도요타 따라잡을래? 기술이 너무 딸리는데.,9
도요타,RAV 4,싫어요 보소,42
도요타,RAV 4,신고가 무서워서 못타겠습니다 참매력적이긴 하지만요.. 세워둔차에 테러하는건 일상이더군요..,3
도요타,RAV 4,기아 조상 마쯔다현대 조상 미쓰비시,41
도요타,RAV 4,일본차도 신경 쓰지 마시고 많이 올려주세요. 차의 국적보다는 차 자체가 어떤지 궁금합니다.,50
도요타,RAV 4,일본차 불매인가요? 이시국엔 현기차 불매아닌가~,26
도요타,RAV 4,"국산차 탄다고 애국자고 일본차 탄다고 매국노 아님. 야동, 초밥, 우동, 돈까스, 필기구,  플스, 닌텐도, 오토바이..세상은 글로벌 시대임",18
도요타,RAV 4,하이브리드는 일본이 좋음,30
도요타,RAV 4,우와 내차다~,15
도요타,RAV 4,토요타가 흉기보다 좋지!,23
도요타,RAV 4,현기 품질보면 왜 일본차 판매량이 점점 올라가는지 알겠어요,28
도요타,RAV 4,현기 엔진 미션 결함에 유튜버나 고소하고 개판치는거 보니 일본차에 눈이간다.,13
도요타,RAV 4,북미판매1위,4
도요타,RAV 4,한국 취향에 먹히는 차는 아닌 듯 싶네요. 디자인이 투박한 요소가 많네요. 실내에 저 시대착오적인 모니터와 무식한 에어컨 다이얼을 보자니 진짜 미국시장용 차임을 다시 한번 느끼네요,1
도요타,RAV 4,댓글보러 왔습니다. 댓글보면 일본차가 최고네요 ㅋㅋㅋ,13
도요타,RAV 4,"수준높은 일제차 배제하고 구매할 수 밖에 없는 상황이 더 X같다..현기가 국내에서 반일감정으로 판매 재미를 볼때도요타는 미국,제3세계에서 더욱 기술력으로 인정 받네. 소형, 준중형, 중형세단 싹쓰리 판매1위.그럼에도 국민들은 일제차 불매(?)하는데현기는 낮은 품질로 보답하네..",23
도요타,RAV 4,글로벌 무역시대에 뭘 안사줘서 상대를 이긴다면 군대는 뭐하러 존재하냐...우리가 처한 상황을 냉철하게 판단하고 힘을 기르는데 노력하자현대 기술원천이 미쓰비시,84
도요타,RAV 4,네비 어쩔;;;,11
도요타,RAV 4,다른건 다 좋은데 디스플레이가 너무 아쉽네요.,18
도요타,RAV 4,불매 이전에 알권리,50
도요타,RAV 4,야동보지말고 다이소나 가지마세요~~,7
도요타,RAV 4,원래 아내 다음 차가 렉러스 아님 라브였는데 그 후 일본차 접음. 그래도 볼게요^^,1
도요타,RAV 4,광고끝까지 봅시당,9
도요타,RAV 4,쏘렌토 대비는 좋다고 하기는 어렵네요^^. 나름 그동안 지나가는차 보면 궁금했은데 ...리뷰 보니 좀 실망!  이가격이면 쏘렌토!!! 확실하네요!  다만 투싼 대비는 ???,1
도요타,RAV 4,라브4 리뷰 보고 나니 투싼이 더 좋아보이네요현대야!난 너네들이 국내 소비자들을 더 생각해주는 모습만 보여준다면 얼마든지 좋게 생각해줄 수 있다근데 요즘에 다시 품질 문제로 시끄럽더라?그러니 너네를 싫어할 수 밖에 없단다 =_=,10
도요타,RAV 4,현기차 사는니 이차 사고싶다..... ㅋ  국민을 우롱하는 기업보다는.. 밧데리 리튬이온으로 바뀐건가요?,48
도요타,RAV 4,"오토뷰가 유료광고를 받는것도 아니라 마지막 양해~~멘트는 안 하셔도 됩니다! 단지, 차 자체의 성능과 리뷰만 확실하게 해 주시면 감사할 따름 입니다. 도요타 하이브리드 기술은 인정하지만 전륜구동 가로배치엔진은 가솔린직분사 2wd면 최상입니다. 라브4가 후륜구동+전륜 e4wd였으면 어떨까 한번 생각해 보네요? 도요타도 옛날 도요타이고, 기술의 혼다도 옛날 입니다. 현기차가 빨리빨리 정신으로 신차를 봇물처럼 발표하고 기술, 디자인도 일취월장하지만  완성되지않은 기술과 조립으로 자국민에게 테스트베드 역활만 안해주기를 바랍니다. 항상 감사희 영상 시청하고 있습니다. thanks",5
도요타,RAV 4,다른건 다모르겠고..결함 많고 서비스갑질대응 심한 현기 구매하고 스트레스 받느니..잔고장없는 라브가 더 낳을듯.. 지금은 일본차 사지말라고 하지 못하겠음..,26
도요타,RAV 4,자유시장경제국가가 언제부터인가 내돈주고 나한테 가장 잘 맞는 소비재를 사는데  누군가의 눈치를 봐야하고 그걸로 애국심을 평가받는 후진국이 되었다는게 슬프다.,57
도요타,RAV 4,불매운동 차원에서 1년동안 일본차 리뷰를 안 했다니 어이가 없네요 ㅋㅋㅋㅋ,5
도요타,RAV 4,"참... 무슨 자동차 리뷰하는데까지 반일 감정을 신경써야 하나요... 플스5, 모동숲, 질샌더유니클로 가열차게 팔리는거 보세요.. 반일 감정은 정치 선동 그 이상도 그 이하도 아닙니다.",31
도요타,RAV 4,일본불매 충분히 이해는 가는대 걔들은 중국불매는 하나몰라. 한한령이 아직도 존재하고 동북공정으로 우리꺼 다 뺏어가려고 발악하는것들건 불매 안하나?할거면 중국불매도 좀 같이하자. 아 근대 라브는 실내가 별로네 ㅋㅋㅋ,11
도요타,RAV 4,실내 실외 정말 일본감성 ㅋㅋ 제 취향은 아니네요. 그리고 반일충들 비공튀 역겹네요,32
도요타,RAV 4,산은 그냥산이고 물은 그냥 물입니다차는 차로 봐야지 차가 사람아니죠일본은 일본이죠한국은 한국이죠있는 그대로 봅시다,28
도요타,RAV 4,현기가 토요타에 비빌수가있나?토요타 직병렬 하이브리드 시스템 타보면 이질감없고 타보면 기술이 느껴진다~개인적으로 현기는 팔아주면 안된다 자국민 등쳐먹는 현기다~,42
도요타,RAV 4,알람을 보고 어라 했습니다간만의 일본차라 반갑네요댓글은 여전히 일부 반일분들이 불편해 하시는거 같네요우스갯소리(?)로 반일과 불매를 강요하면 비정상이라는 말 많이 들렸는데본인들 마음에 안든다고 비공감누르는것도 반일이나 불매를 강요한다는 의미로 받아들여질 수 있습니다 차는 차로 봐야죠구매하실거 아니잖아요?영상 감사히 보겠습니다,26
도요타,RAV 4,ㅡ..ㅡ 가격이 미쳤네.,1
도요타,RAV 4,자기신념 강요하는것만큼 무식해보이는것도 없습니다. 흉기차탔다가 결함으로 사고나서 반불구되어도 일본불매운동 할건가요? ㅋㅋㅋ 오토뷰 응원합니다. 자동차에 대한 객관적인 멋진 리뷰 앞으로도 잘 부탁합니다.,16
도요타,RAV 4,글로벌시대에 불매자체가 웃기는 일이다. 기술로 승부를 봐야지 불매가 무슨 말이냐ㅋㅋ 난 평생 현기차 탈일없다,6
도요타,RAV 4,"시국이 시국인지라 일본차 사렵니다.지금 시국은 연봉 1,000만원 인상안 거부하는 현대차 노조 시국 입니다.그냥... 도요타 사야겠어요^^",7
도요타,RAV 4,그놈의 시국시국 ㅋㅋㅋㅋㅋ  일본 야동은 오지게 쳐 봐놓고 nono 재팬 ㅋㅋ,7
도요타,RAV 4,항상 믿고 보는 오토뷰~~~ 그런데 점점 일본불매운동이 기운이 죽어가는 거 같아 기분이 좋지만은 않네요..,1
도요타,RAV 4,"rav4가 좋은차긴 하지만 nx랑 가격차가 천만원 내외고 투싼 하브, 쏘렌토 하브때문에 경쟁력이 많이 떨어졌죠.... 2500cc라 세금도 높고국내에 하브suv가 없을땐 살만했지만 지금은 매력이 많이 떨어진게 맞음고급진 하브 suv는 렉서스로 가고 아니라면 투싼, 쏘렌토가 답인듯",8
도요타,RAV 4,도심형 suv라는데 실내외가 너무 투박하죠. 한국시장도 넘 무시했네요. 메뉴 한글화 안하고 저 작은 디스플레이를 그대로 들여오고. 해외에선 렉서스 nx에 있던 하이브리드를 라브4에도 적용해서 관심많았는데..전 모델 디자인이 폭망인지라 좀 더 좋아보일뿐 타 일본차보다 한세대 뒤쳐져보이는군요,3
도요타,RAV 4,독일이나 미국차 리뷰할때도 똥꼬빠는애들 없는데 유독 일본차만 나오면 똥꼬빠는것도 모자라 콩나물까지 챱챱하는 애들이 많음 ㅋ,1
도요타,RAV 4,"현대가 어느정도 미츠비시의 기술이 깔려있는지 들어보신적 있습니까? 일단 현기의 대표엔진 GDI. 원래는 미츠비시의 차세대 주력엔진으로 개발되었습니다. 막대한 개발비용이 들어가서, 성능은 그럭저럭 나왔는데, 내구성 부분에서 많은 문제가 발생합니다. 그리고 이런저런 문제까지 겹치며 미츠비를 경영난까지 몰고 갑니다.그런 엔진을 받아온게 현대. 그리고 지금의 GDI엔진. 일본에서는 GDI엔진 이라하면 미츠비시 GDI를 떠올리며 실패한 엔진이라고 다들 입을 모읍니다. 그리고 그 결함은 한국에서 현재진행형.다음으로 생산 시스템, 미츠비시의 기술을 가져오면서 생산 시스템도 가지고 왔는데, 공장 레이아웃이나 생산관리시스템, 품질관리나 부품관리 시스템을 들고와서 접목시켰습니다. 실제로 미츠비시나 자회사, 협력회사와 일 해보면 현대랑시스템이 많이 닮아있습니다. 이를 기반으로 현대는 글로벌 기업으로 나아가기 시작합니다.이제는 많은 개선을 통해 옛날의 미츠비시와는 관계없다고 하시는분들께 한마디 합니다. 현대의기술의 원천은 미츠비시 입니다. BMW에 AMG에어로파츠를 달아서 성능을끌어올린다 한들 AMG가되지는 않지요. 미츠비시의 GDI엔진으로 자국민에게 속여팔고, 미츠비시의 생산 시스템을 가져와 글로벌시장에 나가는 계기가 되었으니 , 현대가 갈고 닦았다 한들 원천은 미츠비시인겁니다. 그래도 자국기업이라고 지금껏 팔아주고 키워준 국민을우롱하며 결함을 은폐하기까지, 심지어 2차대전 가장 큰 영향력을 끼친 전범기업의 기술을 가져와서는 21세기에 전범국이 했던 짓을 자국민에게 그대로 하고있습니다. 글로벌 시대에, 편협한 국가관와 민족관을 가지고 얼마나 번영 할 수 있을까요?? 단순히 일본이라는 이유로 배척하고 미워해야 한다면, 현대는 아마도 매장 당해야 할 지도 모르겠겠네요.",32
도요타,RAV 4,오랜만의 일본차 반갑습니다. 그분들 또 몰려와서 불편해하시겠네요. 잘보겠습니다.,27
도요타,RAV 4,싫어요 밖힌거 봐라 ㅋㅋㅋ 한국인인게 부끄럽네,23
도요타,RAV 4,독3사 처럼 프리미엄도 아니고 국산보다 정비가 용이 하지도 않고 그냥 별로.,1
도요타,RAV 4,자동차로 애국심 따지는게 얼마나 무식한 짓인지 본인 집에 있는 전자제품들 뜯어보면...그래도 모르겠지ㅋㅋ,12
도요타,RAV 4,쪽뽜리 차,1
도요타,RAV 4,시청하시는 여러분들!!은혜도 모르는 자국민 개호구잡는 유료베타테스터 되느니 아예 일본차사세요,24
도요타,RAV 4,깔려고 리뷰하는게 정설,1
도요타,RAV 4,요즘 일본차들이 전반적으로 그렇지만 도요타 디자이너들이 한국차 디자인보고 당황해서 갈피를 못 잡는 건지.... 평정심을 잃고 스케치북에 뭘 그릴줄  몰라서 마구 선을 긋는 듯 한 느낌...  오히려 디자인 자체가 없었던 스바루가 요즘 디자인 맛을 알아가는 듯 하네요...,3
도요타,RAV 4,도요타 디자인은 뭔 생각으로 저리만들까,14
도요타,RAV 4,와 일본카 리뷰라고 비추 하는 애들도 있네ㅋ니네가 쓰는 전자제품에 일본 기술력 안들어가는거 없어  ㅋㅋ 닌텐도 줄서서 사는새끼들이 선택적 불매하는거보소 ㅋㅋ,41
도요타,RAV 4,아직도 주둥이 애국자들이 많군요. 애국은 스스로 하는거지 강요하는게 아닙니다. 거기다 현 상황은 오히려 중국 물건에 대해 불매해야합니다. 김치고 한복이고 다 중국꺼라고 외치는 상황인데 언론통제 받는듯이 여론은  말이 없습니다.,49
도요타,RAV 4,전세대 뒷자석 에어벤트도 없던놈이 많이 발전했네 4천만원 넘는차가 에어벤트도 없는거 보고 충격,1
도요타,RAV 4,반일 반일 거리는것들 지들이 파쇼짓거리 하는지 알랑가 모르것네요 이쯤되면 무식도 죄임,22
도요타,RAV 4,별다른건 없어보인다. 조립하기 쉬운차-? 까놓고 아무런 노력 안한다고 봐야 하는거 아닌가-? 미국시장의 미국차보다 투박하다.,4
도요타,RAV 4,일본차는 사면 안되는데.. 일본에게 돈쥐어주면 안돼요ㅜ 우리나라에게 경제보복한 나라에 차를 산다는건 아니죠,3
도요타,RAV 4,이 시국 자동차네...,1
도요타,RAV 4,도요타 브릿지스톤 out,1
