car_brand,car_model,comments,likes
기아,니로,"재밌고 유익하면서 가려운데 긁어주시니 속이 시원하네요ㅋㅋ 소형 하이브리드 찾고 있는데, 연말까지 기다렸다가 XM3 하이브리드 나오면 비교해봐야겠어요. 참고로 아직 이슈가 안되었지만, 니로 커뮤니티에선 1.6터보 하이브리드(K8, 쏘렌토, 스포티지, 투싼)에서 발생하는 엔진오일 증가와 같은 현상이 발견되어 하이브리드 엔진결함이 의심된다는 이야기가 나오고 있더라구요. 지금 구매하기엔 창렬한 가격대나 결함의심 때문에 시기적으로 이른거 같습니다.",6
기아,니로,"SUV라 비쌈 + 하이브리드라 비쌈 + 유독 높은 상승률... 4000만원이면 K8 V6 3500cc에 중간옵션정도까지 넘볼 수 있으니;;사실 오토뷰에서 추천한 깡통에 네비,드와,컨비 하는 가격이면 K5 상옵도 된다는게 ㅎㄷㄷ",9
기아,니로,"차량 문닫는소리 등 감수성 소리 너무 좋아요!! 절대 빼지마세요모든차 클락션, 깜박이 소리 등등 알고싶어요ㅎㅎ",27
기아,니로,기태피디님 이제까지 20년 가까이  봐왔던 영상중에 가장 능글 맞아(?)지셨습니다 ㅋㅋㅋ 던지시는 유머도 너무 재밌으시고  편하게 얘기하듯이 리뷰해주셔서  보는 입장에서도 더 자연스럽고 좋습니당 ㅎㅎ 무엇보다 유머러스러하게 진행하시면서도 정보전달을 위한 화면간 전환도 넘 매끄러워서 편집과 대본에 있어서 고심 하신 흔적이 고스란히 느껴지는듯도 해서 가..감격입니다! 기태 피디님 사...사...사딸라!,11
기아,니로,출력과 연비 모두 잡는 브랜드도 많은데… 전기모터의 덕도 있겠지만 출력이 낮으면 기름 덜 먹는 것은 너무나 당연한 얘기가 아닐까 싶기도 합니다..ㅋㅋㅋ리뷰 보니까 니로 정말 비싸긴 하네요. 저돈이면 k8같은 대형차는 물론이고 수입차인 폭스바겐 티록~티구안도 보이니까요..,5
기아,니로,선추천 후감상!! 뾱뾱!!  믿고보는 오토뷰. 드디어 왔군요 니로~요즘엔 짧게라도 주긴 하나보내요.  하이브리드니 연비는 당연한듯 느껴지는데..핸들링 감각이 떨어진다니 좀 아쉽내요. 디젤차 하나 보내고 갈아탈까 싶었는데 좀 생각해 봐야겠습니다. 게다가 가격도 ..뾱뾱! 조는.. 음..이번생에 현기차는 안되겠내요.ㅜ..ㅋ뾱뾱 / 삑삑~,12
기아,니로,역시 김피디님 가격으로 아주 대차게 돌려 까주시는군요. 정말 속이 다 시원합니다. ㅋㅋㅋㅋㅋ 니로가 4천이래 ㅋㅋㅋㅋㅋㅋㅋ,9
기아,니로,역시 기대를 져버리지 않는 오토뷰.. 팩폭 지렸고.. 차 리뷰영상은 무조껀 오토뷰만봄,1
기아,니로,"요약: 1. 차의 발전 방향은 나쁘지 않다 2. 연비 훌륭하다 3. 디자인 준수하다 4. 그럼에도 불구하고 가격은 선넘었다. 이 돈이면 차 크기를 떠나 출력,내장재 고급감, 자잘한 마감 등에 더 신경을 썼어야 한다.",17
기아,니로,"원자재 등의 물가상승을 감안해도, 차 자체의 가격이 비싸다고 느끼는건 오토뷰도 마찬가지군요. 니로가 가성비와 경제성이 메리트였는데, 차가격으로 인해 더는 메리트가 없게된..",9
기아,니로,역시 최고의 자동차 미디어!,1
기아,니로,기아가 디자인과 기술을 다 잘 잡는듯 합니다.,1
기아,니로,"예전에 오토뷰 리뷰 보고 초기형 니로 선택했었습니다. 프레스티지(중간트림)에 네비 + 드라이브 와이즈 + 컴포트에다 친환경차 지원금 -100, 노후경유차 조기폐차 할인 -140, 카드사 페이백 -40해서 취등록세 30만원 내고 총 지출 2500만원에 구입해서 정말 가성비 좋게 구매했었는데 이젠 스타트가가 2800이네요 ㅋㅋㅋ다른 메이커까지 비교할것도 없이 이 돈이면 스포티지 하이브리드를 사는게 훨씬 나을것 같습니다. 스포티지는 230마력의 1.6t에다 차체도 훨씬 크니까요",17
기아,니로,섹션을 나누지 않고 기태형님이 전부 리뷰하니까 훨씬 좋네요!!!,6
기아,니로,"비싸도 너무 잘 팔리니까 가격이 떨어질 수가 없지요.. 차를 만들지를 못하니 공급이 수요를 못 따라가고..차량용 반도체 문제가 해결되지 않는 이상 계속 차 값은 올라갈 것 같은데..테슬라처럼 대부분 자동차 회사들이 통합 ECU를 적용하는 5년 후에나 해결 가능하지 않을까 싶습니다",2
기아,니로,귀에 쏙쏙 들어 오는 리뷰 너무 좋습니다. 뾱뾱 ... 넘 비싸네요... 뾱 ㅜㅜ,5
기아,니로,정말 현대기아가 돌았다 라고밖에..성태님 작정하고 얘기하는거 너무 좋네요,4
기아,니로,S클래스가 부럽지 않타니고민해 봐야겠네요ㅋ다른차종 하브를 고민해봐야 하겠네요~~,3
기아,니로,"요즘 시간이 나서 다음 차로 뭘 살까 고민 하다가 디 올 뉴 니로로 마음이 기울었는데, 때마침 아주 반가운 리뷰네요근데, '뾱뾱'은 뭐죠? 매우 강렬합니다ㅋㅋㅋ",30
기아,니로,메인 제목은 니로가 엥?진짜?이지만분석은 현실적인...확실하네요ㅋㅋㅋ,5
기아,니로,니로 가격 보니까... 카니발 하이브리드 생각하고 있었는데.... 가격이 진짜 높아지겠네요. 카니발 하브 마음 접고 지금이라도 디젤차로 계약해야겠네요.,1
기아,니로,기태형님 돌려가며 고급지게 잘 까십니다요 ㅋㅋㅋ,1
기아,니로,돌려까기의 존예 ㄷㄷㄷ,6
기아,니로,어지간하면 리뷰할때 거의 안까시는데 시원하게 한바탕 하셨네요 ㅎㅎ 스포티지 하브가 너무 혜자다,8
기아,니로,짧게 시승 및 가격 상승 돌려까기 ㅋㅋㅋㅋㅋㅋㅋㅋㅋㅋ 항상 잘보고 있습니다,2
기아,니로,썸네일만 보고 진짜 칭찬하는줄 알았네,5
기아,니로,ㅋㅋㅋ 개그리뷰 잘 봤습니다. 진짜 너무 많이 오르긴했네요.ㅜ,1
기아,니로,가격 오른만큼 좋아진건 맞는데… 가격이 너무 오른게 문제네요.,1
기아,니로,신형 니로도 그랜저 르블랑처럼합리적인 가격의 등급이 나와주길.. 기대해봅니다(...),20
기아,니로,관심있는 차 니로 리뷰 잘봤습니다. 기아에대한 저격 멘트도 아주 좋았고요.^^ 위트있는 리뷰 최고입니다!!!!,4
기아,니로,니로 오너인데 고급차 부러워요,1
기아,니로,가장 신뢰하는 자동차리뷰 채널 오토뷰!!잘보고갑니다,1
기아,니로,동급대비 높은가격 짧은 대여기간... 이번에 맘먹고 까시는듯한 느낌입니다 ㅎㅎㅎㅎㅎㅎ 영상 잘봣어요!!,5
기아,니로,9:45 진짜 기태형님 요즘 개그감 있게 잘 까시네요 ㅎㅎㅎ,1
기아,니로,자막기능 너무 좋습니다.,1
기아,니로,이제 반쯤 (구)탑기어UK 스타일을 따라가시는군요 ㅋㅋㅋㅋㅋ 예전에도 그랬었지만 그래도 협찬받은 차에 대해 포장은 해주시는 성향이 있었는데 이젠 포장 갖다 버리셨네요 ㅋㅋㅋ 소비자 입장에서 이보다 좋은 리뷰는 없죠 ㅋㅋㅋㅋㅋㅋㅋ,24
기아,니로,더뉴니로깡통 타고다니는 제가 승자로 느껴지네요 잘보고 갑니다,2
기아,니로,김피디님 최고입니다!!,4
기아,니로,현시점에서는 아반떼 하이브리드가 가장 가성비 좋은듯,4
기아,니로,모든 리뷰가 연비 이야기 할때. 눈치 안보고 가격 말하는 리뷰. 추천,3
기아,니로,이제 조만간 독3사가 가성비로 선택될 것 같네요 요즘 너무 비싸요,3
기아,니로,"미국, 아시아 시장이 상대적으로 운동 성능 보다는 승차감과 안락함을 더 중시하죠.옳다 그르다 말할수는 없는 부분",5
기아,니로,"ㅋㅋㅋ 현대가 기름이 아까운가봐요. 고유가 시대를 맞이했는데 때마침 직장도 집에서 먼 곳으로 옮기게 되어 저도 원래 타던 3,500cc 가솔린 6기통 세단은 매형에게 넘기고 니로 하이브리드 거의 풀옵션 주문해 놨어요(재산이 조단위가 아니라 그냥 흑우 ㅠ.ㅠ)  차 나오는데 11개월 걸린다해서 그동안 타려고 2018년 중고 하이브리드 어제 구매했습니다. 연비 24km을 보니 흐뭇합니다만 그 외의 승차감이나 핸들링 모든 기능은 그냥저냥 그런 차네요. 대형 세단 타다가 니로타니 역체감이 엄청납니다.(허리 부러질 것 같습니다) 니로 하이브리드 취소하고 전기차로 바로 넘어가야겠네요. 항상 좋은 리뷰 감사합니다.",5
기아,니로,선생님 오늘따라 딜교환 장난없으시네요ㅋㅋㅋ 저 3400에 계약중인데 너무 찔립니다,4
기아,니로,"3세대 플랫폼 기반으로 바뀌었기 때문에 차체가 좋아지긴 했나보군요.하지만, 참을 수 없는 가벼움의 핸들링은 여전해보입니다. ㅎㅎ수입차까지는 아니더라도, 쉐보레와 르노의 차를 주행해보면 현기차 핸들링이 얼마나 가볍고 불안한지 바로 알 수 있죠.현기차 가격은 이제 수입차와 별 차이가 없어지네요. 쩝...",4
기아,니로,고유가 시대에 연비 좋으면 장땡이지만..거 .. 가격이 선을 많이 넘은듯디자인은 이쁘고 .. 얼굴값 하겠다는건가? ㅋㅋ,3
기아,니로,5:50 핸들링등 세밀하게 느끼는 국내 소비자가 거의 없다는거에 정말 동의합니다. 현재 쉐보레 올뉴말리부 2.0 타고있는데 소나타 렌트 일주일 몰고 핸들링 정말 체감이 확 됐거든요! 전 운전재미를 추구하고 있어서 내년 BMW M340i 페리 기다리고 있습니다.,12
기아,니로,"현기는 기술이 없어 죄다 1.6 하이브리드, 현재 엔진오일 늘어나서 이슈죠...",9
기아,니로,기태형 요즘 개그가 산으로가넼ㅋㅋㅋㅋ 이런거 죠흐디죠흐디,6
기아,니로,ㅋㅋㅋㅋ 가격을 왜이렇게 올려놓은건지..ㅎ 참신한 디스 좋습니다. 뾱뾱~,3
기아,니로,뾱뾱 따봉ㅋㅋㅋㅋㅋㅋㅋㅋㅋㅋㅋㅋㅋㅋㅋㅋㅋㅋㅋㅋ어떡하냐곸ㅋㅋㅋㅋㅋㅋㅋㅋ막내피디가 시킨거같은뎈ㅋㅋㅋㅋㅋㅋㅋㅋㅋㅋㅋㅋㅋ 형님 보기좋습니다!,5
기아,니로,믿고보는 기태형님,2
기아,니로,가격이… 선넘었네요 ㅋㅋ그랜저 르블랑보다 비싼 풀옵 ㄷㄷ,1
기아,니로,니로4000.. 선택폭이 매우 넓어짐,1
기아,니로,풀옵으로 가는 사람들이 있다면 로또 터졌다고 여기면 되겠네요.,3
기아,니로,가격은 중형차급이 되어버렸네..,15
기아,니로,와 극딜 ㅋㅋㅋㅋㅋㅋㅋ 저도 첨엔 니로 보다가 옵션 몇개 넣지도 않았는데 3천이 쉽게 넘길래 으잉? 하고 결국 스포티지 하브 프레스티지+드와+네비 로 계약했어요. 3300 이네요 ㅋㅋ,3
기아,니로,현대는 우크라이나 사태 일어 날줄 알고  하이브리드를 비싸게 내놓은 거구나,19
기아,니로,시작부터 맘 먹으셨....... ㄷㄷㄷㄷ,3
기아,니로,투싼 하이브리드 리뷰도 궁금합니다. 부탁드립니다.,2
기아,니로,니로 가격이면 qm6 LPG 모델로 구매할 수 있지 않을까요?,1
기아,니로,현대 아반떼 cn7 하브하고 중간에 비교해주는 것도 좋을듯하네요,1
기아,니로,현대가 가격을 올려줘서 덕분에 수입차에 눈을 돌리는 계기가 되었다고맙다,2
기아,니로,영상 제목 보고 오해하지 마세요. 80%는 까이는 중입니다..ㅋㅋ 역시 기태님이야!!,1
기아,니로,불과 몇 달 전에 6만원대에 넣었던 기름이 지금 10만원대...ㅠㅠ 후덜덜고유가와 전쟁의 종식을 기원합니다 ㅠㅠ,1
기아,니로,"니로 사려고 했는데, s클래스와 동급이래서 포기함..ㅋㅋ제조사 눈치보느라 할말 못하는 리뷰어가 즐비한 세상에서..",2
기아,니로,요즘 길에서 간간히 보이는 니로운전자를 볼때 왠지 돈 많으신 분인가 생각이 드는데  그 느낌 잘 표현해 주셨어요. 왠지 진짜 부자들 같다니까요. 소렌토같은거 타면 서민들같고 니로는 부티가 좔좔,5
기아,니로,이번 영상은 오디오가 비는 시간이 거의 없네요 삑삑~ㅋㅋㅋ가격때문에 화가 많이 나신것 같아요ㅋㅋ,1
기아,니로,역시! 그나마 바른말씀 해주시네요. 현기차의 근자감. 가격 쳐 올리기. 뭐 잘사주니까,3
기아,니로,"ㄹㅇ 스포티지 하이브리드 깡통에다가 스마트센스, 네비만 추가하면 3400입니다,, 가성비 ㅆㅅㅌㅊ",16
기아,니로,스포티지 다음 모델은 얼마나 비싸질지 두렵네요,1
기아,니로,뾱뾱이 추가 옵션장착된 영상 잘 봣습니다~~ㅎ ㅎ,1
기아,니로,아반떼 하이브리도도 리뷰 부탁요♡♡,1
기아,니로,현 니로 시그니처 오너로써 한달 좀 넘게 탓는데 매우 만족합니다,1
기아,니로,역시 신사적으로 잘 까십니다 good!,5
기아,니로,오토뷰가 칭찬하면 이건 진짜 좋다는건데 ㄷㄷ// 감상후 : ㅋㅋㅋㅋㅋㅋㅋㅋㅋ,47
기아,니로,요새 소비자들은 굳이 말로 전달 안 하죠...전달할만한 창구도 부족할뿐더러 지금 젊은세대는 대놓고 말하는걸 껄끄러워 하는 분위기니깐요 다만 항상 그랬듯 소비자는 소비로 자신의 의견을 보여줍니다. 그의 아주 대표적인예가 dn8 소나타와 싼타페 페이스리프트 겠죠...소비자가 말 한마디 안 하더라도 확실하게 의사 전달을 하니 기업은 알아서 눈치를 보더라구요,1
기아,니로,아이의 키가 2M를 넘지않는 경우가 상당하죠 ㅎㅎ,2
기아,니로,모든 장점은 엄청난 가격에 다 녹아버림요 ㅠㅠ 특히 연비는 연료비를 일시불로  미리 주고 휘발유값 아끼는 상황 ㅠ,34
기아,니로,와... 옵션을 넣으면 4천이라니;;;; ㅠㅠ,3
기아,니로,깡통 아니면 강성비가 너무 떨이지는차 같은데요 가격으로 엄청 까버리기 ㅋ니로 풀옵이면 k8하브가 맞네요 급차이가,2
기아,니로,편집장님의 블랙 코미디의 재미가 날이 갈 수록 배가 되는 것 같습니다. ㅋㅋㅋ,5
기아,니로,1.6 하이브리드지금 엔진오일 증가로 난리도 아니던데요,1
기아,니로,니로를 4천주고 산다는게 ㅋㅋ 니로는 2천만원이 딱 적당한 차입니다.,6
기아,니로,현기가 방향을 잘 잡았네요.. 어설프게 유럽차 따라하는거 보다는 자기만의 색깔을 갖는게 중요하죠.. 일반인 기준에서는 정확한 핸들링 보다는 승차감이 중요하죠.. 고속안정성만 보장된다면요..,9
기아,니로,김PD님  작두 타신듯...ㅋㅋㅋㅋ완전 익살꾸러기임,2
기아,니로,"그린카에 풀려서 1주일가량 1500KM탔는데 (트렌디+네비+컨비니언스옵으로 2791만원 추정)출력이 낮아서 엔진개입이 너무잦고6dct미션이랑 모터랑 세박자 따로노는느낌입니다. 개인적으로 초기형 건식7단보다 최악이었음시내대비 고속연비가 극악으로 안나옵니다.그리고 80KM이상주행시 엄청난롤과 함께 전혀 방음이 안되는 노면+풍절음이 들리면서 고속주행시 머리깨져서휴게소 + 졸음쉼터 보일때마다 쉬어가게 만드는 엄청난 차량임3천이상은 추천안드리고 , 스포티지 넘어가셔요",13
기아,니로,고유가 시대에 더욱이 각광받는 니로 하이브리드 네요.,2
기아,니로,뾱뾱. 난 늬로지! 기자님 특유의 sarcastic humour 에 또 웃고 갑니다. 좋은 영상 감사드려요~,1
기아,니로,세단이지만 아반떼 하브랑 쏘나타 하브가 더 합리적인 거 같습니다.,3
기아,니로,기자님 진짜 웃기네요ㅋㅋㅋㅋㅋㅋ 기자님 개그 좋네요~ 요즘은 진짜 빠들이 많죠.. 단지 소모품인데.. 휴대폰도 그러는데 차는 오죽할까요,1
기아,니로,연비는 부러운데 디자인이 안 부러워요..,6
기아,니로,어제 실제로 봤는데 원래부터 있던차 같아서 큰 존재감이 없더라고요,2
기아,니로,현기 1.6터보 하이브리드가 대박이났지만..오일증가 이슈가 있습니다. ECU업데이트를 5~6월중 한다는데 이걸로 잡힐까요? 전문가 채널이니 따로 다뤄주셨으면 합니다.,10
기아,니로,이차를 3천넘게주고사느니2천에 아반떼 일반 사서 1000만원 세이브하는게훨씬 이득인듯옵션 적당히 필요한거들어가고2600대가적당한것같네요쓸때없이 너무 비싼것같아요소비자의 현명한 소비가 기업의 방향을 잡아주니소비자의 소비가 중요함 !,3
기아,니로,개그가...!!!! 느셨네요 ㅎㅎㅎ,1
기아,니로,돌려까기 실력이 수준급이시네요ㅋㅋㅋㅋ,3
기아,니로,"10:01 부터 11:00 까지비싸게 많이? 남겨 팔아먹어도 좋다고 사주는 사람이 있으니. 회사도 쉽고 좋고직원들 복지?와 월급도 원하는대로 주고. 성능도 많이? 따라왔고 달리기와는 전혀 상관없는 기타 등등도 많이 넣고. 원자재도 상승. 임금도 꾸준히 상승. 주머니 터는 수 밖에. 보이는 것 보여주면 다 좋다고 말하니. 그 옛날?에도 공부 못하는 애가 외모에만 신경 썼고 외모만 꾸미는 애 대부분이 공부도 못하고. 내세울게 그것 뿐이니. 도구 이외의 용도로 사용하는 사람도 많고차알못이라고 아예 도구를 모르는 사람도 많고요즘은 차나 집이나 필요한 용도 이상의 보여주기 가치관 사고를 가진 사람이 많으니주머니 털기 쉬워진거죠. 차를 한 대만 가진 사람이나 졸부나. 이것은 생물 잡아 벗겨 만들고 피혁 모르는 사람들에게 부르는 값으로 빽 팔아먹는 것보다 더 쉬울 수도 있겠네요. 이것도 공교육 부재 문제.차를 용도별로 사용하거나 여기다가 준소형차, 경차까지 있는 사람은 그렇지 않던데국내 조립사가 어떤 종족 무리가 모여 사는 곳의 조립사가 동남아와 동북아시아에 깔아 놓은 차들과 같이 깔아 놓기를 바라지도 않지만우물 안에 코 묻은 돈 뺏어 먹기는 쉽겠죠. 13:33이정도면 먹힐거라 생각했겠죠. 니로 EV는 그나마 나으니.",1
기아,니로,예전에는 풀옵으로 뽑으면 뭔가 자존감도 조금 올라가고 우쭐 대는 것도 조금은 있었는데. 요즘은 풀옵으로 뽑으면 바보소리듣는거 같아요. 그 돈으로 이걸??? 이런 느낌,6
기아,니로,니로하이브리드 vs 아반떼하이브리드 둘중에 추천하신다면 어떤모델을 추천해주시나요?,1
기아,니로,헐~~~ 4천 미쳤네,1
기아,니로,연기가 되시니까 재밌어요ㅎ,4
기아,니로,1.6터보 하이브리드 엔진오일증가에 녹차오일변색... 심각한 문제들이 발생하고 있습니다. 왠만하면 구매 보류하세요,3
기아,니로,다른 것들은 뭐 그럭저럭한데 6단미션은 진짜 아쉽네요,1
기아,니로,차크기로 가격나누는건 이제 시대가 지났죠. 근데 성능으로 차급을 나눠야하는데 현기놈들 대한민국사람들 조련잘해놨긴햇어 ㅋㅋㅋ,1
기아,니로,니로 de차종 스포츠모드로 타고 다녔었는데 꽤 쓸만했다 하지만 그것도 가성비 기준이지 지금 가격으로는 엿이나 먹으라 해야지,1
기아,니로,쏘렌토 하브 1.6엔진 .. 엔진오일 증가이슈 있던데. 연료가 엔진오일에 섞인다고 하더군요..니로하이브리드는 괜찮을까요?K5하브는 2.0엔진이고 관련이슈는 없는데..니로가 1.6이라.. 혹 쏘렌토에 들어간 엔진과 동일할까요?,2
기아,니로,재산이 조단위여야 니로 풀옵션...,1
기아,니로,승차감을 좋게하다보면 뒷자석 멀미합니다...,1
기아,니로,고유가 시대에 최고 선택은 경차아니면 뚜벅이,1
기아,니로,일주일 뒤에  계약 할려고ㅠ하는대스포티지하브 랑 니로하브 16인치 하면승차감 많이 차이나나요??,1
기아,니로,오늘 최고입니다!!!,1
기아,니로,공감합니다 ~^^,2
기아,니로,"요새는 차종에 상관 없이, 아묻따 풀옵션 지르는 사람이 정말 많더군요. 차 좀 알면 풀옵 안살텐데. 니로 하이브리드를 살 바에야 휠베이스 12센티 더 긴 메기나타 하이브리드를 사는게 현명 할 듯 합니다. 오늘도 잘 보고 갑니다.",3
기아,니로,휘발유 냄새만 맡아도 주행이 된다는 무시무시한 연비머신,2
기아,니로,연비는 잘나왔지만 차값으로 다 까먹은 모델,1
기아,니로,정말 고급진 차량이네요.  수입차가 싸게 보일 정도입니다.연비빼고 칭찬할 구석이 없다니 ~~,17
기아,니로,"이제  니로와  프리우스가격이  크지않군요 프리우스 4세대 처음 출시 할때만해도 3300이라는 게 크긴했는데  이제와 보면  저렴하군요.,",1
기아,니로,"이번에 제주에서 신차급 렌트해서 며칠 몰았는데 일단 창문이 상고방 이중접합(얇지만)으로 내부 정숙성이 매우 좋고 연비는 덤, 매우 만족하며 탔었네요 기본 스피커도 상당히 괜찮았음",1
기아,니로,9:35 재산이 1조단위면 풀옵션을 뽑읔ㅋㅋㅋㅋㅋㅋ,3
기아,니로,대리점에 다른차 계약하러갔다가 니로 시승차 있길래 한번 몰아봤는데힘은 없지만 뭔가 편하더군요. 일단 계약 걸어둠. 근데 너무 비싸긴해요. 뭔놈의 소형suv내지는 준중형왜건 정도가 좀 탈만하려면 3000중반 언저리야..,4
기아,니로,장점 : 연비가 좋아서 고유가 시대에 돈 주머니를 지킬수 있음단점 : 차 값 지불로 이미 털린 돈 주머니를 지켜야함,7
기아,니로,대량생산을 하면 얼마 더 들지도 않을텐데 왜 1.6터보를 안했는가??가속이 많이 아쉽네요,2
기아,니로,장진택의 디리릭디리릭을 이기기 위한 삑삑...하지만 오토뷰는 함께~~~~~~~~~~~~~느껴보시겠습니다.가 있죠.,1
기아,니로,이동수단 자체로는 최고의 선택인듯,1
기아,니로,뾱뾱!! 뭐...뭐지?..하고 다시 돌려봤네요....ㅋㅋㅋㅋ,1
기아,니로,요즘 국산차값이 수입차들이랑 큰차이가 없더라구요영상에서 잠깐 언급됬지만 그랜저 신형은 진짜 풀옵션시 5천은 그냥 넘길거같습니다 ㅋㅋㅋ문제는 소비자들이 그래도 좋다고 사주니까요. 특히 그랜저는 한국 한정 불패신화라...,10
기아,니로,"역시나 비싸다는 이야기군요. 비싸다고 얘기하면 요즘 원자재 단가, 인건비 상승이 어떤지 아냐는 둥 자기 차 감싸기 바쁜 호구 소비자들...순간 공격을 받다 보면 제가 이상해진 건가 하는 생각을 하게 돼요.니로가 4000만 원이라... ㅋㅋㅋ 선택은 자기 몫이지만 제조사~~ 배부르 겄소~~~",30
기아,니로,19:52 ㅋㅋㅋㅋ,1
기아,니로,9:33재산이 조 단위도 아닌데 풀옵션을 구입한다는 것은.. ㅋㅋㅋ 돌려까기 대마왕 ㅋㅋ,2
기아,니로,"광고 끝까지 볼테니,엔진오일증가쫌 다뤄주세요`~~.6터보하이브리드",1
기아,니로,경차 운영중인데..  우와 이정도 연비면 니로 진짜좋다 생각했는데 가격이 모든 생각을 접게 만드네요3500  4000?역시500~1000짜리 중고 경차가 정답이군요,1
기아,니로,니로를 구매하고 싶으시면 동일 가격대 다른 차량을 정말 폭넓게 시승해보시는 걸 저는 추천 드립니다 탈만한 차량이 굉장히 많습니다 더구나 4천이면 무슨 차를 못 살까요,1
기아,니로,"김피디님 니로,더뉴니로 시승기 보고 시승도 못해보고 20년도에 더뉴니로 선룹 빠진 풀옵 제 눈에는 이뻐서 시승기에 나오는 외장,내장 색 동일로 구매했는데 만족하며 잘 타고 있구요현재라면 지금 나오는 니로 풀옵이면 윗급으로 구매할겁니다",1
기아,니로,요즘 인터넷상에서  산타페. 쏘렌토.투싼 하이브리드 차량에서 가솔린 1.6 엔진 오일이 늘어나는 이슈가 있는데 니로도 같은 엔진일까요?,5
기아,니로,나도 스포하브를 사고 싶었어….근데 오래기다리래….ㅠ그래서 중고를 봤는데 무슨 새차보다 더 비싸…,1
