car_brand,car_model,comments,likes
기아,니로,자기만의 차를 보는 눈으로 차를 소개하는데 자신의 소신 및 차를 바라보는 시선이 확실히 느껴져요.우파님 영상은 항상 차보다 내용 전달하는 우파님이 주인공이 되는거 같아서 다른 차 영상보다 보기 좋아욤 항상 좋은 영상 감사합니다.,2
기아,니로,"1~2인만 주로 타는 분들이나, 세컨카를 찾는 분들에게 딱 맞을 것 같아요 ㅋㅋㅋ 근데 우파님이 그냥 니로를 특히 더 좋아하시는 것 같은... 전기차도 빨리 나와서 리뷰 하시는거 보고 싶네요~",26
기아,니로,뒷좌석이 스포티지와 비교했을 때 어느 정도 차이가 나는지 .. 헤드룸과 레그룸이 덩치 있는 두 아들 태우고 타도 괜찮을지 궁금해요.,15
기아,니로,니로는 정말 연비도 좋고 맘 편히 타고 다닐차인데.. 가격은 맘 편하지가 않는 ㅠㅠㅠㅠ,47
기아,니로,니로1세대 차주인데 확실히 도심주행 편안 딱 맞는듯 합니다! 연비죽임.. ㄷ ㄷ 근데 출력면에선 약간 아쉬웠죠 ㅠㅠ,20
기아,니로,니로 작은 차인데 안에 공간은 정말 잘 뽑아낸 좋은 차. 큰 차가 부담인 사람들 한테도 수요가 꽤 있다고 봄.,7
기아,니로,첫차로 1세대 니로 5년째 타고있는데 우파님 말씀대로 초년생이나 부양가족이 아직 없다면 정말 좋아요 ㅎㅎ,24
기아,니로,기아 니로 차 완전좋네요 혼자서 타고가면 니로가 완전편하겠네요,8
기아,니로,요세 보면 기아는 운전자 입장에 맞추는 부서 만든거 같은 차량을 만들고 있다아주 잘하고 있어 !!!,14
기아,니로,"1세대 니로를 4년 넘게 타는 중인데니로 연비 좋죠.. 유지비 적게 들고 좋죠..소형이라기에 실내가 나름 다른 소형보단 넓죠.근데 딱 거기까지!!승차감? 주행감? 개방감? 만족도 없음.시트 각도가 안좋은건지 모르겠으나허리, 목 통증 생겼고 조금만 긴 시간 주행해도힘들어서 못함..개방감도 A필러 샷시? 운전자 쪽은 가림이 은근커서 사각지대가 좀 더 있음.주행감은 당연히 새 차는 잘나가고스포츠모드 놓으면 당연히 다들 잘 나가지근데 이 모든걸 눈 감아줄 건 연비뿐",4
기아,니로,요즘 진짜 기아가 차이쁘게 잘뽑는다,6
기아,니로,니로 사고싶네요 ㅎㅎ 우파 영상은 항상 재밌고 정감이갑니다.,10
기아,니로,니로1세대 타는데 가성비 진짜 좋아요,4
기아,니로,니로1세대 페리 작년초 구매후 아주 잘 타고 있습니다. 진짜 그냥 무난한 차입니다. 연비나 가성비는 뭐 다 아실테구요...,8
기아,니로,이제 차량가격은 어느정도 포기하고 할부 개월을 늘려야겠네요ㅜㅜ 차들이 좋아지는만큼 가격이..,1
기아,니로,신형 니로 소개 영상중에 제일 나은거 같아여 ㅎㅎ 잘 보고 가요 ~ 추천 ~,3
기아,니로,설명이 쉽고 재미나고 편안한 설명 좋아요^^,1
기아,니로,니로 연비 ㅎㄷㄷ,1
기아,니로,연비 진짜 미쳤네… 기변병 오네요 ㅜㅜ,3
기아,니로,와이프에게 사줬더니 너무편하게 운전을할수있다고 너무좋아함   강추,4
기아,니로,"1~2인만 주로 타는 분들이나, 부양가족이 아직 없다면 정말 좋아요 ㅎㅎ",1
기아,니로,원자재값 상승에.. 인건비 상승에 차값을 안올릴수도 없고 서민들은 갈수록 힘들수 밖에.. 니로를 대체할 만한 다른 브랜드 차가 딱히 없는것도 가격을 많이 올린 이유일듯요.,8
기아,니로,엣지팩은 없는게 더 나아보여요 ㅎㅎ,5
기아,니로,개인적으로 C필러 포인트 컬러판넬은 없는게 더 깔끔하고 이쁘네요..b,11
기아,니로,시그니쳐등급에서 썬루프+led실내등 45만원주고 옵션 추가해야 됩니당..ㅎㅎ기본 아닙니다!!,16
기아,니로,극악의 무난함과 뛰어난 연비를 가진 가성비차가 맞는데 이젠 가격이 비싸져서 경제적이라 하기 힘들고 가격대비 승차감 크기 출력이 모두 아쉽게 되어버림.... 디자인만 가격값하는둣,2
기아,니로,저희 동내에 1분도 안 걸리는 정비센터 썬팅 타이어 네비 오디오 등등 있는데 오늘 오후에 저희 아파트 근처에서 니로 하이브리드 차를 벌서 받은 사람이 있다는 것이 신기하더라고요,1
기아,니로,뒤에 디자인은 완전 볼보 같네요 ㅋㅋㅋㅋ,4
기아,니로,같은 하이브리드끼리 비교하면 스포티지랑 가격차이는 그래도 꽤 나지요...;;;,2
기아,니로,엔진과 배터리 성능은 그대로네..,1
기아,니로,스포티지랑 가격이 비슷한데 옵션은 니로가 더 위라니..,3
기아,니로,년식 바뀌면서 스포티지에 헤드업 디스플레이 옵션 들어갈듯ㅎㅎ,2
기아,니로,예전엔 웃자고 아반떼사러갔다가 그랜저 계약하고온다고했는데 지금 가격정책보면 영업사원 안거쳐도 니로사려다가 쏘렌토계약 가능할듯,41
기아,니로,"시그니쳐가  3,300만원이라니개미쳤다3년전에 쏘렌토 3,700만원주고 샀는데",1
기아,니로,니로가 중형으로 나왔으면 딱인데 ㅜㅜ아쉽당 ㅜ,1
기아,니로,시그니처 로 선택하면 선루프랑 LED가 기본인가요 유상옵션이 아니라 조수석 얘기하실때 너무 웃겼어요 ㅋㅋㅋㅋㅋㅋㅋ,1
기아,니로,니로는 가성비로 하이브리드 타는 웨건인데 이건 뭐….,14
기아,니로,"니로 차주로서 많은분들이 잘못 생각하는 부분 짚어봄.1. 스포티지랑 저가격 차이면 스포티지도 잘나왔는데 니로를 왜사냐 거기에 좀만 더 쓰면 쏘렌토까지 간다 - 이번 풀체인지 가격 자체가 그냥 싸다고는 말 못하겠지만 영상에서 말한 스포티지와의 가격차는 내연기관 기준이며 제대로 된 비교를 하려면 스포티지 하이브리드와 비교를 해야됨. 최상위트림 기준 600만원 차이임. 애초에 기아의 suv 라인은 소렌토 스포티지 셀토스로 내려오고 니로는 영상에 나온대로 출시시기에 소형 suv 대란이었기에 끼워맞췄을뿐 소형이라기에도 suv라기에도 애매함.2. 그래봤자 소형아니냐 - 솔직히 큰차는 절대 아니지만 니로를 실제로 운행해보지도 않고 그냥 소형이라고만 생각하는분들 많은듯합니다. 1세대도 패밀리카로 써도 될만큼 2열공간이 나쁘진 않습니다. 자녀가 없는 저는 키181 몸무게 83으로 작은 체구 아닌데 아주 편안한 시트 포지션으로 타도 몸집이크지 않다면 성인이 2열 탑승 무리 없습니다 세단보다는 헤드룸 여유가 있어서 더 그런듯.물론 앞서 말했듯이 큰차는 절대 아니지만 실제로는 생각보다 실내공간이 크다는 얘기.3. 주타겟층 - 이것도 어떻게 보면 1,2번의 연장선상인데 앞서 말했듯이 하이브리드 기준으로 스포티지와 비교하면 풀옵세금껴서 500차이인데 옵션 안꿀리고 실내공간 큰차이는 아니고 연비는 더 좋고 내부 인테리어 싼티도 안나고 주차 편하고 그만큼 운전도 편하고 종합해보면 하이브리드로 비교시 영상에 나온말처럼 이가격에 이런차가 없음 그냥 보면 비싸보이지만 아이러니하게 가성비 차량. 이번 풀체인지 모델이 디자인적으로 개선됐다는 평이 많지만 그래봤자 하차감으로 타는 차는 아님. 사실 사회 초년생은 그냥 값싼 중고나 아니면 가성비를 따질때 승차감보다 하차감을 우선시하는 경우가 많음. 그래서 실제로 니로 오너들 보면 사회초년생보단 30405060 퍼져있고 첫차보단 실용성 목적으로 기변하거나 세컨으로 구입하는 경우도 많은데 오너들 사이에서 만족도가 상당한편",11
기아,니로,"02:27 우파형 리뷰는 항상 잘 보고 있는데 이 부분은 공감이 좀 안 됩니다. 니로보다 스포티지가 승차감도 더 편안하고, 시야도 높아서 운전이 편리합니다. 기아 말고 현대로 가면 투싼같은 경우 풀옵기준 니로풀옵과 72만원 밖에 차이가 안 나요. 아무리 구매층을 고려하더라도 니로는 가격을 정말 잘못 내놨다고 생각합니다. 연비도 니로풀옵은 18.8km/L라서 투싼, 스포티지와 많이 차이나는 정도도 아니고요.11:29 여기에서도 말씀하신 니로 구매층을 고려하지 않고 패밀리카로 생각한다면 투싼/스포티지를 선택하는게 더 좋지 않을까 싶어요.",38
기아,니로,"시그니처에는 전방주차거리경고, 전자식룸미러가 기본장착됩니다.",1
기아,니로,캐스퍼를 시작으로 니로...그리고 새로나올 신차들 전부 가격이 올라갈겁니다. 현재의 스포티지 쏘렌토 그랜저 등은 핵가성비 입니다. 곧 페리할테니까 풀체인지할테니까 기다려야지 하시는분들은 그만큼 비용을 많이 지불하시게 될거예요. 니로가 300~400만원이 올랐는데 그 윗등급이 100~200만원만 오를까요...?,1
기아,니로,옵션은 니로 거주성 가용성등은 스포티지. 이 말은 그가격이면 말이 나올 수 밖에...,1
기아,니로,"큰차 필요 없어서 니로 전기차 타는 중입니다.  응근 속이 넓어서 편해요~ 2~3명 타기에 딱이에요.구형 니로가 문제가... 디자인이 망둥어같은거랑, 시트 설계가 이상해서 허리아픈거..  시트는 살짝 고치고, 디자인은 눈에 보니 익었는데,, 신형은 아우디 R8처럼 뒤에 대어있는게 특징이긴 하네요.",1
기아,니로,최신기술이 들어가니 가격인상은 어쩔수 없죠.3천이고 4천이고 상관없는데 문제는 차를 좀 빨리 받았으면 좋겠습니다.,4
기아,니로,니로 좋은차에 잘나왔는데..이러다 나중엔 돈없어서 외제차산다는 말이 나올거 같네요ㅋ,43
기아,니로,니로 하브 < 스포티지 하브물론 옵션에 자유롭다면요~,1
기아,니로,공홈가면 가격이 130만원가량 전등급다 비싸짐... ㅠㅠ,2
기아,니로,니로 수요층이 있어서 가격 괜찮다는게 말이안됨. 예를들어 만약 소나타가 그랜져랑 200차이나면 당연히 그랜져 사지않나,1
기아,니로,"소형하브를 원하면 300-400만원 더 싼 아반테하브, 니로 3200-3300만원 살바에는  스포티지,투싼 가솔린 1.6T 중옵으로 가는 것이 낫죠.",3
기아,니로,아냐 아냐 우파가 차 리뷰를 너무 자동차회사편만 드는느낌.국산차는 차급을 넘지 못하는 한계가 분명히 있는데 쏘렌토> 스포티지 >니로 이게 대원칙,2
기아,니로,우파님 혹시 골프 8세대와 비교했을때 니로가 나을까요?,1
기아,니로,영상 잘보겠습니다ㅋㅋ,1
기아,니로,니로 1세대 2번째로 출고 받은 사람 입니다 3년타고 정리 했는데 시내주행 많이 하시는분들께는 완전 추천고속도로 타면 솔직히  아반떼랑 연비  비슷 합니다아 전 고속도로는 연비주행 안합니다ㅎㅎ그리고 이차타면서 답답했습니다출력때문에요또 한가지 하이브리드 차여서 중각중간 시동이 켜지고 꺼지는게 무지 불안?했다고 해야하나요? 할튼 시내주행 출퇴근 하시는 분들께는 추천,2
기아,니로,형 포장해도 이미 늦었어 ㅠㅠ 너무 비싸,4
기아,니로,운전석에 릴렉션시트 안 들어가나요??,1
기아,니로,니로 중간 vs 셀토스 중간 사회 초년생 왕복 120km,1
기아,니로,트레버스 500만 인상인데 풀체인지 300만이면 양반이지머..,4
기아,니로,진자 니로 좋지 풀옵이 뭐 어쩌고하는데누가 그렇게 타요 인상돼도 갓성비차는 인정이죠,1
기아,니로,차는 성능이에요.^^,2
기아,니로,2세대2020년식타고있는뎀 사지마세요  진짜 연비만보고 타는차라는걸 느끼실겁니다^~^,1
기아,니로,11:50 여기 부분 잘못 설명하셨네요 시그니처에도 선루프 기본 적용 아닙니다 추가해야돼요!,3
기아,니로,스포티지가 너무 잘나오긴 했음...생태계 파괴자임...,5
기아,니로,니로가 가격만 맞으면 딱인데 너무비싸요 ㅠ,1
기아,니로,살수 있어야 사지 ㅋㅋㅋ 13개월 기다리라는데 ㄷㄷㄷㄷㄷ,2
기아,니로,C필러 쪽에 약간 xc40 생각나네요,3
기아,니로,나도  25 일받아  썬팅ㆍ넘버 달고   오늘부터  타고 다니는데  돈값에  비하면  왜소한  모습이 좀 그렇더라구요,1
기아,니로,썬루프 led 시그니쳐 옵션 추가해야해요....,4
기아,니로,영상 잘봤습니다,1
기아,니로,가격이 전작하고엇비슷해야하는데 왜저리비싸지나 1.6은아니더라도1.4로해서터보라도달아주지 아님 모터출력점오리던가 직병렬식으로해서,1
기아,니로,니로 신차 나오면 무조건 사야지 하고있던 사람인디 차 가격보고 맘 접음....혼자타고 댕기거나 초년생이면 걍 아반떼 하이브리드가 더 좋은거같음.,3
기아,니로,미네랄 블루가 진짜 아름답네요...,2
기아,니로,니로 좋다 니로 사세요~!!! 대박,2
기아,니로,1열  의자 옷걸이 의자 아쉽네요. 혹여나 2열승객 안전벨트하지않거나 움직이다가 급정거나 사고라도 나면 안면이 크게다칠거같네요ㅠ,1
기아,니로,운전 석. 조수석 뒤부분 너무 위험 하겠네요.  뒷좌석 탑승자  사고시 그대로  머리충격으로  사망하겠네요..,2
기아,니로,전기차 충전도 귀찮은 나는 니로가 원픽,1
기아,니로,처음에는 타겟층이 사회 초년생이나 시니어층이라메 근데 왜 영상 중간에는 패밀리카로 이야기 하는지 일관성있게 이야기 하고  그리고 가격 인상에 대한 별명 리뷰 같은 느낌그리고 사회 초년생이 삼천넘은건 무리가 아닌가 그냥 디자인만 예쁘게 만들고 가격  창렬하게 만든느낌이네요,2
기아,니로,편하진않다는거같던데.. 가격오른거대비 승차감별로라고 하던데..,1
기아,니로,스포티지보다 좋은데??HUD 없는차는 절대 못타겠음...스포티지 보닛 유압식 아니구나...,3
기아,니로,18인치 힐만 나오는데 16인치힐을 리뷰 안하나요?,2
기아,니로,옵션에 빌트인캠이 묶여있어서 이건만 따로 빼 주셨으면 좋겠습니다,1
기아,니로,벤츠gle300d 2022년 내부 옵션한번만 컨텐츠 잡아주시면세차용품 더많이 살께요 ㅠ,1
기아,니로,흰섹에 뒤에 빨간 못하는건 너무 아쉽네요... 왜 컬러를 그렇게만 정했는지...,3
기아,니로,이쁘긴한데 소형에 3천대면 좀 비싼편이죠??,1
기아,니로,니로 가성비 정말 좋은 차인데 오우 가격이 이제 만만치가 않네요,2
기아,니로,사회초년생이 타겟층이였으면 가격을 저따구로 하지 말았어야지..😢,9
기아,니로,C필러 엣지팩 없는게 훨씬 낫네,1
기아,니로,가격대가 쏘나타하브 프리미엄플러스랑 겹치는데 과연인가 싶지만 올해판매분은 이미 솔드아웃,1
기아,니로,코나 풀체인지 기다려봐야지...어차피 오를건아는데 조금의 가격희망가지고 기다려야지 .. 니로 가격이 비싸서 하층민인저는 포기했구요,1
기아,니로,흉기 가격 미쳤다,1
기아,니로,장점 뽑을려고 고생하시네요.,2
기아,니로,니로 최고등급 시그니처 3306만원 투싼 하브 최고 등급 인스퍼 3467만원. 161만원 차이남...,1
기아,니로,시승차 빨리 받아서 좋게 이야기하는건 이해하는데 가격적인 부분에서 개같이 까줘야죠.,1
기아,니로,지금이야 비싸다고 생각하지  니로만 오를거같죠 ? 조금만 지나보세요 니로가 가성비 소리 나올듯 ....,1
기아,니로,오늘의 차차 포인트 : 🥲,1
기아,니로,예뻐졌는데 너무 비싸...,1
기아,니로,"배달용으로 깡통에 네비,컨비 넣고 사전계약 2주만에 받앗네요ㅎㅎ  치킨집 하는데 알바생은 치킨 튀기고 제가 직접 배달가는데 기존 쏘나타2.0타다 이거타니까 한달에 40정도 들었는데 12만원 기름값 소모 되네요. 오토바이는 마누라 때매 못사서 경차 살려다가 니로 하브 삿는데 넘나 만족합니다. 차도 작아서 주차하거나 골목길 다니기도 편하고 휠도 16인치라서 승차감 좋고 연비 잘 나옵니다  시내만 타고 막 밟아도 15는 넘기고  국도 주행시 25넘깁니다.ㅎㅎ 돈벌어다주는 차입니다. 애가 셋이라 따로 카니발이 있지만, 장보기, 출퇴근, 배달등  니로로 다 타고다닙니다!",1
기아,니로,저도신형니로타봤어요.,1
기아,니로,유럽에선 평타칠듯,1
기아,니로,이쁘긴하네요,1
기아,니로,하이브리드 혜택이 없어진다는 카더라..,2
기아,니로,가격이 많이올랐네요ㅜ,4
기아,니로,그냥 프레스티지사야겠네 엣지도 필요없고 변속시스템도 돌리는건 별로임,1
기아,니로,니로 구매층은 본인이 모르시는거 같으세요유독 니로에 대해서 관대하시네요,2
기아,니로,첫번째! 다양한 영상 재밌게 보고 있습니다!!,2
기아,니로,"솔직히 이런차에 화려한 옵션이 그닥 필요는 많지는 않을 듯, 가격만 많이 올리는 요인 중 하나.... 걍 실용적있게 옵션 필요한거 조금 넣고 사는게 낳을 듯...",3
기아,니로,시그니처 썬루프 기본 아닙니다. 옵션 입니다.45만원,1
기아,니로,니로 좋네.. 근데 소형이자나.....,2
기아,니로,연비보다 미친 것은 가격 ㅋㅋㅋㅋㅋㅋㅋㅋㅋㅋㅋㅋㅋㅋㅋㅋ 투싼 하브 풀옵이랑 니로 하브 풀옵이랑 100만원도 차이 안남ㅋㅋㅋㅋㅋㅋㅋ,3
기아,니로,내년부터 하이브리드 혜택 없앤다는데 ...,2
기아,니로,기가 막히게 급나누기 해놨네 ㅎㅎㅎㅎ,1
기아,니로,출력이 많이 부족한 니로,1
기아,니로,뭔가 뒷테가 레조 크흠,5
기아,니로,진짜로 이차사라고요?니로 소형아닌가요?저가격에 소형을?,2
기아,니로,Nice .,2
기아,니로,9:00 선 보호하는 주름관 같은거 왜 오른쪽만 없지???원래 없는건가???,1
기아,니로,전면 디자인은 이쁜데 후면은 왜 저따구로 만들었노.. 그리고 최상위 트림 아니면 소세지빵 기어봉 ㅋㅋㅋㅋㅋ,2
기아,니로,전에 본인은 국산차 않탄다고 본것같은데,2
기아,니로,니로랑 스포티지가 가격이 비슷? 왜 스포티지는 가격이 안오를거라 생각 하세요?ㅎㅎ,6
기아,니로,오.....좋네요,1
기아,니로,이돈씨가 절로 나오는 차,1
기아,니로,기름값 아낄려고 나로 사는데 2년치 기름값을 더내고 사는꼴ㅋㅋㅋㅋ,2
기아,니로,디자인도 별로고...가격 또한 미친가격..팔 맘이 없구만,3
기아,니로,근데 진짜 가격 올린건 그렇다쳐도 진짜 국산차 옵션 장난질 개같네 ㅋㅋ,1
기아,니로,다음모닝신차값 2천만원,3
기아,니로,시그니처에 전자식 룸미러 다이얼식 기어 전방 센서 포로 잡아놓고 가격이 3000.. 우파 형 왠만하면 안깠는데 이악물고 실드 치고 있는 모습이 보입니다 허..,5
기아,니로,니로가 4천이여??,11
기아,니로,니로 뒤통수에 대해선 말하는 사람이 없네요. 저는 뒤통수가 좀 치명적이네요(안좋은). 이걸 이쁘게 봐야하나 이런저런 시선으로 보고 또 보는데 영.. 아닌 것 같아서.. 대중들은 니로 뒤통수를 그렇게 이쁘게 보진 않을 것 같죠? 뭐 이쁘게 보는 사람도 일부 있겠지만,1
기아,니로,하루 70km뛰는데 거의 기름값 15만원 듭니다 그냥 공짜입니다 그냥 버스 출퇴근 급입니다,1
기아,니로,사회초년생이 3400짜리 등급차를..??ㅋㅋ,1
기아,니로,좋아 다 좋아 가격 빼고,1
기아,니로,차가 너무작고  문짝도 두께 실화 운전석 조수석  의자 폭 줄여 늘리고  저가격에 저런차를  뒷자석에   안전존이 아이들을 지킬수 있을지,2
기아,니로,사회초년생이 3천짜리 차를 사는데 난 왜 못살까....,3
기아,니로,영업사원 1티어 차입니다.,1
기아,니로,하브라고 다 같은하브가아닙니다ㅡㅡ,1
기아,니로,3천만원이면... 쓰읍..,1
기아,니로,가격대가 너무..,2
기아,니로,하브 고속도로통행료 할인돼나요? 안됀다고들어가지고...,2
기아,니로,후면부는?? 대체 누가 저따위로 한거임,1
기아,니로,빨리 중국차 들어와라 그때가서도 원자재니 임금비니 핑계나오면서 가격 올리는지물론 난 중국차 안 살거임 ^^,2
기아,니로,도심에서 ㅋㅋㅋ42까지 나온적 있긴한데 ㅋㅋ 한적한 도로에서,1
기아,니로,이거 저거  다 넣으면 니로타는 의미가 없어요  몇푼  더 보태서  대형차 타고 말지,1
기아,니로,연비 알려달라고 했는데 안알려줬네여,2
기아,니로,저거 휠 쏘울에 있는거 뗘다가 박아놓은거 같이 생김....,1
기아,니로,아이둘 있는 패밀리카로는 별로인가요,1
기아,니로,2 재미있게 보고 있습니다,1
기아,니로,가격이 참...맘에 안든다...,2
기아,니로,1:06 돈받은거아니다 특=돈 받고싶다니로 살려던 타겟층이 가격보고 다 돌아선거 아십니까? 하 참 무슨근거로 이런말을 하는지..예전 현기차 까던 유튜버들 다 죽고 현기 칭송이 주류인건 알겠지만 해도해도 너무하네!,1
기아,니로,"사회초년생, 시니어를 위한 타겟층 니즈를 위해서라도 저가격으로 내놓으면 안됐음ㅋ 기본적으로 우리나라 사람들은 큰차를 좋아하는 경향이 큼 젊운 초년생이 돈이 없어서 큰차를 못사는거지 있는데도 안사는게 아님 특히 요즘 차박이다 뭐다 실용성에서 큰 suv(스포티지,투싼 등)을 선호하는데 그게 소비자 니즈랑 맞음? 시니어층은 어느정도 맞을 수 있겠지만 시니어층도 실용성, 운송수단, 보이는 브랜드가치 등 에서 현행 니로가격에 훨씬 승차감좋은 다른 세단을  찾지 니로를 선호하진 않을 듯뮬론 '아닌데~ 난 2030 초년생인데 운전못해서 작은차 좋은데?' '아닌데~ 나 시니어인데 검증된 파워트레인에 연비좋고 활용성 높은 니로가 좋은데?' 하면 님말이 맞음 니로사세요 반박시 니말이 다맞음",2
기아,니로,수입차나타자 국산이 국산이 아니다.뼈다구도 골다공증인데 가격은똑같으니 말세다 ㅈㅁ,3
기아,니로,못참치!!!,1
기아,니로,패밀리카로는 별로인가요,1
기아,니로,저 가격에 실내 왜캐 개구려,1
기아,니로,같은차를 몇이서 돌려가며 촬영...,1
기아,니로,마스크를 씁시다,3
기아,니로,"어제 뽑았는데 연비 어쩔,.,21  ㅋ",2
기아,니로,엣지팩 누더기같은데...,1
기아,니로,스탑앤고 되여..,2
기아,니로,볼보 에디션,1
기아,니로,엔진에서 탈락 ;,1
기아,니로,어.. 불잘나는 차 니로아냐..,1
기아,니로,흉기를 저돈주고산다? 독삼사는 오히려 할인 천단위로 하는데 독삼사를 사지 ㅋㅋ,2
기아,니로,그래봤자 거기서 거기.....,2
기아,니로,얼굴 성형하고 인물값한다고 많이 올랐네..,2
기아,니로,레조 닮았네,2
기아,니로,이가격대 살차가너모없다,2
기아,니로,"그돈씨하면 끝이없지만, 가격이 너무올랐음",31
기아,니로,ㅎㅎ,2
기아,니로,니로 가격이 너무 올랐음. 이래서 중국 자동차 산업이 빨리 성장해야 함.,3
기아,니로,3000이면 별로 안비싼거 같은데 다 이정도 해요 요즘,2
기아,니로,설명이너무길어요,1
기아,니로,9등이라니...  늦었다,1
기아,니로,ㅇㅅㅇ,1
기아,니로,3000으로 흉기차를 왜삼 그돈이면 폭스바겐 골프 사는데 ㅋㅋㅋㅋㅋㅋㅋㅋㅋ,8
기아,니로,가격을 임펙트있게 집어주셔서 너무 좋네요! 소형에서 4천이라니... 꼭 영상 리뷰가 현대에 반영되길 바랍니다,75
기아,니로,"연비를 위해 성능을 포기했지만,연비를 위해 가격은 포기를 하지 못한 모델👍",6
기아,니로,거 기자님들께 넉넉하게 시간 좀 주세요! 그래야 소비자들이 양질의 리뷰를 보고 시장이 활발해지죠!,33
기아,니로,김피디님 요즘 컨셉 변경을 자주 하시네요 신선하고 좋습니다 👍 피디님 개그도 나날이 느시네여 ㅋㅋㅋ리뷰는 말할 것도 없이 갓토뷰~!!!,43
기아,니로,"여지껏 오토뷰 역사를 통틀어서 가장 ""그돈씨""에 어울리고 적합한 차량이 아닐까 생각이 드네요.",21
기아,니로,코너링 성능도 한번 테스트 해주세요 이전 모델보다 직진성이 좋아져서 생각보다 코너링 성능은 떨어지는 거 같더라고요...,1
기아,니로,"경쟁자가 없는 독점 상황이라 그런 것 같아요티볼리 소형suv1위 할 때, 코나도 없을때그땐 니로 가격 좋았는데 물론 단점도 많았죠방음도 잘 안되구 고전압베터리 커넥터 화재문제도 있었구 인젝터도 문제였구 너무 잦은 방전… 그런 문제점은 완벽히 다 잡구 개선되었을까요?",3
