car_brand,car_model,comments,likes
랜드로버,디스커버리 스포츠,사용자가 위험한 일을 겪지 않게 실수를 줄여주는게 당연하다고 생각해요. 기어봉 대찬성!,3
랜드로버,디스커버리 스포츠,정말 차는 종류도 다양하고 가격도 조금씩 다 다른거 같아요~,2
랜드로버,디스커버리 스포츠,리뷰 정말로 잘 보고 있어요. 좋은 리뷰 감사합니다.,1
랜드로버,디스커버리 스포츠,와 정말 기자님은 말 솜씨의 천재이십니다.초반 차의 크기가 가격을 결정하지 않는다. 김여사가 우리의 가족이 될 수 있다. 그리고 후진 실험까지 와 구성 정말 멋집니다. 좋은차를 설명해주시면서 왜 이런 가격을 형성하는지....그리고 사회적 인식의 변화 필요까지 많이 느끼고 가는 시간입니다. 정말 멋져요~~ 77ㅑ~<-너무 아재인가요? ㅋㅋㅋㅋ : ),2
랜드로버,디스커버리 스포츠,"외관,실내디자인은렌드러버가 최고인듯.잔고장문제로 말들이 많은데현실적으로 그런지 의심이 가는게렌드러버는 점점 더 많이 보임암튼,갖고 싶은 차~~~^-^",15
랜드로버,디스커버리 스포츠,"유튜브에 렉스턴 스포츠 영상에서도 회전수를 띄우는 던데요. 물론 경사가 더 가파르니까, 시동꺼짐은 있었습니다.중립으로 변환되도록 하는 로직을 추가하면 좋을듯 한데, 어떻게 나올지 궁금하네요",1
랜드로버,디스커버리 스포츠,영상을 잘 보고 갑니다.  가격이 나름 착하네요.,1
랜드로버,디스커버리 스포츠,김한용님부터 여러 리뷰 영상을 보니 갠적으로 느낀것니 가격에 오? 하다가 그 가격에 맞다는게 함정,3
랜드로버,디스커버리 스포츠,랜드로버의 매력을 가장 잘 알고 설명 하시는듯,3
랜드로버,디스커버리 스포츠,댓글 보면 브랜드 이미지가 얼마나 중요한지 몇번을 생각하게 합니다...세계적으로 보면 한국이 큰 시장은 아니지만...뭐 한 1~2년 반응보고 생각해봐도 충분할듯 하네요.,65
랜드로버,디스커버리 스포츠,엔진 시동켜질때가 가장 엔진에 무리가 갈때인데 스탑앤고 기능 정말 괜찮은건가요? 너무궁금합니다. ㅎ,2
랜드로버,디스커버리 스포츠,정답이네요..내 부모님과 와이프도 운전하는 입장에서 누가 운전해도 생명과 연결되는 중요한 사항은 안전하게 만들어 놓는게 정말 중요하다고 생각합니다.외국차들은 보이는건 우리나라 차들보다 허접한 경우가 많은데 보이지 않는 안전 부분은 정말 참 잘 만든다는 생각이 드네요아마도 징벌적 처벌 제도와도 관련 있다고 생각되네요,5
랜드로버,디스커버리 스포츠,"왜 랜드로버가 매니아층이 있는지 알수 있는 방송이네요.운전에 능숙한 오프로드 매니아들이 타는  랜드로버는 실수나 착각 그외의 안전 사고가 일어날수 있는 부분까지도  생각해  반영하고 있다는 점...2020년 국산차 제조사들은 사고시  운전자의  운전 미숙만을 탓할께 아니라 차를 안정적으로 꾸준히 팔면서 성장하려면 폭넓은 수요를 끌어안고 가야 하는 판매시장의 요구를 잘 파악하고,  누구라도 지켜준다는 어떤 누구라도 운전 할수 있다는 믿음을 심어주는 마케팅이 중요하다고 생각합니다.",8
랜드로버,디스커버리 스포츠,시승기라서 그런가 영상 퀄이 좋네요~,7
랜드로버,디스커버리 스포츠,P250se 20년식 나오자 마자 할인없이 구매했는데 다행히? 아무 이상없이 만족 중임. 정말 실내공간은 사기급으로 넉넉함.,2
랜드로버,디스커버리 스포츠,현대기아가 대단한듯 페리주기도 짧고 옵션도 좋고 AS도 좋은데 가격도 착하게 보이네요,2
랜드로버,디스커버리 스포츠,무상렌트를 먼저할 필요가 없죠. 산 사람들에게 기간정해서 고장나면 대차해주는 렌트를 해주는 것이 더 당연하죠,4
랜드로버,디스커버리 스포츠,"디스커버리4 타다가 와이프가 면허따서 디스커버리스포츠와 520d로 나눴는데, 5년 동안 아직 센터 들어갈일은 정기점검 밖에 없었고, 네이버동호회에서도 사실 별로 고장 땜에 시달리는 사람 없어요... 내년에 레인지로버를 사기로 했는데, 과연 레인지로버는 어떤지 보고 괜찮게 3년을 보낸다면 랜드로버에 잔고장이 많다는 선입견을 벗을 때가 되었다고 선언해도 될듯...ㅎㅎ 그나저나 스포츠 되게 좋아졌네... 짱나네? ㅋㅋㅋ",3
랜드로버,디스커버리 스포츠,구독자 4만명만 더 늘면 모터그래프 잡는다.ㅋㅋㅋ  자동차 전문기자의 오리지날 넘버원!! 김한용!!!,5
랜드로버,디스커버리 스포츠,"오픈파일럿이라는 애프터마켓용 반자율주행킷이 있다는데, 국내엔 정보가 별로 없어요.한번 다뤄주세요",2
랜드로버,디스커버리 스포츠,역시 김한용 기자입니다 남다른 리뷰~👍,3
랜드로버,디스커버리 스포츠,왜 쓸데없는게 멋있어!   항상 이런식으로 툴툴거리시는거 너무 재밌어요 ㅋㅋ,3
랜드로버,디스커버리 스포츠,오늘 영상으로 랜드로버에 관심이 가네요~,9
랜드로버,디스커버리 스포츠,2년째 타고있지만 잔고장없었네요... as도 예약기간이 있지만 크게 불편하지않아요,4
랜드로버,디스커버리 스포츠,다들 서비스에 불만이 많으신듯하네요. 외형의모습은 예쁜편인데 서비스만 잘이루어진다면 괜찮지않을까 싶습니다,6
랜드로버,디스커버리 스포츠,보통 엔진은 600 RPM이하로 내려가면 꺼진다고 하던데요.,1
랜드로버,디스커버리 스포츠,"모카님 영상을 보면 정말 좋은차구나... 하지만, 일단 세차장 테스트 먼저...",4
랜드로버,디스커버리 스포츠,정말 고급브랜드긴 한가보다... 6000만원....,1
랜드로버,디스커버리 스포츠,7:33 모카에 와룡 봉추가 둘 다 있었구만11:40 트렁크 세팅에서 사용자에 대한 배려가 돋보입니다,8
랜드로버,디스커버리 스포츠,RPM이 0이 되면 시동이 꺼진다는 것이 무엇인지를 사람들이 스틱 수동을 안타봐서 잘 모르는듯. 오토에서 RPM 떨어질 일이 없으니.,1
랜드로버,디스커버리 스포츠,그래도 랜드로버는 최소 RRS는 타는게 맞는듯,2
랜드로버,디스커버리 스포츠,쎄련된 차와 쎄련된 리뷰 병맛편집! ㅋㅋ,3
랜드로버,디스커버리 스포츠,기본형은 계기판도 다르더라구요. ㅜㅜ,1
랜드로버,디스커버리 스포츠,도로에서 보면 항상 느끼는게.. 차가 껑충하고 뭉툭한 느낌이에요...ㅋㅋㅋㅋ,13
랜드로버,디스커버리 스포츠,궁금해서 물어봅니다.내리막 시동꺼짐 현상이 아무 문제 없는데 뭐하로 테스트 하시나요?,1
랜드로버,디스커버리 스포츠,이젠 이 차가 가성비 차로 보여.. GV80덕분에 올해 외제차 판매량 급상승 할 듯.. 특히 SUV..!,7
랜드로버,디스커버리 스포츠,진짜 재규어 랜드로버는 잔고장만 없으면 세계1등도 가능할것같음 내가 원하는것들을 다 가지고 있음 내 드림카도 신형 디펜더.,1
랜드로버,디스커버리 스포츠,요즘에는 수입차가 비싸단 느낌이 안드네요...국산차 가격이 많이 올랐어요 ㅜㅜ,43
랜드로버,디스커버리 스포츠,이번에 편집하시는분은 밈이나 효과음 중독이신듯.....,39
랜드로버,디스커버리 스포츠,2000cc엔진에 4기통 디젤에다가차크기는 준중형이고  옵션은 국산에 비비지도 못하는데gv80이랑같은 가격이거보면  브랜드이미지가 진짜 중요하구나,7
랜드로버,디스커버리 스포츠,작은 차이가 명품을 만든다,2
랜드로버,디스커버리 스포츠,디스스는 가성비 최고라 생각합니다....,1
랜드로버,디스커버리 스포츠,가격이  문제가 아니라 들었습니다.실 오너 후기가 필요합니다,3
랜드로버,디스커버리 스포츠,후진 기어 넣는다고 엔진 알피엠이 줄어들고 엔진이 거꾸로돈다는건 진짜 차량정비학에대해 전혀 모르고 말씀하시는것 아니신가요 웃고갑니다펠리셰이드는 클러치가 붙고 기동하는차량이 아닙니다토크컨버터라는 중간장치의 부하가 생기게 되는것입니다그리고 클러치 수동차량도 마찬가지로 후진후 완전히서지 않고 전진변속한다면 반클러치상태에서는 시동이꺼지지 않습니다 대신 클러치와 미션에 부하가 생기는것이구요 그 부하를 막기위해 중립으로 기어가 빠지고 시동이꺼지는것입니다하지만 중립으로 빠지기만 하면될것을 시동까지 꺼버렸다는것이 문제입니다,1
랜드로버,디스커버리 스포츠,잔고장 진짜 많은지 궁금,2
랜드로버,디스커버리 스포츠,기자님 디스커버리스포츠 vs X3 2.0디젤 어떤게 좋을까요?,1
랜드로버,디스커버리 스포츠,"계속 벨라랑 비교하는데, 벨라는 레인지로버 라인 아닌가? 레인지로버랑 디스커버리는 같은 랜드로버라 하더라도 완전 다른 급의 차 아닌가요?",8
랜드로버,디스커버리 스포츠,차는 서비스받을일이 없어야 좋은차인데.....,1
랜드로버,디스커버리 스포츠,사고싶다..근데 이미 벨라랑 보그 있어서 돈 아까운데ㅠㅠ고민 좀 해봐야겠어요. 괜찮게 나온거같은뎅아 요즘은 랜드로버 차 사본적 없는 사람들이 더 랜드로버 잘 안다던데 ㅋㅋ 랜드로버 타신적 없는 분들에게 조언을 구해야하나ㅠ,11
랜드로버,디스커버리 스포츠,4:24 왜 기자님 지금이 더 젊어보이는거죠? ㅋㅋㅋㅋ,20
랜드로버,디스커버리 스포츠,디스커버리 스포츠 2년타면서 아무일 없었던 전.. 운이 좋은건가요 =ㅅ=;; 주변에 타시는 분들도 그렇고 AS다녀오셔도 별문제 없던데...비난하시는 분들은 혹시 오너분들이나 전 오너분들인가요?  랜드로버가 국내시장 크게 신경이나 쓰겠냐만은 이미지가 이렇게나 중요하구나 싶습니다.,23
랜드로버,디스커버리 스포츠,현대차와 엄청난 차이가 난다.기본적인 마인드만 따져도!,1
랜드로버,디스커버리 스포츠,gv80이랑 비교하시는데... 180마력이랑 270마력이랑은 매우 큰차이일텐데요.........아무리 레인지로버라지만 9천만원 아래는 독3사나 제네시스가 더 나을법하네요.,2
랜드로버,디스커버리 스포츠,"일반적으로, 샤크핀타입 안테나 = LTE/3G/GPS/[FM/AM]안테나,  후방유리 안테나 => FM (diversity)라디오안테나",1
랜드로버,디스커버리 스포츠,디자이너가 엔지니어 줘패도 용서되는 재규어레인지로버!,1
랜드로버,디스커버리 스포츠,근데 차선이탈 방지만 들어갔다는게....좀 랜드로버 차선이탈 어시스트 넣어주라고!!!,1
랜드로버,디스커버리 스포츠,팰리세이드 플래그쉽이라고 하지만 포지셔닝을 생각하면 도심형입니다. 무슨무슨 주행모드 어쩌구 하는것은 소비자들을 현혹하는거죠. 대표적으로 제원에서 견인능력 찾아보기 정말 어렵고 어렵게 알아낸 권장 견인중량이 겨우 750Kg 이라고 하면서 750Kg 이하 견인하더라도 견인하다 문제 생기면 책임소재 불분명 합니다. 레저용으로 사용하기  어렵다는 거죠. 이번 사건은 팰리의 쌩얼을 본거라고 생각합니다.,1
랜드로버,디스커버리 스포츠,dk~아 빨리 국산 픽업트럭이 나왔음 좋겠탕..쌍용차 말고..음 그리구 영국차 ..음..뭐.!^)..워낙에 거시기 해서....므흣,1
랜드로버,디스커버리 스포츠,AS 덕분에... 두대 사야되는... 한대는.. 수리하고 있고 한대는... 임시로타는 차...,1
랜드로버,디스커버리 스포츠,차박 생각하는데 시트 평탄화가 안되나보네여~~,1
랜드로버,디스커버리 스포츠,가솔린 옵션 넣으니까 8500 나오네요 ㅋㅋ,1
랜드로버,디스커버리 스포츠,AS 기술 및 정신 빼고 다 바뀐듯 하네요~,6
랜드로버,디스커버리 스포츠,아 시동이 안꺼진다길레 진짜 차에서 내려도 시동이 안꺼진다는줄 알았네 ㅋㅋㅋㅋ,1
랜드로버,디스커버리 스포츠,차량 유투브에서 레인지로버 디스커버리 라니... 편집자까지.. OTL,2
랜드로버,디스커버리 스포츠,"지금 이차도 RPM보상으로 시동이 안꺼지듯,전지식오토미션 시동이 절대꺼지면 안됨.기어를 중립으로 빼던지.전자로직을 넣으면되지머.",1
랜드로버,디스커버리 스포츠,"18:48 ~ 김한용님 말씀이 맞아요. 내가 김여사고 김여사가 나일 수도 있다~ 라는 생각,,,그리고 운전자 안전에 대한 현기차의 개똥철학~ 하루 빨리 개선되어야 합니다.현기차는 전자식 기어를 적용해 놓고도 사고방지를 위해 많은 걸 할 수 있었으나 아무것도 하지 않았죠.",2
랜드로버,디스커버리 스포츠,RPM 이 0 이되면 시동이 꺼지는게 아니고. RPM 이 0 이라는건 시동이 꺼졌다는게 맞는거 아닌가요.,2
랜드로버,디스커버리 스포츠,어떤차는 수시로 꺼지고 어떤차는 안꺼지고.. 둘이 협력해서 차 하나 뽑으면 되겠구만ㅎ..,1
랜드로버,디스커버리 스포츠,실내공간으로 봤을때 스포티지나 투싼 정도 크기인가요?,2
랜드로버,디스커버리 스포츠,멋있다아 !! 차 말고 기자님이요 ㅋㅋ,2
랜드로버,디스커버리 스포츠,나의 식구가 저렇게 될수 있다 .. 멘트 오졌음,1
랜드로버,디스커버리 스포츠,왜 중요한 기다리던 디펜더는 안나오지 ㅠㅠ,1
랜드로버,디스커버리 스포츠,이번에 서비스센타 추가 한걸로 알고 있고 ..잔고장은 성××  모시기  때문에  이슈화  커졌죠..거진 대부분 잘탑니다 .. 서비스 센타가 부족 했는데 추가 구축대면서 좀 편해 질려나 ..접수 해바야겠다 ㅋ,1
랜드로버,디스커버리 스포츠,기어봉이 없어야  되는데 있네요... 레인제로버스포츠도  기어봉없에야 한다고 생각하는데..  첨단이미지..,3
랜드로버,디스커버리 스포츠,이보크유저입니다 여러얘기들이 많은데 지금6만정도 탔는데 서비스센터를 안들어가봐서 서비스가 어떤지는 모르겠습니다만 판매수가 많이늘어서인지 서비스센터가 새로 계속 생기고있어서 크게 오래걸리진않을듯 오래걸린다 말이많은데 전에타던 그랜져 블루핸즈에서 이것저것 교체주기라해서 교체하라했더니 그뒤로 차가 진동생기고 엉망되고 돈은 돈대로쓰고 블루핸즈에선 원인을 모르겠다고 센터들어가라해서 현대서비스센터(블루핸즈말고 본사센터)에 전화하니 예약이많아서 한달기다리다 들어갔어서 뭐크게다를바없는듯요 힘도좋고 코너돌때 뒷바퀴가 따라오면서 쭉밀어주는 느낌이 참좋습니다 코너가 너무 안정적이라 운전스타일도 많이바꼈네요 저는 개인적으론 추천합니다 성능도 좋고 디자인도 만족해요 주차하고 뒤돌아서 다시한번바라봅니다 이뻐서 ㅎㅎ,21
랜드로버,디스커버리 스포츠,랜드로버가 다니는 종류가 늘었네요수리받으러 가거나 수리받고 나오던  랜드로버가 시승 중인 랜드로버까지 추가네요ㅋㅋ,1
랜드로버,디스커버리 스포츠,4:23 와 하뇽이형 피부탄력봐,2
랜드로버,디스커버리 스포츠,신형 볼트ev 리뷰 부탁드립니다!,1
랜드로버,디스커버리 스포츠,나이스한 설명입니다 ㅎㅎㅎㅎㅎ,1
랜드로버,디스커버리 스포츠,Unfortunately Land Rover Discovery is famous for parked in the repair shops more than in your garage.,1
랜드로버,디스커버리 스포츠,"디커 스포츠 차주 입니다.이건 정말 감성으로 타는거에요.진동, 잔고장, 옵션등등 다시는 랜드로버 안살것 같아요. 뽑기 잘하면 되지 라고 생각 하기에는 늘 조마조마한게 맘 고생 심합니다.",4
랜드로버,디스커버리 스포츠,길거리에 다니는 두 종류의 랜지로바 그 유명한 이야기 다들 아시죠 ㅋㅋㅋㅋㅋ,1
랜드로버,디스커버리 스포츠,시승 맛집 마크 지금 봤네요 ㅋㅋㅋㅋㅋㅋㅋㅋ만둣집 같아욬ㅋㅋㅋㅋㅋㅋㅋㅋㅋㅋ,5
랜드로버,디스커버리 스포츠,"차라리 투아렉, 티구안을 사라고 배웠습니다.",36
랜드로버,디스커버리 스포츠,와이프가 벨라타는데 드라이버사이드에서 바람소리들리고 오디오에서 가끔씩 지지지직하는 소리가남 딜러 서비스에갔는데 고쳤다고 2주뒤에갔더니 손도안되고 세차만했음..참고로 저는 엘에이삼그래거 딴딜러로가서 일주일두고왔는데 거기서하는말은 고칠수없다고함..서비스맨하는말이 우리가 처음에새차를 가지고갈때는 아무문제없었지 않았냐고 개소리를하길래 그냥함심해서 집에옴.랜드로버서비스는 기대한하는게 좋음,4
랜드로버,디스커버리 스포츠,22:36 팰리세이드 사건 소신 발언참고로 한용기자님이 얘기하는거는 편든다고 생각 안합니다.,21
랜드로버,디스커버리 스포츠,11:48 SUV 트렁크의 가장큰 장점.  비오는날 밑에서 담배피기 딱 좋음,1
랜드로버,디스커버리 스포츠,경사로 밀림방지 셋팅을 길게한게 차를 잘 만들었다는 논리는 무엇????,1
랜드로버,디스커버리 스포츠,14:05 여기서 지려버렷다...,6
랜드로버,디스커버리 스포츠,진짜 영국차 심각하다던데요...ㅎㅎ,34
랜드로버,디스커버리 스포츠,중국에서도조차 잔고장때문에 이미지않좋아져서 판매량이 계속 하락하여 재규어랜드로버 매년 적자라고 합니다 ~ 고장률 많은 브랜드인건 확실한듯,1
랜드로버,디스커버리 스포츠,1000만원 이상 디스카운트가 사실 적절한 가격임.,2
랜드로버,디스커버리 스포츠,듀얼 클러치만 안꺼지다고 우기는 사람들도 많은데..,1
랜드로버,디스커버리 스포츠,랜드로버 해외판매가격보면 우리나라에서 개배짱 장사함 ㅋㅋㅋ,12
랜드로버,디스커버리 스포츠,RPM 이 0이 되면 꺼진다 명장님아.인정 좀 하라고!!!!,1
랜드로버,디스커버리 스포츠,ㅎㅎ 트렁크 버튼 키가 작거나 팔이 짧은제스추어 너무 귀여우심,1
랜드로버,디스커버리 스포츠,랜드로버 사고 싶은데 돈이 부족한 경우 말고는 왜 사야되는지 모르겠는 차.. 온로드 애매 오프로드 애매,1
랜드로버,디스커버리 스포츠,디스커버리산거 진짜 후회하고있어요부품없다고 언제 들어올지 모른다고  차 세워둔지 한달되고있어요대차도 안된다고하고 ㅠ 후회막심합니다재규어 랜드로버 디스커버리 절대 사지마세요 분명후회합니다~~~,1
랜드로버,디스커버리 스포츠,랜드로버!! 가족들과 여행을 떠나기 좋은 차죠. 하지만 집까지 다시 돌아오고 싶으시다면 토요타를 사세요.해외채널 랜드로버 리뷰마다 베댓먹는 댓글입니다 재밌어서 그냥 가져와봤어요ㅋㅋ,3
랜드로버,디스커버리 스포츠,"디스커버리스포츠 차외관, 내관 디자인은예쁜데 문제는  주행성능이나 고장또는 불량이 문제지",1
랜드로버,디스커버리 스포츠,6천이면 깡통이고 기본기능도 옵션으로 돈줘야되서 2천은 추가 됩니다,1
랜드로버,디스커버리 스포츠,공도에서 보이는 렌드로버는 고치러 가거나 고치고 오거나 둘중 하나라는 전설이....,1
랜드로버,디스커버리 스포츠,평탄화는 힘들듯,1
랜드로버,디스커버리 스포츠,차한대 가격은 싸지만 3대를 구매해서 타야하는차1대는 타는용 1대는 센터 정비용 1대는 부품 대기용...,5
랜드로버,디스커버리 스포츠,현기도 괜히 첨단으로 간다고  버튼이나 다이얼 쓰지말고 기어봉 박아라~~,2
랜드로버,디스커버리 스포츠,"꼭 두 대를 사야한다고 소문난 그 차.랜드로버 너무 빨아주지 마시길..못고치고 그냥 타야하는,그리고 잦은고장으로 인한 스트레스지수가 높은 차라는건 지표로,소문으로도,실제로도기자님은 알고 있잖아요?그리고 디스커버리 스포츠가 저렴한게아니고 디스커버리,밸라등이 엄청 비싼거잖아요?과연 디스커버리스포츠가 과연 국내 수입차에서 이 가격대를 비교하면 가성비가좋나요?자꾸 거품왕창인 밸라를 가지고 비교하는게어불성설..기자님..자주 즐겨보지만 비판 할건 하는게기자인데..너무 좋은쪽으로만...",3
랜드로버,디스커버리 스포츠,한 세대 전 차량같다... 2020년 출시된 차 같지않네,1
랜드로버,디스커버리 스포츠,드디어  주행중에 시동안꺼지나욤?,1
랜드로버,디스커버리 스포츠,출시일은 언제 쯤 일까요?,1
랜드로버,디스커버리 스포츠,랜드로버를 꼭 타시겠다면 중고차 사세요 그게 합리적이네요.,1
랜드로버,디스커버리 스포츠,고장이 잘 안났으면 좋겠어요,1
랜드로버,디스커버리 스포츠,???: R로 앞으로 가면 시동 꺼지는게 정상이란 말이에요 !!! 빼애애애애액 !!!!,1
랜드로버,디스커버리 스포츠,"노인운전은 최근 심각한 문제로 대두되고 있고간소화됐던 운전면허도 다시 어려워질 정도로 사회적으로 운전자에게 요구되는 인식이 변하고 있어요자동차는 운전자에 따라서 얼마든지 살인도구로 변할 수 있는 '면허'가 필요한 기곕니다인지능력이 떨어지는 고령자와 어처구니 없는 실수를 하는 초보운전자들은 운전을 제한하는게 정상이죠뭔 뜬금없이 가족드립치면서 성인군자인척 배려를 요구합니까ㅋㅋ정신나간 운전자를 제도적으로 걸러낼 생각을 해야지 그럼 지적장애인도 운전시키고, 정신이상자도 운전시키고 사회취약계층이니까 다 배려해줍니까?우리 모두 늙을거고 김여사가 가족일 수 도 있다니 이딴 소리를ㅋㅋㅋ 물론 이번 어처구니 없는 일로 제조사는 당연히 페일세이프티를 조치하겠죠얼마나 병신같은 일이면 지금까지 케이스가 없어서 조치할 생각조차도 못했겠습니까?",1
랜드로버,디스커버리 스포츠,9:42부터 9:56까지는 현장에서 녹음한게 아니라 다른 곳에서 녹음한거 합성하신 건가요,10
랜드로버,디스커버리 스포츠,AS 개선 되었을까요 그것만 괜찮으면 생각있는데 ㅠㅠ,26
랜드로버,디스커버리 스포츠,"네이버나  여기나.....솔직히 , 랜드로버를   다년간 몰아본 분들이  고장이 많다고성토하면  좀 이해가 가지만.......그외 70-90% 는 타보지도, 실제본적도 없는분들이  카더라 댓글 많이 보고 ,   군중심리로   덩달아  까대는게 많은듯.울나라 사람들 그런대 많이 휩쓸리잔아여 ㅎㅎㅎㅎ",15
랜드로버,디스커버리 스포츠,왜 느낌이 없지.. 이런 차 처음이야..,1
랜드로버,디스커버리 스포츠,다 바뀌어도 상해버린 내마음은 안바뀜 다신 안삼.,5
랜드로버,디스커버리 스포츠,ㅋㅋㅋ(굳이 언급은 안하고ㅋㅋ)은근 현기 자동차들 까는거 같네요 ㅋㅋㅋ,1
랜드로버,디스커버리 스포츠,"끈임없는 잔고장, 노답 서비스에차가 4대여야 된다는 그 유명한!!!!!!혈압올라서 쓰러짐 대비 구급차언제 갈지 몰라 항시대기 견인차 ㅋㅋㅋ기한없는 센터수리기간 대타용 차",1
랜드로버,디스커버리 스포츠,맞아요그게현실이죠,2
랜드로버,디스커버리 스포츠,렌드로버는 두대를 구매  해야 한다는......,1
랜드로버,디스커버리 스포츠,자신있으면 저 빌려줘봐요.일년에 8만키로 이상 탑니다.ㅎㅎ,1
랜드로버,디스커버리 스포츠,프로모션은 얼마부터 시작할까요!??? ㅎㅎ,2
