car_brand,car_model,comments,likes
폭스바겐,투아렉,응원합니다!! 댓글을 저리들 빨리....ㅠㅠ잘보고 있습니다,5
폭스바겐,투아렉,헬로폭스바겐은 그냥 자동차랑 인사만 하는 용도로 ㅎㅎ,2
폭스바겐,투아렉,티구안 vs mq4쏘렌토 하이브리드  뭘 사실건가요? 전 쏘렌토가 끌리는데 ㅠㅠ,1
폭스바겐,투아렉,역시 믿고 보는 미디어오토!!,3
폭스바겐,투아렉,기존 티구안 프론트 마스크가 훨씬이쁜데ㅠㅠ,3
폭스바겐,투아렉,폭스바겐이 스포티지보다 싸다고 하는데....폭스바겐은 어디까지나 프리미엄 브랜드가 아니라 대중 브랜드입니다. 근데 스포티지 디젤 풀옵이 4100인데 제일 하위트림이 4000시작이면 같은 비교 대상에 안들어가죠....비슷한 옵션과 트림 넣으면 4700이 넘습니다. 현재 리뷰어들에게 제공되는 시승차가 그 가격대의 트림일거고요.거기에 보험료와 보증 이후 유지비 생각하면 비교도 안됨....폭스바겐 수리비는 한국에서 대중차 브랜드 답지 않게 일반적인 외제차랑 동급입니다....,3
폭스바겐,투아렉,다들 돈없고 가난하니수입차 삽시다~~~!!,3
폭스바겐,투아렉,음성인식 테슬라 잘됩니다 헿,1
폭스바겐,투아렉,여자목소리 듣고싶을때..헬로우 폭스바겐~~♡♡,1
폭스바겐,투아렉,좋아요 누르고 가요 힘내세요!,3
폭스바겐,투아렉,ㅋㅋㅋㅋㅋㅋㅋ매미소리 강렬해,31
폭스바겐,투아렉,옵션 다달린 프레스티지 소개하시면서 3800만원이라고 하시니,8
폭스바겐,투아렉,"투싼,스포티지 같은 차에 들어가는 똑같은 건식 7단 Dct인가요?",3
폭스바겐,투아렉,디젤 짬처리 감사합니다,2
폭스바겐,투아렉,R라인   이쁘든데...앞  차이가 나네요..,1
폭스바겐,투아렉,와우 폭스바겐(티구안) 최고 최고,3
폭스바겐,투아렉,항상 망설여지는 차... ^^잘 보고 갑니다.,7
폭스바겐,투아렉,"김한용 기자님 영상 잘봤습니다만, 티구안의 시승소감 이나 성능에 대해서는 일반인 이나 다름없이 이야기 하시네요.좀더 조사하고 공부해서 시승기 영상을 올려주셨으면 하는 아쉬움이 있습니다...",4
폭스바겐,투아렉,편집장님 표정이 왠지 힘들어보이시는데 화이팅입니다 세상살다보면 별애별사람들 다있습니다,6
폭스바겐,투아렉,"국산차보다 저렴한 독일차라구요? 국산차는 동급대비 저렴하단 의미라면 저는 이해가안되네요. 설명해주실분있나요? 어떻게 계산을했으면 국산차보다 저렴한건지..당장 폭바 홈페이지가서 풀옵견적내도 4600정도에 현금 프로모션3.5프로적용해도 160만원 할인이 던데 국산차 동급이라면 투싼, 스포티지 정도고 국산차 풀옵견적내도 4600이 안되던데요.물론 예전에 비하면 해외차가 저렴해진건 인정하는데 아직까진 국산차가 저렴하네요.국산차가 수입차보다 저렴하다는 말이 성립하려면 국산풀옵vs해외중하옵으로 비교한것일텐데 국산차풀옵가격보다 수입차 중하옵이 저렴하면 이걸 저렴하다고 해야하나요?이런식으로 계산하면 투싼이 싼타페 되는거고 싼타페가 GV70되는거 아니에요?제목 너무자극적이에요. 좋다말았네요ㅜㅜ",2
폭스바겐,투아렉,13:10 DSG 를 DSC라고 자막씀전 전 영상에도 감응형 자막이니 뭐니 이상한 자막 뜨드만 그냥 TTS 자동인식기능 켜놓고 수정하는 방식으로 자막 만드는구만 참 편해서 좋네 틀리든 말든그냥 업로드 해버려도 아무도 뭐라안함ㅋㅋ개꿀직장,2
폭스바겐,투아렉,폭스바겐디젤이 제일 좋은것 같네요,2
폭스바겐,투아렉,화이팅입니다 ㅋㅋ 주제 모르는 사람들은 모든게 다 자기 때문에 잘됀다고 하죠. 직장을 나갈때도 내가 나가면 일이 돼겠어? 하고 나가고 ㅎㅎ 고생하셨네요. 한두달만 지나도 누가 폭망인지 눈에 보득 뻔한데 자기혼자 컸다고 생각하는 사람은 미리 손절 사업에 기본 입니다.,4
폭스바겐,투아렉,추가 폭로가 나오지 않는 이상 뭉개고 가는거 나쁘지 않은 것 같음 어찌됐든 저찌됐든 난 모카 응원함,6
폭스바겐,투아렉,4:10 풀플랫 안되는거 넘 아쉽네요 ㅠ,2
폭스바겐,투아렉,퇴사자들은 좋게 퇴사하는 경우 거의 없습니다. 잘 퇴사하는 경우는 그사람의 인성이 그런것뿐이지 거의 대부분은 로열티같은건 바래서도 안되는거 같아요. 어느 대기업이 좋은 평가를 받나요. 계속 느끼겠지만 머리검은 짐승은 거두는게 아님.,8
폭스바겐,투아렉,테일램프 ㄱㄱㄱ ㄴㄴㄴ 은근 포인트가 귀엽네요ㅋㅋㅋ,6
폭스바겐,투아렉,"폭스타는분들께 미안한 이야기지만,폭스바겐 타는 사람들 이해가 안됨한마디로 돈없는데 외제차 타고 싶은 사람들로 느껴짐폭스 몰아보기전엔 몰랐었죠.근데 폭스바겐 몰아보니, 와 현대차가 완전 고급차구나 생각이 들었음. 정말 실망했지.그럼 폭스바겐 타는 사람들은 살때 시승도 해봤을건데, 결국 독3사 살 형편은 안되고 국산은 타기 싫은 사람들이 주로 사겠구나 생각이 들었음.그냥 주관적인 생각이니 잘 필터링해주시길.내가 폭스바겐에 너무 기대가 컸을수도 있음.",4
폭스바겐,투아렉,폭스바겐이 현대기아한테 밀린건 오래됬죠..,1
폭스바겐,투아렉,신형 티구안은 디젤만있나요?,1
폭스바겐,투아렉,실내가너무좁아보여요 QM6실내크기랑 비교해서 어떨까요 트렁크크기도 궁금해요,2
폭스바겐,투아렉,8세대 gti나 출시해라!!!,2
폭스바겐,투아렉,김한용기자님G90풀체인지출시도리뷰해주세요,3
폭스바겐,투아렉,근데 디젤뿐이죠? 유럽에서는 안팔리고 단종된 디젤 모델을 가격할인해서 왜 우리나라에 뿌릴까요? 생각해 보신적 있으신가요? 네? 김한용님!! 답변 기다리겠습니다.,2
폭스바겐,투아렉,외제차의 가장중요한거는 지금 가격보다 as와 유지비용 아닌가요ㅋ,3
폭스바겐,투아렉,dct만 아니었으면 샀을차 x1이 더 좋았음,1
폭스바겐,투아렉,전 모델 디자인이 더 이쁘네요,2
폭스바겐,투아렉,앗~~~~!!!저도 좋은기운으로 담에는1등 꼭 할께요~~~!!좋은영상 감사합니다,2
폭스바겐,투아렉,좋네요ㅡ사고싶네요  ㅡ국산차 잔고장으로 실정나네요,5
폭스바겐,투아렉,디자인은 전 모델이 더 나은것 같기도 하고....,2
폭스바겐,투아렉,고엽제로 매미를 싸그리 다 박멸시켜야 최소 2년동안은 조용한 여름을 보낼 수 있을 겁니다.,1
폭스바겐,투아렉,환경 오염때문에 독일에서 못파는 찌꺼기 티구안,2
폭스바겐,투아렉,울나라 주차장은 어찌 이런 꼬라지가 된걸까 ㅋㅋㅋ,4
폭스바겐,투아렉,디젤인거죠? 요즘 디젤 새차사긴 좀 곤란할 것 같던데요.,3
폭스바겐,투아렉,싼타페 쏘렌토 고민하다 3인 가족이고 해서 어제 티구안 계약했네요~,1
폭스바겐,투아렉,어떻게 외제차가 더 싼거 같지?아.. 그래서 그랜져타면 성공했다고 하는구나,1
폭스바겐,투아렉,어휴 2021년에 디젤차가 좋냐 ? 좋아 ? 쟤네는 왜 가솔린 안팔고 온리 디젤만 한국에 죽어라 파는걸까 ?? 유럽에서도 안파는 디젤차를 굳이 한국중국에 왜파는걸까 ?,5
폭스바겐,투아렉,이젠 보기싫은외국인 리액션 영상 중간중간 넣지 않아서 좋네요,1
폭스바겐,투아렉,4천만원짜리 차에 실내에서 B필러 차색을 그대로 볼수가있네요....,1
폭스바겐,투아렉,현기차는 일단 좀 맞자~!!!,2
폭스바겐,투아렉,5년전 현실드림카였는데...,1
폭스바겐,투아렉,투싼하고 스포티지의 하이브리드의 메리트가 너무 큰거 같음,4
폭스바겐,투아렉,좌석통풍시트되나요?,2
폭스바겐,투아렉,옵션을 추가하고 가격을 내리지 말던가! 해야지 폭바 국내소비자 약올리는 처사네요,1
폭스바겐,투아렉,아 진짜 폭스바겐은 가솔린좀 들어와줘 난 디젤이 싫어 가솔린 들여왓음 바로 살텐데 ㅠㅠ 아우디 가솔린은 폭바랑 똑같은데 왠지 별로인거 같아,1
폭스바겐,투아렉,요즘 외제차가  더싸  씨.,3
폭스바겐,투아렉,"전 가솔린파라 가솔린이면 한대 사고싶은데 ㅜㅜ미디어데이때 내년에도 티구안 올스페이스는 가솔린 출시계획은 있다고 하던데, 티구안 가솔린 출시 계획은 안들리던데 모카에서 좀 알려주십쇼 꾸벅꾸벅",3
폭스바겐,투아렉,"스포티지,투싼 살빠에 티구안사지....설마 스포티지,투싼 사는 사람도 있나요?....ㄷㄷㄷ 옵션을 떠나 기본기가 다른데..",7
폭스바겐,투아렉,티구안을 보면 왜 QM6가 생각이 나지???,11
폭스바겐,투아렉,뒷좌석 리클라이닝 되나요,1
폭스바겐,투아렉,스포티지 하이브리드 시승기 해주세요구매예정이라..,1
폭스바겐,투아렉,국내 센터페시아 해외꺼랑 왜 다른거죠?,2
폭스바겐,투아렉,야외 소음이 심하면 따로 녹음 부탁드립니다. 집중이 안되요,1
폭스바겐,투아렉,구입하려면 어디로가야하나요?,1
폭스바겐,투아렉,독일에서 디젤 처리 곤란해서.. ㅋㅋㅋ,5
폭스바겐,투아렉,힘이 많이 없어 보이세요... 좀 밝으신 모습이 사라졌달까? 기운차리시고 조만간 밝은 모습 뵀으면 합니다~^^,1
폭스바겐,투아렉,스포티지 디젤보다 좋긴한데 디젤차라서 좀...,1
폭스바겐,투아렉,독일3사 벤.비.아 폭스바겐은..지켜주지 못하겠다,5
폭스바겐,투아렉,"첫째로, 퇴사한 직원 채널의 컨텐츠는 모카에서 파생되었으며 대부분의 조회수 또한 모카채널에서 파생되는 구조로 안해 조회수 수익만 5대5로 배분해준다는 것을 불공정계약이라고 단정지을 수 없을 것으로 판단함.두번째로, 광고 수익까지 5대5 배분 조건 계약을 했다는 증거자료가 대중에게 알려진바가 전혀 없기 때문에 구독자들이 김한용씨를 비판하거나 비난할 요소가 전혀 없다고 판단함.고로, 이번 사건에서 전직원의 증거 제시가 있지 않는한 모카는 법적인 책임을 질 것도 없으며 도의적인 책임을 질 것도 없기에 구독자들은 그냥 평소에 보던대로 모카채널 잘 시청하는 것이 모카채널에도 유익하고 구독자들의 정신건강에도 유익할것이라 생각함.",5
폭스바겐,투아렉,실내디자인도 넘 하고요.2열 좌석...ㅠㅠ 차박이 힘들어요.,3
폭스바겐,투아렉,동급 차량에 비해 뭐가 좋다는 내용은 별로 없고 쌩뜽맞게 디젤차 설명하고가성비 좋다 그냥 차 좋다 폭스바겐이니까 좋다 너무 광고 티남,2
폭스바겐,투아렉,헬로 폭바. 정말 다 좋은데 하나가 기분 망친다는 것의 대표적인 사례,1
폭스바겐,투아렉,3:08에 나오는 백팩 구입처좀 알수있을까요?~~~,1
폭스바겐,투아렉,역시디젤이네요 나는디제차좋아요,1
폭스바겐,투아렉,힘내세요  홧팅 !,1
폭스바겐,투아렉,보증기간 5년 20만km 라 들은거같은데...맞나요,1
폭스바겐,투아렉,외관은 아직도 괜찮은데 내부 디자인은 너무 밋밋하다.. 네비가 아래에 있어서 불편할것 같고,2
폭스바겐,투아렉,해명 영상은 안 올리시나요?기자답게 지금상황을 해명해야할꺼같은데...,6
폭스바겐,투아렉,폭스바겐은 지니와 계약했는지 파사트gt인데 정말 네비 쓰레기입니다 더군다나 음성인식률 이건 있으나 마나...저의 경상도발음때문인가 했는데 다른사람도 거의 안되더군요,4
폭스바겐,투아렉,탑5 자동차 리뷰채널전문가 오토뷰아재 미디어오토잼민이 모트라인교양방송 우파푸른하늘그리고 젠틀채널이었던 모카가 이렇게..,3
폭스바겐,투아렉,독일 현기 이제야 제값으로 내려왔네,1
폭스바겐,투아렉,가격이 싸져도 부품에서 다 빼먹는다.,1
폭스바겐,투아렉,디젤 떨이 판매하는군요.정부 정책만 아님 가성비로 좋겠어요.,5
폭스바겐,투아렉,자동차 유튜버 it 유튜버 특  4k 18대9 영상  묵묵히 고집함모카도 4k 해주세요,3
폭스바겐,투아렉,공조기만 좀 어떻게 해주지 아쉽다 10년전 디자인같네,1
폭스바겐,투아렉,지능형 현기 댓글부대가 좀 잇는 것 같다,4
폭스바겐,투아렉,저게 신형이라고?? 저 정도 사골이면 더 깍아줘야지....  스포티지로 비슷하게 견적 내니까 3100만원 정도 나오네...,2
폭스바겐,투아렉,"흉기차는 노조 때문에 터무니 없이 계속 임금 올려주다가, 유일한 장점이었던 가격 경쟁력까지 사라져 버리고 폭망할 날이 얼마 남지 않았다.",1
폭스바겐,투아렉,생긴게 쉐보레 차같아요,3
폭스바겐,투아렉,진짜 이러면 차 사는거 고민되는데…국산차..,2
폭스바겐,투아렉,차 이쁘네요,2
폭스바겐,투아렉,자동차가 그냥 형편대로 혹은 생긴거보구 혹은 마크보구 사는거지  가만보면 자동차시장이 정치판이랑 비슷한것같음   여기도 싸우는 사람들이 있는걸보면,1
폭스바겐,투아렉,가격이 3800 이라고 하셨는데 해당 차량 프리미어 아니고 프레스티지로 보이는데요...제가 프레스티지 견적 받았을땐 프로모션 받았을 때 4150 가량 되었습니다.제가 모르는 다른 프로모션이 있는걸까요..,4
폭스바겐,투아렉,싸긴싸네.. 산타페보다 싸네이제..,1
폭스바겐,투아렉,싸게  팔때는  다~~이유가  있지 ...기업의  목적이  뭔가요 ?,1
폭스바겐,투아렉,뒷좌석ㅈ의자 각도 조절되나요?,1
폭스바겐,투아렉,폭바 가솔린 제발 ..,2
폭스바겐,투아렉,힘내세요 기자님!,1
폭스바겐,투아렉,국산차 극혐하는 카센타 사장님의 원픽,2
폭스바겐,투아렉,오일필터교환 국산차보다 어렵다라는데 어떼게개선안되나요,1
폭스바겐,투아렉,디자인이 옛날 디자인이네요;;,2
폭스바겐,투아렉,오일교환할때 오일필더 제그하기불편하다고하는데?,1
폭스바겐,투아렉,골프 풀체인지는 언제 나오는지요,1
폭스바겐,투아렉,폭스바겐 2022 계약하고옴,2
폭스바겐,투아렉,"독일차라고 다 명차가 아님.. 벤츠는 1류, bmw와 폭스바겐은 2류, 아우디는 우주최강개쌈마이",1
폭스바겐,투아렉,횬다이 호떡집에 불나겠네~ ㅋㅋㅋㅋㅋㅋㅋ,3
폭스바겐,투아렉,차가 없어요  ㅠㅠ지금 주문하면 내년에 받는다네요.광고하지말고 그 시간에 물량폭탄 투하해주세요,3
폭스바겐,투아렉,옵션 다달렷는데 3800인가요??,1
폭스바겐,투아렉,음성 인식하는거 보면 진짜 티맵 만한게 없음..대체 만들때 어떻게 만드는건지 유럽차고 미국차고 말귀를 못알아 쳐먹으니...,1
폭스바겐,투아렉,이거.. 스포티지랑 고민되는 거 맞죠?,1
폭스바겐,투아렉,모카 방송은 너무 위험함! 보면 좋건 나쁘건 차 바꾸고 싶은 생각들게 만듬! 이혼 가능성 커짐.,4
폭스바겐,투아렉,이번 모카사태 해명좀 해주세요,8
폭스바겐,투아렉,아직도 현대기아에 기본기가 없다고 하는 사람들이 있네.. 현기가 초창기 자동차 회사보단 후발주자긴 하지만 기본기없단 소릴 들을만한 짠밥은 아닌디... 기본기없단 소린 테슬라나 신생 업체에 해야지..적어도 자동차 분야에선...,2
폭스바겐,투아렉,화폐 가치가 상승해서 그런가.?,2
폭스바겐,투아렉,좋타 심플하고,2
폭스바겐,투아렉,아무리 생각해도 디젤차 처리,3
폭스바겐,투아렉,이쁘네요,1
폭스바겐,투아렉,"영어모르면 이방송 이해하기 어렵네요,하도 영어 이름이 많아서.",1
폭스바겐,투아렉,제에바알~ 폭바야 가솔린이나 하이브리드도 좀 보내줘~~~,2
폭스바겐,투아렉,스포티지 보다 500정도 비싼데 500만큼의 가치가있을지 모르겠는차막 풀체인지된 투싼과 스포티지그리고 500만원더 비싼 나온지 4년된 티구안?,9
폭스바겐,투아렉,이시국 이시점에  디젤은 아니올시다~,1
폭스바겐,투아렉,혹시 45살도 막내작가 가능한가요???,2
폭스바겐,투아렉,제가 이거보고 오늘 싼타페 하브 캘리 취소하고 티구안 프레스티지 계약함……,7
폭스바겐,투아렉,3800이면 그냥 스포티지 투싼 사는게낫지; 사이즈도 더작은데,1
폭스바겐,투아렉,"국산차보다 저렴한 독일suv라고? 제목으로 어그로 오지게 끄네, 그런식으로 따지면  그런차는 전세계 어디에도 다있다.",1
폭스바겐,투아렉,토크 40 넘지 않습니다 ㅎㅎ 37.2인가 그럴꺼예요,2
폭스바겐,투아렉,5:57 음악이 튀네요 옛날 CDP 감성인가요 ㅋㅋ,4
폭스바겐,투아렉,갈등하는 스포티지 예약자,44
폭스바겐,투아렉,통풍업자나~~~ 출력도 별로고 3800보다 더싸야 정상이다,1
폭스바겐,투아렉,현기는 아직 독일ㅈ일본차따라갈려면 멀었어,3
폭스바겐,투아렉,4:18아...그립다,5
폭스바겐,투아렉,앞에 인트로 음악 제목이 뭔가요?,1
폭스바겐,투아렉,이번영상은 원고줘서 글로 읽는 느낌없는 리뷰같네요 광고성이라고 봐야하나요,5
폭스바겐,투아렉,정말 맘에 드는데 내연기관 이제 끝물 아닌가요?,2
폭스바겐,투아렉,성시경님 모카로 전업하셨나보네요,3
폭스바겐,투아렉,왜 디젤만 들여오는 걸까요 흠,5
폭스바겐,투아렉,우왕!,2
폭스바겐,투아렉,제타를 늘려서 만든것 같은 ㅋ,2
폭스바겐,투아렉,스포티지 쉴드가ㅜ안된다 ㅋㅋㅋㅋㅋ,3
폭스바겐,투아렉,국산차량 긴장시키기 딱 좋구만,1
폭스바겐,투아렉,전기차사업 본격적으로 하려고 내연차 떨이하는건가? 흠....,2
폭스바겐,투아렉,9:13 k-주차장ㅋㅋㅋㅋㅋㅋ,1
폭스바겐,투아렉,티구안 계약하러가야지,2
폭스바겐,투아렉,스포티지 하브냐 티구안이냐;; 고민 ㅠ,1
폭스바겐,투아렉,고고고 노노노ㅋㅋㅋㅋㅋ,1
폭스바겐,투아렉,독일서민브랜드 운운하는 우물안개구리들은 한국서민브랜드 계속 많이 쭈욱타그라~,1
폭스바겐,투아렉,아 늦었다 ㅠㅠ 영상 잘 시청하겠습니다,4
폭스바겐,투아렉,자연어 인식이 아닌 경우는 정해진 명령어를 불러주면 되는데 굳이 자연어로 말해서 안됩니다 라고 하는건 좀..,1
폭스바겐,투아렉,살인차 보다는 좋지유~~,4
폭스바겐,투아렉,"이번 유료광고 키워드는 ""국산차보다 저렴한 외제차"" 인가보다 ㅋㅋㅋㅋㅋㅋㅋㅋㅋㅋㅋ",4
폭스바겐,투아렉,요즘 싫어요 많아지는군,4
폭스바겐,투아렉,"폭스바겐그룹 준준형SUV들이 뒷좌석 온도조절 가능한 3존에어컨을 제공하면서, 다른 브랜드들도 2열 송풍구에 부가기능을 넣기 시작한 것 같습니다. 푸조시트로엥은 온도조절대신 바람세기 조절이 되고, 현대 투싼 유럽형 숏바디버전에는 폭스바겐처럼 온도조절이 되는 3존에어컨이 적용했네요. 패밀리카 용도로 더 잘맞는 롱바디 모델에 있어야 할 3존에어컨이 유럽형 숏바디에만 적용된게 특이합니다. 아마도 북미-유럽시장 성향의 차이인 것 같습니다. 북미형 제타의 경우 골프보다 공간이 더 큰데도 2열 송풍구가 옵션으로도 선택불가능한 것을 보면 북미시장은 크기와 공간을 중요시하는 것 같고, 유럽시장이 세심한 부분들을 중요시 하는 것 같다는 생각이 듭니다. 다른 예로 전좌석 세이프티 파워윈도우도 유럽차량들은 소형급에도 기본인 경우가 많고 북미/국내의 경우 중형에서도 빠지거나 옵션으로 제공되는 부분이 그런 것 같네요. 모터그래프 시절부터 유익한 정보, 쉽고 편안하게 설명해주셔서 잘 보고 있습니다. 감사합니다.",1
폭스바겐,투아렉,배경음악이 넘커요 소리가 집중이 안되요,1
폭스바겐,투아렉,와..,2
폭스바겐,투아렉,초반에 칭찬일색이다 했더니 유료광고였군요 ㅋ,1
폭스바겐,투아렉,현대 기아 좋은시절 다 갔네.  정신들 차리세요 .사도 되겠어요.,3
폭스바겐,투아렉,배경음악 없는게 좋을것 같아요 ㅠㅠ ㄷ집중이 안되서 보다 껏어요,1
폭스바겐,투아렉,ㅋㅋㅋㅋㅋㅋ고고고가 노노노로 ㅋㅋㅋㅋ노린건가 폭스바겐,3
폭스바겐,투아렉,ㄱㄱㄱ 고고고 ㄴㄴㄴ 노노노 ㅋㅋㅋ 센스 !!,3
폭스바겐,투아렉,흠 디젤...,1
폭스바겐,투아렉,가격대는 싼타페급이랑 비교해야지 왜 자꾸 스포티지랑 비교하지.. 스포티지 3천후반대에 사는사람은 극히 드물텐데.. 그돈이면 싼타페 중옵갈듯,2
폭스바겐,투아렉,디젤 딸딸이차는 이제 아웃,5
폭스바겐,투아렉,디자인이....좀....음....,1
폭스바겐,투아렉,이영상보고.  스포티지. 예약 취소. 티구안.  가즈아!!!,1
폭스바겐,투아렉,48초전은 못참지,1
폭스바겐,투아렉,폭스바겐 디젤차 떨이 하는가요?,3
폭스바겐,투아렉,디젤 . 마지막 떨이인듯,9
폭스바겐,투아렉,최근 신차 리뷰는 넘 심하다 싶다 싶어요... 다시한번 생각해 보시길...,1
폭스바겐,투아렉,뒷차를따라가는 ㅡ>앞차를 뒤에서따라가는,1
폭스바겐,투아렉,이 차량은 가솔린이 없나요??,1
폭스바겐,투아렉,독일 국민차 디젤엔진 살 돈이면 국산 하이브리드 사겠음,15
폭스바겐,투아렉,티록도 그렇고 가솔린 모델을 내놔야지 이런식이면 그냥 디젤 떨이,2
폭스바겐,투아렉,독일차 타면 현기못탐,1
폭스바겐,투아렉,"그래도 난 스포티ㅈ,,,읍읍",1
폭스바겐,투아렉,오 예쁘네요,4
폭스바겐,투아렉,2:09 한국차였어요???,1
폭스바겐,투아렉,파이낸셜 쓰면 할인해 준거 두배 수수료로 떼갑니다. 할인이란 단어 조심하기~~~,4
폭스바겐,투아렉,매미땜에 안들리네요 ㅋㅋㅋ,2
폭스바겐,투아렉,폭스바겐이 엄청 할인해주면서 디젤로만 파는 이유 ㅎㅎ다 아시죠?그거 생각하면 역시 손해 볼 기업은 없다 가 맞네요그래도 수입차가 국내차보다 저렴..현기가 미쳤다는 생각이 먼저 듭니다.국내 배짱으로 얼마나 갈지..수입차 경쟁 이제 시작이네요아 그리고 기자님 차 설명이 필요하시다면 눕방?하셔도 됩니다.저희는 김한용기자님 차 안내 방송 보려 왔지 이쁜 여자보려 온거 아닙니다 ㅎㅎ,6
폭스바겐,투아렉,제네시스 G80 전기차가 태슬라보다 비쌈 말 다했지,2
폭스바겐,투아렉,아  매미..,1
폭스바겐,투아렉,k-주차장 ㅋㅋㅋㅋㅋㅋ,2
폭스바겐,투아렉,독바인가요 맥바인가요,1
폭스바겐,투아렉,차봤서영님 하고는 계약대로 하실건가요?,6
폭스바겐,투아렉,"디젤 떨이고 뭐고간에 수입차를 국산차보다 싸게 그것도 폭바를 싸게 산다는게 메리트지.물론 폭바가 벤츠, 비엠처럼 프리미엄브렌드는 아니지만..이런 수입차의 중간라인에있는 브렌드들이 차를 싸게 내놔야. 프리미엄급도 저가라인이 생기는거고 국산차도가격이 내려간다. 이거 한대로 효과가 있지는 않겠지만 시발점이 됐으면 좋겠구나..",2
폭스바겐,투아렉,K 중소기업 오명 씻어주세요 아직 구독중입니다.한용님 언제나 즐겁게 보고있었는데이번일 제대로 해명해주세요K- 중소기업 오명 벗어주세요,5
폭스바겐,투아렉,유료 광고인 부분이 어디지,1
폭스바겐,투아렉,2분전은 못참치,1
폭스바겐,투아렉,와 이거실화?,2
폭스바겐,투아렉,디젤 제고떨이?,2
폭스바겐,투아렉,아이고 얼굴이 상하셨네  항상 응원합니다,8
폭스바겐,투아렉,한용님 선영님과 이런저런 얘기가 많은데 각자 입장차이라 생각합니다. 두분다 완만한결과를 도출하셨고. 모카에서 박선영님에게 대응했던 모습도 서로에게 더이상피해를주지않기위해 내린조치라 생각합니다. 두분다 좋아했던 구독자 입장에서 서로 좋은 결과 도착하신거에대해.. 모카에서 대응한모습. 선영씨 퇴사영상애서 본모습.. 아무쪼록 잘해결되길 바랍니다. 모카와 박선영님의무궁한 발전을 기원합니다. 모두 화이팅!!,12
폭스바겐,투아렉,울쩍한 음악 쓰지마~~,2
폭스바겐,투아렉,아이고... 표정이....언제 제작 되었는지 모르겠지만그 일 이후 라면 서로 상처가 엄청 큰거로 보입니다결국 시간이 약 일 겁니다,8
폭스바겐,투아렉,subaru forester vs vw tiguan,1
