car_brand,car_model,comments,likes
랜드로버,디스커버리 스포츠,타야하는 사람들 정해드림 = 까남맘에 안듬 = 별로임,1
랜드로버,디스커버리 스포츠,요즘 누가 랜드로버 타겠습니까?? 아무리 그래도 차 수준이 있는데요. 그리고 서비스 수준은 더 압권일텐데요. 우리차 원래 그래요 한번 당하면 다시는 몰탈차 라고 생각 들겁니다. 디펜터 사시더니 너무 랜드로버 좋게 봐주는거 아닌가 하는 생각이 듭니다.?? 차가 협찬이었나요??,1
랜드로버,디스커버리 스포츠,쏘렌토 리뷰 해주시면 안돼요?,3
랜드로버,디스커버리 스포츠,근데 서비스센터가 전화 안받는게 어떻게 생각하세요?,1
랜드로버,디스커버리 스포츠,디스커버리4 핸들이 아니라디스커버리 스포츠 핸들이네요~편집 오류인듯요~,1
랜드로버,디스커버리 스포츠,미국차 영국차 공통점 마일을 쓰다보니 계기판 디자인이 촌스러움 까남님 타셨던 ct6 아날로그 계기판은 트럭 계기판 스타일이죠 계기판 뿐 아니라 내외관 디자인이 미국차와 영국차는 특유의 촌티가 있음 저 신형 랜드로버도 계기판 디자인 별로 안예쁨,1
랜드로버,디스커버리 스포츠,팰리세이드 만세,1
랜드로버,디스커버리 스포츠,넘..비싸잔여..ㅠㅠ,2
랜드로버,디스커버리 스포츠,형 그럼 이엔진이 내년에 디펜더에 달리는거야?,2
랜드로버,디스커버리 스포츠,박까스남 이란줄 ㅋㅋ,3
랜드로버,디스커버리 스포츠,와우,1
랜드로버,디스커버리 스포츠,북미에서 P360 R-Dynamic HSE  타는중입니다. 가솔린 HSE등급은 한국에서 안파는데 이유를 모르겠네요,1
랜드로버,디스커버리 스포츠,"오 생긴건 장비인데, 운행은 선비? 그렇군요ㅎ",1
랜드로버,디스커버리 스포츠,땅을치고 후회하려면 사시라~~,1
랜드로버,디스커버리 스포츠,03:58 자막오타있어요~왼쪽사진 D4가아니고 DS입니다 ^^,4
랜드로버,디스커버리 스포츠,여기서귀포인데 디스커버리 널렸어요,1
랜드로버,디스커버리 스포츠,인생이 너무 쉽다. 난이도를 올려서 좀 더 하드 하게 살고 싶다? 그럼 이차를 선택하십시오.,1
랜드로버,디스커버리 스포츠,"형 언제부터 이거사 라는말기준이 천만원 , 1억이 넘어가네???",1
랜드로버,디스커버리 스포츠,자동차 리뷰는 형편없는 전직 자동차 기자 ㅋㅋㅋㅋ,1
랜드로버,디스커버리 스포츠,이분 박선영 아나운서님 아닙니까!?,1
랜드로버,디스커버리 스포츠,뒤에서 보니 입이 삐뚤어진거같음ㅠㅠ..번호판이 너무 비대칭ㅠㅠ,1
랜드로버,디스커버리 스포츠,1년 3년 차를 타는데 ...음,1
랜드로버,디스커버리 스포츠,나이스!!!,2
랜드로버,디스커버리 스포츠,"레인지로버 살바에야.,  모하비산다",5
랜드로버,디스커버리 스포츠,윤은수 선물 입금완료 계약완료 모든 디스커버리는 내꺼다 30억,1
랜드로버,디스커버리 스포츠,뭔 리뷰가 이렇게 추상적인지 도대체 뭘 말하고싶은건지 모르겠네. 13분동안 결론은 서스펜션 물렁하다가 끝인가?,1
랜드로버,디스커버리 스포츠,고장 as 진짜 노답 두번다시 쳐다도 보기 싫은 브랜드,3
랜드로버,디스커버리 스포츠,디펜더가 승차감? 거릅니다 수고하세요,1
랜드로버,디스커버리 스포츠,x5 승,1
랜드로버,디스커버리 스포츠,국산차 정도의 내구성만 되도...,2
랜드로버,디스커버리 스포츠,양아치리븈ㅋ,1
랜드로버,디스커버리 스포츠,6:03,1
랜드로버,디스커버리 스포츠,와이프분이신가요?,1
랜드로버,디스커버리 스포츠,이분은 이렇게 잘 아시면차를 만드시지 그래요,1
랜드로버,디스커버리 스포츠,뽑기...,1
랜드로버,디스커버리 스포츠,5세대 너무 못생겻슴요,1
랜드로버,디스커버리 스포츠,좁은 공간에 동행자가 있고 말도 많이 하시는데 마스크는 착용해 주심이... 불편하게 보이긴 하네요. 시승기는 잘 봤습니다.,3
랜드로버,디스커버리 스포츠,이양반은 너무 광고주의라 믿음이 안감 ㅋ미니쿠퍼 승차감좋다고 한거보고 이미 끝났다고 생각함 ㅋ,4
랜드로버,디스커버리 스포츠,역시 가장 정확하게 랜드로버를 평가하십니다. 오토뷰 믿고 봅니당,15
랜드로버,디스커버리 스포츠,"‘과장’이 될때까지 재랜코리아가 적극적으로 만족스러운 서비스를 안해줬으니 한국서 이런 모양이 된게 아닌가 싶어서 씁쓸하네요. 현재 레인지로버 이보크 2014 디젤모델을 큰 문제없이 잘 타고 다니고 있지만 차량의 기본기, 상태라던가 전체적인 서비스 품질들 관련하여서는 잘 개선되었으면 좋겠습니다. 차량이야 언제든 문제라는게 발생할수 있지만 as가 잘됐으면 지금의 이미지까지는 안되지 않았을까 싶습니다. 영상 잘 봤습니다",5
랜드로버,디스커버리 스포츠,"17년식 이보크 3년간 운행했었습니다. 뽑기운이 좋았는지 큰 문제없었고, as가 현대 대비(이전 차량이 현대)  부족한 건 확실하지만, 대체로 서비스 받을 수 있는 건 다 받았었습니다. 한번은 점검이 길어질 것 같다며 인근 영화관에서 영화보시라고 티켓도 받은 기억이 있네요. 이후엔 차에 관심 많이 가지게 되면서 현재 차로 넘어갔지만, 제 개인적으로는 많은 분들이 욕하시는 정도로 나쁜 브랜드로 기억되진 않습니다 ㅎㅎ",19
랜드로버,디스커버리 스포츠,영상설명을 아무생각없이 눌렀는데 주요 테스트항목들을 표시해놓으셨네요!궁금한 부분들을 쉽게 찾아볼 수 있게 되어서 더 즐거운 영상시청이 될듯 합니다항상 좋은영상 감사합니다,10
랜드로버,디스커버리 스포츠,와 진짜 기다리던 리뷰...고맙습니다!,6
랜드로버,디스커버리 스포츠,품질이 극악이더라도 디자인이 모든걸 용서해주는 자동차계의 갬성왕,8
랜드로버,디스커버리 스포츠,분명 특유의 매력이 있지만 레인지 로버의 고급스러움을 높은 돈 주고 사는거 말고는 점점 메리트가 없어지는 브랜드 같네요.오늘도 잘 보고 갑니다.,11
랜드로버,디스커버리 스포츠,"P250 se 구매 후 7천키로 주행 중. 뭐 아직까진 아무런 문제없고 대만족 중 패밀리카로. 특히 2열은 정말 넓음. 왼발 풋레스트 공간이 조금 애매하고 그 외 연베이지시트 및 블랙팩하면 외관도 만족함. Glc, x4 시승 후 디스스포츠 구매.",7
랜드로버,디스커버리 스포츠,뒷좌석 리뷰할때 앞좌석은 어떤 기준으로 설정하나요?제가 보기에는 너무 앞으로 당겨둔거 같아 보이네요.,1
랜드로버,디스커버리 스포츠,선입견 없이 차만 보는 오토뷰 좋습니다.,9
랜드로버,디스커버리 스포츠,오토뷰는 항상 옳다~,5
랜드로버,디스커버리 스포츠,랜드로버 특유의 이미지가 제대로 개선이 될지는 지켜봐야 되겠군요.,1
랜드로버,디스커버리 스포츠,20만 고지가 머지않았습니다 탄력받아서 50만 찍어보아요~~기태형님 만수무강 하십시요,4
랜드로버,디스커버리 스포츠,대한민국 유일무이 원탑 카리뷰 오토뷰,8
랜드로버,디스커버리 스포츠,이번 패리는 상품성이 아주 좋아졌어요.....  P250 분명 괜찮은 중형 SUV죠,5
랜드로버,디스커버리 스포츠,손가락으로 높이 안내 고맙습니다 보면서 제 손가락에 자를 대봤답니다 배경 음악도 항상 너무 좋구요 차에 대한 객관적인 장점과 단점을 이야기 해주셔서 참 좋습니다  전문 용어도 알아가서 너무 좋아요 메시지도 감사합니다,5
랜드로버,디스커버리 스포츠,내가 유일하게 구독 해놓은 자동차 시승채널. .,2
랜드로버,디스커버리 스포츠,랜드로버 차는 좋다. 고장만 없다면..,7
랜드로버,디스커버리 스포츠,감사합니다 구매 예정이라서 진짜 오토뷰 리뷰만 기다리고 있어써요 역시👍,10
랜드로버,디스커버리 스포츠,자동차리뷰는 역시 오토뷰,3
랜드로버,디스커버리 스포츠,고장나기 전까진 다 좋은차죠. 고장이 얼마나 많이 나는지가 문제일 뿐.,2
랜드로버,디스커버리 스포츠,이래서 이미지라는게 참 중요한것같네요. 꽤 매력적인것같은데.. 그간 쌓아놓은 명성이 너무 드높다 보니 ㅋㅋㅋ 잘 보겠습니다!pado입니다!!!!,24
랜드로버,디스커버리 스포츠,기자님..? 실내...엄청 많이 달라진 것 같은데요...?ㅋㅋㅋ 램프는 안에 동그란 게 이뻤는데 평범해져서 아쉽네요,3
랜드로버,디스커버리 스포츠,시간안내까지ㄷㄷㄷ😀😀👍👏👏👍👍💯💯💯친절한오토뷰ㅅㅅㅅㅅ,5
랜드로버,디스커버리 스포츠,이미지 회복이 힘들지 않을까...차는참 이쁘고 고급진데ㅜ,17
랜드로버,디스커버리 스포츠,한번 망가진 이미지를 회복하는게 이리 어렵습니다.ㅎㅎ,29
랜드로버,디스커버리 스포츠,고장 안나는거 확실히 보증해야 팔릴듯,1
랜드로버,디스커버리 스포츠,과장이 아닌것도 같은게 캠핑 유투버영상이었는데 계곡에 잠시 발담그고 오니 문안열려서 산에 수리하는 사람 부르더라구요,1
랜드로버,디스커버리 스포츠,- 랜드로버는 기술도 앞서가..고장도 앞서가..서비스도 앞서가..절대 구매하고 싶지않은...특히 한국에서는..북미는 레몬법 적용이 잘되어 교환 잘해준다네요..,7
랜드로버,디스커버리 스포츠,이게 진짜 찐따같던 그 디스커버리가 맞나? 정말 가슴이 웅장해진다..,8
랜드로버,디스커버리 스포츠,터레인리스폰스..랜드로버로서 가치가있죠..근데 정작 상황이오면..작동을안함..젠장,2
랜드로버,디스커버리 스포츠,독일사람이 말하길 영국산은 모자 빼고 다 고장난다고 ㅎ,16
랜드로버,디스커버리 스포츠,품질 as 이슈에도 세계적으로 잘팔리는거보면  그동안 쌓아온 아이덴티티가 확실한가봄. suv만 만드는회사.,1
랜드로버,디스커버리 스포츠,이제 랜드로버는 한대만 사도 되는건가요?(센터 들어가 있는동안 타고 다닐 여분의 랜드로버 필요없이...),16
랜드로버,디스커버리 스포츠,수입차는 본인이 일해서 사는차가 아니다 집값 올라 추가대출이 되야 사는게 20년간의 수입차엿던것이엇다~,8
랜드로버,디스커버리 스포츠,재규어 의문의 1패ㅋㅋㅋㅋ,13
랜드로버,디스커버리 스포츠,과장되긴 했어도 몇십년째 품질평가 하위인건 맞죠,22
랜드로버,디스커버리 스포츠,소문이 과하긴 하지만 심각한건 사실이라....,11
랜드로버,디스커버리 스포츠,그간의 이미지 때문에 구매하기 어려울것 같습니다. 리릭이 가장 기대됩니다.,23
랜드로버,디스커버리 스포츠,타고싶다,1
랜드로버,디스커버리 스포츠,이 차가 그 유명한....죄송합니다. 오너님들..ㅠㅠ그나저나..sports트림이 제로백이 9.8초..브랜드마다  'S'배지 달고 있는 차들은 전부 한방이 있던데...,7
랜드로버,디스커버리 스포츠,한번 나락으로 떨어진 이미지를 회복하려면 그 반대로 극으로 달해야한다. 카와우에 영상떴던 엔진오일대신 콜라넣고 굴리는 수준으로 듬직한 모습을 지금껏 실추된 기간만큼 유지해야한다. 그럴 자신이 없으면 랜드로버 재규어는 지금의 조롱에 대해 할말 없다. 워낙 과거가 화려하니까.,2
랜드로버,디스커버리 스포츠,동영상 설명에 타임스탬프 적어 주시는 김에 동영상에 챕터 설정해 주시면 좋을 것 같습니다.https://support.google.com/youtube/answer/9884579?hl=ko,1
랜드로버,디스커버리 스포츠,랜드로버의 품질 때문에 미국에서는 찬밥이라 합니다.한국 산타페의 품질은 못 쫓아 온다고 합니다.영국차는 뽑기 운이 가장 심하다고 합니다.,1
랜드로버,디스커버리 스포츠,"브랜드 평판 회복이 안될 것 같으니,랜드로버  => '브랜드오버'  로 개명하고 워크아웃 들어가는 걸로,ㅋ",2
랜드로버,디스커버리 스포츠,"레인지로버스포츠 산지 일주일만에 온갖 잔고장에 시달리다가 큰손해를 감수하고 팔았습니다. 그리고 1년 넘게 기다려서 포르쉐 카이엔터보를 받았는데 기본기, 품질, 운전재미에서 너무 차이가 크네요...아무리 랜드로버가 좋아졌다고 해도 다시는 안넘어갈 것 같습니다.",18
랜드로버,디스커버리 스포츠,제목이 그동안 욕먹었던 랜드로버가 아니다여서 어라? 하고 봤는데 솔직히 극적인 반전은 없었네요 ㅎㅎ,5
랜드로버,디스커버리 스포츠,한남동에 랜드로버하고 같은건물 회사다니는데..건물뒷편에 지상주차장있는데 가끔 딜러가 고객탁송전에 뒤에다 주차하고 소비자 한테 가져다주는데..심심찮게본다. 그차중  문안잠기차..  문여는 손잡이  않 나오는차.. 그때 딜러의 말이 충격... '또 ㅈㄹ이네'  과장도 있지만 완전 과장은 아닌듯,6
랜드로버,디스커버리 스포츠,번창하세요!!!,7
랜드로버,디스커버리 스포츠,기태성 사랑해유~♡,5
랜드로버,디스커버리 스포츠,주차창에서 차주들 보면 물어보고싶어짐잔고장없냐고ㅋㅋㅋㅋ,16
랜드로버,디스커버리 스포츠,차 1대있는 분은 처다도 보지 마세요. 2대 있어야 탈수 있습니다. 1대는 수리중,5
랜드로버,디스커버리 스포츠,스포츠라 쓰고 스포트라 읽는다.,1
랜드로버,디스커버리 스포츠,"4년째 잔고장 하나없이 잘 타고있습니다~장점은 주행감, 기본기, 오디오(제 귀에는...), 넓은 파노라마루프이고...단점은 사이드미러가 완전히 접힌 상태가 약 45도 정도라 빡빡한 곳에 세우고 나서 나오기가 힘듭니다 ㅜㅜ 그리고 180ps hse 풀옵 할인 그닥으로 구매하였는데 다음 달에 폭풍할인 -.-;glc, x3, 모하비, 익스랑 비교해가며 구매했는데 후회는 1도 없습니다....인터넷상 이미지가 안좋은건 랜드로버가 풀어야 할 자업자득 숙제라 생각합니다....이미지가 그렇게 될동안 무얼했는지 묻고싶은....그냥 잘 팔리니 방치하는게 아닌가 싶은...--;여론상 이상하게 들릴수 있지만 다음차도 랜드로버로 갈 계획입니다^^;(별개로...팸카가 아닌 펀카로 중고라도 330i도 꼭 들이고 싶네요 ㅜㅜ)",10
랜드로버,디스커버리 스포츠,차는 참 이뻐..,4
랜드로버,디스커버리 스포츠,랜드로버만 올라오면 예상되는 뻔한 사골 댓글들 역시나 있지만 오토뷰 채널이라 그나마 덜하네요.이런 안좋은 평가에도 불구하고 타던 사람들은 왜 다음차도 랜드로버를 타는지에 대해서도 생각해보길.,7
랜드로버,디스커버리 스포츠,하지만.....향후 최소10년간은랜드로버 차를 타고싶으면동일차종3대는 구매할 재력은 되야함한대는 운행용한대는 부품용한대는 수리시 대차용....,11
랜드로버,디스커버리 스포츠,👍,1
랜드로버,디스커버리 스포츠,"그러나 이제는 랜드로버만을 찾아야할 이유가 사라짐. 대형 SUV가 수입, 국산 할 거 없이 많이 나옴. 그렇다고 랜드로버 탄다고 알아주는것도 아니고.아 물론 이 모델만 그렇다는게 아니라 랜드로버 브랜드를 찾는 사람들이 품질 개판임에도 산다는 명분이 '대형 SUV가 없어서 탄다'인데 진짜 의미없는 소리가 되어버린거죠 뭐.",10
랜드로버,디스커버리 스포츠,다른건 취향 차이지만. AS가 형편없는 쓰래기로 유명하죠. 황당한 서비스 수준 잠깐 검색만 해도 수두룩. 초기불량은 둘째치고 고객응대만 양아치 처럼 안했어도 이렇게 이미지 쓰래기 되진 않았음.,41
랜드로버,디스커버리 스포츠,랜드로버를 매일 타는법.  3대를 구입한다. 첫번째 차가 고장나 입고한다 당황하지 말고 두번째 차를 탄다. 두번째 차도 고장난다 역시 당황하지 않고 입고! 세번째 차를 탄다 세번째 차가 고장난다 센터 입고하러 가는길에 첫번째 차를 찾아온다.,4
랜드로버,디스커버리 스포츠,P250 공식 0-100 이 7.5초로 알고 있었는데 가속성능이 이상하네요. R dynamic이 아니어서 그런가요?,1
랜드로버,디스커버리 스포츠,이쁜데 독3사대비 가성비가...ㅜ브리티쉬 갬성인가,1
랜드로버,디스커버리 스포츠,다른 시승기보니까 물론 차량은 다르지만 동일한 회사 차인데.. 새차인데 엔진오일 새던데요 ㅋㅋㅋㅋ,5
랜드로버,디스커버리 스포츠,강남에 싼타페보다 많이 보이는 랜드로버들 다 어디서고칠까요,3
랜드로버,디스커버리 스포츠,영국애들 기계는 사는게 아님 자동차뿐 아니라 산업용 군용 등등 차라리 국산을 쓰는게 더 효율적임..,2
랜드로버,디스커버리 스포츠,잘봤습니당,2
랜드로버,디스커버리 스포츠,영국영감들이 기저귀 차고 조립하는 차,3
랜드로버,디스커버리 스포츠,"2020  디커스포츠 p250  se 신차출고해서2000키로정도 타고있습니다실차주로서 공감가는 시승기였습니다덧붙이자면  미션....  정말 적응안됩니다디스커버리4벤츠e,bm7,골프gti ,렉서스,xj나름 많은차를타왔는데이미션은 뭔가적응이 잘안되는 느낌이랄까요ㅋㅋㅋㅋㅋㅋㅋ그리고.출력이나 연비가 수치상과는실제로 이질감이많습니다또 자세제어  심하게 빨리들어옵니다적다보니 단점이많은데저것빼곤 다좋아요ㅋㅋ뽑기만 잘하신다면...아시죠?  뽑기.잘뽑으셔야해요.",2
랜드로버,디스커버리 스포츠,와 휠디자인 뭐임,9
랜드로버,디스커버리 스포츠,잘모르겠습니다... 여러모로 ㄷㄷ,50
랜드로버,디스커버리 스포츠,애도 비오면 천장에서 물세나요? ㅋㅋㅋㅋㅋㅋ 랜드로버 디스커버리5 비오면 천장에서 물이 세던데 랜드로버 디스커버리 사면 우비나 우산은 옵션인가요? 아니면 필수옵션으로 제공해주나요? ㅋㅋㅋㅋㅋㅋㅋㅋㅋ,3
랜드로버,디스커버리 스포츠,영국차... 랜드로버 재규어... 흠,3
랜드로버,디스커버리 스포츠,저도 랜드로버에 대해서는 좋지 못한 이미지가 있었는데......,2
랜드로버,디스커버리 스포츠,수줍... 손가락 4개 ㅋㅋㅋ..,1
랜드로버,디스커버리 스포츠,광고끝까지 봅니당,1
랜드로버,디스커버리 스포츠,이쁜 쓰레기 소문나는 건 꼭 문제생김,4
랜드로버,디스커버리 스포츠,오프로드 테스트가 없어서 아쉽군요. 랜드로버차를 온로드에서만 촬영하시다니...,1
랜드로버,디스커버리 스포츠,"영상 잘 봤습니다. 오래전부터 오토뷰의 팬이었고 시청자였습니다.하지만 이번 영상에서 '재규어 랜드로버의 이미지가 다소 과장되었다.' 라는 의견에는 동의할 수 없겠네요.저는 현재 재규어XF 차주이고 차량을 구입하고 이런저런 문제로 한달에 한번꼴로 사업소를 다녔고그 문제들이 전혀 해결이 안되어 누적된 상태로 수리항목이 30개가 누적된 상태로 1년4개월 동안 차량을입고하여 서비스를 받았습니다.장기간의 서비스였기에 대차 서비스도 받았는데 그 차종은 같은 XF 가솔린모델, 디스커버리 스포츠 2대, 이보크, 마지막으로 벨라 였습니다. 웃기는건 대차 차량이 바뀐 이유인데 서비스 대차를 받은 차량들도 문제가 생겨 다른 차종으로 바꾸었다는것 입니다. XF 가솔린모델은 연료계통 오류, 디스커버리 스포츠 시동 오류 등 문제가 없는 차종이 없다라고 느꼈습니다.타보지도 않고 떠들어대는 사람들도 많지만 그 사람들이 떠드는 말이 없는 말을 떠드는게 아니라 실제로 일어난 일들을 떠드는거라고 생각하시기 바랍니다.",8
랜드로버,디스커버리 스포츠,가속성능 왜이리 느림? ;;,4
랜드로버,디스커버리 스포츠,디자인이 심심하네요.,1
랜드로버,디스커버리 스포츠,가성비 제일떨어지는건 둘째치고 2억넘는보그 차싼지 3일만에 퍼지고 수리 이핑게저핑게 고소했다고 소비자고발하는    개쓰레레기회사.나라면bm산다.차는많이 팔아도 보이는차가 수리하러가는차  아니면 수리받고 오는차.😆😎,4
랜드로버,디스커버리 스포츠,여기 욕하시는 분들중 실제 타본분 몇분이나 되실지.. 적어도 디스커버리 스포츠는 문제가 적은 차인데..,9
랜드로버,디스커버리 스포츠,여기서 이 차 욕하는 사람 중 진짜 살 수 있는 사람 얼마나 될까 ㅋㅋ,9
랜드로버,디스커버리 스포츠,랜드로버는 백날 차 잘만들어도 안됌 ㅋㅋㅋ 이미지 세탁 불가능^^,26
랜드로버,디스커버리 스포츠,가속력 제동력 소음 좋은게 하나도 없구만,1
랜드로버,디스커버리 스포츠,절대로 사면  않됨니다2년동안 4회 퍼짐2개월이 넘어도원인도 모르고2년된차가 고속도로 에서 퍼저도미안하다는 놈도 없어오ㅡ,2
랜드로버,디스커버리 스포츠,아무리 얘기해봐도 이쁜 쓰레기의 원조suvㅋㅋ,9
랜드로버,디스커버리 스포츠,과장됐다고요? 다른 유투브 채널에서 이보크 새차를 하체보는데 이미 누유가 시작되고 있었는데요?,5
랜드로버,디스커버리 스포츠,요즘 현기 차량품질 이나 서비스센터 대처를 보면 전처럼 랜드로버를 욕할 처지가 안됨 ㅋㅋ,7
랜드로버,디스커버리 스포츠,가격도 부담스럽지만 브랜드 이미지가....,6
랜드로버,디스커버리 스포츠,안타본 사람은 욕하지 말자..... 가죽 품질이나 오디오 문짝 두께 묵직함 승차감 동가격대 비엠 벤츠보다 좋음.... 근데 잔고장 심함.... 서비스 구림.... 전화도 잘 안받고 예약도 힘듬 막상 시간 내서 가면 어드바이져는 개소리만 해댐.... 신차 사서 3년 탔는데 고장 때문에 서비스 센터만 5번 들락거림. 지금은 벤츠 타는데 이제 1년 되었는데 센터 딱 한번 감... 예약 빠름... 어드바이져 개소리 안함..... 랜드로버는 서비스 품질 부터 올려야한다.... 서비스만 개선되면 나도 비엠벤츠 고려안하고 레인지로바 다시 살텐데 여러모로 아쉬운 회사.,3
랜드로버,디스커버리 스포츠,그냥 욕먹는 차임~~,1
랜드로버,디스커버리 스포츠,코세어가 나을듯하네요,11
랜드로버,디스커버리 스포츠,스포트 인지 스포츠 인지.. 정확한 발음 부탁합니다,2
랜드로버,디스커버리 스포츠,이쁜 쓰X기라는 별명이 있던데,7
랜드로버,디스커버리 스포츠,물이 새지 않으면 진정한 랜드로버가 아닙니다,3
랜드로버,디스커버리 스포츠,뒷광고? 지금도 A/S 에서 시끄러운 브랜드가 리뷰는 계속 올라오네...,1
랜드로버,디스커버리 스포츠,아직 기술력에서 안되는 회사입니다특히 전자장비쪽의 성숙도는좀 더 노력해야하는  회사입니다개판 서비스는 정말 개선해야하구요,3
랜드로버,디스커버리 스포츠,이 회사 차종 중에  물새고 그러지 않았나,1
랜드로버,디스커버리 스포츠,이차 살려면 두대사야된다던데 하나는 정비소에 들어가 있어서 ㅋㅋㅋㅋㅋㅋ,5
랜드로버,디스커버리 스포츠,랜드로버가 중국 자동차 산하 기업이 되었으니 이제 랜드로버는 엿이나 바꿔 먹어야 한다.,1
랜드로버,디스커버리 스포츠,모트라인이던가? 얼마전  새차 하체 보는 영상이었는데 이미 누수가 일어나고 있더군요. 당장 보이지 않는 내구성 고장에 대한 걸 '오해'라고 하기엔 만국공통으로 쌓인 이미진 이미 황인지라 ..,4
랜드로버,디스커버리 스포츠,이뿐개쓰레깅❤️,3
랜드로버,디스커버리 스포츠,안타본 사람이 더 ㅈㄹ하는 브랜드,7
랜드로버,디스커버리 스포츠,부품용으로 한대더사면 얼마할인해주나요,6
랜드로버,디스커버리 스포츠,언제 망하려나,1
랜드로버,디스커버리 스포츠,9초..,3
랜드로버,디스커버리 스포츠,잔고장 없던대 ... 그런 말을 하는사람들은 공인된 통계를  갖고 있나? 혹시 프레임 씌우기? ㅋㅋ,1
랜드로버,디스커버리 스포츠,1분전!,2
