car_brand,car_model,comments,likes
현대,i40,i-40 gt 1.6 터보 8단dct  디자인날렵 출시되면  잘팔릴텐데지금i40 디젤 7단미션 보유중인데  엔진의 물리적인 힘이있어 악셀을 발아야되지만 가속효율성 연비 민첩한핸들링 절묘한 무게중심 오버스티어 언더스티어없는 주행감17인치타이어 지만  빠릿한 몸놀림고속에서 파워가넘치지는않지만 160까지문난히나감  코너링에서 또한번 감탄단점 저속에선  변속이 초기모델이라 저속에서 벌벌거림   이차량의 특성을 이해하고타야됨,3
현대,i40,역대급 출연자분이시네요.재밌어요 ㅋㅋ,7
현대,i40,i30 패스트백 출시 되면 좋겠다...,4
현대,i40,차주님 너무 재밌으시네 ㅋㅋ,1
현대,i40,"포티 명차인 건 다 알지 ,,애매할 뿐 ,, 차 좋음",2
현대,i40,찐차주 멋지다! 나도 왜건좋아한다,1
현대,i40,인터뷰형 매력있어요!!,2
현대,i40,왜건 무덤인거 보면 우리 나라 사람들 차를 사는 1번이 실용성 보단 디자인인듯ㅋㅋ,10
현대,i40,말씀을 진짜 잘하신다. 유재석 수준이심,2
현대,i40,ㅋㅋㅋㅋㅋㅋㅋ차주분 너무재밌어요,1
현대,i40,오랜만에 차 리뷰 나온듯하네요,1
현대,i40,왜건 맛들이면 진짜 suv나 세단으로 못넘어감..,3
현대,i40,아....새로나오는 왜건있으면 바로 지를텐데....i40 하이브리드나 전기차로 다시 안나오나...ㅠㅠㅠ,16
현대,i40,첨에 차 나오고 차주나왔을때 개성넘치는 외모 너무잘어울리네 ㅋㅋ 아ㅋㅋ,1
현대,i40,가솔린2.0 D스펙 풀옵 마지막 6단미션 13년식 14년형  차주인데요.정말... 거짓말쪼금보태서 코너링 예술입니다. G70 만큼 좋아요. 고속주행시 핸들떨림은 차량 휠 셋팅과 서스 세팅에 따라 다른거같습니다 저는 19 18 차례대로 다운하고 마지막 현재 17인치다운 했는데요. 19인치에서 노면을 많이탔으나 18인치에서 적당히 탔었고 17인치 225 55 17 사이즈에 정착한뒤 그다지노면을 타지않았어요.(타이어공기압 31~ 32입니다. 승차감때문에요^^)전차가 벨로스터 5년탓는데  당시에 19인치 18인치 라서 더욱 차이를 느끼는걸지도 모르겠네요 ㅎ타이어랑 휠인치 다운한번해보세요.그리고 얼라이먼트 잘하는곳으로가시고(전 3곳갔어요) 브레이크 패드 점검 한번꼭하세요. 디스크 편마모때매 떨리는경우도 있어요.,1
현대,i40,저도 i40왜건 디젤 타다가..카니발로 넘어왔지만..전반적으로 굉장히 만족한 차량이었으나..소소한 부분이 저랑 안맞아서..팔았습니다.;;디젤6단미션의 경우..기어비세팅이 좀 지랄같습니다.쭈욱 가속해서 6단까지 변속하는건 문제없지만..시내주행시 아리까리한 속도..즉 60키로속도에서 정확히 5단기어가 물리는데(평지기준)이게 딱 60키로가 되야지만 5단이 물리다보니..짜증나더라구요.액티브에코버튼은 쓸모없구요;;(변속시점이랑 관계없음)또하나는..테일램프 방수부분인데..비오거나 세차하면..깜빡이나 후진등쪽에 습기가 차고..나중에는 물까지 차더라고요.;;저는 실리콘을 덕지덕지 발라서 잡았으나..좀 아쉬운부분입니다.다시 구매한다면 말많은 7단dct로 살것 같습니다.변속이 굉장히 부드럽고 빠르고..나쁘지않더라구요.물론 dct특성상 1단에서 2단 넘어갈때만 좀 이질감있지..나머지 구간은 굉장히좋더라구요.나중에 클러치세트와 플라이휠 교체금액인..대략130만원이 아깝긴하지만..6단미션의 지랄같은 변속딜레이보다는 낫은듯합니다.,2
현대,i40,데일리카로 왜건이 최곤데 진짜,1
현대,i40,와 어제 i40 알아보고 있었는데 이게 뜨네 구독 박아놓은 보람이 있네,11
현대,i40,i40 왜건이던 살룬이던 가솔린 사실 분들은 페리된 15년식 이후 모델사세요 누우 2.0 gdi 오일감소 때문인진 몰라도 페리 이후는 기존 178에서 166으로 마력을 낮춰서 출시했더라고요 마력을 낮춘다고 오일감소가 해결된 건 아닙니다 증상이 늦게 나타날 뿐 똑같습니다. 반대로 디젤 사실 분은 페리 전 초기형 11~14년 사세요 페리 된 디젤은 7단 dct..,7
현대,i40,현시점에 나왔으면 많이들 찾았을듯 싶네요 차박이니뭐니하면서 2500넘는 소형suv 그리고 3500이 넘는 중형suv를 많이들보시는데 이차는 3천이하에 차박이가능하고 도심에서도 승차감까지 살린 그런이점이 있는차종이죠,3
현대,i40,이거 보고 다음차는 왜건으로!ㅎㅎㅎ,6
현대,i40,3:15 suv나 웨건이나 실내 헤드룸 거주성은 별반 차이 안나지 않나요?,1
현대,i40,i30이랑 i40 중에 고민하다가 i30샀는데 후회중ㅠㅠㅠ i40 너무 갖고싶어용...,5
현대,i40,우리나라에 왜건이 거의 없는 이유는 살만한 왜건이 판매된 적이 없기 때문입니다. 볼보 왜건들은 잘 나가잖아요.,2
현대,i40,와 넉살님까지 섭외하시네ㄷㄷ,25
현대,i40,제가 제일 좋아하는 차가 웨건인데... 국산 웨건은 중고로 밖에 못구해서 안타까워요,1
현대,i40,17년식 가솔린 왜건입니다고속안정감이 좋습니다그당시 d스펙옵션 셋팅이 단단해서 핸들이 요래요래 하는건 그당시 서스셋팅때문에 그렇게 느끼시는거라 생각되네요차 답답하게 안나가는거 엔진시끄러운거 정말 공감합니다,1
현대,i40,왜건에 진심 단점에 진심인편 ㅋ,2
현대,i40,1.연비똥망(가솔린)2.출력똥망(진짜 더럽게 안나감 특히 70까지)3.부품수급똥망4.진동지옥 (포터 타보면 깜놀 너무 정숙해서)5.저세상 출시 가격(할인 600 받아도 비쌈) 6.생각보다 심한 잔고장 (랜덤으로 듣도보다 못한 별 희안한 고장)7.언젠간 결국 보링(가솔린)8.애프터 마켓 똥망9.유지비 똥망 ( 디젤은 유지비가 보링값 상회)10.중고뽑기 실패시 수리비 폭탄 주위에 추천하는 사람 있으면 뺨을 때리고 연 끊어야함,4
현대,i40,김경진씨 리뷰 잘봤습니다,8
현대,i40,가지고싶던차였는디...ㅜㅡ,1
현대,i40,k3웨건 종종 보이는데 디게 이뻐보이던데ㅎㅎ,1
현대,i40,웨건스타일 좋죠 사랑합니다~^^,3
현대,i40,왜건 진짜 실용적인데 한국에선 왜 노인기인지 이해가 안감,2
현대,i40,살룬 리뷰도해주세요~,1
현대,i40,난 보험료 120나오는데 부럽네요..,1
현대,i40,해치백도 껴줘요! 해치백도 좋습니다 이쁩니다,1
현대,i40,소나타 왜건 하이브리드 나와야...,1
현대,i40,i40왜건이 진짜 찐탱이인데…,9
현대,i40,i40랑 쏘나타 뉴라이즈 터보모델이랑 항상 헷갈림.. 그릴이랑 생김새가 비슷..,1
현대,i40,왜좋은지 모르겠는차 왜냐면 왜건의 장점이 있는데 막상 살롱이 더 마니 팔림ㅋㅋㅋㅋㅋ,1
현대,i40,아앀ㅋㅋ 3분까지 왼쪽분이 차주인줄알고 보다가 뭐가 이상해서 보니까 오른쪽분이 차주였네,2
현대,i40,같은 i40 차주인데 웨건살걸 엄청후회하고있습니다..,5
현대,i40,차주분 첨보고 노라조의 조빈 인 줄 알았네ㄷㄷ,2
현대,i40,진짜 내 드림카였는데....,1
현대,i40,보험료가 와ㅋㅋㅋㅋ,2
현대,i40,이제곧 웨건이 뜨지않을까,1
현대,i40,I40 N 기대중,1
현대,i40,보험료 29만원 ㅋ와ㅋㅋ 개부럽네,7
현대,i40,내가 결혼했고 애기 아빠면 무조건 i40 살듯...,1
현대,i40,"해치백차주로서.. 단종된차중에.. 내 기준으론 제일 안타깝다,",1
현대,i40,15년에 40 왜건이랑 말리부 재다가 말리부샀네요 ㅜㅜ,1
현대,i40,사고싶지만 매물이 너무없어...ㅜ,2
현대,i40,왜건은 사랑이쥬-현 m340i 투어링 오너.,3
현대,i40,말도 안되는 소릴 ㅋㅋㅋ i40랑 아반떼랑 사이즈 자체가 다른데 ..,2
현대,i40,i30왜건의 귀여운 맛이있는데 i40는 너무 못생김ㅜ,1
현대,i40,선좋아요 후감상,1
현대,i40,티볼리 아머해주세요아머입니다베리뉴 아닙니다코란도도 해주세요,1
현대,i40,i40은4륜구동 없죠?,1
현대,i40,현실세계에서왜건 불호자 98%,1
현대,i40,나는 고성능 해치백(6기통) 또는 2인승 고성능경차 출시좀 ...,1
현대,i40,왜건 좋은데 한국엔 이젠 안판다,1
현대,i40,왜 노라조 조빈형님 생각이 나지,1
현대,i40,찐이다....,1
현대,i40,아...이거  살까하다가  아반떼  플랫폼이라서  포기했는데,1
현대,i40,구형모델이  아반데 닮앗다는말듣지  신형은 전혀다른데..ㅠ,1
현대,i40,오!1등인가요?!선댓글 후감상합니다^^,3
현대,i40,뭘 쪼까 잘아시고마이 웨건 무덤인 국내시장인기차종돼는그날까지,1
현대,i40,29만원ㅋㅋㅋㅋㅋㅋ와,3
현대,i40,왜건 다 좋은데 투박하게 생긴 뒷쪽이 너무 못생겨서 사고 싶단 생각이 전혀 안들긴 함ㅇㅇ…..,1
현대,i40,13:10 병 주고 약 주기,1
현대,i40,몇년 식인가요?,1
현대,i40,"냉면집하는 개그맨 그누구지,,,그분닮으셧는데;;",1
현대,i40,차박이 인기를 끌고 있다지만.... 왜건차량을 활용할 수 있는 사회가 만들어져야함ㅋㅋㅋ 유럽처럼 트렁크에 짐가득 넣고 온 가족이 여름휴가 한달받은걸로 주변국가를 내 자동차로 여행할 수 있는 그런 분위기. 하지만 내 아랫돌이만한 나라에서 주변국가는 커녕 죄다 옆동네아니누? ㅋㅋㅋㅋ 길어야 8시간이면 전국 어디든 가버리는지라 ㅋㅋㅋㅋ,1
현대,i40,거 어데 서십니까?,1
현대,i40,왜? 건…,1
현대,i40,2등!!,2
현대,i40,근데 왜건 진짜 못생기긴했다,1
현대,i40,허리가 길어서 SUV가 휘청휘청 거린다...ㅋㅋㅋㅋ 별 그지같은 이야기를 듣네,1
현대,i40,왜건은 미트왜건이죠,1
현대,i40,ㅎㅎ 40이 뭐가 좋다는건지 유럽감성? 암튼 구임 사지마세요 연비 안좋아요,3
현대,i40,"그랜져와 i40중에 고민하다 i40를 선택했는데, 8년째 20만km 타고 있는데 탁월한 선택이었다고 생각함.",23
현대,i40,I40 왜건은 진짜 좋은차 인데 내수가 잘 안팔리는게 아쉬움...,61
현대,i40,작년에 가져와서 1년째 타고있지만 정말 만족스러운차. 12년식 구입후 전면 페페리하면 굉장히 고급스러워보이고 고속주행 180까지 밟아봤는데 그럭저럭 안정감있고 저속주행은 살짝 느린감있지만 60~160까진 가속성능 만족(gdi),4
현대,i40,가격 책정만 잘 잡았으면 내수시장에서도 성공했을법한 차.,111
현대,i40,저희집이 전기형 I40인데 2.0가솔린 178마력인데  연비가 8~12나오내여 실용성은 진짜 장난아니에요. 신차사고 12만 타고 있는데 진짜 만족중입니다 ㅎ.ㅎ,46
현대,i40,I40.왜건 좋음요.전에 4년정도 탔는데 실용성도 좋고 기본기는 왠만한 현대 차중 제일 좋다고 생각합니다,3
현대,i40,제가 i40 왜건 초기 처음 나오자마자 반해서(2011년) 구매해서 8년타고 팔았습니다~ 그당시 그랜저에도 없던 풀오토 윈도우 전동트렁크 스마트 네비 등등유럽공략차라 그런지... 퀄리티가 아주 좋았습니다 .. 우파님께서 말씀하신데로 완성도가 높은차 입니다 저 또한 만족도가 아주 높았던 차 입니다 ~기억나네요~ 또 타고 싶은데.... 단종이네요 ㅠㅠ,3
현대,i40,"저도 18년식 왜건 디젤모델 타고있습니당  차박가기도 너무 좋고, 파노라마 썬루프 개방감 너무 좋아서 대만족이요 ㅎ연비는 15km/l 조금 더 나옵니다.",2
현대,i40,제가 지금 i40 왜건 전기형 타고 있습니다~ hg타고 넘어왔는데 정말 최고입니다~!!! 트렁크는 뭐.... 말이 필요없어요!!!! 서스펜션도 hg와 다르게 조금 하드해서 딱좋아요~!!! 우파님 처럼 실용성 만큼은 정말 최고입니다~!!,21
현대,i40,"i40 아시아 자동차 제조사 최초로 2011년 유럽 올해의 차체 기술상 (유로 카바디 어워드)을 받았죠^^* 1위 i40, 2위 아우디 A6, 3위 벤츠 B클래스...",21
현대,i40,"i30, i40, 벨로스터, PYL(Premium Younique Lifestyle)....으로 선전했지만 결국 PYL(팔리지 않는 양산 라인)으로 더 유명했던 차량.....동급 대비 비싼 가격이 너무 컸지요 그래도 샀던사람들은 좋은 품질로 만족하며 타고 있어요 ^^",5
현대,i40,좋은차일수 밖에 없는게 유럽에 팔 목적으로 독일에 있는 현대유럽연구소에서 설계부터 디자인까지 독일인들이 만든차임. 가격으로 까는데 그랜져보다 좋은차였음.,11
현대,i40,16년식 i40 페리 살룬 디스펙 오너입니다.i40 디스펙 트림은 별도 다이나밋킷 버킷시트 등이 있어서 주행면에서 하드한면이 인상적입니다. 물론 요즘 신차 기능들이 부럽긴 하지만 아직까지 만족도가 높은 차임은 틀림없습니다.중고구매 고려하신다면 디스펙 모델 추천드립니다.,3
현대,i40,전 한때 i40 오너로서 매우 행복했었답니다!! 좋은 추억들을 남겨준 차!!,10
현대,i40,I40 살룬 디젤 타거있는데 다른부분은 요즘 차가 워낙 잘나와서 모르겠다만 연비는 진짜 최곱니다..,2
현대,i40,오 요즘 계속 i40왜건 관련 영상 찾고있었는데 우파님이 리뷰 해주시다니 너무 감사합니다~~♡♡,9
현대,i40,I40 웨건 디젤 차주입니다. 지금은 구형이라 요즘 차들이랑 비교불가지만.. 당시 연식들 차량 비교했을때 차 성능 기능 실용성 최상입니다. 안타보신분들은 모르겠지만 i40타신 분들중이 만족 안하신분 본적이 없습니다,4
현대,i40,가격때문에 망했지만i30 왜건은 실제 몰아보면 가속력 좋고 커브에서도 비교적 단단해서 깜놀 했었음의외로 트렁크도 괜찮고내가 이거 몰아보고 사려다 포기한게 가격이었음젊은 세대를 타겟으로 했는데...정작 사회초년생의 금액으로는 아니었지,4
현대,i40,첫차 2012년 i40살룬 디젤을 2020년2월까지 탔는데 엔진오일 에어컨필터만 교체하고 타고 다녔죠.. 트렁크도 은근 넓어요~ 당시 리어커튼도 전동식ㅋㅋ 공인연비 18.5키로라고했지만 실연비 13.4키로..,1
현대,i40,차는 좋음 디자인도 이쁘고ㅋㅋㅋ근데 가격이 뭔가 애~매~했지..,3
현대,i40,13년 디스펙 디젤왜건 45000km중고구입후 잘쓰고 있음 트렁크 진짜 넓고 실용성이 좋음이번 김장때 높이허리 정도 대형 대야도 들어감단종안되고 상품성 개선하고 하이브리드모델이 나온다면 바로구입 할것같음,1
현대,i40,전i40오너로서 한말씀 드리자면디자인 및 연비 및 패밀리카로서 정말 좋은 차입니다 특히 연비 하나는 현존하는 우리나라 디젤차중 탑 이라고 생각됩니다 연료탱크또한 용량이 커서 1회 주유당 천킬로 이상타는차입니다  정말 완성도 높고 실용성도 높은 차라고 생각합니다,17
현대,i40,i40 외건 3년째타고 있지만 단점보단 장점이 많은차입니다. 애들타기도 편하고 14만넘어 지만 만족하면서 탑니다,2
현대,i40,그때도 분석할 때 가격보다 우리나라 사람들 성향을 분석하는 글이 다수였던걸로 기억함. 유럽에서 먹히는데 한국에서 안먹히는 이유는 그냥 SUV를 더 선호하는 경향이 강해서라고ㅎㅎ,3
현대,i40,"흉기 극혐해도 i40왜건 세컨으로 잘타고다니는중일단 구동계부터 전혀 흉기답지않고 하체도 완벽 4만 좀 넘은거 중고로 가져와서 12만정도 탔는데 아직 잔고장도 없고 루프박스 설치하기도 좋아서 겨울에 스키, 보드장비 실을 때 좋음",20
현대,i40,2015 i40 살룬 디젤 디스펙 오너인데요.. 디자인도 날렵하구요.. 연비가 정말 좋아요... 디젤도 괜찮은거 같습니다. 오너로써 만족합니다. 연비짱이에요,3
현대,i40,i40 왜건은 유럽에서 재미 좀 봤었는데우리나라는 해치백 왜건 무덤이라 폭망긴 바디와 광활한 트렁크 보면 우리나라 사람들이 왜 외면했을까 싶기도 함. 잔고장도 없고 튼튼하고 좋은차긴 함.,1
현대,i40,14년도 진짜 군대 안에서 살룬 그렇게 사고싶었는데....,2
현대,i40,I40왜건 끌고 다니지만 공간 활용도는 어우 최고예요 ㅋㅋ디자인ㄷ넘나 이븐거 ㅎㅎ,19
현대,i40,지금은 왜건에 대한 인식이 바꼈을지...차박이 유행이니까 다시 나와도 되지 않을까 싶네요,1
현대,i40,"17년식 가솔린 디스펙  i40차주입니다만듬새 좋고, 무게배분 및 서스펜션도 적당해서 막 잡아돌리면 전륜이지만 생각보다 언더로 밀리지 않습니다(동급 중형차량대비)기어비도 무게때문인지 소나타는 80km/h에 6단이지만 i40는 70km/h에 6단이 들어갑니다단점이라면 웨건타입이라 뒷축하중이 있다보니 무스테스트에는 약한모습입니다그리고 가솔린이 조용하다 하시는데 GDI는 겁나 시끄럽습니다-_-;; 특히 i40에 들어간 누우gdi는 세타보다 더 시끄럽기로 유명하죠세타에서도 발생한 스커핑현상 누우에서도 동일하게 발생합니다. 특히 전기형은 보링 한번씩 했거나 해야되는 상황이라 보심됩니다후기형은 177마력->166마력으로 디튠하여 엔진내부에 부하를 줄여 확실히 스커핑현상으로 오일소모되는 케이스가 많이 줄어들었습니다제가 제일 추천하는모델은 18년식 제일 후기형 ADAS달린 모델을 구하세요....18년식 초기형까진 ADAS는 고사하고 사각지대장치도 없습니다.....(블루링크도 18년식부터 3.0버젼...)솔직히 차에 만족도는 정말높고 추천할만한 차입니다만, 단종직전 풀옵 가격이 3300인데....새차사는분은 용자 아님 부자였을듯합니다",2
현대,i40,2012년식 프리미엄 유로팩 1.7디젤 살룬타고있습니다 강원도 갈때 정속주행하면 연비 21~2키로넘게 나와요  현재 13만키로 아직도 짱짱합니다,1
현대,i40,요즘 i40에 관심이가서 매물계속보고 있었는데 ㅎㅎㅎ,38
현대,i40,원래수출전략모델이었는데 한국에서 생산하니 내수도 출시한겁니다. I40 GDi엔진은 누우2.0GDi로 i40에만 장착되었으며 쎄타GDi처럼 내구성문제가 없습니다.다만 특유의 Gdi엔진소리는 있죠. 핸들도 칼럼방식MDPS지만 특수장치를 달아서 핸들링을 보완해서 핸들링도 상당히 우수합니다.저차는 웨건이 좋습니다. 특히 트렁크는 넘사벽입니다.,2
현대,i40,i40 왜건 전기차로 다시 나오면 꽤 팔릴거 같은데 ㅠㅠ 단종 너무 안타까움...,4
현대,i40,I40 웨건이없어서 살룬으로 삿는데잡소리 오집니다.. 다른건 이상없네요 ㅎㅎ12년식치고는 이쁜것같습니다,3
현대,i40,연비는 진짜 좋아 1.7 ㅋㅋ아직도 있는데 진동빼고는 고장없고 좋다,11
현대,i40,실용적인것을 목표로 나왔지만 가격이 실용적이지 않아 망한 비운의 차... 가격책정만 잘했어도 잘됬을텐데,2
현대,i40,"현기차만 아반테md, 카니발R, 엑센트위트, 트라제XG, i40 이렇게 타보았는데 트라제는 소장하고 싶지만 노후경유차라서.. i40은 끝까지 함께 하고 싶네요...^^",2
현대,i40,한때 i40 중고 알아보고 다녔었는데 정말 신기하게도 대부분 3년조금 넘었는데 주행거리가 아주 후덜덜한차들이 많아가지고 ㅈㅈ쳤었는데ㅋㅋ영업용으로 인기많았던듯,5
현대,i40,"i40 디젤 웨건 6년째 타고 있는데요, 소음 진동 만족스럽구요 연비는 지금도 시내 14 이상 고속도로 19 이상 연비 나옵니다.",3
현대,i40,"비엠 투어링은 넘비싸서, i40 신모델이나, 후속 페이스리프트라도 나오길 수년째 기다리다 ㅠㅠ i40 신형 만들어주세요~",4
현대,i40,나는 이거 디자인 좋아서 많이팔릴줄 알았는데ㅠㅠ,6
현대,i40,웨건이 짱이죠~~단종만 안됬으면 좋았응텐데..ㅠㅠ,6
현대,i40,"개인적으로 현재 구형 i30 타고있는데 해치백,왜건 스타일 차량 좋아하는 사람으로서  국내에서 인기없는게 너무 안타까워요 ㅠ  이제 차량 바꿀때 어쩔수없이 세단이나 suv 강제로 가야함..  외제차량은 돈없어서 못타구... ㅠㅠ 엉엉",3
현대,i40,진짜 i40 1000만원 이하로 보고있는데.... 웃는모습 에 뻥~ 웃었어요,9
현대,i40,지금타고 있는데 너무 만족합니다  근데 연식이 오래되서  지금은 v60cc  대기타고 있어요 웨건 짱!!,8
현대,i40,옛날 I10 I20은 본적없지만 I30 I40은 확실히 차가 잘 만들어졌다는게 느껴짐,2
현대,i40,I40처럼 비운의 차 올뉴카렌스or 더 뉴카렌스 리뷰해주세요 형~가성비&실용성 좋아요,4
현대,i40,아....14년 2월식 i40왜건 1.7디젤 디스펙 소유자였습니다. 3500만원 풀옵션 모델이었구요. 500만원 추가로 들여서 풀방음 + 포칼 오디오 구축해서 전국 방방곡곡을 캠핑하고 다녔던 기억이 납니다.정말 그당시 현대차 답지않게  하체가 단단하고 잡소리없고 잔고장 없던 녀석이었는데연비도 고속주행시 22키로는 거뜬히 나왔던.그런데그놈의 주변의 그랜져충들 ㅡㅡ... 그돈줄거 그랜져사지 왜 이거샀냐 이 말을 거짓말 좀 보태서 3천번쯤 들었던 날지인에게 팔아버렸습니다그러고 그렇게 줏어듣던 그랜져IG를 뽑았더니왠걸진짜 현대차는 이런 것이구나를 느끼는 순간이미 상황은 늦었죠i40는 제 손을 떠났고쓰레기 IG는 제품에 있고...지금은 신형520타고있지만하체의 쫄깃함은 i40(디스펙 기준)랑 520이 견줄만하다고 차주로써 감히 말해봅니다그리고 외국에서 폭망까지는 아니다싶은게싱가포르에서는 택시로써 엄청 팔렸구요16년에 동유럽출장가보니 제법많이 굴러다닙디다.,9
현대,i40,개인적으로 차 7종 정도 탔는데 만족도 가장 높은 차,8
현대,i40,i40 왜건 패밀리카 잘 탔고 이후로 k9 타다가 rx450h 까지 왔지만 디젤만 아니 었다면 가장 만족 했던 차...,5
현대,i40,개인적으로 웨건차가 많이 나왔음하는데..웨건을살라면 국산차는없다보니 슈팅브레이크같은 외제차를 구매헤야 ㅠㅠㅠㅠ,3
현대,i40,i40웨건 이미지가 안좋아진건  고속도로 보복사건이 크게 난게 한몫한거 같아요,1
현대,i40,i40 웨건 장점 : 현대가 역대급으로 잘만든차i40 웨건 단점 : 중고매물이 가뭄에 콩나듯이 보임,55
현대,i40,세단 모델은 진짜 너무 애매하긴 했습니다..,19
현대,i40,"대체적으로 i시리즈 왜건 해치백 되게 잘 만들었는데 사람들이 가오, 간쥐만 살아서 다 세단만 찾으니깐 안팔리는게 좀 슬프다 솔직히 i30만봐도 아반떼보다 훨씬 성능도 좋고 경쾌한데ㅋㅋ i30n라인 단종 슬프다!!!",2
현대,i40,아부지가 진짜 잘 사시나 보내용,1
현대,i40,비운의 차로 단종되어버렸네요...우파님 비운의 차 시리즈로 컨텐츠 찍으셔도 될 것 같습니다.,23
현대,i40,애아빠인데 진짜 왜건타고싶다ㅜ,2
현대,i40,최소한 정기형은 소나타와 많이 달라요. 차 들어보면 바닥이 다르죠. 엔진도 세팅이 다르고. 후드가 더 짧아요. 실제 오너의 만족도는 엄청 높아요.,1
현대,i40,웨건 세컨카로 진짜 딱인듯 중고하나 사고 싶다,1
현대,i40,지금봐도 뒤쳐지지않는 디자인인데.... 많이아깝네요,2
현대,i40,제 지인분중에 저치 11년식 출고해서 21만 찍은분이 계세요...ㄷㄷ 그중에 얼라이먼트 빼고는 고장난게 하나도 없었어요...ㄷㄷ,2
현대,i40,차는 괜찮지 단지 가격대가 좀 높은게..그랜져랑 가격이 겹치니..실제로 제 주변에도 i40견적냈다가 그랜져 가신분들도 몇분 계시구용,2
현대,i40,i40살룬 볼때마다 드는생각이 진짜 쏘나타를사지 왜... 차량 만드는데 비용도 많이들텐데 할려면 왜건에 집중하는게 좋다 생각했는데 i40는 이제 중고로만 구할수밖에 없겠네요 ㅠㅠ,1
현대,i40,킹스맨 1편에서 경찰차로 몇초나온거에 꽃혀서 12년식 살룬 샀습니다.현재까지 만족하고 타고있네요~,1
현대,i40,전 12년형 살룬가솔린타고다는데 개좋음!가족들 있으면 왜건디젤 무조건사세요!ㅋㅋ,2
현대,i40,"제가 전기형 12년식 탔고, 그 차를 누나가 가져가서 15만키로 넘었습니다. 친한동생이 제 차 타보고는 후기형 샀구요. 저도 그랬고 그 동생도 그렇고 딱히 불만사항이 없었죠.심지어 전기형은 전좌석 풀오토윈도우였습니다.",10
현대,i40,참고로 i40 16년형은 atcc 시스템이 적용되었습니다 32비트 MDPS도 적용 되었구요,6
현대,i40,재대로된 중고 매물을 찾기 힘든차 ..,1
현대,i40,웨건은 요즘같이 캠핑붐에 어울리는 차이긴 하다,3
