car_brand,car_model,comments,likes
혼다,오딧세이,이사람도  차에대해 잘모르는 사람중에  한사람 이네 오로지 디지털화 되는게 멋진차로  착각하는 사람중 한명이네. 차는 머다. 편안함 주행과 안전사향.그리고 젤 중요한건 머다. 풍절음과 바닥면에서 올라오는 잡소리 입니다. 근데 나도 신형 카니발 타는데 1열은 괜찮은편 근데 2열부터 풍절음ㅇ과 바닥면에서  소리가 장난아닙니다. 그리고 3열은 까놓고 짜증날정도로 소리가 장난아님 함 타보시고  얘기하세요.그리고 카니발셋팅은 너무하드하게 셋팅해서 3열은 허리작살 납니다.중요한건 서스펜션이 중요하다고 생각하는 사람중 한명이라. 우짜됐든  카니발과 오딧세이 리뷰한다는것 자체가  넘사벽입니다.,2
혼다,오딧세이,그냥 망했으면 좋겠어 미워죽겠어 인데ㅋㅋ,1
혼다,오딧세이,카니발하고 비교하면 안되지,2
혼다,오딧세이,또 또 또 ㅋㅋㅋㅋ,1
혼다,오딧세이,월할 아니고 원활,1
혼다,오딧세이,난 저 오딧세이 뒷부분 쳐진모습 정말 보기 싫던데.... 차가 마치 짜부된듯한게 찐따 같아 보임.....,3
혼다,오딧세이,혼다 좋죠....,1
혼다,오딧세이,확실히 디자인 구리고 여러모로 상품성 떨어지는 것 같아도 자동차의 기본기 자체는 현기차를 압살하네요... 현기차가 아무리 잘나와도  일본차들에게 밀리는 이유가 있네요,2
혼다,오딧세이,차는 좋은데 디자인은 구리구리하네,1
혼다,오딧세이,7:41 율모차,19
혼다,오딧세이,나는불매운동 하지만 다른사람한테 강요할순없는부분이죠특히카니발은 국내에선 독점적이지만 혼다 넘어서지 않으면 미국시장에선 가능성이 낮죠국내에서 팔생각하지말고 미국에서 팔생각해야죠,7
혼다,오딧세이,예전의 일본이죠,2
혼다,오딧세이,일본차...디자인 진짜 안습....너무 촌스러워요...,4
혼다,오딧세이,아직..일본 한테 배울점 많습니다..오딧세이..카니발보다 월등합니다..하이브리드 출시안하는가?,1
혼다,오딧세이,확실히 디자인은 현기차가 훨씬 좋은데 승차감이나 주행질감 엔진필링 내구성 이런거는 배울 생각을 해야지 계속 불매 머시기만 하고 있으니 발전이 없죠....,14
혼다,오딧세이,미국 살아보셨어요????? ㅎㅎㅎ,2
혼다,오딧세이,순정으로 이러니 저러니 해도 소유해보면 틀림 국산차 에프터 시장이 국내 제품이 많으니까  많이 따라갔구나..보이지만  내구성 부분만 봐도 틀리다고 느껴짐우리나라는 디쟈인 통풍 하얀 전구  실내가죽에만 신경쓴다고 느껴지내요.e클 아방이? 독일가면 택시임..우리나라는 독일택시 운전 하면서 좋아함.즉 문화차이라고 느껴지내요.내가 좋으면 타는거죠 뭐잘봤습니다.띠리링 띠리링,1
혼다,오딧세이,미디어오토,7
혼다,오딧세이,13:46 띠리리,1
혼다,오딧세이,Dnr이 뭐에요?,1
혼다,오딧세이,"3:37 2020년 2분기까지의 판매량 정보인 것 같아,2019년 및 2020년 미국내 미니밴 판매량 정보 공유해드립니다.크라이슬러 퍼시피카 : 97,706대(2019) → 93,802대(2020)혼다 오디세이 : 99,113대 → 83,409대도요타 시에나 : 73,585대 → 42,885대닷지 그랜드 카라반 : 122,648대 → 38,767대기아 세도나(카니발) : 15,843대 → 13,190대(벤츠 스프린터는 스타렉스같은 3밴 화물차로 더 많이 쓰이고, 포드 트랜짓 커넥트는 차급이 달라서 제외하였습니다.)",18
혼다,오딧세이,저 디자인을 굳이 돈주고 사야되나...,3
혼다,오딧세이,일본이나 미국이나 따지고 보면 우리한테 더 도움되고 덜 도움되는 놈을 골르면 되는 거지...덮밥마냥 닾어놓고 까진 말죠,2
혼다,오딧세이,신형인데 왜 이리 올드하노 ㅠㅠ 일본차도 끝인가?,3
혼다,오딧세이,현기차가 외국에서  싸구려 이미지에 한맺혀서 고급화만 신경쓰는데 일본차가 미국포함 동남아에서도 잘 팔리는 이유가 있음현지 고객의 니즈를 정확히 파악하고 수출사양을 만듬 최신기술보다 내구성 안정성에 중점을 둠근데 신기하게 우리나라 사람들 니즈는 좃도 모름,1
혼다,오딧세이,"차에 DVD 재생장치가 있는 것이 한국 입장에서는 이해가 안 되지만, 미국에서는 제법 요긴합니다. 미국에서는 월마트나 시골 주유소를 가면 출구에 DVD 대여 자판기가 있는데, 이용객이 제법 많습니다. 저소득층은 넷플릭스 같은 스트리밍 서비스 말고, 주말에 이런 거 빌려서 1년 정도 흘러간 영화 보는 게 낙입니다. 영상에서 거듭 소개된 대로, 미니밴은 유아들도 많이 이용하는 가족용이므로 DVD 몇 개 구워서 반복 재생을 틀어주면 (한국 애들이 뽀로로 본 거 또 보는 것처럼) 시끄럽게 굴지 않습니다. ^^",5
혼다,오딧세이,국내에서 시트 빼고 주행하다 적발되면 벌금 물어요...,1
혼다,오딧세이,껍데기는 많이따라갔지,1
혼다,오딧세이,일본차는 고장이 안나서 타는 차임. 그게 끝. 렉서스도 고장이 안나는 프리미엄이라 타는거.,4
혼다,오딧세이,아.... 놀리고 싶다 ㅋ  이시국에 .... 읍 ㅋㅋ,1
혼다,오딧세이,혼다는 바이크만 ㅋ,1
혼다,오딧세이,ㅋㅋ 차얘기 하기 어렵네요ㅋㅋ일제가 100좋음.디자인은 쫌? 구리네.,1
혼다,오딧세이,"그럼 넣지마~ ^^""",1
혼다,오딧세이,현대가 유튜브 고발하고 다니는데 타겟 되는거 아님?  현대차 인터넷 대응팀은 드럽게 바쁘것어.,2
혼다,오딧세이,장단점이 있구나. 카메라와 의자는 좋네. 4륜구동이 안되는 게 제일 큰 문제. 7인승도 너무 많다. 부부 자녀 1-2명이면 좌석 4개면 충분.,1
혼다,오딧세이,"디자인 외관 : 한국 승승차감, 주행 기본기, 공간활용 : 일본 승댓글들만 종합해봐도 디자인으로 정신승리하는 댓글만요약하면 한국차는 겉만 번지르르",14
혼다,오딧세이,실내 인테리어가 너무 평범에서 높아진 우리나라 사람들 눈에는 안차겠네,5
혼다,오딧세이,호주에서는 카니발이 오딧세이보다 많이 팔리는데...,3
혼다,오딧세이,초반은 장난치고 중반부터 찐이네 중형세단 같은 움직임 동력 ㅋ 그게 카니발에서 나오나??,1
혼다,오딧세이,엔진 미션 내구성  밸런스  오딧 압승  옵션 편으성  만 좋음  카니발글고  먼 카니발에 비비냐  챙피하다,2
혼다,오딧세이,일제잖아~~,1
혼다,오딧세이,요즘 무슨 일본차를 리뷰해 누가 탄다고 이제 일본차는 관심이 없어 미워서가 아니라 일본 자체에 대한  관심이 없다고 아저씨  요즘 일본차 타면 빙신같이 생각되는데 뭔 우리가 일본을 미워해,1
혼다,오딧세이,솔까 디자인은 기아가 일본차 잡아 먹지...,1
혼다,오딧세이,No Japan은 유치하지요. 일본 정치인이나 한국 정치인이나 수준이 원래 변변찮아서 거기에 놀아날 필요는 없지요,3
혼다,오딧세이,오디세이는 2열 좌석은 안타봐서 모르겠지만 카니발 2열 좌석을 타봐서 카니발 2열 좌석 안좋다는것은 알고 있습니다 멀미가 나서 힘들었거든요상용차에다가 타는 사람 신경 안쓰고 인테리어만 신경 써서 좌석을 붙인 것이 카니발 같습니다 저의 개인적인 생각이고 경험입니다저의 경험과 다른 생각을 가진분들이 있으시겠지만 저는 카니발 2열 좌석을 타본 기억으로 멀미가 너무 안좋았던 기억이 있습니다1열하고 2열하고 차이가 있습니다 카니발은요 오디세이는 모르는 상황이지만 아무래도 안좋은 경험이 있는 카니발 보다는 나은 차일것이라고 생각 합니다멀미가 심하신분들은 카니발 2열 오래동안 타시면 멀미 하실것 같아서 오딧세이하고 비교를 한다면 경험은 없지만 오딧세이를 추천 합니다,2
혼다,오딧세이,미국에서 누가 카니발삼? 다들 도요타 시에나/혼다 오딧세이 두개중 하나삼. 왜 그럴까? 타보면 카니발이 후지거든. 우리나라사람들만 호갱되서 결함이 그렇게 주구장창 나오는데도 계속해서 사주고 검증도 안된 차를 사전계약까지 해가며 마루타가 되가지고 온갖 고생 다겪고.,4
혼다,오딧세이,아 디자인 개구려 ㅡㅡa,1
혼다,오딧세이,수준이 참.,2
혼다,오딧세이,일본 극우가 문제지 일본은 문제 없죠.이거 구분 못하면 평생 이용당해요.^^;;,3
혼다,오딧세이,ㅇㄷ빼고다싫어요,2
혼다,오딧세이,디자인은 오딧세이보다 카니발이지....주행질감이 일본차가 가성비.값이라 고르는거지,2
혼다,오딧세이,기자님 일본차리뷰 했다고 악플달리니까 그거 의식해서요즘 일본차리뷰 하면서 일본차 은근 까는듯ㅋㅋ조금 소신은 없는듯 하네요,4
혼다,오딧세이,ㄲㅁ이었군...하...,1
혼다,오딧세이,응 일본차는 거르고,1
혼다,오딧세이,일본 자동차가 가지고 있는 기술은 우리나라도 배워야 합니다.,4
혼다,오딧세이,차가 무슨 거지같냐?,2
혼다,오딧세이,아...저게 5790만원이면...안사요 안사,8
혼다,오딧세이,"뭐 기자님 입장에서는 일본 메이커 차 리뷰가 이해가 된다지만,  비추 박고 안 보겠습니다.해외 채널의 일본차 리뷰라면 저도 볼지 안볼지 모르겠습니다. 불매의 최전선 분야가 차 아닙니까.불만보단 의견으로 봐주세요.",1
혼다,오딧세이,오빠 했네요,1
혼다,오딧세이,디자인 뭣같네,1
혼다,오딧세이,죄송하면 일본차 찍지 말던가,1
혼다,오딧세이,"객관작으로 오딧세이 시에나  퍼시피카 타던 사람은 카니발 못탑니다 ㅋㅋㅋㅋ 카니벌 보다 좋은 차들임 음,,,,특히 장거리 가보면 바로 답나옴 카니발은 한단계 낮은 등급 차라고 보면됨  그냥 닷지카라밴  흉내내본 차죠",3
혼다,오딧세이,편안한 승차감. 가족을 위해서 사고 싶은데 가족이 테러 당할까봐 못하겠네요. 이러니 세도나가 발전이 없지.ㅠㅠ,2
혼다,오딧세이,국뽕 떠나서 혼다는 아니지 않나 싶네요아무리 유튜이라도 일본차 선전은 하지 마시길 바랍니다,2
혼다,오딧세이,진짜 벨트라인 못생겼다,1
혼다,오딧세이,"최근에 구독하게 되었는데, 도요타 혼다 미쯔비씨등은 좀.. ^^;;",1
혼다,오딧세이,일본에 우리나라차 몇대 팔리지?일본차 타지 말자!,2
혼다,오딧세이,요즘도 일본차 타는 사람이 있나? 참~~~,1
혼다,오딧세이,DNR 쓸데없는 논쟁이죠...미국도 아닌 한국에서.... KIA는 미국에서는 굉장히 안좋은 말인데 잘 사용하고 있으면서 ...,1
혼다,오딧세이,일본차를 홍보하는 이유가 뭡니까....일본스럽게 만든차,1
혼다,오딧세이,"과도하게 편파적이네요.. 3열 접는것만 카니발과 비교해도 오딧세이의 완승인데. 2열 분리도 마찬가지고. ""실용""미니밴의 정석이거늘. 디자인과 보이지 않는 몇몇 마감으로 너무 카니발을 올려치기 하는건 아닌지?",5
혼다,오딧세이,일본 짜증남...,2
혼다,오딧세이,전 카니발 한표,3
혼다,오딧세이,이시국에 일본차.... 하지만 좋아요를 안누를수 없네요. 좋아요 꾹!,2
혼다,오딧세이,흔히들 카니발 이야기 하면서 뭐 넘사다 어쩌다 하는데. 솔직히 주행성이나 승차감쪽은 어쩔수 없다 봅니다.왜냐면 카니발쪽이 많이 불리 하거든요.일본이나 미국미니밴은 3열시트 구성입니다. 즉 바퀴위에 무거운 부분은 사람인데 이게 3열 구조란 겁니다. 무게가 많이 실리지도 않고 무게의 변동도 적죠.근데 카니발은 기본이 4열 구조입니다. 혹자는 7인승은 3열이지 않냐 하는데 차체 설계나 서스셋팅 같은거 솔직히 3열 4열 이거 다르게 하기 쉽지 않습니다. 승차감이나 주행성을 결정짓는 변수가 일본밴이나 미국밴은 3열을 염두에 두고 그걸 픽스한 상태로 모든것을 설계 하니 유리하지만.우리나라는 법과 세제 혜택을 위해 어찌보면 4열이 강제되는 구조입니다. 그러면 3열 디자인과 4열디자인 모두에 대응가능한 설계및 하체 셋팅 을 해야하고 이것에 대한 중간점을 찾을수 밖에 없죠.어찌보면 국내 법규때문에 나온 카니발과 그 법규에서 오는 국산 미내밴의 기형적인 구조에서 오는 어쩔수 없는 성능차이라고 생각 됩니다.3-4열 까지 변동되는 시트 배열 구조에 대한 대응 설계와 오로지 3열을 고정하고 설계하니 승차감 셋팅이나 주행 안전성 등 셋팅이 3열을 고정하고 설계한쪽이 훨씬 정교하게 가능하겠죠그렇다고 3열 시트차와 4열시트차의 스프링이나 쇽업셔버는 바꿀수 있어도 로어암 어퍼암의 두께나 위치 각도 이런걸 다르게 만들순 없으니까요.다만 그덕에 4열구조를 가지면 9인승의 구입당시 7인승대비 조금이라도 싼 가격과 9인승부터 시작되는 버스전용차선 11인승까지 가면 아예 승합차 세금이라는 타사 3열미니밴이 가질수 없는 장점도 있으니까요.,2
혼다,오딧세이,도대체 언제까지 이시국에 해야하는지,3
혼다,오딧세이,불매운동 이제 시들해졌나요,1
혼다,오딧세이,요즘 같은 시기에 전범기업 차 소개라니~이건 아니지요~,1
혼다,오딧세이,솔찍히 댓글이 이모양이니 ㅋㅋ 리뷰하실때 조심하는게 눈에 보인다 아무리 그래도 직접 타봐라 차를 잘모르는 내가 타봐도 ㅋㅋ 왜 미국에서 잘팔리는지 느끼는데 10분도 안걸렸다ㅋ,9
혼다,오딧세이,"일본 불매를 구닥다리로 만들어버리시네요... 아무리 세계화가 되었지만, 이런 걸 일본이 좋아한다는 걸 모르시는 모양인 듯~!   많이 아쉽습니다.",2
혼다,오딧세이,잉 일본차?,8
혼다,오딧세이,거지같은 일본차네 ㅋ,2
혼다,오딧세이,카니발 승,6
혼다,오딧세이,이 시기에  일본차 사라고? 자제를 좀! 칭찬하던 비판하던  그것은 홍보입니다.,3
혼다,오딧세이,아직도 악플 다는 사람이 있네 ㅋㅋㅋㅋㅋㅋ 일본 정치인이 문제 이지 국민들은 잘못없어 오직 자국 이익대로 움직이는거야,3
혼다,오딧세이,아무리그래도 일본제품을 사면 총칼이 되서 우리한테 겨눕니다.,2
혼다,오딧세이,뜬금없이 죄송하게 태클을 걸자면말씀하신대로 덮어놓고 일본 망해라 할 일은 아닌데...자동차 분야가 노재팬을 해야하는 항목인것도 사실이지요(물론 선택은 각자 개인이 알아서)근거는 일본 내의 한국차 판매량...,3
혼다,오딧세이,그런게 아니라 우리가 쓴 돈이 일본 극우 단체로 흘러간다는게 문제점으로 보는 거 아닌가요. 극우단체의 입김이 일본 정부에 상당부문 영향을 미치고.. 차 자체의 리뷰가 무슨 문제가 있겠습니다만은 ㅎㅎ 극우 단체가 하는 일에 대해서는 일일이 말하지 않아도 되겠죠내부공간이 실용적으로 잘 짰네용,2
혼다,오딧세이,아... 이런 일본차... 나오는걸로 구독취소 합니다... 에이 안보고 말지 이런걸 소개하나,1
혼다,오딧세이,"어휴.. 일본 제품만 나오면 발작하는  불매선동, 노재팬 타령하는 뎃글이 있네... 언제 정신차릴래?",12
혼다,오딧세이,다시는 안하셨으면,5
혼다,오딧세이,댓글에 반응이 너무 시끄러워 구독취소. 추천안함 때리고갑니다.,11
혼다,오딧세이,진택기자님 좋은데. 일본차는 하지마세요.  미워죽겠어. 아니야,6
혼다,오딧세이,디자인이 산으로 가는구나. . 그래도 일본차는 리뷰 하지맙시다,2
혼다,오딧세이,이시국 드립 좀 그만했으면 좋겠네.결국 민주당 선거전략 반일선동이었는데 ㅉ,9
혼다,오딧세이,매우실망매국노도 아니고구독취소 고민중,9
혼다,오딧세이,"2014년형 오딧세이 타다가 이번에 2021년형으로 바꿨는데 너무 맘에 듭니다.특히, 승차감 짱입니다. 조용하고, 핸들링, 코너링 너무 좋구요..  그리고 Sport 모드로 했을때 미니밴이지만 그래도 운전하면서 박진감을 느낄 수 있어 좋습니다.",21
혼다,오딧세이,기자님 시승기 잘 봤구요. 다음부터는 진동측정기+소음측정기 구비 하셔서 같은구간 같은속도로 측정하시면 더 객관적이지 않을까 싶네요~,7
혼다,오딧세이,시승기 정말 잘봤습니다. 기자님도 시에나하브의 일명핸드폰진동으로 불리는  2열시트의 진동을 경험하셨군요.,13
혼다,오딧세이,좋은리뷰감사드립니다. 카니발에 욕심을 부리다가 오딧세이와 시에나로 관심이 가기 시작하네요,19
혼다,오딧세이,오디세이 2열은 시트를 가운데로 좀 이동하면 시트를 뒤로 엄청 많이 눕힐 수 있습니다.,13
혼다,오딧세이,갈등 많이 했는데 출퇴근과 캠핑을 위해 시에나로 결정!비교 감사드립니다~~,14
혼다,오딧세이,이분 참 목소리도 차분한게 비교시승기 짱~이네요....디쟌측면으로 봐서는 시에나...요즘 대세인 하브로 봐서도 시에나인데...갠적으로는 오디~~~로 맘이 간다는...기아 카니발은 아직 수준이 ㅠㅠ,15
혼다,오딧세이,오딧세이도 풀체인지가 나와야 할듯하네요~,5
혼다,오딧세이,한가지 빼먹은게 있네요 오딧세이는 가운데 보조시트 탈착하고 좌우 시트를 조금만 중앙으로 이동하면 거의 풀플렛으로 누울수 있습니다.,3
혼다,오딧세이,"2열 시트 진동에 대해 언급해주는 기자,유투버는 못 본거같은데 말씀해주셔서 감사합니다 4륜 대비 2륜이 진동이 더 심하다고합니다저도 시승을 4륜으로만 하고 계약은 2륜으로 했는데 취소해야하나 고민이되네요",8
혼다,오딧세이,궁금한 게 하나 있는데 두 차량 전반적인 비교가 아닌 2~3열만 비교한 이유가 있나요? 제가 알기로는 23열만 비교했을시 오딧이 압승이거든요 그럼에도 많은 사람들이 시에나 하이브리드에 더 많은 관심이 있는걸로 아는데..  전반적인 내용을 다루셔야 좀더 객관적 정보전달이 될듯합니다,13
혼다,오딧세이,"요즘 미국에서는 하이브리드 시에나가 훨씬 많이 팔리는것로 보입니다. 오딧세이 전 모델 235,000마일 타나가 엔진문제로 팔았는데 14년 탔는데 요즘은 시에나가 더 좋은것 같네요.",4
혼다,오딧세이,정말 궁금했던 리뷰네요. 시에나 4륜에 대한 만족감이 얼마나 될지도 궁금하기는 합니다. 두차량의 비교에서 시에나가 갖는 강점도 4륜;;; 소비자 입장에서는 그러니까요.2열의 승차감에 대한 내용에서 시에나는 완패네요,1
혼다,오딧세이,꼼곰한 시승식 잘보아서  구독합니다. 감사,1
혼다,오딧세이,정말 좋은 리뷰 였습니다ㆍ감사 합니다ㆍ,3
혼다,오딧세이,비교시승 잘하기로 유명한 로드테스트비교시승맛집입니다.,7
혼다,오딧세이,와 기다렸어요. 구매고려중인데 좋은 리뷰 감사합니다.,3
혼다,오딧세이,덕분에 잘보고 갑니다! 2열 시트 각도조절이 아닌 앞뒤로는 움직이지 않는 고정일까요~?좋은 영상 감사합니다!,4
혼다,오딧세이,에어컨 송풍구가 천장에 있는 경우 더 시원할거 같지만~~ 여름에 지붕쪽으로 계속해서 뜨거운 열이 전도 되면서 덜 시원한 바람이 내려오더라구요. 저는 카니발 오너로서 천장도 좋지만 직접적으로 바람을 맞는 위치가 여름에 에어컨 을 사용할 때는 더 좋아 보입니다.,8
혼다,오딧세이,좋은영상 너무 감사합니다 ^^,2
혼다,오딧세이,"K9 3.3GDI 타다가 애셋 카시트 설치해야해서 오딧세이, 시에나하리 모두 시승하고 오딧세이 출고했습니다. 연비와 3열 공간만 봤습니다. 개인차가 있지만 연비 빼고는 오딧세이가 훨씬 좋았습니다. 특히, 시에나하리의 방음상태는 창문이 열려있는듯한 느낌을 계속 줍니다.",2
혼다,오딧세이,오딧세이 하이브리드 나오면 진짜 완벽한 미니벤일 듯,30
혼다,오딧세이,연비 때문에 데일리카가 도요타 하이브리드다보니 참 많이 고민하다가 다음주 오딧세이 받습니다. 시에나의 진동은 제 경험상 2만키로정도 타면 질이드는지 진동이 많이 줄어드는경향이 있습니다. 물론 겨울은 피해갈수없었지만 나아지니 진동으로 고민하시는분들께는 참조되셨음 합니다. 저는 도요타 엣킨슨 엔진을 느껴서 가족차는 매일타지 않아 편안함을 택했습니다.,3
혼다,오딧세이,시에나 하이브리드 4륜구동은 2륜구동보다 2열시트 진동이 많이 개선되었을까요? 솔직히 저는 시에나쪽이 더 끌리긴 하지만 2열시트 진동때문에 고민이 되네요.,6
혼다,오딧세이,오딧은 대체 2열 레그룸을 왜케 좁게만든건지 쏘렌토보다 좁음. 레그룸만 보면 투싼수준임. 3열접고 2열 넓게 쓰는 수요가 의외로 많은데 아쉽네요,5
혼다,오딧세이,"오디세이 2열 시트 더 뉘어지지 않나요~?미국에서 산 오디세이라 차이가 있을지 모르겠는데, 2열 간이좌석 빼고나서 옆으로 슬라이딩하면 뒤로 거의 누워집니다",5
혼다,오딧세이,시에나 오딧세이 파일럿 타보다 파일럿으로 왔는데요. 사실 다 좋아요. 다만 뒷자리 편리함은 혼다가 더 배려하는거 같고. 연비같은 효율은 아무래도 도요타 특기죠,2
혼다,오딧세이,오늘 시승하고 와서 글 남깁니다 2열 시트 흔들림 정말입니다... 첫째가 멀미 난다고 하더라구요 찾아보니 여기서 정확하게 이야기하고있네요,5
혼다,오딧세이,"모든 단점을 감안하고도 남는 다섯글자, 하이브리드!!!",2
혼다,오딧세이,여기가 그 유명한비교시승 맛집^^인가요?오늘도 유익한 영상 잘 보고 갑니다감사합니다,3
혼다,오딧세이,"강준기 기자님. 비교 시승 영상 잘 봤습니다. 시에나 하브 2열 진동 관련 궁금증이 있습니다. 영상에서 직접 말씀하신 표현을 빌리자면 ""확실하게 진동이 느껴진다."" 라고 하셨는데요.동호회에서 언급되는 진동 관련 글을 먼저 보셨기 때문에 느껴지신게 아닌지요? 글을 미리 보지 않고 탑승하셨다면, 못 느끼실 수준이지 않았을까요?노면의 잔진동이 2열 (미니벤 2열은 상석이죠)에 핸드폰 진동처럼 드르르르 오면, 사실 장거리 여행 때 굉장히 피곤함을 느낄 듯 합니다.그러면 사실 미니벤 차량의 중요한 한 부분을 잘못 만든 것이라 생각되어지고요. 차후 개선이 될지 리콜이 될지도 지켜볼 이슈일듯 하구요.오딧세이와 비교했을 때의 상대적 진동인지, 그냥 일반 여러 대중들이 타고다니는 자동차 기종이랑 비교해봐도 좀 특징적이고 이질적인 진동이 있었는지 궁금합니다.있는 그대로 기자님의 느낌을 전달 받고 싶어서 여쭤봅니다.",6
혼다,오딧세이,"후기 너무 감사합니다. 셋째 예정이라 둘 중 구매하려고 하는데요. 혹시 시에나 2열 진동이 없다면 높은 점수를 줄 수 있을까요? 머리로는 오딧사야하는데, 외관이 시에나 취양이라 너무 고민되네요",2
혼다,오딧세이,캐나다에서 오딧세이 탑니다. 일본차 안사려고 했으나 이만한 차가 없더라고요. 개떡같은 캐나다 도로노면을 정말 스트레스 없이 잘 타고 다녀요. 탄탄한데 부드럽습니다. 연비는 아쉽지만 고속도로위주 주행이라 12키로정도 나옵니다,15
혼다,오딧세이,오딧세이도 조만간 하이브리드 트림이 나오지 않을까 생각합니다하이브리드까지 되면 가장 완벽한 가족용 미니밴이 되지 않을지?혼다는 하이브리드 기술도 세계최정상급이죠,14
혼다,오딧세이,회사차로 오딧세이 시에나 카니발까지 타고있는데... 국뽕만 걷어내면 이급에선 오딧세이 시에나가 최고입니다 카니발 못따라와요 왜 오딧세이 시에나가 북미서 많이 팔려나가는지 이해가됨,7
혼다,오딧세이,아니 자동차 관심이 많아서 여러 영상 봤는데 못소리는 여기가 진짜 최고네,1
혼다,오딧세이,시에나는  2열 시트에  진동와셔랑   고무판좀  덧대야할듯..,4
혼다,오딧세이,2열시트가 탈거 되는 차와 그렇지 않은 차는 미국에서 용도가 조금 다름 주거 환경에 따라 큰짐 싣을 일이 많아서,1
혼다,오딧세이,저는 혼다 오딧세이 디자인이 무난하고 좋은듯.,2
