car_brand,car_model,comments,likes
도요타,코롤라,"캠리 하이브리드를.... 쏘나타 하이브리드에... 누가봐도 그랜저,k7급이죠... 그랜저,k7 하이브리드 정돈 되야 동급으로 봐줄듯 해요..",12
도요타,코롤라,열선핸들 통풍시트 넣어주면 진짜 소원이 없다,4
도요타,코롤라,통풍시트만 있으면 캠리 우리나라에서 두배이상 더 팔린다.,17
도요타,코롤라,캠리 사야겠다~,4
도요타,코롤라,한국은 못따라갑니다.일본차 정비소 안가는거 있어서 너무좋아요..,2
도요타,코롤라,일본차가 내구성이 좋지만 일본인은 오래 차를 타지 않는다 근데 일본은 차를 잘 만드는가?한국은 왜 일회용 차를 만드는가? 너무 궁금합니다,14
도요타,코롤라,다음차로 혼다나 토요타 하이브리드 생각하고  있습니다  현기는 믿음이 안가서,51
도요타,코롤라,그랜저하이브리드랑 비교하면 어떤가요?,12
도요타,코롤라,돈있으면 도요타보는게 맞다본다,2
도요타,코롤라,코너링 직진 추종성 이런거  어코드가 완승,3
도요타,코롤라,얘네도 급발진 호갱님 탓인가요?? 불나지 않는게 최대장점인듯,2
도요타,코롤라,저돈이면 그랜저 풀옵이구나..,5
도요타,코롤라,es 살바에 캠리사고 차액으로 기름값하는게 최고라 카던데..,3
도요타,코롤라,겨울엔 관리안하면 연비 반토막나요,2
도요타,코롤라,에어백이 왜 안터지죠? 고객님 각도를 잘못 맞췄어요,2
도요타,코롤라,일본제품이 좋으면사는건 당연하다 소비는 자유이지만내부가 너무 2002년도네…. 일본차는 인테리어 신경안쓰나보네 하이브리드에관심많아서 보는데 일본차들 내부왜이럼…,27
도요타,코롤라,좋긴해..,13
도요타,코롤라,캠리 순정 내비는 어디껀가요?,2
도요타,코롤라,아참  캠리는 통풍~ 엉덩이  땀난다,4
도요타,코롤라,실내 대박이네요,6
도요타,코롤라,이돈이면 그랜저란다 ㅋㅋㅋㅋ 해외에서 팔리지도 않고 2.5는 내수용만 파는 쓰레기랑 해외에서 잘팔리는 캠리랑 비교가되냐... 차를 내부만 보고 타니...,33
도요타,코롤라,열선핸들도 없다면서요ㅜㅜ,4
도요타,코롤라,클리앙이라고 거기는 현기하이브리드가 이미 우주명차에 토요타 기술이나 성능을 앞섰다고 얘기하던데요뭐가 맞는얘긴지;;,1
도요타,코롤라,오 캠리,1
도요타,코롤라,내 차 연비 3배네 ..,6
도요타,코롤라,우리나라가 일본차 따라잡을수있을까 가격은 따라잡긴 했는데,22
도요타,코롤라,"나도 극일주의자 이지만 Toyota와 현대차를 비교하지 마라! 뭐 상대가 되야지. 실내구성 이라구? 너 같은 머저리 때문에 현대차가 팔리는거야. 편의장치 만 주렁주렁 달고 엔진, 구동장치, 내구성 은 완전 똥차 이잖아! 너 같은 애들 타라구 현대가 차를 팔아 먹는거야!",3
도요타,코롤라,한국이니까 그랜저 소나타가 비비지.. 해외에서 비교하면 그랜저 소나타는 비비지도 못한다..차를 대충 생긴것만보는 차알못들이나 소나타랑 비교하겠네,3
도요타,코롤라,머리는 원하지만 가슴에서 멈추는 일본차..,40
도요타,코롤라,캠리좋은거알아 그런데 .......  난 k8계약함........  아  나도 사람인지라  3년을 저   실내에서  생활하려니  심장이 답답하다...,3
도요타,코롤라,현대는 일본에 비하면 디자인 말고는 그다지 볼것없는 것 같다. 우리나라에서나 어쩔 수 없이 타는 차.,11
도요타,코롤라,NO JAPAN을 극복할 정도의 상품성은 아닌 것 같습니다.어짜피 장기간 운행하면 공인연비에 수렴합니다.,6
도요타,코롤라,NO KOREA(N),1
도요타,코롤라,유튜브 왜 찍나여? ㅋㅋㅋ 직업 없나여?,1
도요타,코롤라,일본차 시승기 리뷰도 하시는구나... ㅜ,1
도요타,코롤라,내가 한국사람이 아니라 다른나라 사람이였으면 무조건 일본차 산다,15
도요타,코롤라,여기 댓글 상당수는 그냥 아는 사람들이 광고로 댓글 단 것 같네 ㅎㅎㅎ 참나..  티가 좀 나..,2
도요타,코롤라,"아베싫어요, No No Japan.",3
도요타,코롤라,참.... ...,6
도요타,코롤라,그래 일본놈들 하이브리드 차 잘 타고폐차  할때까지 타라중고차는 절대 못팔아 처먹을 꺼다,2
도요타,코롤라,말 더럽게 못하네 같은 용어를 반복하지 말고 하나씩 또박또박 얘기하는 그런 습관을  가져요,1
