car_brand,car_model,comments,likes
볼보,V60,최근 출시한 XC60에 T맵은 적용이 안되었나봐요ㅠㅠ,3
볼보,V60,"이렇게 보게 될줄이야^^;; 고민하고 있는 차종인데 반갑네요, 잘지내셨죠?",2
볼보,V60,손 따뜻하게 하는 핸들열선 기능 있나요?,3
볼보,V60,1열 이중접합 유리라고요? 혹시 v90하고 헷갈리신거 아닌가요?,4
볼보,V60,볼보 고급유넣어야 한다는데 맞으실까요?,2
볼보,V60,티맵이 안된다면무선 안드로이드 혹은 애플카플레이 되나요? 유선으로라도요!,2
볼보,V60,V60 계약한지 이제 두달… 제차는 언제 나올지 ㅋ,2
볼보,V60,4:27 문짝 수납공간에 말보루라이트!,2
볼보,V60,"힘들다.,.",3
볼보,V60,좋은 리뷰 감사합니다 차 바꾸고 싶어서 영상 잘봤습니다~,4
볼보,V60,볼보는 차가 무거워서 운동성능이나 연비가 좋을 수가 없어요. 대신 안전성으로 승부하죠.,1
볼보,V60,B5 출고1개월차 오너입니다. 장단점은.. 가속 및 전륜치고 운동성좋고 인테리어와 오디오 시스템. 편안함이있겠고 비슷한 가격대에 수입차대비 옵션..단점은 이중접합유리가 아니여서 고속주행에서 외부소음.. 아스팔트가 아닌 도로 콘크리트에서의 하부소음. 볼보 온콜부재. 그리고 출퇴근 60KM정도에 외곽도로 80% 시내주행 20% 기준으로 14이상 나옴.. 어떻게 운전을하셨길래 저리 연비가 안나올까? 생각해봄,8
볼보,V60,고속도롤주행했는데 복합연비가 저정도수준밖에 안되는건 의아하네요,8
볼보,V60,S60 계약하고 대기중에 있습니다. 희소성및 카푸어들이 타는 차가 아니라는 생각에 선택했는데 연비도 부담인데 고급유까지 넣어야돼서 좀 부담스럽네요.,17
볼보,V60,도심에서는 연비가 평균 10.3 나오고 있습니다,1
볼보,V60,잘 보고 갑니다!,2
볼보,V60,센타페시아  공조장치가  다이얼과  버튼식이  없어  후회됩니다. 주행할때 모니터 조작이  넘  불편한  오너입니다.,3
볼보,V60,가끔 이영상 저영상 여러 유튜브보면 항상 느끼는데 패들시프트를 부재나 크기 위치 운운하던데 막상 패들시프트 주변에 쓰는 사람 별로 없음..,7
볼보,V60,s60 가격대비 옵션이나 공간등 괜찮아서 관심 가지는 차종중에 하난데 볼보 서비스센터 수준이나 유지비 많이 들까요?현재 그랜저ig타고 있습니다.,2
볼보,V60,솔직히 독일삼사  차량들이 너무 흔하다보니  볼보차를 보면 꽤 신기합니다.. 안전의 볼보..카시트의 끝판..뭔가 묵직한 이미지가 참 좋은데..국내에선 마케팅이 좀 ...볼보차 오너들 존경스럽습니다.중고가.브랜드네임  따위 신경안쓰고오직.  안전과  자신의 만족감 으로구매해 타시는것이 상남자 같습니다.아주 특별하지도 않고아주 허접하지도 않고너무 튀지도 않고그저.. 기본에 충실한 차...볼보가 더 흥하기를 기대합니다.,10
볼보,V60,v60 보고 왔는데 s60이 쏘나타급은 된다고 하시는데ㅠㅠ v60은 쏘나타보단 작은건 인정하신다고 하셨거든요?? 어떻게 받아들여야할까요? 보기엔 v60이 더 커보이거든요..,3
볼보,V60,꼭 고급유 넣어야 하나요 ? 이달에 차 나오는데.,6
볼보,V60,"S90 시승했습니다  바닥소음...불편하면또...볼보 오디오 시스템  조은평가하지만전 시승때 노면소음 과 오디오스템 동시에하니가 전불편 했습니다 또..,네비 에서도 불편하더군요..??저두 90대기자입니다  취소생각중입니다..!",4
볼보,V60,굿,1
볼보,V60,가격이 너무 비싸.,2
볼보,V60,ㅋㅋㅋ8개월되가는데.차가안나옴 ㅋㅋㅋㅋㅋ앰병 ㅜ,5
볼보,V60,"우리나라에 수많은 자동차 리뷰가 있지만, 그 중에 No.1은 김한용의 MOCAR 입니다. 내용이 알차고 편안한 진행 너무 좋습니다. 2021년도 재미있는 리뷰 부탁 드립니다.",8
볼보,V60,최고의 자동차 리뷰어!!! 30분 이상의 자동차 시승기를 skip없이 들은 것은 이 시승기가 첨이네요. 군더더기 없는 깔끔한 리뷰.. 최고에요!!,26
볼보,V60,"김한용님의 리뷰인만큼 정보전달력은 최고네요. 아쉬운건 볼보의 고급유 사용에 대해서 언급될줄 알고 영상 내내 기다렸는데, 별다른 언급이 없네요. 권장이 아니라 반드시 고급유 주입이라는 말이 있어서 김한용님의 의견을 들어보고 싶었습니다. 실구매를 생각할때 되게 중요한 요소라 확실히 알고싶네요.",3
볼보,V60,"ㅋㅋㅋ엄청 사랑스럽게 말씀하시네요~  안전성,브랜드,디자인,가격,옵션 제 기준 정말 베스트 카입니다! 아쉬워 보였던 실내 마저 이젠 괜찮아보여요~",7
볼보,V60,며칠전 지인이 신차 뽑아서 타봤는데  하체가 아주 단단한 느낌이 나고 안정감있고 좋더라고요.,1
볼보,V60,"볼보 xc60t6오너입니다.  굉장히 만족하면서  타고 있구요. 출고 6개월만에 벌써 2만키로가 되어가네요 ㅎㅎ 모카에서 볼보에 대해서 많이 알려줘서 많은 도움이 되었습니다. 아는만큼 보인다고, 몰랐던 부분을 알려주시니 볼보차와 볼보회사에 대해서 더욱 더 애착이 갑니다.항상 재밌게 잘 보고 있습니다. 감사합니다.😘",1
볼보,V60,진짜 실내 너무 괜찮다 깔금한테 우드느낌 좋고 시트 가죽도 좋고 예쁘네 차가...,24
볼보,V60,아....볼보타고싶다 진짜....... 10년이지나서 돈이 모인다면 중고라도 볼보산다. 진짜 안정감들어서 탈때마다 만족감들듯..,2
볼보,V60,"진짜 옛날 볼보 디자인은.... 10년전차가 아니라 한 2,30년되보이는 디자인이였죠",2
볼보,V60,볼보 시승기 넘 재밌게 잘봤습니다! 갖고 싶어지네요.ㅎㅎ 저는 다른 모델 생각중이지만 s60 B5도 너무 이뿐데요 실내도 깔끔하고 고전적이공ㅎㅎ음향도 짱짱 좋고...볼보 최고 좋음!,4
볼보,V60,진짜 볼보의 여러 정보 간결하고 이해하기 쉽게 최고 리뷰입니다~~!,1
볼보,V60,몇년까지만해도 구형같은느낌이 들었는데 지금은 디자인 레전드,37
볼보,V60,캬... 시승기에도 깊이가 있네요.  감사합니다.^^,5
볼보,V60,"와 매일 동영상이 올라오네요. 시간을 지키시니 대한민국 지존의 자동차 리뷰어, 기자가 되실겁니다.",9
볼보,V60,디자인과 브랜드감성이 많은 일 하는 차 S60,1
볼보,V60,볼보 매우 멋진 자동차 메이커네요 ㅎㅎ 영상 잘 보고 갑니다.,1
볼보,V60,아 진짜 다른차 다 필요없어..볼보가 제일 이쁘다.. 😍,8
볼보,V60,부지런한 모카👍🏻채찍 맞는 편집자님... ㅋㅋㅋ 항상 고생 많으십니다🙋🏻‍♀️,4
볼보,V60,볼보의 미니멀하고 클래식한 디자인이 좋아서 샀습니다. 요즘차들 유행따라간다고 차에다 기교를 너무 부려놔서 금방 질리는데 볼보는 기교가없어서 좋아여 거기에렉서스 사려고 시승식 햇다가 버튼이 너무많고 씨디플레이어 있는거보고 놀랐네여...심플한 인테리어의 볼보 굳,2
볼보,V60,우왕 디자인 너무 이뻐요~~,1
볼보,V60,와...죽인다진짜.. 요즘 차사고싶어서 불사조형따라서 주식으로 돈 모으는 중인데 빨리 사고싶네여.. 진짜 잘보고갑니다...ㅎㅎ,2
볼보,V60,S60 인스 계약하고 이제 한달 지났는데 이거보니  더 기다려지네요 ㅠㅠ 아직도 4~5개월 더 기다려야하는게 함정  대기 기간이 너무 길어서 환장하겠네요,4
볼보,V60,"수입차, 볼보....4800 만원이면 .............  진짜 저정도 스펙이라면  합당한 가격같은데.",1
볼보,V60,볼보는 깔게 없다. 안전벨트 최초로 개발하고 특허 풀어줘서 수 많은 생명을 살려낸 공로만 해도 그냥 칭찬만 받아도 되는 회사.,3
볼보,V60,잘봤습니다 이해하기 쉬운 설명덕분에 차알못이 배우고 갑니다,1
볼보,V60,한용이형 투아렉 시승기 때와 같은 스타일 영상이 너무 좋아요!!,16
볼보,V60,"볼보를 사는 이유는 첫번째 동급최고수준의 안전사양, 두번째 동급최고수준의 럭셔리한 인테리어, 세번째 압도적인 사운드의 바워스앤윌킨스 오디오 거기에 디자인까지 차분하고 고급지다.",5
볼보,V60,Volvos are true dream cars.,1
볼보,V60,"XC90 사려고 시승 해봤는데 너무 고급지고 느낌이 깊어서 놀랐고 진짜 프리미엄 느낌 좋았습니다..... 헌데 저 터치스크린 방식이 너무 메뉴 하나하나까지 조절 하기가 어려워서 고민 되더군요. 결국 렉서스 RX 로 갔습니다. 또 한가지는 생각보다 실내 소음이 좀 크고, 사이드미러쪽 풍절음이 높아서 패스 했습니다. 매일 사용하고 느끼는 부분이 구매에는 제일 중요한 부분인거 같습니다.",2
볼보,V60,볼보는 독일 거리에서도 고급스러워 보여요 🥰,4
볼보,V60,17:00 역시 볼보... 가끔 왜 헤드레스트가 일체형일까 생각했는데 이런 깊은 이유가... 역시 볼보다... 내 드림카 V60cc S90 진짜 사고 싶어지네,5
볼보,V60,"전 차에 특별히 일가견 있는것도 아니고, 렌트카 직원으로써 왠만한 차는 운전 해봤다 정도지만...개인적으로 벤츠 a클래스와 비슷한 가격대비 가성비 측면에선 볼보가 우위인듯 하네요.",1
볼보,V60,볼보의 단점은 안전이 커버를 하니깐 이해가 크게 된다는 장점이 있네요~ㅎ단점은 예전에 볼보가 돈이 많이 없었던 회사다보니 앞으로 점차 개선되면 벤츠 아우디 비엠보다 훌륭한 차로 바뀔거 같아요~ㅎ,8
볼보,V60,한용이형 영상 잘 보고있습니다 감사합니다.,1
볼보,V60,진짜 궁금한게 있는데요~속도제한이 180이면...내리막 길에서도 속도가180이하로 유지되는 건가요?,2
볼보,V60,정말 좋은 차 소개영상이네요.,2
볼보,V60,볼보구매 그 어느 전시장 딜러분들보다설명을 너무 잘해주셔서 저같은 여성들에게너무 도움됩니디다. 진짜 감사해용,2
볼보,V60,비싸기만 하고 안전하지 않은 차와 안전하고 좋은차의 가격 차이가 너무 크다.,1
볼보,V60,와..... 볼보차 최고의 리뷰네요,4
볼보,V60,S60 cc 다시 만들었으면 좋겠네요한때 제 드림카 였는데,1
볼보,V60,얼마전에 본 것 같은 영상이지만 또 보네요 ㅋㅋ겨울에 가장 잘 어울리는차..내년 겨울에 사야겠다,7
볼보,V60,볼보가 겨울인데도 불구하고 섬머타이어를 끼워준 이유는 한번 사고가 나서 진짜 안전한가 판단하라는 의도같습니다,2
볼보,V60,차 진짜 기깔난다..,8
볼보,V60,인테리어만 한번 바뀌면 계약하러 가야겠어요~오늘도 잘보고 갑니다.,2
볼보,V60,자동차 리뷰의 바이블 같은 김한용 님! 잘 보았습니다.,3
볼보,V60,옛날 볼보디자인도 매력 많음,2
볼보,V60,이 형이 리뷰에서 좋다고 하면 다 사고 싶어져서 견적 뽑게 된다는거..,2
볼보,V60,볼고온콜이나 티맵 업데이트 진행현황도 알려주셨으면 더 좋았을거같습니다구매대기자로써 가장 궁금한 사항이에용,3
볼보,V60,볼보안전성 검증 방송뜨구 호응얻어서 리뷰까지~볼보 좋은차 인즈엉~👍👍,5
볼보,V60,볼보 정말 믿음직스런 최고의 차,1
볼보,V60,볼보도 엄청투박하게 픽업트럭 만들면 좋겠다,3
볼보,V60,이번리뷰 젤 잘봤습니다  많은것을 배우고 갑니다,1
볼보,V60,정말 사고싶은 차네요,2
볼보,V60,옛날엔 볼보하면 그땐 진짜 어려서 포크레인 회사로 밖에 몰랐는데 ㅋㅋ,11
볼보,V60,진짜 좋은차,2
볼보,V60,스웨덴이 참 대단한거 같습니다..전투기를 만들수 있는나라....,2
볼보,V60,오디오가 진짜 좋다... 사고싶다!!,1
볼보,V60,B5 모델의 '퍽소리' 이슈에 대해서도 꼭 다뤄주셨으면 좋겠습니다.,1
볼보,V60,모카님 착한 이경규 같은 느낌이 드네요 볼보 정보 많이 얻고갑니다 👍,1
볼보,V60,모트라인 순한맛 ㅎㅎㅎ 조곤조곤하게 볼보 서비스정신 잘까시네요~~ 진짜 차를 잘만들어도 서비스 정신좀 투철하게 했으면 좋을 브랜드,3
볼보,V60,2:25 진짜 엠블럼 차이가 엄청나구나.. 이 정도일줄은 몰랐네 ㅋㅋㅋㅋㅋ,331
볼보,V60,지난주에 계약했는데 ㅎㅎ 반년은 기다려야할듯 합니다만 언제 시승기 뜨나 기다리고 있었어요. 감사합니다,1
볼보,V60,오 볼보 차가 다르게보이네요. 그냥 저렴한외제차인줄알았는데. 가성비가 끝내주는 차인것같아요. 다음에 외제차는 볼보구매해야겠네요,4
볼보,V60,오디오 하나는 진짜 인정합니다.  초강추!,1
볼보,V60,본사는 아직 스웨덴이지만 2010년부터 중국그룹 길리홀딩스가 사서 현재까지 주인인걸로 알고있습니다. 안정성과 디자인때문에 사고싶었는데 중국회사기 주인이라고 해서 사기가 꺼려지네요,1
볼보,V60,맨첨에 뒷짐지고 둘러보는 애기기자님 왤케 귀여워요ㅋㅋ볼때마다 초딩 어린이같은데 전문적인 얘길 해주니 이질감 느껴지면서 역시 귀엽습니다,1
볼보,V60,믿고보는 한용 리뷰,4
볼보,V60,와 현실 드림카 ㅠㅠ,4
볼보,V60,센서스 화면에 메뉴들은 휴대폰 앱처럼 꾹 눌러서 마음대로 위치 이동 및 구성이 가능합니다XC60 18년식 2년 넘게 타고 있는데 대만족입니다 ^^,1
볼보,V60,아우디+BMW 같아..디자인 넘 이쁨,7
볼보,V60,스피커는 진짜 좋은듯하다. 디자인은 내 취향저격이네;;; 볼보오 이대로만 가다오. 내집마련 먼저하고 갈텐게!!,3
볼보,V60,계기판과 디스플레이는 화려함 보다는 직관적이고 심플한게 운전할땐 더 좋을듯.... 갠적으로 지금의 볼보식 계기판이 더 나은듯,1
볼보,V60,김한용 기자님 아주 잘보고있습니다S90 T8. 차주입니다스피커 퍽서리 아주 큰 문제입니다소리가 너무커서. 사고난줄 압니다안전을 최고로 추구한다던 볼보가퍽서리에 대해 해결책도 없고 고지도안하고 차을 계속 판매하는건 문제라 생각합니다이문제에  한번 다려주셨쓰면합니다기자님 처럼 영양력 있는분이 찰영 한번해주세요소수에 차량에서 나는소리가아니고 상당이 많은 차들이 소리가 납니다,2
볼보,V60,베터리가 뒤에 있어서 후방 추돌시 뒷사람에게 물어내라고 하면 돼 ^^ 역시 모카.,3
볼보,V60,저기 기어봉이 실제 크리스탈이라 하던데요 ㅎㅎ이 색은 또 다르네요. 다른데서 아이보리 색 보고 왔는데 그 색은 화사하고 고급저 보이던데 이 색은 편안하고 올드해 보이긴 하네요.,2
볼보,V60,사고싶다... 다음차는 볼보,2
볼보,V60,"대표님ㅎㅎ S60과 C클래스 중에 고민이 크네요, 아니면 조금 더 보태서 E250 이나 K7이 좋을까요? 아무분이나 추천 부탁드립니다!",2
볼보,V60,볼보 V60 너무 사고싶은 차인데돈이 없네 ㅠㅡㅠ,1
볼보,V60,카시트의 올바른 사용법에 대해서도 (혹시 아직 안 안 하셨다면) 올바르게 알려주세요 :) 한국은 솔직히 많이 엉망인 것 같습니다,1
볼보,V60,S60 뒷자리가 각도가 넘 세워져있어서 아쉽더라구요,6
볼보,V60,이 세상에 탈만한 차는 볼보밖에 없다,2
볼보,V60,센터페시아이콘들 드래그해서 원하는대로 옮길수있어요 안쓰는건 아예 밑으로 끝없이 내려서안보이게하고 켜놓고 필요한거 몇개만 위에 둘수있어요안전옵션은 다켜서 안보이게 내려놓고주차나 스트조절같은거만 위에둘수있죠스마트폰 홈화면 조절과 같습니다^^,2
볼보,V60,볼보가 이뤄낸게 엄청 많군요,4
볼보,V60,이제 판매가는 진짜 현기랑 차이가 없구나...  G70이랑 거진 비슷하네...,2
볼보,V60,19:56 형님 웃참실력이 신급이시네요 ㄷㄷ,41
볼보,V60,믿고보는 한국의 용 ㅎㅎ,2
볼보,V60,9:27 나뭇가지 주워와서 가리키는거 너무 귀여움ㅋㅋㅋ,5
볼보,V60,볼보 단단해보인다ㅎ,1
볼보,V60,북유럽브랜드들의 특징...실용적이고 고급스러워보이는데..요소를 보면..그리 고급스럽지않은.... 그리고 고급스러운겅 비쌈 이케아도...,1
볼보,V60,문득 윈터타이어의 마른 노면에서의 기능성이 궁금해지는데요 마른 노면에서도 일반적으로 얘기하는 사계절타이어보다 월등한가요?,1
볼보,V60,전동 텔레스코픽 안쓴거보면 시트폴딩도 왠지 안전상의 위험을 제거하기위함이 아닌가 싶은 뇌피셜,3
볼보,V60,와 볼보 와이퍼 너무 좋은 정보네요 크~감사해요,2
볼보,V60,나온지 좀 된 모델인데 외형보다 자료를 가지고 설명했으면 합니다. 예를들면 전 후면 비율을 알려주고 설명을.,1
볼보,V60,볼보 2도어 스포츠카 나올때까지 존버한다........,5
볼보,V60,개인적으로 볼보 후미등 아랫부분(ㄴ자 부분)만 없애면 좀더 멋있고 스포티하게 보일것같은데 볼때마다 아쉽네...,1
볼보,V60,현다이는 디자인을  보다는 안정성을 따하는게 어떨까요??,2
볼보,V60,토르망치 램프는 아우디가 원조 인줄 알았는데..그 때는 볼보가 잘 안보여서 그랬던건가..,1
볼보,V60,디자인은 괜찮아졌음. 단차는 아직 잘 못맞추네.. ㅎ,1
볼보,V60,차 진짜 괜찮네요 현기는 점점 설 자리를 잃어 갑니닼ㅋㅋㅋㅋㅋㅋㅋㅋㅋㅋ,1
볼보,V60,S90플러그인 하이브리드 타는데 정말 정말 만족하며 타고 있습니다,1
볼보,V60,하뇽형님 스잘알 인정합니다.고오급 스테레오는 역시 아이돌음악이 제맛.,9
볼보,V60,"아버지 애마가 s90 인데 진짜 오디오, 앞자리 시트는 탈때마다 감동임;; 근데 시승감, 인포테인먼트 때문에 제 차로는 안사고 싶음",22
볼보,V60,제 차라서 더 반갑네요^^,5
볼보,V60,"어댑티드 크루즈, 파일럿 어시스트는 에코모드로 해야 감속&브레이크때 엄청 자연스럽게 선다, 인포테이먼트 메뉴는 아이폰처럼 아이콘 누르고 있으면 원하는대로 위치및그룹변경이 가능하다.",2
볼보,V60,국산차도 볼보 정신으로 좀 만들었음 좋겠다저기능에 가격이 결코 비싼게 아님타보면 암 괜히 재구매율 1위가 아닌듯,1
볼보,V60,지리자동차가 볼보에게 꽤 좋은 주인인가봐요?,5
볼보,V60,9:25 볼보니까 ㅋㅋ 나중에라도 믿고 살 수 있는 차에요,4
볼보,V60,쿠페형이 아닌데 천장이 낮아서 시트를 불편하게 만들었다? 그냥 뒷자석은 잘 못 만든 거네요ㅠ 역시 세단은 그냥 중형크기 이상으로...,1
볼보,V60,본사에서 총판이랑 AS망 손좀 봐 주면 좋겠네요.,2
볼보,V60,볼보는 감동이다!,2
볼보,V60,22:50 슈퍼차져가 안들어간 차인데... 슈퍼차져때문에 이차는 등을 치는 느낌이 난다는건 등에 뭔가 특별한 원격 센서가 달린것인가요?,4
볼보,V60,간만에 디테일한 긴 영상. 사려는 사람은 좋은데나머지분들은 살짝 지루할수도,3
볼보,V60,s60의 유일한 단점.s90이 아쉽다.,1
볼보,V60,이제는 저 가격 보면 그냥 테슬라 사겠다 싶네,2
볼보,V60,형님 영상 잘보고있는데 4K로도 보고싶습니다. 하하하..,3
볼보,V60,나중에 볼보차 꼭 사야지!A/S센터 많이 있나요?,3
볼보,V60,언제부턴가 윈터타이어 무새가 된 하뇽이형.....윈터타이어의 중요성은 알지만....ㅋㅋ,1
볼보,V60,차에대해 잘 알려주셔서 고맙긴합니다. 근데 광고 좀 줄여주세요! 맥이 너무 끊겨요!,2
볼보,V60,안전의 볼보에서 썸머타이어 시승차를 제공하다니...,15
볼보,V60,오토 스탑은 대부분 괜찮은데거기다가 자동주차를 켜두면 암만 좋은차라도 좀 불편하네요,2
볼보,V60,"정말정말 사소한 거지만, 볼보가 스웨덴 출신이라 당연히 눈길 안전을 위해 전륜구동인건 사실이 아닙니다; 볼보가 대중 메이커 출신이다 보니 전륜 구동 플랫폼만 남은거죠. 볼보도 전륜구동이 대중화되기 전에는 후륜구동이었고 다른 대중 메이커들과 같이 80년대 중반부터 전륜으로 넘어온것이지 원래부터 눈많은 스웨덴이랑은 상관없죠.",3
볼보,V60,볼보 하면 크로스 컨트리가 젤 예쁜듯 ㅋ,2
볼보,V60,사고프다~~~♡,4
볼보,V60,오오 볼보에도 쿠페가 있었군요 첨봐요,1
볼보,V60,4800? 와우..,4
볼보,V60,이건 또 구매 후 얼마나 기다려야 할까요?,4
볼보,V60,볼보 차 정말 좋죠 v60사고 싶었어요 엄청 기다려야 한다고 해서.. 결국 마들Y를 살거지만 말이죠... 볼보르보오올보오르으으~~,5
볼보,V60,09년식 s80 awd V8 4.4 탔었는데 실내는 거의 그대로네.,2
볼보,V60,볼보는 로고디자인을 이름 새겨넣는건 유지하면서 저리 세련되게 바꿨는데 기아는 대체 왜....,1
볼보,V60,최고속도 제한은 엔진 내구성 딸려서 락건가 싶기도한 느낌이 드네요...,1
볼보,V60,"22:54 B5는 터보, B6는 터보+ 슈퍼차저입니다. S60 B5는 터보차량이 맞아요.",3
볼보,V60,으아아ㅠ 3시리즈랑 s60  고민하다가어제 3시리즈로 기울었는데ㅠ 하뇽느님 영상 보고 다시 고민의 늪에 빠져 버렸어요ㅠ,3
볼보,V60,Xc40은 전동인데 더비싼차가 어떻게  전동트렁크가  안들어가있지!😬,1
볼보,V60,이제는 그냥 기자님이 샷스파이 인수합시다,6
볼보,V60,"볼보 세단 라인은 항상 뒷태가 아쉽다... S60 기준으로 자체 길이를 조금 더 늘려서 2열 도어 프레임은 조금 더 뒤로 확장하고, 과거 볼보의 계단식으로 한층 깎아 내린 뒷 디자인으로 다시 돌아갔으면 좋겠다는 생각이....리어 램프도 사이즈를 좀 줄였으면",1
볼보,V60,상용차는 볼보의 점유율이 꾀나 되지 않나요? 그런데 왜 볼보는 항삿 어려웠던건가요?볼보와 볼보드럭은 별개의 회사인건가요?,2
볼보,V60,핸들에 핀이 맞는 씬이 많네요~~ 얼굴인식으로 포커싱 해놓으세요~~ ^^,1
볼보,V60,감성은 북유럽!  S60 생산은 미국에서...,1
볼보,V60,4:54 ㅋㅋ한용이형 영어 겁나 잘하는데혀 꼬이는거 보니까 인간미 뿜뿜 넘침,1
볼보,V60,철하면 세계최고의 포스코가 있는데 현기에 들어가는 철은 어찌 그리 구린지...ㅋㅋ,3
볼보,V60,내가 사랑하는 볼보...,2
볼보,V60,볼보는 차를 정말 성의있게 만드는거 같다현대가 볼보 발톱의 때만큼만이라도 배웠으면 좋겠다옵션 팔아처먹을 생각만 하지 말고.....,3
볼보,V60,꿈의차.....,1
볼보,V60,모멘텀이랑 인스랑 어떤거 추천하세요????,2
볼보,V60,차 조혼나이쁩니다....,28
볼보,V60,출고 기다리다 사망해서 못받는다는 그 전설이 자동차인가요.,28
볼보,V60,와이퍼에서 워셔액이 나온다는건 전용 와이퍼를 사용해야 하는거죠? 일반 와이퍼에 비해 가격이 어느정도 비쌀까요.,1
볼보,V60,결정! 볼보로 간다!!!,1
볼보,V60,학교 선생님 차인데 볼 때 마다 간지 작살,2
볼보,V60,"차는 시승안했으니 모르겠고 현대기아 아이오니5보다는 디자인 외적인면에서는 훨 떨어지네 ~현대기아 아이오닉5는 미국,유럽시장에서 테슬라1년판매를 아이오닉이 하루만에 1년치 2배를 팔았고 1위 했는데 볼보가한국 디자인 모델을 본뜬건 아니고 ~ㅎ",1
볼보,V60,하...... 6월에 나올지 8월에 나올지... 대기가 너무 힘드네요 ㅠㅠ,1
볼보,V60,17:24 볼보가 잘하는거,74
볼보,V60,22:54 B5 차량에는 터보차저만 있고 수퍼차저가 없습니다.,17
볼보,V60,볼보도 한국 패치 되면 '전륜구동은 눈길에서 문제없다!!'는 건가요?;;;;;;,3
볼보,V60,샷스파이는 모카에 취업했나요? ㅎㅎ 영상에 자주 보이네요~,4
볼보,V60,"세단같은 SUV도 만드는데 세단같은 해치백 ,해치백같은 세단정도야 ㅎㅎㅎ WHY NOT",1
볼보,V60,13:22안에서 열 수 있는 현기 타던 시절아들이 어찌나 장난을 치던지,3
볼보,V60,네비게이션 예기 꼭 해야해요. 이것 숨기면 사기로 인정합니다. 기가 막히네요..어떻게 하려는 지?,1
볼보,V60,산소센서  하나로 볼보는 오늘도 웃네요.,5
볼보,V60,모카 오전에올라오는거 너무좋아요,3
볼보,V60,타이어를 바꾸라는 곳은 내가 알기론 두곳 전에 다니던 회사와 지금 회사... 포도밭에서 갓끈은 고쳐메지 마세요.,6
볼보,V60,5000만원 미만 가족 차량은 이게 최고인가요 ?,1
볼보,V60,편집자님11분14초에 풍경 영상 소스 원본을 보고싶어요~~링크 좀 부탁드려요너무 아름답네요,1
볼보,V60,28:25 과연 차는 찌그러지는것을 원할까?,21
볼보,V60,볼보 C30 타던 시절 생각나네,2
볼보,V60,30:29 와 저거 벤츠에서 하려고 했다가 포기한거 아닌가?,1
