car_brand,car_model,comments,likes
폭스바겐,아테온,"bmw 520d, 벤츠 c220d, e220d, 아테온 프레스티지3대 시승해봤는데디젤 소음은 아테온이 가장 조용했습니다.디자인 및 내외관 마감은 벤츠가 갑이고요  정말 럭셔리하다는 느낌주행성능 치고나가는건 bmw가 갑입니다 밟았을때 쾌감이 있네요벤츠는 소음도 있고 쿨럭거리는 답답함 있었고 아테온도 나름 쭉쭉 잘 나갔습니다.옵션은 아테온이 갑입니다. 자율주행은 bmw 보다 한수 위입니다. 안정감 짱입니다.뒷자석 공간도 아테온이 훨씬 넓고 트렁크 공간도 가장 넓고 실용적입니다.가죽은 벤츠, 다음 bmw, 아테온순으로 좋았고아테온 프레스티지 옵션중에 다이나 오디오 있는데 음질이 아주 생동감 넘쳐서 인상적이었습니다. 타메이커 차량 오디오는 보통이었고, 만약 다이나 오디오로 업글비용한다쳐도 비용만 수백에서 천단위 되는거 같네요세차량 시승해보니 다시는 국산차 못탈듯요 기본기가 아주 다르네요개인적으로는 주행성능이 bmw가 넘사벽이라 bmw으로 선택중입니다패밀리카로 기본기 탄탄하고 연비좋고, 뒷자리나 트렁크 넓고 옵션빠방하고 오디오좋은 아테온이 가장 좋은거 같네요. 돈 있다면 아테온 추가 하고 싶네요 디자인도 이쁘고 계속 생각나는 차인거 같습니다.",14
폭스바겐,아테온,차에 대한얘기는 없고 뭔 매 게시글마다 게시자 찬양밖에 없네,1
폭스바겐,아테온,5천만원2.0디젤전륜구동..ㅋㅋ무슨 프리미엄브랜드도 아니고..아테온의 메리트를 어디서 찾아야 하죠?,2
폭스바겐,아테온,광고보고 있는줄,2
폭스바겐,아테온,영상미 어쩔 겁니까?! 너무 믓지다....,7
폭스바겐,아테온,그냥 cc신형인데 이름만 바꾼거..,3
폭스바겐,아테온,디젤. 끝.,1
폭스바겐,아테온,이건 보다가 느낀겅데 기자님 머리 왜구래용 ㅜㅜ 미용실을 바꿔보심이ㅠㅠ 진짜 미용사 못됐다ㅡㅡ,15
폭스바겐,아테온,음.. 디젤이라..,5
폭스바겐,아테온,폭스바겐 푸조  너무 없어보임,1
폭스바겐,아테온,드디에 아테온,1
폭스바겐,아테온,약간 현대 그랜져랑 비슷하네요......,1
폭스바겐,아테온,디자인 구린데 속 디자인은 폭망,1
폭스바겐,아테온,"해외에서는 출시된지 꽤 되어서 지인차를 몰아본적있는데 신형아테온, 가격대가 사실 에러로 보입니다. 이 가격대면 다른 대안들이 너무 많고 아테온을 굳이 꼭 선택해야하는지 의문이 많이 들기때문에.. 차가 좋고 안좋고를 떠나서 폭바를 골프부터 폴로,신형티구안 그리고 아테온 까지 타 봤지만,  아무리 겉 디자인이 화려해지고 독일특유의 감성이 살아있고 하지만 실제로 오너가 되서 차문을 열고 주행을 시작하고 타다보면 왜 폭바는 아우디 하위 티어 브랜드인지 누가 설명해주지 않아도 알 수 있습니다. 아테온이 아무리 잘나와도 아우디 A5,A7과 비교할 수가 없습니다. 티구안이 아무리 잘나와도 구형이자 스테디셀러인 Q3보다 떨어지듯이. 차를 겉디자인만 봐서는 절대 안된다는거 꼭 명심하시길.",86
폭스바겐,아테온,폭스우디,1
폭스바겐,아테온,"조작바겐 하다하다 rpm바늘 움직임까지 조작질이네 ㅋㅋㅋ 글고 소음, 진동은 어쩔 ㅋㅋㅋㅋㅋㅋㅋ",2
폭스바겐,아테온,전륜 4기통 디젤 딸딸이를 5천이 넘는 가격에..;;,1
폭스바겐,아테온,디젤. 끄덕끄덕,3
폭스바겐,아테온,현기와 폭바 동급취급하는 유일한 나라 대한민국ㅋ,12
폭스바겐,아테온,사실 디자인이  제일 마음에 안든다.,1
폭스바겐,아테온,"일단 폭파는 쳐다보는순간 3류차에  쓔레기차라는 인식이 든다....그러나 3,500정도면 고민해볼만하다 .......",1
폭스바겐,아테온,머리는 직접 깍으시나요?,1
폭스바겐,아테온,한국은 쏘나타랑 경쟁하는데,1
폭스바겐,아테온,"참 애쓴다 애써, 중립적이다는게 도대체 뭔 개소리야?",1
폭스바겐,아테온,국내는 240마력짜리 말고 190짜리 들어왔네  남조선이 공산국가라서 차별하네,1
폭스바겐,아테온,말할때 어~ 음~ 스읍~음~ 하는거 무지하게 거슬려요.,1
폭스바겐,아테온,3등,3
폭스바겐,아테온,"요즘 국내에 들어 오는 신형 차종들이 전부 디젤에 국한 되어 있는 점이 매우 의심 스럽 습니다.CLS,  A7, 아테온, 파사트 GT, A6, 푸조 508 등등   흉기차의 국토부 사주로 인한 것이 아닌지.  리뷰어들이 확인 해서 밝혀 줘야 할것 같습니다.",5
폭스바겐,아테온,2등,1
폭스바겐,아테온,"김기태 기자님 다른 답글은 다 답변 달아주시면서 제 글은 답변이 없는건가요? 아님 애써 무시 하시는건가여?다시 질문 드립니다 제가 독일에 갔을때 렌트했던 차량인데 패들로 수동 사용시 고알피엠에서 기어 다운시 약2초정도 있다가 기어가 내려 가더라구요  몇번을 해봐도 동일하게 기어가 늦게 내려 갔는데 이게 다블클러치가 맞나가 아니라 예전 2000년대초반 4단오토 차량보다 시프트 다운이 느렸어요  제가 탄 차량만 그런줄 알았는데 검색해보니 유튜브에 그런 내용이 있네요   지금 타신 차량은 그게 개선이 되었는지 아니면 모르시는건지 오토뷰 정도면 모르진 않을텐데 말이죠  일반인인 저도 타자마자 바로 알았으니 말이죠  이 부분에 대해 답변을 부탁드립니다 https://www.youtube.com/watch?v=8H3HyuOwAEY 위에 링크에 가셔서 31:15 초에 보시면 제가 말한 내용이 있습니다",1
폭스바겐,아테온,H,1
폭스바겐,아테온,아테온=sm6=블랙베리결론 이쁜쓰레기,8
폭스바겐,아테온,"아테온 핸들링이 좋긴 개뿔이 좋아무스테스트 영상보니까 완전 형편없구만 https://www.youtube.com/watch?v=VQ_zs1qrENk오토뷰 영상만 쓸데없이 고퀄이고, 내용은 갈수록 산으로 가는구만전륜구동 드립치는놈 있을까봐 미리 알려줌말리부와 사촌격인 오펠 인시그니아 무스 테스트 https://www.youtube.com/watch?v=P3U8WQrDEUk",5
폭스바겐,아테온,"노사장은 아테온 이 차 완전 게판이라고 , 오토뷰는 나쁜 얘기 없고.......ㅎㅎㅎ 누구말이 맞을까? ㅋㅋㅋ 그러나 시장에선 안 팔리고 있다는거~! 결론 이차는 상품성이 꽝 이라는거. 가성비도 꽝.  타보면 전반적으로 그랜저보다도 한참~ 못하다는걸 느낄수 있습니다. ㅉㅉㅉ........ 그랜저 시승 한 번이라도 해보시고 아테온 시승 꼭~~ 하시고 사시길 추천!",2
폭스바겐,아테온,이정도면 시승기가 아니고 아테온광고 아닌가여?ㅋ 190마력 디젤딸달이가 무슨스포츠성이있다는건지 ㅋㅋ 아테온기 기함급?이라니...차를 분석을 해야지 죄다 좋다고만 빨기바쁘네..에혀..단점은 가격? 가격빼고 다좋다니..이게 어째서 시승기 인지...,1
폭스바겐,아테온,리프트에 올려 바닥한번 보고 얘기하지...폭바 홍보 그만하고 오토기어 한번 보세요.~,1
폭스바겐,아테온,"와...내가 좋아하던 오토뷰의 본모습은 어디간건지...아테온을 이렇게까지 빨아주시다니 이차 시승하고 그냥 딱 SM6, 아반떼 수준이었는데 고속도로에서 급차선변경하면 그냥 뒤털림 진짜 죽을뻔함. 한시간 시승하고 나서 내린결론은 조용한 포드 몬데오 디젤 수준 이 차가 왜 오버스펙해서 타이어를 끼웠는지 생각해보면 답나옴 그 사이즈를 안끼우면 고속도로 항속에서 서스가 버티지를 못함. 사실 렉서스 IS200t 칭찬할때부터 신뢰는 하지 않았음 그렇게 엔진위치가 높은차를 안정감이 있다고 리뷰하시다니 ㅜㅜ",1
폭스바겐,아테온,4모션은 언제 나와요?,1
폭스바겐,아테온,바쁜가? 답변이 없네. 쯥,1
폭스바겐,아테온,"파사트, 아테온 같은 세단이 가솔린도 함께 들어왔으면 더 좋았을텐데.. 여러 복합적인 이유로 디젤만 들어오겠지만 너무 아쉽네요 ㅠㅜ",5
폭스바겐,아테온,디자인만 놓고보면 아테온이 압도적이네요,9
폭스바겐,아테온,디젤이네요^^ 가격과 연비 좋네요.. 제네보다 저렴하구요ㅎㅎ 시승해보고 싶네요.. 승차감만 좋다면 구매하고싶네요..,2
폭스바겐,아테온,아테온디자인이 압도적이네용,5
폭스바겐,아테온,K82.5 풀옵 오너입니다 구입할때 아테온도 고려했는데  디젤이라 ㅠㅠk8로 흰색은 같은차오너지만 저도 적응이 ㅋㅋㅋ 아테온 이쁘긴하네요^^,3
폭스바겐,아테온,"1년에 2만킬로이상의 장거리 주행을 하는 분들에게 최고의 선택은 아테온입니다. 거의 완벽한 차량이라고 할 수 있습니다. 모든 옵션이 다 있습니다. 모든 기능이 완벽합니다. 심지어 CD까지 있습니다. 스키스루뿐만 아니라요.차를 모르는 사람들은 현대기아를 선택합니다. 앞으로도 아테온처럼 연비,디자인,가격,옵션,실용성등등 모든 면에서 완벽한 차량을 만나기 쉽지 않을 겁니다.",8
폭스바겐,아테온,아테온이 모든면 압승,4
폭스바겐,아테온,K8디자인은 정말 답이 없네.돈 들여 이런 걸 만들다니...이건 뭐 초기 중국차?,3
폭스바겐,아테온,K8흰색은 진짜 구리다 흰색이 저러기 힘든데 ㅋㅋ,2
폭스바겐,아테온,"K8 그릴은 뺑기 칠해놓은것 같고, 그랜져 그릴은 스티커 붙이 놓은것 같고~~~",4
폭스바겐,아테온,민준님 얼마전에 리스때문에 메일보내드렷엇는데 원하는차량 연락처남겨두엇는데 혹시 메일이 안갔나요?,2
폭스바겐,아테온,와우 ㅎㅎ,3
폭스바겐,아테온,아테온은 스티어링휠수동이에요????,3
폭스바겐,아테온,가격이 훨씬 싼 K8이 더 좋네,4
폭스바겐,아테온,K8 하브 흰색 차주인데 실제로 보면 너무 이쁨 색상선택에 후회는 없음ㅋ 대부분사람이 실제로 보면 흰색이 젤 이쁘다 그랬음ㅋ,4
폭스바겐,아테온,휠 검정 아니었나요?아테온,2
폭스바겐,아테온,ㅡㅡ 아테온 가솔린이었음바로 질렀지.,3
폭스바겐,아테온,아테온 디자인은 정말 좋음..근데 폭바가 디젤 짬처리 하는 느낌이 너무남,2
폭스바겐,아테온,나란히 놓고보니까 k8오징어됐네..,3
폭스바겐,아테온,Made in Germany  vs 너튜브 보면서 금속노조가 만든차.,3
폭스바겐,아테온,K8저 앞주둥이는 정말 토나온다,4
폭스바겐,아테온,아테온 죄송합니다 안이뻐요 ㅠㅜ,3
폭스바겐,아테온,"돈더주고 차라리 아우디로 갈거 아닌이상 아테온은 가격대비 모든면에서 k8에 한참 못미침.k8하브나 3.5에 옵션 다 때려부어도 아테온보다 싼가격, 근데 아테온보다 대부분의 항목에서 훨씬 더 좋음.특히 k8하브랑은 비교하면 진짜 상품성에서 아테온을 갖다붙이는게 민망할정도죠.연비, 정숙성, 고급감, 승차감, 옵션, 정비성, 편의성 어느하나 k8을 넘을게 없네요.'난 현기차 타면 두드러기 생긴다' 이런 사람 아니라면 무조건 k8이 압승입니다.",11
폭스바겐,아테온,"작년 12월에 아테온 20% 할인했던 차와 크게 달라지지 않았네요, 시장의 반응은 정확할 겁니다.",19
폭스바겐,아테온,디자인이 예술이네,5
폭스바겐,아테온,밤에 지하주차장에서 저희 고객님 차량으로 흰색 봤었는데... 디자인은 진짜 최고던데요... 디젤이라 아쉽지만 소장은 하고 싶어지네요...ㅎㅎ 근데 올해엔 ID.4가 나올텐데 흠...,3
폭스바겐,아테온,폭스바겐이 디젤차량을 한국이나 기타 국가에 할인해서 풀고 있죠. 신형 나오기전 차량을 할인폭 크게 해서 내놓기도 하고. 유독 한국 시장을 그런 용도로 많이 활용하더군요.,1
폭스바겐,아테온,dcc는 최대장점중하나. 급가속시 엑셀반응이 반박자 늦은감이 있는건 단점. 기존 물리버튼들이 터치로 바뀌는 부분도 단점같네요.,1
폭스바겐,아테온,여전히 아름다운 디자인이네요. 예전처럼 4모션은 늦게 들어오려나요?,10
폭스바겐,아테온,15단계 댐핑은 전모델과 완전동일메뉴얼 같습니다추가된 기능은 아닙니다,15
폭스바겐,아테온,아르태온 진짜 세단역사상 가장 아름다운 엔진입니다!,10
폭스바겐,아테온,"형님 골프 시승기도 기대할게요 그리구 경쟁차종(1시리즈 , a클 등)과 비교도 부탁드려요",5
폭스바겐,아테온,디젤 good  힘좋고 연료비 싸고...,12
폭스바겐,아테온,좀 처럼 비판안하시는 분이 디젤에대해 자주 언급 한것은 시청자들에게 메세지를 확실히 준겁니다.,4
폭스바겐,아테온,한대는 전기차 한대는 디젤차  디젤이라 좋네요,2
폭스바겐,아테온,디젤도 독일 삼사 2.0 3.0 디젤은 전평이 났죠~이미 디젤기술은 세계최고이고 관리만 잘해준다면 디젤장점이 엄청납니다~  최근 디젤은 요소수도 한몫하는 기술이구요 무조건 디젤은 아니다 라는식은 절대 금물이라 생각합니다 출퇴하면서 가족차량으로는 충분히 괜찮다고 합니다 겁나 쏘고 다니고 답답하다 이러신 분들은 가솔린 터보나 최소 3000cc로 넘어 가면 될듯 합니다 풀 2중 접합유리라 나름 딸딸소리 잘안들리긴 합니다 밤새 잠자고 아침에 시동걸때 조금 시끄럽긴 하네요ㅠㅠ,14
폭스바겐,아테온,기존 아테온 20~27퍼 할인해서 풀어났는데 누가 이가격에 살지 궁금하네요 ㅋㅋㅋ현명한 소비라면 지금가격이면 520i 사야죠,7
폭스바겐,아테온,디젤 아직 7-8년 괜춘!그후로 전기차로 넘어가면됨  그때되면 전기차 충전시 주행거리 더기술 좋아질거고 전기차 충전소도 그때가 되야 눈에띄게 많아지겠지,11
폭스바겐,아테온,이 가격에 이 크기 전륜차에 저 네임밸류와 보증기간은 진짜 애매하네요 5시리즈 주력모델에 안 들어가는 전자제어 서스가 들어간건 참 좋지만요,1
폭스바겐,아테온,그랜져나 k8 하고 승차감 비교시 어떤지 궁금하네요,1
폭스바겐,아테온,1:55 이부분 설명 잘못하신듯. DRL이 낮에는 가운데 부분은 안켜집니다. 헤드라이트가 들어올때만 점등 됩니다.,13
폭스바겐,아테온,박기돈기자님 안녕하세요 오늘2023 더 모하비가 출시했는데 리뷰 꼭 부탁드립니다.너무 보고 싶습니다.이제 그래비티 트림에서도 블랙만 선택할수 없게 되었더라구요.다른 색상도 선택할수 있더라구요.,2
폭스바겐,아테온,"포드, 닛싼, 혼다, 토요타, 푸조, 씨트로엥 등에서 신차를 출시하면 가만히 있다가 폭바에서 신차만 출시하면 급발진 하는 사람들 많음. 디젤을 타든 가솔린을 타든 본인들이 다 상황에 맞게 타는거지 자기 생각과 다르다고 훈수두고 폭바관련 기사마다 악플달고 비아냥 거리는 인간들 넘처남. 언제 부터인지 제네시스 이하 주행성능은 제외 하고  편의 사양에만 몰빵한 국산차 4~5천만원 짜리 차를 사면 합리적인 소비고 같은 가격이지만 수입차 사면 없는데 허세 부리는 인식이 깊게 깔리기 시작하는 거 같음.",8
폭스바겐,아테온,항상 잘 보고있습니다,2
폭스바겐,아테온,싸게사고 2~3년후 팔땐 감가 오지게 날 디젤엔진...ㅜㅜ,2
폭스바겐,아테온,와 실내 개구리다..ㄷㄷ,1
폭스바겐,아테온,as수입차 순위를 보면 과연 폭바를 사야할지는 의문이긴 한데... 1위는 알다시피 도요타/렉서스...ㅋㅋ 이게... 물론 폭바센터가 도요타보다는 많지만 단순히 as센터 수가 많다고 해서 퀄리티까지 좋지는 않더라.... ㅋㅋㅋ 진짜 폭바 빠돌이거나 정말 드림카가 아닌 이상에는 '아... 함 가볼까 폭바디젤로?' 라고 생각하기에는 ...ㅋㅋ,1
폭스바겐,아테온,Dcc는 기존모델이도 있는 기능입니다^^그리고 가운데 엘이디는 데이라이트는 아닙니다,2
폭스바겐,아테온,믿고보는 박기돈 ㅎㅎㅎ,1
폭스바겐,아테온,아테온 광고 진짜 역대급으로계속나오네,1
폭스바겐,아테온,진짜 실내만 빻지 않았어도 디자인빨로 엄청 팔렸을텐데,1
폭스바겐,아테온,가솔린 있었으면 살 뻔 했던 차 ㅜㅜ,7
폭스바겐,아테온,가운데부분 데이라이트 아닙니다~!!! 전조등켜야 같이 들어옵니다!! 데이라이트랑은 차이가 있습니다!! 규정상 그렇게 안된다고 합니다~~~,15
폭스바겐,아테온,우아아아아 박기돈 편집국장님이다아아아~!!@$@$@,3
폭스바겐,아테온,2022 더 뉴 SM6 1.8 가솔린 터보 모델과 비교하면 어떤가요??,3
폭스바겐,아테온,1500정도 깎아야 제값일듯,1
폭스바겐,아테온,이차는 스타일리쉬 하긴한데 특유의 아쉬움은 어쩔수가 없나봅니다그리고 지금시점에서 4door coupe 스타일에 굳이 디젤이 필요한지도 의문이네요.,7
폭스바겐,아테온,아테온은 바뀐게 없네요;;;기어노브도 그대로고 HUD도 그대로고 라이트만 하나 추가된듯....,3
폭스바겐,아테온,이제 디젤모델은 사양길인데가솔린이나 전기모델이 대세~!!,5
폭스바겐,아테온,폭스바겐은 개취로 별루,3
폭스바겐,아테온,할인은 얼마나 해주나요? 요즘 차사기가 너무 안좋은시기인듯 좀 기다려봐야겠다,1
폭스바겐,아테온,기존에 알려진 휠이 아니네요. 그 휠은 r라인에 들어가는 건지,1
폭스바겐,아테온,외관은 이전께 낫네요전면 하부 범퍼 쏘나타 뉴라이즈인줄 ㅜㅜ실내는 이뻐졌네요시계를 왜 없앴지 ㅋ썬루프 열면 디젤 매연 냄새 나는거 말고차는 괜찬아요 ㅋ,1
폭스바겐,아테온,파사트 안나오나..파사트 은근 고급스럽던데,4
폭스바겐,아테온,디젤사는건 지금은 아닌듯가솔린하이브리드에서 전기차가 대세디젤 2년됬는데 지금은 아쉬움이 있네요,1
폭스바겐,아테온,외관은 비슷해보이네용,2
폭스바겐,아테온,왜이리 안올라오나 기다렸습니다^^,2
폭스바겐,아테온,"알테온 좋은정보 감사합니다.번호판,봉인 녹방지 봉인구어셈블리 라고있네요.",1
폭스바겐,아테온,패들 시프트 쓰는법 강의해 주세요 D에서 바로 사용 하시는 거죠?,1
폭스바겐,아테온,아니 다 좋은데 얘네는 기어봉이 이게 이게..ㅜㅜ아우*처럼 항공기 기어봉 스타일 얼마나 멋진가구지~~~~  저딴 말뚝을 ㅜㅜN~~~~~G,1
폭스바겐,아테온,지금 시점에 디젤 차를 사도 괜찮은건지 궁금하네요,5
폭스바겐,아테온,아테온r 도 좀 들여오지 아쉽네요,2
폭스바겐,아테온,디젤 10년은 충분하죠,13
폭스바겐,아테온,"디젤 떨이 하려는 건가, 해외는 가솔린 잘만 나오던데",2
폭스바겐,아테온,운전하시면서 조작을 하시면 위험한것 같은데요,1
폭스바겐,아테온,지금까지 이양반이 시승하면서 나쁘다고 말한 차는 없었다   믿거나 말거나,3
폭스바겐,아테온,천만원씩 할인해주는 찬데 기본값 내리는게 의미가 있나 ㅋㅋㅋ 할인 그만큼 덜 해주겠지,7
폭스바겐,아테온,아 골동품같은 기어봉....하다못해 골프거라도 넣어주지..,1
폭스바겐,아테온,R라인은 언제 나올런지요ㅎ,2
폭스바겐,아테온,가솔린 모델 좀 출시해주지 ㅠㅠㅠㅠㅠㅠㅠ,9
폭스바겐,아테온,요즘 폭스바겐이 시대에 역행하는 행보네요. 디젤엔진 차량은 이젠 시대의 유물로 되어가는 마당에 떨이 판매처(호구)를 우리나라로 잡은 게 아닌가 싶네요. 서울시내 디젤엔진 차량 진입 완전금지 정책이 검토되고 있는데......,2
폭스바겐,아테온,한국은 유럽디젤차 하치장이 아닙니다.디젤내연차는 시대흐름의 역행입니다.,4
폭스바겐,아테온,기존 아테온이 개인적으로 더 이뻐보이네욥,8
폭스바겐,아테온,아테온 요수수 들어가나요?,2
폭스바겐,아테온,골프도 올려주세요~~~,2
폭스바겐,아테온,기존 240마력 아니었음?,1
폭스바겐,아테온,구형이 더이쁨 가운데 아날로그시계왜뺌 원가절감 오지게하고 가격내리고 할인은 1퍼? 아무도안삼 중고아테온 3천중후반이면사는데 왜 5천넘게돈주고 이차를사는건지.. ㅋ,2
폭스바겐,아테온,현기아는 바뀐게없으면서 가격 계속올리는데,1
폭스바겐,아테온,사지마 년말되면 20프로 세일할거야.작년에도 20프로 훨씬넘게 세일해서 4천 초반에 팔았다,2
폭스바겐,아테온,디젤 이젠 그만  가솔린 내놓아라  요즘 누가 디젤 차를 사니  특히  세단을,5
폭스바겐,아테온,처음부터 끝까지 DCC 얘기만 하시네,2
폭스바겐,아테온,왠지 디젤부품이 남아서 떨이하는 느낌으로 국내에 파는 느낌? 개인생각입니다~^^,7
폭스바겐,아테온,가솔린은 왜 안들어 오는거지??,1
폭스바겐,아테온,할인 없어져서 가격 존나 올린거나 다름없는데 매리트 전혀 없는듯,1
폭스바겐,아테온,아우디동생답네,1
폭스바겐,아테온,통풍시트유무,1
폭스바겐,아테온,아테온 R나왔으면 샀을텐데 쩝,1
폭스바겐,아테온,페리 디자인이 이전보다 별로인것 같은데....에어덕트부분이 쏘나타dn 같은 느낌이....뭔가 직선 느낌의 언밸런스한듯....그리고 실내도 이번 골프처럼 변경 해 줬으면 좋았을텐데....구관이 명관~ 새차같은 중고 아테온을 구입하는게 더 매력 있을듯,1
폭스바겐,아테온,가솔린…,3
폭스바겐,아테온,디젤이라..진짠가 다시 돌려봤네,1
폭스바겐,아테온,내부 디자인이 골프보다 못하네...티구안이랑 같네...,2
폭스바겐,아테온,컴바이너hud실화냐 쪽팔려서못타겠다ㄷㄷ,1
폭스바겐,아테온,디젤 경유 딸딸딸이  안사요..,1
폭스바겐,아테온,디젤은 이제끝,1
폭스바겐,아테온,가솔린은 정말 안되는 건가요,4
폭스바겐,아테온,하이브리드는 안들어오나...,5
폭스바겐,아테온,죄다 디젤,4
폭스바겐,아테온,잡소리는 그대로 나오나요?,1
폭스바겐,아테온,"아테온 엔트리급이 5500이면 살 이유가 없는거 같은데. 거기에 디젤 ㅋㅋㅋ....가솔린 엔진에 4륜 모델이 가격이 4500정도면 괜찮은듯. 디자인 빼고 살 이유가 없는 차. 독3사 럭셔리급 차량도 아니고 뭐 외제차끼리에서도 가성비로 보고 캠리하브 어코드하브를 능가하는 연비도 아니고, K8하브 그랜져 하브랑 비교해서 나은것도 없고. 아니 솔까 암만 쉴드 쳐줄려고해도 뭐 좀 제대로 된 게 있어야 사지.폭바 브랜드 밸류는 그냥 없는 수준이고 누가 폭바 탄다고 오~ 이런것도 없고, 가격은 디젤 전륜 모델 주제에 520i 할인 가격하고 비비는 수준이고 15단? ㅎ. 그냥 사는 사람이 흑우지.",4
폭스바겐,아테온,지금 시대에 누가 디젤을 사 ㅋㅋㅋㅋ 백번 양보해도 가솔린이지,9
폭스바겐,아테온,디젤에 기어노브. 답이 없다.,2
폭스바겐,아테온,끝내 가솔린은... 아쉽습니다,11
폭스바겐,아테온,실내가 너무좁고 천장이 너무 낮아...ㅠㅠ 키가작거나 앉은키가 작은 사람에게 추천합니다.,1
폭스바겐,아테온,차알못 들은 또 재고떨이라 떠들듯...뭐 좀 알고 떠들어야 하는데...ㅋ,3
폭스바겐,아테온,아테온 진짜 왜 디딸만 파는지 이해가 안되네.. 재고처리인가,3
폭스바겐,아테온,디젤.....?,3
폭스바겐,아테온,재고처리 아쉽네요  골프역시 나온지 4년된 재고,7
폭스바겐,아테온,너무 비싸게 나왓음 게다가 디젤 ㅡㅡ별 메리트 없는듯,6
폭스바겐,아테온,아니 할인말고 걍 가솔린모델을 가져오면 될 일같은데.. 뭐 가솔린 인증에 문제있는건지 디젤 재고떨이를하는건지 이유를모르겠네 얘넨.. 아니면 그 디튠된거말고 240마력짜리 고성능 디젤이라도 팔든가... 최근에 제타 포함 티구안하고 kncap 충돌테스트 통과도 못했던데.. 기본에나 충실하길. 그리고 가격떨어진것도 솔직히 2022년 현시점에서 아테온이 그만큼 경쟁력이없으니까 그에맞는 위치로 떨어진것뿐이지 대단할건 없다고 생각함.,5
폭스바겐,아테온,잘 모르시나봐요.ㅋ,1
폭스바겐,아테온,K8 1.6  풀옵보다 비싸네 ㅡㅡ,2
폭스바겐,아테온,아이고 2.0TDI 안 쓰이는 곳이 없구나우리나라에 출시하는 차량 전체에 적용하네재고처리를 이렇게 하는구나,3
