car_brand,car_model,comments,likes
도요타,RAV 4,뻔뻔한거 보소 북미사양 그대로 들어왔네. 한글화같은건 바라지도 말라고 대놓고 진짜 염치도 없네.상품성은 망이지만 기본기가 있어서 그나마 미국시장에서 먹히고 있는 중이네요.그래도 하이브리드가 ISG에 가까운 국산차보다 그나마 모터만으로 달릴수 있단거 하난데전기차 빨리 도래해서 도요타 일본에서만 팔렸으면 ㅋㅋ,3
도요타,RAV 4,이차는 수입차 티가 전혀 안남......고급감은 1도 없고 걍 국산 준중형 깡통모델 처럼 생겼음 지나가는거 보면 투싼같음,6
도요타,RAV 4,"경쟁모델인 투싼이 모델체인지가 돼서 크기, 디자인이나 성능이 상대적으로 옛날느낌이 물씬 나긴하는데 이제 2021년이니 조만간 라브4도 신모델 얘기가 나오겠군요현대가 미쓰비시에서 벗어난게 언젠데이상한소리 하는분들 많네요모르는사람이 보면 현대차가 아직도 미쓰비시에서 기술과부품을 공급받는줄 알겠네요",2
도요타,RAV 4,실내가 너무 허접한데???? 90년대 감성이네.,9
도요타,RAV 4,일본차라...싫어요. ~,1
도요타,RAV 4,일본차 안되요,1
도요타,RAV 4,구독자지만 이번 영상은 역따 누르고 안보고 갑니다~,1
도요타,RAV 4,이제 국산차가 앞선거 같네요^^,1
도요타,RAV 4,이시국에 라브4 ㅠㅠ,3
도요타,RAV 4,오토뷰는좋아하지만 왜구차는관심없네요😉,3
도요타,RAV 4,관심없음추가요.,5
도요타,RAV 4,이건  뭐 디자인이  산으로가네요재질도 싼티나고 국산차가  영 좋네요투산  쏘렌토가  압승이다 일본 옛말이다,1
도요타,RAV 4,역시 광고였어. 요즘 일제차 겁나 잘 팔린다죠?마케팅도 겁나 공격적이더라구요. 좀만 더 옥죄면 완전 고사시킬 수 있었는데 그걸 참지 못하고 조건 좋다고 쪼로록 가서 사주고 매진시키고...한국인들 냄비 근성은 하여간 알아줘야 함.,3
도요타,RAV 4,이딴걸 광고를받다니,1
도요타,RAV 4,"괴랄한 외부 디자인과 외장에 비해 평범한 실내, 고만고만한 옵션, 그지같은 실내 소재만 줄창 쓰고 있지만 차의 기본기가 좋다는 이유만으로 사주는 전세계 고객들이 있어서 연명해 가는 도요타... 현기차 정의선 회장은 차 판매에 있어서 외,내부 디자인이 얼마나 중요한지 알기에 폭바그룹 출신 피터 슈라이어, 루크 동커볼케, bmw의 카림 하비브, 벤틀리의 이상엽..등등 어벤져스급 디자이너들 갈아넣어서 k5, 제네시스같은 외양만 보고도 사고싶은 차를 만들어 내는데 도요타,혼다는 건담의 후예라는 일본인들 특유의 곤조 때문인지 만화에서나 볼 법한? 외양만으론 선뜻 구매가 망설여지는 차만 만들어 내고 있음. 도요타가 정의선 회장이 한 것처럼 어벤저스급 디자이너들 모아서 차 만들어내면 현기차는 심각해 지겠지만 그럴 일은 없을거고 정의선 회장은 계속 흐뭇해 하겠지...",2
도요타,RAV 4,패밀리 마트에서 아사히 맥주를 사서 집에서 유니클로 히트택 입고 플스 게임하며 한잔하고 우로스 발라 샤워를 하고 샤워후 시원하게 포카리스웨트 한잔후 니콘 카메라로 셀카한번 찍고 야마하 오디오른 켜서 음악을 들으며 잠든후  아침에 도요타 라브4 타고 ABC 마트로 아식스 신발을 사고 미즈노 야상을 사고 데쌍뜨 티셔츠 산후 세븐일레븐 가서 담배 커피 사고 브릿지스톤 가서 타이어를 교체한후 오로나민C를 마신다... 하늘에 계신 이순신 장군께서 우리 후손들을 참으로 대단히 여기시겠다,4
도요타,RAV 4,일본차 리뷰라니 실망입니다. 내가 좋아하는 것 안해주셔도 되는데 내가 혐오하는 것을 하니 저도 이만 물러갑니다.,6
도요타,RAV 4,알권리 알권리 하는데 난 불매 할권리 누릴려고 비공 누르고 간다,3
도요타,RAV 4,당분간 일본차 리뷰는 안하시는게 어떨까요?,3
도요타,RAV 4,이시국에라는 말만 하겠습니다아무리 물고 빨아도 할 말은 해야지,3
도요타,RAV 4,좋아하는 분도 있겠지만 저는 개인적으로 일본차리뷰 실망스럽습니당  ㅜ 아쉽,4
도요타,RAV 4,반일을 강제하는 건 아니지만 굳이 라브4 일본차 사야할 이유가 있나 싶네요. 투싼도 있는데,4
도요타,RAV 4,"갑자기 웬 일본차 리뷰에요?다른 리뷰할 차도 많을텐데, 그 많고많은 차를 두고 왜 굳이 일본차를 골라 공을 들여 리뷰하는 건가요.이번에는 브리지스톤 코리아에서 일본차를 섭외해서 리뷰하게 된 건가요? 하기야, 브리지스톤도 일본 타이어 회사였죠. 같은 나라 기업끼리 돕자, 이거일까요?",2
도요타,RAV 4,"오토뷰 영상 다 보지만...한국을 수백번 침략하고, 반성없고, 한국을 무시하는 일본차는 페스 ~~~~",2
도요타,RAV 4,오토뷰....쪽팔리게 살지는 맙시다..,2
도요타,RAV 4,퉤,4
도요타,RAV 4,일본차 오너들 교통법규 잘지켜라잉~ 위반하면 바로바로 신고 해줄텡게~,2
도요타,RAV 4,얘네차는 줘도 안타요,1
도요타,RAV 4,아직...  일본차는 아니지 않나요ㅜㅜ,10
도요타,RAV 4,굳이 일본차 리뷰해야합니까?,3
도요타,RAV 4,국내에 소개할 차가 없는것도 아닌데..굳이 이시기에 일본차를 올리는 이유는 뭔지! 혹! 예전에 찍어 놓은거라 해도 영상을 올린거는 아니라고 봄! 매우많이 실망!,1
도요타,RAV 4,망해라 일본차,4
도요타,RAV 4,아직 일본발 경제전쟁이 끝나지 않았습니다. 강제노동자들의 배상문제도 위안부피해할머니들문제도 아직입니다. 전 오토뷰를 응원하고 지지합니다만. 이번 일제자동차리뷰는 반대합니다. 경제와 정치 외교가 서로 다르다고 하는 사람들있는데요.. 어떻게 그런 생각을 하는지 참 난감합니다. 독립운동은 못했어도 노재팬은 제평생 하려 합니다.,5
도요타,RAV 4,오토뷰만 보지만 첨으로 비추눌러봅니다.,13
도요타,RAV 4,"라브4 하브 4륜은 탈수록 좋고 신뢰가 가는차 입니다. 그러니 승용부문 북미1등 판매차 이겠죠. 무엇보다 연비가 환상적이고 주행질감 좋고 잘나가요. SUV의 다목적성, 공간, 하이브리드의 경제성, 4륜의 안정성, 내구성,패밀리 지향적, 핸들링, tnga플랫폼 모두 좋아요. ^^",7
도요타,RAV 4,라브 가성비 최고,2
도요타,RAV 4,잘봤어요!! 자막이 조금 작다는 아쉬움이 ㅠㅠ 눈아파요 ㅎㅎ,1
도요타,RAV 4,센터페시아 디자인은 왜 저거밖에 못뽑았을까ㅡ.ㅜ,1
도요타,RAV 4,내비게이션이 구림!! 괜찮아 보이는데..,2
도요타,RAV 4,ㅋㅋㅋ 네비뭐냐 ㅋㅋㅋ 지니 . 아이나비네비냐?? ㅋㅋㅋ 언제쩍 디자인이냐 ㅋㅋㅋㅋㅋㅋㅋㅋㅋㅋㅋㅋㅋㅋㅋㅋㅋㅋㅋ 줟가다,1
도요타,RAV 4,요즘 차읽남 리뷰는 무조건 챙겨봅니다.. 다른곳은 이런저런 설명 없이 그냥 간단하게 리뷰만 하는데 여긴 설명까지 해주시니 너무 좋아요~~얼른 100만 가즈아~~,6
도요타,RAV 4,"분위기에 맞게 흘러나오는 인트로 음악부터 애청자들의 질문에 성심성의껏 답변 및 행여나 간과할 수 있는 부분까지 부연설명을 곁들여 차에 대해  장점과 단점을 들으며 무릎을 치는순간 벌써 마무리 멘트가,,,,,,아쉬운점은 고퀼영상에 비해 적은 구독지수와 담을 기약해야 하는 시간뿐,,,고생하셨습니다! 오늘도 잘봤습니다 ^^",4
도요타,RAV 4,하이브리드에 대해서 많은걸 배우고 갑니다,5
도요타,RAV 4,차읽남님 예리한 분석과 알기쉬운 설명에 간탄했습니다. 시승기 즐겨보는데 확실히 차별화되는 느낌이에요! 혹시 엔지니어 출신인지요?^^;,2
도요타,RAV 4,"안녕하세요~관심있는 차종 찾아보다 이렇게 들어왔는데 설명도 쉽고 자세하게 잘 해주셔서 댓글까지 남깁니다~요즘 어린 두 자녀와 함께 4인가족 함께 탈 차량으로 라브4하이브리드, 티구안 비교중인데 년2만km정도 주행하는데 승차감, 연비 등 고려해서 선택할 수 있는 가이드라인을 좀 제시해주실 수 있을까요? 꼬리에 꼬리를 물어 선택하기가 어렵네요~",2
도요타,RAV 4,지난번 혼다 어코드 리뷰에 이어서 토요타 라브4까지 해주시니 정말 너무 좋네요 굳!,2
도요타,RAV 4,인테리어와 네비가 빼곤 장점인듯,2
도요타,RAV 4,이전세대 모델 5년째 타는데... 엔진 소음 불만 많은데 좀 개선 되었는가 모르겠네요.. ㅋ 그외에는 전부 장점이라 일본불매 터지고 나서도 바꾸질 못하네요 ㅋㅋ 특히 이포시스템은 눈길에서 짱입니다.. 작년에 바꾼 마누라 아우디 A4 매력을 느껴서 q5넘어가고 싶은디..시에나 하브가 선택장애를.... ㅠ ㅋㅋ 이런고민하며 이전 라브4하브 4년만 더 타렵니다 ㅋㅋㅋ 그래도 좋아요 ㅋ,4
도요타,RAV 4,담엔 혼다 토요타 연비비교 한번 부탁드려요!,2
도요타,RAV 4,예전에 일본여행에서 도요타 하이브리드 메다섯대 타봤는데요확실히 우리보다 트래픽 심하고 규정속도도 좀 느린 일본 시내에서는 좋았는데 속도 50이상으로 달리는 구간이 많은데서는 영 시끄럽고 힘도 없고 안좋더라구요,2
도요타,RAV 4,단점 : 인테리어장점 : 엔진오일증가 없음,28
도요타,RAV 4,설명 진짜 대박인듯 ㅋㅋㅋ 혼을 갈아넣으신게 느껴지네요..샌드박스 뭐해 얼른 모셔,3
도요타,RAV 4,라브4 너모 이뻐요 ㅜㅜ 사고싶다 ㅜㅜㅜㅜ,3
도요타,RAV 4,"차체 하부가 스틸이라서 승차감과 소음이 떨어진다고 하셨는데 현기차 투싼, 스포티지부터 싼타페,쏘렌토와 비교해서는 어떤지 궁금하네요",2
도요타,RAV 4,"도요타,렉서스의 엔진우선권의 직병렬하이브리드시스템이네요.ㅎ혼다는 전기모터우선권의 하이브리드입니다만 혼다 하이브리드는  전기차 비슷한 느낌이 난다고합니다.",4
도요타,RAV 4,렉서스 ux 타봤는데 승차감이 엄청좋더라구요 실내도 구린데 렉서스는 고급스럽더라구요,1
도요타,RAV 4,시에나 하이브리드 2륜 리뷰 부탁드려봅니다. 특히 2열 승차감..,3
도요타,RAV 4,crv도 나중에 리뷰해주세요!,1
도요타,RAV 4,차주로서 거지같은 인테리어와 네비 빼고는 만족합니다.잔고장 없고 연비 좋고,4
도요타,RAV 4,좋은 차죠👍,2
도요타,RAV 4,저기 그럼 도요타 하이브리드차량의 엔진소음은 일반 가솔린 차량 정도라고 생각하면 되는건가요?,1
도요타,RAV 4,형 담엔 시에나 하브도 부탁할께 ♥,3
도요타,RAV 4,"프리우스, 캠리하브 타다가 라브4로 바꾸려 했는데, 센터디스플레이 7인치가 너무 마음에 안드네요.. 페리되면서 조금이라도 커질 줄 알았는데, 4,700만원짜리 차에 7인치 디스플레이는 좀 아닌 것 같네요",2
도요타,RAV 4,캠리 8.5세대 가솔린도 시승기 부탁드립니다~^-^,1
도요타,RAV 4,렉서스 RX450H 도 리뷰해주세요ㅜㅜ항상 기대중입니다.,2
도요타,RAV 4,2022년형 라브4 계약하려고 합니다. 2륜보다 4륜이 더 안전한건가요?4륜으로 결정해야 할까요?,1
도요타,RAV 4,비싸서 2륜 하브 뽑았는데이거 보니까 4륜 탐나네요 ㅜㅜ,1
도요타,RAV 4,7인치 네비 ㄷㄷㄷ,1
도요타,RAV 4,"리뷰시간이 14:11""로 길게 나왔습니다~•Toyota hybrid일반적이고 (발끝신공) 연비주행을 중요시 하는 분들• Honda hybrid괜찮은 연비 + 나름 재밌는 운동성능을 중요시 하는 분들이렇게 추천해 드리면 어떨까 합니다.* 와인딩 때 카운터 치시는거...RAV4가 제일 역동적 이었습니다😀👍👍",3
도요타,RAV 4,방지턱같은건 부싱땜에 그런겁니다 부싱을 좋게 해서 그래요,1
도요타,RAV 4,"좋은 리뷰 감사합니다.도요타, 혹은 렉서스의 차들은 아직 어딘가 균형이 잡히지 않은 차같다는 생각이 듭니다.하이브리드가 아니던 시절의 도요타 차는 세단이던 SUV 던 가리지 않고 상당히 좋은 승차감, 안정성, 운동성을주었던 것으로 기억하는데, 거의 모든 차량을 하이브리드로 바꾸면서 어딘가 균형감을 잃었다는 생각입니다.그래서 (상대적으로 승차감 위주로의 세팅이 손쉬운) 세단에서는 괜찮은 차라는 생각을 갖게 하지만SUV는 아직까지도 계속 균형을 잡아가고 있는게 아닌가 하는 생각을 해 봅니다.최근엔 전기차로의 전환이나 수소차로의 전환을 또 신경써야 하는 상황에서 도요타차가 언제까지 현재의 위상을 유지할 수 있을지 조금 고민스럽기도 합니다. 비록 얼마전 뉴스에 미국내 차량 판매 1위를도요타에서 차지했다고는 하지만....  우리가 미국시장을 볼때 꼭 염두에 두어야 할 것은, 그 사람들 생각보다 애국적 소비심리가 저변에 심각하게 깔려 있다는 것입니다. 그런면에서 이번에 도요타 차가 많이 팔린 것은 사실 자국브랜드로 인식되는 렉서스에 기인한 바가 크고 전기차인 테슬라를 구입하고 싶지 않은 이들이 렉서스를 대체제로 구입한 것이 아닌가 하는 생각이 듭니다.",1
도요타,RAV 4,그냥 한국차에 비해 5년차이가 나는 디자인과 어중간한 기술력이네요굳이 살 필요가 없을거 같아요,2
도요타,RAV 4,나중에 출시될 렉서스 NX350H 도 리뷰 부탁드리겠습니다..,2
도요타,RAV 4,부럽다 ㅠ,3
도요타,RAV 4,인스타보고 영상 기다리구 있었다규..!,2
도요타,RAV 4,엔진오일. 증가 없죠?,2
도요타,RAV 4,디스플레이 거지 같아서 70만원인가 주면  10인치로 업그레이드 가능합니다.,2
도요타,RAV 4,와 아무리 일본이 하이브리드 짜세라지만 실내가;;,1
도요타,RAV 4,Rav4가 코롤라 베이슨가요? 하이랜더가 캠리베이스니..,2
도요타,RAV 4,멋지다,1
도요타,RAV 4,와 썸네일보고 오토뷴줄,1
도요타,RAV 4,💯,2
도요타,RAV 4,노사장 cr -v 리뷰 보시길,2
도요타,RAV 4,이거 신차인가요? 화면크기가..?!,1
도요타,RAV 4,혼다와 토요타 (렉서스) 하이브리드 두대를 동시에 연 5만km 이상 10년 가까이 운영하고 있는 입장에서 설명을 참 잘해주셨어요. 실 동시 소유 오너 입장에서 하브만 놓고 봤을때 선택은 저와 와이프 모두 혼다 입니다. 연비는 10%정도 토요타가 좋은데 구동계 진동이나 소음면에서 직렬식 우선인 혼다가 더 깔끔하고 부드러우며 성능이 좋습니다. 또한 장기 보유시 소모품이 더 적고 혼다가 배터리 보증이 더 길어요. (10년 무제한km),1
도요타,RAV 4,여기는 일본차라고 무조건 까고 구독취소한다는 사람들 없나ㅋㅋ작년까지만해도 넘쳐났는데,1
도요타,RAV 4,와인딩이 뭐니...,1
도요타,RAV 4,꼭 일본차를 홍보해야합니까일본은 한국차를 1년에 10대도 수입 안합니다,2
도요타,RAV 4,시승기인지 광고인지,3
도요타,RAV 4,직관적이고 객관적인 비교.분석에 박수를 보냅니다.,48
도요타,RAV 4,5세대 나오자마자 계약해서 2년반정도 타고있는데 가격 생각하면 별 아쉬움 없네요 인테리어 내장재를 기대하신다면 닥 현기차로 가셔야겠지만... 저희가족은 기본에 충실한 차를 좋아해서 ㅎㅎ패밀리카로 손색없는 차같아요 4륜이고 연비도 거의 20 무난하게 나옵니다  고급스러움을 기대한다면 비추입니다,12
도요타,RAV 4,오랫만에 설명을 들었는데 양사 하이브리드 비교에 더해서 운행 중 감각적인 측면 설명 등 참 좋았습니다.,3
도요타,RAV 4,"하이브리드에 모르고, 큰 관심도 없던 제게도ㅡ알기쉽고,이해되기쉽게 잘 비교,설명해주셨네요 항상 잘보고있습니다👍",14
도요타,RAV 4,차분하게 설명 잘 해주셔서 끝까지 다 보고 갑니다 ㅎㅎ스포티지 하브 괜찮은 차임에는 분명합니다  앞으로도 좋은 영상 부탁드려요~,35
도요타,RAV 4,PHEV가 오히려 아직 아쉬운 전기차 관련 인프라를 대신해서 독보적인 시장을 만들고 있는 것 같아요! 앞으로도 한동안 전기차 대신 고를 수 있는 현실적인 선택지라는 생각이 듭니다🙆🏻‍♂️,37
도요타,RAV 4,하이브리드를 좀 더 적극적으로 활용하도록...^^ 해야할듯좋은콘텐츠네요...,12
도요타,RAV 4,"새차끼리 비교하는  영상 잘 봤습니다. 다음에는 5년, 10년된  차끼리 비교해보는 영상도 올려주셨으면 좋겠습니다.",30
도요타,RAV 4,정말 객관적으로 설명 잘 해주시네요. 타 유튜버 처럼 선입견 없이 깔끔하게 본질만 애기하시니 더 좋네요,3
도요타,RAV 4,"외국과 달리, EREV나 PHEV는 공급  자체가 한국 시장에서 찾아보기 어렵습니다.    왜 그런지 궁금하네요.  덕분에 중고 가격이  동년식 HEV대비 상당히 강세네요.",4
도요타,RAV 4,"승용차는 전기차로 가고, 승합차나, 미니밴, 등 중대형급이나 상용차는 하이브리드로 가는것도 좋을듯 하다고 생각드네요. 디젤이 저속에서 매연이 많이 나오더라구요. 언덕길이나, 그때 모터로 보조만 받아도 환경에 도움될듯하네요.",4
도요타,RAV 4,"미국에서 투싼 하브 AWD 타고 있습니다. 확실히 4륜은 연비가 안나오네요. 지금  7개월 정도 타고 있는데 7000마일 (11200 km) 달렸구요. 연비는 30 m/g 환산하면 12.7km/l 정도 나옵니다. 저속에서는 25~35mile(40 ~55k), 고속에서는 50 ~ 60mile(80~96 k) 속도에서 최적의 연비를 보이네요. 구입당시 rav4 도 시승했었는데,  rav4 는 4륜구동 느낌은 아니었고, 전륜과 비슷한 느낌(개인적인 생각), 하지만 투싼 하브는 확실히 4륜 느낌이 났었죠. 스포 하브도 구매 하려고 했었는데 4륜이 없더라구요.",12
도요타,RAV 4,내용이 좋네요.. 좋은 기사입니다.. 저 또한 하이브리드 차를 6년째 운행 중입니다.,18
도요타,RAV 4,하이브리드가 전기베터리 를 자동으로 충전하는거였군요 방전되면 자동충전했다가 운행에 보조역할을 하고 그런거였네요 일반 가솔린엔진보다 확실히 장점이 있어 보입니다,3
도요타,RAV 4,"공학적인 아름다움이고 뭐고 하이브리드의 최종 목표는 에너지효율입니다. 동일한 연비면, 도요타의 하이브리드건 현대의 하이브리드건 무엇이 더 우월하다고 말할 수 없다는 거죠. 물론, 도요타가 하이브리드의 원조고 공학적인 센스가 있는 구조인기는 하나 연비가 월등하지 않다면 크게 의미가 있지는 않다고 생각합니다. 같은 목적을 달성하는데에 더 간단한 구조를 가지고 있다면 그게 더 좋은 거죠 공학적으로.",32
도요타,RAV 4,수준 높은 분석이네요너무 좋네요 이런 컨텐츠,1
도요타,RAV 4,"디젤 배기가스에 대한 환경 규제가 강화되면서, 실낱처럼 이어지던 하이브리드의 명맥에 슈퍼사이클이 찾아 오고 있습니다.",4
도요타,RAV 4,스포티지가 제 아무리 좋다고 주장한들 세계기준 판매량면에서 RAV4가 스포티지보다 압도적으로 더 높은 데는 다 이유가 있죠. 그래도 디자인은 확실히 스포티지가 더 좋아 보입니다.,22
도요타,RAV 4,기자님 말씀처럼 고속주행에 현기 하이브리드가 좋은 건 보유 중이라 잘 알고 있는데 이유가 뭔지 잘 와닿지 않네요. 토요타와 다르게 고속연비가 강점인 이유가 뭘까요?,15
도요타,RAV 4,하브 시스템. 맞는말씀 하시는구만..우리나라 전기차 상용은 아~직 힘들것 같습니다.지금도 이중주차에.. 길빵에.. 주차공간이 심각함...내생각,9
도요타,RAV 4,전고체 배터리 나오기 전까진 무적권 하이브리드가 체고...,8
도요타,RAV 4,쏘렌토 하이브리드 타고있지만 만족하고있습니다.다만 변속로직과 엔진-전기 오가는 로직이 조금 아쉬운 느낌이 들어요 그리고 겨울철 외부주차시 차가 얼어서 엔진 예열하느라 전기를 거의 안쓰는데 엔진은 엔진대로 예열이 느려서 출력이 조금...,3
도요타,RAV 4,항상 심도있고 깔끔한리뷰!다만 한 가지!하이브리드 기술은 사장 됩니다!토요타를 제외한 모든 브랜드가 사장 시킬 겁니다!특히 하이브리드 기술에서 많이 처진 미국계브랜드에서 테슬라 루시드등 신생 순수전기차브랜드의 약진이 두드러지는 미국에서 하이브리드를 죽이고 빨리 전기모델로 세대교체를 시도할 겁니다!자국시장에서 토요타와 혼다의 점유율만 끌어 내려도 5~60년대의 빅3의 영광이 재현될테니까!물론 덩치 큰 토요타는 하이브리드에 안주하다 앞으로 5~10년 이내에 한번쯤 큰 타격을 받을것이고 혼다는 규모가 작아서 그런지 GM에게 플랫폼을 공급 받는 형태로 전기차 시장에 진입한다고 하네요!하지만 과거와 현재까지 누리던 시장에서의 좋은 평가와 지배력은 잃게될듯!,2
도요타,RAV 4,토요타도 차마다 다른건 아니고 세대별로 1.5리터급 1.8리터급 2.5리터급 하이브리드 시스템을 여러차종이 공유합니다,3
도요타,RAV 4,"라브4에선 얼마나 좋아졌는지 몰라도..렉서스 NX에서 경험한 바로는 전후륜 구동력 밸런싱에 문제가 참 많았었는데...모터로 구동하는 후륜과 엔진으로 구동되는 전륜에 토크가 들어가거나 빠질때 매우 이질적이며 전혀 매끄럽지 못했고, 가다서다 도심운전과 언덕길 주행에선 거슬리고 위험하겠다는 생각까지 들었다는... 4륜이 흔히 우리가 생각하는 그런 4륜이 아님!4륜으로 인한 안정성 보단 이질감으로 인한 불안정성이 더 크게 다가왔었음.하브의 연비효율 그런게 아닌.. 4륜구동의 안정성은 기대하시지 않는게 좋으실듯!그래도 구매하시겠다면 가다서다 도심주행 및 긴 언덕길 시승은 필수!",17
도요타,RAV 4,하브는 도요타 넘사벽 기술 차이는 극강임. 내구성 극강 그냥 라브4 사야됨.,6
도요타,RAV 4,가솔린으로 20년만 더버티자. 대체에너지 개발이 잘되서 내연기관 차들이 다시 흥했으면 합니다,1
도요타,RAV 4,좋은 영상 잘 봤습니다,4
도요타,RAV 4,스포티지 하브 타고 있는데정말 만족스러워요👍👍👍,12
도요타,RAV 4,리튬이온 배터리 저렴해지면서 현기가 많이 따라옴 니켈수소였으면 토요타가 넘사벽인건 맞는데 리튬이온 배터리가 이리싸질지는 몰랐었을거임,3
도요타,RAV 4,아이오닉에 들어간 아킨슨엔진이 열효율 40% 정도 됩니다,3
도요타,RAV 4,그래도 하브 살거면 직병렬방식의 차를 구매하는 게 답....,6
도요타,RAV 4,충방전이 동시에 이루어지는 건 배터리한테는 최악의 가혹조건인데 그걸 잘 견디나보네,11
도요타,RAV 4,"라브4가 혁신적이고 괜찮은 차인것 같은 설명이지만, 결국 하이브리드에서 연비면에서 그닥이면 별로란차아닌가",13
도요타,RAV 4,라브4  와우~!,3
도요타,RAV 4,현대 기아차가 이질감이 크던데요 소나타 하이브리드는 브레이크 밟을때 푹꺼지는 듯하면서 잠기는 안좋은 느낌들고 많이 개선되엇다고는 하지만 엔진 개입할때 이질감도 좀 있고 솔직히 라브4가 좋죠 실내디자인은 한국차가 낫고마지만 라브4가 한국차고 소렌토나 산타페가 일본차엿다면 산타페 소렌토 하이브리드가 한국에서 한대라도 팔수 있을까요?,2
도요타,RAV 4,"라브4의 아쉬운 점1. 고속 안정성을 택한 대신에 큰 커브에서 좋지 않은 승차감2. 도드라지는 풍절음3. 내장 네비게이션,후방카메라가 아쉽다.투싼의 아쉬운점1. 외관. 기존 외관이 더 안 질립니다.현대,기아의 아쉬운점.1. 다운사이징때문에 출력을 더하기 위해서 터보를 달았다 보니, 라브4에 비해서 엔진 반응성이 좀 많이 떨어짐.2. 1과 같은 이유로 언덕에서 살짝 아쉽다.라브4를 택하면 편의사항에 비해 비싼 느낌이 들더라도, 하브 트레인 값 한다 생각하시면 되고투싼,스포티지를 택하면 자흡 하브에 비해 살짝 아쉽지만 기타 편의사항에서 불편함이 없습니다.",6
도요타,RAV 4,"하이브리드 장,단점 감사합니다.번호판,봉인 녹방지 봉인구어셈블리 라고있네요.",1
도요타,RAV 4,하이브리드기술은 토요타가 넘사벽임,2
도요타,RAV 4,캠리하이브리드도 시승기 올려주세요,1
도요타,RAV 4,디젤 탑니다 장거리 쎄려밟고 고속 크루징 해도 기름값 만원이면 100키로 근처 타는듯 합니다,1
