car_brand,car_model,comments,likes
현대,스타리아,소니 미러리스가 손상되어 저도 마음아프네요ㅠ냉철하면서도 아주 꼼꼼한 시승기와 간접체감되는 세세한 설명까지 잘 봤습니다.김기자님 항상 응원하고 있습니다.감사합니다.,5
현대,스타리아,이차 사진으로는 별루다했만 실제로는 너무 멋진 차로 바뀌었네요 미래지향적인 디자인 최첨단옵션들 더이상 스타리아는 단순화물차가 아닌 비즈니스를 위한차라고 해도 손색이 없을거같네요 특히  두 라인으로 나눠진 부분이 확실히 승용과 화물을 구분해 놓은차 같아요,2
현대,스타리아,기존 승합차의 최대 단점인 사각지대 문제는 어느정도 해결 한 것같아보이네요.어린이용 승합차로도 기존보다 더욱 안전해 보입니다.,5
현대,스타리아,이야 스타렉스에 무드등 넣고 7-9인승 하니까 실내 개이쁘네 풀옵이 답이다그리고 시트가 돌아가서 아기 시트 끼우는거 진짜 저건 대박이다,32
현대,스타리아,스타리아 디젤이 마력 디튠하지 말고 202마력 그대로 나왔으면 더 좋았을거라는 아쉬움이 남습니다.ㅎㅎ,3
현대,스타리아,디자인 진짜 쩐다 ~~~~,1
현대,스타리아,현대 제발 둥근 디자인 손 놨으면 좋겠다... 제발 각지게 만들어줘...,4
현대,스타리아,오히려 창문 개방감은 3열이 2열보다 훨씬좋겠네요ㅎㅎ,1
현대,스타리아,전체적인 높이가 차폭에비해 높은게 사실.. 시트가 높아지는 이유.. 좀 낮추면 전체적인 밸런스나 운전할때도 좋을듯...계기반은 동일한걸 여러차종에 쓰는가보군요,2
현대,스타리아,기존 스타렉스의 최대의 단점 주행중 엔진소음 노면소음 풍절음인데많이 개선된듯합니다,1
현대,스타리아,"옆유리가 너무 커져서 기괴하다는 느낌이 들었는데, 그래도 잘 만들었네요.동네에 주차된 실물을 보고 왔는데, 생각보다 괜찮아 보이더군요.",1
현대,스타리아,무조건 좋다 좋다 아니고 아쉬운점 확실히   지적해주시네요^^그리고 솔직히 모니터에 네비게이션 내장보단 차라리   핸드폰 미러링 기능이 들어갔음 하는 개인적 생각이네요,1
현대,스타리아,카메라 700만원...ㅠㅠ 게임 광고가 이래서 들어간 거군요~ 스타리아 깔끔하니 예쁘네요,22
현대,스타리아,저정도 크기에 디젤 2.2 엔진이라...힘이 딸릴것 같은데...적어도 2.5 면 어떨지...근데 LPI는 3.5라 괜찮을듯하네요,2
현대,스타리아,리무진 풀옵션 기대됩니다,1
현대,스타리아,전조등의 조도가 야간주행에 충분할지 궁금하네요 ㅎ,2
현대,스타리아,"차량에 대한 관심 너머, 김한용 님의 나레이션이 더 흥미로왔......습니다.차량 자체로도 많은 관심 go~ ",1
현대,스타리아,"스타렉스는 FR(프론트 엔진,리어 드라이브) 방식이었는데.스타리아는 ff(프론트엔진, 프론트 드라이브)방식인데승차감의 차이가 어떤지 궁금하네요.",2
현대,스타리아,측면 사고나면 창문밖으로 팅겨져 나갈것같아서 위험해 보이네요ㅠ,8
현대,스타리아,궁금한건 수소전기차로 나오면 승차감이 많이 좋아질까요?,3
현대,스타리아,3:16 이런 설명 정말 원했는데 도움 많이 됐습니다 감사합니다!!,9
현대,스타리아,고급스럽네요 ,1
현대,스타리아,디자인도 멋지고 장점도 많고 대박사겠네요.굿입니다.,1
현대,스타리아,2열 창 열림 수동으로 한 건차박할때 정지시에도 창을 열 수 있도록 한 것 같습니다후면쪽 창 열림도 마찬가지 인 것 같습니다전기차로 나오면 차박전기차 V2l 기능 차박,2
현대,스타리아,현대 엔진중에 그나마 문제 없는 디젤 넣었네요 블럭이  스틸에서 알루미늄으로 바꼈다던데 어떻게 될지는 모르지만,2
현대,스타리아,페리할때마다 그릴 달라지면 나름 새로울듯,1
현대,스타리아,시트 회전하는건 정말 맘에드네...,7
현대,스타리아,김한용 님 덕분에 골뱅이 주차장 커브 구간에 주차를 할수 있게 되었습니다.좋은 유익한 정보 감사합니다.(feat.TESLA마덜3),1
현대,스타리아,와우~  세심한 설명 아주 좋아요LPI 스타리아 11인승 관심이 가네요~구독 & 좋아요 꾸욱입니다^^~,1
현대,스타리아,승차감은 차의 용도상 어쩔 수 없어도 2열 창문 개방감을 포기한 건 크게 아쉽다 감성EQ가 딸리면 결정적인 실 수를 하기마련 ...단체 여행에서 장거리 여행의 제일 핵심은 개방감아닐까 창문에 창살이 있는 건 아 너무 이숩네요 경치를 보는 행복을 못 나누겠구나,1
현대,스타리아,좋은건 좋다 나쁜건 나쁘다라고 리뷰 하시는게 전문성있게  보여집니다,3
현대,스타리아,스타리아 1열 측면 윈도우가 크다고 하시는데 1세대 스타렉스도 저정도로 커서 비슷한 느낌이 납니다.,1
현대,스타리아,어이구..ㅋㅋㅋㅋㅋㅋ 카메라도 뿌셔먹는 스타리아! 인기가 대단하네욬ㅋㅋㅋㅋㅋㅋㅋㅋㅋ,15
현대,스타리아,3단계 자율주행 되면 운쥔은  차에 맏기고  2열에  타고다니면  데일리카로도 좋을듯,2
현대,스타리아,캬 풀폴딩 에어메트 하나면 바로 차박 고고씽이다. 잘나왔다. 흥해라 스타리아~~,1
현대,스타리아,수소연료전지차 도 나온다고 들었는데 그때 기대 해봐야겠네요,1
현대,스타리아,9인승이상 스타렉스 110km 속도 제한 때문에 출력이 낮다고 느끼는 건 아닌지요? 예전 스타렉스들은 출력이 충분 했는데 락 걸리고 나서는 100km/h 에서 추월이 어려워 졌거든요,2
현대,스타리아,센터 터치 버튼 진짜 너무 불편해 보이네요.... 현대는 탑승자를 고려한 설계를 좀 해주었으면 합니다...,3
현대,스타리아,인트로 좋은데요? 발전하는 모카 편집자 작카 모카 대장님 고생이 많으시네요,5
현대,스타리아,지상고가 높은 차량들이 운전하는 재미가 있음..승용차에선 절대 못느끼는 하늘을 나는 느낌이랄까 그런게 있죠,1
현대,스타리아,스타리아 확장형 캠핑카가 나왔음 좋겠다.욕실있는걸로 ㅎ 대박날텐데,5
현대,스타리아,저렇게 수많은 중앙 터치식 스위치들은 정말 어렵네요.,1
현대,스타리아,33:23 뒷좌석 승차감을 칭찮 하고 계신 와중에 화면에 보이는 방지턱 넘는 스타리아의 움직임은 결코 승차감이 좋아 보이 지가 않네요...ㅎㅎㅎ,1
현대,스타리아,이 형 진짜 차를 잘 설명하시는 것 같아,2
현대,스타리아,로고 애니메이션 변경되었군요. 훨씬 깔끔하고 전문적인 지식전달 채널 같아요.,12
현대,스타리아,와.. 운전석 사이드개방감 어쩔!,1
현대,스타리아,17:08 제조사의 원가절감 꼼수,77
현대,스타리아,개일 취향이지만 스타리아 많이 본입장에서 흰색이 너무 예쁘네요ㅎ,2
현대,스타리아,운적석 높이를 보믄 딱 봉고화물차입니다..그냥... 화물차로 보이네요..카니발 승!!!,1
현대,스타리아,9인승 사고싶네요. 아주 좋으네요.,1
현대,스타리아,보고보고 봐도 또봐도 그냥 스타렉스네요ㅋㅋ 딱 학원차 30년전 태국여행 갔을때 버스 창문크기가 저랬어요,2
현대,스타리아,9:42 열릴 때 껴도 충분히 박살낼 수 있단 얘기가...? ㄷㄷ,2
현대,스타리아,크... 이제 납치 차량으로 쓰기에는 아까운 디자인이야..,6
현대,스타리아,검정이 진리인것같습니다 디자인 정말 우주선같아요,1
현대,스타리아,카바쳐주려고해도 센서부분에서 원가절감 여지없는거 같네요 ㅎㅎ,1
현대,스타리아,지금 보니까 1세대 스타렉스 느낌도 있네요,1
현대,스타리아,역시 카니발 경쟁이 아닌 스타렉스 후속임 04:21  카시트 던져버림 ㅋㅋ,2
현대,스타리아,이게 전기차로 바로 나왔으면 다 씹어 먹었다,2
현대,스타리아,한강 제방도로 지나가던 스타리아 봤는데 그게 한용이형이었구나......,7
현대,스타리아,고속도로에서 1주전에 검정색 스타리아 봤었는데 스타렉스보다 커보이던데... 앞 일자 led 빛이 엄청 세진 않더라고요..,1
현대,스타리아,이건 무조건 lpi로 가야죠...,4
현대,스타리아,스타리아 라운지 9인승도 시승해 주세용~~^^,1
현대,스타리아,와 시트돌아가는건 대박이네요,3
현대,스타리아,스타렉스 고급화 버젼.이제 영화촬영장에서 구형차들 많이부서지겠네요,1
현대,스타리아,"수출을 어느 나라에 하는지, 차체 강도 특히 루프강도는 얼마나 보강되었는지 궁금합니다. 시에나는 미국 출시차라 안전도는 보장되는데, 스타리아는 얼마나 안전한지 알고싶어요. 아이들하고 부모님까지 같이 타실차라서요.",3
현대,스타리아,개방감은 좋은데 1열 경우 벨트라인이 너무 낮아 안전도 시험에선 어떨지 궁금합니다,1
현대,스타리아,창문 열고댕기면 그냥 문짝 없는 상태로 달리는 느낌 날듯 ㄹㅇ,7
현대,스타리아,현대한테 이쁨받는 모카♡,1
현대,스타리아,궁금증이 있습니다. 스타리아 문열면 자동 파킹되던데... 달리는 중에 문열면 오토기어 파킹이 되나요??,1
현대,스타리아,전기차가되면 캠핑카로 많이 팔릴것같아요 ㅋㅋ,2
현대,스타리아,엠블럼이 그릴 중간으로 갔으면 더 좋았을텐데,2
현대,스타리아,차모양이 예전에 삼성 조약돌MP3플레이어 같네요ㅎ처음으로 승합차가 탐나네요,1
현대,스타리아,카메라 700  ㄷㄷ 가셨네요,56
현대,스타리아,그레이스-스타렉스-스타렉스 쓰고있어요이 상황이면 사실 다른 대안이 없습니다너무 궁금한 차라서 영상만 기다렸어요영상 잘봤습니다 ㅎㅎㅎ,1
현대,스타리아,비영업용으로 타고 다녀도 괜찮은 디자인이라 전고 낮은모델 높은모델 두개였으면 좋았을듯. 전고 한 3센치 낮으면 .,1
현대,스타리아,11:45 맴찢..ㅠㅠ 장착된 상태로 문을 열어버리셨네요..ㅠㅠ 차 유리에 장착하고 나서는 유리창 내리는것도 조심 ;;;,1
현대,스타리아,"퇴근길에 밀려서 시승중인 차 계속 따라가게됐는데... 뭐랄까, 그냥 여전히 짐나르는 스타렉스 느낌이 강하던데...",1
현대,스타리아,강철값이 올라서 저렇게 뺀건가.. 사고났을때 저큰 유리창이 어떻게 될런지 궁금하네요..,1
현대,스타리아,12:53 와 존멋,90
현대,스타리아,스타리아 라운지 7인승을 보고 있는데요... 옵션에 사륜구동을 추가 해야 하는지 고민이 됩니다.,1
현대,스타리아,카니발 타고 골프 치러 가는 사람은 봤어도 아직까지 스타렉스에서 내리는 사람들은 못 본 거 같음ㅋㅋㅋ,36
현대,스타리아,카니발하고 진짜 다르죠...쥐도새도 모르게 운전중에 훅가니 ㅎㅎ,1
현대,스타리아,2열 창문은 스타렉스랑 비슷하네요 카니발은 전동으로 위아래로 열리는데,1
현대,스타리아,옵션장난질의 끝판대장인건가 ㄷㄷ,1
현대,스타리아,타보지는않았지만 우리나라는 승합차의 개념을 완전 바꾼 모델인거같아요.일본도 승합차를 일반승용차를 타는분들이많은데 우리나라도 그런차가 나온듯하네요,1
현대,스타리아,전륜이라... 바닥이 낮을 줄 알았는데.. 아쉽네요. 이스타나처럼 바닥이 낮으면 좋았을 것을...,1
현대,스타리아,11:05 대표님도 몰랐던 경품추첨 ㅋㅋㅋㅋㅋㅋㅋㅋㅋ,16
현대,스타리아,디자인만 봐도 카니발 하고는 비교가 안 되는데요^^,1
현대,스타리아,기존 스타렉스는 2열시트 회전방향이 외부 쪽으로는 안 됐는데..저기 앉아서 낚시 해도 될듯 ㅋㅋ,1
현대,스타리아,옆으로 충돌사고나면 .... 아찔하겠는데요 ㄷㄷㄷ;;;,2
현대,스타리아,스타리아 가속성능과 연비는 어떤가요?,1
현대,스타리아,와~~ 엔진이 운전석 앞까지 들어가네요 흠.........디젤사면 죽것는데 ㅎㅎ,1
현대,스타리아,11:43 안전장치가 있을텐데? 카메라 콰직= 24:54 브레이크 밟지 말아보세요. 쾅,12
현대,스타리아,시트 맘에든다ㅠㅠㅠㅠ,2
현대,스타리아,그래도 카니발의 적수는 안될듯하네요.기존 스타렉스보다 못해 보이네요.,1
현대,스타리아,디젤이 아쉽네요설명 감사합니다 ^^,1
현대,스타리아,제 지인도 스타리아 11인승 학원차로 구매했습니다.카니발 나왔을때는 사고 싶다고 안했는데 이번 스타리아는 실소비자가 봤을때 스타리아가 잘 나왔다고 생각하나 봅니다.,1
현대,스타리아,9인승 세금....7.9.11인승   세금 및 보험 장단점비교하는게 있으면 선택에 도움이 되겠네요. 지인이 선택장애가있어서요,1
현대,스타리아,"""광고 못건너뛰기"" 신박하다....",92
현대,스타리아,2.2 디젤이 좀 아쉽네요 그렇다고 기존 2.5디젤은... 소음 진동 출력 모든 면에서 더욱 별로인지라... ㅋㅋㅋㅋ 아 순간 치고 나가는 토크는 2.5디젤이 더 낫기도 했네요(수동미션기준),1
현대,스타리아,11:20 세계 최초로 우회전 하다가 창문 너머로 운전자가 추락했다는 뉴스 해외토픽에 뜰 날이 멀지 않았다,9
현대,스타리아,오늘도 모닝 모카 아주좋아요 ㅎㅎ 그나저나 트렁크에 선영작가님은 몇명 들어갈수 있나요 ?.?,1
현대,스타리아,시트를 돌렸을 때 에어백같은 안전사항은 기본적으로 생각했겠죠...?,1
현대,스타리아,"현대의 개 아니랄까봐, 폐기물급 차를 포장하느라 애쓰시네요 언제나 화이팅",2
현대,스타리아,장거리에서 시야각이 나름 얼마나 중요합니까 그게 안 중요하면 고속버스 탈 때 창가에 앉을 이유가  딱히 없죠,2
현대,스타리아,승차감 평이 아주 나쁘던데요. 특히 3~4열은 최악이라고 하네요,1
현대,스타리아,프리미엄도 엿맥이는 60초 광고 잔인하네요ㅋㅋㅋㅋㅋㅋㅋㅋㅋㅋ,10
현대,스타리아,현대의 욕심과 야망이 가득 들어간 느낌이네요ㅋㅋ,2
현대,스타리아,역시현대의개 김기자!,1
현대,스타리아,김한용 기자님 스타리아 2열 창문 아래로 내려가는 옵션도 있나요?,1
현대,스타리아,광고가 한개도 불편하지 않은 모카 ㅋㅋㅋㅋㅋㅋ,2
현대,스타리아,저 봉고차 살빠에는 기다렸다가 2022~2023에 카누나 카누픽업캠핑용차를 사는게 낮겠네요.일단 특별한사람들은 저 스타리아를 꼭 구입해서 사용하겠지만요 ㅋㅋ,2
현대,스타리아,계속보니까 이쁘네요,7
현대,스타리아,와 이제 디자인들이 진짜 미래식 처럼 나오네 ㄷㄷ,1
현대,스타리아,창이 넓어서 전복시 더 위험한건 없을까요?,1
현대,스타리아,운전자 쪽 측면추돌시 위험해보이네요,1
현대,스타리아,드라이브모드 버튼은 사실상 몇일만타도 금방 찾을위치인데요 ㅎ,1
현대,스타리아,이거 전기차 모델도 나온다고 하는거 같던데.. 그게 졸라 기대됌.,3
현대,스타리아,광고 천국 이군요~ㅜㅜ,21
현대,스타리아,오! 오프닝이 고급지게 바꿨네요. 멋있습니다,3
현대,스타리아,ㅋㅋㅋ 광고 못 건너뛰기 대박 첨 봄,7
현대,스타리아,학원차 제약회사 도우미차량 ㅎㄷㄷ,1
현대,스타리아,법타렉스의 아성을 뛰어넘지는 못하겠군요,1
현대,스타리아,모양이 기괴하긴한데 막상보니까 이뿌네..,1
현대,스타리아,스타리아에 루프트필터끼고 2열에 누워서 로드모바일 하면 되겠네요,1
현대,스타리아,2열창문이 전동이냐 아니냐보다 시야각을 가리는 건 너무 치명적 아픔이네요 2.5엔진이 안들어 가서 다행이긴 하네요,1
현대,스타리아,이걸 차라고 만든건가 하는게 느껴진다 ㅋㅋㅋㅋㅋㅋㅋ,10
현대,스타리아,lpg  로 하면 연비가 폭망 일듯   충전하고 오면 ~ 다시 충전 하러 가야 하는 재밌는 차가 될지도 ㅋ,1
현대,스타리아,밴 기종에  4륜이 필요합니다적극적으로 어필합니다,1
현대,스타리아,광거 못건너띄기 ㅋㅋㅋ 잘보고 가요.,1
현대,스타리아,"맞아요. 뒷자리 앞자리에 어린이, 다리 불편한 분들이 쉽게 오르내릴수 있도록 , 스쿼드 가 있어야 해요.너무 높아요.",1
현대,스타리아,현대에서 나온차중 유일하게 맘에 드네 (디자인 빼구),1
현대,스타리아,역시 칭찬 일색~ 제조사가 좋아하는 채널,4
현대,스타리아,스타리아 직접봤는데  트렁크가진짜 크더라고요  비는그냥  피할수있겠어요,1
현대,스타리아,스타리아는 디자이너가 햄스터를 좋아해서 햄스터를 형상화 했다는데진짜군요 ㅎㅎ 귀여운 햄토리같네요,1
현대,스타리아,5밴도 궁금합니다 담에 부탁합니다,1
현대,스타리아,추월 힘든건 스타렉스 속도110  리미트 걸렸을껀데..이제 풀려서 나오나요?,1
현대,스타리아,"1열 3좌석 넣은거보면9인승 3,3,3배열 나올수 있는건데.......3,3,3 배열 9인승이 다시 나오면 좋겠습니다.예전 카니발1세대 3,3,3 배열 공간활용도 최고였습니다. 요즘 카니발 9인승은9명이 다 못타죠. 탄다고 쳐도 9인승이4열까지가면 짐을 실었을때 4열 사용이불가해서 9명이 다 못탑니다.333배열으로 4열을 남기면 9명이 다타면서도 짐을 가득 실을 수 있지요.스타리아에서 1열에 다시 3개의 의자를넣는걸 보여준 이상 3,3,3배열이 안전성과연관없이 다시 가능하다는걸 보여줬길래이 글을 씁니다.",1
현대,스타리아,광고 못건너뛰기 이 표시가 없었으면 그냥 불만없이 보는데 ㅋㅋㅋ 시간 줄어드는 것 계속 보고 있으니 킹받네 ㅋㅋ,5
현대,스타리아,"이차는 까다로운 한국 시장보다.유럽,남미,북미쪽에서는 대박이다.",1
현대,스타리아,21:18 너무 잘한짓인것 같아요ㅋㅋ,15
현대,스타리아,이쁘게 만들어논 화물차라고 보는게 맞을듯,1
현대,스타리아,현대가 드디어 제대로 만들었네!예쁘군요,1
현대,스타리아,우산 수납까진 아니어도 꽂이?정도하고 2열쪽에 신발같은거 수납공간좀 더 다양하게 넣어줬음 하는 바램이다. 우산꽂이는 2열쪽 문열리는곳에 한두개 만드는거 어렵지 않을거 같은데..세로로 꽂아둘수 있게..,1
현대,스타리아,카니발 15 16 엄청 잘나오는거넹 ㅋㅋ,1
현대,스타리아,가격 겁나 비싸진 스타렉스... 승차감은 80년대 봉고차..,2
현대,스타리아,4:18초 카시트옴기다 차시트에 기스남... 내차도아닌데 맘아프다 ㅠ ㅠ,4
현대,스타리아,안에서는 밖이 엄청 잘 보이는데 밖에서는 잘 안 보이는... 오,1
현대,스타리아,스타리아 뒷모습은 벤츠v클래스랑 흡사한듯한 느낌이네요. v클래스 처럼 뒷유리만 개방되도 실용적이였을듯 하고요,1
현대,스타리아,운전석 보조석 유리엔 1/3 정도 아래에 아예 검게  썬팅해야할거같네요;;;;;,1
현대,스타리아,시트 돌아가는거 좋네요..카시트는 졸업해서ㅎ,1
현대,스타리아,실내 전혀 고급스럽지 않네요 ㅋ창문 수동으로 당기는 모습 참 간지 납니다. ㅋㅋ,1
현대,스타리아,"ㅋㅋㅋㅋㅋㅋㅋㅋ 게임광고도 잼난데, 자막에 ""광고 '못' 건너뛰기"" ㅋㅋㅋㅋㅋㅋㅋㅋㅋㅋㅋㅋㅋㅋㅋㅋㅋㅋㅋㅋ",47
현대,스타리아,뭔 옵션이 이리 많어.역시 옵션장사꾼 현다이.,2
현대,스타리아,"차박용으로 스타리아를 고려해봤는데 시승기를 보면서 단념했다. 출력이 낮아진 것이 가장 결정적이다. 모는 더더구나 아니고, 또도 게도 아닌 잡탕짬뽕 같은 하찮은 느낌이 든다.",1
현대,스타리아,그냥 차 좋다 리뷰인듯,1
현대,스타리아,솔직히  스타렉스 고급형 살바에  카니발을 사지 ㅎㅎ스타렉스는 학원차 or 밴   이 두개의 용도가 9할은 될거 같네요,1
현대,스타리아,고속도로 주행시 바람에 휘청 거리는 부분은 여전할듯 보이네요,1
현대,스타리아,24:56 기마뇽: 브레이크 밟지말아보세요스타리아: ㅇㅇ,42
현대,스타리아,2.2디젤 ...힘이 부족하지 않을까요 예전에 2300 9인승 힘이모질라서 힘들었는데 ..어쩔지 모르겠네요,1
현대,스타리아,"""광고 못건너 뛰기"" 젤웃기네 ㅋㅋㅋㅋ",18
현대,스타리아,컨셉디자인만 봤을 때는 별로였는데 실물 보니까 되게 괜찮네... 특히 회색 갠적으로 되게 좋은듯,2
현대,스타리아,카니발 프레임을 위로 뒤로 덧붙여서ㅜㅜ 3열타면 바로 멀미ㅋ 가족이 다같이 타는차 아닙니다. 단 시트만 좋음.,2
현대,스타리아,첫 차가 아버지께서 물려주셨던 스타렉스였는데ㅋㅋ 이거도 궁금하네요,1
현대,스타리아,"광고 짱났는데, 고까카메라 파손 보고나서 납득가능 ㅎㅎ",1
현대,스타리아,기대했는데..너무비싸고 공간큰거말고는 장점이없네,1
현대,스타리아,"광고 못 건너띄기도 당황스러운데.,. 광고가 또 나옴ㅋㅋㅋ",12
현대,스타리아,막내작가님 나오는 10:14 광고 못 건너 뛰기  ... 너무 참신하네요 ㅋㅋㅋ 광고 나오는데 짜증나는 건 또 처음,1
현대,스타리아,"9인승은 7인승처럼 전동시트나 열선,통풍은 없나요?",2
현대,스타리아,하이브리드옵션이 있었으면..쩝,1
현대,스타리아,이번에 아예 범퍼라고 할게 없어졌네요....... 범퍼는 안전에 아무런 도움이 안돼나요? 라고 제조사에 묻고 싶네요. 점점범퍼 같지 않게 만들더니 이젠 차제조사들은 범퍼를 없앨 계획인가보네요.물론 안박아야 하겠지만 그게.. 될까요? 제조사들의 상술이 디자인라는 이름으로 잘 가려지는듯하네요..,1
현대,스타리아,아니 디젤이제 안탈텐데..디젤을 출시하더니..왜  개발비를 버리다니..당근 가스차죠...정말 조용하거든요..근데 차는 타고싶네요,1
현대,스타리아,모카가 게임광고를 할줄이야 ㅋㅋㅋㅋㅋㅋㅋㅋ,6
현대,스타리아,스타리아도 하이리무진 버전 있으면 좋을꺼같은데,1
현대,스타리아,혹시 전기차는 엔진이 없어서 사고시에 더 위험한가요??,1
현대,스타리아,4:51 근데 뒷좌석 사고나면 위험해보이는데....,2
현대,스타리아,스타렉스를 단종하고 스타리아만 판매한다면 결국 판매가를 올리려는 꼼수인 것으로 보인다.애초에 스타리아는 카니발과 경쟁하기엔 덩치가 큰 상용차이기 때문에 패밀리카로 보기엔 어렵고그 시장 진입도 힘들 것으로 보인다.,1
현대,스타리아,탱크 안타보셨군요~~ ㅋㅋ 탱크 엄청 좁아요 ㅋㅋㅋ,2
현대,스타리아,17:19 화물이구나.....,56
현대,스타리아,스타리아 괜찮아 보이네요.,1
현대,스타리아,23:33 방지턱에서 무조건 떨어지겠네ㅋㅋㅋ,4
현대,스타리아,"광고 빨리감기 하면 되는데,끝까지 본 분들이 꽤 있네요ㅎㅎㅎ,아이디어 베리굿",1
현대,스타리아,아 은하계 최초 시승은 못참지!,1
현대,스타리아,창문턱 팔걸이는 르노마스터가 그렇습니다. 개방감이 비슷할 거 같네요.,1
현대,스타리아,"""애를 끼워""에서 현웃 터졌네요 ㅎㅎㅎㅎ",3
현대,스타리아,열선과 통풍을 동시에 하는 기능도 있어요???,1
현대,스타리아,4:22 아빠의 한풀이ㅋㅋㅋㅋ,135
현대,스타리아,가정용으로는 카니발이 더 좋아보입니다 스타리아는 화물용이나 사무용으로 더 인기가 좋을거 같은데 이럴거면 후륜인게 더 좋았을쩐 했네요,1
현대,스타리아,유튜버들이 점점 언론화 되고 있다는 느낌을 주는군요.,2
현대,스타리아,몸에 무게중심이 허리위인데.사고시 엄청나겠군요.전복당했을때 사이드쪽 엄청 위험해보이네요.원초적인 사고예방은 생각안하고 만든듯 합니다.,1
현대,스타리아,결국 디자인은 화려하고 예쁘고 실내도 다양한 시도를 하지만 상용 화물차에 가깝다는 느낌을 받네요. (1세대 구매는 흑우지),1
현대,스타리아,"미국에 안들어오나요? 수입하면 미니밴들 제치고 대박나겠는데. 일단 캠퍼, 서퍼들에게도 안성맞춤으로 쓰이겠네요. 디젤 대신 3.5리터 정도의 개솔린이어야 하겠고요~~",1
현대,스타리아,35:33 잘생겼다... 한용형님이,26
현대,스타리아,예전 스타렉스처럼 프레임이 부식되는 그런 일은 없으려나요?,1
현대,스타리아,스타리아는  스타리아   라운지 7인승에  검정색외장에  흰색  내장이 젤럭셔리 한듯,1
