car_brand,car_model,comments,likes
기아,K9,기어봉이 너무 예뻐요!최근 기아자동차에는 저런 기어봉이 스팅어랑 k9밖에 없어서 아쉽네요ㅠ,51
기아,K9,자동차도좋고 설명도 매우잘해줘서더 좋아보입니다올뉴K7도 만족하는데K9기대됩니다,5
기아,K9,진짜 기아 별로 안좋아하고 완전 그랜저빠였는데 기아 k시리즈 갈수록 디자인 너무 이뻐진다,10
기아,K9,G80보다 확실히 좋더라구요 등급은 무시 못합니다 G80이 옵션가격이 추가하면너무 비싸요 ㅠ k9이 옵션가격폭이 적더라구요..,68
기아,K9,항상 느끼는거지만 타이어 수리키트와 함께 타이어 공기압조절기를 넣어줬으면 좋겠네요.,5
기아,K9,근데 개인적으로 k9은 젊지도 그렇다고 중후하지도 않은 애매한 디자인 같아요.. 세련됨과 보수적인 느낌이 섞여있는거 같아서 사는사람도 애매할거 같아요..,25
기아,K9,V6 3.5T랑 V8 5.0NA를 넣었으면 어땠을까 하는 마음이네요,2
기아,K9,기아차가 디자인이 맘에 듬..,3
기아,K9,성공의 냄새 ㅋㅋ 김한용 기자님 아재개그 ㅋㅋ 커피 마시다 뿜을뻔 했습니다 ㅋㅋ,6
기아,K9,한용행님은 역시 뒷자리가 안 어울립니다운전석이 행님자리네요뒷자리는 직원들 자리입니다.직원들모시고 다니시는 행님 모습이 찐 대표모습^^새해 복 많이받으세요,4
기아,K9,부츠타입도 변속레버가 예쁠 수가 있구나 역시 갓성비 케나인,1
기아,K9,회장님차 소개가 잘 어울리심 스포티한 차는 신입에게,4
기아,K9,G90이랑 주행질감 비교가 없는게 아쉽네요 ㅜ,1
기아,K9,디자인은 몰라도 k9 차 성능에 대해서만큼은  안좋은 평을 단 한번도 본적이 없음.,36
기아,K9,디자인은 전께 훨씬좋다 ㅠㅠㅠ 다음 K9 기대해본다...,18
기아,K9,현기차량들 전부 오토에 히터가 발로향하는것은 추운겨울날 오토는 발로 나오더군요. 여름에 에어컨오토는 앞으로 향하고요.. K9 후기 잘봤습니다.,1
기아,K9,g80이 너무 잘 나와서 그렇지 k9 디자인도 예쁨,35
기아,K9,그 전꺼사 진짜 디자인 좋았는데...실내는 여전히 너무 고급스러유ㅓ보인다 ㅎㅎ,12
기아,K9,하이브리드도  나온다는 말이 있던데 정말 나올까요? 전기차는 아직은 조금 불편할 거 같아서 하이브리드 나오면 먼저  이런 차를 타보고 싶네요.,3
기아,K9,뒷모습은 구형이 더 이쁘다 생각되네요,25
기아,K9,k9은 실물로 봐야 이쁩니다. 영상으로 다담기힘들어여. 그냥 광고나 유튭으로 많이 봣던차중 하나인데 실물로 보니까 진짜 고급져여. 백라이트가 영상과 사진에선 그저 생선뼈이지만 실물로 한번보십쇼. 생각보다 크고 어색하지않아여.,38
기아,K9,허나 네임벨류가 받쳐주지 못하는게 흠이죠.그거 아니면 G90에 근접할텐데 말이죠.,11
기아,K9,디자인이g80이넘사라..국산차중 g80이 제일이쁜듯,49
기아,K9,G80 계약까지 했다가 시승해보고  k9 으로 구입 했습니다. 만족하며 잘 타고 다닙니다. 개인적으론 g90 한번 타보고 싶네요,1
기아,K9,차 좋네요 !,2
기아,K9,유일하게 3800cc 자연흡기가 있다는 것은 너무 좋음. 부모님이 g80(dh) 3800cc타고 계신데 운전해보면 만족도가 상당히 높음.하지만 s580에는 있는 v8 엔진이 현기제에서는 없어지고 못타보는게 아쉽다.,5
기아,K9,오너드리븐위주 옵션으로 넣자니 첨단옵션을 선택할수없고 차가이뻐서 포기할순없고...,1
기아,K9,진짜 고급이당,2
기아,K9,깡통도 좋다고하는데~ 궁금해요~~~깡통도 리뷰한번해주세욤~,1
기아,K9,3년뒤에 감가맞으면 사야겟다 지금g80   2018년식타고있는데요요즘 k9끌려서  새차사기엔 비싸고 3년뒤 감가 오지게 된후에 사야겟네요,4
기아,K9,k9의 내연기관 마지막 모델이 되겠네요...그동안 고생했어요~k9,4
기아,K9,"제네시스의 이전 dh모델을 베이스로 엔진,밋션도 그대로사용...그냥 디자인과 세부옵션의 차이만 있는건 인정해야할부분입니다...마지막 k9이 될거란 썰이 돌곤하는데...그부분도 알려주심 좋겠습니다",1
기아,K9,흰색 실물보고 지렸는데 진짜,6
기아,K9,김한용님이 싫어하는 2세대 플랫폼으로 알고 있는데 좋다니요!! 혹시 3세대로 바뀐건가요?,5
기아,K9,다른걸 다 떠나서 전자식 기어봉 있는거 진짜 맘에 든다. 현대도 좀 보고 배웠으면 하네. 진짜 다이얼이나 가어봉으로 바꿔주는게 그렇게 덧나나,1
기아,K9,차주인데 트렁크 싸이드 그물 내려지는거 처음알았네요;;;;감사합니다^^,4
기아,K9,9:39 비교대상은 아니다만 k3옆에 지나가는거 좀 귀엽네,3
기아,K9,잘됐으면 하는 좋은차~~,4
기아,K9,공도에서 본적이 진짜 손에 꼽을정도,2
기아,K9,요즘에 나온 골프백은 좀 길어서 4개 안 실리던데요.. 옛날 거 는 4개 거뜬합니다,1
기아,K9,전 아직도 페리 전 디자인이 더 나아보이네요페리는 앞뒤가 너무 따로 노는 느낌들어서,49
기아,K9,한용이형 매일 챙겨보는 구독잔데 질문이 있어요트래버스 페이스리프트는 언제 출시될까요?시승기는 바로 올려주실꺼죠?,2
기아,K9,차량 리뷰가 너무 정확한거 아닌가요 ㅠ ㅎㅎ,1
기아,K9,제네시스 브랜드 무시할 수가 없네요. 브랜드 갭차이가 너무 납니다. 선택지가 있다면 G80. 고로 감가도 크고 한계가 명확한 k9 입니다.,8
기아,K9,항상 잘보고 있습니다    현대 파워택 8단 자동변속기 문제 많아요  변속기가 깨지고 그런건 없지만 저속시 변속 타임을 잘 못잡아 주어서 울컥 거리는 증상이 있습니다  출발시도 마찬 가지이구요   제네시스 동우회및 k9 동우회 에서도 이 문제로 많는분들이 골치 아퍼합니다    k9 제차도 그러구요.....문제는 현대가 이걸 정상 이라고만 하고 해결 할려는 의지도 없다는 겁니다   자동차 유튜버 분들  시승기 보고 차를 구매 할때 참고하는 사람들 많습니다   다른 분들도 마찬가지 이지만 무조건 칭찬 보다는  이런 이슈를 좀 알려주셨으면 합니다  그래야  차 구입 할떄 참고를 하지요  수고하세요,29
기아,K9,브레크등 디자인이..... 전조등이랑 . 통일 되게 만들었으면 좋았을 텐데...,1
기아,K9,뒷모습만 바뀌어도 두배는 더 팔릴 것같아요,7
기아,K9,오차량좋네요,2
기아,K9,기존 예쁜디자인에 찬물을 끼얹는 리어램프,8
기아,K9,난 그래도 전 모델K9이 더 디자인이 좋왔던거 같은데?  나만 그런가?,5
기아,K9,현대보다 기아가 엠비언트 라이트도 이쁘게 잘 넣어줍니다,2
기아,K9,"한용님, 신차소개 감사해용~잘볼께용~사업자명의차량을 중고로 팔게 되면 개인명의차량 판매보다 중고차 값을 못 받게 되는게 맞나요?그런 얘기때문에 사업자로 사야할지...개인명의로 사야할지 고민이네요;",8
기아,K9,K9은 확실히 대형세단 느낌 물씬나서 g80보다 비싼차럼 생긴거 같아요,13
기아,K9,밤에 정차해서 천천히 엠비언트라이트 좀 촬영해주시면 좋을거 같아요,1
기아,K9,k9이 좋은차인건 맞지만 또 한편으로는 말씀하신것처럼 일반인이 살 사람은 거의 없고 대부분은 기업중직들이다보니까 k9살꺼면 g90으로 많이들 가시는것 같네요.....이 차도 단종한다는 썰이 슬슬 들리던데,2
기아,K9,장점: 대형세단 최고의 가성비 차단점: 제네시스 사러감,42
기아,K9,중고로사면 개꿀인차 ㅎㅎ,18
기아,K9,휠 디자인이랑 크기가 아쉬움G80도 20인치 나오는데윗급인 K9이 19인치까지만 나오니..,3
기아,K9,실내 디자인은 나쁘지 않네요. 월드탑 수준인 것 같아요.마음에 드는 실내 디자인을 가진 차는 거의 없죠. 거의가 아니고 없다고... 새로운 개척 분야임^^자동차의 애플은 아직 나오지 않을 것 같아요. 디자인 측면에서. 아마 기능적인 제약이 많아서 그렇겠죠?깔끔하고 미려한 디자인이긴 한데 디스플레이가 좀 어색하도 우뚝 서 있고예쁘기가 불가능한 공조기 홀들이 벤츠만큼 흉물스럽진 않지만 시계 좌우의 벤트홀들은 감점요인이고그중 최악은 기어봉. 좀 없애지 앤간하면.,2
기아,K9,k9 전 모델은 좀만 다듬으면 압살할만한 디자인인데 아쉽다. 모든게 조금씩 아쉬움.,13
기아,K9,"K9장점 : 기아의 플래그십 세단  가성비갑           고급스러운디자인단점:  기아 , 왜 제네시스안사고 소리들음",15
기아,K9,성공하신 김한용님!,1
기아,K9,예전 2세대와 g90비교 영상 기억나는데...괴상 망측한 차라고...디자인 이게뭐야  별로라고 했었지 않았나?,4
기아,K9,혹시 기회되시면 아우디 RSQ8도 리뷰해주시면 안될까요~? ㅠㅠ,1
기아,K9,현대차도 사주세요ㅠㅜㅠㅜㅜㅜㅜㅜㅜㅜㅜㅜ,1
기아,K9,근데 K9은 신차임에도 2세대 플렛폼 아니던가요?서브프레임 보니까거의 K5수준인것 같던데 어떻게 생각하시는지,23
기아,K9,점잖고 무작정 까지않고 자극적인거 안 하고 최곱니다,1
기아,K9,제 차라서 그런가 몰라도.. K9은 페리 이전이 이뻐보여요,4
기아,K9,K9은 화이트가 흰고래같이 이뻐요. 이쁜 고래같은 느낌 ㅎㅎ,4
기아,K9,후 타보고싶은 k9일세,3
기아,K9,차를 오래 탈수록 느끼는건 껍데기가전부는 아니다,14
기아,K9,요즘 현기 엔진 결함에 대해서는 어떻케 생각하시나요??,2
기아,K9,모딩 레이 도 형편이 어려워서 팔고 버스타고 자전거 타는 상황에 ㅎ,1
기아,K9,주변분들도 g80 사러갔다가 k9 사오시는분이 제법 많더라고요,7
기아,K9,뒷자리 선바이저 수동이 제일 오버네요.다른걸 빼서라도 저건 자동으로 넣어줘야지... 타겟이 뒷자리양반인디,4
기아,K9,정면 디자인이 무게감이 없어서처음에 k7이랑 헷갈렸음전체적으로 제네시스 브랜드보단확실히 서자인 게 분명히 느껴짐,4
기아,K9,"하브같이 연비 좋게 나옴 바꾸고 싶네요7호기 사업소에서 테스트 하다 사고내서  대차로 전모델 9호기 시승차로 렌트해줘서 타봤는데 모닝급?으로 안나가는거 빼곤 맘에 들더라구요(3.3GDI, 400km탄 비닐도 않뜯은 새차)제차는 2.2D올뉴7호기리밋하지만 생긴건 파란집 8호기가 굳~시녕9호기는 너무 아재느낌~",1
기아,K9,모카보고 어머니차 K9으로 결정 지었습니다 ㅎㅎ,1
기아,K9,페리전 마크빼면 디자인 훨씬낫네요,2
기아,K9,시승차의 시트 색깔이 어떤건가요?,1
기아,K9,지금 37살에 G80스포츠 타지만 만약 내가 나이가 50대라면 K9살거같긴함 적당한 고급감에 간단한AS및 유지비용,1
기아,K9,K9는 풀체인지를 기대중..내연기관으로 한번은더 플래그쉽 세단 나올거같은데 그땐 디자인 정말 제대로 웅장한 멋을 뽐냈으면 좋겠음지금은 좀... 뭔가 부족,3
기아,K9,요거 앞으로 단종인가? 전기차버젼으로 나오나요?,1
기아,K9,이 영상을 클릭하고 나오는 헤이딜러 광고 보면서 그냥 영상이 시작한 줄 알았네요 ㅋㅋㅋ,1
기아,K9,하뇽형님♡ XX투자증권에서일합니다부사장님급에서..K9운행하고있습니다쪼~~~끔그런거전혀없습니다 ㅎㅎㅎ,2
기아,K9,셀프키트 단순 바람주입용으롱 아주 유용해요 펑크가 아닌 겨울에 타이어 공기압 알람 자주 울리는데 주차장서 5분이면 해결이에요,1
기아,K9,테일램프 생선뼈는 아무리 좋게 생각해도..생선뼈ㅠㅠ,2
기아,K9,차라리 전 디자인이 좋았....,2
기아,K9,"기아의 플래그십이긴 하지만 dh때의 플랫폼이고.. 크고 고급스럽긴하지만 브랜드가 못 받쳐주고 가성비도 나름 있지만 쟁쟁한 국산,수입차가 많아서 애매한 세단은 페리가 되도 비슷한 거 같습니다...그치만 좋은 차라고 생각합니다",4
기아,K9,타고싶다,1
기아,K9,크롬과 우드는 진짜인지 플라스틱에 도장한 것인지 확실한 설명이 필요할 듯.,4
기아,K9,"스팅어,K9 일단 둘은 고급 브랜드로 분리시켜야....",5
기아,K9,아니야!!!! 구독자를 위해서 g90 발랜시아 골드 1호차를 노려줘,127
기아,K9,17:13 어떻게 알겠냐만은 ---> 어떻게 알겠습니까만은,3
기아,K9,생선가시만 아니면 멋진데...,1
기아,K9,번창하세요!!!!!!!!!,2
기아,K9,안녕하세요~~~ 부모님께서 오피러스 타고있습니다~~ 제가 부모님과 함께 새 차를 구매하려고 합니다. 후보에는 gv80 2.5가솔린  k9 3.8가솔린이 있습니다. 두차 모두 오피러스보다 가속이나 힘이 좋은가요????k9 은 오피러스 보다는 훨신 잘 나갈꺼 같은데 gv80은 어떨지 잘 모르겠습니다 여러분 생각은 어떠신가요???,1
기아,K9,2세대 플랫폼이라 주행능력이 g80보다 딸리고 타보면 진동이 꽤나 느껴짐 고속에서 안정성도 전혀 좋다고 못느낌 실내이쁘고 빨리안다니는 분들한테는 괜찮을듯한 차라고 느껴짐,20
기아,K9,K9 타고 천천히 달리면 좋은차지만.정말 고속도로에서 한 120 ~ 140에서 급차선 변경이나 급레이크 떄려면 사고나는 차인대.. K9차가 마치 최고급 S클래스 7시리즈 A8 처럼 동등한 성능이라고 많이 착각을 하면서 엄청나게 쏘고다니는 차들을 보면 !?!?!??!?!?!?!?!? 여튼 천천히 달려야 합니다.  K9은,2
기아,K9,7:31 오우 깜쨔갸... 또 나왔네욬ㅋㅋ 영광입니당   (_ _),8
기아,K9,그랜드체로키L도 해주세요!!,1
기아,K9,국산차중 k9기어봉이 젤 고급스러워보임기아는 그냥 저걸로 밀고가지,3
기아,K9,아무리 디자인에 호불호가 있지만 저 이상한 뒷 모습을 좋아하는 사람이 있을까요?,2
기아,K9,"K9 진짜... 프론트,리어 디자인 조화가 안맞아!!!차라리 페리 전 모습이 벤츠 카피 모습이라도 괜잖았는데하여간 기아는 디자인 잘 하다가도너무 이상한쪽으로 욕심 부린다!",9
기아,K9,후면 디자인만 좀더 잘 다듬지 ㅜ,1
기아,K9,참 언변 좋으시네요.,1
기아,K9,의전용으로 쓰긴 차가 부족합니다. 리므진나와야 할듯,1
기아,K9,"30살 직장인인데 눈치 안보고 k9 타고 다닙니다ㅋㅋㅋ 현 시대에 사장,부사장 그런 개념이 있을까요?? ㅎ 여유있으면 내가 타고싶은 차 타는거죠",10
기아,K9,K9 단종 안 되었으면..,7
기아,K9,애매하다... 뭔가 애매해.. 차라리 G80타겟으로 해서 운전석 위주로 좀 세팅을 했으면 어떨까 싶은..그나저나 넷플릭스도 유튜브도 안나오는 모니터는 왜 필요한건지 당췌 ㅎㅎㅎㅎ,1
기아,K9,기아 엠블럼이 예쁘네요,1
기아,K9,앰블러 포함 후면 디자인 생선가시만 아니였으면 하는 안타까움. 한번 보고 이상하고 적응 안되면 계속 봐도 이상함,1
기아,K9,뭔가 실내 인테리어가 브라운?계열로 통일되어 있는데 와이퍼랑 방향지시등 레버만 검정색이니까 괜히 확 튀어보이네요,1
기아,K9,브레이크 밟지말아보세요 ㄱㅋㅋㅋㅋㅋㅋ,2
기아,K9,차만 이쁘게 만들지말고 서비스도 제네시스 만큼... 해줘 제발,2
기아,K9,타봤는데 모든면에서 g80 보다 낫던데.......,1
기아,K9,다른 얘기지만 부자동네에서 경비 알바하는데 사장이나 임원급 되는 입주민들은 젠틀한데 그 입주민 수행기사들이 갑질 더하고 짜증내고 그럼;,1
기아,K9,엔진은 현대가 준 에쿠스 엔진~,1
기아,K9,차 멋지다. 그래도 k9은 중고가 진리 ㅋ,1
기아,K9,기아차는 위치가 애매하죠 항상 현대 제네시스 때문에,1
기아,K9,화면 비율이 바뀌었나요?? 왜 갑자기 보기 너무 편해졌지??,2
기아,K9,뒤에 노란 3시리즈 컨버가 보이네요 ㅠㅠ,2
기아,K9,도대체 뒤에 생선뼈다귀 디자인은 누가 허락한건데?? 평가하는 눈이 동태눈알이라서 생선뼈다귀가 좋았던거야??,7
기아,K9,2006년 오피러스에도 있던 기능에서 업그레이드 했구만~~신기술도 아니듯.,1
기아,K9,엔진 결함 없나요??,1
기아,K9,hda로 브레이크를 안밟으면 안되는건가요...  헷갈리네...,2
기아,K9,안녕하세요 김한용님~~ 도토리TV  채널에 캠핑 다니시는 분 있으신데 윈터 타이어 상담 좀 해주세요~~ 어제 라이브 하실 때 고민이 많으시더라구요 ㅎㅎ 어제 다들 김한용님 한테 물어봐야한다고 난리였어요 ㅎㅎ,1
기아,K9,8:50 ㅠㅠㅠ 제 애마인 아슬란에는 렉시콘이 달려있다구요 한용형님 ㅠㅠㅠ,1
기아,K9,볼보 S90 흰색으로 추천합니다 김한용님,1
기아,K9,아.. 생선뼈 테일램프.. 아.... 누구야 승인한 놈....,2
기아,K9,풀체인지 안하면 미래가 없는 차,6
기아,K9,K9을 만약 산다면 역시 중고로^^;,11
기아,K9,성공의 냄새가 아니라 광고의 냄새 군요,2
기아,K9,k9은 다 좋은데 기아 앰블럼땜에 판매량 다 까먹음 독자 앰블럼 만들어라~,1
기아,K9,근데 K9 스코다 옥타비아 닮지 않음?,1
기아,K9,요세나오는 기아 차는 뒷자석 헤드룸이 너무 낮네 왜저렇게 만들지 참,1
기아,K9,"K8, K9은 대형차의 고급감이 안느껴짐가격하고 상관없이 걍 싼마이 느낌",3
기아,K9,K9이 안팔리긴 하나보네요.,2
기아,K9,현대 렉시콘 = 넥쏘 !,1
기아,K9,좋다는 사람만 있고 사는 사람은 없음ㅋㅋㅋㅋ,31
기아,K9,중고로 사는게 가성비차,3
기아,K9,성공의냄새에 빵터짐,1
기아,K9,현대에 렉시콘오디오.아슬란있습니다ㅎㅎ,1
기아,K9,나는 언제살까...집도 사야되고 차도 사야하는데...ㅎㅎ,1
기아,K9,매기 닮았다 생선뼈 닮았다 이런 부정적인 얘기가 자주 나온다는 건 호불호가 갈린다는 건 걍 취향차라기 보단 디자인이 구리단 거임,9
기아,K9,케구도 못사는 애들이 비하는 잘함18년 11월 그플 트림 몰고있는데 dh랑 비교불가 팔공이 신차니 당연 좋은거고 케구가 후속 나온다면 팔공이 보다 더 좋으면 좋았지 나쁘지 않음  현대차 그룹은 절대 급차이 못뛰게 만듬신형 팔공이는 대쉬보드랑 도어트림 풀옵도 인조지만 케구는 지구공과 같이 나파가죽임게다가 팔공이는 리어파워시트가 슬라이딩이지만 케구 풀옵은 지구공이랑 동일한 14방향 에르고 시트임.팔공이는 케구 아랫급,2
기아,K9,그릴 진짜 k7 구형 그대로 가져온거같넴..,1
기아,K9,이젠 인트로까지 ㅋㅋㅋㅋㅋ,2
기아,K9,K8을 생각하면 다음 세대 K10?,2
기아,K9,뒷면 디자인은 계속 봐도 이상해요. 가로지르는 등이 너무 두꺼운것도 같고..싼티나는 거 같아요.,2
기아,K9,갑자기 전면이 아우디가 됐네 ㅋㅋ,1
기아,K9,국산차는 아무리잘만들어봤자 국산차 ㅋㅋ,1
기아,K9,G80이랑 비교대상인가요?,2
기아,K9,김해에서 살고있다... 도로에서 보이지 않는차,1
기아,K9,기어봉 최고,1
기아,K9,뒷모습이넘 아쉬움 ㅜ,2
기아,K9,오늘 본게 k9 이었구나.. k8정도급 차인줄... 전면 고급감이 전혀 없었는데,3
기아,K9,이형은 요즘 거진 광고네 볼만한 채널이었는데 점점 광고로 도배돼는거 같아서 잘 안봐지네요 ㅠㅠ,5
기아,K9,실물봤는데 리어 디자인 빈티남,1
기아,K9,앞쪽 디자인이 구형 소렌토가 웬말이여…,1
기아,K9,바로 전 모델이 더 예쁜건 나뿐?,2
기아,K9,생선뼈... 도로에서 보면 진짜 생선뼈같이 보인다전체적으로 디자인이 후퇴했다. 벤츠같은 경우 전작에 비해 깔끔하게 다듬었는데 k9은 전작을 잘 뽑아놓고 그걸 못살리네 ㅡㅡ;;,1
기아,K9,성공의 냄새를 맡는 자,3
기아,K9,엠블럼 k9전용 좀 만들지,2
기아,K9,전k9헐이쁜듯~,1
기아,K9,소프트클로징 없다길래 헉..,1
기아,K9,기아마크 살빠에는 g80 사지...,6
기아,K9,간지나긴 하는데 예쁜지는 몰것슴,1
기아,K9,"실내는 저렇게 고급스럽고 이쁜데, 망한 외관디자인과 브랜드 이미지 때문에 몇년뒤면 중고차시장에 헐값에 나올차. 안타깝다. 제네시스 처럼 기아도 독자브랜드 만들어서 외관도 좀 바꾸고, 로고도 바꾸고 진짜 고급차 라인 만들었으면 좋겠네.",2
기아,K9,현대기아 dct 변속기는 잘 깨지는데..,1
기아,K9,후면 디자인은 정말... 특히 진주색이나 흰 색...길에서 보고 오래된 미국차인줄...물론 누군가 타라고 주신다면 큰 절 올리고 잘 타겠지만...ㅎㅎ,1
기아,K9,댓글에 플랫폼 어쩌구 하는 분들.. 실제 타면서 플랫폼 차이도 못느끼면서 뭔 플랫폼이 어쩌구 저쩌구.. 노보스가 플랫폼 까는 방송좀 보고 아는척 하는거 너무 웃기네.,1
기아,K9,대표님 뒷자리 타실때가 된거 같아요,2
기아,K9,벤츠 s 클래스 마이바흐 시승해주실 수 있나요?,1
기아,K9,k9 디자인이 별로네요 뒤가 ef소나타 같음..풀체인지 같지 않네요.,2
기아,K9,뒷모습은 아무리 봐도 이상한 게 사실.,2
기아,K9,2.5 바라는건 욕심띵?ㅋㅋ,1
기아,K9,테일램프 안 이뻐요...아무리봐도.... 다시봐도....,2
기아,K9,흉기는 디자인을 아우디를 너무 따라하네..,1
기아,K9,아무리봐도 후면이 너무 후져보임,2
기아,K9,앞모습은 이쁜데...뒷모습은 진짜 에러다.,1
기아,K9,용따 : 성공의 냄새 빠끄,1
기아,K9,자주포는 못참지?!!!!,2
기아,K9,저는 k9 손~~ ✋,1
기아,K9,급발진 이슈가 그렇게 많은데..,2
기아,K9,어우 디자인 때문에 거르고 싶은 차 ㅠ,1
기아,K9,먹고남은 병어조림 뼈...,5
기아,K9,K9 가장 좋아하는차.,1
기아,K9,생선뼈만아니면 사겠는데 테일램프 에바다 진짜 누가디자인했냐,1
기아,K9,승차감 전혀 부드럽지 않던데.... 기아에서 안팔려서  그런가... 고급감도 없고 디자인도 그렇고...  폭망할줄 알았음.,2
기아,K9,말일 고속도로 신형k9임시넘버달고  주행하는거 보니 왕실망...라디에이터 그릴 앞 모습은 너무 밋밋 했고  뒷모습은 k8같으면서도  허전해보여서  개실망...,2
기아,K9,K9은또 G90과비교가안됍니다,1
기아,K9,이거 전버전도 글코..이것도 글코..디자인이 문제다..이번것은 앞은 잘했는 뒤가 넘 구려..전혀 중후하지도 멋있지도 않은..도대체 뭔생각으로 생선가시로 만든건지..내가 항상 말하자나..뭐로할지 아이디어 안떠오르면 걍 동그러미 두개로 하던가..길게 직사각형으로 뽑고  led 를 기가막히게 박으면됨..뭐하러 고민고민하다가 이런 죽도밥도 아닌 디자인으로 잘만든차 아무도 안사게 해놓는지..안타까움..,1
기아,K9,이거하고 g80중에 고민중,1
기아,K9,G80보단 k9인쥬,4
기아,K9,진짜 ㅈㄴ 좋다...어디g80 비교를,4
기아,K9,3년후에 4천만원에 살수있을려나 ㅋ,1
기아,K9,변속기 대신 엔진이..,1
기아,K9,잇섭 인트로 느낌?ㅎㅎ,1
기아,K9,현기채널 ㅋㅋㅋ,2
기아,K9,페리됐는데도 아직도 뒷 후미등은 생선뼈다귀네…참 디자인 개못한다…품질을 깎아먹는 디자인!!,3
기아,K9,디자인 망한거 같음... 기존것이 나아보이네요..,1
