car_brand,car_model,comments,likes
혼다,오딧세이,"정말 잘봤습니다 이번에 캐나다에서 시에나랑 오딧세이 구매 고민했는데요 ~~ 시에나가 신형이고 해서 고민햇는데 결국 오딧세이 담주에 받습니다~ 2,3열 승차감이 중요해서요",8
혼다,오딧세이,오딧세이 하체의 묵직함.,9
혼다,오딧세이,"4인 가족의 주말 나들이용 세컨카로 오딧세이랑 시에나하브를 두고 엄청나게 고민하다가 제가 내린 결론은 시에나 중고였습니다, 참고하세요.오딧세이는 3열이 편한데 정작 더 중요한 2열은 애매하고,시에나하브는 연비빼면 전작이 오히려 낫다고 봅니다.",3
혼다,오딧세이,그래도 오딧세이나 시애나는 진동이 적은편입니다. 신형카니발은 와! 장난아닙니다. 소음이 장난아니게 들어오고  바닥에서 바퀴굴러가는것까지 들려요.그리고 최악은 진짜3열은 짜증날 정도로 심해요. 타보고 느끼면  아~~~장난아니네 라고 바로느낌니다.ㅜㅜ차값이 카니발하고 비슷하면 난 무조건 시에나.오딧세이삽니다. 무조건입니다.현실은ㅜㅜ카니발!,7
혼다,오딧세이,연비면 시에나 하브 승차감이면 오딧세이 그리고 기타 옵션이나 디자인을 보실거면  카니발 을 선택시시면될 것 같아요ㅋㅋ 제대로된 비교 리뷰인듯,15
혼다,오딧세이,솔직히 좀 걱정이네요이번에 시에나하브2륜 계약했는데2열 진동이라니 좀 짜증나네요전시차는 2륜 시승차는 4륜으로 하는 것도 좀 이상했는데 …,11
혼다,오딧세이,시에나는 2열 시트를 빼낼수 없어서 에를들어 4x8 크기 합판을 실을 수없다는 것이 매우 큰 핸디캡이다.밴으로서 역할은 다양한데 운반과 요즘 캠핑카로서 최소한  차에서 숙박을 하려면 필수적으로 이열 의자를  빼내야 하는 사실에  부합되지 않음이 아쉽다.,2
혼다,오딧세이,신형 카니발 기대했는데 역시나 에휴시에나냐 오디세냐 고민중인데 영상 감사합니다,3
혼다,오딧세이,"시에나 2열 달달달 거려요, 전세대 승차감 생각하고 계약하러 갔다 포기.",3
혼다,오딧세이,차분한 목소리가 너무 좋습니다,4
혼다,오딧세이,용호상박 인듯둘다 비교 타보고싶네  ㅋ ㅋ,1
혼다,오딧세이,시에나 4륜은 뒷바퀴도 전기모터가 따로 구동해주고 타이어가 17인치라 (편평비가 높아서) 승차감이 더 좋았던건지  4륜 뒷자리  시승했을때는 진동 소음 그다지 못 느낀거 같애요.,9
혼다,오딧세이,시에나 2열 잔진동이라구요 카니발 디젤은 전좌석 진동인데..본인과 가족을 고문하며 떠나는 여행,2
혼다,오딧세이,하나는 6천가까이되고 하나는 6천이 넘는디 보닛을 열고 작대기를 대야하는거여 너무하넹^^,1
혼다,오딧세이,오딧세이가 가장 잘 팔리는 이유가 있겠죠. 미니밴은 오딧세이가 제일 나음.,17
혼다,오딧세이,오딧세이 하브 존버합니다,6
혼다,오딧세이,그렇죠 미니밴은 오딧세이가 최고 입니다....아 카니발 괜히 삿어.... ㅋㅋ,2
혼다,오딧세이,시에나하브 1만키로 이상 2열에서 타봤는데 도대체 2열 진동 못느끼겠슴.. 뽑기 인가...,10
혼다,오딧세이,"난 시에나 살듯. 연비, 디자인",1
혼다,오딧세이,전 개인적으로 오딧세이보단 시에나에 한표여. 생긴것도 시에나가 월등히 이쁘네요. 연비도 굉장하구요. 어딧세이는 뭔가 엉성하게 생긴듯,3
혼다,오딧세이,시에나는 인상이 더 싸납달까.. 아저씨는 시에나가 마음에 드나봄 다 예뻐보인대 ㅋ,6
혼다,오딧세이,기자님!오딧세이와 시에나 하이브리드 고민중인데 가격은 제외하고  품질 승차감 사후 a/s 등 종합적으로 봤을때 어떤게 나을까요?전부다 오딧세이가 낫다고 하지만 제가 사는지역은 창원이라 혼다 매장과 서비스센타가 있는 부산까지 가야하고 또 이번에 혼다가 대규모 리콜관련 뉴스도 있고 한국시장 철수설도 있고 해서 고민중입니다!,1
혼다,오딧세이,전체적으로 시에나 승 아닌가요?외관 디자인이나 하이브리드 퍼포먼스가 엄청나네요 ㅎ,8
혼다,오딧세이,화면에 필터가 너무 강하게 씌어있어서 색감이 확 죽네요..,1
혼다,오딧세이,"기자님 소신있는 리뷰 감사합니다.저희도 시에나 하이브리드 시승해보고 와이프가 2열, 3열에서 얼마 타지 않고 진동도 느끼고 해서 오딧세이로 왔네요.지금 4개월째 오딧세이 타는 중입니다. 승차감, 3열 공간은 매우 만족, 연비는 ㅋㅋㅋ 포기하고 타고 있습니다.",1
혼다,오딧세이,몇년식이죠..5세대인가요?,1
혼다,오딧세이,"혹시 카니발 3.5가솔린 4세대랑 vs 시에나하브 2,3열은 진동이 어떤가요?시에나 하브가 카니발보단 2,3열 진동이 없는거죠?기자님이 젤 객관적이신거 같습니다동호회는 칭찬 일색에 진동 있다고 하면..혼?나고ㅋㅋ",9
혼다,오딧세이,시에나에 한표,3
혼다,오딧세이,아.. 오딧세이 우리나라 들어가는 모델은 2열 오토만 시트가 아닌가요?? 오딧세이 2열 오토만 시트도 신세경인데…. 3열은 뭐 오딧세나 시에나나 애들용이니.,5
혼다,오딧세이,오딧세이는 성능이고 뭐고 디자인이 너무 오래되보임. 실제보다 더,9
혼다,오딧세이,오디세이는 외관이 좀 촌스럽다..풀체인지 시급함,9
혼다,오딧세이,자막 하신분이 실수를...ㅎ 숫자-C자형~오디션-오딧세이^^;; 숨은그림찾기처럼 재미로 생각해주세요~,1
혼다,오딧세이,영상 콘트라스트하고 감마값 좀 제발 눈 아프다,3
혼다,오딧세이,방향지시등  위치,1
혼다,오딧세이,오딧세이는 서라운드뷰가 없어서 백화점 갈때 버거울듯;;,4
혼다,오딧세이,동영상 화질부터 어찌해야할듯요. 눈이 침침해서 못보겠어요. 영상 중간에 사진나올때랑 촬영영상이랑 너무 차이나요,1
혼다,오딧세이,B필라 안전벨트 없어요,1
혼다,오딧세이,영상이 뭔가 어둑한거 같습니다.,1
혼다,오딧세이,죄송하지만 둘다 너무나 대박 못생김,1
혼다,오딧세이,이런 !! NO Japan 한지가 언젠데 ...님 .일본사람 ?,4
혼다,오딧세이,기본기 탄탄한 오딧세이 vs 기본기는 떨어지지만 겉치장을 잘 해놓은 카니발,82
혼다,오딧세이,오딧세이는 혼다가 가족을 위한 미니밴을 오랫동안 만들어 오면서 노하우가 묻어나오네요. ㅎ 청소기는 정말 아이들 태우는 차에는 꿀 옵션인 것 같아요.,11
혼다,오딧세이,혼다 차량이 대부분 하체 셋팅이 스포츠 주행성능을 기본기로 하고 있습니다 그래서 주행성능은 국산차량은 차이가 많이납니다또한 기본기인 엔진 미션 내구성 무시 못하죠 그래서 북미 시장에 가성비 하면 일본차라는게 현실 입니다,26
혼다,오딧세이,확실히 순수하게 차만 가지고 비교해주시고 심지어 카니발 오너의 솔직한 느낌까지 설명해주시니 더욱 리뷰가 신뢰가 가네요!,4
혼다,오딧세이,디자인이나 소재감은 확실히 카니발인데 아직 갈길이 멀었나보네요,33
혼다,오딧세이,2019년식 오딧세이 차주 입니다. 세단 느낌의 안정감과 고속 주행 엔진 필링에 대한 리뷰에 전적으로 공감합니다. 카니발 가솔린을 살 분들은 꼭 오딧세이 고려해보세요.가격 차이가 안 아까울 겁니다.,17
혼다,오딧세이,오딧세이 처음 탔을때 느꼈던 하체의 묵직함에서 오는 승차감은 아직도 기억에 남네요. 마치 허벅지 등 하체가 튼튼한 사람같은 느낌.,22
혼다,오딧세이,"2017년 말에 출시되어 2020년말 최근  F/L 발표한 차량과 비교하는 것 자체가 카니발  의문의 1패죠...오준님 말씀대로  그간 카니발은 적수가 많고 많은 미주 지역에서만 보아도  혼다, 도요타, 크라이슬러 등에도 밀린지 오래이고 그건 비교리뷰 하신  구형 오딧세이의  내,외부디자인 처럼,  디자인의  문제보다 차체 기본기 등이 문제였다고 봐야겠죠 다만 미국에서 갓 발표된  4세대 시에나가 있으니, 내년 초에 한국에도 나오겠죠  끝물급 오딧세이와 4세대 카니발(한국 가격포함) 비교라니  가격에서던 모델이던 카니발 밖에 선택권이 없는 국내 소비자들에겐 참 슬픈 비교시승기 같네요 고생하셨습니다...^^",11
혼다,오딧세이,카니발 타고 잇는데 오딧세이 타볼 기회가 잇어서 타봣는데 정말 저 자신한테 개쌍욕 햇습니다.정말정말 좋은차 엿어요 다음차는 무조건 오딧세이 신형입니다.일본의 기술력은 정말~카니발 아직 한참 멀엇어요 한번 타보시길 바랍니다.,28
혼다,오딧세이,"인테리어, 익스테리어는 확실히 카니발이 우승이긴 하지만, 오디세이가 연식변경이 된다면 말은 또 달라질 것 같습니다. 엔진의 느낌은 두 차 모두 가솔린이여서 잘 모르겠지만, 카니발 2.2디젤은 확실히... ㅎㅎ  무튼 항상 유익한 영상 재밌게 보고있습니다 안오준TV 화이팅입니다 근데 영관이형 웨저뤱...",1
혼다,오딧세이,"이런 비교영상 정말 유익하고, 좋네요!!! 어코드10세대 운행중인데, 혼다차 핸들링과 주행성능은 타보면 매력넘칩니다.",22
혼다,오딧세이,카니발 4세대 1300키로 주행 후 느낀점은 카니발은 감추려하는게 많아 보여요 다른부분(옵션)으로 상쇄하고싶어하는거 같습니다 . 조금만 깊게 파악하면 뽀록날게 많은 사람처럼요  그래도 적당한 옵션에 구매한다면 아주 합리적인 차 입니다 .,20
혼다,오딧세이,"솔로일 때도 큰 도움 주셨는데, 가장이 돼서도 도움을 받는군요. 영상 잘봤습니다.",2
혼다,오딧세이,대시보드는 카니발은 멀어서가까운 오디세이가 잘만들어진것 같네요변속기 구성도 좋고,12
혼다,오딧세이,원래 카니발 출시부터 기능 많이빠져서나옴 경쟁모델이 없다는게 이렇게 심각한 결과를 초래한거임... 이렇게 개판쳤는데 판매량은 상위권이니 개선할생각도  없는거고,21
혼다,오딧세이,미니밴의 최고 지향점은 승차감이죠아직 현대기아가 기술의 일본을 따라갈수 없는것인가요 ㅠㅠ,17
혼다,오딧세이,글로벌시장에서 카니발은 아예 설자리가 없다는게 현실,24
혼다,오딧세이,오딧세이 예전부터 봐왔는데 역시 카니발은 적수가 안되네요 이영상보고 다음차는 오딧세이입니다 감사합니다!,13
혼다,오딧세이,시승기 잘 보았습니다~ 두 기종이 항상 궁금했었는데 많은 도움이 되었습니다!!^^,2
혼다,오딧세이,오딧세이 시승한번 해보면 카니발이랑 엄청 고민하게 됩니다(옵션 & 주행질감)      혼다 차 참 잘만든다는 생각이 듭니다,19
혼다,오딧세이,베트남 에서 미니벤. 혼다 오딧세이.도요타 시에나. 포드 는2.3열 승차감이 압도적으로 현기차는 따라갈수없습니다. 카니발이 안팔리는 이유이죠,11
혼다,오딧세이,"아무리 일본메이커라도  오딧세이랑 비교하는 자체가 ,,,가장치열한 미국서 오딧세이는 많이 더비싼데도 베스트셀러입니다 말장난 …쩔어요",5
혼다,오딧세이,저도 캐나다에서 16년식도 보유했었고 20년식 지금 타고있는데 다른밴은 안타봐서 잘 모르겠는데 2열승차감은 직진주행중엔 괜찬은데 좌/우회전시엔 별로입니다…2열시트는 가운데 떼내면 캡틴시트로 사용가능하구요 캠핑가서 2열 다 탈거 가능해서 차박하기 좋습니다. 2열 매직시트라 캡틴시트 좌우로 움직여서 2열에서 옆에 앉은 아이가 있다면 케어하기 좋습니다.ㅋㅏ니발 2열 승차감 안좋다고 하는데 얼마나 안좋은건지 궁금하네요…,4
혼다,오딧세이,스포츠성으론 독일에 BMW가 있다면 일본엔 혼다가 있지요~ 확실히 혼다는 하이테크 이미지가 강해요. 매니아들이 좋아하는~ 근데 실내는 카니발이 그냥 학살하네요~ 실내재질. 마감 국산차를 따라갈 수가 없음. 인정,4
혼다,오딧세이,소음 차이를 알고싶습니다. 고속도로에서 100키로 이상에서 옆사람과 대화를 하거나 음악을 듣는다고할때 카니발과 오딧세이의 차이점 이게 제일 궁금하네요..,1
혼다,오딧세이,결론 : 카니발은 하~~~~안참 멀었다. 잘팔리는 이유는 단지 한국에 경쟁모델이 없어서. 오디세이는 넘사벽!,61
혼다,오딧세이,"오딧세이는 3기통 6기통 가변식입니다. 그래서 정차시엔 3기통일테니 진동이 더 있을 거에요. 슬라이딩도어 닫힐때에 오딧세이는 약간의 힘으로도 다시 열리는데, 카니발은 강하게 잡아야 센서가 반응을 해서 어린아이에겐 좀 위험하다고 봐요. 그리고 카니발이 탈때에 좀 더 높아요.",9
혼다,오딧세이,"오딧세이: 주행질감이나 승차감, 실내거주성에 더욱 초점을 맞추어 패밀리카 로는 한수 위카니발: 옵션과 인테리어 및 익스테리어(개취) 는 한 수 위 이나 2,3 열의 승차감 및 주행 질감은 비교적 부족.개인적으로 고속 장거리 및 3열까지 탑승 할 일이 많은 경우에는 오딧세이가 좋아보이나, 실내 소재 및 옵션의 중요성과 2열까지만 주로 이용하는 오너분들께는 카니발이 더욱 효율적일 것 같습니다.오딧세이 출시 년도를 고려 했을때 다음세대 오딧세이가 매우 기대되는군요.",13
혼다,오딧세이,미니밴을 사는 고객층이 원하는것들이 뭔지 혼다는 확실히 알고있네,24
혼다,오딧세이,비교시승기 넘 잼났습니다!황제성님 다음에도 꼭 나왔으면 좋겠어요!!,2
혼다,오딧세이,"쌍용자동차가 rv 개발,출시를 꾸준히 해서 카니발 대항마를 키웠다면 좋았을텐데..",1
혼다,오딧세이,"영상 잘봤습니다.  차량교체 시기가 와서 펠리나 카니발 보고 둘다 시승했는데 펠리는 좋긴했는데 버튼기어가 너무 싫었고 카니발은 두분 말씀대로 2,3열 승차감이 쩝~~ 일본차는 패스~~ 그와중에 얼마전부터 쉐비 타호가 국내 들어온다는 소식이있어서 기다리고 있습니다.  정말 기대 가득~ 타호 소식들어오면 영상하나 부탁합니다.",6
혼다,오딧세이,미국의 판매량이 증명해주고 있다.오딧세이 압승,4
혼다,오딧세이,"가격도..차이가 있지만..카니발.,아직 ..오딧세이 못따라갑니다..오딧세이 앞승! 직접타보니 카니발 ..현기차..아직 멀었다..",6
혼다,오딧세이,오딧세이랑 카니발은 승차감 비교 자체가 안되죠...ㅠㅠ 국내에서 독보적인 카니발이기에 갈 길 멀었습니다..,34
혼다,오딧세이,현재는 더뉴카니발 가솔 타고 있는데 오딧세이 처제차량 타보고 정말 와~~~~ ^^ 궁금한게 오딧세이랑 시에나하브랑 어느차량의 승차감이 더 좋을까 궁금해요^^,2
혼다,오딧세이,신형 시에나하이브리드4륜 시승기도 기대하고있습니다,6
혼다,오딧세이,"같은 모양이라고 같은 급이라고 차를 비교하다니...혼다 오딧세이는 일본차라는 단점만 빼면 비교가 불가한 차량 성능...기본기가 너무나 차이가 나는 클라스...가성비도 좋은 것도 아니고...하지만 나름 안오준 TV 에서 가장 잘 팩트를 전달한 느낌이네요. 확실한 장단점을 지적하고 있네요. 미국 판매량을 본다면...ㅋ 아직 기아의 카니발은 오딧세이를 카피하는 수준이지 앞서가지는 못하죠...옵션이나 실내로 승부하는 것이 아니라 기본기인 엔진, 미션, 셰시등이 월등 합니다. 시승기 잘 봤습니다.",11
혼다,오딧세이,토요타 알파드가 엄청 좋아보이더라구요... 오프로드 능력도 뛰어나서 관공서 지원차량으로 많이 쓰인다고....,1
혼다,오딧세이,오디세이 사고싶다 ㅎㅎ,11
혼다,오딧세이,보다 객관적으로 볼줄알아야 한국차도 발전할수 있습니다. 차의 목적 1. 성능 및 기능 2. 안전성 그다음에 3. 모양이나 편리성,4
혼다,오딧세이,형 리뷰는 정말이지 기업에서 영상을 가져가서 인스턴트식 CF를 만들어 TV에 틀어도 이질감이 없을듯 최고얌..,1
혼다,오딧세이,오디세이 청소기 대박~!,6
혼다,오딧세이,오디세이 검정은 절대 사지 마세요.옆에서 보면 완전 상조회 차입니다.관이 연상이 되요.,9
혼다,오딧세이,잘봤습니다이시국 빼면 ㅎㅎ와이프가 es300h  2년타다 애 둘낳더니 도요다 밴 사려고 하더군요 카니발도 좋긴한데 둘다 타보니 다르긴 하더라고요,1
혼다,오딧세이,타보면 알아요 하체가 얼마나 짱짱한지 조금 보태면 bmw에도 않밀리는거 같아요,11
혼다,오딧세이,자주보는 구독자 입니다.좋은차가 정말 많은거 같습니다.  사고는 싶지만 일반월급쟁이가 유지를 할려면 얼마를 벌어야 편하게 유지를 할까요?,3
혼다,오딧세이,오딧세이 트랜드미션은 최악인데 이번에는 좋아졌는지 궁금합니다,3
혼다,오딧세이,안오준tv 잘 보고있는 구독자에요어제 저녁에 런업님 방송 올라온것도 봤는데언제나 유튜브도 1티어 시니까 ㅋㅋ유튜브 활동 화이팅 해주세요 !!,2
혼다,오딧세이,흉기차는 껍데기만 멀쩡 엔진은 결함과 고장으로 불안.  기술의 혼다차는 그 반대임. 고장 결함 없음. 내구성 짱임.,15
혼다,오딧세이,Kia 는 아직 제가 사는 california 팔지 않아서 Odyssey 차 좀 알려드립니다 . 우선 Enigne 은 Vtec Engine 은 일반적으로 Sohc 로 작동되다 힘이 필요하면 Dohc 로 변화합니다 그리고 아직도 Timing Belt 고무로 쓰고 카니발은 Chain 일거에요 고무가 약간 부럽죠 엔진 성능이 .. freeway 는 Honda Vcm 으로 3 기통으로 변화 합니다 . 힘딸리면 V6 로 되고 아마 6 speed Trans 면 좀더 힘이 출발때 좋을거에요 근데 10 speed 는 장거기 띠기엔 좋죠 LA 에서 Vegas 처럼 멀리띠면 10 speed 정말 기름 많이 않먹죠 근데 local 에서는 출발때 좀 힘이없어요 이번 2022 acura mdx 3.5 Engine change 약간 upgrade 되서 나왔어요 Rdx  크게 나온차 인데 차 좋아요 저는 2004 년도 오디세이 타는데 아직도 20 만 마일 인데아직도 쌩쌩 잘달려요 .. 잔고장 거의 없구,6
혼다,오딧세이,브랜드 빼고 봐도 카니발이 비빌 차가 아닌데...,5
혼다,오딧세이,적수라고 하기엔 너무 양심없는 거 아닐까 싶은 ㅋㅋㅋㅋ,43
혼다,오딧세이,아~ 두분 캐미 너무 좋네요^^ 즐겁게 시청하고 있습니다 짝~ 짝~ 짝~,1
혼다,오딧세이,재밌다 너무 재밌다 이런 비교 시승기!!!! 인스타 보고 얼마나 기다렸게요~,1
혼다,오딧세이,12:22 2열은 그래도 탈만해 공기압 다빼고 헐...컥.... 뭐 이리 조건이 많은지 타라느거 말라느거?카니말 의문의 완패인듯,1
혼다,오딧세이,현대 많이 발전했네 혼다와 승차감 비교 시승까지 하고,3
혼다,오딧세이,좀웃긴게 올뉴랑 오딧세이랑 비교했었는데.. 지금와서 읽어보니 얼마나 갭차이가 컷는지 알수있네..,3
혼다,오딧세이,스포티지 나오면 투싼이랑 비교해주세요!,2
혼다,오딧세이,ㅋㅋ 카니발 3열 포터 승차감 ㅋㅋㅋ 맨날 옵션이나 디자임만 치중하니 기본기는 못따라가는게 현실 ㅋㅋㅋ 거기다 리뷰에서는 안나타나는 엔진결함 누유 쇳소리 공명음... 이런차로 전세계 베스트셀링 미니밴을 잡겠다고 하는게 개그죠,23
혼다,오딧세이,"오딧세이 제발 2열 열선, 어라운드뷰는 장착해줬으면..하네요 ㅠ",1
혼다,오딧세이,카니발 3열에 부모님이랑 애들 타면 그냥 장거리 타면 다 멀미하고 토하고 그럽니다.오딧세이요? 진짜 일본차만 아니었으면 벌써 샀습니다. 승차감은 진짜 아직 멀었습니다.,3
혼다,오딧세이,진짜 카니발 같은 핵폐기물 쓰레기차하고는 비교자체가 안된다,7
혼다,오딧세이,"아빠들의 가장 큰 착각 중에 하나가 넓이와 가족들의 편함이 같다고 생각하는 것입니다.아빠들은 주로 운전만 하니 2, 3열에 앉아서 멀미하는 아내와 자녀들의 불편함을 잘 이해하지 못하고,그저 넓으니까 편할 거라 여긴다는 의미입니다.",14
혼다,오딧세이,카니발 오너로서 카니발이 너무 대충 만들었음 다른 현대기아차에비해 너무 원가절감한게 느껴짐,15
혼다,오딧세이,북미에서 오딧세이 시에나 퍼시피카 카라반 네 차종에 근접하게만 따라가도 성공임그런데 미국 리뷰어들에게 어떻게 비춰질지,1
혼다,오딧세이,몇백만원 싸게사놓고 탈때마다 후회하고 스트레스 받을바에는 오딧세이~ 갑니다.전 프리우스 오너였습니돠~~,24
혼다,오딧세이,역사적 문제만 없었어도 현대가 이렇게 크지 못했지,4
혼다,오딧세이,일본차 차는 가성ㅂㅣ좋은것 같아요단 한국에서 수리비는 국산차 보다는많이 비싼것 같아요,7
혼다,오딧세이,일본한테 무조건 이기고 싶지만...... 기아차는 넘 좋아하는건 아니지만 갑질과 ㅎㅎㅎ 베짱 대응 일단 팔면 끝이라는 마인드가 넘 맘에 안든다ㅎㅎㅎ대한민국을 대표하는 자동차 제조 회사로서 모범을 보여줬으면 합니다 ㅎㅎㅎ,2
혼다,오딧세이,오딧세이 시에나 카니발 3대 있습니다 개인적인 생각이지만  솔직하게 말씀드리면 카니발은 내부 디자인이 이쁜 승합차 시에나는 3대중에서 운전하기가 편안한 세단느낌이 나고 오딧세이는 대형승용차입니다 웬만한 독삼사도 능가하는  비교불가 넘사벽입니다,5
혼다,오딧세이,현대기아는 차량을 고객과 타협을 자기들이 하면서 만드는거 같습니다. 에이 이정도 안해도 다 타....이정도만해도 좋은거야~~ 이정도면 나쁜거 아니야...그 생각을 제조사가 하면서 만드는듯합니다.,3
혼다,오딧세이,현대차 공장 vs 일본차 공장 비교가 요새 화두라고 하더군요.,8
혼다,오딧세이,비교불가네요... 오딧세이 승. 끝.,12
혼다,오딧세이,도요다 시에나도 3엺 승차감 좋더라구요..,8
혼다,오딧세이,오딧세이가 밴과 픽업트럭 강국이라고 불리는 북미에서 1위입니다. 카니발 6천만원 암도 안 살껍니다. 그리고 비슷하게 만들수는 있어도 시장성이 없으니 안 만드는겁니다.,7
혼다,오딧세이,비교불가능한 비교였다 ㅠ,7
혼다,오딧세이,앞뒤가 따로 놀다는 것에 동감합니다.운전하다 보면 노면이 안좋은 도로나 턱을 지날때마다 뒤쪽이 점프하네요 ㅡ.ㅡ,1
혼다,오딧세이,오딧세이는 시에나랑 비교해야 하는거 아닌가요?,11
혼다,오딧세이,카니발 vs 오딧세이 vs 시에나(toyota)제일큰 차이점...?일제차들은 오래탄다...할수없음요 고장없이 오래타는데 뭔 말이 필요하나요 ㅋㅋ,16
혼다,오딧세이,"북미는 아직.. 신형 카니발 안나왔져?..  하지만... 토요타 시에나, 혼다 오딧세이.. 타야죠~~~아직은 카니발 대적 안됩니다... 가격 빼고~~~",5
혼다,오딧세이,카니발 3열은 시멘트 포장 도로에서는 탈 수 없을 정도 입니다. 3열에 타서 사람이 타지 않은 옆의 3열이 떨리는 모습을 보고 있으면... 한숨만 나옵니다.,4
혼다,오딧세이,인테리어 회사를 엔진 장인 회사에 비교가 되나백날 반일 해봐라 산업 전반에 걸쳐 객관적 우월을 인정하고 베이스 부터 다져야지실내외 화려함으로 이년마다 생김새 바꿔서 유투브보며 조립하며 호객행위하는 타를 내돈 주고 타거 싶을까 ㅎㅎ,17
혼다,오딧세이,카니발 따위가 오딧세이한테 비교자체가 말이 안되지만일본여행갔을때 알파드 타봤는데  알파드가. 최고였다는,2
혼다,오딧세이,시에나도... 비교 가능할까요? ^^,3
혼다,오딧세이,가솔린 배기량만아니면 ..카니발 가솔린도 부담되는데..없어면 디젤이 갑.,1
혼다,오딧세이,정말비교가안됩니다 냉정하게 일본차가 몇수는위입니다 딱잡어 머가좋다얘기못하는데 그냥 오랜시간타보면 확실하게느낍니다,29
혼다,오딧세이,사고싶네요 ㅎㅎ 오딧세이,1
혼다,오딧세이,비교불가 솔직합시다,33
혼다,오딧세이,비교하는 거 자체가 오딧세이에 대한 민폐다! 인정할 건 합시다! 내연기관기계의 성능과 내구성은 아직 일본이 진리!,30
