,comments,likes
403,연비는 둘다 대단하네,1
404,스토닉 1.0터보에 한표출력짱 연비짱 통풍시트도 있고베뉴보다 더 스타일짱임,4
405,차는 편하고 조용해야 한다.,5
406,굉장히 정밀한 줄자 ㅋㅋㅋ 웃었습니다. 갈수록 리뷰가 맛깔나지는 걸요? ㅎㅎ N 사장 사기꾼 감성 따위 이제...,2
407,베뉴는 통풍시트가 없고 스토닉은 전조등이 LED가 아니라는거...두 차가 참 애매하네요 가격이 메리트있는것도 아나고,3
408,성로형 귀에 때려 박아주는 리뷰 좋네요,2
409,사심가득 방송..... ㅎㅎㅎㅎ 근데 나도 베뉴!!!!!!,7
410,베뉴는 진짜 경차같은 느낌이던데둘 다 그닥이지만 그래도 베뉴보단 스토닉아닌가,2
411,짐 코나타고있지만 베뉴랑 스토닉을 고르라면 ...스토닉에 한표  ....,2
412,베뉴 뒷 부분을 스토닉처럼 하는 게 어떨지.,6
413,디자인은 스토닉이 압도적이죠. 프라이드나 k3 다 좋은 디자인,3
414,현대차가 실내공간 하나는 전세계에서도 가장 잘 뽑는다고 봅니다...팰리세이드랑 텔루라이드 외장 크기가 마즈다 cx-5보다 짧은데 실내 레그룸은 도요타 하이랜더보다 더 넓습니다;마즈다 cx-5는 외관 크기가 팰리세이드급인 주제에 실내공간은 고작 산타페보다 조금 넓은 정도죠Alex on Autos라고 미국 유명 리뷰어도 외관대비 실내공간이 동급 최강이라서 추천한다고 하더군요베뉴도 마찬가지 같습니다,4
415,딱 2년 터울 이군요.상품성으로만 따지면 스토닉이 밀릴법 하죠 게다가 더비싸군요...슬슬 페리해야할지싶네요,1
416,통풍시트는 페이스리프트때 옵션넣어 팔아먹을 수단이다에 한표 ㅋㅋㅋ,58
417,흠.. 호불호지만 디자인적으로는 스토닉이 이쁜거 같은데.. 워낙 사람마다 취향이 달라서..근데 너무 까이네요 ㅋㅋ,2
418,트렁크는 스토닉이 조금이나마 더 넓은 것 같던데..,1
419,ㅋㅋ사심이 가득하근요 재밌게보았습니다.,15
420,전차가 스토닉 1.6디젤이었는데정속연비주행하면 평균연비 22km도 뽑아요.,1
421,다른 건 모르겠고 베뉴가 생긴건 훨씬 이쁘네요,2
422,셀토스 하체 및 리뷰 부탁드립니다!,2
423,정보) 스토닉은 17년도 베뉴는19년도,13
424,모트라인은 영상을 보면 기본적으로 현대를 좋아하는거같음.,1
425,셀토스 직접 봤는데  디자인 이쁘더라구요.베뉴뒷 모습이 개인적으로 너무별로...,1
426,스토닉 가솔린 타고 있지만 궂이 비교하자면 베뉴 타고 싶다..,5
427,"다른건모르겠고 디자인은 스토닉압승인거같은데.,",5
428,기다리고 있던 리뷰였습니다.선 댓글 후 감상,2
429,베뉴 영상 중에 제일 와닿는거 같아요,3
430,베뉴 압승이네 디자인도 그렇고,6
431,전 스토닉..... 아무리 디자인은 개취라지만 베뉴는 첫인상이 너무 언밸런스 합니다.... 본닛 뒤쪽의 A필러와 윈드쉴드가 너무 일체감 없이 툭 튀어올라온 듯한..... 마치 경차 주제에 억지로 무리해가면서 덩치를 키운 레이의 첫인상을 베뉴의 첫인상에서 느꼈습니다.,6
432,와이프차량으로 고민중이였는데.. 봐도봐도 고민이네요..,23
433,2년째 스토닉타고있습니다. 구매동기 대형견을 키워서 써드카로 구매했습니다. 나오자마자 전시차량 바로 샀구요.  1.6 디젤 풀옵으로 구매했습니다. 장점1. 연비 13-14키로 유지2. 혼자타고다니기 딱 좋습니다. 3. 풍부한 옵션 차선이탈 방지 및 전방 추돌방지(이 옵션은 정말 좋습니다)  측후방 센서 4. 주차편함5. 고속도로에서 스트레스 없이 쭉쭉 밀고 나갑니다. 단점1. 뒷자리 포기 승차감 정말 거지같습니다. 2. Dct는 개나줘버려 정말 구립니다(가끔 언덕에서 밀려요)3. 트렁크 공간 정말 협소합니다. 제 생각엔 주요 타켓은 사회초년생 여성분들에게 딱 맞을것 같습니다.,57
434,개인적인 생각은 지양하는게 좋겠네요. 정보를 줘야지 자기 생각만 얘기하다가 끝나네요.,3
435,베뉴오늘보고왔는데 생각보단크고 이쁘던데,18
436,좋게말하면 잘들리는 리뷰나쁘게 말하면 화내는 리뷰 ㅎㅎㅎ,2
437,솔직히 베뉴는 아님 너무 사심 많이 들어감 스토닉 1.0 터보가 답임.,23
438,ㅋㅋㅋ 이게 왜이렇게 웃기지햄톨: 난 베뉴살래 끝또치: 아 그럼 베뉴 사요햄톨: 네~또치: 네~,8
439,베뉴는 이급에선 진짜 잘나온거같음 항상 보면서 느끼는거지만,5
440,당연히 새로 나온 신차종이 낫지..하지만 디자인은 개인취향이고..같은 비유로 2년전에 나온 옷이랑  지금 나온 신상이랑 같나?,1
441,레드불 3개정도 빨고 하는 탠션입니다. ㅋ  기분이 업업 됩니다~ ^^,1
442,베뉴는 옵션종류가 너무많아요  옵션몇개 선택하면   가격이 확 올라가요,1
443,"베뉴는 장점만을 찾고 스토닉은 너무 단점만 찾아두고 비교하시는 기분이 확실하게 드네요,,,",7
444,베뉴는 코나에도 없는 험로주행모드가...,19
445,스토닉 번호판이 보이네요..ㅋㅋㅋㅋㅋ혹시몰라 댓글로 적습니닼ㅋㅋㅋ셀토스와 코나도 리뷰부탁드립니다! 모트라인 화이팅!!,26
446,으아 ㅋㅋ 윤사장 편파 제대로! ㅋㅋ 잘봤어요,9
447,처음 들어올 땐 새찬데 아무래도 베뉴가 좋지~ 했는데 왜이렇게 얘기 들을수록 스토닉 실드 치고 싶지,8
448,왜이리 우리나라는 suv를 좋아할까 난 세단이랑 해치백이 최고,7
449,불쌍한 스토닉ㅠㅠ,1
450,동생이 스토닉 디젤모는데 제 느낌상 진동이랑 소음은 별로 없습니다 과장이 살짝 들어간듯 하네요...,2
451,베뉴를 위한 밑밥 스토닉.......모트 취향........,1
452,3:34 스토닉에 번호판 가리개가 모트라인에 미래인가요... 17년에 나온 스토닉이랑 이제 막 나온 베뉴를 비교하면서 베뉴 손을 들어주는건 좀 아닌 듯 싶네요. 그리고 디자인은 진짜 지극히 주관적인듯 싶네요ㅋㅋ 베뉴 디자인 엄청 까이던데ㅋㅋㅋ,1
453,저는 이대로 유쾌하게 하는 모습이 젤 좋은거 같애요 오히려 좀더 까불어도(?)괜찮을거 같애요,2
454,현대 기아 같다고 하지만그래도 둘중엔 현대가 낫습니다,2
455,베뉴는 쏘울 눌러놓운것 같이 생김...내눈엔 스토닉이 더 멋짐,1
456,베뉴가 더 귀엽네요 ღ’ᴗ’ღ,8
457,스토닉은 suv라 하면 안되는거 같음..그냥 좀큰 해치백.. suv로 홍보해서 망한거 같음,2
458,나는감독님이 생긴게 좋아ㅋㅋㅋㅋ 윤대표님 귀여우셔ㅋㅋ,7
459,이렇게 재밌게 본 리뷰는 첨이네요ㅋㅋㅋㅋㅋㅋㅋㅋㅋㅋㅋㅋㅋㅋㅋ 전 여자인데도 베뉴 디쟌이 왜케 예뻐보일까요..... 강한여성느낌,1
460,출시연 거의 2년이나 차이나는 차를 비교하는 것이 맞는지 ...,2
461,2분 37초까지 보고 아 베뉴가 좋으시구나..,1
462,베뉴 안전등급 2등급이라고 하던데..  요즘 차는 2등급도 없다하던데..,1
463,베뉴가 걍 더 예쁨,2
464,형님..스티커 신청한지 7달이 지났습니다..ㅠㅠㅠㅠㅠㅠㅠ 아직도 감감 무소식입니다ㅏㅏㅏ,1
465,오랜만에 봤는데 리뷰 재밌게 잘하시네요원래 노사장껄 즐겨봤는데 볼수록 멀어지더군요 시청하다가 옆에 누구라도 있으면 민망해서 못보겠습니다 섹드립에 욕난무에..개취겠지만 전문성도 안느껴집니다  자기자랑 듣는것도 지겹고 성로씨와 노사장관계를 떠나서 영상보기에는 성로씨가 훨씬편하네요 앞으로도 누구나 봤을때 편한영상 부탁드립니다,2
466,베뉴는 디자인 답이 없어서 스토닉이 나은듯,7
467,성로씨  화이팅 ~~또치감독님 화이팅,3
468,갠적으로 디자인은 베뉴가 더 예쁜듯 ㅎㅎ,3
469,스토닉 디젤연비 30키로나오는영상보고 식겁햇는데ㅋㅋㅋㅋㅋ,21
470,베뉴만 왜 더 좋게 평가 하나요?,2
471,두 개중 하나 고르라고하면... K3탈래,3
472,베뉴 엔진룸에 냉각수보조통 있나요??,1
473,둘다  답이 없는차,2
474,오늘은 시간에 쫓겨하시는 느낌?ㅋㅋ 땀이 송글송글 잘봤습니다,26
475,저 급에서 따질 필요가 없는 것들. 결론은 그놈이 그놈이니까 마음에 드는 놈으로 고르세요.첫차로 적당한 친구들임. 장거리용으로는 요추받침이 없어서 힘듦.,4
476,둘중에 사라면 나라면 스토닉 1.0터보,18
477,나름 스토닉 처음 출시 했을때  코나랑 비교하는 차량이엇는데... 이제 코나 아래등급 베뉴한테도 밀리네....,6
478,차라리 티볼리 코란도나 소나타 타겠다,1
479,지금 보이는 베뉴가 더데님인가요 코스믹그레이인가요? 빛받으니까 색이 헷갈리네요,1
480,베뉴 통풍시트없는데 내년에 부분변경해서 통풍시트 추가될꺼라고 보시나요,1
481,이 집 재밋네~에어백 유무와 숫자가 중요한게 아니라잘 터지느냐가 중요한게 아닌가요?제일 중요한게 안전 부분인데 제일 대충 넘어가네요.,2
482,후덥지근한 날씨에    야외 촬영 하느라 고생하셨습니다.,10
483,리뷰 하실때 듣는 사람 위주로 부탁드려요너무 하이톤 으로 하이텐션 으로 목이쉴듯이 소리지르는듯이 들려서 듣기 힘들때가 많습니다차분히 설명해주시면 좋을것 같아요설명할때 숨도 고르고...듣는사람이 숨이차요잘 전달할려고 열심히 하는거 같은데 오히려 반감되어 오히려 호소력이 떨어지는거 같습니다더욱 좋은 리뷰어로 발전 하세요,8
484,대표님 목이 나간 느낌이 강하네요. 건강챙기면서 하세유.,1
485,디자인은 기아가 더 좋다고 생각합니다. 제 생각엔 말이죠,34
486,아주 편파적인 내용 잘 봤습니다 ㅋㅋㅋㅋ,16
487,저도 베뉴^^  사심가득~~,6
488,베뉴랑 셀토스를 비교해야 되지않나요?,1
489,레이 사는게낫지 않나..,4
490,얼마전 친구 K3 뒷자석 탔는데 시트가 낮아서 다리가 엄청 아프고 저리더라고요,1
491,모든면이 스토닉완승~!,4
492,그나저나  24고 1997 넘버의 스토닉차주는 이번리뷰에서 보호받지 못했구만 ^^,4
493,베뉴는 쏘울뻥튀기스토닉은 프라이드뻥튀기,1
494,"저 불편러는 아닌데, 햄토리대표님이 리뷰 해주실때 다소 나긋나긋한 목소리, 사람과 대화하는 목소리톤이면 좋을거같아요~너무 소리 지르는 느낌? 목에 핏대 세우고 노래방 에서 고음 지르는듯한 목소리톤이라 오래 듣고 보기엔 부담되는거같아요~실내 리뷰일때조차도 일관된(?)지르시는 목소리 너무 커요~고음 정점에서 갈라지는 허스키 목소리..ㅠ저만 그런거면 제가 감안하고 볼께요ㅠ조심스럽게 건의드려보아요! 절대 기분나빠하진 말아주세요~",2
495,4만원 더 내고 이거 탈래요 ㅋㅋ 넘 재밌떠요,1
496,둘다 너무 싼마이 이차종으로 suv활용하는건 무리고 무조건 k3 삼각떼 혹은 차라리 터보단 티볼리로 갈듯싶다,4
497,볼때마다 느끼지만 진짜 혼자만의 생각을 아무 꺼리낌 없이 말한다. 어떤 수치로된 비교같은건 전혀없음. 나름 이런사람두있구나하고 보지만 진짜 맘에드는구석 1두 없음,1
498,차는 신차가 최고 ㅎㅎㅎ,4
499,베뉴는 누가봐도 티볼리 박살내려고 나온 모델임 ㅋㅋㅋ,80
500,흠... 앞에 나 광고에서 봤을 땐 베뉴가패밀리룩이라 예쁘다~ 했는데 너무 껑충해서 쏘울 후속인가 싶은 느낌도 드네요,1
501,돈 조금 더 들여 셀토스 사는게 진리죠~^^,3
502,ㅋㅋㅋㅋ차 작으면 무조건 까고 보는 댓글들ㅋㅋㅋㅋ차는 취향이지 크기가 아니지않나,272
503,차급도 차급인데... 가격이 너무.... 2000만원 넘는 초소형 SUV라니..,21
504,셀토스도 리뷰 부탁드립니다,4
505,셀토스도 리뷰 부탁드려요,6
506,스토닉 터보 1.0  좋다고 하던데~ 개취 차인가요?,1
507,실제 공간이 궁금,1
508,영상 잘 봤습니다~근데 영상이 매번 너무 길어 부담 스러워요,3
509,결국 소형은 소형.디자인에서 호불호가 갈리거나실내공간 에서 갈리겟죠,5
510,베뉴보다 전 스토닉입니다. 베뉴 시트나 센터페시아 너무 쌈마이 해보임.,2
511,거름망을 조수석에 설치만했는데 베뉴보다 비싼 1750만원 이게 싸냐!?,1
512,스토닉에는 통풍시트 잇나요?,5
513,베뉴는 레니게이즈 같은 느낌. 귀여움. 스토닉은 별 감흥이 안생김,5
514,서울시내에 일초도 아까운 신호등과싸움에서 저런차는 가속도 너무 느림,1
515,운대표 재밌네요 ㅋㅋ,4
516,애초에 년식차이나는데 내부비교자체가 편파비교인가요 지금이랑 2년전이랑 다른게많은데,1
517,준대형타는데 베뉴 탐나네요,3
518,프로포션은 스토닉이 취향...,10
519,앞에서 보면 포터대가리에 뒷축(짐칸)을앞으로 갖다붙인 느낌  ㅋㅋ 실제본느낌,8
520,스토닉은승용차같은SUV...베뉴는경SUV...스토닉우세승!,1
521,리뷰하실떄 조금 말씀을 천천히 덜숨차게 말씀하시면 더 좋을거같습니다.,6
522,뭔가 차가 너무 커보이네여 싼타페랑 모하비 비교인줄 ㄷㄷ,1
523,2300만원이면 아반떼나 k3에 옵션 많이 넣고 탈듯..,20
524,베뉴 실물보고... ㅎ^^,1
525,전 스토닉이 디자인 더예쁘고 베뉴 테일램프부분이 별로,2
526,스토닉은 통풍시트 있어요 그게 고민...,29
527,쏘울타라저두차보다는 나을듯,6
528,너무 표시나는 편파적인 비교 분석~ 확실히 사심 분석인것 같네요~스토닉 타고 다니신분들은 기분 나쁠 것 같네요~,4
529,지금 기아자동차에 찾아보면 가격표에 디젤은 빠졌습니다.단종될것 같네요.,6
530,"베뉴네비게이션은  핸드폰과  스마트뷰, 미러뷰 같은 기능 되나요?",1
531,스팅어 3.3좀 리뷰해줘요,4
532,디젤은 최소 250이 더비싼데 2300 기준을 제대로 잡은 건지,2
533,주관적맞네요 ㅋㅋㅋㅋ  객관적은 아닌거 인정,7
534,주행모드가 필요한 차인지는...,9
535,리뷰 대본이야 애드립이야. 역시 짬밥은 무시못함,2
536,1.0이면 경차인가요?,2
537,헐 베뉴 통풍시트가 없네요...,2
538,베뉴가 훨 낫네,5
539,어차피 다 혼자 타는 찬데 왜 2도어차는 안나오나? 아파트는 1-2인가구용이 대세인데 차도 1인용으로 2도어 좀 만들어라,1
540,근데 2300만원이면 그냥 아반떼 옵션몇개넣고 타는게더좋을듯?,1
541,셀토스 리뷰 해주세여!,2
542,차 길이랑 휠 베이스랑 다르지 않나요,2
543,내차 530i 인데  실내 크기는 비슷하네.....ㅋㅋ,1
544,스토닉 아니라 셀토스를 비교해야하는거아님? 가격을 떠나서베뉴랑 셀토스가 인기데ㅡㅡ,4
545,위급 살건대하는 사람 정신차려 투싼 이고 스포티지 고  선택사양 빼고 최하위트림은 2400만원대  인데  그런헛소리하지말고 베뉴나 스토닉은 풀옵션으로 안하면 등록까지 2100~2200얜충분하다,8
546,베뉴는 약간 소울느낌....,24
547,베뉴 통풍만들어가면 됨,35
548,스토닉 가솔린이랑 비교 해야하는거 아닌지. . .,2
549,난 다필요없고 통풍시트있구 풍절음만 작으면 됨 ㅎㅎ,1
550,185에 모닝타고 출퇴근 하는데 불편함 못느끼는데 비정상인가ㄷㄷ,4
551,현대차좋아하시는듯ㅋㅋ 저도현빠,4
552,베뉴 전자식 사이드미러 없다던데..,1
553,스토닉은 팔리긴 할까?,3
554,걍 저 2300주고 저 두 차 사느니 쏘나타 2400~2500사이 되는거 살듯 적어도 뒷자리 공조장치는 있다,5
555,베뉴는 경차느낌,1
556,2300이면 동일 파워트레인에 차도크고 옵션도 훨씬많은 K3나 삼각떼가 보여서 ;;;소형 SUV 거품 언제 꺼질려나,15
557,둘중에 하나 고르자는데 둘다 안산다는말은 뭐냐...,6
558,베뉴 웰케 디자인이.. 제취향이 아닌듯,1
559,나는 저거 베뉴 저 그릴보다 스트라이프?로 된 그릴이 좋던데,1
560,운전자가 사용하기 좋으라고 생각해서 조수석에만 포켓을하나만  만든건데 비웃는모습은 보기좋지않네.현대 협찬받았냐?.아주 신자네 !,2
561,레드불 텐션은 너무 좋은데가끔 목에서 쇳소리 나올때 안타깝기도 하고 그래요.발성 쪼끔만 신경 써서 습관들이시면 좋을거 같아요.리뷰 오래오래 보고싶어서 하는 얘기입니다.ㅎㅎㅎ,12
562,저는 딴거 모르겠고베뉴가 더 작아서 베뉴로 결정,1
563,본 리뷰는 하기 싨으셨나봐요 마이 흥분하신듯,15
564,와 베뉴 많이보이던데,12
565,티구안 올스페이스vs 푸조5008 보고싶어욤,2
566,제목을 이거보고 베뉴사세요로 박궈얄듯 ㅋ 잼게잘봤슴다,3
567,베뉴.... 통풍시트만 왜 뺏냐 ㅋㅋ,2
568,스토닉 옆에 찌그러진건가요?,1
569,이날씨에 통풍시트없는거실화냐,1
570,베뉴는 휠이 블랙휠인가요?,1
571,베뉴가 예쁘군,2
572,컨텐츠 요즘 재미있네요,2
573,Dct절때사지마셈  연비이득본거 배로 미션수리비나감 ㄹㅇ 고속주행 80퍼이상만 구매하시길 ㅋㅋㅋ,2
574,리뷰는 까만형만 했으면,3
575,스토닉 코나랑 경쟁모델아닌가?,2
576,현대 칭찬 많이.하네. 기아은 음 ㅎ ㅎ,2
577,2300만원이라.. 쏘나타가 저가격이였던게 엇그제같은데..,4
578,통풍시트 있고 없고의 차이 ㅋ,2
579,마! 현대가 시키드나!! ㅎㅎㅎ스토닉 차주였습니다 기분나빳다면 죄송합니다,1
580,누가봐도 편파적이자나ㅋㅋㅋ기아 스토닉 저격온것같은 느낌,1
581,소리좀 질르지 말아주세요 ㅜㅜ,12
582,과학적으로 굉장히 절밀한 기계로 측정.......줄자!      풒......,1
583,스피치 학원을 다녀보는게 어떠실까요? 모트라인팬인데 쇳소리나는건 좀 안타깝네요. 기본 발성 개념이 안 잡히고 너무 목으로 말할려다보니까 쇳소리나는것같은데 정말 욕심있고 길게 보신다면 스피치학원 다녀보는거 추천합니다,2
584,존만한차가드릅게비싸네..,1
585,개인적으로 살꺼면 베뉴가 나아보이는데 풀옵살 돈이면 그냥 투싼이나 스포티지 사는게 낫지 않을까 싶네요그래도 디자인적으로 아기자기하게 잘빠져서 여성분들한테 인기있을꺼 같네요,1
586,베뉴는.. 엑센트 후속스토닉은.. 프라이드 후속임알고들 타세요베르나 프라이드를 2천만원에 파네,1
587,2300 이면 셀토스~ㅎㅎ,8
588,핸드폰으로도 네비 잘보는데 7인치라 답답하대 ㅋㅋㅋㅋㅋㅋㅋㅋㅋㅋㅋ,1
589,읭? 스토닉 코나급 아니었나요 쿨럭;; 저라면 그냥레이.. 이 급 보시는 분들 돈 좀 더 모아서 스포티지 하시길 애기 생길지모르는 년차수 낮은 신혼부부급이라면 더더욱 (야 그럴거면 돈 더 모야서 산타페사지.는 반사) 주머니 마지노선 2500일시,3
590,어째 작은 차에서도 작냐~ ㅋㅋㅋㅋ,2
591,이제 저 가격이면 xm3로~,1
592,차가 큰건지 햄토리 사장님이 큰 건지 모르겠네요 ㅋ,3
593,스토닉 번호판이 노출됐네요,1
594,세금내고  기름이  아까운차,1
595,3:34 스토닉 번호판에 모트라인커버 떨어짐 ㅋㅋㅋㅋ,48
596,실제로 보니까 스토닉 이쁘던뎅,3
597,스토닉 1.4 가솔린 7개월 탓는데사지마세요!!!!!,10
598,차는 연비만 좋으면 된다. 스마트 크루즈 정도만 있으면 되고ㅋ 타고 다니는건데 뭐 ㅋㅋ 천년만년 타는것도 아니고,1
599,아... 이번 리뷰는 좀 어거지인듯... 모카가 더 정확한 리뷰인듯 하네요...,1
600,베뉴나 스토닉은너무작고 셀토스는 소형답지않게너무크고 ㅋㅋ 코나가 적당하다고봐요,2
601,부동산거품이 많고 흉기차도 거품이많음,6
602,2300이면 스포티지 트렌디등급에 네비+후방카메라 + 열시트  옵션인데 ;..,2
603,목 쉬시겠어요 ㅎㅎㅎ. 마이크 있으니 조근조근 말씀하셔도 될 것 같아요.,1
604,베뉴 스토닉 사느니 레이 사고 말지......,1
605,저거 둘다 suv아님   닷지 캘리버 이거랑 같은 느낌  전고가 너무낮아  절대suv아니다,5
606,qm6 lpe도 2300인데  경차를 왜 웃돈주고 사는거야,1
607,횽하 텐션 좀 낮춰...... 톤도 좀 다운 시키고!!!!혈업터지겠어. 그거 빼곤 다 좋네~~~~,30
608,배뉴단점 ㆍ비싸고 연비도별루,4
609,"윤대표 리뷰가 일반 사람들이 접하는 관점으로로 접근해서 매우 좋아합니다.영상보면서 느낀게 있는데, 이번에 야외에서 해서 그런지 목소리 톤이 상당히 높습니다.다르게 들으면 짜증내는 목소리일 정도로요.다음 리뷰에서는 목소리 톤을 약간 한두단게 톤 다운해서 해주셨으면 합니다.그리고 캐리커쳐요.특징은 잘 살렸는데, 윤대표 것만 짜증내는 모습입니다.그건 이미지에 도움 안되는거 같아요.좀 더 순화시킨걸로 바꿔주세요.",3
610,할인받고 1800중후반 트랙스 레드라인 살게요 1.4 140마력,5
611,차안에서 부드럽게 말하는톤이 나은거같아요,2
612,깨알같은 버바팀 pplㅋㅋ,8
613,스토닉은 못생겼는데 베뉴는 참 귀엽게 생겼네요 :),2
614,베뉴 진짜 안나가던대 ㅡㅡ,1
615,리뷰를 하는 데 왜이렇게 화를내세요 ㅋㅋㅋㅋㅋ,40
616,셀토스랑 비교를하면 베뉴 노답입니다 ㅋㅋ,1
617,음....  목소리가 너무 흥분상태라 ㅋㅋㅋ  편안하게 보기가 힘드네요.원래 윤대표님 목소리 톤이 그러하긴 한데 오늘은 더욱... 다음리뷰는 좀더 부드럽고 나긋하게 부탁드려요 ㅎㅎ,18
618,얘는 너무 외국 사대주의 머리에 박혔어...,1
619,전 그래서 쏘울 부스터로 갔습니다,30
620,소리를 주로 듣고 화면을 잠깐잠깐 보는데 얘얘 하니깐 어느 차를 말하는 건지 알기 힘들어 아쉽습니다.. ㅠㅠ,2
621,형님은 볼때마다 느끼는 거지만.. 정말 가수 조장혁님 닮으셨어요...,1
622,으하하하 윤대표 재밌어 으하하하 <3,2
623,스토닉차주는웁니다,1
624,둘다  이도저도 아니다 그냥 시내 출퇴근용이나  시장갈때  타고  다니면 되는 차다,1
625,결론! 나는 베뉴 살래~!,11
626,저가격에 베뉴 스토닉 살빠엔 k5나 아반떼삼,2
627,말하실때 너무 긁히네요 좀 더 저음으로 크게 얘기한다고 생각해보시고 말씀하시면 더 좋은 소리가 나올거에요! 저도 그랬거든요ㅠㅠ,3
628,조회수 대박쳤네,2
629,먼가 말톤이 서두르는 리뷰같아요 차분하게하세요,6
630,갠적으로 베뉴 좋아하지만 그냥 베뉴 광고 같음ㅋ,1
631,차라리 쉐보레 스파크!,3
632,셀토스가나왔는뎈ㅋㅋㅋ 베뉴랑 스토닉 비교를한다고???,2
633,베뉴 귀엽네,1
634,다보고난 느낌 배뉴는 장점만 스토닉은 단점만있다.,2
635,정확장비 ㅋㅋㅋㅋㅋ 줄자 ㅋㅋㅋㅋㅋㅋㅋ,1
636,비교인지 베뉴 광고인지....,2
637,스토닉 번호판 가린거 떨어졌어요ㅋ,1
638,그냥 둘다 사지말고  k3이나 차세대모델 나오는 아방이 사는게 답,2
639,저같으면 셀토스 사겠음ㅎ,1
640,이때만 해도  화가 들하네 ㅋㅋㅋ,1
641,싼티 진짜 작렬이네,1
642,"글쎄 베뉴 디자인 7,80년대 깍뚜기같은데",1
643,"소형,준중형승용차사려거든~스토닉SUV구입하세요!...광명소하리생산기지에서~",2
644,스토닉 디젤단종,1
645,역시 기아보단 현대지,4
646,베뉴 승,3
647,마이크 차고 있어서 살살 말해도 되지않나요? ㅋㅋㅋㅋ 윤대표님 악쓰면서 말하는거 같아요 ㅡㅜ 숨차요....,9
648,모닝에 튜닝한거 같다,1
649,결국엔 자기가 맘에드는거 삼 ㅇㅇ,1
650,디자인은 스토닉이 훨 이쁜데 왠 애매모호?,2
651,차로 부르기도 민망한 애들을........... 모트라인 정말 사랑하지만 이번 기획은 약~간 실망입니다ㅜㅜ물론 채널 성장을 위해 하기 싫은 콘텐츠도 하셔야겠죠. 고생이 많으세요,2
652,그냥 대충타는 차지 뭐..,2
653,어떤차량 비교해도 모트라인은.... 혀.....ㄴ 빠죠...,5
654,4:46 스토닉 차량번호 개통,3
655,ㅎㅎ형제의난~^^♡,4
656,무조건 현대지 자동차를 많이 타본사람은 현대를 추천한다 형만한 아우없다,8
657,사심이 넘치는구만,1
658,저정도 가격이면 셀토스지... 생김새이쁘자나,5
659,내돈주고 내가 좋아서 사는건데 정답이어딧나요 ㅋㅋ 개취인거죠 세금이야 차이난다지만 2천넘는차 인데 세금 몇만원 더나간다고 못살사람없자나요 안그래요?,4
660,이분 원래 말투 비꼬면서 띠껍게 말하는게 컨셉인건가요;;...... 스토닉 오너들 개 빡칠듯 ㅋㅋㅋㅋㅋㅋ,2
661,그냥 스토닉 까다가 끝나네,45
662,스토닉 앞 번호판 ㅋㅋㅋ 덜렁덜렁,5
663,"베뉴 리뷰네,스토닉 까는영상~게이세분vs그랜저하면 똑같은데도 1개 까겠네요ㅎㅎ 아반떼vs k3해도 1개 까긋네 똑같은차로 왜까는지몰라 본인 취향대로 사면되는걸,자기 맘에 안든다고 까고^^",3
