,comments,likes
1656,커넥팅로드 ㅋㅋ없으면 깍으면 됩니다,1
1657,가슴이 뭉클해집니다.,1
1658,엔진이 살아난다. 차가 살아난다.. 최고 이십니다.,1
1659,저두 정비사출신입니다 그냥 밥먹구살려면 생계형차량하세여 그게끝입니다 현재로써는 ㅎㅎㅎㅎㅎ,1
1660,천안에 제가 한때 자주 다니던 길에 있는 정비소이었군요...,1
1661,대박 ㅡㅡㅡㅡㅡㅡㅡㅡ,1
1662,감동적이네요.,1
1663,보고 또 보고멋지다^~이 경기에 ^~,1
1664,울뻔  감동,1
1665,멋지십니다.,1
1666,중고차 하나 사는게  나은듯 ..,2
1667,감동임니다 감사합니다,1
1668,이야 여기 채널 영상 첨보는데 멋지네요,1
1669,전문가라는 말을 이런 분들을 두고 지칭하는거였구나,1
1670,감동입니다 구독하고가요,1
1671,아 멋있다,1
1672,감동  받았어요  카맨 최고임,1
1673,멋지다~!!!!,1
1674,이거 무슨 차를 다시 만드는수준인데;;,1
1675,지역번호판 옵티마는 못참지ㅋㅋㅋㅋ,1
1676,눈물나게..훌쩍..,1
1677,와...다섯살 때 차가 좋아서 길에 있는 모든 차 이름을 말하면서 다닐 때 좋아하던 차 중 하나인 옵티마를 리스토어 하시다니... 사연도 좋고 카맨 패밀리 분들과 다른 업체 분들 모두 고생하셨고 앞으로도 사업 대박나시길!!,2
1678,리스토어 옵티마 진짜 멋있네요!!!부품수급이 어렵겠지만 30년이상된 차들도 리스토어된거 보고싶네요 정말 수고 많으셨습니다.,1
1679,아~~~~~~ 눈물난다~~~~~,1
1680,와...갬동을 넘은 감동...진짜 멋있는 차가 되었네요함께하신 대표님들 임직원 분들 모두 고생하셨겠네요..저 도자기 같은 차에 손 자국 하나 남겨보고 싶네요새차 샀을 때 보다 더 더 좋은 마음들이 말로 표현하기 힘들 것 같네요너무 멋있네요,3
1681,내가 짊어진 삶의 무게는내 아버지의 어깨만큼 무겁지 않다.,1
1682,"와...정말 싹다 고쳤다고 봐도 무방할 듯..힘든 시기 무탈히 지나고 번창하셔서 더 재밌는 영상 많이 올려주시길 소원합니다, 화이팅!",1
1683,엔지니어분들이 항상 새로운 도전과 발전하시는 모습을 보면 진짜 기술자 후배로서 너무 도전받네요 날씨도 더워져가는데 몸 조심하시고 항상 응원하겠습니다 좋은영상 부탁드려요~!!,1
1684,매장 전화번호 좀  알려주세요,1
1685,쑈미형님....일하시는 모습 ㄹㅇ 왜케 멋있냐 ㅋㅋㅋㅋㅋ와... 이번 영상 최고로 멋지네요...오래토록 정비사로 일하시며.. 카맨 패밀리분들 마음가짐 부터 큰 사람이 되신거같네요...마지막에 차주분 받으시고 감동의 폭풍 눈물 예상 했는데...아쉽기도하고 한편으론 조회수에 목메지 않으시는거 같아 더욱 감동적이네요~♡,1
1686,이런분들이 진짜 명장이지...명장 이름 팔아먹어서 돈독오른 노인네 새끼말고..,1
1687,"리스토어 하시느라 모두 수고하셨고, 차주님께서도 오래오래 안전운전하시면서 타시기를!",1
1688,요즘 같이 힘든 시기에  엔진작업만  봐도 엄청 힘들어  보이는 일인데 이걸 무상으로 해주신다니.  정말 대단하세요.정말  감동받고  영상 잘보고  갑니다.항상  잘되시기를  기원합니다,1
1689,저도 구독 눌렀음 이분  맨날 돈안받아 ㅋ,1
1690,진짜로  와~~~말이 안나올정도로 옛날차 복원하는 영상 처음봤어요  진짜로 대단하시고  수리하는라 피곤하실텐데  대박입니다 카맨패밀리분들 수고 하셨어요,1
1691,이러니 새차 살 필요가 없음,1
1692,기존에 더뉴K5도 그렇고 이번 옵티마도 그렇고 정말 좋은일 하신것 같습니다!! 차주분은 평생 추억을 안고 카맨패밀리에게 평생 감사해 할 것 같네요,1
1693,제 마음이 다 뿌듯하고 감사하네요. 최고입니다. 협력해 주신 모든 업체 사장님들 앞으로 더 승승장구 하시길 바라고 정말 감동 그 자체입니다.,1
1694,보다보니 30분이 후딱 지나갔네요.,1
1695,댓글을 잘 안달지만 카맨님 이번 편은 안달수가 없네요... 고생도 많으시지만 차로 인해서 좋은 스토리를 정말 잘 전해주시는 것 같아서 감사합니다^^,1
1696,외관은 신차급인데? ㄷ ㄷ ㄷ,1
1697,내가 믿고 맏길수 있는 서비스 센터가 있다는건 행운 입니다,1
1698,15:08요런것들은 이전자리아닌 다른자리들어가도 상관없는건가요? 잘몰라서여쭤봅니다.. 항상 웬만하면 같은자리들어가는게 좋다고 알고있어서..,1
1699,구독박았습니다,1
1700,대한민국에서 젤  믿음이 가는  신의손들~~~~~~~~~^^,1
1701,그냥 새차를 사드리자,1
1702,역대급입니다. 기가 맥혀요,1
1703,구독하고 처음 댓글 달아요~카맨 사장님 생각과 인성이 베리 굿 입니다~,1
1704,지역이천안이셔요?,3
1705,잘봤습니다 .부품들이 아직다 나오는군요.번호판은 모자이크했어도 길에서 마쥬치면 바로 알겠어요 수고하셨습니다,1
1706,묵묵히 구독을  클릭,1
1707,리스토어라면 옵티마에  신형 K5 엔진으로 교체 하는 건가요?,1
1708,당신들은 이 대한민국의 힘입니다.가슴 찡한 영화를 보고 갑니다.이 세상에 빛과 소금이 여기 있었군요.감사합니다.,1
1709,이영상보고 구독,1
1710,돌아가신 아버지 생각에 눈물만 쭈룩쭈룩 나옵니다.  어릴적 부모님과 함께 수산시장에서 게를 샀는데 한마리라도 살리고 싶어 울고불고  어머님께 땡강을 부렸지만 결국 저녁식사로 되어 버렸지요. 그런데 아버지는 저 몰래 수산시장에 다시가셔서  바닷물과 게 몇 마리를 다시 구해오셔어 잘 키워서 다시 바다로 보내자고  말씀하셨던 기억이 나네요~ ~~~제 나이가 50이 넘어서도 사랑한다는 말씀을 드리고 싶습니다~~~~,1
1711,여기 위치가어디예요?,3
1712,환골탈태의 극치를 느끼고 갑니다.,1
1713,당신들이 있어서 세상은 더 아름다워질 수 있습니다 수고하신 모든 분들 께 우리 좋으신 하나님의 풍성한 축복이 늘 함께 하기를 기도합니다 감사합니다 수고하셨습니다 응원합니다,1
1714,안티가 아니라 그냥 사연 이라하시면 될뜻~~~~~,1
1715,아 실린더 헤드를 저렇게 박는구나 지그가 다 있네 링을 어떻게 잡고 밀어넣나 궁금 했는데 잘보고 갑니다.,1
1716,도와주신 모든 업체분들 부자되세요!!!!!!!,2
1717,이 어려운 시기에 도움 주신 대표님.직원분들 3대가 복 받으실겁니다.,1
1718,거의 새차가 돼서 나왔네요. 저도 보면서 뭉클해지는데 차주분께서 보고 얼마나 감동받으셨을지.. 좋은 영상 올려주셔서 감사합니다.,1
1719,그냥 새차로 다시 태어났군요,1
1720,정비사님들의 노동이 감동을 주네요 최고의 영상 입니다 ,1
1721,우리아빠도 그랬겠지... 내가 아들 생각하는 만큼...,1
1722,진짜 리스펙 합니다. 협력해주신 모든 업체 또 카맨 패밀리 번창하고 항상 행복하세요.,1
1723,"깨끗하게 리스토어된 차를 보며 많은 정성과 손길을 들여 새차 같은 기분이 들어 감동많이 받고 갑니다 카맨식구분들 너무나도 고생많으셨고 항상 사업 번창하시길 바라며, 차주님도 오래오래 관리하시며 항상 안전운전하세요~~!!",1
1724,카앤맨은 홧팅야,1
1725,정말 대단하십니다. 노후차 복원에 감탄을 금치 못하겠네요 .,1
1726,광고 좀 더 넣으셔도 될듯,1
1727,저도 소중한 차량을 현재 잘 간직하고 잘 운용중에 있습니다. 비록 다른 차종이지만요^^ 한편으론 부럽기도 하네요. 저도 현재 슬슬 한개씩 천천히 리스토어 하는중이긴 합니다.  소중 한 추억을 빛나게 해주신 카맨님 대단하시다 생각이 듭니다.,1
1728,이 시대에 정말 보기드문 분들입니다. 너무 너무 감동입니다. 카맨 모든 분들 건강하시고 사업장이 날로 날로 더 큰 축복 받으시길 소망합니다. 수고하셨습니다^^,1
1729,전부다 공짜로 리스토어 해준겁니까???,1
1730,와우~~!!! 엔진 및 실린더 헤드  당신들의 노력과 열정 기술을 응원합니다 ^^,1
1731,앞에 4분만 봤는데  눈시울이 붉어지네요...,1
1732,옵티마 리스토어  영상 잘보았습니다. 옵티마 리스토어 진행 과정을  보니  많은  사람들이 도움주셨네요.   감동쓰럽고  수고하셨습니다. 카맨패밀리  파이팅 하십시요,1
1733,지인분들도 대단하시네요.감동입니다.모두 응원합니다.,1
1734,눈물난다~,2
1735,멋진 작업 하나를 해 내셨네요.스토리가 있는 영상 재밌게 봤습니다.그런데 2010년식 치고는 좀 많이 낡은 상태였네요.고생많으셨어요.,1
1736,1000이면 그냥 중고차 좋은거 하나 사는게 ...,2
1737,감동입니다.,1
1738,아버지라는 무게를 느끼고 알아가는 삶을 살아가면서 이 영상을 통해 아버지에 대해 다시 생각을 해 봅니다. 감사합니다.,1
1739,엔진 손대는건 어우.. 답이안나온다 -_-...부품 저거 어케 기억하시는지...,1
1740,오늘처음보는데 이분들 진짜네 엔진뜯는거보고 그렇게 느껴짐,1
1741,K5의 아버지.,2
1742,고생 많았음. 잘만든 영화 한 편 본 기분임.,1
1743,가슴이 따듯한 영상이네요~,1
1744,풀시청 ㅎㅎㅎ,1
1745,영화한편을 보는듯하네요 뭉클해지네요,1
1746,고속도로에서 이차 뒷태 보면 토나와서 무조건 추월함,1
1747,멋지다 !,1
1748,감동입니다,1
1749,나 울었다,1
1750,이제 차주분 30년 타셔야 겠네요 축하 드립니다.이런  행사를 워캐 기획 했을까요?  좋은 일 하셨어요 참말로!!!!저도 내  틱순이 내년이면 30년 생일빵 먹여 하는디  빵을   구하기가  쉽지 않네요또 나랑은 너무 오래 있어서 참 헤어지기가 쉽지 않아요몇번 죽을려는거 살려 놨지만 나이가 너무 많아서 그런지 지도 마이 힘든 모양이네요IMF때 만나서 지금껏 같이 살고 있는데 한번씩  장거리 800키로씩 다녀오면 집에서 궁시렁 그려사요  아이구 피곤허다 좀 쉬자  근디 다음날 또 쌔리  밟아요요즘은 폐가 마이 힘든지 호흡하기가 힘들다고 허네요워낭소리마냥 틱순이 엔진소리가  오래 가야 하는디~~~유튜브 잘보고 있습니다번창하시길 기원 해 봅니다눈탱이 옆에서 계속 쭈욱,1
1751,4:00 2010년식이라고해서 뭔가했네요,1
1752,감동입니다~댓글 잘안다는데 너무 므찝니다~응원합니다,1
1753,편집자 누구인지...브금과 사연이 적절하게심금을 울리는 영상이네요,1
1754,자식은 없지만 아버지 생각에 눈물이 나네요..아침에 아버지께 전화드려야겠네요~차로 사람을 울리는 영상은 처음인듯..,1
1755,좋은 기운 얻어갑니다,1
1756,돈천만원 정도 들었을거 같은데 ;;;,1
1757,너무 좋은 일 하셨네요 긴 영상이었지만 그래서 끝까지 볼 수 밖에 없었습니다. 좋은 일 하신 만큼 항상 좋은 일만 있으셨으면 좋겠습니다!,1
1758,아~ 아버지 생각에 저절로 눈물이 또 흐르네요!!! 이번에도 정말 감동적인 일을 하셨네요~눈물 흘리며 댓글 작성합니다. 카맨님의 진심 영상 잘 봤습니다~~,1
1759,나의 구독을 받으세요!,1
1760,카맨 패밀리 그리고 많은분들의 도움 멋지십니다!쉽지 않은 선택이었을텐데... 아름다운 선행에 다시 한번 감동받습니다늘 응원합니다 !,2
1761,무조건 올려!!!,1
1762,영상 보면서 울컥 하기는 처음 이네요. 카맨 식구들에 그 마음 있는 그대로 잘 전달 되었으면 합니다.,1
1763,대박이네요.. 저도 아버지가 물려주신 99년식 ef소나타 1년전까지 몰고다니다가 각종 부식 및 수리불가 판정으로 폐차했는데 그동안 그 차를타고 다니던 가족과의 추억들이 생각나서 떠나보낼때 눈물이 나더라구요...,1
1764,가슴이 먹먹하네요.,1
1765,감동적인 영상입니다. 아버지가 타시던 차를 리스토어 해서 많은 분들이 감사하게도 도와주셨네요. 제가 다 감사하네요. 영상 잘 보고 갑니다.,1
1766,옵티마가 k5가되었다,1
1767,카맨 가족분들 모두 고생하셨습니다 진한 감동 선한 행동에 다시한번 머리숙여 봅니다 항상 응원합니다 카맨 가족분들 모두 그리고 거래처 사장님 모두 최고입니다 사업 번창 하실 겁니다 서울에서 항상 응원합니다 카맨 가족분들 화이팅,2
1768,큰이벤트 꾸준히 이어갔으면 좋겠네요^^기아 휠캡이 아직도 새제품이 나오는게 신기하네요.,1
1769,부강모터스 혹시 천안 신계리가기전에  잇는거아닌가요?,1
1770,역시 차에 대해 진심인 분들정비에 대한 사명감을 느낍니다다들 성공한 인생을 사시는 것 같아 한없이 부럽습니다다음 번에 꼭 찾아뵐게요 감사합니다!,1
1771,솔직히 돈만 있으면 멤버항 올도색돼죠 너무 오바하는거 같심더,1
1772,가슴이 뭉쿨해지는 영상입니다 협조해주신 모든대표님들과 카맨샾 대표님 직원분들 복받으실 겁니다.,1
1773,작업 영상 잘 보았습니다 고객님을 위해서 이렇게 까지 꼼꼼하게 작업 해주시고사업 번창 하세요.,1
1774,이걸 예토전생이라 하나요?,2
1775,너무나 훌륭한 드라마의 한장면을 보는듯 가슴뭉클했습니다.엔지니어 분들의 노고에 깊은 찬사와 박수를 보냅니다. 수고많이하셨습니다.,1
1776,천만원은 오버 ...,3
1777,존경스럽습니다! 좋아요 10개 드리고 싶습니다!저는 벤츠타는데 아버지는 아직도 제작화면 동일 차량인 옵티마 LS 입니다작년 작은 뇌경색으로 입원하셔서 이제 차량을 많이 타시지는 않지만~ 꼭 저도 카맨님의 가게에서 리스토어 하러 가는 일이 있을 것 같습니다감사합니다.^^,1
1778,진심 대단하세요 쉽지않은결정이겠지만 정말 보는 저도 같이 기분이 좋아지네요^^ 카맨패밀리 화이팅!!,1
1779,이런곳은 돈쭐나야되,1
1780,마음씨도 멋지시고 기술자로서도 정말 멋지신거 같습니다!! 기계과라 이런 영상보면 열정이 샘솟.. ㅋㅋ,1
1781,아니 이런 영상에 광고좀 팍팍 넣으시지.... 이런 영상에 있는 광고는 얼마든지 봐드릴 용의가 있는데 말이죠 ㅠㅠ 꼴랑 4개 넣으셨네 .....,1
1782,수리비 1000만원 보다 더 나오겠는데요... 공임만 1000만일듯..카맨사장님 정말 대단하십니다. 존경을 표합니다..,1
1783,이런 결정을 하시는것부터가 힘든건데 너무 멋있고 존경스럽습니다.제가 도와드릴수있는건 좋아요와 시청시간뿐이지만 꾸준히 영상시청하겠습니다.,1
1784,전기차 타자..,2
1785,새차를 만드셨네요.. 참으로 대단하고 존경스럽습니다~~,1
1786,그돈으로 아들딸 맛있는거 사주세요무슨 의미가 있는지 다시한번 생각하고마스터베이션 하지말고 ㅋ,1
1787,아흑 마음이 찡하면서도 슬프면서도 뿌듯하네요 언제고 고객들을 위한 카맨 패밀리 들은 복 받으실거에요~그리고 도움주신 모든분들 또한 멋지고 장하십니당차가 빛깔을 내는게 처음 출시된 차처럼 반짝거리네요그차주에게도 인생에 잊지못할 차로돌아와 눈물을 흘리실거같네요ㅜ,1
1788,아 정말 대단하십니다감동깊은영상이었습니다. 존경합니다제차도 리스토어 하고싶네요ㅠㅎㅎ,1
1789,Scv go sir !,1
1790,ㄹㅇ 재능기부 멋있습니다 형님들,1
1791,#아버지를 위한 마지막선물이 맞는거죠??,1
1792,정말 대단한 일을 하셨습니다 항상 응원합니다  대박나시고  건강하세요  감사합니다,1
1793,수리비가 1000만원 이상 들어갔지만.....도움을 주신 분들은 1000억원이상의 복을 받기를 기원합니다....,1
1794,와 차가 번쩍거리네,1
1795,정말 카맨패밀리 및 지원해주신 대표 임직원분들께 정말 감사하며. 너무 고생하셨습니다 쵝오입니다,1
1796,수제자동차..,2
1797,대박나셔서 더 많은 좋은일 하셨으면 좋겠네요응원합니다같은충청도라서 몇번 시청했었는데재미있기도하고이렇게좋은일도하시는줄 몰랏네요,1
1798,지금까지 본 영상 중에 최고입니다!제가  여러분께 감사 드립니다파이팅!,2
1799,6분 1초 부분에 하시는 작업은 뭐라고 하는거죠? 그리고 어떠한 작업이죠?? 궁금해서요 ^^,1
1800,아직 세상은 따듯하고 선한 영향력을 주는 사람들이 많기에 우리가 살아가야 할 이유 입니다.  다들 자기 일에서  최선의 도움을 주시는 모습이 너무 감동입니다.,1
1801,서론이 넘 길다… 그냥 오래된 차를 탈바꿈하면 될것을 ㅎㅎ 거기 무슨 의미를 두나.. 차는 그냥 차인걸. 소설 쓰시오?,2
1802,대박 새차를 만들어 놓으셨네요..ㅋㅋ 차주분 엄청 감동이시겠네요,3
1803,세상에.아직두 이런 멎지신 분들이 많이 계셔서 세상이.아직은 아름답다는 생각을 하게 되네요 큰 선물을 주신.분들이나 받으시는 분들 모두들 행복하시고 홧팅 하셨으면 합니다,1
1804,촤곱,1
1805,감동 그자체 입니다^^.  카맨 가족 여러분 응원합니다!,1
1806,What car is this,1
1807,가슴이 울컥할 정도로 감동이었습니다 수고 많으셨네요맘이 참 따스해 지네요저도사실 21년동안 타던 EF소나타 차량을 올1월에 폐차하면서 울었습니다카맨패밀리 분들 늘 응원합니다~!!,1
1808,30분이 진짜 흑 지나가네요. 한편의 스토리 잘 봤습니다.,1
1809,머라고 댓글 달아야 하나  진실이 거짓을 가리네  좋은일은  모르게 너무  거시기합니다,1
1810,차뿐만 아니라 차주까지 어루만지는 정비사님의 손길이 느껴집니다.,1
1811,돈쭐나세요 정말,1
1812,세차할때 봤는데  그 옵티마가 그런 의미가 담겨져 있었군요... 카맨패밀리 항상 응원합니다!,1
1813,"카맨님 너무 영상 잘 봤습니다.감사합니다.멋진 영상, 잼있는 영상 부탁 드립니다^^",1
1814,2010년식?2006년 초가 마지막연식 아닌가?,1
1815,"카맨 패밀리 여러분들, 그리고 그 동료분들의 마음을 볼수 있어, 너무 좋았습니다. 다른 카센터 하시는분들도 다들 이런마음 가지고 계시겠죠?힘드신데도 불구하고 고생하셨습니다.모두 대박나세요",1
1816,기름쟁이가 아닙니다 기름장인 입니다,1
1817,한편의 영화같은 영상 보고 감동과 슬픔 등의 감정을 느꼈씁니다.카맨 항상 응원합니다~ 영상 올려주셔서 감사합니다~,1
1818,이야~옵티마...사회초년생때 뚜벅이 생활하면서 친구넘 리갈탈때부러워서 꼭 면허따고 저걸사야지...했었던 기억이나네요그런놈이 아버지유품... ㅠㅠ정말 고생하셨고 좋은일들 하셨습니다항상 마음으로나마 응원합니다^^,1
1819,완보링,1
1820,와 진정한 사장니이시다 분명 복 받으실꺼에요,1
1821,천만원으로 저게 돼요??????????,1
1822,영상 너무 가슴깊게 잘 봤습니다!!,2
1823,항상 넉넉지않음에도 주위분들에게 따뜻함을 주시는 카맨 패밀리와 여러 도움을 주신 업체분들께 감사하다고 말씀드리고 싶습니다. 이런 영상을 볼때마다 저 자신을 돌아보는 계기가 됩니다. 그리고 수고하셨습니다.,1
1824,6:02 이건 뭐하는 거에요? 신기하당,1
1825,역시나카맨분들도 한 가정에 가장이신 분들입니다많은 감동과 아버지란 세 글자 을다시한번더 마음속에 세겨 갑니다화이팅 하십시요수고하셨습니다,1
1826,고르고고르고 몇개를 사신거죠    ㅋㅋ,1
1827,너무좋은일들하시네요 복받으실거에요 항상 화이팅하세요,1
1828,자돔차 동영상 보다 눈물을 다 흘리고! 진심으로 차를 고쳐주신 카맨께 감사드립니다,1
1829,이런 말하긴 좀 그런데 나대는 박병일이보다 훨씬더 멋지네요..,1
1830,"인트로 부분의 솔직한 내용이 너무 공감되네요. 좋은 방송 감사합니다. 저도 2002년식 싼타페 SM을 지금까지 35만 타고 있는데 40살 차이나는 중학생 아들은 아빠의 첫새차를 운전면허 따면 자기가 물려받아서 타고 싶데요. 현재는 작년에 구입한 K5하이브리드가 패밀리카로 역할을 하고, 싼타페는 제가 관리 차원으로 운행합니다. 디젤차라 DPF장착은 했지만 서울시내 운행등 제한적 요소가 많아 안타깝네요. 저도 리스토어 해서 새롭게 생명을 연장해주고 싶어 오늘 영상 관심있게 잘봤습니다. 감사합니다.",1
1831,썸넬 왼쪽만 보면 아이오닉5 ㅋㅋㅌ,1
1832,눈물이 날 정도로 격하게 멋지셨습니다..,1
1833,와~ 감동 감동~ 그저 다른말이 필요치 않네요 최고입니다^^,2
1834,"거의 리빌딩인데,,",1
1835,옵티마 너무 멋지네요~,1
1836,와,1
1837,"우리가 아버지인 것이 자랑스러워지는 가슴 따뜻한 영상이었습니다. 앞으로도 더 선한 영향력이 넘치고, 끼치는 사업장이 되시길 소망합니다! ^^*",1
1838,저도 첫차가 옵티마 였는데요. 너무 고생 많이 하셧습니다~,2
1839,이건 말이 필요 없구만,2
1840,영상 보다가 감동받고 차주분이 주신돈으로 기부하신거보고 2차감동.. 따봉에 구독박고 저도 한번 기회되면 꼭 방문할께요! 돈 많이 버셔요~,1
1841,와우~~대단합니다..새생명탄생했네요..보는것만으로도 뿌듯해지네요 ☆☆☆☆☆,2
1842,그동안 카맨 영상 많이 봐왔지만 너무 드라마틱한 감동적인 프로젝트 영상 이였습니다.,2
1843,아..제 첫차네요..나오자 마자 구매했는데..벌써 20년 전이네요..옵티마..좋은 차죠,1
1844,자동차 고치시는분들 정말 대단해! 나는 라디오 하나 분해 했다가 조립해도 나사가 남는데...... ㅎㅎㅎ,1
1845,저시절 현기차는 부식되서 요새 보기 힘들던데 상태가 좋네요.,1
1846,존경스럽습니다.정말 개인의 희생이 없이는 할수 없는 일이라고 생각됩니다.요즘 같은 시대에 말하기 좋아 하는 사람은 이때다 하고 덤벼들수도 있을듯 하지만 개의치 마시고 항상 카맨 패밀리의 유쾌한 모습을 볼수있으면 좋겠습니다.감사합니다.응원하겠습니다.,1
1847,와~!!! 멋지다~!!!! 진심으로 멋지십니다~!,1
1848,참여하셧던 모든분들 복받으실 겁니다,1
1849,정말 자동차에 이런감동을 받을수있다는것이 정말 신비롭고 마음이 정말  따뜻해지네요카맨 홧팅!!!!!!!,1
1850,제차는 프레임 삭아서 사고나면 부러질것 같고 차체 구멍 숭숭인데 20년 된 차가 프레임과 바디에 큰 부식이 없는게 대단하네요. 그당시 기아가 아연도금 강판을 쓰지 않았을 거라 생각되는데요.,1
1851,정부의 지침으로 인한 노후차 압박 ㅜㅜ 여유 된다면 저도 02년식 쏘랭이 진짜 복원해서 타고 싶어요  부럽다요 사장님 엄지척!,1
1852,보고만 있는데 왜 눈물이 날까?  작업에 참여하신 모든 분들 복받으실겁니다.,1
1853,"이 세상에 이런 분들이 있다니,,,,,,,,,,,",1
1854,저는 아르헨티나에서 30년정도 거주하고 있는 교포입니다. 이번 영상을 보며 저도 아버지가 돌아가시고 저에게 남기신 차를 몰고 있습니다. 비록 연도수는 오래됫지만 바꾸지 못하고 타고 잇습니다. 이번 카맨 페밀리분들 및 여러 공업사 분들 너무 좋은일 하시네요...영상 보면서 저도 아버지 생각이 나서 몇자 적어 봅니다. 마지막 멘트가 제 가슴을 뭉클하게 하네요....감사합니다.,1
1855,응원합니다~~~,1
1856,카맨 패밀리와 지원해주신분들 모두 따듯한 마음을 가지신분들입니다.항상 응원하겠습니다.,1
1857,"우리가 아버지인 것이 자랑스러워지는 가슴 따뜻한 영상이었습니다. 앞으로도 더 선한 영향력이 넘치고, 끼치는 사업장이 되시길 소망합니다! ^^*",1
1858,영상 시작하자 마자 눈물이 왈칵 쏟아지고 있습니다. 아버지가 너무 보고 싶어서 가슴이 아픕니다. 누군가를 도울수 있는 당신을 존경합니다. 신의 축복이 당신과 함께 하기를 기원합니다.,1
1859,현기차는 정말 예전 차들이 훨씬 내구성도좋고 품질이우수함.. 정말이지 잔고장 거의 없을정도임..  아부지 마르샤 40만 키로 넘게탔는데 오일만 갈아주면서 그냥 키로수마다 교체해야되는 것들만 교체해줬는데 아직도 짱짱합니다.  미션 엔진 한번도 교체한적없고 거기다  ecs 쇼바까지  잘되고요..  그차는 현재 제 친구가 자알 타주고 있고..  정말이지  요즘 현기차들  예전차 품질 반만 따라가도..,1
1860,대박~~역대급이네요. 카맨 패밀리 정말 존경합니다. 이런곳이 많아야할텐데,1
1861,크....2001년식.....저 태어날때 같이 태어난 차네요,1
