,comments,likes
1219,"고등학교 자동차과 엔진 전공생 대학교 자동차과로 진학하여 기능생 활동하고 그후 취업하여 정비사로 근무하다 현재는 천안에서 중장비 조종사로 임대업 하고있습니다.선배님같은분은 저와같은 정비사 후배들에게 존경받아 마땅하십니다제가 정비사의 길을 못간것도 현실적으로선배님같지 않은분들이 많아 그것에 실망을 많이느끼고 다른길로 가게되었습니다자동차의 애착과 공구를 다루며 그시절의생각이 이영상을보며 저의 옛열정이 다시생각나게되어 댓글을 남겨봅니다아직도 중장비와 승용차 자가 정비를하며, 이루지못한 정비사의길을 이렇게나마 만족을 느끼고있습니다.한번 꼭 가보고싶습니다.지금처럼 후배들이 보고 배울수있는 컨텐츠와앞으로도 정직하고 투명한 정비문화로 이끌어갈수있게 좋은 영상 부탁드립니다.",2
1220,감동입니다. 하시는 일에 장인정신이 느껴지네요.,1
1221,시동거는거 한번 보여 주셨으면...,1
1222,와. 이게 쉽지않는데 말이죠.  대단하십니다.,1
1223,와~!!짠하네요~정말 대단하십니다. 항상 응원하겠습니다.,1
1224,킹왕짱입니다~!! 뭔가 찡하네요...,2
1225,많은분들 고생하셨고 감사합니다.보는내내 감동이네요,1
1226, 대박 ,1
1227,진짜 멋있다!!!!!최고입니다~~,1
1228,정말 카맨수고하셨습니다옵티마환골탈태하는모습 감동적이네요앞으로도 리스토어많이올라오길기대합니다 처음부터하나도안놓치고다봤네요~,1
1229,각박한 세상의 빛이 된 카맨패밀리의 아빠란 영화 잘 보고 갑니다 감동 입니다,1
1230,복 받으실 거예요 대표님~  멋지십니다.,1
1231,김동현 선수와 닮으셔서 더 친근감이 느끼네요,1
1232,우와..카맨 구독 한지가 오래 되었지만 댓글을 처음 달아 봅니다..어찌 이런 생각과 행동과 감동을 주시는지..카맨 식구들 정말 복 받으셔야 하고 건강하시고 대박 나실거에욧!! 아자!!^^,1
1233,멋있습니다   유튜브 댓글 처음 다는데 이런 멋진영상에서 댓글은 달아야쥬~~존경합니다!!항상 사업 번창하십시요~~,1
1234,감동 입니다,2
1235,우와!!!!!!!!!!! 감동적입니다.작업하시느라 고생 많으셨습니다!!^^,1
1236,그랜져XG차량같은거 진짜 시간이지나두멋진데 저런작업잘해주면 괜찬을꺼같습니다 ㅎㅎㅎㅎㅎ무쏘라던지 ㅎㅎㅎ코란도라던지과거 ㅎㅎㅎ,1
1237,자동차 제작 과정을 보는 것 같네요. 대단한 영상입니다. 굿굿~,1
1238,와.. 새차를 만들어버렸네요 대단하십니다.,2
1239,"자동차 정비를 아트의 경지로 끌어 올리고 패밀리화 시킨 당신들이 영웅입니다. 올 한해도 수고하고 애쓰셨습니다. 언제 천안쪽 내려가면 한버 꼭 들릴께요. 아메리카노 사서요 , ㅎㅎ",1
1240,아 이런분들 돈줄내드려야되는데 ㅠㅠ 해외라 할수 있는게 맴버쉽 가입밖엔 없네요.. 매번 좋은 영상 감사합니다!,1
1241,인트로에 말씀이 맘에 너무 와닿네요... 오늘은 아버님께 전화드려봐야겠습니다,1
1242,훌륭하신 분들이시네요. 이런분들이 우리 사회에 함게 계시다는데 참 감사하고 고맙습니다. 감사합니다. ~,1
1243,와~~ 감동~~  자동차 정말 좋아하는 1인으로써 너무 뜻깊은 영상이라서 잘 보았습니다 멋쪄요~~^^,1
1244,가슴이  먹먹 합니다   대표님~~,1
1245,진짜 멋있네요... 최고 인듯,1
1246,혹시 크레도스도 리스토어 안되나요? 크레도스 동글동글하니 디자인이 이뻤는데...,1
1247,이렇게 좋은 영상을 올려주셔서 정말 감사합니다.좋아요 버튼과 구독버튼으로 마음을 전합니다. ,2
1248,그시간을 함께한거 같아서 마음이 울컥하네요 고생하셨고 좋은일 해주셔서 감사합니다,1
1249,이영상보고 구독 좋아요 눌렀습니다...,1
1250,차 이야기 하는 채널이 아니라 감동을 마구마구 퍼 주시는 채널이네요. 카맨 패밀리 분들 정말 복 받으실 겁니다. 아니...꼭 복 받으셔야 합니다. 도움 주신 모든 분들도 꼭 복 받으실겁니다. 잔잔한 감동 주셔서 정말 감사합니다.,1
1251,진짜신기해.. 차 엔진이 저렇게생겼구나,1
1252,너무 멋집니다! 추억이 담긴 자동차,1
1253,우리나라에 이런곳이 있었네요 해외차량복원영상 보는것 같았어요 멋있어요 !,1
1254,와 능력자들이시다.굿입니다.,1
1255,옵티마너무멋있다~  구형지역남바까지 있다면진짜 이렇게 후원받아서 부활하는게정말신기하네요~  부모님차가 96년식 크레도스 를 15년을타고 24만키로를타니  오토밋션이 갔다고폐차하라고했는데  그것보다도 키박스와 배터리부분문제도많아서 폐차가 불가피했는데 저차를보니  정말 저렇게 다시살릴수있구나  자동차처럼 인생도 늙고 망가진 몸을 다시 복원할수있었으면좋겠어요!,1
1256,감동입니다.,1
1257,응원합니다 ~~멋지십니다~~,1
1258,와 정말 대단하고... 멋지십니다..,1
1259,바로 구독 박았습니다~^^,1
1260,와 진짜 왠만해서는 댓글 안다는데 대단하십니다!!!!! 화이팅입니다!!!,1
1261,가...가슴이 웅장해진다,1
1262,정말 큰선물 하셨네요~감동,1
1263,차 잘 만들었네요. 20년된차가 컨디션이 이정도라니,1
1264,멋집니다,1
1265,아... 너무 멋진 이야기였습니다... ㅠ,1
1266,제 차도...복원한번해보고싶어용...두아이 아빠 i3008년식 입니당,1
1267,자동차계의 이국종교수님이십니다.정말 사람처럼큰 자산은 없는거 같습니다.사장님및 팀원분들에게 존경을 표합니다.정말 존경합니다. 구독좋아요 박고 갑니다.,1
1268,인트로 너무 감동.엔진 내부 열었을때 무쟈게 깨끗한거에 놀람.오일관리 많이 중요하구나 느낌,1
1269,밸브키 빼는 망치도구 쓰시는게 빠를듯한데 하부에 두꺼운 고무쓰시고 ...밸브스프링키 넣을땐 무거운무게의 철제옆에 고정형으로 만드는게 엄청빨라집니다.DO형태는 이게 빠르죠.SO는 밸브쟈키가 빠르지만 DO는 그게 효율이 좋음.프린스헤드 키는 미쳐버리실텐데...그걸로 하면...헤드재생만 전문으로 하는애들이 보통 고정형으로 하더군요.,1
1270,너무 감동적이에요 자동차 영상보고 눈물흘린적은 첨이라 ㅠㅠ 멋지시네요,1
1271,기아차에서 상줘야 할거 같네요.,1
1272,좋은일 하시고 항상 응원하겠습니다 제차량도 정비를 맞기고 싶은 곳이네요,1
1273,아...같은 차를 10년넘게 탔었기에보다가 울뻔했네요.......감성 막 터지고 있는중입니다...,1
1274,근데 안타까운게 만약 사고나면 보험사는 현 중고차 시세로만 차값 줌... 100-150정도.... 그래서 우리나라에선 올드카를 유지하기 힘듬..,1
1275,가슴 깊이 따뜻해지는 훌륭한 영상을 볼 수 있어서 감사드립니다^^,1
1276,올해본 유튜브 최고의 컨텐츠,1
1277,저도 어릴적 장난감을 주시던 아버지 나이가 다 되어서 이런영상을 보니 저도 모르게 눈물나네요. 할수있는건 별로 없고 구독과 좋아요 누르고 갑니다 좋은 일해주셔서 감사합니다.,1
1278,정말 멋지십니다. 영상 잘 시청했습니다.,1
1279,저도 아빠 생각이 나서... 이번주에 뵙고 올게요.,1
1280,정말 멋진!!!정말 최고!!!모든 찬사를 보냅니다.,1
1281,이거 다못보고  침울하지 않으면 비정상 ㅇㅈ 아닌가?? 형 나무 고생 많았어,1
1282,와 옵티마 전 이번에 폐차할려고 하거든요.. 크로스멤버가 썩는 고질병이 있어서 2년전에 폐차장부품으로 고쳐서 2년 잘 버티고 이번에 다른문제가 생겨서 폐차합니다 ㅠ 1~2년 더 타고 싶었는데....... 차주분 부럽습니다!!,1
1283,옵티마 진짜 차좋은데  2001년식 옵티마 회사 과장님이   32만7천 넘게 타신거 19살에 넘겨받아서  내가 군대가기전까지 타고 아버지가 1년더 타시다가  37만5천에 페차..잔고장 뭣도 없었고 딱한번 마후라 뻥난거랑 연료펌프 한번 끊긴게 다였던..,1
1284,대단 대단,1
1285,평소에는 예능카센타인데이거는 다큐네 .. 멋집니다도움주신분들 복받을겁니다  ~~,1
1286,나도 아버지 쏘2 복원할수 있음 하고 싶었는데..,1
1287,예전에 K5 도 이렇게 해주신 적이 있는 분들이죠.멋집니다 번창하세요.,1
1288,정말 놀랍습니다. 훌륭하십니다. 짝짝짝~~,1
1289,멋집니다,1
1290,고생 하셨습니다~~복 받을겁니다~~가슴 찡 허네^^,1
1291,이거 볼때마다 생각나는게 아버님 생각이나네요 저 고딩때 돌아가셧는데.... 초딩때 아빠가 오토바이 뒤에태워서 치킨집가고 드라이빙 해주고 좋앗는데 아버님이 너무 나 그립네여 이거 볼때마다 눈물이 앞을가리네요,1
1292,스피스헤커 수용성작업까지 완벽하네요,1
1293,아 감동적이야 ㅠ 10년후 내차를 처음 만났을 때 모습으로 다시 돌아가면 먼가 뭉클할것 같아요 ㅠ,1
1294,감사합니다,1
1295,감동적인 콘텐츠입니다. 마음이 따뜻해지네요.,1
1296,이건 구독 안누를수가 없네요,1
1297,진심으로 응원드립니다쉽지않은 결정 이셨을텐데 그 누구도 불평없이 밝은 모습으로 모든과정이 원활하게 진행되는 모습보면서 저또한 마음이 뭉클하게 만드네요대단들하십니다 극한 찬사 보내드리고 앞으로의 행로에 무궁한 발전 기원드립니다^^,1
1298,그냥 최고란 생각이 듭니다.죽은 자동차를 살리시는 차 명의.,1
1299,최고입니다.,1
1300,뭉클하네요.저의 첫차도 옵티마 인대 아버지의 선물,1
1301,자동차 유튜브 3개 구독했는데 그중에 하나다.여기 찐이다.나도 돌아가신 아버지차 동생이 타고 있는데 공감.,1
1302,자동차는 진짜 현대공학의 꽃이다.,1
1303,역시 전문가분들이다...,1
1304,그냥 구독..이시국에 정말 찐이네요..,1
1305,바로 구독 누르고 갑니다.... 엄청 멋있는 채널...,1
1306,이게 유튜브지 최고입니다,2
1307,감동입니다 항상 건강하시고 복많이받으세요,1
1308,진심 멋집니다,1
1309,대신해서 감사합니다.,1
1310,와~첫 스타트부터 너무 감성적입니다.구독하길 잘한,3
1311,22:27 크로스맴버 보니 예전차 구ef가 생각나네요 개,2
1312,피스톤링 맨손으로 끼우기 장인이다!!!!대박,1
1313,멋있다! 경의를 표합니다!!,1
1314,감동적입니다,1
1315,좋은 영상 잘 봤습니다. 작업중간중간 간단한 자막을 달아주시면 보기에 더 좋을 듯 합니다. 건승하세요 ^^,1
1316,걍쌔차 ㄷㄷㄷㄷㄷㄷㄷㄷ,1
1317,옵티마 너무 이쁘네요 꿈의  차입니다,1
1318,이런 사연들을 모으고 모아서 기아차 홍보 영상을 만들면 참 좋을거 같네요 그러면 제작지원도 받아서 좋고 기아는 이미지 얻어서 좋고 차주는 무상 이라 좋고 모두 좋은 방향 일거 같네요,1
1319,전체 재도색의 경우 도장면이 까끌까글한 느낌이군요,1
1320,훌륭한 일을 하시는 이 분이 명장입니다...,1
1321,,1
1322,이런 좋은 영상은 조회수가 믾이 나와야 하는데...,1
1323,와.. 이게 뭐라고 눈물이 아냐.. 흥하십쇼!!,1
1324,카맨패밀리 흥해라~,2
1325,"리스토어를 일찍 알았으면 저희 옵티마도 폐차 안했었을건데용ㅠ.ㅠ 대리만족하고 갑니다. 옵티마가 명차긴 하죵ㅎㅎ 스틱이고 가스차 였는데 특유의 떨림, 특유의 소리가 좋았어요ㅎㅎ 삼촌한테 18년, 저한테 6개월정도 발이 되어주고 갔네요..ㅠ.ㅠ 옵티마로 쎄멘으로 포장됐지만 경사도가 심해서 스베루 치면서 겨우 올라가고, 뱀 들어올뻔하고, 잘가다가 길에서 퍼지고 참 많은 일들이 있었는데 19년도에 폐차결정 했어요ㅠ.ㅠ그때는 오르막에서 갑자기 올라가지도 못 하고 뒤로 내려가고, 가면 갈수록 힘도 딸려서요ㅠ",1
1326,고맙습니다,1
1327,멋지십니다!!!,1
1328,넷플릭스에 미국에 이런 프로글램이 많길레 다봣는데  한국에도 이런분들이 계셧네요^^ 응원합니다^^,1
1329,저도 2001년식 옵티마를 14년타고 지금은 다른차를 타고있는데 지금 어디서 달리고있을지....,1
1330,저희는 지금도 옵티마를 타고 다녀서 단어에 꽂혀 댓글을 올리네요.^^마음 한켠이 따뜻해지는 고마운 영상 고맙습니다.^^,1
1331,우리나라에도 저런사람이 있다니,1
1332,와.. 진짜 구독을 안누를수가 없네요...,1
1333,영상 그 자체가 감동이네요,1
1334,왜 제가 울컥하죠 제가 다고맙습니다,1
1335,감동입니다  따뜻한  마음이  느껴집니다 감사합니다,1
1336,나중에는 수제 자동차도 나오겠네..,1
1337,사장님의 뜨거운 심장을 닮고 싶습니다번창하시길 기원하겠습니다,1
1338,주행 장면이 포함되었으면 진짜 완벽했을텐데 살짝 아쉽습니다.,1
1339,"그냥 아버지란 말만 들어도 왜 눈물이 나노 ..나이 30중반 넘어가고 애가 생기고 가정이 생기니 이제야 아버지,어머니 마음이 너무 이해가 갑니다..아직 건강히 두분다 계시지만 언젠가는 저도 이렇게 그리워할날이 올걸 생각하니 마음이 짠하네요~~구독 하고 갑니다",1
1340,차주님 만나 차를 보여드리는 장면도 있음 감동 백배 일듯해요 얼굴을 모자이크 하더라도 그게 생생한 감동,1
1341,이사람 찐이네  누군가에게 감동을준다는게 나 감동받았다ㅜㅜ,1
1342,이  정도면  차 맡길만한 신뢰 영상이네요,1
1343,추천드립니다 정말 가슴 따뜻한 영상 잘 보구갑니다 번창하세요...,1
1344,다시보는거지만 정말 그냥 광고스킵하기가 힘드네요 ㅎ 광고라도 끝까지 보고 본영상봅니다,1
1345,정말 멋진 영상이네요,1
1346,괜스레 돌아가신 아버지가 생각나 눈물이 납니다,1
1347,많은 사람들이 신형이든 구형이든 보여지는게 아니라 진짜 차의 의미와 추억을 탔으면 좋겠습니다진짜 좋은 차는 최신형에 비싸고 고성능인 차가 아니라 내가 좋아하는차 입니다.,1
1348,왜이렇게 울컥하는걸까요 ..감동입니다 고생하셨어요,1
1349,이 영상을 보고 자동차가 왜 비싼지 알겠다 ...,1
1350,멋집니다~!,1
1351,약간 미국감성이네요 ㅎㅎ 좋네요 좋아~,2
1352,이건 그냥 새차임..와우!,1
1353,"멋진 카맨 식구들. 멋진 마음만큼 멋진 차로 다시 태어났네요. 아빠 마음이 전해진 것 같아 마음이 먹먹합니다. 차주분은 아버지의 좋은 기억, 카맨 식구들은 좋은 추억을 간직할 수 있었네요.",1
1354,눈물나네요...ㅜㅜ,1
1355,정말 카맨분들 보면 제 자동차 하체 교환 맡기고 싶네여...,1
1356,이게 뭐라고 사람을 감동을 시키나..,1
1357,감동입니다....구독하고갑니다,1
1358,세상 아직 따뜻하네요 구독하고갑니다,1
1359,우리 동네에 흰색 세단이 있는데...각져있는 겁나 옛날 차입니다.저게  굴러가네 싶을정도로 옛날차던데.,1
1360,감동... 그 이상입니다. 대단합니다.,1
1361,아 이건 구독해야지...,2
1362,96년식 무쏘 320 이런식으로 작업 하면 비용이 얼마나 나올까요? 열정 대단하십니다,1
1363,역시~카맨페밀리 굿~~^^화이팅입니다!,2
1364,Good!!!,2
1365,카맨방송4만때본것같은데..25만축하드립니다선플이라..감동적이네요,1
1366,여기 정비소 가보고싶습니다 위치가어디죠,1
1367,멋지십니다 ~~!!!!,1
1368,와 이건 수리가 아니라 재조립 수준이네요;; 공임비랑 다 하면 차값만큼 나왔을꺼 같은데 좋은일 하셨네요,1
1369,8:17 끝에 가서 후끼 꺽어불면 도막 두께 차이 난다 한혀요!!!!,1
1370,아..버..지.. 진한..감동..입니다^^,1
1371,,1
1372,차를 한대 만들었네요 대단합니다,1
1373,감동입니다,1
1374,,1
1375,감동입니다ㅠㅠ,1
1376,마지막에 시운전이 없어서 아쉽네요,1
1377,"""아버지의 마지막 선물""  감동 많이 받았습니다.  감사합니다.",1
1378,"좋은일 많이 하시네요   저도 아빠에 대한 추억이 자동차에 많이 묻어 있습니다,  찡하네요  아빠 라는 단어가",1
1379,아름 답네요,1
1380,베타엔진과 하이벡4단 미션조합은 정말 내구성 좋았습니다. 백만부터 시작.,1
1381,차에대한 애정이 얼마나크면 큰돈들여서 리스토어 하셧을꼬..,1
1382,감동입니다!,1
1383,리갈 부품구하는거 겁나힘든데 대단,1
1384,우와. 아버지가  월급날에 가져온  종이봉투 안에 통닭이 생각납니다..좋은일 해주시네요 ㅠㅠ 추천요..지금 아버지는 작년 정년퇴직하실때 울었어요... 나중에 제가 그 의미를 알겠죠..,1
1385,산타할아버지가 선물해준 선물보다 더 부럽네요차는 올드할수록 더 예쁜거 같아요,1
1386,늘 다른 정비업체도 좋은분들이라고 열심히 편들어주시지만...글쎄요......지난 타뱅사건과 며칠전 르노 서비스센터 사건을 보니 왠지 카맨님의 공허한 외침이 아닐까 하는 생각이 드네요...,1
1387,다들 복 받으십쇼,1
1388,지나가면서 많이봤습니다! 항상 모범을 보여주셔서 감사합니다 저도 의뢰하나해도될까요?,1
1389,보링샵 어딘지 알겠네요 ㅎㅎ 반가워서 댓글남깁니다.,2
1390,최고의 영상이었습니다,1
1391,아 3분까지 봤는데도 가슴이 뜨거워지네요.,1
1392,진정한 메카닉 카맨페밀리 항상 응원합니다.,1
1393,차는 단순히 탈것의 도구가 아닌데 우리나라는 너무 차주 자주 바꾸니 안타깝네요. 저도 인생에 첫차가 레간자로 폐차시킬때 눈물 났구 지금은 스포티지R 10년째 타고 있는데 너무 쌩쌩합니다. 추억도 많구요. 다른 물건처럼 버리지 못하갰더라구요.,1
1394,멋지네.,2
1395,대한민국 축구 구가대표 월드컵 4강진출해서 경기전 애국가 듣는 느낌처럼 가슴이 벅차오르는 영상입니다.잘 봤습니다.,1
1396,대박,1
1397,너무 좋은 메세지를 담은영상 제작해주셔서 너무감사드리고 제작하는데 있어서 도움을 주신분들 또한 감사드리네요. 차주분은 아버지에 대한 생각을 하면 차를 더욱더 오래 간직하고 운행할수있는 모습을 생각하니 저 또한 가슴이 너무 벅차네요~ 앞으로도 카맨 응원하겟습니다.,1
1398,진심이 느껴지는 영상이었습니다. 감사합니다! 모두 고생하셨습니다,2
1399,나의 첫차 옵티마 MS ㅎㅎ,1
1400,2002년 군대갔을때 우리 행보관님이 타시던 옵티마 ㅜㅜ 배차 못 받았을 때마다 얻어 타고 다녔었죠.  맨날 군수과 가서 멘탈 개털리고 오면 아버지같이 위로해주시고 편들어주시던 분이라 기억에 남는 멋진 차에요!,1
1401,"감동적인 스토리는 맞는데, 좀 엉뚱한 소리를 하자면 2010년 차가 리스토어를 할 수준이라니 도대체 멀쩡한게 없네요. 현대기아차 내구성이......2005년 SM5 도 그럭저럭 타는데",1
1402,감동스럽게 잘 시청했습니다.올려주신 영상을 볼때마다 믿음이 가고 뭔가 다르다고 느껴왔지만  각박한 세상에서 훈훈하게 베푸시는 님들의 마음에 응원을 보냅니다.,1
1403,카맨 페밀리는 진짜 대단해요  쉽지않은 선택일텐데 응원하고 잘되길 바랍니다 ,1
1404,수리비 꽁짜 로 차주좋겠다 인심좋네,2
1405,코로나로 힘든시기에 이런 고마우신분들이 있다는게 정말 가슴 따뜻해집니다.감동깊게 잘 보고 갑니다. 항상 몸건강들 지내시고  파이팅입니다.,1
1406,왤케 형 답지 않게 웅장하나 했네.... 조금더 과해도 ㄱㅊ았어...,1
1407,정말 멋지십니다 감동 적입니다^^ 저도 정비기사로 7년을 근무 했었는데 영상을 보고 있으니 가슴 뭉클합니다 대표님^^,1
1408,차량의 히스토리가 그차량의 잔존가치를 뛰어넘을수 있죠...수고하셨습니다..엔진보링은 대형차량도 대부분 금액때문에 그정도까지는 못하는데 정말 시원하게 하셨네요.,1
1409,짠하네요.,1
1410,작업 진행 보니까 존경 스럽습니다~최고의 전문가들....,1
1411,,2
1412,진짜 멋있습니다. 그 어떤 말로도 표현할 수 없습니다. 어려운 결정이였을테지만 아버지 그 한마디에 마음이 움직이시고 또 그에 따른 결정을 하신것이 너무 멋있습니다. 영상을 처음부터 끝까지 보는내내 눈물이 왈칵 쏟아질 것만 같았습니다. 세상을 비관적으로 쳐다본 제가 너무 한심해지는 순간인거 같습니다. 정말로 존경합니다. 승승장구 하시길 바랍니다.,1
1413,정말 울뻔 했네요ㅜㅜ카맨패밀리 가족분들 그리고 도움에 참여한신 모든분들 복 많이 받으시고 번창하시길 기원합니다♡,1
1414,가족이 떠나면 한 2년 힘들지만  결국 나도 결국  따라 가기에 과거는 잊고 열심히 현재을 살아가야죠  과거에 연연하면 그것 만큼 불행한 나의 인생이 없습니다,1
1415,영상 보면서 가슴이 찡하네요 진짜 멋진분이네요 저도 두 아이의 아빠입니다 제  차도 오래 되긴 했지만 두아이 키우면서 그차와 정도 들고 놀러도 많이 다녔던 추억이 많은 차입니다 그래서  심하게   고장나도 수리해서 타고다닙니다,1
1416,️옵티마스 프라임️,1
1417,대단합니다,1
1418,정말  감동입니다 아버지를 좋아하진않지만 가슴에서 찡하다,1
1419,구독 박았어요!!!,1
1420,마음이.뭉클해지고.감동.그자체였음.좋은영상.감사.            ( The best of the best      ),1
1421,추천 드리고 갑니다.,1
1422,잘 봤습니다. 멋져요 1 보탭니다,1
1423,모든분들 멋지십니다. 카맨 패밀리 믿고 갑니다.,1
1424,저희집에는 저차가 한쪽후미등이깨진 장난감으로 있어요,1
1425,감동을 받았습니다,1
1426,구독을 안할수가 없네요 눈물이 차올라서 ㅜㅜ,1
1427,대한민국에 이런 컨텐츠가 있다는것에 놀랄뿐입니다...,1
1428,"한 10년 후, 올드카의 모든 것이라는 서브채널 나와도 괜찮을 듯.한 편 한 편이 전부 카맨과 인연 있는 분들이면 정말 뿌듯하실 듯 ^^추가로 추억 팔이 감성도 뽑고 ㅋㅋㅋ (영상편집이 어쩌고저쩌고 저기 삐대는 동생 어쩌고저쩌고하는 등ㅋ)  티키타카가 10년 후에도 쭉 이어지길 기원합니다. 정말 멋지십니다. ^^",1
1429,아버지........이하나에  많은  의미가 함축되었다  느껴지네요,1
1430,인정할건 인정하자.. 사장님 굿 입니다. 번창하세요.,1
1431,옵티마가 옵티머스 프라임수준으로 탈바꿈했네 ㄷㄷ,1
1432,그저 멋..! 멋쟁이들,1
1433,눈물이 나고 뜨거워  지고감니다  좋은영상보고 감니다 제가 감사하네요,1
1434,여기 리스토어 업체 이름 이 뭔가요 저도 한대 맡기고 싶은데요,1
1435,"아버지에 대한 그리움, 진정성이 느껴집니다예전에 했던 것처럼 마주앉자 바둑한판 두고싶네요..그때 하지 못했던 말도 하고 싶고요이제는 제가 아버지가 되어보니 알 것 같습니다오늘따라 아버지가 보고싶네요..",1
1436,ㅠㅠ 오늘 구독했습니다 ~,1
1437,"아 진짜 카엔맨 최고입니다. 감동이네요.지역이 너무 멀어 정비 받으러 가진 못하지만, 멀리서 영상보며 응원하겠습니다.화이팅하십시오!",1
1438,카맨관계자분들 그리고 협렵사분들어려운 시기인데도 좋은일하셧습니다!모두 힘내시고 발전하시길 바랍니다!!응원합니다!!,1
1439,오...? 수용성 도료? 굿굿,1
1440,너무 멋있네요. 제 첫차가 어머니께 물려받은 옵티마 였는데요.. 잠깐 탔지만 첫차의 추억들과 어머니의 추억과 함께 하다 폐차를 시킨 기억이 나네요. 아버지의 유산이라는 말에 정말 뭉클하네요. 저도 여유가 있었다면 수리해서 가지고 있고 싶었던 생각이 납니다. 이런 크나큰 선물을 하셨다는거에 정말 멋지십니다,1
1441,혀엉 엔진 소리 들려줘야지  ㅠㅠ 엔진소리들을라고 기다렸는데,1
1442,"너무나 대단하다는 말밖엔..,늘 건강하시기를 바랍니다.",1
1443,이런 정비마인드를 가지신분들이 옆에 계셔야 차도 더 오래 탈수있지 않을까요? 대단하십니다.,1
1444,시승장면이없어 아쉽..,1
1445,진짜 좋은 주인만나서자동차도 새 생명을  받고 다시 공도를 달리면서   보답하겠네요이런차는 진짜 대대로 물려주고 싶겠네요사장님 진짜  찐엔지니어  이십니다,1
1446,구형 sm7도 될까요? 27살때 구입한 첫차..지금도타는데 늙어서 힘들어해요..,2
1447,정비해본사람으로서 진짜 썩차 리스토어만큼 욕나오는작업이 없음... 진짜 대단하십니다.,1
