,comments,likes
760,저도 서울에서 가솔린7인승 4년째 타지만 시내3키로 고속도로6키로라뇨?시내6키로 고속도로9키로 후반나옵니다.복합연비 7키로 후반정도..,7
761,"응 카니발 디젤 연료누유로 리콜 ㅋㅋㅋ 카니발 휘발유 타는데 도대체 시내에서 얼마나 ㅈㄹ같이 타야 3km가 나오나요??? 흠... 에코 키지도않고 노멀로 시내주행하는데  5 정도 나오고, 고속도로 평균속도 100~120 밟는데 9~10정도 나옴. 실차주임.",2
762,카니발디젤이더좋아요,3
763,흉기는 거르는게 답이다,3
764,요로수 ㅋㅋㅋㅋㅋ,1
765,카니발로. 몇편을 찍나요,6
766,카니발 디젤은 거른다.,2
767,엔진소리 들려줄려고 마이크 가따댔으면 말을 좀 멈춰주시지 말소리땜에 들리질않네 진행을 너무 급하게 할려함 편집차이인가?,1
768,운전을 어따구로 하길래 3이 나오지?? 이런거 믿지마세요 9나옵니다,3
769,수프라어디갔슈 수프라!!,1
770,디젤줘도안타요 경유타지,5
771,우파루파형2,2
772,호구차 이거사면 호구죠~~인싸k  영상 또 떴죠  카니발  누유,4
773,아니본넷 꼬챙이다 헐,1
774,1등,1
775,흉기차 빠들 미국대형 가솔차들 연비 욕하더니 이제 알겠냐? 흉기차보다는 낫다는거 ㅋㅋㅋ 아무리 그래도 역사가 100년된 미국차한테 아직 안됨 ㅉㅉㅉ,2
776,하리,1
777,연비좋다는 소리는 진짜 다 개소립니다혹해서 사지마세여연비운전해야나오는 연비입니다서울시내막히는곳에서 휘발유 7?8?말도안되는소리고요ㅎㅎㅎ5나오면 많이나온거죠,18
778,카니발 특성상 쏘렌토나 싼타페 랑 비교하면 엔진룸 사이즈가 더 짧아서 엔진이 실내쪽으로 더 들어옵니다.그래서 다른차에 비해 진동이나 소음이 더 크게 들릴수밖에 없구요. 당연히 풀악셀하면 우리나라 2.2디젤 특성상 소음은 어쩔수없다고 생각합니다.그걸 알고도 국산 미니밴 디젤은 대안이 없으니 탈수밖에 없는거같고요....,8
779,디자인은 참 이쁘네요~,2
780,저두 전 카니발 소유했었는데요 승차감 개선 이외에는 전과 크게 다른게 없어 보이네요  그래도 소형승합차를 원하시면 이만한 대안이 없죠^^,1
781,진짜 항상 리뷰 잘 보고있어요. 다른곳에서 무조건 좋다는 리뷰보구서 K7 샀는데 진짜 후회하고 있거든요.  미국에서 독일차만타다가 한국와서 국산차도 이제 독일차와 비교해도 크게 밀리지않는다는리뷰에 구매해보았는데 아직까지 국산차는 가성비로 타야하는것같습니다. 그래서 이런 거짓없는 솔직한 리뷰가 차량선택하는데있어 많은 도움이 될거라 생각해요. 진짜 모든차를 장점만말하는 그런 리뷰어보다 수입차 국산차 편견없이 부족한점은 확실하게 말할수있는 이런분이 많이 필요해요...,2
782,확실히 칼같은 리뷰가 맘에든다...ㅎㅎ 두루뭉실한게아니라 현실적으로 느껴지는 단점과 장점을 콕콕 집어서 칼같이말하는게 너무조아!!,10
783,그리고 역시 차 리뷰는 모트라인이 쵝오임. 수많은 차 리뷰하는 유튜버들을 봤지만 차 리뷰는 모트라인이 제일 몰입감 있고 솔직함.,6
784,역시 내년에 출시한다는 하이브리드를 기다리는 게 좋을 것 같아요. 바닥에 배터리를 깔면 안정감도 더 생길 것 같고,13
785,키니발이 이런 이유는 간단합니다. 경쟁상대가 없기 때문이죠~ 그래도 잘 팔리기 때문인데 경쟁모델이 없다는게 소비자에게 얼마나 손해인지 알수있습니다.,2
786,카니발 4세대 3세대에 비해서 많이 좋아졌나요? 궁금해서 렌트해서 타보고 싶네요,1
787,전세대 카니발도 그렇고 이번모델도 그렇고 3열쪽 라인에 멋부리느라 측면 창문이 되게 작은거 같던데 좀 아쉽습니다.시에나나 오딧세이처럼 평평한 라인이 아니라 조금 스포티한 느낌을 주려고 한거같은데... 디자인 이전에 실용성을 중시하는 북미시장에서 어떨지 궁금하네요. 아재들이 타는 차는 멋있으면 안되는건 아니지만 아쉽습니다.,1
788,리뷰 역시 시원 시원하게 방송 잘 봤습니다.,2
789,가솔린 엔진이라면말씀하신 주행능력이많이 차이날까요??같은 성씨 이기도하고더친밀감도 가고 더 응원하겠습니다^^,1
790,성로형이 말하는 시트느낌허리가 민감해서 시트리뷰에서는 매우공감되네요.언제 넥쏘리뷰해주세요 제가 느끼기에 등받이 착좌감은 넥쏘가 가장 좋다고생각합니다.(등판이 라운드형임),7
791,"차의 사이즈, 가격, 편리, 가치에 관점도 좀더두면 좋을것같아요. For the price of the vehicle, there's no other minivan come nearly close to this Sedona.",3
792,역시 설명은 깔끔하시네요~^^,2
793,진짜 뼈는 시원하게 때리심...ㅎㅎㅎㅎ 결국 3세대 디젤에서 문제가 된 진동 공명음이 또 4세대에서도...정신 못차리는군요?15년전 벤쯔 C클 (S나 E클도 아닌 C클) 디젤 타보고...이게 진짜 디젤인가? 했던...에휴...,1
794,시원한 리뷰 잘 봤습니다,3
795,현대에서 차 받아오는거 아니면 참 리뷰를 잘해요. 뭐가 중요한지 딱딱 잘 집어 내고.,1
796,그러나 미니밴으론 대안이 없는 아쉬움ㅠㅠ 씁쓸하네요,24
797,디자인은 진짜 잘나왔네,1
798,"윤대표님 역시 정확하십니다!3년후 F/L때헤드업, R 랙타입, 4륜, 하브다 들가면~~사는게 맞는듯 합니다! ㅋㅋ분명 또 결함 터집니다 ㅎㅎ",11
799,카니발정도 크기의 차는 최소 6기통은 되야해요 결국 가격이죠 ~ 180키에 몸무게 120키로에 심장은 애기 주먹만한 크기 그래도 걱정마세요 고속도로에서 터보s 따위는 씹어먹을 꺼예요-,37
800,성로님 영상 오랜만에 보는데 맘고생하셔서 그런건지 예전보다 날카로워진 느낌이 있어요..,1
801,모트라인 넘나 잼나게 보고 있습니다^^ 근데..갑자기 이렇게 일반광고가 많아졌나요ㅜ 보다 흐름이 엄청 끊기네요ㅜ,1
802,"ㅋㅋㅋ 이제 화내는게 컨셉으로 자리잡음 ㅋㅋ윤성로 힐링케어 VLOG좀 올려줘요두피케어, 화삭히는 요가, 명상 ㅋㅋㅋㅋ",1
803,신차고민하고 있는데요. 솔직한 리뷰 감사드립니다.,1
804,현 하리차주입니다.. 그냥  제대로 까셨네요... 조만간 시승해보겠지만  성로씨 리뷰보니 할것도 없네요...것만 번지르르 바뀐느낌이네요... 보니깐.. 아시겟지만 다자녀아빠는 카니발밖에 대안이 없습니다.. 2 리터대 터보랑 하이브리드 와 4륜 들어가면  바로 바꾸려고 고민하는중이었는데..현 하리 그냥 2~3년 더 타야 할느낌이네요..  자동차로보면 카니발은 쓰레기입니다.. 진짜 독점차라 많이 신경 안써도 팔리는차.. 쏘렌토나 K9정도까지만 신경써주면 진짜 좋은차 나올텐데..안타깝네용...,4
805,요즘 현대기아차는 어떤지 모르겠으나 제가 타본 거의 대부분의 현기차는 의자 시트가 다 저렇게 살짝 짧아 장거리 운전하면 엉덩이가 아프고 편치 않죠... 요즘은 안그런듯한데 카니발은 여전히 그런가 보네요...,2
806,형 다정다감해서 넘 좋아요 사랑해요,1
807,ㅋㅋ 시원시원한 시승기~,1
808,모트라인은 항상 응원합니다!!,1
809,이러면 안되는 줄 알지만 카니발 하면 제주도 난봉꾼이 생각나서리 ㅋㅋㅋ. 좋은 영상 고맙습니다~,1
810,진동 소음 큰 차이 없다는게 참 충격적이네요. 기아 무슨 배짱이냐... 벌써부터 이러면 겨울 몇 차례 지나고나면 경운기 예약이네요.,5
811,얼마전에 02년식 겔로퍼2 280주고 샀습니다. 수동인데 아주 만족하면서 잘 타고있습니다.엑셀 밟으면 움직이고 브레이크 밟으면 차가 멈춥니다. 비와도 차안에 비 안들어옵니다.,2
812,"오히려 시트로엥c4그랜드피카소가 더 나을듯.. 2,3열 바닥에 들어가서 카니발보다 더 활용도 높아보이더라구요",3
813,우회전할때 차선좀 잘 지켜주셔야 할듯합니다.. 우회전하는데 두개차선을 한번에 넘어가는 모습은 보기에 좋지 못해요.. ㅎㅎ 항상 까는 리뷰 아주 좋아합니다 ㅎㅎ,1
814,성로님 기준으로 2열3열이 정말 편해보이네요,3
815,경운기 디젤 배기음 좋아하는분들 강추드립니다~~방충망보다 인견이불같은 느낌,1
816,디젤을 거르고 가솔린으로 가기엔 또 gdi가 걸리네요. 수출용은 mpi 내수용만 gdi라..,8
817,열쉼히 하시는 모습에 좋습니다.,3
818,모트라인도 정차시 리뷰때 번호판 모트라인으로 달고 하면 이쁠것같은데,8
819,차는 무조건 나오고 최소 6개월 후에 구매하는게 좋은거 같음,1
820,"1세대 카니발도 2.9였는데, 진동 소음 카니발에서 잡기 힘든거 알면서 왜 모하비에 들어가는 6기통 엔진을 안쓸까요?",1
821,원래 까줘야함  칭찬엔 이유가있슴  잘봤습니다,1
822,르노랑 쉐보레 리뷰 보고 왔는데 단점만 영상 끝날때까지 나오던데 역시 현기차는 다르네요 따로 돈받은게 있는지 궁금합니다,1
823,"크기는 큰 데 가격은 쏘렌토와 같다는 점... 엔진도 같고,,,,, NVH 에 돈 덜 쓴거라 생각되네요",1
824,성로형 오늘 영상 2개올라와서 너무 좋아️,5
825,디젤 걸러야 하는 거면 모트라인 버전 가솔린 리뷰 보고 싶네요. 가솔린도  걸러야 한다면 차종을 바꿔야 할 텐데...,1
826,제대로된  리뷰네요,2
827,전세대 진동 소음 전 그냥 디젤차구나 하는 느낌 그 이상 그 이하도 아니던데요.뭐 어차피 전세대 카니발은 쏘카로 타볼 수 있으니 구매 의사 있는 분들은 직접 타보고 판단하겠죠.너무 불필요하게 오버하면서 지적한다는 느낌을 지울 수 없네요.,1
828,뒷자석보다 운전석이 가장 편하고 좋아야한다. 현기는 왜 이걸 모를까,1
829,데일리카보단 패밀리카용인데 진동 공명음이 심하면 좀 ㅠㅠ mpv는 제발 내용물에 더 신경써줬으면팰리가 더 좋은가 결국... 아 슬라이드도어 편리성 포기하기 정말 아쉬운데 ㅋㅋ,1
830,벤은 관심차종 아니라서리 구매할 일은 없는데 이전모델 타보니까 실내가 넓어서 주행할땐 편하던데,9
831,2열 전동은 진짜 애바다...  3열 사람타면 2열 조정할때 한세월이겠네.,1
832,"패밀리카를 저따구로 만드니    독점이다 싶으니  저렇게 만드는 거죠,  이번 신형 소렌토는 정말 좋습니다, 경유가 휘발유 수준이죠.  안사는게 답입니다.",3
833,이 분 영상보면 무슨차를 사야될까 싶다..,1
834,과거 생활의 달인에 나온 원가절감의 달인이 생각나네요ㅋㅋㅋㅋ,1
835,날카로운 분석입니다,1
836,4열은 부모의 원수를 차태워줄 때 유용하죠,192
837,난 아직도 스타렉스 카니발은 일제차들에 비해 멀은거같음 회사다닐때 출장가면 타던 세레나와 시에나의 퀄리티를 잊을수없다,2
838,언급하는 단점이 제가 카니발 시승해보고 접었던 이유와 같네요.딱 초중때 타고다니던 학원 승합차같은 진동과 소음.SUV는 엔진 같아도 진동/소음이 그래도 승용 수준입니다.이건 승합.,28
839,이분리뷰를 보는이유는.. 차를 바꿀일이없는데도 까는게 재미있어서. 하는말들보면 주관적이다보니 나올수있는말 적당히 걸러들으면 개꿀잼임.,1
840,성로형 운전도 다리 90도로하면 시트를 얼마나 앞으로 당겨야해요?ㅋㅋ,2
841,안그래도 차 5~60년 만들어본 기업인데... 아직도 물이샐정도로 조립품질이 떨어지는건 좀 아니지않나 왜자꾸 현대기아차는 역주행을하는지..,2
842,뒷범퍼에 전구다마 깜빡이....앞은 좋은데 뒤에서 확 없어보이네 이래놓고 오딧세이 게섯거라 ㅋㅋㅋㅋ원가절감 쩐다 쩔어,1
843,카니발카페에 디젤도 주행느낌좋고토크카매력적이고 휘발유못지않은 승차감이다 라고 하는사람 많던데ㅜㅜ,1
844,그래도 강남권에서 가장 빠른차는 5시리즈와 카니발입니다 ㅋㅋㅋㅋ,86
845,리뷰 진짜 핵심 짚네요...엠비언트 진심 극혐....현기가 이거보면 한층 더 발전하겠죠..?현기화이팅.!,2
846,윤대표님 얼굴이 좀더 활짝 폈으면 합니다~ ^^ 동생이 이차의 구매를 고민하고 있어서~ 모트라인 리뷰를 추천해줬습니다~ 글을 잘 쓰진않지만 언제나 잘 보고 있어요~건승 하세여~ 윤대표님~,3
847,잘한다~~~. 윤성로 화이팅!!!!!! 제대로 까라. 그래야 우리나라차가 산다....~! 요즘 맘에 듬.. 근데  요즘 까만형 왜 안나오는지. 이차도 제대로 서킷에서 밟아 줘야 되는데. ㅡㅡ;,2
848,풀체인지차는 사전예약시 출고순서 밀리는게 더 이득인듯,1
849,솔직해서  좋다,3
850,"달리는 차도 아니고 힘 없어도 엔진 배기량 낮아도 좋으니 소음,진동, 이건 잡아줘서 2열3열 안락해졌으면 좋겠어요.",6
851,3.0디젤 아이신10단밋션들어가야 정상이죠 전장10cm늘어나고 에어서스펜션은 기본옵션,1
852,노보스인더스트리에서는 습식DCT8단미션 안 좋다고 신랄하게 비판하는대 여기선 좋다고 하네요.. 과연 누구 말이 맞을까요,1
853,디자인 개이쁘다,1
854,트렁크 조립 단차봐ㅋㅋㅋㅋㅋ일부러 층 나뉘어져 보일려고 작정하고 조립한거 같아ㅋㅋㅋㅋㅋㅋㅋ현대기아님들 대단들 하셔ㅋㅋㅋㅋ,3
855,감독님과 성로형의 기럭지 차이보소 ㅋㅋㅋㅋㅋㅋ,69
856,쏘렌토MQ4도 리뷰하시는거 보고싶은 1인 입니다,37
857,4열은 성로행님이 타기딱좋은사이즈같은뎅~ ㅋㅋㅋㅋㅋㅋ 싸랑합니다~ ㅋㅋㅋㅋㅋㅋㅋ,1
858,리뷰어중에 제일 솔직한편!!!!!!!,5
859,카니발의 큰 구매 포인트는 노래방때문임 ㅋㅋㅋㅋㅋㅋ,3
860,역시 바뀐건 디자인뿐이군...,1
861,17년식 카니발(dpf마지막출고)인데 1열 헤드레스트가 진짜 거지같아서 조수석에 앉으면 목이 부러질것처럼 아프고 불편하더라고요 게다가 제일 뒤로가있을때가 그정도로 불편하니...신형도 그정도인가요?,1
862,몇억짜리 독일차 리뷰하면 나도 행복하겠죠. 국산차 몇천짜리차 리뷰할땐  후진거  감안좀 하세요.  운짱이 얫날 노래기보다는 잘한다고 늘 응원하는 사람입니다.,1
863,쭌이형은 진짜괜찮다고 하던대 갈리네유,1
864,카니발 시승기를 보고 성로형이 화낸다고 말씀하시는 분들! 지금 정말 평온한 상태입니다.  다음주 SM6편을 기대해주세요 ㅋㅋㅋㅋㅋ,9
865,카니발 아무리까도 깡통 3천대에 풀옵 4천대인 차량임 비교 대상자체가 없는 가성비,2
866,나 같아도 화나지 그만큼 한국을 사랑한다는거~ 영상 잘 봤습니다~,2
867,"엔진 문제, 전자제어 장치 등등 빨리 보완해라 ~",1
868,은근히 저 분노에... 중독성이... ㅋㅋㅋ,2
869,결국 돈이지  큰 차에 소음을 더 잡으려면 돈을 더 써야 하는데 그럼 가격이 상승하니 판매율이 하락할 수 있게 되는거고  결정적으로 소음을 어느정도 나게 냅둬도 살사람을 살것이기 때문에  소리 안나게 잡는다고 세단이나 suv 대신 카니발을 사는건 아니니깐,1
870,"저 방충망(강판) 앰비언트는 차라리 넣기 싫으면 싫다고 이야기하고 아예 넣지 말지 저딴걸 앰비언트라고 넣다니 기가 찹니다.  이번에 차 잘만들어 놓고 다된밥에 재뿌리는 짓인듯 합니다.  7인승 시그너쳐에 추가 옵션좀 넣으면 4천 후반대...조금 비약하면 5천에 육박하는 상당히 비싼가격인데 몇가지 옵션은 대충만들거나 빼버려도 카니발은 만들면 잘팔리니 신경 쓸 필요없다는 생각인지, 몇가지부분에서 말도안되는 원가절감을 해놓은것이 화가나네요.사실 5천에 육박하는 가격이면 awd,  제대로된 앰비언트 조명, R-mdps, hud, 등이 모두 들어갔어야 하는 금액입니다. 저는 일단 마루타 테스트 기간이 지난 몇년후 7인승 3.5 가솔린 모델을 구입하려 하는데 큰건 안바라고 그동안 앰비언트라도 정상적인 수준으로 바뀌었으면 좋겠네요.",7
871,윤대표님말씀은 진짜 잘 한다.모트라인 화이팅!,1
872,9인승이 아니라 6(+3)인승 이라는게 학계의 정설,4
873,"워딩이 점점 고급스러워 지시는군요 ㅎ 홍역, 나팔관 ㅎ",2
874,디젤은 어느정도 소음이있을수밖에없죠.. 맨날 디젤타면 화내 ㅋㅋㅋㅋㅋㅋ,1
875,더 어이없는 사실 : 4000만원 중반대 차량인데 본넷 쇼바가 안 들어가고 작대기 들어간 점 (이런 점에선 왜 이렇게 인색한지 모르겠음),1
876,그냥 가솔린 타면 되는데... 도시에서 살면 연비도 생각보다 나쁘지 않고 괜찮은데 ㅎㅎ 전세대 3.3 운행중인데 연비가 생각보다 좋아서 놀랍니다,5
877,많이 바뀌었다고 해도 현기를 믿을만한건지....,2
878,토요타 시에나 구형을 타봤는데 공명이 있었는데 대다수 미니벤들이 그런것 같습니다,4
879,깔라고 리뷰하는 곳이네.. 갠적 취향이 들어간 리뷰네요,1
880,"정확한 리뷰, 좋은 영상 감사합니다.",2
881,정말 딱 깔꺼 까시네여 잘보고 갑니다,1
882,투아렉 디젤 8기통 리뷰 기다리구 있겠습니다.,17
883,구형에 무게중심 약간 낮추고 adas 장착한게 전부인 발전없는 신모젤,1
884,NVH 는 개인 느낌이 아닌 수치로 해주심이...전문성이 있는부분은 정량적으로...느낌은 느낌으로...,9
885,본인 차량이 아니기에혹시나라도 시트에 오염생길까흰색 옷으로 갖춰입은 매너남 성로님은 도덕책~,3
886,가솔린 모델 구입하시면 요즘 로턴 LPG 개조라는게 있던데 좀 알아보시고 리뷰 부탁드립니다.,3
887,이러면 MQ4도 까일지 궁금함,1
888,재미있게 잘 보고 있습니다,1
889,앞에 디지인 진짜 그릴이랑 굿이다 솔직히 볼때마다 뽀대좀 난다ㅋ 애기 있으면서 옆슬라이드문이 얼마나 편한지 알게됨 근데 조수석 뭐냐ㅋ,1
890,9:40 옆차들 보명 그리 큰 가속도 아닌데 디젤 엔진음 심하네요.;;;;,13
891,시에나가 다른건 몰라도 시트가정말 편합니다.. 카니발은시트가 영 꽝이라...,1
892,시트랑 디자인은 굳이던데.... 역시 현기는 엔진 미션이 함정이야ㅠ.ㅜ,3
893,카니발 디젤은 진짜.... 아.... 그냥 신차일때 그 가속한것도 아닌데 저정도면 말다했죠뭐.....그리고 편의사항 좋아지면 뭐해 다른건 그냥 전세대랑 비슷한데,1
894,기아는 절대 카니발은 쏘렌토보다 좋게 안만들어줍니다,1
895,쏘렌토도 해주세요!!!,2
896,카니발 사서 시트 다 버리고 튜닝해야 되겠군요,14
897,몰랐던 좋은 정보 얻고 갑니다.    이음새 마감이 문제 많아 보이는군요,1
898,11:10 앰비언트진짜 왜 저렇게 만들었는지..대쉬라인따라가면 이쁜데 굳이 못나게 만든이유가..,9
899,펠리세이드 랑 비교시 어때용?,2
900,카니발이 주차시 앞뒤로 나오는 기능이 없나요?? 커서 그 기능이 주차장에 제일 필요한 차량인거 같은데..,3
901,쏘렌토하이브리도 리뷰부탁 드립니다 ㅎㅎ,2
902,수출형 차와 같은  7인승 가솔린이 정답.,2
903,저런 주차 상황에서 대고 내릴수가 없어 카니발 팔았습니다. 폭이 개넓어서 카니발 타시는 분들은 좀 타차량을 배려해줘야 됩니다. 우리나라 주차칸이 넓어지기 전까지,1
904,다른 카니발전세대 유져들은  조용해졌다라고 하는데.... 거의 모든 과반이상의 사람들이 그러는데...,16
905,윤성로 대표는 너무 돌직구다 ㅋㅋㅋㅋㅋㅋㅋㅋ,1
906,카니발 3.3gdi 가솔린 타보고 깜짝 놀랐습니다 정말 굼뜨고 안나가면서 가솔린도 이렇게 시끄럽구나.. 이게 과연 v6 가솔린 맞나 싶더군요 디젤은 더더욱 말할것도 없겠지요ㅎㅎ 신형으로 가서 좀 개선되었나 생각했는데 역시는 역시이군요ㅋㅋ 아무래도 운전석이랑 엔진이랑 격벽이 너무 가까운 레이아웃을 하고 있는데다가 원가절감으로 방음이 전혀 안되어 있어서 그런가 생각이 들기도 하구요,1
907,디젤을 거른다구요??유류비가 2-3배 이상 차이날텐데...실소유주의 입장에서 생각 안해보셨어요?,1
908,앵그리모드 안켜질수 없는 카니발이군요,1
909,엔진음이 좋네요.부르릉..,2
910,투싼 ix 10년차 오너이고 이제 차량 변경하려고 보고있습니다. 제 입장에선 가격대비 참 좋은 차량이라고보는데 리뷰는 비판적이네요. 이런게 실 구매층과 그냥 보기만하는 사람의 차이가 아닐까요. 차는 휴대폰처럼 바꾸시는분들도 있겠지만 저처럼 오랜기간 유지하고 바꾸는 사람이 더 많다고 봅니다. 실구매 예정자 입장으로 요즘 차들. 다 개 미친듯이 좋아보입니다ㅠㅠ,4
911,카니발정도크기면 6기통드러가야 된다고생각함,1
912,카니발은 그래도 무조건 잘팔릴겁니다아기 3키우는 아빠는 카니발만한게 없어요시에나 에스컬레이터 뭐가 오든간에 돈값 대비는 카니발을 이길수 있는차는 단언컨데 전세계에 없을겁니다,1
913,S클라스 90도 만들어 보는거 보고싶네요. 뭐든 깔라고만 하시네요.,2
914,미니밴은 7인승이 좋을듯,1
915,2.2  라는출력이 차량 무게에비해 모자라기때문 아닌까요? 그리고. 솔찍히 기술적으로 모자라는것은 더 커구요.,1
916,펠리랑 카니발 비교해주세요,5
917,"디젤이면 감안하고 타야죠,  카니발 차주 중에 몇명이 가솔린입니까 ㅎㅎ",1
918,모트라인 리뷰를 보는 이유! 좀 까줘요. 시원하게. 그 차를 사려고 하는 사람들은 좋아보이니까 사려는거에요 어차피.그러니 이왕 사려는거 단점을 최대한 알고 사야하지 않겠습니까?,12
919,근데 2열 아쉽다고 말한부분 7인승 가면 다됩니다. 현기상품기획이 다그렇죠뭐,3
920,현대차는 1년6개월후에....기아차는 2년후에.....독일차는 2~3년후에.....신차출고 정답...!,1
921,차를 잘 만들면 저런 애기가 안 나올텐데신형이 나오면 뭔가 바꿔져야 하지 않겠어요,1
922,"카니발은 편하게 타려면 1,2열만 사람타야하고 2열은 비행기용 리무진처럼 개조하거나 리무진 등급vip시트가 아니면 불편해쇼.레그룸도 어정쩡차가 높아서 시트까지 높게 만들면 헤드룸 거의 없어지고 차 좁아보이고 결국 시트를 작고 낮게 만드는 방법뿐인데초딩이상이면 불편해서 오래 앉기도 힘든게 카니발입니다.7인승 리무진사서 3열은 포기하고  4명탈 생각이면 어른4명 가능  아니면 1열 빼고는 초딩용 ...싼맛에 탄 차였는데 이젠 싸지도 않으니 메리트가 없어졌어요.특히 전작 카니발은 승차감이 개판 그 자체라서 이건 포터보다도 못한 승차감을 가지고 패밀리카라뇨 ?",1
923,6단 파워텍에 알엔진 2.2 를 50만 키로 넘게 타다가 더뉴카니발 2주 타 봤더니. 디젤 타다가 가솔린 차 느낌이 나더군요. ㅡㅡ코너링 연비 등 모든 면에서 압승입니다. 딱 한가지.  연비 때문인지 저알피엠 위주의 변속으로 6단차처럼 가속페달 밟으니라 뒤에서 빵빵거러요.  대신 연비로 보상은 받네요.  좀 더 꾹 밟으면 잘 나가긴 합니나.,1
924,진짜 저 빨래판 극혐..쏘렌토는 시승하는데 아니 조수석 빨래판에(은색판) 햇빛이 반사되서 은근 눈부심..어이없었음,7
925,2열 시트는 7인승에서 해결 됨,1
926,진짜 저 새차사면 윤성로형님한테 신차검수 받고 싶어요...ㅋㅋㅋㅋㅋㅋㅋ,1
927,항상 응원 합니다,2
928,역시 시승 리뷰는 모트라인 윤성로님이대한민국 1등~!!!,2
929,예전이야 현기차가 싸다고해서 단차가차이나도 싼맛에 그냥저냥 수입차 비교안하고 차겠지만이제 현기차 가격도 만만치않던데 좀 신경좀 써야겠네요,2
930,ㆍ국산이나 수입이나 신차는 신제품 출고후~구입은 약 1~2년 뒤에구입하라는 정설이 있음.,39
931,2열에 시트가 낮아야 편하지 않나요?90도로 되면 불편하지 않나?,1
932,카니발 4열은 그냥 관상용입니다....,1
933,방충망에서 빵터졌내 ㅋㅋㅋ신차계약해놨는데..ㅋㅋ  안좋은건안좋고 좋은건 좋은거니까..,1
934,엔진을 그냥 모하비 3.0 6기통 너어주면 조용하고 힘도 좋고 얼마나 좋을까?..,2
935,팰리세이드 vip옵션 출고됬어요. 리뷰한번 꼭 부탁 드립니다.,1
936,4열은 성인이 앉을수 있는 공간이 아닙니다 ~,7
937,3분20초 대퇴사두(?) 서포트에 빵터짐 ㅋㅋㅋㅋㅋㅋㅋㅋㅋㅋㅋㅋㅋㅋㅋㅋㅋ,1
938,ㅋㅋㅋㅋ 광고 지옥,4
