,comments,likes
939,항상 궁금 했던건데 왜 카니발은 추차라인에 비스듬이 추차하는거죠? 과학인가요?,1
940,누가 카니발 경유 사고싶어서 사나요..?휘발유 6기통이 더좋은거 누구나 다압니다.아빠들은 경제적이유때문에 거르고싶어도거를수없어요. 일반대중의 니즈에 공감해주시면 더 좋겠습니다.,1
941,4열시트를 떼어내면 불법인가요???,1
942,현기는 QC를 까다롭게 하고 싶어도 노조때문에 쉽지도 않을듯현기는 현 노조 다 자르고 새로 시작하는게 훨씬 나을지도....,7
943,전세대 카니발 오너입니다 신형 카니발엔 레인센서(우적감지와이퍼) 추가되었나요? 진짜 왜 이런걸 안넣어줬나 모르겠어요 10년전 몰던차에도 있던건데...,2
944,잘봤습니다.,5
945,디젤이 판매량의 대부분인데 거른다니 ㅋㅋ,34
946,내갸타보니 기아카니발 Good  입니다.^^전에 카니발 은 키가 187인데  의자랑 공간이  불편했는데 이번 카니발 은 Good Good Good ^^기아 화이팅 하세요.^^,2
947,방충망  ... 진짜 공감합니다.  뱀껍질 문양같아서  볼때마다 극혐.,2
948,카니발 공명음은 슬라이딩 도어 때문인듯합니다.,7
949,무드등자리는 나중에 카메라화면이 들어갈 자리임 그래서 지금은 비워둔거인데 믿믿하니 우선은 등이나 넣은거,1
950,정말 놀랍게도 저 방충망은실제로 모기를 막아줍니다.     앙???????,4
951,노읍읍때 보기 시작해서 노읍읍 사태 터지고나서 성로님 또치님 범스 에픽 응원하며 조용히 봤는데....그동안 잘 봤습니다  번창하세요,2
952,아니 진동 소음 개선 됐다는 유투버들은 뭐지.. 일단 보수적으로 잡고 이 영상을 기준으로 판단해야겠네요,1
953,카와우 보다 보니까 차이가 많이 나는듯,1
954,카니발 전세대 몇번 운전해보고 진동 소음 불안한 주행성능에 엄청 실망했는데 신형 좋아졌다길래 살까 고민중이였는데 껍데기 옵션 말고 나아진게 별로 없나보네요.  트래버스 페리버전 나올때 까지 기다려야 하나....,1
955,경쟁차량이 없으니 많은 개선을 할 이유가 없겠죠?,1
956,슴6 침투력ㅋㅋㅋㅋㅋㅋ,8
957,디젤이 힘이좋아서리 카니발 같은차를 휘발유쓰면 연비 겁나 후져요,1
958,방충망 엠비언트 ㅋㅋㅋㅋㅋ 그러게요 엠비언트 넣어야할 자리 다 비워놨네요,7
959,2열 허벅지 길어지는 거 옵션에 있습니다 안마의자 처럼 무중력 포지션으로 뒤로 넘어가면서 포지션 만들어집니다,1
960,항상 영상 보면 판교에서 수원 넘어가는 언덕길 지나가시는데 혹시 이유가 있을까요?,1
961,오디세이나 시에나와 비교시 어떤가요...핸들링만비교시...,1
962,요즘 현기 가솔린 앤진이 영 신뢰가 안가요.,1
963,크하하하하 방충망 빨래판 ㅋㅋㅋㅋㅋㅋㅋ 넘 웃겨요,2
964,정말화가나서리뷰하는사람,104
965,소음과 진동추측1. 이중차음유리 미적용2. 방음면적과 재질 부실3. 하체 소음4. 에어서스펜션 미적용,1
966,"디젤은 거르는 걸로, 이제부터 카니발은 가솔린인걸로...",2
967,4열은 국토부에서 안전 관련도 승인 해준건가요?,1
968,8단 자동변속기는 여전히 멍때리나요?,3
969,내가봤을때디젤 없애려고 지금 차량회사들이 끼부리는듯,2
970,카니발 디젤차를 사지말라는건 카니발을 사지말라는건가....?... 하이브리드가 나오면 좋겟지만서도.. 그런데.. 4000만원짜리에 2열전동시트를 바란다라.. 현대차가 엄청나게 눈을 높혀논서거나 옵션의 대왕이거나..,5
971,윤성로 대표님 덕분에 제가 자동차 관련된 꿈을 찾을 수 있었습니다 아직 학생이지만 공부 진짜 열심히해서 현대자동차 꼭 들어가고싶네요ㅠㅠ,2
972,ㅋㅋㅋㅋㅋㅋㅋㅋ리뷰마다 화가나잇는게 대부분이시내 이분,7
973,공감이 안가는게 그전 카니발보다 진동이나 소음 더 괸찮던데 그리고 디젤이 가솔린이 될수없듯이 디젤에너무바라는게많네,1
974,성노씨 팬으로서 한톤만 낮추시면   좀더좋은리뷰가 될것같습니다,1
975,영상에 나오는 모델로 구입하실 차주님들... 이것만 알고삽시다. 저런 색상 시트........ 관리하기 드럽게 힘들어요.  조금만 관리안하면 바로 시꺼매집니다. ㅋㅋㅋ ㅋㅋ 시트 광내는데 죽어나요...,1
976,광고가 너무 많고.... 그리고 카니발은 2-3열 리뷰위주로 해야 하는거 아닌가...싶네요,7
977,자기주장만 강함자기생각이 항상옳을수는없음,2
978,ㅋㅋㅋㅋㅋ내가 또 까일줄 알았어 ㅋㅋㅋ안까이는 차가 없다니까 ㅋㅋㅋㅋ,21
979,목소리 한톤만 낮추면 성대가 편안해 질것 같다 ..,32
980,에쿠스가 저지경인데 나머지차들은 말다했지모,12
981,셀토스처럼 a필러만 흰색이네요. 얘도 투톤 되려나.. 솔직히 어떤 한부분만 색 하나 다른거 넣어버리면 투톤 넣으라고 그따구로 만들어 놓은것 같아서 상당히 싫단 말이죠,3
982,믿고보는 모트라인~♡,1
983,"쏘렌토도 리뷰 해줘 ,,,",2
984,"정말 이 리뷰를 보니 유튜브의 자동차 리뷰 중에 믿고 볼만한 거 거의 없다는 생각이 드네요.이구동성으로 기존 카니발이 가지고 있는 문제가 사라졌거나 많이 개선된 것처럼 이야기 했는데, 도대체 뭐가 진실입니까?다시 한번 카니발 리뷰들을 보면서 가짜 리뷰어들을 걸러내고 구독 취소해야겠네요.그러나저러나 가족용 차로 카니발 하이리무진을 연예인 밴처럼 컨버젼 한 것을 사려다가,화려한 옵션이 아닌 차의 기본기가 제공하는 승차감을 중시하다보니좀 과하다 싶을 정도로 비싼 차를 사고 말았는데 (BMW X7 40i)마음 한편에는 카니발 풀체인지를 미처 확인하지 않고 성급하게 지른 것이 아닌가 하는 불안감이 있었습니다.그러나 잘 판단한 것 같네요..역시나 대충 만들어도 잘 팔리는 카니발에는 기아가 정성을 다 할리가 없죠.리뷰 잘 봤습니다. 감사합니다.",5
985,예전에는 리뷰가 별로였는데 리뷰하시는 실력 확실히 좋아지신듯.. 귀에 쏙쏙박히고 좋네요!,2
986,카니발 페밀리카 인데왜 하이브리드는 안나오나?!이해가 안가는 부분?에 혀 ~성로님 이부분은 왜 안 까십니까?,2
987,대범 하시다~~잘 볼께용,2
988,말은진짜 빠르게 잘한다또박또박,4
989,엠비언트가 차의 성능을 나타내진않는다네..기본에 충실한차가 좋은차지..불 번쩍번쩍들어오면 괜찮은찬가?,1
990,왜 항상 리뷰를 보면 화가 나있을까.....,67
991,그럼..카니발은 가솔린으로만 가야하나여??연비똥이던데......데일리카로써 쓸정도인데 10을못넘는게.......(개인적인생각)저희 가족이 320d g바디랑 코란도스포츠2014년형 갖고있는데 얼마뒤 코란도스포츠를 팔것같은데여..팔면 가족끼리 여러명 탈 카니발 스타렉스(디자인부터 그냥 다좋아서여)살것같은데  짐도 많이싫고 많이 다닐꺼라서..우찌해야되죠. 가족여행 인원이 못해도 최소5명(많게는 8명)이라 5명탈 공간에 짐 싫은공간따져서 사려구요...,1
992,시트 포지션은 제한된 차체 길이로 인한 극복하기 어려운일 아니겠어요,1
993,역쉬~~~ ㅎㅎㅎ 르노삼성 얘기할 때랑은 완전 다르군.. 까는것도 부드럽게~~~,2
994,9:30 형 표정 ㄹㅇ 열받음,1
995,저 근대 나보다 지식이 풍부하고 타당성 있게 까는건 좋은데 자신의 기준점이 대체 어디인지.....  알고싶네요,1
996,디스커버리 복원영상은 왜 내려갔나요?? 오랜만에 보고싶어서 왔는데 ㅠㅠ,6
997,엔딩곡 들을때마다 좋은듯 ㅋㅋ,1
998,엠비언트ㅋ 연식변경때 추가된다에 한쪽 겁니다,5
999,"하지만 카니발아니면 세자녀 이상 가진 아빠는 선택지가 별로 없습니다. 제조사들이 패밀리밴을 많이 내놓아주면서 경쟁체제로 가며 품질도 올라가는 것이 베스트일텐데, 그렇지 못한게 실상이죠.카니발 5년이상 끌며 진동도 많이 느끼고 과거 m3 몰고 다닐 때의 드라이빙의 즐거움은 없지만, 아이들의 해맑은 웃음소리 그리고 여행 다녀 올 때 세 딸 아들 한 놈 푹 자고 있는 모습 보면.. 이놈이 동력은 부족하지만 제가 살아가는 동력은 만들어주더라구요 ㅎㅎ.. 맥주 한 잔 먹으며 리뷰보는데 재미있네요. 항상 발전하는 채널되시길 바라며, 그리고 제조사들이 이 채널 보면서 많은 발전을 했으면 좋겠네요.",9
1000,몇번 보다 보면 차에 관해선 소비자 입장에선 이 방송이 가장 좋다고 봄..내가 카니발 4세대 타는데..둔하신 분이나 타 방송에서는 잘 얘기 안하는 내용을 내가 느끼는 거랑 똑같이 얘기해줌,2
1001,에이... 일본가서 20년된 미니벤 타봐도ㅡㅡ 소음은 잘 모르겠음... 독일차만 타봐서 휘발유타면 잘 못느끼기는 하는데 카니발 타면 소름돋음.,1
1002,개인적으로 이런분들은 국산차 시승기 안했으면 좋겠네 누구나 비싸고 좋은차를 사고 싶지만 자신의 경제수준에 맞춰서 사려면 국산차가 답이라 국산차를 보는건데  기준이 죄다 외제차중심이라 벤츠니 아우디니 그런차는 이런데 현기차는 그런부분이 아쉽다. 혹은 이정도면 국산차 수준에선 양호하다 이런식의 리뷰니까 차를 사려고 보는 시승기에서 까기만하고 있으니 차를 사는게 맞나싶음. 그냥 외제차 시승기를 하시던지 기준을 국산차로 잡으시고 하시는게 도움될듯,1
1003,그냥 엔지룸 격벽 방음 안돼서 그런거아닌가요?...,1
1004,음 개인적인거지만 느끼는바가 공감이 안되는 부분이 많네요,23
1005,모트라인의 애청자로써 장점만 이야기하는건 다른 리뷰에서도 어마어마하게 많이 볼 수 있으니 성로형처럼 시원하게 까면서 리뷰하는 모트라인이 정말 좋음,1
1006,카니발  아파트 일반적 주차장에서  정말 옆에 피해주는 차량...아파트는 서로 피해 받고 피해주는 구조이지만 카니발은 구형이든 신형이든 민폐 차량입니다.돈 없는 넘이 가족 많아서 타고 다니지만  카니발 옆에 주차되어 있으면  아~~~~ cccccc bbbbbb  합니다.,1
1007,땀... 더운데 고생많으셨습니다 ..,1
1008,성로씨는 자기가타본 값비싼 고급차 대비 국산차들시승하고 비교하니 그냥 국산차는 까이는거같은 느낌 국산차서민 입장으로 이야기해주세요,2
1009,적당히보고 시승해보고 결정해야지..너무많이 영상시청하면 절대 구입못해요..내년 중순넘어 구매하는게 좋을듯.,1
1010,냉각수가 색깔이 변햇네 ㅋㅋㅋㅋㅋㅋㅋㅋ드디어,7
1011,당신은 완벽한사람입니까?컨셉이라 믿고싶습니다.톤 자체가 집중은되는데 신뢰는 안가는톤이라 컨셉다시잡아봐요,1
1012,저 덩치에 애들 태우는 것까지 생각하면 디젤을 넣을 수 밖에 없고 그렇다고 고배기량 가솔린을 넣으면 가격대가...언제부터 카니발 같은 디젤 차 타면서 정숙성까지 바랬는지 이런 리뷰는 좀 안했으면 차가 가지고 있는 특성을 생각하고 리뷰를 해줬으면 디젤 자체가 진동 소음은 어쩔 수 없는데 진동과 소음 억제하는 소재로 떡칠하면 나아지겠죠 근데 바보가 아닌 이상 그거 몰라서 그럴까요? 단가 몇마넌 차이는 날껀데 그게 쉬운게 아닙니다. 조용하게 해서 팔면 더 잘 팔릴 수 있다는건 누구나 유추가능한 일입니다.개인적으로 현까지만 제발 차에 성격의 맞는 리뷰 부탁드립니다. 답답해서 올려봅니다.,1
1013,3열 시트 설명때 키높이 깔창 왕창 채운 기형적인 다리길이 구조라서 이해 불가하네요.,1
1014,HUD는 다음 모델에 내준다...........는 거겠죠,1
1015,성로형 요세 까만형 서킷은 안해줘? ㅠ,23
1016,"승차감이나 운전피로도, 소음 등 9인승이니 할 수 없지. 달래 9인승인가....",1
1017,써렌토 디젤 쏘렌토 하이브리드도 리뷰좀,1
1018,쏘렌토에 들어간 하이브리드 파워트레인이 왜 안들어간건지...,5
1019,"여러분 화나있는게 아녜요, 저게 저분 모습이예요",1
1020,오늘 올라온 우파님 영상 3분19초 모터라인이라고 모트라인 짭(?)이 등장합니다 ㅋㅋㅋㅋㅋ,3
1021,쏘렌토 하이브리드 구매 고민중인데 리뷰해주실수있나여,14
1022,잘 보겠습니다^_^,3
1023,MQ4 리뷰좀 해주세요,1
1024,화내는데 머리가 크니까 애니메이션 미니어처 같아요 귀엽네요,18
1025,날카로우시네요 ㅎㅎ,2
1026,기아차 쏘렌토 K5 카니발 시트팀 다교체해야함 어떻게 하면 이렇게 불편한 시트를 만들수 있는지 연구 대상. 살면서 타본 차중 유독 기아차 시트만 30분이상 운전이 힘들정도로 불편 특히 올뉴 더뉴 소렌토 역사상 최악의 시트,1
1027,화난 컨셉 잘못 잡은거 같은데..ㅋㅋㅋ,5
1028,"리뷰잘봤습니다, 이번영상은 많이 화? 나신듯해요 ㅎㅎ",2
1029,윤성로씨는 160넘는다 1번  아니다 160 이 안넘는다 2번,2
1030,너무 화내니까 알콘이 애~에햐 에 하면서 브레이크 콱 잡아버리네,48
1031,저는 호주사는데요.. 소음 진동 부분은 여기선 이슈가 없습니다.  소음 진동 부분은 호불호가 많은거같네요..,2
1032,"나팔관;;;;;; 우리 모두 나팔관을 지나본 경험이 있죠? ㅋㅋㅋ들어보라는 엔진 소리 괜찮은데요????   근데, 현기 디젤은 이제 버려야 해요.... 진동을 잡는다고 잡았는데... 그래도 남은 진동이 이게 뭔 진동마사지기도 아니고... 타는 내내 근육이 풀리는 느낌....",1
1033,정말 제대로 된 리뷰입니다.저도 극혐입니다..정말 극혐.,29
1034,진짜 죽어도 타기싫은데 애들 때문에 어쩔수없이 타야하는차....디젤 소음이고 나발이고 어쩔수없이 타는거 시발유는 카페에서 연비 3~4키로 나온다는거보고 그나마 디젤 잘삿구나 싶었는데 하이브리드 나온다길래 나오면 디젤팔고 하이브리드로 넘어가야지 hud없는게 진짜 가장 아쉽고 동영상 말처럼 빨래판에 방충망은 진짜 최악이다,1
1035,내 친구녀석 이번에 까니발 샀는데 잘못샀다 하더라구요 디젤이라 그런가 차는새차인데 몇년탄차처럼 진동이 심하다더군요 엔지소리 많이 들어온다고 가솔릴살걸 하면서 지금 후회하던데,1
1036,왜 멀쩡한 영상에 우파를 뿌려놨냐...,23
1037,디젤은  거르는게 답~,1
1038,"진동과 소음이 크게  개선되지 않았다니.. 기아차 의지의 문제기인가, 생산원가때문인가 기술이 딸린건가",7
1039,성로형 사랑해 잘봤어,3
1040,우파님이랑   짬짜미해서~카니발 담궈주세요~~,2
1041,윤성로 대표님.. 오늘도 여전히 화나셨네요,39
1042,변속기 이야기 할 때 자료 이미지가 잘못들어간거 같네요 13:40 아니면 제가 이해를 못한것일수도 있고요.,1
1043,"2,3열은 애들 카시트 공간아니여?ㅋㅋ성인착좌감따윈..ㅎㅎ",1
1044,이사람이 느끼는 소음과 진동 정도의 기준을 모르기에 어느정도인기 감이 안오네요. 정말 진동 소음이 심한정돈가??,22
1045,앞으로 더 까주세요,1
1046,밤누나들이 조금더 만족함을 얻는 차,1
1047,가루가 되도록 까이는구나ㅋㅋㅋㅋ,7
1048,예전 97년식 무쏘 엔진미미 고무  십년지났는데 경화안되어 있음. 현기는 소재고급화 해라.,2
1049,차 리뷰어 중에 광고는 제일 많은듯 ㄷ ㄷ ㄷ,1
1050,형 s90 fl 리뷰해줘요,5
1051,성로형 쏘렌토는 왜 안해줘요 쏘렌토 꼭 해줘요,1
1052,항상 화가난 상태에서 리뷰하시는 분,1
1053,대퇴사두x hamstring이 맞아요~,14
1054,카니발은 그냥 관광용 SUV정도인듯,1
1055,다른사람들은 차좋타고 빨아주는데  이분은 까는게 시원하니 보기 좋네여 ㅋㅋ,1
1056,이것도 해명글 올리실건가요?쉐보레 르삼차는 까면 염병을 떨던데..ㅋㅋ,6
1057,현기차는 일단 거르는것이 답이다.,1
1058,모트라인이 현기 빠인줄 아는사람 있는데... 최근에 기아차 대차게 몇번 깠다가. 기아차에서 신차 행사 초대도 못받더라 ㅋㅋㅋㅋ 현대는 초대 해줌 그래도.윤대표는 에어서스 빠 임.,7
1059,현대로 부터 협찬 받은거 아닌가요? 영상올릴때마다 표시해야 됩니다.,1
1060,카니발9인승을 깔수 없는 좋은점1.개소세 면제로 같은 옵션을 넣더라도 9인승이 저렴함(차가격도 저렴함)2.사업자 부가세 환급(차 가격에 10프로 환급 4600짜리 사면 460환급으로 4100초반대 사는거임)여기에 딜러 페이백100정도 해주면 4000에 살수있는 개꿀이죠 그렇다면 깡통은?3000에 살수 있는거죠 가격면에서 깔수 없는차3.버스 전용차로 6인이상 탑승시 가능4.원가 대비 저렴한 가격이외에 안좋은건 에프터 마켓에서 튜닝으로 커버 가능 방음부터 휠서스 타이어 레일개조 및 리무진시트 하면 엄청 좋아집니다이만한 가격에 이런차 없습니다 저도 신형 카니발 사업차로 사서 타고 있지만 아주 만족합니다,1
1061,형 너무 화나있어 ㅋㅋㅋㅋㅋㅋㅋㅋㅋㅋㅋㅋㅋㅋㅋㅋㅋㅋ,10
1062,타면 탈수록 진동은 더 심해지는데..신차가 저 정도면.....,1
1063,이분은 트위지 1년 태우고 카니발타게 해야되,1
1064,리뷰자는 왜 항상 화가 나 잇죠?,145
1065,저 정도 소음 진동은 그냥 아무 신경도 안 쓰일 정도 아닌가,1
1066,"볼 때마다 느끼지만, 세상에 온갖 분노를 리뷰하면서 분풀이 하는 듯...ㅎ",1
1067,"14:44 됐고. 슴식이는 언제? ? ㅋㅋ ㅋ 일주일 넘게 커밍쑨 하고 있느,ㄴ데/... 왠지 반전이 있을듯 ㅋㅋ",4
1068,요즘 현기차는 디자인은 이쁜데 디테일은 ...,1
1069,타이밍벨트가 더 좋은건가요.......ㅠㅠ,1
1070,디젤을.거르는걸로 리뷰하다 마지막 광고 어이가없네 ㅋㅋㅋㅋㅋㅋㅋㅋㅋㅋㅋㅋㅋㅋㅋ,13
1071,이정도면 리뷰가 아니라 홍보지,1
1072,윤대표 얼굴에 육수가 흘러요!,3
1073,저 잛은 다리가 뜨다니,7
1074,볼보 v60cc는 언제 예정인가요?,2
1075,감독님이 거인같단...,2
1076,ㅠㅠ 마음은 가솔린이지만 주머니가 넉넉치 않아서..,8
1077,출시 전에 오디세이 따라잡을거라고 하더니,1
1078,엔진음 진짜 저질이다...,4
1079,단종된 코란도투리스모 엔진룸 열어보세요. 카니발보다 광활하다 못해 광야입니다. 그래도 공명음 없고 방음 상당히 괜찮습니다. 그냥 현기차는 기본이 안된차입니다.,1
1080,좆나게 까봐야 출고하는데 6개월ㅋㅋㅋㅋ 다들 디젤극혐거리는데 70%가 디젤출고랍니다~,1
1081,농규는 방구석에서 xxx 중인데 모토는 승승 장구,7
1082,카니발 3세대 지인이 자랑해서 밥먹으러 2열 탓다가. 몇십년만에  멀미할뻔...나랑 안맞음,1
1083,AWD랑 하이브리드도 없는차..,2
1084,14:43 슴6 또 죽..,4
1085,카니발은 항상 비새는거 같아요,1
1086,그랗게 뼈 때리면 가루되겠다 ㅋㅋㅋ,3
1087,3:18 거긴 대퇴이두근 이에요 (햄스트링)이라하죠,10
1088,아니 미니벤 인데 당연히 2열 3열 좁고 불편한거아닌가,2
1089,나 2001년 도 카니발 몰고다니는디....그거에 비하면 이차는.. 소리 아예 안나는거...제껀 탱크에여..탱크소리남,1
1090,미쿡에 사는 난!!!!!!!   언제 자라고 이시간에 채팅을 한다고 그럭게 불러대는지 ..... ㅋㅋㅋ,4
1091,"윤성로님이 그 좋아하는 멘트,,, 디젤 특유의 더러운 느낌,,,이겠죠,,,,윤성로님 디젤 리뷰는 보지 않는게 답 같아요,,디젤 타는 사람들은 상당히 극혐할듯,,",1
1092,엠비언트를 어떻게 저렇게 해놧을까 ㅋㅋㅋㅋㅋ,3
1093,우파님 나중에 차 팔기 힘들어여,4
1094,우파님 차불쌍 ㅜ ㅋㅋ,2
1095,가솔린은 괜찮겠죠?,1
1096,"잘보다가....점점점 기분이 짜증나고 화가나게 되요...설명도 잘해주시고 포인트도 잘잡고 팩트도 잘 잡으시는데...언성을 좀 낮추시면 보는 사람들이 좀 편할거 같네요..화가 너무 나서 따지는듯한 말투처럼 들려요.,.ㅎㅎ",10
1097,차량리뷰계의 박평식인가,3
1098,방충망 ㅋㅋㅋ,4
1099,아무리 까도 겁나 잘팔라다는거 아무리 까도 현기는 신경 1도 안쓴다는거,1
1100,"현기차 얘기하는데 화안나는 사람들은 불량 또는 결함 경험이 없거나, 결함차  불자동차로 인생조진 사람들 관련영상을 안봤거나 둘중하나지요 ㅎ 현기차 고객대응태도는 사기꾼저리가라 수준인데 ㅎ",1
1101,현기 조립 품질이 갈수록 거지같아요... ㅡㅡ;;;,12
1102,모두트집  라인 ㅎ 장인어른께서 카니발사신다는데 어카지ㅡㅡ?,1
1103,14:43 가만히 있다가 팩트폭력 당하네ㅋㅋㅋㅋㅋㅋㅋ,1
1104,난 왜케 시트가 투톤이면 싸구려같아보이지?,18
1105,싼마이느낑 지리네,2
1106,방충망 아 웃겨죽겠네 ㅋㅋㅋㅋㅋㅋㅋ,3
1107,아귀아파,8
1108,조온나게 까네~ 저정도 금액대에 미니밴이면 가성비 좋지않나?? 맨날 비싼 외제차만 타고 리뷰하니 당연히 어느정도 딸리자나~카니발 오너로써 애들 태우고 고속도로에서 냅다 달릴것도 아니고 저정도면 상당히 준수하다고 생각함!!,2
1109,그럼 몇기통인가요?,1
1110,디젤 살 수 밖에 없잖아 ㅡㅡ 휘발유3.5람서유지비어쩔겨,6
1111,윤대장 탈모 조심합니다~,2
1112,실제로 보니 디자인이 투박함 너무 덩치큰 동네 바보형 느낌..디자인은 전세대가 더 세련된듯,1
1113,박지영 아나운서 불러주세요,5
1114,다리가 길고 직각을 세우니 당연이 의자에서 다리가 뜨지!!!참 팩트라구!됐열의자가 낮으면 당연한거 안인가?,1
1115,ㅎ 많이 까네요 싸지마요,1
1116,ㅋㅋㅋㅋㅋㅋㅋㅋ썸네일 ㅋㅋㅋㅋㅋㅋㅋㅋ극혐이네요 진짜 ㅋㅋㅋㅋㅋㅋㅋㅋ,6
1117,맨 뒷자리 앉으면 없던 폐소공포증도 생길듯...,1
1118,허벅지 뒤쪽은 대퇴사두가 아니라 대퇴이두입니다,10
1119,이 차 레인센서 없지 않나요..?,1
1120,4000천짜리차에  뭘바라는겨?  기왕탈꺼면 휘발유타라  기름값후달리면 아반떼모닝타던가~,1
1121,목소리 너무 커서 부담스러움..늘 너무 흥분된 목소리로 해서 듣는 사람이 피로해집니다.프로답게..좀더 컴다운 하시면서 방송하시는게 좋을듯..,17
1122,가장 매니아층이 많은 차종인데도대체 왜 뻔히알면서 대강만드러 팔아 쳐먹을까 싼것도 아닌데,2
1123,재밌네요 ㅋ,3
1124,이새키는ㅋㅋㅋㅋ  진짜ㅋㅋㅋ,4
1125,쏘렌토 리뷰는 없나요?,1
1126,ㅋㅋㅋㅋㅋㅋㅋㅋㅋㅋㅋㅋㅋㅋ 내가 시승해봤는데 카니발????? 그냥 그급에서는 최고야 어디 비빌차도 없어 어쩔수가 없어 가격봐 5천도 안하는데 엄청나잖아,1
1127,냐팔관은 여자 쟈궁에 붙어있는거요..,4
1128,"카니발급의 해외차도 2,3열 시트 높이조절안됩니다!저 양반은 그냥 국산차가 싫은거야!에휴!디젤차량 소음은 국산차든 해외차든 다 똑같아!",1
1129,모트라인이 아니라  모두까 라인 같네요  ㅋ,1
1130,어떤 기준에서 평가를 한건지 모르겠지만 개인적인 소견이라 하였기에 뭐라고 말하긴 그런데 그렇게 전문 적인듯 말하는건 아닌듯  단점은 단점인데 그단점을 보완하고 맘에 꽉 차는 차량을 원한다면 당신은 최소 1억이상의 카니발을 타면 그단점은 보완이 될듯합니다.  카니발을 2세대 부터 시작하여 15년을  격어온 오너 로써 이정도 가격에 이정도의 변화는 나쁘지 않다고 생각은 됩니다.  유투브 란 특성을 가지고 리뷰를 할때는 좀더 신중한 리뷰를 해줬으면 하네요.  5천만원 미만의  차량이 이정도의 옵션과 완성도라면 충분히 어떠한 동급차량과 비교하여도 손색은 없을듯 하네요.,4
1131,카니발도 하이브리드,1
1132,카니발은  가솔린이지,1
1133,설명이 시끄러워 끝까지 보기가 힘이드네요,4
1134,6분재생하다가 귀가 먹먹해서 껐어요 소리 별로안큰데 조금 톤만 낮게하시면....,1
1135,국토부에서 9인승으로 승인해주면 안된다...정답,1
1136,"ㅋㅋㅋ유료광고포함 문구 적어야되는 법안 시행되면서 우파,뻥태기,윤모씨 겁나 까대기바쁘네??ㅋㅋ언제부터 이분들이 현기를 깟지??ㅋㅋ 그리고 우파 차 한대가지고 3명이서 리뷰하네ㅋㅋ 왜? 이제는 지원안해주디??ㅋㅋ겁나웃긴다ㅋㅋㄱ차한대가지고 돌려가면서 리뷰하고 자빠졌네ㅋㅋ 언제부터 니들이 차한대로 돌려가며 리뷰했냐?ㅋㅋ",5
1137,ㅋㅋ 저거 트렁크 진택이형이 사주한거임,1
