,comments,likes
1022,가격도 완전 저렴하고 차 좋네요 초대박 칠것 같네요 돈이 없어서 아쉽네요,2
1023,너무 비싸다... 요새 국산차 가격 경쟁력은 아예 없는것 같음...,1
1024,1:10 쏘나타 디자이너 현대에서 짤리고 기아갔냐? 스포티지는 또 눈이 왜 저따위냐ㅋㅋㅋ,3
1025,이 가격이면 티구안 할인받고 사는게 낫겠는데요ㅎ,6
1026,음...좀 비싸네,1
1027,아저씨 안녕하세요,1
1028,킹상기니뮤 뜻이 뭔가요 알려주시면 감사하겠습니다.,2
1029,광고  절반 ㅡ.ㅡ 짜,1
1030,"* 스포티지 가솔린 4륜, 투싼 가솔린 2륜* 스포티지, 투싼 1열 차음유리 미적용* 투싼 가솔린 시승기(예전 영상)https://youtu.be/XaddeW7Cjco* 투싼 하이브리드 시승기(예전 영상)https://youtu.be/NhjGv2hQuGY* 스포티지 최신정보 : 스포티지 NQ5 클럽https://cafe.naver.com/prosumernote",6
1031,스포티지 실내는 그냥 미쳤음,2
1032,와 ...내가 알고싶던 정보다 하고 들어왔는데 전혀 비교가 안되는 상황....ㅎ,17
1033,잘 보았습니다^^ 좋은 컨텐츠 감사해요,3
1034,스포티지는디젤이라 단순 비교는 어렵겠네요. 스포티지 가솔린도 시승 기대하겠습니다,5
1035,"스포티지 최초 전문시승기 인거 같네요,, 기다리던 비교시승기 감사합니다.^^",4
1036,투싼 비교 궁금했는데 오늘도 잘봤습니다~,5
1037,실외는 그냥 뭐 투싼이나 스포티지선택하기 어렵고 실내는 스포티지가훨 낫다,13
1038,같은 2륜으로 하면 좋았을텐데 스포티지는 4륜으로 해서 아쉽네요,1
1039,설명 깔끔 하네유~~~!!!,2
1040,다른 시승리뷰와 달리 투싼비교라고 해서 기대했는데 뭔가 난잡한....아쉬워요과속방지턱 넘어가는부분이나 꿀렁임을 느꼈다고 말하는 부분이나 현상을 영상에 안 담고 그냥 말로 설명만하고 편집해버려서 뭐지?하는 느낌입니다,6
1041,스포티지도 옆유리는 차음유리 안들어가있어요~~~~투쌋이랑 동일하게 앞유리만 차음인겁니다....(사실 대부분 차가 앞유리는 차음유리라 걍 마케팅 요소에 불과함;;),1
1042,일반 2륜차만 타본 사람이 4륜차를 타면 어떤느낌이 들까요? 앞뒤바퀴가 좌우로 같이 움직이니깐 움직임이나 코너를 돌때 민첩하나요? 궁금해요,1
1043,연비10~12나온거  좋은거아니예요어떤분은  연비11나온거 가지고  좋은거라고 하더라고요  좋은게 아닌데,1
1044,스포티지 이중접합 차음유리 아닙니다.두 차량 비교 시승 잘 봤어요.,4
1045,아. 소음은 있어야죠   지나친 정숙성좋다는건  좀 문제있네  어느정도는  소리가 있어야지,1
1046,같은 엔진에 2륜으로 하면 더 알아듣거나 구입하는데 도움이 될거같네요;;,2
1047,그냥 디자인 보고 고르세요...2륜17인치와 4륜19인치 코너링 비교는 의미가 없어요...,4
1048,코너슬립은 스포티지는 4륜이고 투싼은 2륜이니 당연히차이가 날수밖에없구요 영상이전반적으로 혼잡하고 정보도 부정확하고 좀 보기가힘들었습니다.투싼 스포티지 비교시승이라고해서 기대하고 봤는데 아쉽네요,5
1049,스포티지가 디젤인줄 알았으면 투싼은 1.6터보 가솔린이고 지금 현재 내가 타고있는건 디젤2.0인데 가속력이 왜케 비슷하지 라면서 바로 알아 차려야 하지 않나요? 디젤이 훨씬 잘나가야 하는데도 말이죠 구독자 1만 차량 유튜버의 한계인가요?,5
1050,ㅋㅋㅋ 2륜 가솔린과 4륜 디젤은 비교가  ㅋㅋㅋㅋㅋ,1
1051,스포티지 2열 3명앉기는 힘들까요?스포티지가 넓다해도 투싼이랑 큰 차이없구 5인은 힘들겟죠?,1
1052,투싼 하이브리드 n라인 이쁘던데,5
1053,4륜과 2륜은 비교하기가 그렇지요... 똑 같이 4륜을 갔다 놓고 하셨서야지요.... 비교시승이라고 하기가 참~~.,2
1054,투싼2륜.스포티지4륜같은차로시승부탁해요.,7
1055,외부 디자인은 투싼.... 내부 디자인은 스포티지..... 투산 네비게이션좀 이쁘게 잘 만들어주지 차 완벽하게 잘 만들어놓고 네비게이션을 왜 매립형으로 만들었데....,3
1056,유투버 자동차 영상을 만드시느라 고생하시는건 알지만... 이런 채널을 하실려면 차에 대한 전문적 지식도 많이  필요합니다. 그냥 느낀점만 가지고.. 영상 만들어서 올리면 그건 누구나 할 수 있는거거 든요... 물론 사람마다 그런 느낀점이 다르지만.. 요즘 유투버 채널을 보면 진짜 차에대한 전문적 메커니즘을 알고 하는 건지 모르겠네요... 몇개 채널 뺘고 대부분이 다 그렀습니다.. 채널이름은 그냥 생략하겠습니다. 50보 100보라서요!!.,1
1057,그냥 투싼 vs 스포터지 오너들 서로 싸워라 밖에..?,3
1058,옵션똑같이해서 비교하삼,2
1059,어휴 그냥 보고 고생했어요 감사합니다 하면 되지 프로불편러들 왜케 많냐 다 꼰대들밖에 없나 각박한 세상에 각박한 티좀 내지마셈,7
1060,똑같은 조건에 유틉 하세요..  역시 구독자 많은  자동차 유툽들이랑 급 차이가나네 차 유툽.  비교 분석 자체가 딸리네요.. ㅋ  2륜이랑 4륜 가지고 비교분석을 하시네요ㅋㅋ 아직 차 유툽 초보운전 이신듯하네요.. 솔직히 보고 비교분석 자체가 안됨,6
1061,"Sorry, i don't know your language and don't understand you. But i want to know soo much. Which one is better? Mean, handling, steering, suspension comfort and finally insulation (road and vind noise) Can you axplain please? Thank you.",2
1062,차량스펙 제대로써주셨으면..,5
1063,드디어!!!!!,3
1064,운전에 집중하시지..주행중에 카메라는 왜보는건지? 그리고 편집다하고말로만 설명할꺼면 그냥 차타지말고합시다!,6
1065,투싼2륜.스포티지4륜.또캍은차로시승해주세요.,6
1066,저만그런가요? 마스크 계속 내려가서 올리는게 한번 보이기시작하니깐 계속신경쓰이네요 ㅎㅎ..,2
1067,디젤  가솔린 알핑엠 게이지 보시면 압니다요,2
1068,둘다 이륜인가요. 스포티지만4륜인가요??댓글보니. 혼란이.,5
1069,스포티지하브 쏘렌토하브 비교는없느영,2
1070,마스크 하나 새로 사세요 ㅠㅠ,5
1071,자동차 전문기자신가여?,3
1072,비교의미가 없음,5
1073,기아 차는 ㅅㅂ 노면소음 최악임,3
1074,아부지 몇달전에..투싼 풀옵가셨는데스포티지 실내보시고..기다릴걸후회하시는중ㅡㅡㅋ..기다리라고뭐라뭐라하니깐...니차보단 이쁘다하심ㅡㅡ,2
1075,결론이 뭐에요 그래서 ㅋㅋㅋㅋ누가 요약좀,1
1076,같은스펙 아니라 의미없는 영상,1
1077,스포티지가더좋아보여,1
1078,투싼 문닫을때도 텅소리  오지게나는데 말다햇지 ㅋ 원가절감을 대체 어디까지한거야,2
1079,졸품을 포장하시는 기자님의 노고가 느껴지는 시승기 잘봤습니다.,1
1080,김한용 기자님의 기사와 동영상들 정말 좋아합니다. 언제나 한결같은 마음으로 응원합니다.!!!,2
1081,김한용 기자님이 갈수록 리뷰가 더 섬세해 지시는 듯 하네요. 작은 단차부터 신경쓰기 힘든 사소한 부분도 놓치지 않고 리뷰해 주시네요. 항상 좋은정보 감사합니다.,8
1082,솔직 담백한 방송 잘 봤습니다^^,1
1083,깔끔한 리뷰 항상 잘 보고있습니다앞으로도 질 좋은 영상 계속 보고싶네요 번창하세요,1
1084,시승기리뷰중 그나마 소비자랑 기업 중간을 합리적으로 하는게모터그래프같아요,4
1085,역시 김한용 입니다.매의눈  유도리있게 할말은 다하고 마무리도  잘하시네요.애썼네요.시청자들도 그대 마음 잘 알고 있습니다.,4
1086,한용기자님 늘 잘보고있습니다~  시간나시면 티볼리 디젤로 한번 시승 부탁드립니다~,1
1087,공감가는 시승기 잘보고 갑니다.,1
1088,영상이 정말 깨끗하네요. 4K인가요? 카메라 스펙이 궁금합니다... 캬....,4
1089,시승기 잘보고잇어요 ㅋㅋ김한용기자님꺼 항상재밌음,1
1090,오~ 디자인이 사진보다 정말 이쁘네요ㅎㅎ저희 패밀리카로 장만하고싶은생각이네요~풀옵션이 가격이 어느정도인가요??혹시ㅎㅎ,2
1091,현재 오너고 타고 다닌지 한달 정도 되었는데 상당히 만족스러움. 잘 나가고 잘 서고 잘 돔. suv라서 둔할거라고 생각했지만 딱히 기동력에 있어 세단과 차이를 모르겠음. 내부 인테리어도 마음에 들고 영상에서 지적한 대로 안전벨트 너무 민감함 ㅋㅋㅋ 천천히 매야함 오디오 음향이나 블루투스 지원은 울 엄마 BMW 보다 좋음 다만 중상 옵션으로 하니까 2천 중반대 차가 3천까지 감;; 국산차 옵셜질은 뭐 각오 했으니까 감수 할 수 있음. 아무튼 스포티지~ 편하게 타고 다니기에는 모자랄게 없는 차임. 다만 시내주행 연비가 생각보다 떨어짐...,8
1092,김한용기자님의 설명 아주 좋았습니다.,1
1093,"""와 타이어 19인치를 달았어....와......19인치가 얼마나 스포티한 능력을 보여줄지 되게 걱(ㅇ_ㅇ;...).....기대가 많이 됩니다."" ㅋㅋㅋㅋㅋㅋㅋㅋㅋㅋㅋㅋㅋㅋ",20
1094,디자인이 너무 독특해서 이쁜건지 어떤건지 아직 감이 안오네요..,2
1095,다카르랠리 나갔던 스포티지가 아직 있구나!! 영종도에서 황운기 단장이 직접 시범주행하는걸 봤었는데.. 어린 나이에 정말 충격적인 모습이었는데... 속도며 소리며...,1
1096,객관적이고 직선적인 평가가 모터그래프의 장점이자 큰 매력이라고 생각하는데요.저번에 찐빠먹은 이후로 부정적인 평가를 했다고 해서 김한용기자의 개인적인 생각이라고 자막까지 올리는걸 보면 기업의 압박이 만만치 않은것 같네요.그럼에도 불구하고 유익하고 재밋는 시승기를 만들어 주심에 항상 고마워하고 있습니다.,2
1097,항상 잘 챙겨보고 있습니다!!!벤츠 b클래스 한번 시승해주세요^^,1
1098,ㅋㅋ 그럼 제가 찾는 차네요 ㅎㅎㅎ 아 사고 싶다. ㅋㅋ,1
1099,김한용 기자님~ 만약에 출고를 받았는데 저런 단차가 눈에띄면 어떻게 처리해야하나요...? 요즘 시승기 보면 참 저런 찜찜한 부분이 많이 발견되더라구요 _...,2
1100,리뷰감사해요^^,1
1101,개인적이지만 외관은제맘엔안들어도 실내는 맘에드네요,1
1102,기아 실내 디자이너한테 인센티브줘야해 ㄷㄷ,1
1103,전에 이영돈피디 쏘울 시승기 보고 완전 실망했는데 모터그라프는 그렇지 않은것같아요. 소비자 시청자는 보면 딱 압니다. 이게 홍보용인지 제대로된 시승기인지. 모터그라프 흥하세요!,1
1104,항상 신경쓰이는 보노보니핏... 계속 시선이 가네여 ㅎㅎ,2
1105,저는 개인적으로 투싼보단 기아 스포티지가 좀더 나은거같아요투싼은 시내주행에 적합하고 스포티지는 고속도로 주행에 적합한거같아요괜히 스포티지가 고속도로의 제왕이라고 불리는게 아닌거같더라구요 코너링은 스포티지가 좀더 안전성잇고 실내 디자인도 스포지가 좀더 나앗어요외관은 처음딱 봤을대 투싼이 좀더 낫고 계속보면 스포지가 이상할듯말듯 하면서 묘한매력이 잇더라구요,2
1106,"직진한다니, 다행이네요 아반떼는 우측으로 쏠리더라구요~",1
1107,오늘도 김한용 기자는 현기차의 홍보대사로 열심히 활약하네요,2
1108,기아 ㅠㅠ 경영좀 신경써서 현대에 먹히지 않았다면 더 좋았으련만... 그래도 요새 선전하고 있으니 다행이긴 하지만... ㅋㅋㅋ 근데 사진빨 정말 안받는 차에서 공감했어요 ㅋㅋㅋㅋㅋㅋㅋ,2
1109,김한용 기자님! 혹시 쉐보레 카마로 시승기도 가능할까요?? 부탁드립니다!,1
1110,지인이 새차 뽑아서 직접 타봤는데 주행성능이 물렁하다고 하셨지만 나처럼 딱딱한걸 그닥 선호하지 않는 사람들에겐 적당한 세팅인듯. 그냥 도심에서 그럭저럭 타기에는 나쁘지 않음.  대신 이름을 바꿔야함. 스포티지 말고 패밀리티지로.,6
1111,차는 점점좋아지는데 디자인은 점점 후퇴하는 느낌 이전 디자인이 더끌리는 느낌은 멀까요.....,9
1112,스포티지를 보면 맨날 페라리닮았더고 생각함,4
1113,4륜은 어떤지 알고 싶네요..,2
1114,투싼이 이긴거 같네요 ㅎㅎ,1
1115,김한용 기자님 할말이 더 있을거 같은데 자제하고 있다는 느낌을 갖게 되는건 비단 저 뿐일까요 ㅎㅎ항상 잘 보고 있습니다!,3
1116,"범퍼와 휀다 단차, 어휴 아직 멀었당 ㅠㅠㅠ",1
1117,스포티지는 실물이 깡패임,3
1118,"요즘 일제나 유럽차나 모두 디자인이 무난한 쪽으로 비슷해져가는 거 같아요. 그런 점에서 각각 개성이 없어지는것 같아 아쉬운데,, 그나마 스포티지는 나름 자기 색이 있다고 봅니다. 앞모습이 호불호가 있지만 저는 나쁘지 않은거 같아요...",3
1119,스포티지 1.7시승기는 언제쯤 볼수있을까요?,1
1120,"헤드램프가 다른 차들에 비해 높은 곳에 위치한 거 같은데, 그 때문에 야간에 세단 운전자의 시야를 방해할 가능성은 없나요? 자기만 편하면 된다는 이기주의가 너무 만연해 있어서 요즘은 램프의 각도를 높이는 튜닝도 많이 하는 거 같더라구요.",1
1121,색이 너무이쁘네요..,1
1122,very beautiful suv..,1
1123,엔진떨림은 물컵에 물을 담아서 보여주는걸 본것같숩니다!!,1
1124,근데 파노라마 선루프는 문제 많은 선루프 아닌가요? 쉽게 깨진다는데 그문제가 다 해결낫는지 궁금하네요,1
1125,스포티지 2.0디젤 하고  요번에 새로 나온  2.0가솔린 비교 해주세요 부탁드릴게요,2
1126,김한용 기자님 팬입니다. 아놔 뒷편에 녹화방송이라 여과없이.. 자막에서 빵터졌네 ㅋㅋ.. 처음에 외관에서 칭찬이 너무 많길래 이럴분이 아닌데.. 했는데 주행감각에서 엄청 까시네요 ㅋㅋ 솔직한 리뷰 감사드립니다,1
1127,기아차 죽이기인가요? 승차감에서 같은 플랫폼인 투싼보다 물렁하다니... 단단한 기아의 명성에 금이 가네요..,1
1128,@motor grasp 저 궁금한게 국산외제 통틀어서 4인 패밀리세단 추천하는게 뭔가요? 가솔린 디젤 하나씩 추천해주세요,1
1129,김한용기자님 스포티지나 쏘렌토 둘중 차 구매를 하고픈데  주행감각과 실내편안함은 역시 쏘렌토가  더 낫나요? 아님 두대가 서로 비슷한가요?( 물론 두대가 급이 다른건 알지만 스포티지 최고급형으로 올리면 쏘렌토랑 가격이 비슷해져서... 궁금합니다.),1
1130,설계성능에 비해서 조립품질은 아직도 갈길이 멀었다는걸 느끼네요. 부끄러운 노조입니다. 밥버러지는 되지 말아야겠죠.,9
1131,디자인 첨엔 이상했는데 볼수록 나쁘진않네,48
1132,뭔가 현대는 디자인 방향이 아우디 느낌으로 가고 기아는 포르쉐 느낌으로 가는듯,1
1133,팬이에요 기자님,1
1134,시승차는 풀옵이겠지요 현기차 얘기할 때 풀옵가격 말하면 풀옵으로 사는 사람 얼마나 된다고 풀옵가격 얘기하냐 하는 사람이 많은데 정작 이런 대외적으로 보이는 건 풀옵이라. .,2
1135,4세대 앞에 디자인은 마칸을따라한 느낌을 지우긴 어렵네요차라리 4개 LED등이 없더라면 그나마 이질감이 덜했을텐데 디자인에서 k5보다 못하네요,3
1136,매의 눈으로 보신 김한용기자님 항상 잘 보고 갑니다.,1
1137,스포티지 맘에들더라고요 대리고온지 6일됐는데 ㅋㅋㅋ,4
1138,트렁크에 안전벨트는 뭔가요,1
1139,저도 k5에는 다섯가지 심장을 강조했으면서 스포티지에는 한가지 심장만 허락하는 현대기아차 속내를 모르겠네요. 하드한 차량을 선호하시는 김한용 기자님의 아쉬움이 여기까지 느껴집니다. 그리고 김한용 기자님 개인적 견해라는 자막도 ㅋㅋ,1
1140,쏘렌토도 실내가 정말 좋습니다,3
1141,색이 너무이쁘네요..,1
1142,기자님 할말을 다 못한다는 그런 느낌을 지울 수가 없네요. 현재의 대한민국에선 어쩔 수 없는 건지...,21
1143,"제 눈엔 진짜 디자인은 갑인데,주행성능이 구린가보군여",1
1144,느낌을 롤스로이스와 비교하면어떡합니까,5
1145,요즘 김한용 기자님 리뷰가.. 상당히 뭐랄까....건방진 느낌이 듭니다.전 그렇게 느꼈습니다. 이유는 말하지 않겠습니다. 제가 느낀 감정 그대로.. 말씀 드리는 겁니다. 독자들 반응도 시원찮았고.. 제대로 된 영상과 편집도 없이..리뷰했었던 그때 초심으로 돌아가는 것도 나쁘지 않을 거 같습니다. 오래전부터..기자님 리뷰 봐왔던 독자의 충언입니다.,14
1146,"아직 스포티지 1.7은않나와서 인터넷에서도 시승기잘안나오고 동영상시승기도잘안나오네요 다음에 스포티지 2.0단독으로취재좀해주세요 ! 부탁드립니다, 영상잘보고있습니다",2
1147,녹화방송 너무 여과없이 나오는군요 ㅋㅋ,2
1148,"다 좋은데..  살짝 방어적인 자세의 리뷰같았어요. 조금 사린다는 느낌이었다랄까, 조심스러웠구요. 동영상 시청전에 기자님이 쓴 기사내용을 봤었는데..기사내용과 다른 부분도 있구요.. 음...  직접 시승한번 해봐야겠어요. 투싼은 dct의 주행감각 빼곤 특별함은 못느꼈는데  실물도 궁금하네요.",3
1149,올뉴투싼이vs2017녕형스포티지 어떤게 좋을가요고민이네요,1
1150,아~디자인 ㅠㅠ,1
1151,닛산 쥬크 디자인을 갖다 때려박았네 ㄹㅇ;;,1
1152,2~3천 만원 짜리 차량 타면서 무슨 이것저것 바라는 게 많은지....,1
1153,혹시 새로 출시된 트랙스 디젤 리뷰하실 생각은 없으신가요?,1
1154,님들아 2분 40초 부터 보면 시동키면 켜지는 라이트가 반짝 거리는데 그건 어떻게 하면 깜박 거리는거에요?,1
1155,ㅇㅏ니 오토기어에선 코너잘돌고 거동이좋다는데? 웬만한 보급형디젤세단보다 잘나간다는데?,2
1156,아 앞테만좀 좀..더 바꿔서나왔으면 좋았을텐데 뒤는 이쁘네요,1
1157,사진빨이 확실히...근데 어느차던 직접봐야 아는거죠 실물과 사진은 확실히 다르니,1
1158,스포티지 너무 이쁜데...나는 기아 로고가 너무 안이쁜거 같아요ㅠㅠ,1
1159,정면샷 봐 ㅋㅋㅋㅋㅋㅋㅋ,1
1160,i20이나 한국출시 기대,1
1161,"근데 한국 시승기는 왜 한국차와 독일 프리미엄 차를 그리 비교하는건지 모르겠음. bmw, 벤츠 이런거랑 왜 기아, 현대를 같은 선상에서 비교할려 그러는지 모르겠네",17
1162,쏘나타 플러그인 하이브리드 시승기 부탁드려도 될까요? 하이브리드시승기만 많지 플러그인하이브리드 시승기는 거의 찾아볼수가 없네요..,2
1163,시작부터 피파 강화하는줄 ㅋㅋ,1
1164,진짜 앞디자인 와... 그냥 k5 스토닉 k7 짬뽕시키지 왜 저따구로 한거지,1
1165,성시경 + 손석희 + 이경규,33
1166,올뉴쏘렌토 타는차마다 브레이크~밀리다 안밀리다 하던데 분명문제있다.,2
1167,김한용기자님 이자리를 빌어 포드 익스플로러 16년식 시승기도 부탁드려도 될까요??,1
1168,쏘렌토 시승기는 언제하나요 기자님?,2
1169,우리삼촌이신형쏘랜토타는데 쏘랜토가더 좋은듯,1
1170,모터그래프 리뷰 항상 잘보고 있습니다^^ 근데 댓글들 보니 참 가관입니다. 인터넷으로 주워배운 지식으로 뭘 그렇게 논하고 싶어서 안달인지 ㅋㅋㅋㅋ 카이엔이 어쩌고 마력이 어쩌고 ㅋㅋ,12
1171,2.0 엔진 프레스티지 인가요??,1
1172,잡소리 최강차...,2
1173,와~차 가격이 얼마인데 가스리프트 가 안달려있냐,6
1174,나만 디자인 맘에 안드는건가?낮은 세단에 저 눈을 달면 정말 예쁠것 같은데...약간 맥라렌 느낌으로?,1
1175,앞모습 빼곤 다른거 다 괜찮게 나왔음인정하는데승차감이니 주행감이니 이런거 논할 때는 아닌듯전 모델일아 거의 비슷 ㅋㅋ,1
1176,난 앞모습 진짜이쁘던데ㄷㄷ,2
1177,구라바겐 망한듯 현대 기아야 힘내^^,3
1178,오스포티지 저희차도 2018기아스포티지  2.0인데 ㅋ,1
1179,지동차전문기업 기아. . .문어발대기업에 먹히는 순간 끝난거지,1
1180,돈 따라 집잇고 차잇다 .  왠만하면 본인 의 재산능력수준 에 맞게 만족하고 타자  레인지로버 가 갑이라는 거 모르는사람이 잇냐?  스포티지 3천만원 딱 그만큼만 하지 그이상도 그이하도 아니다 모든것이 그렇듯이 비쌀수록 좋다는건 누구나 다 아는사실이다,15
1181,몇일전 칼치기당해는데 뒤쪽깜빡이위치가 너무아래에 있어 잘안보임 방향등도 겁나작고,3
1182,체어맨시승되나요?ㅠㅠ,2
1183,k5 는 시승기 없으신가요??,1
1184,인간적으로 현기는 기자들한테 자유롭게 쓴소리하고 리뷰해도 터치하지말자..소비자들이 이런리뷰보고 평가의 기준으로 척도를 어느정도 삼는데.. 이런데 터치하면 대체 80년대 전두환정권처럼 입막음하는거나 다름없지..,2
1185,가솔린 터보는 없는데 ㅋㅋ 2.0 그냥 가솔린이요,1
1186,더뉴가 아니라 더 SUV 아닌가요?,1
1187,기자님 오타가 났나요 더뉴가 아니라 더 SUV .아닌가요?,2
1188,hello morgraph u make test Optima new test drive with 2.0 245 hp let me know thanks.. or 1.6 177 hp,4
1189,투싼이 더 낮다...,1
1190,한국에 현대슈퍼카 N인나요?,1
1191,저기...바지 좀..ㅋㅋㅋ,4
1192,woot is this car already on sale in Korea?,1
1193,"어, 또 리뷰않하시네요.",2
1194,이게 벌써 4년 전이네,2
1195,리뷰 않해주시네요.,1
1196,쉬트프 업 쉬프트 다운이잇네...,1
1197,거의 갤로퍼급,1
1198,사고싶다..ㄷᆢ,1
1199,김한용 기자님 중국판 마칸을 시승하셨나요 리뷰 잘봤습니다 ^^,1
1200,물침대가 부활했네요^^,4
1201,암만봐도 디자인 구린데..,1
1202,이게 벌써 5년 전이네,1
1203,앞이 이상함. ...,9
1204,돈벌라고 리뷰찍는건 아는데그렇다고 양심은팔지맙시다..,2
1205,불만 있으면 안 사고 안 타면 되잖아.꼴불견이네 진짜 ㅉㅉ,1
1206,차팔기전에 저분한테 시승안시키낭? 저분차는 외제차 타겟찌?엉?,1
1207,디테일이고 뭐고 전면은 정말 못생긴거같네요,1
1208,스포티지 타고다니는대 디자인 너무맘에듬 ㅋㅋㅋ,5
1209,suv의 뒤를 누른 듯한 디자인이 별로네요. 앞의 높이를 유지하는 디자인이 더 나아 보입니다.,1
1210,나 참 어이없이 빠네. 역시,1
1211,English subs pls,1
1212,아니 이차는 왜 핸들 놓아도 똑바로 직진하지 ㅋㅋ 이게 정상인거죠? ㅋㅋ,1
1213,현대차 매니아네 ㅠ말도 안되는 소리하고 있네,1
1214,젊은 사람들이 보기엔 디자인 참신하고 좋은데 늙은이들은 왜케 난리지 ㅋㅋㅋ,3
1215,대체멀기준가지고투싼이이겻다고하시는지이해가안가네요....오히려투싼이투박한데.....전스퐁이가이겻다고봐요,9
1216,차를  설명할때  또는 리뷰할때 차의 기본기나 성능 등을 설명해줘야지.. 맨날 사소한 트집 잡고 늘어지기   쫌생이도 아니고  와이퍼 단차 등등  그런건 조립불량이지 차 본연의 성능이 아니라는거지요  본인이 무슨 검수자도 아니고  유저들이 원하는건 진정한 시승기 랍니다   외부 모양은 우리도 티비나 잡지나 브로셔 가지고 충분히 볼수 있는데 엉뚱한 걸로만 밀어붙이는 보여주기식 리뷰는 이제 식상합니다,1
1217,아무리봐도 앞모습이 최악인데,7
1218,괜찮은거 같기도 하고 이상한거 같기도 하고..,8
1219,"할말 못하는 시승기. 대기업(자본) 광고주 이익에 반하면 살아남기 힘든 것이 대한민국 언론의 현실. 누굴 탓할 것이 못되지만, 그래도 아쉽습니다.",1
1220,김한용기자님 입맛에 안맞으신거같아보여요 억지로시승기하시는거같은...나쁜뜻은아니에요,1
1221,쏘렌토시승기는 왜 없는거임?,1
1222,댓글 왠만해서 안쓰는데 저도 실제로 가서 봤지만 외부디자인 너무 안타깝습니다!디자인이라 호불호가 있겠지만. 아닌거는 아닌겁니다!,8
1223,왜자꾸 멈춰요 다른 리뷰는 이상없는데 모토그래프 리뷰만 다 화면이 멈춰요 소리만 나와요!,1
1224,승기기자용으로 특!별!히! 방음이라든가 다른부분에 신경을 쓴걸지도... 망둥어 페이스는 계속봐도 영 아니네요 낚시대를 드리우고싶은!???,2
1225,문화방송에서 방영 시트로앵 미쓰비시... 이후 안함 다카르랠리 보여줘,1
1226,"부드러운건 뭐고, 딱딱한 것은 뭐죠? 비유적인 설명이라서 뭘 표현하는지 모르겠어요.",2
1227,헨들 잠기나요? 이게 제일 큰 문제인데 이건 안 다뤘네..ㅋ,1
1228,Too bad no English subtitles,3
