,comments,likes
587,이걸보고 구독 좋아요를 안누르는 사람 있나요..?우리나라에 이렇게 좋은분들이 아직도 있다는게...대단합니다 제가 할수있는건 구독 좋아요뿐이 없내요...ㅠ ㅠ오랜만에 따뜻한영상보고 갑니다,1
588,정말  멋지십니다 카맨님들  감히말하길 진정한  영웅입니다,1
589,감동적이네요~카맨식구들과 지원해주신분들모두 대박나세요~오늘따라 아버지생각이 더 나네요~,5
590,캄보디아 사시는 한국 유튜브채널보다 앤진만 가지고 차를 만드는거 보고 우리나라는 없나 그랬는데.. 오래됀차를 살리시는거보고      다른쪽 기능인으로써  엄청난  감동과 그고생길이 눈에 훤희 보이는듯하네요,1
591,역시 보통분들은 아니었네요......항상 잘 보고 있고....번창하시길.....,1
592,아버지가 출고하실때 모습그대로 복원하셨네요! 인트로 가슴 뭉클했습니다..,2
593,대단하십니다 정말..!,1
594,와... 진짜 환상적이네요.,3
595,모두 다 고생하셨습니다~  좋고 멋진영상 잘 봤습니다~!!,4
596,정비사분들이 가지고 계신 구형차종들 보면 파리가 미끌어 질정도로 병적관리...신차처럼 좋긴하더군요.,1
597,"그제 아버지 49제를 마치고 영상 처음부분 인트로 맨트를 듣고 있자니 저절로 눈물이 납니다..""아빠 생각이 나서""너무 뭉클한 한마디 입니다.너무 감동적입니다.카맨 페밀리 진심으로 응원합니다",58
598,우리 어머니 옵티마로 운전배웠는데.. 다시태어난 옵티마보니 기분이 너무 좋네요 ㅠㅠ,1
599,멋지네요! 훌륭하신분들이 많은것 같습니다,2
600,우리나라는 기술자에 대한 대우가 너무 안좋습니다. 그냥 정비사이고 기능인이라뇨 누구나 할 수 없는 기술을 가지신 훌륭하신 분입니다. 자부심을 가지시고 일하시는 모습을 보고싶습니다. 좋은컨텐츠 잘보았습니다. 감사합니다.,2
601,"아 감동입니다. 좋은 사람들, 고마운 이웃들. 더불어 살아가는 것이 이런 것이구나 느꼈습니다. 박수를 보냅니다. 이런 좋은 영상을 볼 수 있게 해주셔서 정말 감사합니다. 구독 좋아요 누르고 갑니다.",1
602,마음이 담긴 작업이네요 흥하시길 기원합니다,1
603,하아....자동차유튜브 보면서 뭉클거려 글썽인적은 처음이내요..정말 뜻 깊은일에 선뜻 도와주신 분들 정말 감사드립니다.,5
604,마인드나 실력이나 정말 멋지십니다.귀회가 주어진다면 저희 아버지 차도 해드리고 싶네요ㅠ,1
605,고생하셨습니다 정말 멋져요 ,1
606,"너무나 훌륭한 영상 만들어주신 보답은 구독입니다,,, ^^",2
607,너무나 감동입니다.. 멋지십니다.마지막 복원다 되고 첫 시동 거는 장면이 멋지게 표현됐으면 끝내줬을텐데.. 아쉽습니다.ㅎ,1
608,자동차의 모든것 당신들은 진정한 정비사이며 정말 너무 멋진 분들입니다 수고하셨어요~ 정말 존경 합니다~^^,1
609,  따뜻한 마음이 절로 영상에  묻어 납니다  모두 모두 수고하셨습니다 ,14
610,완전 새차가 되었네요!! 옵티마 멋진 차군요! 잘 봤습니다,1
611,기술이 진짜 좋으시네 대단하다,1
612,감동적인 스토리 감동적인 차량신차셋팅 영상감사히 잘보고 갑니다늘건강하시고 행복하시고 이번고생하신 정비사님 큰복이 함께하시길 간절히 바랍니다  대한민국 최고 명장이십니다 ^^,1
613,"현직 썬팅 매장을 운영하고 있습니다. 19년 전 저희 아버지께서 처음으로 뽑으신 새 차가 옵티마였습니다. 어머니와 형을 태우고 막내 아들 군 면회를 왔었는데 그때 아버지의 그 마음이 아직도 생생히 느껴집니다. 지금은 돌아가셨고 저는 다른 차를 운전하지만 제 형님께서 아직도 아버지께서 남겨주신 옵티마를 타고 있습니다.흔하지 않았던 1.8리터 가솔린 엔진에 실내 시트도 직물 시트였던걸 보면 아마 가장 최하위 트림을 사셨던 것 같습니다.당시 다른 매장에서 직원으로 일하던 시절이였기에 항상 형편이 어려웠고, 언젠가 사장님께 부탁드리고 제가 직접 전부 가죽시트로 교체한 적이 있었는데 아버지께서 살아 생전에 해드렸으면어땠을까 하는 후회와 아쉬움이 많이 남아있습니다.저도 옵티마에 썬팅, 경보기, 후방감지기, 가죽시트, 블랙박스 등등을 직접 제 손으로 작업했는데 이 영상을 보니까 또 아버지 생각이 많이 납니다.유튜브 보면서 썬팅 교체를 제가 해드렸으면 어땠을까 하는 생각도 드네요.영상 잘 봤습니다. 감사합니다.",2
614,"공업사에서 도장, 도색이 저렇게 이루어지는걸 처음 봤네요.ㅎㅎ",1
615,너무 멋있지만 너무 걱정된다 ㅠㅠ 카맨님 본인도 챙기시고 수리비도 받으셨으면...,9
616,"멋있네요.. 감동입니다. 차 고장나면 여기로 수리하러 가보고 싶은데, 너무 머네요~",1
617,고객님께 차량인도 하는 영상도 보고싶어요 ^^,6
618,마지막에 차주 반응 궁금하네요 기뻐하는 모습까지 담았다면 최고일듯 싶습니다^,1
619,와 정말 영상 편집 대단하시네요.촬영이랑 어떻게 전문적으로 하시는지 궁금합니다..,1
620,여러 사람들의 노력이 담긴 정말 멋진 선물이 되었네요항상 영상 잘 보고 있어요,1
621,멋있네요   모든분들이 건강하세요 ~^^,1
622,좋은일하셨습니다 볼때마다 정말 재밌고 유익한정보 얻고가는데거기에 마음까지 따뜻해지네요 베푸시는게 많은만큼 더 잘되실거라고 생각이됩니다^^,1
623,올드카에 새 생명을 넣으셨네요.어려울때 큰 결정을 하신 카&맨 분들과 주변 분들의 도움이 아버지 의 유물 을 지켜드릴수 가 있었습니다. 그래도 참 따뜻한 세상 입니다....이래카~~ 기본기 탄탄한 곳입니다. 오! 카맨 스티커 가 있었네요 욕심나네요^^,71
624,저의 첫차 이긴 한데... 중고차 가격이 아예 안나오는 차를 저렇게 부활 한다는건....  암튼 대단합니다.,1
625,"감동의 물결입니다. ,그리고 모든 정비파트 담당자분들에게 경의를표합니다.^^",1
626,와.. 지린다.. 정말 대단합니다!,1
627,와........ 내 첫 차 로체도 이렇게 탈바꿈되면 좋겠다 ^^ 차 색상이 정말 이쁘네요 ^^,1
628,우와 진짜 보통일이 아니다지나다가 영상 보게 되었는데 최고다구독 합니다,1
629,카맨샆 사장님외 식구분들 존경 합니다  ㆍ앞으로 흥하시고 성공 하세요 ㆍ카맨샆 사랑합니다  ᆢ,4
630,와  굿 모든분들 존경스럽네요^*^,1
631,사장님과 도움주신분들 모두 존나 멋있다!!이게 남자지,1
632,정말 대단들 하십니다! 멋지세요~~,1
633,"정말 멋진 카앤맨 식구들, 함께 다른분야에서 협조해주신 멋진 분들께 감사의 말씀을 드리고 싶네요~ 멋진 동영상으로 편집해주신 편집자께도 수고의 말씀드립니다~보는 내내 뭉클했습니다~",1
634,넷플릭스의 다큐 러스트 밸리 브라더스를 보는 느낌이 들었습니다.자동차 복원은 추억을 되살리는 것이라고 생각됩니다.잘 보고 갑니다. 화이팅!!,1
635,정말 좋은일하셨습니다   보고만있어도 감동입니다,4
636,"""아빠 생각"" 눈물 나네요 ㅜㅜ 너무 멋집니다        도움주신 모든분들 감사합니다",1
637,새 생명을 불어 넣어주심 멋집니다.,29
638,저도 비슷다면 비슷한일을 합니다. 대표님의 진정성을 보고 많이 반성했습니다 우리나라 최고~!!기술자는 실력뿐 아니라 따듯한 마음을 가진 대표님 인것같습니디.,1
639,시간 가는 줄 모르고 봤네요ㅎㅎ다들 멋지십니다ㅎ,1
640,14년식 K7 3.0 lpi 차주입니다냉각수 누수때문에 엔진 헤드 수리 판정 받았고 견적 150~200 받아 놓았던 상태였는데 어찌어찌 자동차의 모든것 채널을 접하게 되었고 영상에서 나오는 대흥보링 업체에서 수리하고싶어서 전화 드렸는데 대흥보링 사장님이 제 고장사유가 기아자동차 리콜 사유라고 기아자동차 오토큐에 방문해보라고 말씀해주셔서 (전화로 20-30분 너무 친절하게 상담해주셨어요) 방문하여 무상 수리 판정 받고 현재 차 입고하였습니다. 자동차의 모든것 가족분들 이하 그 동료업체(대흥보링) 분들 모두 정말 감사드립니다. 받은 이 은혜 꼭 갚겠습니다^^대박 나세요 모두!,4
641,하... 저도 금전적 여유만 좀 있었다면 only 수동만 고집하시던 아버지가 암투병으로 운전이 힘들어지시자 오토+경제성 따진 프라이드 디젤 사놨던거 풀리스토어하고 계속 굴리고 싶었는데 현실의 벽이 ㅠㅜ,1
642,인트로에서 울컥해서 잠시 영상멈추고 생각에 잠겼었네요.. 어렸을땐 자식이생기면 뭐든 다해줄거라생각했습니다. 어느덧 30대에 접어들고 가족이생기니 현실이란 벽이 너무 매섭고 힘들더군요.. 가끔 아들래미 장난감사주러가면 제일크고 제일좋은 장난감을 사주고싶지만 요즘 장난감들 가격이 장난아니더군요....사달라고 떼쓰는 아들 겨우겨우 달래어 그나마 값싼 장난감으로 겨우 맘을 달래주고 집으로 돌아가는길에 제맘은 찢어졌습니다..ㅜㅜ 열심히 일해서 우리아들 갖고싶은거 하고싶은거 다해줄수있는 멋진아빠가 되고싶습니다.,1
643,제가 구독하고 후회하지 않게 늘 좋은 영상  만들어주셔서 감사합니다. 오늘도 따뜻하게 보고 갑니다!,4
644,정말 좋은일 하셨네요 좋은 영상 감사합니다,1
645,정말 대단하십니다!,1
646,좋은 일 하시네요~~인정이 살아있음을 느낍니다.~~Good!!!,1
647,너무 감동적 입니다. 다시 한번 아버지를 되돌아 볼수 있었던 영상입니다. 정말 감사드립니다.,3
648,리스토어는 감성이 없으면 할수없는 작업인듯합니다. ,1
649,제 옵티마도 저렇게 해주고 싶네요ㅜㅜ 영상 잘볼게요~,5
650,와 ~~ 차 한대를 그냥 새로 조립하시는거네요 존경합니다,1
651,"‘아버지’란 단어만 들음 쨘~해 집니다. 제 나이 27살 때 돌아 가셨는데 벌써 20년이 흘렀네요. 보여 드릴께 참 많은데 말이죠~ 우연히 좋은 영상 보고, 댓글 같은거 안 남기는데~ 아버지의 추억을 선물해 주신 카맨패밀리분들 멋지십니다.차주님도 추억의 차 잘 관리하셔서 오래 오래 타셔요~^^오늘 따라 아버지가 더 보고 싶네요.",1
652,원래 댓글 잘 안다는데 정비하시는 분들 정말 맥가이버 저리가라 대단하십니다. 그 열정 정비소 번창하실 겁니다. 하늘복 많이 받으세요. ! 우리나라 최고의 정비팀 같습니다.,2
653,와  진짜 감동이네요  명장이십니다,2
654,안녕하세요 대표님 멋진영상 감사합니다 01년식 옵티마오너였습니다^^,2
655,카맨의 엄청난 프로젝트 응원합니다 ^^,4
656,저는 그렇게 뛰어나지도 않은 그냥 기능인 입니다...실럭이 뛰어나면 경쟁자가 생기고 인성이 좋으면 조력자가 생긴다..각기 다양한 파트의 전문가 님들이 함께 작업을 해나가는걸 보고 너무나 좋은 영향력을 받고 갑니다^^  최고입니다,1
657,아빠생각나서요가 뭔가 뭉클하네요 카맨식구분들진짜 존경합니다,9
658,제가 자동차 모든 영상중에 가장 훌륭한 영상인거 같습니다 정말 수고하셨습니다,1
659,멋집니다.시트까지 깨끗히 청소했으면 좋았을걸... 하는 아쉬움이 살짝 남네요.완전히 새차 되었군요.굿~~~입니다.,1
660,옵티마 지금 봐도 괜찮은 디자인이네요노고가 아깝지 않네요고생하셨습니다.!,1
661,너무 감동이고 한국정비사분들 정말 기술하나는 끝내주네요. 현재 미국에 살고 있는데 이정도까지 가능한 곳 보기도 드물고 이렇게 믿을만한 샵 찾기도 어렵습니다. 이 채널의 오래된 팬인데 나중에 한국 들어가서 오일이라도 한번 교환하러 꼭 가고싶네요.,1
662,존경스럽습니다. 저도 아버지가 너무너무 보고싶네요ㅜㅜ!! 카맨 최고입니다~~~,2
663,시작부터...하...정말 가슴에 와닿는 말씀..눈물이 고입니다..,8
664,코로나로 다들 힘들어 할때 끝까지 이겨내려 노력하시는 모습이 멋있습니다저는 더이상 버틸수 없어 이제 그만 하려고 합니다다른일를 찾아 볼려구요~!^^,2
665,인간적으로 현기는 리스토어 하시는 이분들 부품은 무상지원해줘야될듯..,1
666,멋지십니다 복많이받으실거에요~~,1
667,감동입니다^^ 카맨페밀리님들 건승을 기원합니다,2
668,존경합니다. 자랑스럽습니다. 감사합니다.,1
669,대단 하십니다.....,5
670,대박사건~모두님들 도와주신분들 복받으실꺼예요 아멘~내차도 좀해주세요,1
671,요즘같이 코로나로 모두가 힘든시기 이렇게 착한분들과 감동적인 스토리 이런건 우리들이 공유하고 퍼날라서 전세계분들이 볼수있도록 해야하지않을까요 영어자막 잘하시는분들 빨리 이영상 영어자막도 넣고 해서 우리모두 좋은일 하시분들 복을드립시다하루에1번이상 영상 다시보기등등 ㅎㅎ 조회수도 올려드리고,2
672,감동적이군요..ㅠㅠ저도 언젠간 차령 복원하고싶네요,1
673,아~ 카맨형들 영화 찍으시네..   감동적인...카맨과 협업해주신  업체 사장님들  대박들 나시길 바랍니다~,1
674,의미있는 영상에 바로 구독하고 갑니다 멋진분들~^^,1
675,형제차인 04년식 뉴ef 아직도 잘타고있는 사람인데 너무 멋진 영상입니다 제차도 애정이 깊어서 이렇게 해서라도 다시 살려주고싶네요 ㅠㅠ,12
676,단순한 정비사가 아닌 사람들의 마음을 다돋여 주시는 분 같네요.목에서 뜨거운게 올라와유~~~2009년 아반떼 타고 있습니다.동생이 타던 걸 받아서 타는데 외장에 테러를 너무 당한상태로 받아서  ㅡㅡ전체 외장 판금하고 도색하면 비용이 얼마나 들까요?썬팅도 안된 순정이라외장이라도 단정하게 타고 싶은데요..지금의 그 마음 잃지 마시고후배들에게도 기술보다 가슴을 먼저 알려주십시요. ^^,1
677,진짜 뿌듯한 내용입니다  제가 다 감사합니다  고생하셨습니다  감동입니다,4
678,눈물나는 다큐네요.. 감동이네요... 협력해주신분은 대단한 인물들... 이네요.. 이런부분 하나하나 풀영상이 많아야 사설도 엄청능력자도 많고 배려도 많고  안좋은이미지 싹 다 없어지길 바랄뿐입니다. 고생하셧습니다 박수,1
679,"난 그냥 열심히 일하는 사람이다 란 말 듣는데 왜 울컥 하는건지… 다들 자기 자랑에 바쁜데,,, 누구보다 믿음이 가고 멋쪄 보입니다!!! 바로 구독도 했구요 ㅎㅎ",2
680,저희 아버지차도 옵티마였고 제가 몇년간 타기도 했습니다. 이영상을 보니 폐치했었던게 너무아쉽네요.,1
681,아버지 라는 단어에 항상 울컥해버리는 김선우 카맨님 ㅠㅠ  저도 나이 한살한살 먹을수록.. 아버지라는 단어만 떠올려도 콧날이 시큰해집니다. 항상 건강하십시요. 카맨 사랑합니다,1
682,유튜브보면서 눈물흘리기는 처음이네요 ㅠㅠ진짜진짜 완전 감동입니다정말 복 받으실겁니다,1
683,"멋진 감동 감사합니다, 카맨패밀리 그리고 동료분들",7
684,이야 대단하네요 고등학교 자동차과 들어오길 정말잘한듯 이런거보면 이런직업이 힘들면서도 뿌듯할거같구나 생각함,1
685,근데 진짜 일이 많이 없으신가봐요 영상 사이사이에 옆 리프트가 비어있네요힘내세요...워크스루시스템이랑 잉가솔 임팩 멋지네요,1
686,영상 초기의 멘트에서 눈물이....고맙습니다.세상 사는 맛은 이런 데서 느끼는 것 같습니다.,1
687,이분들 장인정신 찬양합니다- 가까우면 단골되겟는데 ㅎ,1
688,마음 따뜻해지는 훈훈하고 감동적인 영상~ 카맨패밀리 가족들분과 많은 동료분들께 감사드려요.^^,1
689,울컥했습니다. 카맨패밀리의 건강과 번창을 빕니다!,4
690,감사합니다. 고맙습니다. 좋은 일 많이 하십니다.,1
691,와..그냥 새차가 되어버리네 ㄷㄷ,1
692,차는 추억입니다. 좋은 영상 잘 봤습니다. 캐나다에서 응원합니다!,1
693,진심으로 대단하십니다,1
694,정말  고생하셨습니다저도 다시 한번  아버지에 대한  어릴적 기억을 되돌아보는 계기가 되었습니다  감사합니다,1
695,대단하고 존경스럽기까지 합니다  훌륭한 일  해주셔서 감사합니다  저도 아버지 생각나네요,5
696,멋진영상 잘 봤습니다. 화이팅입니다!,1
697,멋지세요~이런 영상이 100만 아니 1000만 되어야 하는데...,9
698,이런게 진정한 재능기부 인거 같네요.,1
699,정말 우리나라에는 대단한분들이 너무 많은것 같습니다. 존경합니다.,1
700,썬팅 이레카 대표님 항상 친절하시고 잘해주십니다! 영상에서 뵈니까 정말 반갑네요 ㅎㅎㅎ,1
701,진짜 감동입니다! 구독하고 갑니다 정말 멋지세요!,1
702,정말 고생하셨습니다복 받으실 겁니다 제가 다 감사하네요,1
703,진정한 리스토어 네요~~~~,9
704,4:00 참 좋은일 하셨고..  뭉클합니다..근데 2010년식이라구요? .. 2000년식을 잘 못 말씀하신게 아닌지..  자막도.. 2010인데..영상도 멋지고 너무 잘 봤습니다.,3
705,와~ 정말 인간승리네요. 정말 나온분들 남자로서 멋있습니다,1
706,진짜 기술이다...,1
707,미쳤다 대박 진짜 와...,1
708,저도 2003년식 쏘렌토 초기형 27만키로 운행중입니다 노후경유차라지만 추억이 많고 잘달려주어 버릴수가 없네요 오래타세요,2
709,1994년식 엘란트라를 아버님이 타고계신데  요즘들어 잡소리등 교체해야 부품이 많이들어 고민이네요 폐차를시킬까 한번 부품교체를  해드려 볼까하는데 오래된차라 부품이 있을련지도 모르겠고~~정말아끼시는 차인데~~대단하시고 멋지십니다,22
710,이런 분들은 진짜 아주 돈쭐을 내줘야 하는데..,1
711,영상 보는 내내 가슴 뭉클 했습니다뜨거운 마음들이 강동의 영상을 만드네요 모처럼 함께 따뜻한 마음이 되었습니다 늘 응원 하겠습니다 ^^,1
712,최고네요 ~! 마지막에 그 시동을 걸고 나가는 장면이 있었으면 좋겠어요~~,1
713,우리나라도  차고에서 아들과 아버지가  차정비 같이히는 그런문화가 있으면 좋겠다. 차도물려주고,2
714,대단하십니다. 리스펙!♡,1
715,선우씨  왜 날 울리냐 내일 아버지 보러가야겠다.도움주신 대표님들 3대의 복을 받으십시요.이 영상 널리 퍼트리겠습니다 ,69
716,갑자기 훅 들어오네요. 감동입니다. 사장님 말씀도 진심이 전달됩니다. 감사합니다.,1
717,펑펑 울면서 영상 봤습니다 너무 감동적이에요 고생 많으셨습니다,9
718,감동적이네요. 대단하시네요.,1
719,부품들이 아직까지 있다는것이 믿기지 않는군요.  재밋게 잘봣습니다~~,2
720,대단하고 멋지십니다 보는 내내 감탄했네요,1
721,요즘 인터넷에서 잘나간다는 업체 메??바는 돈을 버는것에 열중을 해서 계속된 PPL만 주구장창 영상에 내보내는데 이렇게 좋은일을 하시는 카맨 여러분들을 보니까 존경스럽고 부럽기도 합니다. 저도 정비밥을 먹고 있는데 너무나 부럽습니다. 앞으로도 사업 번창하시고 함께 하시는 인상이 좋으신 여러분들도 언제나 건강하게 승승장구 하시기 바랍니다.,1
722,이형 찐이다 진짜...  응원합니다.,1
723,아. 뭉클하네요. 아버지의 존재란.,9
724,와 자동차 정비의 어벤져스 대단 하십니다~~~언빌리버블....,2
725,와~다들 멋진분들이십니다,1
726,진짜 댓글 안 다는데 큰 정성에 감사해서 구독까지 누르고 갑니다,1
727,이거보다가 눈물 흘렸다...어느덧 나도 그때의 아버지 마음을 아는 나이가 되었음...,1
728,대표님의 진한감동이 아마도 누군가에는 꿈이고 앞으로 잘 살아갈수있는 발판을 만들어주신거 같아보여서 대한민국 힘든현실속에서 마치 한줄기빛이 보이네요 희망이 없다면 미래가없고 행복이없다면 나 자신조차 없다 하지만 한줄기 빛이 누군가에는 살아갈 용기를 주는거 같습니다 행복하세요. . . .,1
729,와 저 이거 저희 동네에서 본 차 인데 진짜 너무 예쁘던데 멋지신분이셨군요,36
730,와.. 링만 갈고 끝낼줄알았더니 흡배기벨브 로테이터까지 분해하시고 메인베어링도 새걸로 교환.. 라이너 빼고 그냥 새 엔진됬네요 ㅋㅋ,1
731,대박~ 새차를 만들어 주었네요. 차주 정말 좋을듯. 차는 진짜 또하나의 가족인듯.......,1
732,저게 정녕 탈수 없는 차를 새차로 만들어버리는 장인의 손길..,1
733,정말 존경합니다...,1
734,박수!!!!!! 큰 박수를 보냅니다. 깊은 감동이 몰려옵니다.,1
735,질 좋은 영상질 좋은 써비스질좋은 감동대박나세요~,7
736,아버지의 마지막선물! 마음이 ...찡합니다.감동받고 갑니다..,2
737,차영상 보다가 눈물이 나다니.. 감동입니다.,4
738,이게 유튜버지...멋진 협업이다.번창하세요...,1
739,와우  멋져요  대단합니다  정말 정성입니다,1
740,엔진 수리하는 것 보니 심장 수술하는것 같아요,1
741,와.... 완전 신차로 만들었네요;;; 대박,1
742,영상이 끝나고 눈물이 계속 흐르네요.저 또한 아버지께서 97년에 돌아가시면서 94년식 캐피탈을 물려받아 제가 타고 동생이 타다가 폐차했는데 이영상보고 괜시리 맘이 아파옵니다.,1
743,왜 눈물이 나는건지ㅜㅜ고생하셨습니다,4
744,진짜 너무 멋있어서 구독하고갑니다,1
745,고생하셨습니다. 감동 받았어요,1
746,의뢰인 모시고 인터뷰까지 했으면 정말 감동이었겠네요 김선우 대표님 존경합니다,3
747,캬 진짜 멋지십니다. 구독자인데 바쁘다는 핑계로 자주 못오는데 감동입니다.,1
748,4:00 2010년식이면 우리 차랑 비슷한데 뭐가 오래 됐다는거지? 했는데제목을 보니  2001년식이네요 ㅎㅎ지금 나온 차라고 해도 믿을거 같아요  정말 복원이 완벽하게 된거 같습니다타고 다니면 주변에서 엄청 쳐다볼거 같아요,1
749,와ㅠ 작품이네요진짜… 눈물난다ㅠ,15
750,정말 존경스러운 카맨 식구들입니다...,1
751,저도 5월 말일 자로 01년식 베이지색 옵티마를 보내주었습니다. 어렸을적 우리 가족 어디를 가던 함께 했던한식구 였는데 보내주기 전 날 미안함에 마지막으로 달려 보라며 힘껏 엑셀 밟아주고 새로 오게 될 신차에 다시 돌아와 깃들어 달라며 그간 안전하게 우리가족 잘 지켜줘서 고마웠다고 하고 보낸 기억이 영상 보니 다시금 생각나네요울컥 하는거 참느라 혼나면서 끝까지 잘봤습니다. ㅎㅎ,1
752,지역이 경남권이라 디테일링쪽으로 도움을 드리고싶지만 그럴수가 없어서 아쉽습니다 멋지세요!,1
753,살다살다 옵티마가 이렇게 멋져보이는적은 처음,2
754,솔직히 말해서 새차기준이었나 차비용 50퍼 이상 견적가 잡히면견적오바라 해서 폐차시키고 중고 장만하라인데진짜 거의 뭐...새차하나 구해준급의 큰 용단을 내린거나 다름없는데...진짜 번창하셔야 합니다.,2
755,감동적인 한편의 드라마를본것 같네요역시 믿고보는 카맨 패밀리  홧~~~팅  입니다,19
756,진짜 가슴이 웅장해지네요 크으 멋잇다,2
757,감동입니다~ 박수 짝짝짝~~!!!!!!!,5
758,차를 새로 만드셨네요... 대단하십니다~,1
759,옵티마 개인적으로 외관도 지금차량이랑 비교해도 손색이 없을정도.,1
760,멋지고 아름답네요!항상 행복하시고 보람된 일 많이 하시고그로부터 힐링하는 삶이 너무 보기 좋아요!,1
761,아버지라는 이름이 무거우면서도 가정을위해서 희생하시고 자식한태 조금이라도부담덜주려고하는모습들 진정한 아버지에모습이죠 카맨도 차에있어서 아버지 이십니다  진정한 카맨 고맙습니다 영상 참 좋습니다,2
762,보기좋아요 응원합니다 화이팅,1
763,카맨여러분~멋지시네요.항상 응원합니다.홧팅~~~~~~~~~~~^^,8
764,옵티마 저의 아버지의 두번째 새차여서 출고날과 많은 추억이 평생기억에 남습니다.영상을 보니 지금은 곁에 안계시는 아버지가 생각납니다.,2
765,정말 멋진분들 항상 응원합니다,1
766,대단하다…..,2
