,comments,likes
0,닛산 쥬크/알티마/맥시마/캐시카이를 타본바로는...닛산차가 상당히 좋습니다...가성비도 좋고..엑스트레일 풀옵 살바엔...뉴무라노가 좋을듯 싶기도 한데...가격차이가 좀 크긴 하네요..캐시카이가 판매금지된게 제일 아쉽긴하네요..쥬크와 엑스트레일 사이에 캐시카이가 가격이 딱 좋앗는데...,4
1,개인적으로 엑스트레일도 제대로 된 하이브리드 하나 만들어서 연비도 좋았으면..,2
2,로그 미국있을 때 렌트로 몇번 몰아봤는데 차 진짜 좋긴 함. 운전감이 좋음.반면 닛산의 다른 차종은 다소 실망했었음..,1
3,오랜만에 뵈니 너무반갑고 좋네요^^ 앞으로도 리뷰많이해주세요~~!!!!,4
4,일본여행때 이차 렌트해봤는데 참 한국에 들어오면 좋겠다 했는데 딱 들어오더군요^^ 탐나던 차였었죠. 그땐 가솔린차를 렌트했었죠^^,1
5,"캐나다에서도 잘 팔리는 로그입니다~ 이번에 구입하고 크루즈기능 살펴보려고 검색하였습니다.. 아쉽게도 크루즈기능 설명이 없네요.. 차량설명서 읽어보기 귀찮은 사람인지라~~ 영상 잘 보았습니다. 생각없이 탔는데, 영상보고나서 제차를 더 사랑해야겠다는 생각이 듭니다~~",1
6,"2,3년된 중고로 사면 딱 합리적임. 감가도 심하고. 그때쯤이면 풀체인지 모델 나올거고. 차는 좋을 듯. 근데 성능 외 어필하는데에는 한국 suv라인이 너무 막강해.",1
7,김한용기자님 오랜만이에요~ 오랜만에 김기자님 리뷰를 보니 반갑네요~~,4
8,김한용기자님이 리뷰하는 엑스트레일 보고싶었는데 잘보고 갑니다,3
9,이번 신형 시승해봤는데 좋더군요 다만 풍옵션도 통풍 시트와 행들 열선이 없는 거랑 네비 화면이 데비보드 위쪽이 아니라 통풍구 아래에 있는점이 아쉬운 것 말고는 다 좋았습니다,1
10,기자님 최근소식 페이스북으로  접했습니다.아프로도 하시는 모든일 잘되시길 바라고 항상 응원하겠습니다!,1
11,꺄~ 김한용편집장님이다.. 리뷰 너무 기다렸어요.. 김상용씨리뷰.. 너무 재미없었는데.. 정말 좋네요.. 앞으로 계속 리뷰해주세요.. 김상용씨 너무 졸려..,2
12,최근 기변고민에  국산5사 외 저가외제 브랜드까지. 많이 가봤는데 왜 현기가 잘 팔리는지 알았습니다.,1
13,조근조근  자세한 설명 너무 좋아요.,3
14,닛산엔진 미션은 세계최고죠디자인은.....,1
15,기자님 참조아라 하는데 근데 시승차들 다넘좋다고만 하시는듯 한데 장단점 확실잉 설명 해주심을 부탁드립니다.,4
16,뒷자리 슬라이딩 진짜 신의한수...,1
17,이번에도 김상영기자님이 리뷰하는줄 알았네,8
18,이게 로그였구나... x trail 이라길래 다른 차인줄 알았네요,1
19,참.. 자주 느끼는 거지만 독일 삼사나 한국 차량을 제외하고는 무성의하게 방송을 하는것 같습니다. 많이 팔리는데 가격이 저렴한 이유가 전부는 아닐테구요.. 좀 더 성의있는 방송 부탁합니다..,17
20,마즈다 cx-5를 리뷰하는건 어떨까요. 호주에선 베스트셀러랩니다,1
21,잘 보고 갑니다!~,2
22,닛산 베이스로 삼성차들이 나올때가 좋았는디 ㅜ,29
23,QM6가솔린이랑 비교하면 어떤가요 2열및 트렁크공간. 엔진같은거 어떤가요?,1
24,현재 미국서 이차타는데 그냥 무난하게 부담없이 타는차,3
25,전 차라리 펠리세이드 탈래요....ㅋㅋ 4천초반이면 경쟁할 수 있지 않을까요?,4
26,최고!,1
27,보고싶어습니다 김한용 기자님~~~,2
28,이번 영상 편집 재밌네요 ㅋㅋ,5
29,아 승차감은 장난아님 이찬진짜뒷자리가,2
30,저는 4천 초반이면 펠리 살겁니다  개인적인 의견입니다,2
31,디자인은 결코 가장 많이 팔릴차가 아닌데....,10
32,센테페시아가 람보아벤 닮은건 기분탓??,2
33,김한용 기자님 떠나지 말아주세요,13
34,저가격이면 쏘렌토가 낫지않을까요?,1
35,인테리어는 쌍용보다 조금 나은 수준인 듯... 요새 현기가 인테리어를 하도 잘 뽑아놔서 일본 3사도 별거 없는 느낌,11
36,계속 김한용 기자님이 해주세요 제발요,24
37,"마력, 토크, 디자인 다 별로인데 가격이 싸군요.. 잘팔리는 이유가 그거였어 ㅎㅎ",2
38,오 김한용 기자님 자주 나와주세요~~~~~~~~~~~오오오~~~,2
39,으...디자인보소..90년대 고급차 같다...,2
40,엄지 꾹 누르고 갑니다,2
41,김상영기자님이 좋은데....,1
42,전반적으로 qm5하고 비슷하넹요 의자나 내부까지,1
43,해외용 연비4등급 더러운 차 보유세 300만원 요망 클리오 나왔네 디자인은 퇴보,1
44,오오오 오랜만에  김한용기자님이다,15
45,부산공장에서 로그를 바로 가져올 수 없나,1
46,저기 초반에 배경 파주 영어마을 맞죠? 예전에 군대있을때 영어마을 파견 갔었는데 비슷한듯 해서요.,1
47,이분이 그 유명한 김한용 기자님 인가요?,20
48,기마뇽 👍👍👍,1
49,요즘 영상이 너무 안올라와서 심심합니다.,1
50,"브리즈스톤 망해라,,,무슨 뜻인지? 타이어가 안좋단 뜻인지? 뭐지?",1
51,닛산의단점: 버튼이  다지워짐  시간지나면 ㅋㄱㅋ,1
52,쓸데없이 장난하는 느낌이 강하네,1
53,미국 처음이민와서 36000달러에 구매해 타던차네요.미국 판매명은 로그죠차는 괜챤은데 앞바퀴 스티어링을 완전히 꺾으면 드르륵소리가 나는 결함이 있죠.A/S 에서도 원인을 못찾더군요.제차만그런게 아니라 다른 오너들도 항의를 많이 했지만 닛산에서도 원인을 못찾더군요.그래서 정 떨어져 손해보고 팔았는데.지금은 괜챤은지 모르겠네요,3
54,리뷰는 후배들에게 넘기고 편집만 하시길...,4
55,처남차가 닛싼 에쿠스토라이아루인데 타보니깐 승차감이 그렇게 좋진않음;;; 까를로스곤 프렌치놈이 사장하고나서 망함 80-90년대 닛산이 최고다,1
56,4:34 편집 귀엽네요,4
57,요즈음에 foot 파킹 브레이크 채택도 합니까????,1
58,개인적으로 편집이 좀 유치하고 잔망스러워 진 느낌이네요,1
59,악플러들 때문에...,1
60,왜 계기판을 가려놔요?,1
61,너무 간략간략 지나가네요.. 너무 성의 없이 진행하는 느낌... 일본차 시승때마다 대충한다는 느낌이 드네요... 안타깝습니다.,2
62,카뮤니티 다시 시작 하세요,2
63,이거 니산 Rogue 아니에요?,1
64,아휴...대놓고 스폰 받았다고 티내네. 준비도 없이 드립으로만 진행되는 리뷰....한국 닛산 마케팅 팀장 시말서 내라.,1
65,일명 마징가 제트카,1
66,근데 중간중간에 속도 게이지는 왜 모자이크 처리하는건가요,2
67,일본차 이제는 국산차와 비교해도 별 차이없어요. 국산차도 그만큼 차를 잘만들죠.그래도 일본차가 더 땡기네요~혼다 토요타 닛산 > 포드 볼보 푸조 > 현대 기아 르노삼성 쉐보레 > 벤츠 BMW 아우디 순으로,2
68,이 자는 눈탱이가 맨날 부은겨? 맞은겨? 참 밉상이네요 적어도 저에게는...쏘리~~~ 참 한번의 낙인이 꽤 깊네요.. 이러는 나도 참 모지리인가보구요...ㅎㅎㅎ,2
69,"병맛 cvt, 미쿡에서는 싼맛에 타는거지 성능이 좋거나 뭐 그딴 이유 없음",2
70,홍보인가...?,6
71,와 생긴거 진짜 별로네 ㅋㅋ,5
72,믿거,1
73,촉바리차  광고하는 친일  구독취소한다,2
74,닛산 알티마 편은 지난 2019년 제작되었습니다. 그동안 비공개 컨텐트였지만 순수한 차량 정보로 봐주실 분들을 위해 공개 전환하게 되었습니다. 또한 지금 당장 인기가 있는 신차에만 국한하지 않고 다수의 브랜드가 보유한 많은 다양한 차량들에 대한 정보를 확대 적용해 나갈 예정입니다.,279
75,알티마 프레임과 하체 정말 좋더라구요~,8
76,닛산알티마 역시 듣던대로 손색이 없는 명차 입니다.  가성비로 따지면 거의 최고 입니다,3
77,"이번 알티마의 매력은 맥시마보다 더 큰 휠베이스와 2.0 VC터보가 아닐까 합니다.다만 아쉬운건 2.5na에는4륜 옵션이 다른 나라는 있는데국내는 삭제를..긴 휠베이스가 주는 옆모습의미적 비율이 특히 좋은데,4륜 옵션 넣구 옵션가격을 저렴하게했다면 요즘의 분위기에도 판매를좀 올리지 않았을까 합니다.",11
78,2.0T 모델은 꽤 재미있으셨던 모냥입니다. 트레드옆에 물결무늬 많은거 보니 꽤나 조지신듯..ㅎㅎ,13
79,2200 에 산사람들 개부럽다 진짜,40
80,잘봤습니당~ 무난하게 이쁘고 기본기도 좋아보이네요,10
81,"안녕하세요, 알티마 테크랑 터보 사이에서 고민하다 오토뷰 시승기를 보고 터보로 구매했습니다.평소 와인딩이랑은 인연이 없고 연비주행하며  얌전하게 타고 다니고 승차감을 중시하는 편인데, 2.5 순정휠인 17인치로 인치다운해도 출력 대비 제동성능 등에서 큰 문제는 없을까요?",6
82,"자동차 리뷰는 오직 오토뷰만 보고 있습니다. 다양한 비인기 차종 리뷰하겠다는 제작의도 너무 감사합니다. '인류'를 사랑하는 사람은 나이팅게일처럼 적군과 아군을 가리지 않고 모든 사람을 보살피는 것처럼, '자동차'를 사랑하는 사람들은 국가와 정치이념에 휩쓸리지 않고 오직 '자동차' 그 자체를 사랑하고 평가해야 한다고 생각합니다. 중국차도, 일본차도,  잘 알려지지 않은 제 3세계의 차도 많이 리뷰해 주시면 감사하겠습니다.~~",5
83,일본 대중브랜드 중형차 중에 그나마 마음에 들게 생겼습니다. 다른 것들은 알티마보다 더 너무 요상하게 생겨서...,31
84,기태성. 평생 사랑해유~♡앞으로 오십년이상만 더 활동해주세요.항상 응원하겠습니다^^,24
85,예나 지금이나 자동차 리뷰는 많은 유튜브채널이 만들어 졌지만 오토뷰가 최고인듯,3
86,차 멋지네요차도 비싸지도 않고멋지네요리뷰 고맙습니다.,5
87,건담 보고 디자인 연감 받나봐요.실재로 보면 생각 보다 좋아보이지만SM5 초기형(닛산차량)에서 시국타령 전에 알티마로 기변한 지인이 있어..,8
88,잘봤습니다   좋은 리뷰 감사합니다어디가나 반대편은 한두명 있지요그러려니 하시구  계속 리뷰해주세요,18
89,기술의 닛산엔진의 혼다마케팅의 도요타,7
90,이 급에선 타이어만 바꾸면 어코드가 달리기는 제일 빠를 것 같습니다.,7
91,VC TURBO 가변 압축비 터보 엔진    기술의 닛산이라는것을 바로 알게 해주는 엔진이죠,19
92,알티마 사고싶다,17
93,출발전에 Vdc를 끄는 이유가 있을까요? 급궁금하네요ㅎㅎ,1
94,일단 과속안하고 안정적으로 속도내고 운전했을때 극한의 이득(2200)을  볼 수 있는 이득충들의 자동차,3
95,이런 순수하고 객관적인 리뷰에대한 의지 너무 칭찬합니다,10
96,디자인이...옛날 감성이,2
97,누구는 영상용 일제품 사용하면서 차리뷰어가 이시국 저시국하면서 정치성향인거같았는데 오토뷰보니깐 오로지 차에대한 리뷰만하니깐 자동차 채널에있어 더욱 신뢰가 가지게 되네요,16
98,네비없는 부분은 참 마음에 드네요.,7
99,안녕하세요. 십년? 더 오래전인가 티비에서 리뷰 하시는거 보고 그때부터 펜입니다. 그때부터 티비로 꾸준히 보다 한동안 리뷰가 없어 너무 슬프게 지내다 몇년전부터 본격적으로 유튜브로 리뷰도 올려주시고 저는 얼마나 행복한지 모르겠습니다. 관심차종리뷰를 보며 비교를 하다 십대와 이십대에 드림카인 BMW G바디 530i를 타고있네요.. 대기가 싫어 540을 포기한게 아직까지 후회중이긴 하지만요......  브리지스톤 티셔츠 너무 이쁜거같아요.저도 입고싶습니다. ㅎㅎㅎㅎ,10
100,나중에 중고로도 사도 괜찮나요?지인이 알티마 전 모델 타시는데 잔고장없이 엔진오일만 갈고 타더라구요현기가격도 엄청올라서 ㅠ기본기 탄탄하다고 하길래 어떤가요?,3
101,닛산 알티마 좋은차였는데 철수여서 아쉽네요,3
102,알티마 알고보면 가성비 정말 좋은차 입니다.궁금했었는데 오토뷰에서 리뷰해주시네요.잘보고 갑니다.맥시마 리뷰도 기다리겠습니다.,17
103,일본차 인테리어를 보니 미국에 전념하는 모습... 별 신경안쓰네요.,2
104,리뷰 잘 봤습니다. 믿고보는 오토뷰~,7
105,마크를 떼어내면 모든 네바퀴굴림은 일류의 안전과 행복에 기여하는 장치일겁니다. 그냥 그자체로 보면 됩니다~ 수고많으십니다!,3
106,빨간색 개이쁘네 진짜...,1
107,한떄 알티마 캠리 어코드 비교 하다가 렉서스 구입 했었는데.. 알티마도 타보고 싶네요,7
108,갓직히 다른거 필요없음 달리기성능 코너링 다개소리지 그냥 일본차처럼 준수하게 달리고 고장안나고 기본기탄탄하고 있을기능만 딱있고 대부분의 시민들은 이정도면됨 가격도 착하고 ...,28
109,차량내 USB포트 암페어 수치 알려주는건  오토뷰뿐 아닐까요 ㄷㄷ평소 아주 궁금하던 부분이라 아주 반갑네요,14
110,와 라브4랑 알티마 진짜 기다렸어요!!!감사합니다.형 건강해!,9
111,갖고싶다,5
112,"오토뷰의 전문성과 흥미진진한 영상미로 10년 넘게 봐온 애청자입니다. 다름이 아니라 혹시 김기태 기자님과 김선웅 기자님의 자차 리뷰를 올려주실 계획은 없으신가 궁금해서 댓글 달아봅니다.각양각색의 차들을 몰아 보시면서 어떤 차들을 타시고, 타오셨는지 궁금하네요.",15
113,잘 보고 갑니다!,3
114,일본차라  차별하기싫지만... 따봉만 찍고 갑니다,3
115,저 알티마 2.0터보와 어코드 스포츠. 이 2 차종. 성능만 놓고 봤을 때 독일 3사로 가면 독일3사에선 차량가격이 얼마가 되나요?,5
116,알티마 2.0  터보 관심 많아요소유하고싶은    차량입니다,2
117,"인피니티Q50 디젤 2016년 4월에 신차 뽑아서 아직 타고 있는 오너입니다. 그때 당시도 고민 많이 하고 샀는데.. 유튜브 보면서 조립하는 현기차냐.. 당시 철수 이슈 상당하던 쉐보레냐..르노..어차피 얘도 닛산이나 마찬가지고...쌍용..세단없고.. 그래서 그냥 차만 딱 보고 결정하자 결론이 나와서 Q50샀었습니다. 불매를 하는 것도 사실 워낙 그 범위가 애매한 부분이 있어서..  뭐라하기 힘든 부분이 있다고 생각합니다. 채식주의도 생선은 먹는 사람 달걀은 먹는 사람 이렇게 나눠지는거 처럼요. 플스는 열심히 하면서 일본차 구매는 까는 희안한 경우도 있지요.  본인의 신념대로 각자 할 수 있는대로 하는게 맞다고 생각되네요. 불매안한다고 욕하지말고 불매한다고도 또 욕하지 말았음 합니다.  불매안하는 사람도 불매 하는 사람의 신념..그거 욕할 자격없고, 불매 하는 사람도 정도의 차이지 일본 제품 쓸 수 밖에 없습니다.  각자 신념대로 합시다~",30
118,최고의 차,3
119,항상 잘 보고 있습니다. 살 마음은 없지만 ....있었지만...그냥 이런차가 있다....라고 잘 보겠습니다.,15
120,소나타 센슈어스랑 비교하면 어떤가요?,2
121,팩트: 장진택 기자는 오히려 구독자가 늘었다 ^^,30
122,엔진이 너무 구식이긴 한데 싸게사서 상당히 좋음 어코드가 조금 더 낫긴함,4
123,👏👏👏,6
124,컨셉 이뻐도 양산 죠지는건 여기나 저기나구나,1
125,2열 시트 폴딩은 정말 큰 메리트가 있네요,5
126,앞은 구형 k7 느낌나고 뒷 데루등 아슬란 같네 ~,1
127,와우 !!  편집 포인트 멋찌다박자에맞춰 다른영상과 음악 무슨 광고찍는줄쵝오 오토뷰 보고있슴 귀에 쏙 들어와욤 🤗🤗🤗🤗🤗🤗🤗🤗🤗🤗,3
128,여윽시~^^,7
129,좋은 자료 감사합니다.  2.0 T 에 대한 브레이킹 성능이 빠진부분이 좀 아깝긴 하네요.,2
130,리뷰가 궁금하던 차 였는데 드디어 공개 됐네요~ 잘 보겠습니다!,12
131,이 차가 아반떼보다 싸다는 차인가요,16
132,일본차도 어지간히 디자인 포기한것 같은데 경쟁모델 메기나타 보다는 낫다.갓토뷰 잘 보고 갑니다.,19
133,잘 봤습니다 후미등이 아쉽네요,6
134,정말 만족도 좋습니다^^ 10년은 거뜬히 탈수 있는 차량이에요 ~ 너무 편합니다. 참고로 저는 벤츠 이클 차량도 가지고 있는데  알티마가 더 편하네요~,18
135,35:31 총평,8
136,cvt내구성은 좀 나아졌으려나...,2
137,5.5세대 알티마 오너입니다  //  일본차의 가장 큰 장점은 잔고장없고 그냥 무난하나 브랜드는 있는 것입니다 // 가족용 차로 재격입니다,26
138,생중계는 안하시나요그리고 예전에 골프R시승기 할때 차량이 지금 k카에 매물로 올라왔던데 추억입니다. ㅋㅋ,2
139,재미있게 잘보았습니다~!오토뷰는 사랑입니다♡,6
140,믿고보는 오토뷰!!,20
141,우리같은 월급쟁이는 가성비 따지고 고장없이 오래 탈려면 일본차,21
142,"알티마 나오게되면 시승 및 계약을 생각하고 있었는데 일제불매가 시작되는바람에 아얘 잊고지냈었네요^^오토뷰입장에서는 시승기 업로드를 포기했었던거 충분히 이해가 가고, 지금와서 뒤늦게 업로드한것도 차를 좋아하는 사람으로써 충분히 이해가 갑니다.비록 사지는 않겠지만 재미있게 보겠습니다^^",6
143,다 좋아졌는데 후미등 너무 저렴해보여요 ㅠㅠㅋㅋㅋㅋ,7
144,"기다렸던 리뷰, 잘 보겠습니다.",5
145,용기있게 공개를 하셧군요. 감사합니다.😄👏,17
146,일본차로는 경적소리 '대~한민국'을 안하는 센스 ㅋ,1
147,이젠 일본차 리뷰 하셔도될듯킹시국이 이제 일본에서 중국으로 넘어가서 ㅋㅋㅋ,11
148,드디어 올리왓네,5
149,외부세력의 농간질에 같은 대한민국사람들끼리 싸우고 헐뜯는 일이 없으면 좋겠습니다.,15
150,나빠요든 좋아요든 민주주의 국가에서 자유지만아직은 기본과 내실에 충실한 일본차는 꼭 사지 않더라도 국산차와 좋은 비교대상이 되고 또 선한 경쟁이 있어야 국산차의 발전도 있지 않나 생각됩니다.역사와 현 시국에 어떤 흐름을 거스르지 않고자 하는 정신도 분명 필요하지만 배우고 흡수하고 또 아닌것에 대해선 아니라고 할수있는 자세도 필요하지 않을까요?알티마는 일본브랜드 차량인걸 넘어서가격대비 기본기와 성능이 분명 우수한 차량임은 확실하다 생각합니다!옵션이나 편의사양 실내 내장제하부나 엔진룸 소재는 원가절감의 흔적이 굉장히 많이 느껴지긴 합니다.기본에 아주 충실한 전륜기반의 가솔린 세단이 아닐까 합니다! 좋은 정보 늘 감사합니다!아!  ㅎ 많이 바쁘시고 코로나로 인해 지금은 많이 어수선하지만 2019~2020 530I MSP는 엠스포츠 서스펜션이 들어갔는데요 여력이 되신다면 한번 시승해주시고 리뷰해주시면 감사하겠습니다! 제가 타고 있기는 하지만 전문가분들의 날카로운 분석과 차량의 대해서 좀 디테일하게 알고싶습니다^^곧 페이스 리프트가 되긴하지만17~18년식 모델에 빠진 요소들 때문에 차량이 가진 장점에 비해 너무 단점들만 부각이 되어서요!항상 감사드립니다^^*,8
151,CVT...정말 가루가 되도록 까이지만 연비하나는 기똥찬 차..,13
152,알티마 살려다가 너무 늦게 나와서 어코드로 넘어온..,4
153,근데...알티마는  옆동네 캠리나 어코드 하이브리드한테  대차게 까이고있어서 ㅜㅜ 심지어 다운사이즈도아니고  점점  판매는 저조해질듯 ㅜ,31
154,차는 기본기가 중요하긴 하지만 디자인도 중요한 구매요소인데 실내외 디자인이 뭔가 한 세대 뒤쳐지는 느낌이네요...,7
155,저는 사지 않을테지만.. 혹시라도 구매하실 분들 혹은 정보를 전달하는 채널이라는 차원에서는 안가리고 전부 다 업로드 하시는게 맞지않나 생각합니다. 항상 응원합니다.,15
156,닛산 인피티니 안타깝다 돌아와라 미쯔비시 마쯔다 스바루 프리미엄 어큐라까지 모두 와라 이기야!!!!,9
157,불매운동 선동하던 고위공직자 상당수가들 렉서스 혼다 차량보유중인 현실에서 좋은 리뷰입니다,17
158,닛산 없어진거 개오바네 ㄹㅇ 시부레,2
159,차는 순수하게 차로 판단되었으면 좋겠다는게 차덕후인 제 생각입니다,19
160,살 일은 전혀 없겠지만.. 여튼 잘 보고 갑니다.,5
161,그유명한니산,1
162,무조건 일본차라면 나몰라라 신경안쓰고 있다면 그게 바로 우물안 개구리죠. 우리가 가장 따라잡아야하고 알아야하는게 일본브랜드인데도요. 이렇게 다양한 정보를 공개하고 공유하는게 결국 우리나라 자동차 전반에 큰 도움이 되는 일이라고 생각합니다!,27
163,30:57 소나타 2.0T 개안습...현대 지못미,30
164,국민감정을 떠나서 기자의 보도 정신을 지키는 오토뷰는 진정한 언론입니다.,11
165,"왜구차는 싫어하지만 배울건 배우고 우리나라차가 앞선 부분도 있고 , 현기,쌍용 , 르노삼성, 쉐보레가 더 발전했으면 좋겠어요",26
166,좋은리뷰 감사합니다^^,8
167,자동차 채널의 본질에 충실하는게 우선이죠.리뷰에는 성역이 없어야 합니다.개인적으로 그랜저 구입 예정이고 앞으로도 계속 일본산 소비재는 안살 계획이지만 그래도 이런 리뷰는 정보 차원에서 필요하다고 봅니다.마지막 판단은 소비자가 하는것이고 소비에 대한 결정 또한 각자 개인의 몫.리뷰 재미있게 잘 봤습니다.,7
168,요즘 난리난 차....,1
169,현기 쌍용 르노삼성 쉐보레가 이런 왜구 차보다 인테리어 내장은 더 좋아졌다 생각합니다 내구성이나 주행질감도 더 좋아지길!!,3
170,자동차 정보에 정치색이 드러나면 안되죠.오토뷰팀의 용기에 박수를 드립니다.,11
171,흉기 아방이 사느니 알티마 사는게 정상인이지~ㅋ,20
172,구독자가 16만  가까이 되어가는 결코 영향이  적지 않은 컨텐츠인데 객관적 정보전달믜 취지라지만 그 영향력을 제작자 관계자분들이  너무 과소 평가 하신듯 합니다.,7
173,알티마 타보면 안다. 편하고 내구성 좋고. 미국놈들이 많이 사는 이유가 있다,3
174,"닛산이 日産이란 뜻이죠. 단어자체가 ""made  in(by) Japan"" 을 표명합니다.치우침이 나쁘다고 하지만 일본차에 대해서는 받아들이기 힘드네요. 제국주의 침략자들~!!!오토뷰의 컨텐츠 품질과 열의는 항상 감사합니다",5
175,이러면 정신병자들 몰려 올텐데..,16
176,아 진짜 2200ㅇ아 ㅋㅋㅋㅋㅋ 아 ㅋㅋㅋ 뛰어가? 진짜 뛰어가? 앜ㅋㅋㅋㅋㅋㅋ,35
177,차 좋네요 vc터보 미국가서 사고싶네요,7
178,플래쉬 라는 관종은 오늘도 관심을 못받았는지 혼자 베들베들 거리는군요 관라자님^^ 정리를 하심이 좋을듯하네요.,30
179,알티마 궁금했었는데 감사합니다!,6
180,닛산 정말 좋은 차죠^^~,10
181,벤츠나 BMW도 가짜 머플러 쓰는데... 듀얼머플러라니...,4
182,딱 불매때 올릴려다 마셨네,2
183,이 시국충= 쿠팡은 잘도 이용중,11
184,역시 오토뷰 ^^,3
185,관리자님.. 오토뷰 홈피 오래된 시승기 재생이 안되요 모바일 pc버전다요 최신꺼 유튜브만재생대용ㅠㅠ,6
186,2.5인데 연비가 잘나오네요!? 살아있네~,8
187,cvt라니요 아 치명적인 약점으로 작용할거 같은데요 ㅡㅡ;;;,3
188,차는 괜찮은대... 판매량보면 정비망 자체가 없어질듯 ㅋ,3
189,잘 보겠습니다!,5
190,뭔가 닛산에서 만든 캠리같네가격이 비슷하면 한번 타보고 사야지,13
191,요즘 가격생각하면 혹하죠 ㅎ..,5
192,리뷰하라니까 또 cf만들었네,23
193,순수 오토뷰만 봅니다. ㅎ,15
194,"닛산 알티마,맥시마~는 애초에 이름 지을때 말'마'자 쓰는걸까요?적토마처럼ㅎ 네~다음 아재개그!",11
195,잘볼게요~,3
196,쏘나타랑 K5보다가 이거보니까 되게 심심해 보이네....;; 리뷰 감사합니다!,1
197,차는 참 좋은데 안타깝...,10
198,굿바이 닛산,1
199,어코드 1.5타고있는데 .. 알티마 1.5도 같이 나왔음 삿을텐데.. 2.0은 세금이 너무 비싼거 같아요디자인은 이만하면 나이쓰! 캠리도 다운사이징됬음 좋겟답..,8
200,뭔가 느낌이 아반떼 비슷한 것 같은데... 차잘모르는 개인적인 생각입니다.,1
201,이게 아반떼 경쟁모델인가요,21
202,일본차를 떠나 별로 매력이이 없네요,6
203,현재 미친할인율 거진7002500~2600에 파는중그래두 안팔리는중,7
204,2.0 t 사고 싶네요. ㅋㅋ,21
