,comments,likes
244,"도요타는 거의 모든차종이 하이브리드가 있기 때문에 지금까지의 eu환경기준에 문제가 없었죠.그래서 그럴 필요성도 없었고, 충전이라는 문제점을 가지고 있기때문입니다. 참고로 지진발생하면 전기 다 끊김니다. 은행atm도 사용하지 못할정도죠, 카드전산도 당연히 안되고요. 이동하려면 전기 없이 못움직이죠. 이런 관점도 있어요. 그러나 환경기준에 바뀌면서 강제적으로 전기차를 판매할수 밖에 없기에 억지로 만드는격이 된거죠. 그리고 노동자 얘기하는데 도시 하나가 도요타가 먹여살리고 그 도시가 도요타를 먹여살리는 상생관계에 있죠.그런것도 관과할수 없겠죠. 도요타가 전기차에 뒤쳐져만 있다고 보기가 어려운것이 전기차 관련된 특허나 기술을 굉장히 많이 가지고 있습니다. 테슬라가 전기차 양산에 있어서 여러 연구 개발을 도요타힘을 빌려서 했으니까요.",1
245,그런데 전고체 일본이 잘하는 걸로 아는데,2
246,비디오시장도 VHS 방식과 알본 베타방식이 있었는데일본의 베타방식이 좋았다하지만 결국 고집에 작살났죠.변화 보단 전통과 유지에 너무 몰빵해서 손해보는듯.....,4
247,일본 아이돌이 대표적인 예이죠! 우리나라 아이돌이랑 비교되니 일본 특유의 자기합리화 시키는말! 우리는 성장하는것을 보며 응원하는것이 아이돌문화라고~ㅎㅎㅎㅎㅎ 무슨 말같지도 않는…말인지 당나귀인지…특히한 민족성!자기합리화대마왕!,1
248,아시아 유일 독창성과 창의성을 갖는 일본을 응원합니다. 그거 베끼는 카피켓 중국과 한국은 별로 기대가 안됨,2
249,나는 그냥 일본인의 국민성 같아요지금도 도장을 고집하고 있는 것처럼 그리고 정치권에서 전기차를 만들자고 하니 도요타 회장이 다른 말을 했지요,2
250,"자동차세상의 진짜 주인공은 소비자입니다. 아무리 회사가 회심의 상품을 만들었어도 소비자가 외면하면 팔리지 않고 회사는 망하는 겁니다. 가장 중요한 포인트는 놓치고 곁가지만 따라가고 있네요, 토요타씨.",1
251,일본은 만화때문에 망할거에요 만화적인 상상력이 가진 한계죠,1
252,"BZ4X 의 초기 스펙에 대해서만 이야기를 하시고 아주 중요한 사실이 빠진것 같습니다.. 사실 토요타가 미국에서 신뢰를 받는 이유중 하나는 고장없는 내구성인것 같습니다. 그런 의미에서  BZ4X 의 가장 큰 차별점 중의 하나는 제로백이나 항속거리보다는  10년사용시 90% 배터리성능을 보장한다는 것 같습니다. 테슬라가  8년에 70% 유지를 보장하는것을 보면 아주 큰 차이인것 같습니다. 토요타는 자신들의 가장 큰 장점인 ""신뢰성"" 을 부각시킬 듯 합니다. 현대가 미국에서 엉터리 메이커에서 그나마 한단계올라설 수 있었던 계기가 아마도 10년 10만 마일 무상보증이 아니었을 까를 생각하면 전기차 시대에서 배터리 보증은 제로백이나 마력 이런거 보다는 아주 중요한 요소가 될듯 합니다.",22
253,솔직히 기술력으로 현기차가 도요타를 못따라간다,1
254,저도 최소한 2030년까진 내연기관 차가 활발히 팔릴꺼라고 생각하는 사람이라서 토요타의 이런 선택이 사뭇 이해가 되네요. 전기차 충전시간을 10분 이내로 끊지 못하면 내연기관 수요를 완전히 대체하는건 근본적으로 불가능하다고 봅니다.,4
255,이거 전고체 배터리 달린건가요?,1
256,일본은 진짜 넘 보수적이라 시대의 변화를 못 따라가네요.아니 변화에 화내고 꾸짖는 느낌.도요타도 소니처럼 옛날엔 전설적이었던 회사로 남길 기대합니다.,3
257,내연기관 자동차. 2년 안에 끝나요.  우리나라도 카센터 사장님들도 지금 고민이 많은데...,1
258,한국이 주차시설 부족으로 인한 충전문제로 오히려 일본보다 전기차로의 전환이 더 늦게 갈것같은 느낌입니다.,4
259,인정하기 싫지만 현재 나온 전기차중에 제일 맘에든다 너무 이쁨,1
260,원기옥 모으다 깔려 디질듯 ㅋㅋㅋㅋ,4
261,일본식 회심의 일격 = 진주만 공습,4
262,곧 현대는 경쟁 않될듯...역시 기본기 광고 부터 하는 우리와는 기술력으로 칼 갈며 준비한 토요타 기술력 인정합니다👍,3
263,전기는 과정일뿐 답은 수소다 미쳤다고 시총2위 회사가 수소에 대량으로 투자하겠냐,1
264,"개인적으로 몇년전까지만해도 우와 일본차 짱이네, 멋지네, 독일3사 못가면 도전해야지 했는데, 요즘은 뭔가 갸웃 하게 되네요ㄷㄷ",5
265,"전기차를 무슨 꼭 환경때문에 타는건 아니니깐요,  전기차 타다 오랜만에 화석연료차 타니 깜놀했네요, 덜거덕 거리고 느려터져서,,",1
266,도요타의 플랫폼이 TENGA라고?,4
267,"아무래도 핵을 맞은 그 기억이 유전자에 남아있어서 필살기에 집착하는 습성이 있는거 아닐까 싶네요병적으로 지나친 장인정신 역시 패전후 억척스럽게 살아가던 조상들에게 물려받은거 같구요아무래도 아마 기존 내연차 회사 중에서는 유일하게 배출가스로 세금 안내는 회사가 도요타가 아닐까 싶은데요그래서 하이브리드를 포함한 내연차 시대를 더 붙잡고 싶은걸수도 있겠죠지나치게 필살기, 전통을 중요시하는 그들의 습성이 아마 복합적으로 그들의 쇠퇴를 이끄는 스위치가 되지 않을까 생각합니다",1
268,한국 자동차 내구성 없이 는 도요타를 절대 이길 수 없다,1
269,전기차는 진짜 갸우뚱하게 되네요,2
270,차 자체는 아직 현기가 따라잡지 못한 완성도를 가지고 있죠..진짜 씹팩트,2
271,음...   소니와 파나소닉이  전세계  가전제품을  씹어먹다가  변화에  뒤쳐져서   잊혀진것 처럼  일본의 폐쇄적인 사고방식은  높은  기술수준에도  불구하고  도요타모터스가  잊혀질수도...  차는  진짜  좋은데  RX450H  타고  있지만   성능은 최곤데 편의사양과  내부디자인은 너무 구려... 클래식? 이라고 해야하나 ㅎㅎ,1
272,"사실 도요타 걱정은 쓸데없죠... 현기, 쌍용 걱정이 더 시급해 보입니다.",23
273,"솔직히 토요타는 툰드라,캠리,타코마 빼고는 안 끌림",3
274,앞좌석 복사 발판 저거 배터리 따뜻해지니까 바닥에서부터 따뜻해진다는건가..ㅋㅋ,1
275,태평양전쟁 때랑 이상하게 오버랩되는 장면들이 …… ㅋㅋㅋㅋ,7
276,"스마트폰 우습게보다가 망한 노키아,모토로라 예가 있음에도 도요타가 저렇게 느긋하면 안될텐데....",1
277,무슨 현기차를 세겨인들이 테슬라 처럼 열광 합니까? ㅎ,1
278,텐가 ㅋㅋㅋㅋㅋㅋㅋㅋ,4
279,ㅋㅋ 원기옥 비유 저도 똑같은 생각했었는데...,1
280,노키아왈 : 에이 스마트폰?? 그거 누가써 버튼도 없고 애플이  만든다고 삼성 .엘지.모토로라. 다 만드네 스마트폰으로 다 바뀌려면 10년은 걸릴텐데 우린 피처폰 더 만들어야겠다 (개꿀)...하다가 순식간에 망....,25
281,배터리가 폭발하는 자동차는 타고 싶지 않습니다.,1
282,일본 엄킁한 회사들  많지  절대 비공개 마지막 특허 기술 만들어 버리는 회사,1
283,그러니까 아직 관공서에서 연필만 쓰지,4
284,발로 하는 놀라운 장면이 잠깐 지나간것 같은데!? 읍읍!!,2
285,LG가 그랬죠. 스마트폰이 피쳐폰을 대체하려면 한참 걸릴거다. 그래서 우리가 피쳐폰 시장을 장악하겠다..했는데 결국 경쟁에서 도태됐죠.,1
286,저도 TNGA 보자 마자 텐ㄱ...,5
287,"도요타는 탄소배출에대한 대책은 어떤가요? 도요타는 다른회사들이 왜 전기, 수소차로 넘어가려는지 모르는건가요? 돈만 벌면 된다는건가?",1
288,9:09 아! BZ4X 이야기 하던 중이지 ~ 잊어 버렸다.,1
289,고급진 코나?,5
290,"일이인용 소형전기자동차로 출퇴근 장이나 보고 캠핑이나 장거리 취미 활동은 가솔린 카쉐어로, 평소 근거리는 자동력 자전거로 구상중",1
291,"변화를  두려워 하는 소인배 일본...     미래를  꿈꾸는 미국, 한국....  스마트폰 으로 쓴맛을  보았지만....    전기차  관련  토요타   ..  ?!",1
292,2:02 뜬금없는 배그 보급상자.,10
293,늦었다기 보다는 서두르지 않았다가 맞겠네요.,2
294,왜 토요타가 아닌 이유가....ㅎㅎ불공정한듯,1
295,역시 도요타네요 세계최고 기업답네요 전기차 관련 특허보유기업 1등이 도요타네요,6
296,일본 국민성 ㅇㅈ ㅋㅋㅋㅋㅋ,2
297,ㅋㅋㅋ 갑자기 일본 전설의 1군이 떠오름.,1
298,"소니,파나소닉,아이와의 워크맨, 브라운관TV후지필름의 필름식 카메라 등이고집으로 나락간 사업들",11
299,그따위식  또요타가 생각 한다면  결국 망하고 말지요,1
300,원기옥 ... 일본 돌려까기 ... ㅋㅋㅋ 일본에 남은 유일한 산업이죠,5
301,심야전력 낭비에 도움 되겠네요.,1
302,생긴건 그냥 라브4랑 렉서스 섞어놓은거같네ㅋㅋㅋ,1
303,소니가 스마트폰 엑스페리아를 처음 만들었을때 소니니까 뭔가 특별하겠지 했지만 별거 없었음  도요타도 마찬가지같네..,12
304,밧데리 수급이 안되서 주문해 놓은 차들도 출고가 안되는 상태이니...  뭐가 맞는건지...,1
305,차이 한명씩 넣어놓고 계속 발굴러서 무연료차 나올지도,1
306,한방 좋아하는 일본 그래서 원폭 한방에 나라가 나라갔지….,5
307,카운터 펀치 노리다 쨉맞고 기절하는거지...,2
308,드디어 나왔다,1
309,토요타 차만 사는 사람인데 지금 3대째 새차 사서 몰고 있습니다.토요타의 가치는 무슨 인상적인 스펙같은데서 오지 않고 그냥 차의 목적에 충실한 데 있습니다.내가 토요타 차만 고집하는 이유는 아무런 불만도 없고 문제도 없다는 겁니다.   엔진오일만 갈아주면 쉽게 오십만 탑니다.  그래도 그냥 새차같아요.인상적 디자인 파워  가속력 이런거 다 소용없어요.  벤츠 BMW 다 고장 잦고 고장나면 수리비 장난 아닙니다.   바쁜 생활에 엄청난 시간낭비에 스트레스   유럽차 다시는 안탑니다.   토요타 전기차 나오면 묻지도 따지지도 않고 무조건 삽니다.  단지 자율주행 기능때문에 테슬라도 심각히 고려중이죠.,7
310,일본차 망했다는건 한국인들 바램이죠 ㅋㅋㅋㅋ 그러면 현대는 진작에 망함,1
311,전기차 가즈아.,1
312,결국 스맛폰 시대에서 다 말아 먹고 나가리 되듯 전기차에서도 폭망 까진 아니여도 헛발질 계속 하다가 큰코 다치지지 않을까 싶네요.  너무 그냥 구려요. 스타일 이나 하이텍 그런 이미지가 없이 고장 안나는 차.  수프라 내놓은것 만 봐도 얼마나 소비자입장이 아니라 그냥 지네 하고싶은대로 대충 타협해서 편한쪽으로 가는듯.,6
313,외관 생긴게 렉서스 UX250/300 랑 비스무리 하네,1
314,욕심은 많은데 안되는 거 어거지로 밀어부치는...일본...갈라파고스 신드롬의 나라...ㅎㅎ,1
315,우리나라가 도요타 걱정하는게 너무 웃긴데.. ㅋㅋㅋㅋ,6
316,김한용의 원기옥론 ㅋㅋ 일리있다 있어,1
317,9:59 님아 그 강을 건너지 마오,3
318,도요타가 전기차를 늦게 나오는 이유는 탄소권에 있어 도요타는 여유가 있기 때문입니다.  배기가스 기준치를 도요타는 하이브리드 차량을 많이 팔아 여유가 있습니다. 다른 회사들은 탄소 배출권 때문에 적가를 보면서 전기차를 빨리 도입하고 있는 실정이구요. 실재로 테슬라는 차를 팔아서는 수입이 거의 없는데 탄소권을 팔아서 이익을 보고 있습니다.(코인도 팔구요)그리고 실제 전기차 관련 특허를 가장 많이 가지고 있는 회사가 도요타 입니다. 기술은 충분히 있는데 출시 시기를 보고 있는거죠 지금은 하이브리드 팔아도 많이 남으니 도요타는 여유가 있습니다. 한간에 일부 유투버들이 도요타 전기차 한참 뒤진다는 이상한 유언비어를 퍼트리고 있는데 ..... 참 한심합니다. 차에 관해서 도요타는 걱정할 이유가 없습니다. 현기나 걱정해야죠,5
319,LG가 스맛폰에서 좆된 테크트리 타네요 ㅋㅋㅋ,3
320,도요타도 망하기 싫으면 전기차든 수소연료전지차든 만들어야죠. 하이브리드로 얼마나 더 땜빵을 하려고.지금이라도 신차가 나온 게 도요타 입장에서는 다행이라고 생각해요. 누군가의 일자리가 없어진다는 등 무슨 헛소리를 하시는데 전기차가 배터리에 모터 달랑 얹은 심플한 물건인 줄 아나봅니다. 그 주변에 달려 있는 부가장비들만 정비해도 어지간히 먹고 살 수 있어요. 전기차가 심플해지면 심플해지는만큼 제조사들이 또 이것저것 붙인단 말입니다.,4
321,현대기아보다는 잘 만들었겠지.,2
322,안되겠다... 해외 디자이너 부터 영입해라...,1
323,"도요타, 혼다, 닛산, 미쯔비시, 스바루, 다이하츠, 스즈키, 이스즈, 마쯔다, 히노 vs 현기쌍.비교되냐??",8
324,토요다 자네.. 전기 LFA 만들 생각은 없나...?,1
325,도요타가 세계에서 전기자동차 특허가 가장 많은 회사인데하이브리드에 대한 미련이 많이 남아 있나 보네요.어디에다 팔려고 만들었는지 의문이 드네요일본은 전기자동차에 대한 인프라도 크지 않고 인식도 별로 호응적이지 않은 나라고미국은 테슬라가 꽉잡고 유럽은 유럽자동차 현대 중국 자동차 등등이 경합하는데,3
326,전세계 전고체 1위는 도요타라 발로 차서 만드는 울나라 기업보다는 기술력은 일본이 한수위인듯,9
327,뭔가 차 스펙이 아무리 전기차라도 스펙이 자신없으면 잘 안 내놓는 토요타답지 않은데;;,1
328,스티어 바이 와이어 궁금하다,2
329,"노키아가 그러다 애플한테 왕좌를 넘기고 역사 저편으로 넘어갔는데, 도요타도 그럴려나?",4
330,현지내수 야리스  크로스오버 닮았네,1
331,흠.. 너무 안일한거 아닌가...,2
332,"도요타가 전기차를 못만들어서 주력으로 안만드는줄아나 ㅋㅋㅋ 자동차시장 시가 1,2위를 타투고있고 전고체배터리 특허를 가장 많이 가지고있는 기업이 도요타인데 ㅋㅋㅋ 일본에선 전기차 시기상조로 생각하는거지 인프라도 아직 확보도 못했는데 ㅋㅋ아니 자동차가 서울에서 부산 왕복은커녕 편도도못가서 충전을 해줘야되는데 전기차 몇대 먼저 뽑아놓고 좋다고 ㅋㅋㅋㅋㅉㅉ 난 도요타가 전기차 본격적으로 달려들면 하이브리드때처럼 기술력으로 다잡을거라본다",5
333,미국에서 내연기관 차 1위 가 토요터 차량..,1
334,나만 이상한가 디자인이 좋다고 하시는 거 보고 살짝 혼란스러웠네요,1
335,국내차는 일단 만들고보고 문제가 생기면 고쳐서 수정하자 이런 방향이라면일본차는 100프로 완성도 아니면 판매도 안한다 주의라서.. 그동안 한국 미국 유럽차 전기차 전환이 빠를때 일본이 하이브리드 체제서 전기차로 넘어가는데 보수적인 이유는  향후 10년간 충전소 인프라도 일본도 마찬가지로 문제가 많다는 점 카센터 공업사서 전기차 전환으로 인한 정비사 실업자 양성 부품 업계 매출 감소 우려를 고려하여일본 차 업계서 전기차에 소극적이었죠 하지만. 토요타의 기술력과 완벽주의성 완성도는 테슬라나 현대기아 전기차보다 높은 완성도와 강점을 가지게 되어 기대가 됩니다.,4
336,캬~ 정말 말 잘하시네~,2
337,앞은 코나요. 뒤는 ev6 로다.,1
338,노키아=도요타,4
339,일본은 애니메이션의 영향이 크다~ 그놈의 회심의 ㅇㅇ,1
340,도요다가 실패해서  지금 위치를 뺐긴다면 진심 일본은 뿌리까지 흔들릴듯...한국에서의 삼성과 같은 위상,5
341,10:07 kwh를 잘못쓰셨어요!,1
342,ㅋㅋㅎㅎ 총적으로 미국국민차 도요타을 깍아내리는구먼 머가아파 배가아파 몽구스 나라답네,1
343,안살래요ㅠㅠ,5
344,"늦은 출시 시기, 낮은 성능, 뜬금없는 디자인은 개취라 넘어가도... 도요타라는 이름 말고는 볼게 없네.",1
345,일본이 약간(?) 변태같은 면이 있죠...ㅋㅋ,3
346,개쩌는 한방을 좋아하는 일본은역사적으로도 개쩌는 한방을 노리고 진주만을 공격했지만....,11
347,그냥 구색 맞추기로 전기차 내놓았네,2
348,디자인 직이네....,1
349,"도요타가 오만해서가 아니라, 미국에서 너무 괴롭히고 기술 강탈해가고 해서 은밀하게 진행하는 거에요, 결국 수에즈 운하 사고로 미국한테 털려서 테슬라랑 기술제휴 해서 강탈 당하고 있는중이긴 하지만요,",4
350,오 디자인이쁘다,3
351,렉서스 모 회사가 도요타 아닌가 브레이크 밝지마세요가 생각이나는군요,2
352,이넘 차리뷰하는거보면 참웃겨 11:05 100키로 까지 7.7초면 충분히 빠른가아닌가? 아니뭔 도로에서 레이싱 할려고 그러나 ㅋㅋ 마력도 218마력이면 충분할텐데 하이간 쇈징이들 겉멋만들어서 무조건 빠르고 마력높아야 좋은줄알아요 ㅉㅉ 하긴 도로에서 쌩쌩 달리며 운전하는건 쇈징이들이 유일하지,5
353,일본차는 좋을까 왜 한국 자동차는 일본차와 비숫할까,1
354,토요타 화이팅,1
355,"요즘에는 어느 순간부터, 일본차는 우와~ 이런 느낌이 없어~;;요즘 현대기아 신차들이 도요타에 뒤지는 것도 없고 오히려 상품성이나 디자인은 더 나은것 같고, 렉서스가 벤츠 BMW 만큼 고급지다 라는 느낌을 못 받는거같아서 그런거 같음~~",4
356,그래서 얼마정도에? 출시되는지는 얘기를 안해주시네,1
357,전기차 쏟아지는데 전기만드는 원자력은 뭐하는겨.. 태양광  산밀고 얼마나 쳐넣어야 ㅜㅜ,1
358,일본차는 아무리 좋아도거시기 합니다~~,14
359,전기차가 대세네,2
360,토요타 걱정하는건 말도 안돼죠 기술 개발에만 현기의 몇십배는 하는 기업인데기술은 가지고 있지만 시기 상조라서 안내놓는거인듯,7
361,뭐 어차피 다 조작된 것 아닐까... 이젠 뭐 믿을 수가 있어야지.,1
362,빨리 사야겠는걸,3
363,"국뽕채널에서 토요타 망했네.. 일본 배터리 폭망.. 일본 전기차 낙후.. 일본 절망.. 이런 국뽕뉴스를 쏟아내고 있는데 사실은 다릅니다. 전기차 부문에 가장 많은 특허를 가지고 있는 회사가 도요타고 한해 전기차에 투입하는 연구비 1위가 몇년째 도요타입니다. 현기차는 비교도 안되요.. 그리고 일본은 리튬,전고체 배터리 기술을 모두 가지고 있습니다. 언제던 전기차 양산이 가능하죠.. 그런데도 왜 내연기관 자동차에 목매냐.. 포기할 이유가 없기 때문입니다. 한해 천만대 가까이 생산하고 미국내 내연기관 자동차의 판매량이 오히려 늘었습니다. 급할 것이 없는거죠.. 현재 불안정한 전기차의 배터리 충전화재나 각종 오류나 문제점을 지켜보고 후발주자로 참전해도 충분하다는 자신감이 있는거죠., 토요타 쉽게 무너지지 않습니다.",9
364,도요타 느낌은 어차피 돈도 있고 브랜드도 있는데 앞서서 가지말고 누군가가 길을 개척하면 안전하게  따라가자. 그동안은 자신들이 할 수 있는것들 개발하는것같네요.,3
365,토요타-도요타폭스바겐-복스바겐..포르쉐-보르쉐…???,1
366,쓰레기 현대 기아 전기차 보다는 도요타 무조건 사세요....해외에서 싸구리 싼맛에 타고 버리는차가 현대 기아차 ...허접하고 내구성도 후지고...한국 차는 삼류 기술로 만든 차........중고로 팔아도 똥값......도요타 중고차 가격 안떨어짐......,4
367,현다이 정신 바짝 차려라 준비 철저히 하기를,1
368,소니 파나소닉의 몰락과 함께 일본도 끝이낫구나!,1
369,도요타가 무너진다는 소리보다 삼성이 무너지는게 더현실성 잇는데 ㅋㅋㅋㅋ,7
370,Self chargong hybrid 라더니 엌ㅋㅋㅋㅋ,2
371,유튜버 쇠교수도내연기관빠 ㅎㅎ,2
372,일본은 건전지 밧데리 개발 빆에 안해서 그리구 중국 대리 생산 차량은 어디꺼야 그냥 걸러야지,1
373,17:04 지금 다시 보니 toyota 가 아니라 toyta 네요 ^^;,1
374,이웃집의 도토로 도토로..,3
375,고출력시 나오는 배터리 발열문제를 해결 못했거나 모터 성능 자체가 구린듯 ㅎㅎ...,1
376,불쌍한 토요타 그러지 마라 차라리 라브4 전기차 만들지 바퀴마다 모터 달고ㅋ,1
377,"유럽을 시작으로 환경규제 강해지는데, 북미 & 내수만 바라보다, 결국 내수만 바라볼 지도 모르겠네요.",2
378,950만대라 대당 오천불 만 남기면 그금액은 계산이 되나ㅡ역시 일본느ㅁ은  대단하네ㅡ세계이삼위경제대국이라더니  도요다만  망해버리면 우리자동차회사 힘을 펼텐데 망할이유가 없겠네?ㅡ전기차 까지 나오다니?ㅡ하늘도 없나보네  망해야되는데?,1
379,너무 막 말하네요 전문 가술자들이 다 이유가 있으니까 그렸개 만들었겠죠 모르면서 이상하다고 까는건 보기않좋아요~,2
380,생긴건 EV6 배낀거 같은데...,1
381,도요타 전기차 안한다고 안했나?,1
382,일본차는 하나 같이 디자인이 다 난해함.,1
383,안면마비 올 정도면 일 쉬셔야하는 건 아니신지요?,1
384,그냥 토요타 하는대로 하겠지요!내벼둬요! 신경쓸거 있나요!,1
385,어줍잖은 것보단 훨 낫네,1
386,4:57 왜 쓸데없는 외래어표기규정을 만들었는지.. 통일되게 표기하는 건 좋으나 한글의 최대 장점인 발음 그대로 표기하는 걸 포기한 거잖아,1
387,노조의 방해만 없다면 현대기아가 짱인데...,2
388,도요타는 하이브리드가 많아서 다른회사보다 탄소규제를 덜받습니다어느자동차 회사보다 가솔린차를 더많이 더오래 팔수있다는거죠그리고 마력을 조정하는건 다들아시겠지만 너무고성능은 차체도 고성능에 맞게 해줘야하기때문에 원가가 올라가죠현기가 만드는 아이오닉이나 이브이 같은 약한차체로는 고마력을 버틸수있는 능력치가 가 낮아서 주행능력이 낮아 사고위험성이 높습니다 그래서 고마력을 하지않는겁니다이런걸볼땐 테슬라가 많이 팔리는 이윤 서스가 고성능에 맞게 세팅되어 안정성 있는 고성능을 지향 할수 있다봅니다,2
389,이분. Sm6가 좋다고 하신분이네.ㅋㅋㅋ,1
390,토요타의선택이옳타,2
391,ㅋㅋㅋㅋㅋ..당신펜이야...마스크가 정말이쁘네....모카마스크....같고싶네....모내줄수있는지...미국으로...너무먼가...,1
392,토요타 전기차는 중국에서 가져온다던데,1
393,車は良いけど、内装やパネルにはガッカリした,1
394,토요타 혹시 화면이 아날로그 인가??ㅋㅋㅋㅋㅋㅋㅋㅋㅋㅋㅋㅋㅋㅋ,2
395,ㅋㅋ 그런회사가 비 정규직만 뽑아??,1
396,전기차는 아직 시기상조. 일본애들이 이걸믿고 아직 방심하는듯.,1
397,그래 너희 신념대로 밀고 나가라 응원할게 토요타,1
398,테슬라를 그럼 데슬라 라고 불러야 하나요 ? ㅋㅋ,1
399,6:17 따봉,3
400,바보들.. 그러는동안 세계 차제조사들은 가만있겠냐 등신도요다. 망해랏,1
401,오늘 재규어 화재 소식 났던데..,2
402,일본차는 리뷰안하는게 좋지 않을까생각합니다  우리나라는. 일본에 승용차 한대도 팔지못합니다  그런나라 차광고하는거랑같지안을까요,1
403,"뭐 평균 이하의 전기차일 뿐이네요.ㅋ 다만, 현대는 이번 전기차로 역전의 발판을 만들 수 있습니다만, 역시 발목 잡는 노조 때문에...",2
404,일본에 파는게 아니라 미국에 팔겠다는거 아님?,1
405,도요타승   아직까지는,1
406,그러다 노키아 꼴 난다 근데 솔까 현대 마크보단 도요타 마크가 훨 낫긴함,2
407,현기차 국뽕들 진실들어나!!!,1
408,진짜 아무도 모르는거아닌가요??토요타 얘네 무서운 놈들이라....1위 자동차회사다 뭐다 이런건 둘째치고 입귀 꾹닫고 계속 개발하고 보완해서 하이브리드 최초양산에 성공한거 보면..,3
409,어릴때 오락실좀 다니셨나보네요 ㅋㅋ얍삽이 탁탁탁탁 ㅋㅋㅋㅋㅋㅋ,1
410,제조사들이 엄청 많아 지네요....,1
411,일본은 가솔린에서도 뻥연비더니 전기차도 그러네.,3
412,"lol that's right. not Toyota, not Doyoda. Mr. Toyoda says... acute observation.",1
413,EV6 디자인이랑 거의 같은데?,1
414,제네시스 전기 브레이크 아닌가요?내가 브로셔를 잘못봤나,1
