,comments,likes
0,중요한거 시간이 오래가도 배터리의 효율이 떨어지지않는다는데.. 이 다음 전기차가 너무 기대되네요! 얼마나 좋은차를 만들어서 가지고 발표할지가 궁금하네요,5
1,기존의 내연기관 엔지니어들을 자연스럽게 전기차 설계와 연계해서 설계하게 해서 기존직원들을 최대한 활용하려는 계획이네요..,12
2,사실인지는 확인할 방법이 없으나 미의회에서 친환경 전기차·수소차 정책을 반대하는 가장 큰 로비스트가 도요타 자동차라는걸 들은적이 있네요. 근데 도요타도 이제 대세를 거를 수 없다 판단을 한 모양입니다.,13
3,기술이란 게 소비자가 보는 시선으로만 따지면 어느날 갑자기 훅 바뀌던데 점유를 조금씩 하는 게 아니라 고작 2~3년 안에 70프로 이상 물론 차는 비싼 재산에 가까운 것이기에 그렇지 않을 거 같긴 함,6
4,스마트폰 나올때 아직 시기 상조를 외치던 노키아 엘지는 지금 어떻게 됬는지 보면 도요타의 행보는 정말 기대가 되는군요,54
5,도요타는 2010년 까지 미국서 카세트데입 플레이어 장착됀 모델 팔았음.2010 Lexus SC430 세계에서 가장 마지막으로 카세트테입 장착한차. 😁,19
6,탄소제로 문제 때문에 토요타가 마냥 하이브리드만 고집할 수는 없는 사정이 있죠,6
7,지금 탄소배출제로 같은걸 하는이유가 이대로가면 10년 뒤가 없을수가 있다고 하네요. 탄소배출 총량이 되돌아올수없는 수준을 넘는다구해요.앞으로 새로운차는 전기차로 바꿔야될때입니다,10
8,기존 하이브리드에 적용되는 말만 4륜인 시스템이 적용되있는듯 합니다.,25
9,베터리 수급에 문제가있는 지금상황에서는 80kw 베터리차 1대 가솔린차 15대 있는거보다 5kw베터리 하이브리드 16대 있는게 환경에 더 좋다는게 토요타의 논리.,29
10,LCD 넘어갈때도 이미 OLED 개발이 시도되었군요 와…,4
11,도요타 전기차 개발연구 많이함...단지 모터부분 희귀금속  중국이 갑질할때  다른 대체 재료 찾으려고 노력한것도있고..전기차는 베터리  모터 +자동차 조립관련전반 기술만 있으면 다른기업들 진출이 쉬우니까 ..하다못해 애플도 진출생각...ㅋㅋㅋ 전기차 1년유지비용 휘발류차 보다 넘사벽을 좋지만.. 충전부나 바닥 일부 긁혀도 베터리. 전체 교체하거나 수리비용 많이드는거 보면 보완점이 필요하긴함....지금당장 전기차는 출퇴근용 까지는 가능해도  무거운 물건 운송하는 분야는 아직 약한것같음..,1
12,스트리어링 바이 와이어는 인피니티 Q50/60중 선택 사항현대도 향후 10-20년을 위해 내연기돤과 하니브리드 개발을 계속해야할듯,6
13,이번 편은 김한용 기자님의 생각이 많이 담긴 영상이네요. 재미있게 잘 봤습니다. ㅎㅎ,2
14,수소 폭발시켜서 가솔린엔진처럼 만드는거 예전에 했던생각이였는데 이미 시도했었군요..,1
15,저게 한 방에 훅 되는 거면 그랬겠지..근데 기술축적이 되어 있어야지 급변하는 것을 대처하지,8
16,재미있으면서 논리적으로 도요타를 까고 있어서 즐겁게 봤습니다.,7
17,일본은 전기차 보급이 쉽겠네..차고지가 있어야 차를 살수있으니까,257
18,성능보다는 안정성?에 신경쓴걸까요? 스바루와 공유하는 차량이라서 부품호환성은 좋겠네요.,4
19,그런데 동시다발로 회사들이 전기차 만들게 되면 소비자들이 매연기관차에 매력을 느끼려나? 대세를 따르는 소비가 이루어딜듯!,2
20,"빠른 전기차 정보, 좋아요!!",4
21,"지연전략은 좋은데, 공룡이 된 도요타가 전환이 빠를까 어느 순간 올드패션드의 대명사로 남을거 같음",3
22,근무전 항상 시청할 수 있어서 너무 좋습니다~~ 성공 하실 수 밖에 없는 모카 한용님 홧팅!,6
23,전기차 출시도 전에 원가절감을 시도하는 듯한 느낌이네요,3
24,도요타 캠리가.. 요새 나올때도..6기통 엔진은 FWD 뿐이고..4기통 엔진에만 AWD 로 나옴.,8
25,일본 유투버중에 플랫폼이름 텐가라고 했다가 불타오른 사람이 한명 있었던거 같은데 ㅎㅎㅎ스펙상으로 별로 기대받는거 같지는 않은 느낌같은 느낌이더군요,3
26,일본은 항상 산업의 큰 변화가 있던 시기에 어물쩡거리다가 한국에게 추격당했죠 ㅎㅎ 아마도 자동차산업도 같은 길을 걸어갈거라 생각되네요일본인의 무창의성과 무혁신성은 20세기로 끝난것같음,5
27,잘봤습니다. 노보스인터스트리에서 칠판강의때 도요타의 전고체 배터리이야기를 많이하더군요.앞으로 5~6년을 기다려야한다고합니다. 국내에도 출시할 가능성은 있을지도모르겠네요. 내년에는 렉서스 ux250h의 전기차인 ux300e모델이 2022년 상반기에 출시예정입니다.,2
28,하이브리드 또한 eu환경기준에 포함되서 더이상 팔기 힘들듯,36
29,다른건 몰라도 운전대와 브레이크가 전자식인건 많이 불안하네요.,4
30,차에 대해서는 잘 모르지만 일본이라는 나라는 참... 독특합니다. 새로운걸 참 터부하는 느낌이 드네요. 어떻게 저런 생각을 하지? 싶을정도로 일본이구나 싶어요.,6
31,원래 1등기업은 혁신을 하기 어렵습니다. 잘팔리는데 머하러 모험을 하겠습니까.. 판 깔아놓으면 들어오겠단 심산이죠. 머 그러다 망한 기업들도 많치만 가봐야알겠죠.,2
32,단순히 늦는 것이 문제가 아니고 늦는 만큼 기술과 데이터 축적이 이루어지지 않는 것이 문제.  즉 10년 늦으면 20년이 뒤쳐지는 상황이라는 것.,23
33,"100%  문제 없는 공산품을 만들겠다는 자신감이 도요타는 갖고 있는것 같습니다. 1억분의 1이라도  문제가 생기면, 그 사람의 운명이라고 생각하는듯...",9
34,"아이오닉 계기판을 핸들이 가려서 핸들 아래로 내리고 싶어도 못내리는데.. 계기판이 핸들 위로 보이는 것, hud가 필요 없어지는거. 너무 좋네요.",3
35,"토요타는 블루오션이라고 가솔린을 막 만드는데유럽과 미국에서 화석연료 규제한다고 수입을 막거나 핸디캡을 마구 주겠지.독일과 포드가 가솔린을 안만들면, 가솔린차는 당연히 못파는거지",5
36,도요타도 본격적으로 전기차로 뛰어드려는 그런경우인듯.,18
37,"일본의 자동차 미래 샤프, 도시바 처럼 몰락할지.... 너무 궁굼하네요도요타 혼다 닛산 어떻게 될지...일본사람들은 똘기(?)가 있어서 어떻게 또 돌파구를 찾을지 모르긴 하는데지금은 전망이 밝지 않은게 사실이군요.진짜로 전고체 나오기 전까지 전략차종 1-2대로 버티다가 전고체로 넘어가는 상황도 볼 수 있겠구요",7
38,전세계 자동차에 배터리 만들 자원(희토류 포함)이 충분한가요??? 대책은 있는건지?,6
39,바이 와이어 조향시스템을 시도한건 자율주행에 유리한 하드웨어 포석이 아닐런지요.,2
40,도요타 회장이 일본내에서 전기차로 못 넘어가는 이유가 기존  일본내 고용된 내연기관 인력과 관련 산업때문에 그렇다는 식으로 말하더군요. 일본정부에게 내연기관 인력과 관련 산업 대책을 마련해야한다고 요구하고 있습니다.,6
41,테슬라의 판매원가나 자동차 판매후 발생하는 구독서비스 생각하면 토요타 300만대에 맞먹는 이익율이 아닐까 생각합니다.,7
42,전기차는 만들기가 쉬우니까 전고체 전지가 성공하기 전까지 하이브리드로 울궈먹고 있다가 전고체 전지가 나오면 한방에 황제가 되겠다 이런 심산으로...... 그런데 그사이에 남들이 길을 다 차지하고 못다니게 합니다 ㅋㅋ,4
43,"전기차 보조금받고 동급 가솔린과 가격경쟁력 있다 생각하고 사도.. 배터리관련 as가 생기면 고치기도 어렵고 어마어마한 수리비가 나오죠.. 수리비는 보조금이 없거든요, 그리고 연식이 지날수록 배터리 효율이 떨어져서 중고차 감가도 심할것입니다. 차값고 배터리 관련 비용, 효율등이 좋아져야 적절한 시기라고 보는데 억지로 전기차 시대를 앞당기고 있다고 보입니다. 사실 도요타의 직병렬 하이브리드 시스템은 엄청난 효율과 성능을 자랑하는데 특허로인해 다른 기업들은 쓰고싶어도 못쓰는 시스템이죠. 도요타의 하이브리드 독주를 막기위해 하이브리드 시대를 끝내버리고 억지로 전기차로 넘어가야 도요타를 제외한 다른 기업들이 유리하긴 할겁니다. 탄소핑계를 대고있지만. 하이브리드도 충분히 친환경적이죠",4
44,남들 전기차 만들어도 자기들은 내연으로 간다고 당당하게 외치더니전기차 결국 만들었군요 ㅋㅋ그래도 일본인스러운 그 고집덕분에 전기차 중에 가장 완성도가 높지 않을런지..,1
45,저렴하게만 나오면 모든게 이해될것 같아요,1
46,어짜피 유럽에서 도요타가 안팔렸으니 굳이 안만들겠죠. 도요타가 많이 팔리는 국가들 보면 이해가감,5
47,일본은 하이브리드 차량 비중이 전체 과반수 이상이기도 해서 전기차 수요가 적을듯 하네요 그러다보니 전기차 시장에 조금 늦게 참여하는 것 같습니다영상에서 도요타 논리도 들어보니 그 말도 맞는것같기도 하고 ㅋㅋㅋㅋㅋ,38
48,예전부터 보면 4:28 숨찰 정도로 까놓고 너 말하는건 아니야!! 라고 탈출하는 기술이 아주.... 포브스 선정 탑 10 급이네요,6
49,김한용기자가 탠가로 나를 웃기다니... ㅋㅋㅋㅋ,3
50,비행기도 수십년동안 fly-by-wire로 날아다니는 세상이죠. 충븐한 신뢰성을 가질 수 있다면 자동차도 by-wire로 가게 될 것 같습니다.,1
51,87년에 첫 차를 샀고 가솔린차를 오래 탔지만 하나도 엔진에 대한 환상은 없네요. 작년부터 모델3를 타고 있지만 모터를 경험하고 나니 생각이 바뀌었네요. 성향의 차이일 뿐이라 봅니다.,15
52,모터가 2배가 되어도 마력이 비슷하면 일반내연기관 몰던 주행감각으로 탈 수 있을것 같기는 한데.. 너무 잘 나가도 무서우니까,4
53,토요타의 자동차는 고출력 고성능보다 절전에 촛점을 맞추고 있어요.  전기  많이 쓰니까 배터리 많이 넣는게 아닌 전기를 덜 소모하는 쪽으로  개발되어 있어요.,25
54,"유럽기준 최고500키로면 ev6랑 비슷한 수준이거나 약간 낮은 정도니 괜찮은데, 문제는 가격이 어떻게 되려나...",3
55,도요타의 마스터 드라이버잖아요. 최고CEO가 차를 가장 잘모는사람저는 아키오는 좀 무섭게 봅니다.,1
56,재미있게 잘 봤어요!,6
57,전기차에 너무 기대하는데 지금 당장 전기차타기 불편합니다.충전시간에 항상 주행거리 신경써야하고 보조금없으면 차값도 6천만원임물론 언젠간 전기차로 다 바뀌겠지만 지금부터 몇년간은 불편한게 맞고 당장 타고 다니기는 하브가 좋다고 보네요.기름값 좀 아끼겠다고 전기차간다면 후회할수 있음,25
58,미국에서 전기차 재끼면서 자기들 하이브리드가 진정한 미래이면서 친환경 이라고 광고 했던거 생각나네요,15
59,모든 차를 전기차로 바꾸면 전기는 어디서 나올까? 라는 의문을 도요타도 갖고 있능거 같네요,3
60,일본 자동차 제조사들 공통적으로 아쉬운게 인테리어가 너무 구닥다리라는거... 그나마 이 모델은 큰 디스플레이 넣어서 조금 덜하긴한데 송풍구 디자인도 좀 신경쓰지 저거 하나 때매 올드해보이네,6
61,내연 기관 때는 히트 펌프가 필요 할 이유가 없었는데 전기차에는 이게 필요한건가?AC와 heatpump 큰차이는 부품 하나 차이라 획기적 건 아님.,2
62,예전 대우전자의 탱크주의 정신. 제품을 너무튼튼하게 잘만들어서 고장이 안나니 제품구매 순환이 없어서 오히려 망했다는 일화,2
63,"이건 뭐... 토요타는 전기차를 진심으로 하겠다는 건지 아닌지... 주행거리,전비,출력,충전시간까지 뭐 좋은게 하나도 없는데...",1
64,도요타의 구색맞추기폭스콘이 만들어도 저정도 스펙은 넘을듯,17
65,마력은 아무래도 연비때문이겠죠..,3
66,한용님 1200달러 넘었어요 ㅋㅋ.주주로써 기쁩니다!!,8
67,"일단 자국시장,미국시장에서는 살사람 많겠네. 신뢰가 중요해",11
68,현재 자동차 업계 보면 첨단 과학 기술의 모든 것을 다 보는 거 같습니다제 주위에는 아직도 하이브리드는 어디서 전기 충전하냐는 소리나 하고 있는 전부 차알못만 있는 고구마 몇 개 먹은 답답한 세상에서 모카 들어오면 항상 놀라운 자동차 이야기가 많아 속이 뻥 뚤린 느낌입니다,2
69,토요타가 전기차를.... 지금까지 전기차를 안만들다가 갑자기 전기차를 만드네.... 나는 늦었다고는 생각이 안들고 그만큼 내연기관을 포기하기 싫다는것으로 보이는데.....,1
70,진짜 말 너무 잘하신다 ㅠ늘 좋은 영상 감사해요!,11
71,"솔직히 제가 미국에 이민 오기 전까지만 해도 도요타 회사가 이렇게 유명한 회사인줄도 몰랐습니다. 한국에서만 살면 일본차 개무시하게 되죠. 근데, 미국에서 어디 큰 공용 주차장을 한번 둘러보거나 고속 도로를 달리면서 보면 도요타차수에 놀라게 됩니다. (렉서스 포함) 특히 한인 교회 주차장을 가면 반 이상은 도요타(렉서스), 혼다(아큐라), 니산(인피니티) 이런순이고 나머지 겨우 독일, 미국, 한국차 입니다. 특히 산호세나 IT 회사 주차장을 가면 이게 도요타 켐리 주차장인지 구별이 안갈정도로 많죠 (인도인들의 도요타 사랑)  그럼 왜 그럴까요? 이유는 단순해요, 크게 비싸지 않고, 부품 비교적 싸고, 잔고장이 덜해서 오래 탈수 있고 리셀 밸류가 높아서 입니다. (도요타 차가 뭐가 싸냐, 비싼건 엄청 비싸다 그러시겠지만, 실제 제일 많이 팔리는 차는 2만불도 안되는 ""코롤라"" 입니다) 자동차를 그저 교통수단으로 밖에 생각 안하는 대다수의 자동차 소비자들이 딱 원하는것이죠. 자동차에 미쳐 디자인이 어쩐다, 성능이 어쩐다, 저거 나오면 내가 산다...이런말들 하는 사람들이 전체로 따지면 몇프로나 될까요? 바꿔말해서 그 사람들 타겟으로 차 만들면 딱 망하기 좋은거죠. 도요타는 그걸 아는것 같습니다.",3
72,저번에 광고에서 자동차의 역사를 보여주면서전기차를 내연기관차보다 뒤로 보여줬던 애가도요타 아니였나…?그리고 발컨이라….,4
73,하이브리드가 좋은거같음.. 충전 귀차나 폰충전도 긔차는데,9
74,bz4x 는 발음상 busy 4x 로 들리는데 바쁜 네바퀴 즉 네바퀴가 열심히 일한다는 뜻같네요.,2
75,컴퓨터로 가동시키는 기계쟁이 20년 넘었는데 같은일을하는 기계중 부품적은기계가 고장도적고 유지비도 적지요엔진차부속 3만개로볼때 수소차 하이브리드 3만개이상일거 확실하죠,3
76,한 가지 복병은 SDV를 만들기위해 소프트웨어 투자를 폭스바겐만큼 하고 있다는거 현재 아키오 사장 아들이 도요타 소프트웨어(아린) 투자개발회사 대표입니다이거는 현대기아도 빨리 따라가야할거 같아요,4
77,"엔진기술자 살리겠다고 수소를 다시 태우겠다?미국이 강제개항 안 시켰으면, 일본은 아직도 옆구리 칼차고 다닐 듯.",1
78,우리나라도그렇고 유럽도 빠르면 25년 늦어야 35년부터는 전기차만 생산하도록 규제하는데 저렇게 버틴다고 되는일이 아닐텐데,6
79,"자동차 전동화가 아쉬운거 진짜 공감가요 어릴적부터 꿈꿔왔던 수동변속기에 내연기관 차량들을 마음껏 탈수 있는 능력과 나이가 되었는데 정작 시대는 그걸 버리고 더 쓰지 못하게 규제를 강화하는게 섭섭하죠 갤로퍼, 코란도, 무쏘 같은 디젤차는 특히 더 그렇구요. 물론 환경과 미래를 생각해서 신기술 개발과 규제는 당연한거지만 반강제적으로 이전 것들을 즐길수 없는건 참 뼈아픕니다 어릴적 아버지 어깨너머로 운전하시던 모습을 동경하면서 나도 어른 되면 낡았어도 구형차를 타면서 불편한 승차감, 진동, 시끄러운 엔진소리를 즐기는걸 꿈꿧는데 말이죠",10
80,전고체 배터리 나올 때까지 하이브리드로 버텨보겠다는 건가? 하여튼 앞으로 5년~6년간은 전기차 시장에서 도요타는 끝.....,23
81,가솔린아쉬워도 환경 생각하면 전기로 가야죵 ㅎ,1
82,4:14 역시나 현실화되면 토요타보다는 전기차 만들던 짬이 있어야 더 잘 만들겠죠 ㅋㅋㅋㅋㅋㅋㅋㅋ,13
83,디자인이 그냥 토요타스럽다,1
84,9:58미친 텐가 ㅋㅋㅋㅋㅋ 기절할뻔했네 ㅋㅋㅋㅋㅋ,25
85,아마 기술자 일자리를 위해서 기다린다는 말이 현실일 가능성이 높을거 같네요. 일본 국민성을 생각해보시면…공무원들 일자리 없어진다고 아직도 아날로그 방식으로 업무를 하고 있고. 은행원들 일자리 없어진다고 인터넷 뱅킹도 아직 잘 안되고..북미 렉서스 판매량이 계속 내려가고 있지만 아직 토요타 북미 모델들이 잘 팔리니 시간이 있다고 생각하는거 같네요.,1
86,렉서스  RX 와 NX 느낌이 많이 나네요. 좋아보입니다.,9
87,도요타는 누가뭐래도...자동차 메이커중....탑에 속하지....,8
88,4:28 깨알 같은 갓산직의 발차기 ㅋㅋㅋㅋㅋ,2
89,이미 아파트마다 충전시설 다있고 단독이면 집주인이 충전기 설치하면됨 출퇴근 50km이상인 직장인은 지금 전기차 다들 고민하고있음...생각보다 전기차시대는 빨리 올거라고 봄,3
90,근데 수소충전소 보급이 빨라지면 전기차 오래갈 수 있을까요?,4
91,이쁜데? ㅋㅋㅋev6를 조금 더 날카롭게 만든 느낌이네 기존 도요타 만큼의 내구성을 보여준다고하면 갈만함. 근데 주행거리 개에반데 350이면...서울에서 부산까지 3번은 충전해야 앵꼬 안나겠는데,2
92,근데 10년정도는  하이브리드가 나쁘진않다고봄전기차가 주행거리나 충전이 문졔..가격도 비싸죠,13
93,전기차를 빨리선점해야하는이유가 주행로그등의 빅데이타 축적이 제일중요한포인트 같습니다 결국 자율주행으로 귀결될텐데 그 기술의 모태가 추행습관기록등의 데이타를 분석해야하는데 이부분이 테슬라가 아직까지 제일 잘하는 부분이니깐요 ㅎ,1
94,아날로그 기술로 LCD TV를 만들었던 미친 나라가 일본. 하지만 그게 일본의 장점이자 단점이죠. 굳이 시장에서 필요로 하지 않는 기술을 현실로 만들어내면서 기술을 뽑내려고 하거든요. 뇌피셜이지만 그짝에서 몇년동안 일본 사람들과 함께 일해 본 경험이 깔린 뇌피셜입니다.ㅋ영상 너무 잘 봤습니다. 시장에서 어떤 반응을 보일지 기대가 됩니다.,1
95,전기차관련 특허 젤 많은곳이 토요타로 알고있는데 아닌가요?  세계 1위라는건 그냥하는건 아니지 싶어요 궁금한게 있어요 전기차 진짜 친환경 맞을까요?  배터리 만드는데 정말 어마어마한 환경파괴가 있고 나중에 폐기물은 어찌할것이며 당장 5년이내 10년이내 전기차가 50프로 70프로쯤된다면 과연 아파트에서 충전할수있는 전기가 땡겨와 질까요?  선진국들의 새로운 먹거리에 또다시 중진국 후진국의 환경을 파괴하는건 아닐까요?,1
96,전기차 시대는 지금보다 더 빠르게 주인공이 될 듯~,3
97,미국한테 뚜드려 맞더니 전기차 시장 결국 발을 들여놨네. 일본이 현실적인 전략을 잘짬. 근데 전기차 잘 만들면 잘할것 같은데 쉽진 않아보인다.,1
98,도요타 전기차 그렇게 늦었다는 생각이 안드는게 북미에선 어차피 아직 현대 기아 전기차 신모델 한대도 굴러다니는게 없습니다. 가을에 나온다더니 아직 소식없고 구체적인 인도 일자도 나온게 없거든요. 공도에서 많이 돌아다니는건 테슬라가 유일하고 간간히 폭바 ID3하고 포드 Mach-E 가 보이는게 다입니다. 테슬라만 빨랐지 나머지 브랜드는 도찐개찐이란 생각입니다.,9
99,도요타가 급하긴 급했구나 공엄용 찰흙으로 만들어 16대 전시를 하는것보면..움직일수있는건 BZ4X뿐입니다,2
100,마쯔다 전기차도 깨던데... 엔진룸 비워놔서 왜 트렁크도 안 만들고 걍 비워놨냐니깐 가솔린모델은 엔진들어가야해서 비워놨다는... 뭔..,5
101,스노블로워는 아직 가솔린 쵝오지. ㅎㅎㅎ,1
102,"김한용 님, 영상 잘 보고 있습니다. 감사드리고요.영상제작에 대단히 수고 많으십니다. 그리고, 한 가지 Toyota발음에 대한 의견입니다만...일본어 교재 (=일본인도 잘 모르는 일본어 문법)에 따르면, 카(カ),타(タ)行의 발음이 강한자음이 단어의 첫머리에 오면, 부드럽게 발음해야 한다는 문법(법칙)이 있습니다. 본인은 일본에 직업상 오랜기간 왕래를 하고,일본어 공부를 하는 과정에서 알게된 지식입니다.즉, Toyota(도요타), Tokyo(도쿄),Kyoto(교토) 등입니다.실제로 일본인들 중에서, 토요타,토쿄,쿄토라고 발음하는 사람은 아무도 없습니다.한국어도 실제 소리나는 대로 영문표기를 하도록 바뀌었지요. 부산(Pusan-->Busan), 대전(Taejeon-->Daejeon),대구(Taegu-->Daegu)등.입니다. 참조하시기 바랍니다.감사합니다.",11
103,정보감사합니다,1
104,"파열음을 표기 못하는 것이 아니라... 일본어로 トヨタ라고 쓰면, 한국어로 ""도요따""라고 읽으면 발음이 똑같습니다. 영어로 Toyota라고 쓰면 한국어로 ""토요타""라고 하면 발음이 맞는 거고요. 이건 영어, 일본어 한국어의 발음차이인데,  한국어의 ""도""(첫마디)는 외국인에게 ""Do"" 보다는 ""To"" 로 들리는데, 한국어에는 ""토""도 있기때문에 도=Do, 토=To 로 표기하는 것이고요. 일본어의 と는 한국어의 ""도""와 같지만, 일본어에는 ""토""에 해당하는 글자가 없고, 대신 ど가 있는데 이것은 영어의 ""Do""에 유사합니다. 그래서 일본어에서는 と=To, ど=Do 로 표기하는데요. 다시말하지만 첫마디 ""도""는 と와 같은 발음입니다만, 한국어와 일본어의 차이때문에 로마자 표기에 차이가 생깁니다.",1
105,뭔가 코나 닮음. 도요타 특유의 공격적인 디자인에서 평범해진 인상,1
106,충전인프라랑 충전시간이 주유소 동급되지않는이상 전기차 그닥;,6
107,"랙서스 NX 느낌이 나는데, 토요타 브랜드로 나온다니 신기하네요!",1
108,확실히 알수있는건 기후변화가 가속화가 되고있고 세계적으로 매년 더 가혹한 탄소중립등 정책들이 쏟아져나올겁니다많은나라에서 2035년 2040년후 내연기관차를 도심운행금지 법안을 통과시키기고 있고 그러면 2025년 쯤부턴 내연기관 구매수요가 더욱 쪼그라들수도 있죠 중고차 판매도 제값을 못받을수도 있으니깐요,2
109,모카님~~ 예전 탑키어처럼 차량 소개할때 랩타임 기록 마크 해 보실 생각은 없으세요? 경차든 suv든 슈퍼카든 말이에요. 이젠 여력이 되시잖아요~~~^^  생각 좀 부탁드려요~ 화이팅~~!!,2
110,도요타 구매하는 이유...내구성 주행성능...,1
111,가격이 합리적이기만 한다면 뭐....,3
112,대기업 걱정은 하는게아님 이미 전부터 미림미리 시나리오 짜놨겠죠,6
113,"성능도 성능이지만 토요타는 워낙에 잘 알려진 회사고, 차를 많이 팔았기 때문에 전기차 시장도 금방 잡을 수 있을 것 같아요. 토요타 프리우스나 캠리를 잘 타던 사람이 전기차를 산다면 바로 이 차를 고를 듯 합니다.",7
114,요소수 대란 이야기가 나오고 있는데 요소수 이야기좀 해주세요.. 대형트럭 운전하시는분들 걱정이네요.,2
115,"노키아도 그렇게 골로 갔죠. 뭐 지금 다시 살아나고 있다지만, 휴대폰 회사는 아니니까요.",3
116,"한글로 도요타라고 쓰면 외국인들 귀엔 toyota로 들립니다. 우리나라의 ㄷ/ㅌ/ㄸ은 영어의 t에 대응하는 소리에요. 영어의 d에 대응하는 소리는 한국어엔 없습니다. 다만 ㄷ  앞에 모음이나 유성음이 있읊때, 그 떨림이 ㄷ에 전해져서 마치 d 소리처럼 들릴 순 있죠. 그러나 음절의 앞에 ㄷ이 오면 다 t로 들려요.",1
