,comments,likes
1101,디젤...5000..쌍용차 응원하지만..언제까지 고객이 쌍용을 응원하고 있지는 않을겁니다..고객의 니즈를 많이 반영해서 신차 개발 집중 하시길...시한부 회사처럼 불쌍해보이는 판매는 한계가 있습니다..,1
1102,무쏘가 다시 나왔으면 더좋을텐데 그만그만 한듯합니다 조금 아쉽게도 항상 잘보고있어요,4
1103,"모하비하고 크기 같습니다.  렉스턴, 모하비 두 대가 서있는 모습보면 렉스턴이 조금 더 큽니다. 근데 기자분 키가 크네요. 렉스턴이 1820mm높이인데 비슷하게 큰 느낌...",1
1104,편집장께서 후한점수를 다른블로거보다 많이 주는거 갔습니다. 그 만큼 바디온프레임을 감안한평가라 그런것 같습니다 많이 팔렸으면 좋을것 같네요.,11
1105,뒷좌석 승차감이 궁금합니다,1
1106,잘봤습니다!! 역시 모터리언.. 잘 이해되네요ㅡ,6
1107,역시 박기돈편집장님 목소리로 듣는 설명이 가장 좋아요 ㅎㅎ,7
1108,쌍용 흥해라,7
1109,6기통 가솔린 모델 나오면 더 좋겠네,1
1110,좀 지저분한 중국 상남자에서 깔끔한 한국 마초남으로 바뀐듯 ㄷ ㄷ 개머찌네유 디자인,49
1111,하브를 내놓아야...디젤 끝물이라 그렇게 판매율 올라가진 안을듯요..팰리세이드 페리되면 하브 나올듯요,3
1112,폭을 20센티 늘렸어야지~~다른 페이스 리프튼 의미가 없을거 같네요~~~펠리가 인기 폭팔한 이유를 아직도 모르나 보네요~~ㅠ한국 사람 취향은 높이보다 폭이 넓은것입니다~~~노력은 하셨으니  선방은 바라지만~~~다음엔 폭을 20센티 늘리는걸 감안 해 주십시요~~~^^,1
1113,"편집장님 다리가 기셔서 그럴수도 있는데, 2열 시트 하단부 길이가 짧은거 같습니다. 저러면 무릎부분 지지가 충분치 않아서 장시간 승차시 불편합니다. 다른 차랑 비교해 어떨까요?",2
1114,렉스턴이랑 모하비 뭐가 더 안전한가요? 답변 좀 꼭 부탁드려요~,1
1115,설명 잘해주셔씁니다,2
1116,시승해보면 박기돈 기자님 느낌이 다 맞다는걸 소름돋게 느낀다,9
1117,박 편집장님  올렉 오프로드도 부탁드려요!,4
1118,22년형은 제발 휀더 디자인 둥글고 다이나믹하게 변경되기를.왜 걷어 차인듯 움푹 꺼진 디자인을 고집하는지..그리고 쌍용차는 저 디자인의 패밀리룩으로 가야 할 듯.,1
1119,"조선의 랜드로버 쌍용, 조선의 레인지로버 렉스턴 +조선의 디스커버리 코란도, 조선의 이보크 티볼리쌍용이 명실상부 국산 suv 명가로 거듭나길 기원합니다!",2
1120,차값이 있는데  헤드업이 없다는게답이없네유,2
1121,소렌토보단..렉스턴모하비보단..렉스턴펠리도 자꾸보니 영~~전 올뉴렉스턴 삽니다...,41
1122,크롬죽이기는 필수일듯,2
1123,기자님께 잘어울리네요.ㅎ이차랑 케이9  이두차량,4
1124,"펠리세이드 랑 달리올 뉴 렉스턴은  온 로드 주행은조금 불리하다는데,  개인적으로 어떻게 생각하세요???넘 궁금 합니다.속 시원히 풀어 주세요...",6
1125,잘 보고 갑니다. ^^,4
1126,모터리언만 아는팁 좋습니다! ㅋ,2
1127,우아아아아아 박기돈편집장님이다!@#!@#!@#3.0 엔진만 얹어줬어도.. ㅜㅠ,3
1128,헤드업 디스플레이 있으면 더 좋을듯요,2
1129,시승 잘 봤습니다.  운전하시면서 내부 디자인 설명하시는데 사고날까봐  괜히 제가 조마 조마 했네요.불편충의 한마디였습니다.,1
1130,흉기보다가 쌍용을보니 확실히 구시대적인 2세대정도 뒤쳐진 느낌이...... 안탑깝다,1
1131,쌍용은 그냥 이기회에 이름 렉스턴으로 바꾸고 렉스턴 대 중 소 / 픽업트럭 대 중 소 로 가쟈. 번외로 티볼리는 여자들 상대로 귀욤귀욤하게 만들고.,17
1132,가솔린이나 하이브리드가 있으면 좋겠는데... 디젤은 이제 그만타고 싶은데 말이죠~,4
1133,썅용!1톤 트럭좀 만들어 줘요.북미식 본렛트 있는 트럭으로.안전하게 트럭을 타고 싶어요,10
1134,이젠 픽업도 디자인 저렇게 싹 바뀌죠????콜로라도 잡아야 하는뎅 ㅋ,2
1135,차 좋네......,2
1136,D에서R은 버튼누르고 딸깍딸깍 두번인가요?,1
1137,현재 투리스모 타는데...나는 패밀리형 투리스모 후속은 기다리는데소식감감...언제나오려나카니발로 가야되는건가??,2
1138,와아아 할 정도가 아닌거 같은데요. 충전 됬네요,1
1139,주말짬나서 가솔린기다리는 차주들이 많다고 하니 안그래도 쌍용자동차에서 준비중이라고 영업소방문했는데 내년에 몇개월뒤에 가솔린2.0터보 225마력 나온다네요.차량가도 가솔린이라서 디젤보단 200만원정도 저렴할거라고 하네요. 기다시는분들 쪼~옴 기다리세요.애초 디젤과 가솔린 둘다출시할거로 협의됐다가 디젤판매추이를 보고 후발로 출시한다고 했답니다. 저도 가솔린 기다리고 있습니다. 전고높아서 사이드스텝없으면 탑승하기가 힘들겠구요.도어두께느낌도 펠리하고는 비교가 안될정도로 묵직하구요. 81.7% 포스코 기가스틸 고장력강판을 썼구요 쿼드프레임바디온프레임으로 그랜드화이트도 이쁘네요.이번엔 풀체인지이전 페리라서 센터페시아까지 손대는것은 위험부담이커서 손을대지 않았다고 합니다.다이아몬드쉐입뉴디자인라디에이터그릴은 펠리와유사한데 그럴수밖에없는게 현대차 수석디자인팀장이 쌍용으로 이직하셨다고 합니다.쌍용기사회생 기원합니다. 쌍용자동차 파이팅 .^^가솔린은 6인승좀 넣어주세요.,47
1140,검은색 차량 줄지어 놓으니... 야쿠자 동호회 같네요. 포스가 한가닥 하네요..,2
1141,번창하세요!!!!!,7
1142,쌍용이 신경을 많이 쓰고 있다는 것은 인정 기업이 잘 만든것도 중요 하지만 고객의 소리를 많이 들어 보아야합니다.현.기를 제치는 그날까지~~,1
1143,새차에 신발자국...,2
1144,솔직히 반세대 혹은 한세대 이전의  모비스 부품들이 군데군데 많이 보입니다,1
1145,자동차 계의 아픈손가락이다. 쌍용 쓰러지지말고 화이팅~!!!,1
1146,매덕스 보이드 김병천 김동환 코리아텐더,1
1147,디젤차가 미세먼지 유발한다고해서 승용디젤은 또 안만들고 안팔죠 클린디젤이라고 광고하던 대기업들에 말은 쏙 들어같구요 정부도 마찬가지고 그런데 suv는 왜 계속 디젤이 주가되서 만들고 파는걸까요?,2
1148,5천만원에 2.2엔진.ㅋㅋㅋㅋ   이건아니지요.ㅜㅜ  모든게 바뀌고 엔진은 똑같고 미션도 현대8단이면 걍 쏘렌토가 나을듯...,1
1149,니 차 살땐 르쌍쉐 내 차 살땐 현기차,1
1150,정인교 김기만 매덕스 보이드 코리아텐더,1
1151,오프로드 기대할께요.,3
1152,전면: 코란도+투싼후면: 쏘렌토+렉스턴,1
1153,난가솔린 버전나오면 산다 만들어줘라 진챀,3
1154,호평이 많으니 안티들이 슬금슬금 기어 들어오네요 ㅠㅠㅠ,3
1155,와 멋지누 펠리세이드 계약하로갑니다,1
1156,방지턱이나 고르지 못한 노면에서 탱탱거리는 승차감 감수할 수 있는 분만 사시길. 결함 투성이 쓰레기 흉기차 빨리 망하게 쌍용 흥해라.,2
1157,정인교 김병천 매덕스 보이드 코리아텐더,1
1158,"정말 쌍용에서 뼈를 갈아서 개발한 티가 나네요... 모든 쌍용차의 리뷰는 항상 ""쌍용에서 나온 거 치고는..."" 라는 단서가 항상 붙기는 하지만...;;;근데 이장님은 대부분의 시승기에서 호평 위주로만 말씀하시는 리뷰어신데... 유독 본인 차인 ""쏘렌토 하이브리드""에 대해서는 상대적으로 야박한 평을 주시거 같습니다...ㅋ;;;(다른 채널의 리뷰어들께서는 쏘렌토 하이브리드는 극찬 일색인데...ㅎㅎㅎ)",14
1159,국내외 무수한 브랜드들을 놓고..쌍용차를 5천주고 산다는건 엄청낭 매니악함과 용기가 필요하겠네요. 여러모로 이왕 큰돈 쓰고 준~대형 suv같고 싶으면 트래버스가 낫지 않나요?,2
1160,요번에 제대로 나왔어요~,39
1161,모하비 v6 3.0모하비 사는게 좋을듯 힘도좋고 디자인도 내.외부 다 좋은듯,6
1162,트렁크는 아직 저런형태네요   입구랑 바닥만 평평해도 30%는 더 팔릴듯.,14
1163,아무리 시승차라도 ㅋㅋㅋ 막 밟고 올라가네요,1
1164,투리스모 크기의 슈퍼렉스턴 출시 시급,1
1165,진짜 궁금해서 그런데 저가격이면 모하비랑 별차이없는데 경쟁모델이되나요 렉스턴이?,1
1166,매덕스 보이드 김병천 김동환 코리아텐더,1
1167,"중요한건 아니지만, 평탄화는 좀 아쉽다.^^;",1
1168,정인교 김병천 매덕스 보이드 코리아텐더,1
1169,전면은 g80 테일램프는 아우디가 떠오르네요,1
1170,샌터페시아와 송풍구만 바꿨어도. 그부분이 조금 아쉽네요. 옆 라인에 주름?도 아쉽고.,2
1171,가장 중요한 주행성능측면은 거의 언급을 안해주셨네요ㅡ아쉽ㄴ,2
1172,실내만 조금 다듬음 좋것내요 너무 각이  살아있내,2
1173,렉스턴 롱바디도 필요항,1
1174,잘봤습니다.,1
1175,9:31  모터리언 팁 ~ 좋아요 ㅎ.ㅎ,9
1176,좋아 아주 좋아 쌍용,1
1177,모터리언 최고의 팁 헤드레스트 거꾸로 빼서 배게로 쓰자,6
1178,제발 살아나라. 쌍용! 교만해진 현기차 혼내주길..,1
1179,"하브모델 없는것이 안타깝네요. 내년에 쏘렌토, 싼타페 하브모델 구매예정인데... 현시점에 디젤차 선택하기에는 리스크가 너무커서...",2
1180,렉스턴에서도 애플카플레이나 안드로이드오토 사용 가능한가요???,2
1181,다카르타랠리 다시나가는 쌍용이 됬으면 ..ㅈ,1
1182,송풍구가 좀  구식 같네요~!,1
1183,1빠~~~  항상  잘보고  있어요 모터리언  박편집장님  화이팅입니다.,9
1184,"품질, 가격, 신뢰성(내부사정) 뭐 하나 신뢰를 주는것도 없는데,,, 브랜드의 대한 신뢰/ 안정성이 없는데 누가 이쁘게 봐 주나요!단점은 없고 장점만 이야기 하는건 글쎄요 아무래도~",1
1185,네 일단 차박할땐 앉으면 머리 닿아요 대부분 SUV? 동일 냉정하게 평가 하자구요,2
1186,매덕스 보이드 김병천 김동환 코리아텐더,1
1187,쏘렌토보다  승차감 더촣다?,2
1188,쌍용 결국 법정관리신청 이럴줄 알았어요. 팔수록 손해나는 구조.,1
1189,풍절음 있다던데 괜찮나요?,1
1190,소렌토 살려는 사람들 고민되겠네요 저도 렉스턴으로 고민되네요,13
1191,"고속도로 특화?음 렉스톤은 2,5,반자율이라고 했는데",1
1192,봐... 하면 잘하는걸,29
1193,개뼉다구처럼  생긴말에~~ㅋㅋ근데 더 웃은건 말해놓고 뒤로돌아보며 눈치보심ㅋㅋ,4
1194,다들  기자님 말씀들이 다다름,1
1195,쌍용차는저노무  트렁크  바닥 좀제발쓰잘데기 없이  높이맹길지  말길..,1
1196,그러게 화이팅!!!,1
1197,올뉴렉스턴 하이브리드는 언제쯤 나오려나,1
1198,디젤만  아니였다면,2
1199,청와대에서 많이 좀 써주세요~ 경호원차,1
1200,현대차 1.5세대전 디자인,1
1201,말만 응원하지말고 좀 사주라.말은 응원한다하고 사는건 현기차나 외제차 사면서..,11
1202,한국의정통오프로드브랜드로거듭나시길,1
1203,조으네요,3
1204,네비게이션은 12.5인치 화면으로 이동해서 보여주기 때문에 HUD가 필요없습니다,11
1205,불 안나고 브레이크 안잠기고엔진만 안꺼지면 좋아요^^흉기차 닮지마요!!!!,36
1206,젤 중요한 엔진 밋션이 현기차 꺼네?,1
1207,"쌍용 코란도 스포츠 차키 분실해서 주문한지 6개월 지났습니다. 당연히 아직까지 못받았고 언제쯤 줄수 있다는 답변도 못해준다고 합니다. 그냥 무한정 기다리랍니다. 반도체 때문이랍니다. 근데 궁금한점은 그럼 쌍용 새차 주문하면 반도체 때문에 차키 없이 차량만 받겠네요? 근데 새차에 대한 차키는 잘만 받고 있습니다. 그래서 차키 반도체 납품하는 하청 업체 모*텍에 직접 전화했습니다(쌍용에서 알려준 하청업체 연락처). 모*텍은 반도체가 부족한것은 맞지만 쌍용 본사에서 주문한 것은 차곡차곡 조금씩 납품하고 있다고 합니다. 쌍용에서 이 반도체를 가지고 어떻게 사용하는지는 본인도 잘 모른다고 합니다. 결론! 쌍용은 기존 고객에 대해서는 그냥 나몰라라 쓰레기 취급하고, 새차 주문건에 대해서는 문제없이 해결하고 있습니다. 만약 여러분이 쌍용차를 구입하는 순간 고객님이 아니고 호갱님으로 바뀌고 고객 서비스는 이제 꿈도 꾸지 마시고, 차키를 분실 안되게 정말 소중히 잘 관리하세요! 차라리 차를 분실하면 차는 찾을수는 있습니다. ^^ 누가 제발 공론화 해서 차키 좀 받게 해주세요! 다시는 쌍용차 살일도 없고 추천할 일도 없을겁니다. 적극적으로 쌍용차 못사게 말릴겁니다.",1
1208,,1
1209,흉기빠 틀딱들은 댓글쓰지마라쌍용이라 차별두고 비아냥거린듯한 선입견.. 이번기회를 비로소 끝을 봤음 바랍니다,2
1210,신발자국...ㅜ,1
1211,Did you like Rexton?,1
1212,가솔린 엔진은 튠업되어서 나오겟죠?,2
1213,형님 잘보고갑니다,1
1214,미션이 현대파워택8단이라는데 ㄱㅊ한가유,1
1215,"쌍욕은  써비스가 개판입니다,테일게이트잡소리, 딸각 딸각  쿵쾅..절대로수리불가입니다구조적인 문제입니다.",1
1216,체어맨도 부활,1
1217,현기 쌍용에디션,1
1218,하이브리드도 아닌데 왜난리지 이해가 1도 안감,1
1219,"센터펜시아 디자인, lcd  지못미..",1
1220,양옆 쭈그려뜨린 디자인은 별로다. 어디서 받힌 모습 같아서...,1
1221,6:00 현대는 왜 욕 먹고 쌍용은 인정인가요?,1
1222,트렁크 2단높이? 저건 불편할듯 하네요 짐 싣고옮길적에 많이 걸리적 거릴것 같네요~,1
1223,판매량이 저조하지ㅋㅋㅋㅋㅋ,1
1224,6인승안나오나요.,4
1225,저 양반 잡설이 길어서 핵심만 덜어내서 봐야함,1
1226,렉스턴이 4900???,1
1227,쌍용은 남성적으로 가야지,1
1228,Awd 는 왜 안넣는거에요?,1
1229,뒷좌석 안 크다,1
1230,모하비같네요,1
1231,비싸서 모하비로 몰리겠네.모하비와 가격차이 얼마 없잔아.,2
1232,저 디자인이 좋다고??,1
1233,2톤이 넘는 차가 202마력.. ㅋㅋㅋㅋㅋㅋㅋㅋㅋㅋ,1
1234,거의 5천인데 안좋으면 그게 차냐....,1
1235,이정도면? 귀에 맴돔,1
1236,현기도 어차피 디자인짬짜미함,1
1237,차박확인할때 신발신고올라간거 나만 불편해???,1
1238,비싸다,1
1239,누가 저걸 구매 하겠냐 망한 회사,1
1240,상시사륜?파트사륜?,3
1241,현대 미션에서 손절할께요 ㅡㅡ  아이신 쓰지,1
1242,그냥 기자하지 마시고 영업사원 하시죠?? 친구차 몰아보니 언덕에 힘 무지딸리더만 무슨 좋다고 이리 빨아줍니까?,1
1243,참  쌍용은 디자인도 더럽게 못하네. 흉기봐라 차는 뭐같아도 디자인은 쫌 하잖아~~. 누가 살지. . .,1
1244,전형수 김기만 매덕스 보이드 코리아텐더,1
1245,그냥그런것같네요,1
1246,전형수 김기만 매덕스 보이드 코리아텐더,1
1247,김기만 김동환 매덕스 보이드 코리아텐더,1
1248,응원 벗뜨 안 살란다.,1
1249,아는.소리.하려면.직접.설계.하시요.,2
1250,산업은행 으로가드니 환장햇군  좋어면 가만았어도데 좋다면진즉 그렇게하지 쓴물 단물 다 빼먹 고 이재  저러니 참으로 한심하다 그만 좀해라 4천7백이강아지이름이냐?,2
1251,잘나왔다=그러나 누가사?!!.....끝.,1
1252,그릴좀 바꼇으면..,1
1253,방지턱 시로,3
1254,9:47 자기차도 아닌데 신발신고 자국내는거 진짜 극혐이네  ;;,1
1255,이정래 삼성 올시즌 lg 트레이드,1
1256,김병천 김동환 매덕스 보이드 코리아텐더,1
1257,김기만 김병천 매덕스 보이드 코리아텐더,1
1258,구병두 이버츠 에반스 lg,1
1259,휠베이스가 4800？ ㅋㅋ,2
1260,봉하민 김기만 매덕스 보이드 코리아텐더,1
1261,헉 5천? ㅜㅜ,1
1262,전방주시좀 하시면서 운전하세요 불안해서 못보겠네요  내부실내 설명은 주차장에서 하시죠  주행할때는 승차감소음만 설명해주세요,2
1263,솨라있네,1
1264,202마력이 찐일지....,3
1265,현대가그렇게하면 욕쌍용은  인정....칭찬이여? 욕이여?,6
1266,김기만 김병천 매덕스 보이드 코리아텐더,1
1267,봉하민 김기만 매덕스 보이드 코리아텐더,1
1268,리뷰는 진정 오토뷰나 모터리언 처럼해야지  뭔~구독자수 늘릴려고   여자들앞세우거나  욕 섞어가거나  광고도 엄청올리고 은근 리뷰외에 슬쩍 제품팔고 개그처럼하는 그런 체널들  제발 다 없어졌음하네요~~   유투브가 물론  좋은점도있지만서도  일부 돈에 눈이~멀어서 어떻게든 구독자만 늘리려는  유투버들 때문에 ㅠㅠ,1
1269,"심영렉스턴,",1
1270,이홍수 구병두 이버츠 에반스 lg,1
1271,너희들은 포위됐다 오윤아 오열연기,1
1272,별론데~...먼가..부족해보임,1
1273,아 제발 남의차엔 신발좀 벗고 올라가세여,3
1274,프로농구 lg 코리아텐더 4대4 전격 트레이드이버츠 에반스 황진원 이홍수 lg매덕스 보이드 김병천 김동환 코리아텐더,1
1275,시승하실,1
1276,임영웅이 반은 했다,1
1277,차량 시승 느낀점...노면과 따로 노는 느낌,1
1278,황진원 이홍수 이버츠 에반스 lg,1
1279,이버츠 에반스 황진원 이홍수 lg,2
1280,차알못G80  빨고나서 이분 리뷰안봄,1
1281,춘장 냄새 좀 화~~~~~아~~~~악못 빼냠?짜장면 냄새가 뒤에서 아직도 난다옆은 대볼리 그대로고~~~,1
1282,내실부터- 남 이야기는 할 필요도 없다고 봅니다,1
1283,김기만 김동환 매덕스 보이드 코리아텐더,1
1284,똥x멍,1
1285,사람들...  쩝,1
1286,김기만 김병천 매덕스 보이드 코리아텐더,1
1287,봉하민 김기만 매덕스 보이드 코리아텐더,1
1288,이홍수 구병두 이버츠 에반스 lg,1
1289,너희들은 포위됐다 오윤아 오열연기,1
1290,황진원 이홍수 이버츠 에반스 lg,1
1291,이버츠 에반스 황진원 이홍수 lg,1
1292,김기만 김동환 매덕스 보이드 코리아텐더,1
1293,?,1
1294,"언젠가.. 단 한 번은 기자질을 꼭 하는 것을 봤으면 합니다.  송은기자.. 무슨 기자.. 서로 주거니 받거니 그만 하고진짜. 기레기가 아닌.. 저널리스트의 모습을 보였으면 합니다.  아니면 아예  김한용,  장진택처럼 유투버로 커밍아웃을 하고 편하게 시승영상을 제작하면 어떨까요?제발 기자라는 칭호를 입에 담지 마시기를 바랍니다.   현대에게 고소는 일개 유투버가 당하고. 꿀은 시승 기자들이 빠는 이 어이없는 형국을.. 다른 나라에서 알까 두렵습니다. 개인으로는 불가능 할 것입니다.  하지만 뭉쳐서 기자질을 좀 해보세요. 프레스니 뭐니.. 한상기처럼 이름 달고 뭘 표방하지 말고 진짜 기자질을 꼭 해보시기를 바랍니다.",6
1295,00770,1
1296,"아무리 자기차 아니라도 그렇지 새차를 신발도 안벗고 저렇게 다 밟고 그냥 신발 자국으로 조져 버리네, 다른 리뷰어들 보면 매너있게 신발 벗고 올라가던데,, 보기 좀 그러네",1
1297,저만 디자인 올드해보이는건가요? 솔직히 실내는 최악임.. 그리고 그나마 쌍용하면 오프로드인데 오프로드 뛸차에 디컷 스티어링이 왠말임.,3
1298,쌍용 곧망할듯 사도되려나 3년안에 파산할것같은디,3
1299,쌍용차를 5000 주고 사실 분들?참고로 이미 망해서 대주주도 버리고 튄 회사입니다여러분 세금으로 먹고 산지 꽤 오래됐어요,2
1300,실내디자인구린건 어쩔수없네요,3
1301,황진원 이홍수 이버츠 에반스 lg,1
1302,이버츠 에반스 황진원 이홍수 lg,1
1303,김기만 김동환 매덕스 보이드 코리아텐더,1
1304,황진원 이홍수 이버츠 에반스 lg,1
1305,황진원 이홍수 이버츠 에반스 lg,1
1306,황진원 이홍수 이버츠 에반스 lg,1
1307,김기만 김동환 매덕스 보이드 코리아텐더,1
1308,황진원 이홍수 이버츠 에반스 lg,1
1309,황진원 이홍수 이버츠 에반스 lg,1
1310,황진원 이홍수 이버츠 에반스 lg,1
1311,황진원 이홍수 이버츠 에반스 lg,1
1312,* ↓추천 신차 금융서비스 '실시간 카톡' http://pf.kakao.com/_cfxhSs/chat * ↓추천 신차 금융서비스 '상담 신청'https://forms.gle/4NPqVLAZtxbMN5eX7,1
1313,렉스턴 스포츠 궁금했는데자세히 설명해주셔서 감사합니다^^,4
1314,빠른정보  자세한 설명 잘듣고   갑니다좋아요~~~,3
1315,오프로드타이어는 시승차에만 임의로 달아준걸로아는데요,1
1316,- 영상에 나오는 인포카 구매 링크: https://smartstore.naver.com/infocar/products/5600877377,18
1317,"쌍용은...이제 다른 생각 말고 제일 잘하는, 잘할수 있는 픽업트럭시장을 확고히 잡아야한다고 생각합니다. 좋은 영상 잘보고 갑니다",124
1318,역시 다른채널과 다르게 트럭의 본질로 보시는게 정말 좋습니다.,41
1319,쌍용은 이런 픽업이랑 정통 SUV를 위주로 해야 다시 옛날의 영광을 조금이나마 누릴듯 합니다. 쌍용 하면 튼튼하고 험로도 잘 가는 그런 차량이 떠오른다고 하더라고요,14
1320,"이야기를 차분하게 참 잘하십니다.위트도 있고요,,,,귀에 쏙쏙 들어오네요.....국내 자동차 유튜버 중에서  최고라고 생각되네요 ^^",17
1321,"쌍용은 기존 suv시장에서의 경쟁력이 약하니, 화물 시장을 공략해줬으면 좋겠어요",23
1322,전기차 시대가 와서야 내연기관차의 품질을 완성시키는 쌍용 클라스...,5
1323,"쌍용은 볼보처럼 튼튼하고 우직한 suv랑 픽업트럭으로 포지셔닝 해야함. 티볼리는 전기차나 하이브리드로 가성비 귀여운 소형suv로 포지셔닝, 코란도부터는 옛날 코란도처럼 남자답고 우직하게, 중형suv로 클래식 한 디자인으로 무쏘 출시해서 레트로감성+오프로드감성대형suv랑 픽업으로 렉스턴이렇게 하면 많이 살듯합니다..",31
1324,18년식 렉스턴 차주로써 지금까지 타고 있지만 정말 좋은차라고 느끼고 있어요. 사소한 디테일을 챙기는 차라고 항상 느낍니다.,4
1325,디자인이 바뀌고 제대로된 픽업트럭이 되었죠 가성비로도 경쟁력있어요,1
1326,쌍용은 잘하는 렉스턴스포츠나칸 위주로 전문 분야로 해서 살아남아야합니다..다른것 다접고 스포츠나 칸 위주로 하루빨리 전기차를 만들어 화물시장을 점유해야 됩니다,70
1327,한용님 친절한 방송 항상 잘 보고있습니다~,5
1328,왜이렇게 세상을 부정적으로만 보려는 사람들이많은지 모르겠어요최소한 칸은 가격을 생각했을때 정말 멋진차입니다 가격을 좀 생각하고 판단 합시다~~~~역시 멋진 방송!,7
1329,확실히...픽업트럭 가성비는 쌍용이 최고 인듯 해요.옵션도 디쟈인도..미국차 미국차 해도 가격대비 따지면 실용성.가성비는 최고 인듯 해요.미국차 실내 보면  더 할말도 없고 픽업 트럭이 세단처럼 옵션 .디자인 하는것도 아니고.내구성 좋은차.실용성. 가성비 좋은차는 마자요.회사 이미지가 그래서 글치.미국차?비싸고 불편한건  한없이 많음.다 개인 차이 이지요.,16
1330,진짜 전기차로 나오면 대박날수도,2
1331,자동차 브랜드에 편견에 빠져서 그런말 하는 사람들이 많죠 온라인에서 사람들이 별로라고 하는 사람들도 실제로 그 차를 타보면 이게 그 차야? 라고 생각하는 사람들도 많을 거라고 생각합니다 영상 볼때마다 즐겁게 보고 갑니다,40
1332,렉스턴스포츠 3년 탔고 4년째로 접어드는데요.조용하고 잔고장 없고 튼튼하며 실용성 높은 것이 장점입니다.,15
1333,다른차는 모르겠지만 렉스턴 스포츠를 보면 쌍용이 살아남아줘야겠다는 생각이 듭니다,5
1334,국내 픽업트럭은 렉스턴이 제일 가성비면으로나 성능면에서 좋을거같긴한데..먼가 좀 아쉬운..고민이 됩니다ㅎ,32
1335,구식이고 기본 성능 별로인걸 클래식하다로 포장하는 김사장님 스킬! 대단합니다!,19
1336,역시 모카.. 균형잡힌 시각. 우리나라 최고 자동차 채널.,3
1337,마케팅 장난이지만 클래식 소구포인트는 지금 할 수 있는 쌍용의 몸부림이랄까.,1
1338,다른분들 말씀대로 쌍용은 쌍용만의 아이덴티티를 뽐내줘야 잘 팔릴거라고 봅니다.규모도 작은 회사가 다른 거대기업들 따라해봤자 비교당하며 짭취급이나 받죠.,1
