,comments,likes
0,개발자들이 좋아할만한 리뷰네요 ㅎㅎ개선한것들을 디테일하게 잡아내주시니 말이죠차자체는 많이 좋아진것 같아 좋네요,26
1,확실히 현기차 와 차별점을 주는게 경쟁력에 도움이 될거 같네요 요즘 현기차는 운동성능에 치중해서 그런지 좀 단단 하다 생각이 드는데 쌍용은 반대로 누구나 편안하게 탈수 있는 부드로운 승차감을 강점으로 세우는게 좋을거 같네요.,18
2,언제나 깔끔한 리뷰 잘보고있어요. 렉스턴 잘 됐으면 좋겠어요,6
3,쌍용차에 힘을실어주는 따뜻한 시승기네요 항상 응원합니다 오토뷰 화이팅!!!,10
4,분명 이번 렉스턴은 전작에 비해 잘나오긴 했는데 회사꼴이 말이 아니네요차 좀 잘팔린다고 해결될 문제는 아닌거같긴 합니다만...투자자가 있긴 할까 싶기도하구요그럼에도 잘 팔리면 좋겠습니다영상 감사히 보겠습니다,146
5,"쌍용차는 좀 투박하더라도 SUV 를 SUV 답게 만드는게 장점인데.소볼리, 중볼리, 대볼리를 벗어나서 전기차 시대에도 힘 있는 SUV 를 쭉 만들어 주면 좋겠다.",3
6,와~~잘봤습니다^^ 멋진 시승기였습니다 쌍용 화이팅!!,18
7,"마지막 애정어린 조언까지, 역시 대한민국 최고의 리뷰",66
8,쌍용차가 일어설지는 모르지만 렉스턴은 잘나왔지만 회사사정때문에 구매결정이 쉽지않은 사정이 구매자현실입니다,42
9,긍정적인 마이너체인지네요. 쌍용 직원분들 힘내세요.,5
10,RPM 디스플레이가 어긋나는건 한심하지만 속도계가 뚝뚝 끊기지 않고 부드럽게 올라가는건 마음에 드네요,2
11,역시 제자동차 스타일이군요!!고장만 안나면됩니다엔진오일만 안새면됩니다엔진에 펑크만 안나면됩니다그것만 갖추면 완벽한 자동차입니다,6
12,qm6와 렉스턴 사이에서 고민하다 가성비로 갔지만 역시 디자인은 렉스턴이 갑이네요. 더블드래곤이 살아남아서 다음차는 꼭 렉스턴으로 가고싶습니다.,11
13,뭐랄까 정말 정이 듬뿍 담긴 리뷰인듯 하여 뭉클해집니다.,3
14,와 드디어 기다리고 기다리던 올 뉴 렉스턴 시승기!!!! 감사합니다ㅠㅠ,32
15,"쌍용, 쉐비 유저로써 회사만 망하지 말기를,,,,,,♡♡♡",23
16,쌍용 제발 잘되서 열심히 달렸으면좋겠네요. 화이팅! 입니다.,5
17,이 디자인으로 2017년에 진즉 나왔어야 했다는걸..쌍용빼고 모두가 인정하는 부분.그랬어야 소렌토와 싼타페의 수요 일부를 가지고 올 수 있었을텐데..미래가 보여 안타깝네요,11
18,2021년에도  힘차게 응원합니다.! ,2
19,옆집에 비해 없는돈으로 최대한 노력한 모습이 보여서 좋아요,200
20,전자식 계기판에 화면전환이 좋네요현대는 전자식인데도 원형게이지가 계속 유지되는데 여긴 작아지기도하고 숫자만 나와서 네비화면이 크게 나오기도 하는데차후 현대차도 이렇게 바뀌면 좋겠네요,2
21,다들 응원하고 좋다는데 아무도안사.... ㅜㅜ 힝제가볼때도좋아보이는데전직원이 한마음이되어 더 잘되기를 기대해봅니다 ㅜㅜ디자인도 좋고 인테리어도좋구의외로 옵션이 좋네요현기보다좋아보이긴처음,19
22,렉스턴의 계기반의 디지털 디스플레이보다는 ..3000CC V6 이상의 디젤 혹은 가솔린 엔진을 탑재하여 나온다면.....가속할때 여유가 있지 않을까 싶네요....쌍용차의 현 상황으로 볼때 새로운 엔진 개발은 어려울 것이며.....앞으로 전기차 수소차시대라서 내연기관에 투자하는 것이 회사입장에선....손해일까...쌍용차가 현대차 기아차를 견제해줘야 되는데 ..참 ....차종이 제한적이라....현대차 기아차와 비교하기가 어렵...셀토스 투싼 스포티지.니로...가 코란도와 경쟁차종인가 점차 아니라고 생각되네요        항상 국산차의 신차를 출시하는 것을 보면 거의 대부분 현대차 기아차 제네시스라 ....국산차의 신차출시가 재미가 없습니다,7
23,애정을 갖고 쌍용이 잘되기를 바랍니다~,3
24,최대한 달래가면서 리뷰하시느라 고생하셨습니다,14
25,더블드레곤... 쌍용에 대한 애정이 묻어나는 따듯한 리뷰..  잘지내시죠..,56
26,지금쌍용차 코란도c타고 있읍니다.이전 G4도 본사협찬 받아서 700km를 3일간 시승했었구요.분명히 전작들 무쏘.렉스턴에 비해서는 장족의 발전을 이룬게 사실 입니다.지금 출시된 올뉴는 더욱더 상품성이 계선되었으니 주행감성이 좋아졌겠지요.개인경험으로는 쌍용차는 뒤에 짐상하차가 많은 분들에게는 타사보다는 분명이점이 많다 봅니다.지상고가 높다보니 상하차시 훨씬 수월하구요.적재공간도 높아서 효율적 이구요.파트타임사륜구동계와 프레임샤시가 필요한 업종.직종.취미가지신분들적절한가격 내에서 구매하신다면 좋은 선택이 되실듯 합니다.오토뷰의 시승기참고하시면 더욱더 좋을거구요.,8
27,평소 냉철하게 리뷰하고 판단하던 pd가 오늘은 쌍용을 조금이라도 더  케어해주려는 배려리뷰가 엿보입니다. 리뷰시청하면서 현재 쌍용자동차 백척간두의 상황이 안타깝게 느껴집니다. 리뷰 잘보았습니다.,7
28,잘 봤습니다. 이번 올 뉴 렉스턴 참 좋습니다. ^^,22
29,티볼리 잘팔렸다고 전부다 티볼리 따라했던게 쌍용의 가장 큰 패착이었는데진작 이렇게 했었다면 좋았을텐데요 과감히 구조조정해서 몸집을 줄여서 알짜배기 회사로 거듭났으면 좋겠습니다,4
30,초기형은 진짜 2017년에 출시된 차가 맞나 싶게 촌스러웠음.오늘도 잘 보고 갑니다.,20
31,훈훈한 리뷰네 역시 기태형은따뜻한 남자,1
32,쌍용에서 유일하게 맘에 드는 차,4
33,근데 진짜 리뷰하나만큼은 오토뷰가 최강인듯해요,7
34,"우리나라 최고의 카 리뷰, 오토뷰!",4
35,어떻게   보면  모방  쌍용차  답게 당당 하게 멋진 디자인 좀  화이팅ᆢ,3
36,믿고보는 오토뷰~ 선추천 후감상~~,2
37,24:00 쌍용차에 대한 안타까움과 기자님의 마음이 전해 지는 리뷰인 것 같습니다,4
38,크드뎌 오토뷰 리뷰 나왔군요엄청 기다렸습니다!,5
39,솔직한 리뷰 짱,1
40,언젠가 리뷰해주시겠지~ 하고 엄청 기다렸습니다!선댓글 후감상 하겠습니다~,6
41,"차급 대비 저렴한 가격과 프레임 바디의 안전성 딱 두개로 밀고가는 차...2021년 차라고는 믿을 수 없는 제동,주행성능과 승차감을 보여줌..",4
42,사고싶다...,2
43,미션이 거의 20년 전 반응속도네요. 제조사의 존폐 앞에서 매력이 급감했습니다. 차는 느긋하게 넓게 다양한 옵션을 즐기기에 좋은 차입니다. 지긋한 어르신들 추천드립니다.,4
44,오토뷰는 사랑입니다 ^^,4
45,이번 렉스턴 진짜 멋잇음,1
46,이상한 로고 말고 쌍용로고가 다시 돌아와서 기뻐~,2
47,방향지시등 소리가 특이하네요^^~,5
48,"내가 쌍용을 좋아하고 지금 차도 렉w15년식 끌고 다니지만...  다음부턴 쌍용은 패쓰해야것다. 렉 장점. 정숙하고, 주행질감 좋고 안전하고, 특히 고속에서 안정감이 너무 좋가. 단점 연비, 악셀반응성, 서비스 등 이중 가장 큰건 서비스.",1
49,드디어 이 차가 오토뷰에 올라왔군요!!코리안 지프!!! 쌍용 살아남아주라아아아아,30
50,"전면그릴은 아우디가, 브레이크등은 볼보가 생각나지만, 실내구성은 좋네요",7
51,한겨울에도 반팔 입는 상남자 ㅎㄷㄷ,138
52,오토뷰가 쌍용차 칭찬하는 날이 오네요..ㅋㅋ,28
53,쌍용이 앞으로 좋은 투자를 만나서 현기의 강력한 대항마가 되면 좋겠습니다. 더불어 시대에 맞게 사명변경좀 고민해보면 좋겠습니다..,15
54,Y300렉스턴이 개발됐어야 했는데...하다못해 그 6기통 엔진이라도 있었어야 했는데....노력은 많이 하는데....야속하게도 시장이 너무 빨리 변하네요,43
55,V6가솔린이나 디젤엔진 장착하고나오면 훨씬더잘팔릴텐데ㅜㅜ 디자인정말잘나왔음 가격도착하고,1
56,85점 승차감  블로워 작동 곰팡이제거,5
57,차는 진짜 좋아졌는데... 회사 상황이....,5
58,도로에서 몇 번 봤는데 멋있었습니다,1
59,추천만 하고 못봤던 오토뷰 몰아보기~ 선추천 후감상,2
60,"내외부 디자인요소 요소들이 현대차 느낌이 많이 보이네요, DH 제네시스를 SUV로 만들면 이렇게 나오지 않았을까...",10
61,헤드업 디스플레이만 있으면 완벽 디자인 아주이쁘던데,1
62,근데 실제로 보니까 너무 본닛이랑 뒷 라인 이런게 동글동글해서 별로던데.. 물론 덩치가 엄청 웅장하고 디자인이 예뻐진건 사실입니다,1
63,전작 대비 많이 향상되었네요~,1
64,쌍용 화이팅 !!,1
65,믿고보는 오토뷰,5
66,차 멋지네요 오토뷰. 쌍용차 화이팅입니다,1
67,실물로 보니까 웅장하긴 하더라고요  광고끝까지 봅시당,15
68,성능이 더 나은파워트레인과 트랜스밋션상위 트림 출시 노력이 필요함.이왕 토요타 아이신 적용하는 바에2.7 가솔린엔진도 도입해서 적용하길...현기가 엔진과 트랜스밋션 팔지도 않으니 브레이크도 전자브레이크 시스템으로 바꿔스마트크루져 가능하게,1
69,덩치에 비해 출력이 아쉬운건 어쩔수 없다..,8
70,엔진빼고 상품성은 좋네,4
71,드뎌 올뉴렉스턴 시승기가 올라왔네요. 감사해요 ㅋ,7
72,나는 소망한다. 쌍용이 뉴코란도를 부활 시키기를...,2
73,드디어 렉스턴이 올라왔다  오토뷰 사랑해요,8
74,오토뷰는 관심없는 차량이라도 한번보고가게된다.,2
75,옆으로 좀더 넓었으면 좋았을듯,6
76,회사가 어려우면 차 할인을 좀더 많이 해주나요? 차는 괜찮은거같은데 ㄷㄷ,1
77,닛산같은 회사도 망할까말까이고... fca 푸조도.. 힘들어서 합치는 상황인데.. 쌍용같은 소규모회사는 혼자 살아남기 힘든게현실..ㅠ 아주 큰 회사로 먹히지않는이상..,1
78,디자인팀이 진작에 일을 제대로 했다면...,1
79,쌍용 힘내라~,2
80,18:25 승차감이 펠리세이드보다 좋다고 하셨는데 오토뷰 홈페이지상에 렉스턴은 승차감 별3개 펠리세이드는 별 3.5개 주셨거든요 어떤 차가 승차감이 더 좋은건지 혼란스럽네요,1
81,"올뉴 렉스턴을 보게되는군요.잘보고가지요.20:07 ""강변북로를 달리고 있는데"" 이길은 상기형님의 단골길?",5
82,오토뷰짱^^,1
83,더블 드래곤!!!팔꿈치 치기가 생각나네요!!!쌍용 화이팅!!!,5
84,갓기태형,9
85,오토뷰  리뷰 기다렸어요,5
86,쌍용이 좋은 투자자를 만나길 바랍니다 ㅠㅠ,1
87,정말 100키로까지 힘겹게 올라가네요..,3
88,급격한 가속은 엔진에 무리가있지요 셋팅2초정도는 아주 좋은것   같아요 무보링100 생각하시면 ~,1
89,솔직히 뷰티풀코란도도 당시 투싼 스포티지보다 승차감 셋팅을 잘했고 공간도 나쁘지않고 가성비도 좋아졌는데도 불구하고 디자인과 옵션이 망쳐버렸죠 패밀리카로써 승차감 살렸는데 2열 에어벤트빠진게 아쉬웠고 티볼리랑 별다를게 없는 디자인이 망쳤죠 근데 만약에 현재 현기가격이라면 최근 코란도 렉스턴 가성비 좋아보입니다,4
90,회사 정상화되면 롱바디 모델 만들어서 체어맨 이름 붙이면 될듯,1
91,더블드레곤 쌍용 아... 그게임 추억돋네요 항상 응원합니다,6
92,쌍용아 살아나라!!!!!!,1
93,차는 두말하면 입이 아플정도로 멋지고 대단합니다..다만 쌍용이라 거를뿐....만약 현대나 기아로고가 달려서 나왔다면 저도 구매를 고려했을겁니다.,3
94,차가 조금 무거워지면 승차감이 좋아질것입니다,1
95,오토뷰가 칭찬하면 믿음,16
96,가솔린 2.0터보도 같이 출시했으면 싼타페 쏘렌토 영역에도 조심스레 넘볼수 있지 않았을까....?,3
97,중고차로 사면 좋겠네요 ㅎㅎ.....,3
98,편집장님 애정스러운 조언까지는 좋았는데... 더블드래곤 게임 드립을 하시다니요,9
99,멋진렉스턴,1
100,가격대비 가성비가 괜춘한가보네요%:,1
101,"껍데기만 바뀌는 타사와는 다르게 엔진까지 바뀐 진정한 의미의 페이스 리프트!쌍용,오토뷰 응원합니다!",7
102,쌍용차 공장가동 중단했다고...이젠 더이상 쌍용에겐 기회가 남아있지 않은건지도..,2
103,김기태 기자님 개인적인 질문 이지만 2015년식 페이톤 폭스바겐 차량 어떻게 생각 하시나요?,1
104,9인승이나 7인승이 있어야하는데 아마 힘들겠구나 이번에 나올거라는 차도 7/9인승없다지,2
105,Qm6마냥 출력과 무관하게 lpg 2.0으로라도 나오면 판매율이 팍팍오를텐데요,3
106,25:02 이걸 아는 당신은 아재,34
107,타 자동차 기업이 사가지규 기술력좀 받구 만들어제끼면 좋겟네요,5
108,1.5배로 들으니까 일반인 말하는 속도로 들림ㅋ 시간절약 개꿀ㅋ,1
109,렉스턴 마크 ㅈㄴ멋잇다,8
110,1등인가요!----분명히 개선된 점이 있는 차지만모기업 분위기 때문인지 망국의 왕 같은 느낌이 드네요. 항상 리뷰 잘 보고있습니다~,3
111,더블드래곤은 역시 엘보공격이죠.,2
112,20년간 신차효과를 느낄수 있을듯 ㅋ ㅋ,2
113,세로로 길어보이는 껑충한 디자인은 그대로 두고 그릴만 바꿨다고 웅장해 보이나...,4
114,이상하게 고속도로에 렉스턴 타고 폭주하는분 많은데 롤링심하고 브레이크도 안좋으니 제발 위험하게 위협운전 안했으면 합니다. 달리는 차가 아님 ㅜ,4
115,어우 형님 반팔 정력왕♡,8
116,현대기아 대우쌍용 삼성 시절이 그립네요ㅜ 힘내 더블드래곤..,3
117,쌍용이 자본만 더 있었으면 르쉐보다는 더 잘팔고 있었을꺼임;;;;장사는 열심히 하는디 문제는 돈이 읎어 돈이 ㅠㅠㅠㅠ,9
118,터보 하나 더달아야 탈만할듯,3
119,시대의 뒤떨어진 경영진들 ...주인이 바뀌고 물갈이가 이뤄지지 않으면 힘들다에 한표,1
120,디젤은 소음보다는 진동쪽이 실활용에서는 더 중요,1
121,쌍용아 제발    살아놔쥬ㅜㅜㅜ 내가 기도를한다ㅜㅜ,2
122,다 좋은데 엔진이 너무 아쉽다ㅠㅠ,3
123,"나아진 점은 분명히 있지만 원판이 기대 이하였고, 그렇다고 특출난 캐릭터가 있거나 성능이 뛰어난 것도 아니고 회사의 자금력이 빵빵한 것도 아니고, 얘 다음으로 나올 차들도 그렇게 특출나지도 않고... 잘 되면 좋긴 한데 모든게 최악인 쌍용ㅠㅠ",2
124,여기는 한국! 좋은차 보다는 보편적인차!,1
125,렉스턴이 가솔린으로 나왔다면 바로 예약걸었을텐데 아쉽네요ㅜㅜ,3
126,익스테리어는 역대급으로예쁨. 인테리어는 안습.. 요즘 네비를 저런식으로 넣어주니 10년전차로 보임.,4
127,차가괜찮아도...회사의 불안한 미래때문에 꺼려지는...;;,6
128,"1:29 .... 잠시후함께 ........ 느껴보시겠습니다이거 룰라의 3!4! 인트로 맞추기 게임보다 난이도가 높은 ""느껴보시겠습니다"" 게임인듯.저 이번에 맞추기 실패함. ㅠㅠ ㅋㅋㅋㅋㅋㅋㅋㅋㅋㅋ",46
129,선추천 후감상!오늘의 영상 요점——>  더블 드래곤,1
130,스티어링은 트럭중에선 당대최고 .... 개취니 이해하세요.,2
131,쌍용차하면 약간의 오프로드도 가능한 차를 생각하게 되는데승차감쪽으로의 강점 괜찮네요~~현대기아차 승차감이 단단해서 좀 그래요 (특히 싼타페TM 2열은 허리나갈것 같음;;)쌍용차 조용하고 승차감 좋은 편안함을추구하는 브랜드로 가보는것도 좋겠네요쌍용차 꼭 잘 되길 바랍니다!,8
132,비운의 자동차가 되겠네요 ㅠㅠ,5
133,그래도 조금 비싼 느낌이 있습니다. 이젠 디젤 말고 가솔린 하이브리드도 만드시길,5
134,발진......순항미사일인줄 알았네요 렉스턴은  무기체계로 비유하자면..........60톤..전차라고 해야 할까요....,3
135,돈이 있다면 사고싶은 모델이지만..,1
136,킹블드래곤은 인정이지ㅋㅋㅋ,16
137,"실제로 내부 보면 부 좋아진것은 맞으나.. 이상하게 어르신 차 이미지가 각인되서... 브랜드, 차이름 빼면 정말 좋은차. 마치  24시간 내내 집에서 트로트 방송보는 아줌마의 남편차 이미지랄까?",4
138,디자인은 현기 다이겼다.... 진심으로 참고로 나 모하비탐 ㅠ,3
139,변속기 반응 보니까 현대기아 파워텍 변속기는 양반이네 ㅋㅋ우우웅~~ 우웅 소리는 나는데 바늘은 안움직이고 차는 그대로고상품성이 괜찮은데 브랜드 이미지 때문에 안팔리는게 아니었다,3
140,마지막 모델이 될듯 이젠 국민도 단념했을듯,5
141,3:29 각자 갈길 가는 타코미터 속도계........ㅋㅋㅋㅋ차라리 비디오겜이 더 사실적인데여......ㅋㅋㅋㅋ10:13 타코미터만 보면 CVT인줄......ㅋㅌㅋ,20
142,아직도 갈길이.. 좀 느껴지네,3
143,진동이 어마어마하네요... 그 진동이 스티어링 센서까지 움직이다니..,3
144,뷰티풀코란도를 실내는 그대로 가고 외관은 저런 디자인으로 진작에 하고 이름을 코란도B나 올뉴코란도 라고 했으면 판매량 좀 많이 나와서 티볼리랑 쌍두마차 갔을텐데 에휴.......,1
145,떠블드래곤 께임 얘기에 빵터졌습니다. ㅎㅎㅎㅎㅎ앞으로도 살짝유머 부타드려봅니다.,1
146,정말 센터페시아 랜드로버 처럼 만들지  저게 뭡니까~완전90년대 디자일  어이쿠,2
147,누가 좀 인수해서 잘나가면좋겠다 현기말고도 대안 찾고싶은데 ㅠㅠ 없으니 몰려서 현기가 저렇게 기세등등한거고,1
148,쌍용차의 최대의 장점은 튼튼함과 안정성이다.단점은 장점빼고 다 단점이다.ㅋ,4
149,렉스턴 첨보신다면은 신세계패러디한 광고 꼭 보세요ㅋㅋ  개웃김,42
150,03:00 패들도 있죠? 요새 거의 모든 국산차가 있는거지만 쌍용차라 그런지 새로운 기능을 본듯한 말투임 ㅋㅋㅋㅋㅋㅋ,6
151,뒤에 rexton 없애고 porshe로 바꾸면 카이엔인줄 알겠어요,1
152,쌍용 짠하기도 하면서 응원하고 싶다가도 정신 못 차리는 노조 보면 개빡치는데 어쩌지?,5
153,ㅋㅋㅋㅋㅋㅋㅋ각자의 길을 가는 엔진과 타코미터....... 쌍용은 늘 실내에 조잡한 느낌의 무광 은색 플라스틱을 넣어서 전체적인 마감이 안좋아보이는 ㅠㅠ,7
154,타코미터는 오차는 충격적이네요,3
155,"쌍용차 사면 고장날때까지 타게된다는 장점이있음..왜냐하면 중고로 팔고싶어도 개똥값이라 ,그냥 타게 됨.평생 안고갈수도 있다는 장점이 있음",68
156,피디님  이두 삼두 운동 따로 하시나요? 부럽네용,1
157,오~  현대기술이 들어간 미션~현대미션  들어간 것도 예기좀,3
158,이전 모델 렉스턴을 아직도 못 버리는 이유가 아직도 100만을 못 탔다는 것과 15년 이상 된 차지만 고장 없고 요즘 차들에 비해 출력도 부족 하지 않고 연비도 아직 10~11 킬로 정도 나와 주는 효자 같은넘이 너무 좋아 버리지를 못합니다. (04년식 뉴렉스턴 2700CC 42만 주행 썬루프뺀 노블레스 풀옵션 현재 시세 120만원 ㅠㅠ) 근데 올뉴 렉스턴도 100만을 지향 하고 나온차 맞나요? 현기의 8단미션과 현기의 디퍼 장착 한걸로 알고 있는데 현기 물미션이 100만을 버텨 줄까요?,2
159,내첫차로구입하고싶네요,1
160,얼굴도 잘생겼고 연봉도 높지만 집안이 개판인 신랑감.,6
161,가성비 갑인 자동차인듯.. 티볼리도 잘 타고 있습니다 ㅋㅋ 쌍용 죽지않았으면 좋겠습니다,7
162,마음 만은 소년이라고 쓰신걸 어디서 본 것 같은데 따블드레곤이라니..,1
163,현기였으면 개까였을텐데. 얼마나 불쌍했으면 기자님이 그래도 살려는 줄께 하는 느낌 ㅎㅎㅎ,11
164,마지막 렉스턴이 될지도...,8
165,"사전에 준비된 대본을 읽는것이 아닌 자연스런 발화의 과정이니 당연히 이해되는 부분이지만,  문장의 시작점에 '어떤' 이나 '그런' 을 빼고 말해보시면 좋을거 같습니다.특히 계속 등장하는 '어떤' 은 없어도 되거든요 .이번 영상도 수고하셨습니다",3
166,"어떻게 렉스턴이 모하비와 경쟁을 합니까?4기통 2,1570cc(202마력,44토크)  렉스턴  : 6기통 2,959cc (260마력, 56토크) 모하비",2
167,쌍용 주식 -52% 생각나네..ㅠㅠ 지금은 거래두 안됨..,1
168,차라리 현대기아가 인수해서 오프로드&클래식 쪽에 집중하는 SUV 전문 브랜드가 되었으면 좋겠네요,3
169,볼보 토르의 망치를 리어램프에 박아둠...헤드라이트의 디자인을 리어램프에 썼으니베낀건 아니라는건지...,4
170,쌍용은 대부분 디젤이라... 가솔린 모델출시좀ㅠ,3
171,현대차 기아차 분리 말고는 쌍용은 답이 없음,1
172,다른데는 왜 이렇게 리뷰를 못할까,1
173,"개인적으로 디자인은 팰리,모하비,트레버스,카니발보다 훨씬 이쁘다고 생각하는데 디젤만 아니였어도 후보군에 둘텐데ㅠ",5
174,요차는 몇번 타봤는데 진작에 좀 이렇게만들지!! 으이구 쌍용아,1
175,전자식 계기판 rpm 반박자 느리게 따라오는 거 제발 해결 좀.....아님 미션까지 현대꺼 사다쓰니 현대 소프트웨어도 사다쓰던지......,2
176,뷰티풀 코란도만 아니었어도 ㅜㅜ,1
177,그래 저런게 쌍용이지,4
178,이제쌍용답게 만드는듯 제발 현기따라가지말고 예전처럼 쌍용색깔답게 나아갔으면' 합니다,1
179,오토뷰가 더블드레곤을 좋게 말하다니.  어렵긴 어렵구나?,3
180,회사가 기로에 있는데 회사의 주력 상품 홍보하는게 무슨 의미가 있는가.... 회생을 2번 하는 회사는 거의 못본거 같다......끝났다는 얘기이다....,3
181,현직 쌍용차직원 렉스턴을 만들고있습니다.리뷰 따뜻한말씀 감사합니다^^,5
182,쌍용차는 중고로 쌔거 같은 중고 뽑으면 우와~~~ 생각보다 괜찮다~~ 그러고 재돈주고 사면 아씨... 머야 이것도 안되고 저것도 안되고 되는게 없네~? 이런다 ㅋㅋㅋ,19
183,"뉴체w 그리고 와이프는 g4렉스턴.쌍용 특유의 든든함과 벤츠와 공유하는 플랫폼,엔진,밋션(구형)덕에 되려 더 안심하고 선택하고 비싸돈 주고 샀고 지금도 만족함.다만 지금 쌍용차 사태와 오리지날 귀족노조 때문에 안,밖으로 싸우는 형국때문에 불안함.",7
184,스마트폰 약정 2년 걸고 사는것도 유행 따라가는게 겁나 빡센 시대인데 그것보다 몇배 비싼 자동차를 쌍용 이름 붙이고 어찌  따라가리......,2
185,이거 한 100만대 팔리면 회생가능,5
186,형님 잘볼께유~선추천,1
187,펠리세이드 느낌을 내고 싶었나보네.,3
188,앞쪽은 렉서스 뻬끼고 뒤는 벤츠 뻬끼고 ㅋㅋ,1
189,전 앞면 디자인사진보고 쏘렌토인줄...알앗는데 렉스턴이더라구요...,1
190,펠리땜에 망하고 쏘랭이한테 눌리고 qm6한테 밀리고,3
191,어떻게 될지도 모르는 회사 제품을 몇천만원이나 주고 살 사람이 몇이나 될지 흠,3
192,무쏘의 계보를잇는것같은느낌,3
193,차는 괜찮은데 회사가 안 괜찮음,2
194,더블드래곤에서 빵 터졌네요 ㅋㅋ,2
195,물들어올 때 노 저었어야 했을텐데 아쉽네.... 저 차로 돈 좀 벌어보려했을텐데 글러먹었겠네,1
196,잘보겠습니다.,2
197,감상 잘하겠습니다~~ ㅋ,3
198,어차피 현기노조나 쌍용노조나 개차반인건 거기서 거긴데 쌍용이란 이미지가 안쓰러워서 그나마 여론이 이정도인거지 그것도 아니었음 진작에 작살냈어야될 브랜드임.어차피 무쏘랑 코란도로 추억하던 그 쌍용은 20세기에 죽었고 지금 쌍용은 카레도 포기한 망한회사임.,4
199,응원은 하면서 자차로는 안사는 쌍용,10
200,확실히 모든게 뒤쳐진듯한 디자인과 옵션이구나 망하게생겼어,3
201,진작 이렇게 나왔으면 5천대는 더 팔았겠다... 이미 고객들 펠리세이드 gv80 다 넘어가고 나서 나와서 뭘 어쩌라고... 망할놈은 희망고문 말고 빨리 망해버리던가,1
202,오토뷰는 기냥 좋아요 누르는거 아이가 공감이믄 좋아요 눌리라~~,1
203,BMW X5 XDRIVE 40I도 부탁드립니다!!,10
204,렉스턴은 묵혔다 중고로 사야제~,2
205,코란도도 좀 디자인 변경해라 ㄹㅇ;;,1
206,뷰티풀코란도 같은 삽질만 안했어도...,5
207,황봉알 형님이 응암동 하꼬방 살던 시절 도둑 맞았던 차,2
208,기어노브 사제 에쿠스인지 비엠꺼인지 조잡한 사제느낌 난다..,3
209,현기 R엔진 미션 그대로 가져온건가 ?  미션은 가져오는것같은데 엔진도 R 엔진과 비슷한것같은데,1
