,comments,likes
352,티볼리 분신술 쓰지 말고 이런걸 진즉에 냈어야지 쌍용은 항상 좀 구조조정 위기 같은걸로 처맞으면 정신 차리는듯,1
353,승차감이 바이브레이션을 끄집어내버리네.,1
354,목소리 떨리시는거 보이네요 ㅋㅋㅋㅋ 엄청 차가 떨리나봅니다 ㅋㅋㅋ,23
355,쌍용은 노조만 없으면 안망헤요.. 노조부터 없애버려야지,1
356,안전의 쌍용 차 쌍용 적재함 부분 틈을  단차라니요 ㅋ  쌍용은 현기랑 틀리다 !!프레임 바디위에 승용공간 따로 //적재함 따로//제작이 되어 프레임 바디에 얹어집니다  그러니 그부분을 단차라는건 차의 구조를  모르고 이야기 하는말입니다,1
357,가성비 끝!,3
358,한국은 라이벌이 있어야 한다~~~~~,1
359,휠하우스가 너무 좁아서 미국 픽업보다 스포티함이 떨어져보인다..,1
360,무쏘나 만들었으면...,1
361,솔직히 말해서 부분부분 보는 것보다 그냥 딱 봤을 때 아재차같아서 별로... 거기다가 쌍용차가 망하든말든 나는 관심없음.. 업보라고 생각함,1
362,1차로 주행하시면 다른 운전자의 분노를 사게됩니다어찌되었건 트럭이거든요,1
363,평소같지않은 말투 어조.. 왜그렇게 느껴지지?! 나만그런가? 애써 자조하는듯한 분위기.. 안타까운 현실 때문이었나? 아니면 생각보다 별루여서 였을까?! 암튼 안타까운 쌍용의 작금의 현실..,1
364,잔고장조차도없음ㅋ 그래서 재정이 안좋을수도요ㅋㅋ현대기아보세요. 잔고장투성이라 서비스센터는 불티나게 돈끌어모읍니다ㅋㅋ 심지어 쌍용서비스센터 부품비와 수리비도 현대기아보다 반절정도쌉니다ㅋㅋ 엔진오일쪽만봐도 알죠ㅋ,1
365,우리아빠 옵션 이것저것 해서 3700에 산거면 잘한건가요..?,4
366,연비는 어떻게되나요 궁금해요,1
367,ㅎㅎ 그렇게  좋아요?A/S 죽이죠!  ㅋㅋㅋ 아주 최고야!  굿이지 ㅋㅋㅋㅋ,1
368,현기는 잘하는거나 더 잘할생각하지 남의거에 더 눈독 들여 ㅠㅠ 지는 10개 가지고 있으면서 남이 1개 가지고 있는꼴을 못봄,1
369,앞범퍼. 옛날부터바꿧으면. 좋아셧는데.  옛날앞범퍼 정말마음안들엇는데~😋,1
370,칸 하믄 테라칸 이지~~♥♥♥,1
371,짐칸에  짐 실으면 뒤가 내려오잖아요?그래서 물이 앞으로 흐르게 한 듯,1
372,다 좋은데 쌍용로고를 빼고 포드처럼 칸을 그릴 중앙에 박지..,1
373,화물공간에 물 흐르는거 그거 평지일까요?,1
374,드디어ㅜ쌍용이 소비자들이 뭘 원하는지 알았는거같네;그동안 너무 게이 레즈비언(비하아님) 너무 유니섹스라던지 진짜 성정체성이 넘 혼란이 오는 디자인들밖에없었는데드디어... 뭔가....진짜 사고싶으누차가 뉴코란도이후로 쌍용에서 생김..개인적으로 산타크루즈보다ㅜ이쁜듯,1
375,1440p  넘 좋아요,1
376,얼마나 진동이 심하면 시승내내 목소리가 떨리지...,1
377,쌍용 응원한다면서...사실은 부족한 면을 강조...실망입니다.,1
378,good job,1
379,타이어 옵션인걸로 아는데 일반 타이어로 했으면 염소 소리가 어떻게 나올지~~좀 아숩,1
380,쌍용을 응원하고있는데...형목소리가 덜덜떨리고있어,2
381,기존 아이신 6단 자동 멍청함은 나아졌겠죠?!,1
382,목소리가 자주 떨려서 비포장 도로를 타는 줄 알았네요,1
383,"승용차로서는 좋지 않습니다.운전 내내 김한용씨 목소리 떨리는거 들리시죠?프레임 차 특유의 노면 충격후 바이브레이션처럼 전해오는 후진동은 충격 그 자체보다 더 불쾌감을 줍니다.프레임바디 차량만의 종특이죠.(근데 콜로라도 시승기들에선 목소리 떨리는거 안들리던데...)몇년전 모하비 운전해보고 이차엔 부모님 못태우겠다 싶더군요.그나마 모하비는 댐퍼라도 출렁거릴 정도로 부드럽게 세팅했다 하지만 트럭인 칸은...적응한 분들이야 괜찮더라 할수도 있지만 일반 모노코크 바디 차량, 특히 세단 타던 사람들은 저 불쾌한 승차감 적응 무지 힘들겁니다.저는 구형 싼타페 타다 모하비 타고는 프레임 차는 목록에서 빼버렸어요.혼자 탈거면 감수할수 있을지 몰라도 가족들 태울거면 승용목적은 고려하지 마십시오.",1
384,20:27 여기 어디? 도로인지 궁금해요~!,1
385,"다좋은데 휠하우스공간이 너무나도 좁음  콜로라도만 봐도 사람머리가 하나들어가는데 렉스턴픽업은 주먹하나도 안들어가,,,,픽업트럭은 휠하우스 공간이 핵심,,꽃인데   그걸 모르고 못살리네,,, 포드보고 따라라도 하지   동호회 보면 공간넓히려고 무리하게 인치업도하고 차체만 높아지니 구조변경도 해야되고 포드레인져 모델만봐도 순정이 저정도로 휠공간이 넓은데 무엇보고 무얼생각하고 설계를 했냐   당장 미국가서 픽업공부를 하고 와라",1
386,그동안 할 수 있었으면서 안한거였던건가? 진짜 노조가 문제였던건가?,1
387,베이스 가격이 내 오토바이 가격과 같네요.,1
388,시장에서 판단해 주겠지...이번에는 정부에서 인위적으로 개입하지 말길!!! 흘러가는 대로 놔둬야!!!,1
389,목소리가 이렇게 떨리시는건 처음 들어보는것 같아요. 많이 터프하나보네요 ㅎㅎㅎ,1
390,트렁크가 없어서 데일리 자동차로는 불편해요,1
391,짐칸이 위로 올라가는 스타일 정말 맘에 안든다..걍 미국픽업 처럼 일자로 수평으로 만들었으면...,1
392,뒤 창문 열고 닫고 좋을뜻...^^ ㅎㅎㅎ,1
393,으잉?  오늘  느낀건데  이경규씨  많이 닮았네요 ...,2
394,뭔가 전면은 팰리세이드 느낌도 좀 나고...?,1
395,4:23  뜬금없지만 8 이쁘다...,13
396,진작 이렇게좀 만들지... 지금 뭐 무서워서 이거 사겠나,4
397,초동조치부대 봉고 그만 태우고 이걸로 갈아줘라.....!,1
398,렉스턴 스포츠칸 아이신 미션 쓰레기인데요.변속 충격 있고요 고속도로 오르막 80킬로에서 기어변속 어리버리하고 힘없어요,1
399,저는 딱보이는게 a필러 손잡이네요 이거 없어서 엄청 불편했어요,1
400,뒷자석 열선시트 신형모델은 빠진건가요? 구형은 있는데,1
401,가솔린좀 나와라 쫌 ㅜㅜㅜ,4
402,11:29 11:29 11:29 뚝배기 뚝,2
403,오프 시승은 안보여 주시나요...그게 궁금하네요..,1
404,"검사 자주, 보험료도 말해야죠 .",1
405,나는 마음에 든다,16
406,네비게이션이 1~2세대 전인 거 같은데..?,1
407,근데.....쌍용엠블럼은....... 좀 거시기하네요. 앞에는 넣지말지;;,1
408,아 탐만다 정말,1
409,"아니....최소 외관은 합격임......저건 좀 뭐랄까,,,,한국형 와일드...?",1
410,달릴때 목소리가 너무 떨려요... 진동이 그냥 전달이되는거 같아요.,1
411,"한국인의 쓸데없는 짓거리는 운전할때 지들이 무슨 매드맥스 영화속인줄 아는건지, 레인 바꾸려고 하면 정말 코를 들이밀고 달려오는 싸가지 천지라는거. 그래서 아직 선진국은 아니라고 생각합니다. 외국에 가면 그런 운전자들도 있지만 드믄 편입니다.",2
412,다좋은데.. 염소소리..ㅋㅋ 얼마나 진동이 심하면 그럴지..,1
413,어댑티브크루즈 센서 사서 달수는 없을까요,1
414,김한용 기사님이 뒤에서 오시면 쪼는 맛이 있어서 그러는게 아닐까요?,1
415,엔진룸 매직... 안습하네... 인수길만걷자,2
416,10:40 저 저기요...주차된그곳이 완전 수평한곳이 아니지 않을까요?,1
417,불편러많으시네 ㅋ 트럭이 승차감이 얼마나좋아야되노래방가서 콘서트음질 찾을분들이네 ㅋ,1
418,렉스턴스포츠 뒷도어 기역자 부분 세계 어디에도 없는 후진디자인인 저렇게 만드니까 망함,3
419,"으르신들한테, SUV이지만 세금이 싸면서, 연비 좋은 4기통 2.0?(2.2)라고 개구라 까면서,  튼튼한 짱용의 이미지를 어필하는 그냥.........................모 회사 노력해서 만들었겠지만, 현직 마케팅도 개 ㅈ 같고.. 트럭모양의 으르신들한테 사기쳐서 파는 차.아.. 물론 법인용차로는 뛰어난 차.쌍용을 응원하지만, 뛰어난 SUV 좀 만들어주세요.현기가 자본력으로 이거저거 만들어서 시장 반응에 응하고 있는데,한국의 SUV 명가 쌍용이 저런 애들한테 밀린다는 게..............쌍용 제발 좀 제발..........",2
420,쌍용이 일냈다,3
421,쌍용노조가 민노총에서 탈퇴하고 정상적인 쌍용의 가족이된다면 구매고려해보지만 지금은 아닌듯....,1
422,쌍용떠난 1인입니다...왜 나만 인잭터가 잘나갔을까요???액티언스포츠부터 코란도스포츠..2대 다  인잭터 문제로  쌍용을 떠났습니다...,5
423,어라운드뷰 스위치 왼쪽 무릎위쪽에 있어요.,3
424,근데 목소리가 덜덜하신거 보면 승차감이 별로인건가?  ㅎㅎ,1
425,진동이....타이어 때문이겠죠??,1
426,잔진동이 심하긴 하는거 같습니다. 김한용 기자님 설명하는데 목소리가 ...,1
427,진작 이렇게 나오지...,6
428,지금샀다가 쌍용문닫으면 수리부품은 어쩌나요,1
429,앞에 칸자는 중국스럽다.빼면 좋을 듯.,2
430,쌍용화물차들 고속도로 1차선 주행만 안하면 참 좋을텐데,1
431,쌍용차 아직 폐기 처분안됨?,1
432,혼자 찍으셔서 보러왔습니다!!!,10
433,말씀하시는데 차가 많이 떨리나 보네요...?,1
434,차가 어떻길래목소리가 달달 떨리냐 ㅜㅜ,1
435,나만느끼나  목소리가 차량 진동에맞게 바이브레이션되는데,1
436,옵션이나 편의사항은 뭐......트럭이니까. 저정도면 뭐..,1
437,아.. 계약하고나서 아죠씨 리뷰 보는데 주행할때 목소리 떨리는거 보니까 주행중 떨림 엄청 불안하네요,1
438,차가 얼마나 떨리길래 목소리가 계속 흔들려서 들리죠?,13
439,됫고..옛날 코란도나 만들어라 !,1
440,노면 진동때문에 목소리가 계속 떨리시는걸 봐선 승차감이 그닥인가보네요..,1
441,타이어도 제대로 끼웠네 이제야,3
442,산타크루즈는 화물로 될겁니다 왜냐구요 현토부가 있자나요 쏘렌토때도 기준 변경된거보면 ㅎㅎㅎ,2
443,스키드 플레이트가 아니라 언더커버인데 약간 용어를 혼동하셨나보네요아무튼 잘 봤습니다,1
444,그냥 이제 그만 보내줍시다.  무한경쟁 자본주의 사회에서 시장 경쟁력 없는 회사는 사라지는게 정의 아니겠습니까?  기업 공중분해 시키고 청산절차 밟게 해야 더 이상 국민의 혈세 낭비하지 않습니다,1
445,노조만 어찌하고 회생만 한다면 전 이것 살꺼야!  별르고 있음 ㅜㅜ,8
446,저타이어 기본타이어 아니죠?,1
447,조선이 아직 존재하는 나라인가?,1
448,이쁘긴하다,1
449,쌍용은 노조가 싫다안사는게답한용이 쌍용존나까더니지금은 뭐야 웃긴다,1
450,쌉스럽네요,1
451,와 유압식 스티어링.......어처구니없네,2
452,조선이라면 한용이는 조선사람이네..난 대한민국 사람인줄 알았더니 조선 백성 이었네...제발 대한민국 민주시민으로 돌아 오길 바란다.,1
453,개발속도가 너무 늦어.. 그러니깐 그 모양이지...,1
454,쌍용 잘가라,6
455,연비는 몇이예요???????????????,1
456,이래서 쌍용돈줄을 흠흠 ㅋ,2
457,주행중 목소리가 떨리는게 느껴지는..,1
458,제발 가솔린엔진좀 올려주세요,2
459,근데 회사가 망해가는데 저렇게 차를 출시해도되는건가?? 궁금해서물어보는거,3
460,싼타크루즈 국내출시하면 절때 쌍용차가격에 못내놓지쌍용이 참 계륵이다계륵,7
461,차가 아무리좋아도 현실은 다른차 구매할거면서,1
462,200마력도 안나오는 카울만 오프로드.ㅋㅋㅋ,1
463,ㅋㅋㅋ 짐칸에대한 경험치가 아예없나봄,1
464,전 그냥 현대 투싼사려고요 이번에 잘나왔던데 ㅋㅋ 쌍용은 만들거면 처음부터 이렇게 만들던지 옛날 코란도1세대 그런 디자인 놔두고 티볼리같은 그저그런 디자인만 만들다 그렇게 된거지 아줌마차만 찍어내더니 ㅉㅉ,1
465,짐니  스타일  만들어줘요,1
466,누가 한용형님 앞에 선풍기 켜 놓았나? 목소리 왜케 떨림???,1
467,운전하면서 목소리 떨림이 엄청나네요 ㅋㅋ 불편할꺼같음 ㅠㅠ,1
468,쌍용 픽업 제일 큰 문제가 2열 도어 끝단이 뾰족해서 위험함. 대체 왜 그딴식으로 만드는지 이해가 안감.,2
469,형 모카가 쌍용차 인수하면 안됨?,1
470,굿,9
471,아쉽다.내부 흉기에비해 옛날차 같음,2
472,2열 열선(멍뜨)있어요~,2
473,진즉에 좀 내놓지... 임원들이 문제인가..??,1
474,A필러에 손잡이가 생겼네요,1
475,앞 그릴에 Khan 만 빼고 싶다... ㅠ,1
476,카라큘라랑 우파가 이미 산꼭대기 가있다! ㅋㅋㅋㅋ 꼭대기에서 라면먹고있다,1
477,미국에서 팔아야지 저런건.,1
478,마닐라 옆 카비테에서 이전 모델을 봤는데 솔직히 좀.......,1
479,저두 사고 싶습니다 ! 파나요? AS는요??국방부에서 인수 하라,1
480,중간에 필터 안좋다 해놓고 협찬 상품 광고하시네요.너무 실망입니다.차라리 순정부품도 좋지만 더 좋은 제품을 원하시면 이거 사세요. 라고 했으면 좋았을듯.,2
481,네비는 아이나비 인가요?,2
482,5:15 어디서 클래식이들려;;,1
483,쌍용은 디쟌은 좋은데 퀄러티가 떨어짐,1
484,매직 짠하다~,1
485,을매나 급하면 거의 매년 페이스리프트를 하냐 걍 접어라 뷰티풀 코란도 이러고 앉았으니 망하지 ㅋㅋㅋ,2
486,끌리는데 나중에 독박쓸까바,2
487,렉스턴스포츠 그린 프레스티지에 옵션 조금 넣고 3360만원 계약해놨는데 5월달까지 언제기다려..,7
488,남자의 색 핑크 나왔으면 좋겟다...,2
489,세금은 싼데 보험료가 비쌈 이천씨씨급이라면 또이또이,1
490,정통 오프로더 suv답다,1
491,쌍용 어려운디군용차딱이네유,1
492,파이팅 그러시면서 현실은 다들 온니~ 현기면서 풉ㅋ,1
493,엔진이 아직도 2.2냐 쌍차야 니들도 포드 브롱코 마냥 뉴코란도.무쏘 부활시켜 내가 뉴코란도 부활 시키면 구매 약속한다,2
494,이걸 보고 혹하는 나는....쌍빠라 그란가? 호구라 그런가...,2
495,운전중 진동이많은가보네요;; 말할때마다떠는거보니..;;,2
496,"조선은 북한조선이고, 우리의 국호 대한을 씁시다.",1
497,쌍용은 머저리운영진과 허접한디자이너 그리고 욕심쟁이노조... 이 3박자가 딱떨어져서살아나기 불가능...,1
498,"영상을 거의 중간까지 보다가 너무 광고성이라, 조금 적어 보고 갑니다.스키드 플레이트 아니고, 언더커버 인데요..(스키드플레이트는 별도로 있었으나, 범퍼 형상이 바뀌면서 제외된것 같습니다.)제가 저것 (언더커버) 때문에 고생을 많이 해서 한마디 적자면.. 제품에 좀 문제가 있다고 아이언빌드 대표하고도 통화 했지만, 절곡의 문제인지.. 아니면 제품 자체의 제작 문제인지 모르나, 고정 볼팅 부분에 힘을 많이 받아 부러지는 사고가 많이 있었죠..저도 볼트 맨뒤의 2개가 풀리지 않고 부러져 버려서 잘라서 빼내느라 1시간을 넘게 고생했었습니다.초창기의 언더커버 고정 볼트는 SUS 재질로 돼어 있었는데, 부러지는 영상 올리니, 그 다음부터는 하이텐션 탄소강 볼트로 바뀌었지만, 여전히 부러지는 사례는 존재 합니다.뭐 이제는 정비든 튠업이든 돼도록 안풀고 있지만, 또 풀때 요령도 생겼고.. 해서 부러지지 않게는 풀수 있는데,, 언제가 하자가 터지지 않을까.. 하는 우려는 합니다. 힘을(응력) 꽤 많이 받고 있거든요.이점은 쌍용 본사에서도 개선해야할 부분인데, 왜 개선을 못하는지.. 안하는지 모르겠습니다.그리고 이번에 바뀐 내용을 적어 보자면, 현재 영상의 차량은 다이나믹에디션 인데, 이번에 옵션이 바뀌어서 다이나믹 선택하면 타이어, 사이드스탭,  아이언빌드 (파랑색 스프링) 스프링이 들어갑니다.위의 내용중 다이나믹 에디션에 대한 부분을 다뤄 주셨으면 좋았을것을 좀 아쉽네요..옵션에 강제적으로 포함 입니다. 스프링과 레터럴바 등등..전에는 다이나믹에디션 에서 오프로드 패키지 라고 해서 150만원 짜리를 별도 선택해야 했었는데, 지금은 다이나믹 선택하면 130만원 추가로 자동으로 들어간다 하니, 구매를 생각 하신 고객분들 이라면 잘 살펴보고 불필요한지, 필요한지 여부를 결정 하시면 될것 같습니다.즉.. 현재의 다이나믹 패키지는 이전 모델의 오프로드 패키지 라고 보시면 될것 같습니다.이전에는 스탭 / 언더커버 / 데후커버 / 다이나믹로고 와 휠 이 한개의 패키지고 오프로드 패키지가 별도로 존재 했으나, 이번엔 강제로 통합시켜서 다이나믹을 사면 오프로드 패키지가 130만원에 강제적 포함 이란 말이 맞겠죠..그리고 번외로..김한용님 말씀 처럼 가변 스프링 이란 말을 쓰시는데, 가변 스프링 이란 단어가 존재 하나요?단순히 스프링 에서.. 존재 한다면 저것이 가변 스프링 이란 단어를 적용할수 있는 것인가요???가변이란 단어 하고는 좀 동떨어진것 같아 보이네요..이점은 확인 부탁 드립니다. 제가 처음 들어보는 내용이라...왜 저렇게 윗쪽 또는 아랫쪽을 촘촘하게 감는지는 어느정도 알지만, 논란의 여지가 많을것 같아 그냥 안적고 갑니다.제가 아는 내용이 다 맞는것은 아니니까...다이나믹 에디션을 구매 하는게 좋은지..저한데 저 옵션을 선택하냐 마냐 문의를 많이 주시네요...뭐 선택은 개인의 자유지만, 중복투자 라는 말씀들을 하시는걸 보니.. 승차감은 어떨지..조만간 차가 입고돼니.. 타보면 알수 있을것이라 봅니다.그리고 이전의 다이나믹 에디션에 들어갔던 데후커버는 옵선에서 제외 됐습니다.이점도 참고하셔서 말씀 해주셨음 좋았을텐데요...이 부분에서도 실망 하시는 분들이 계셔서요..스폰을 받고서 제작 하시니.. 어느정도는 감안 하지만, 그래도 중립적인 입장에서의 의견도 필요하다고 생각 합니다.이 영상을 보고 수많은 구매 예정자 들이 선택하는건데, 책임감 이런것도 필요하겠죠..맞는것은 맞다고, 아닌것은 아니라고.. 그리고 다수 정보중 잘못된 내용도 있습니다.즉.. 정확한 확인은 다 안해보고 보여주고 싶은 내용만 올리셨다는 느낌을 받네요..------------------------------------------------------------------------------------------------------------------------------------------------------------------------------------아... 추가로 더 적고 갑니다. 밑에 댓글에 타이어는 제외라고 하신 글이 적혔는데, 저한데 전화 오셔서 구매 문의를 상담하셨던 분은 타이어 포함이라고 하셨어요..이점은 저도 확인 해봐야 할것 같구요..그리고 저도 쌍용이 잘 됐으면 하는 바램인데.. 바보같은 골로가도 차량 보다는 정비 입장에서 훨씬 효율적이고 문제가 없는차가 쌍용 차니까요....차량을 구매 예정인 분들은.. 내가 부담없이 탈수 있고, 검증이 된 차량을 선택 하실꺼면.. 이번 차량을 사셔도 좋을것 이라 생각 합니다단.. 영상에서는 이전 모델과 바뀐 부분.. 그리고 영상 중간에 스프링의 쿠션이 없고 위에서만 노는것 같다.. 이 부분은 잘 봐두셔야 할것 같구요..나머지는 정말 좋은쪽으로 개선이 됀것같아... 기대가 돼는 부분 입니다.",2
499,엄청 단단한가 목소리가 ㅜ,1
500,한용씨 픽업은 잘 모르시네,1
501,1:45 기본은 수동 변속가..,1
502,히밤 작년에 샀는데 ㅠㅠ,1
503,쌍용 100만 키로 현대 만 키로 혹시 ~ ?  (oil hippopotamus),1
504,이쁜데!? 아..니 멋진데,2
505,ㅋㅋ쌍용차 산다는넘들 사지도 않을거면서 희망고문시키노,1
506,운전병으로 '나 돌아갈래~~~',1
507,번호판 앞자리가 왜 두자리수인가요 ?,1
508,유료광고로  시작하면  시승기가 될까?,1
509,진짜 좋게봤었는데 염소소리듣고 고민돼네요....,1
510,전기차 허머ev 비스무리한거 한개 출시해라 사줄께,1
511,전기차로 내놔 좀,2
512,저차 트렁크 오픈이라 아줌마나 애새기들 쳐먹고 쓰레기들 버리고가는거 보면 극혐이던데,2
513,나쁘지안아요  가  아니라    좋아요 하면 될것을 왜 말을  어렵게 하지   이상한 화법이  언제부터  생기기시작했는지~~~,2
514,엔진 미션 왜 안바뀌고 그대로 나온거냐 ㅋㅋ 에휴 팔기 싫지 ?,2
515,20:52 허리가 아픔..,19
516,쌉좀 안쓰셨으면 좋겠네요. 니뷰가 좀 쌉오입니다.,1
517,저게 2400???,1
518,크롬이 너무 많다...,2
519,짐칸바닥이 뒤로기울어지면 싣은짐무게 중심이 뒤쪽으로 쏠리죠 !  ㅉㅉㅉ,1
520,목소리떨린다는거 타이어때문임다ㅋ쿠퍼타이어라서 그럼. 승용차에 쿠퍼달고달려봐야~  아~  렉칸 쿠션감 정말좋은데 할끼야? 차알못들이많네 외제차에 피xx 미xx타이어를 왜끼는지는 알어?ㅋ 글고 진짜 차안 조용함ㅋ,1
521,수천만원 주고 사는데 제조사 사정 생각해주면서 사야한다니..없어져야 할 회사가 맞는듯,4
522,편집을 엄청나게 하셧네요 ㅎㅎ 이야기 하시다 뚝뚝 끊어 지고 다른이야기로 넘어가는 장면이 너무 많아서 무슨이야기를 하시는지 ..매끄럽게 이야기 를 진행 되지 않을정도로 편집을 해서 보기 힘드네요,2
523,"유트버들이 도와주려고 하는데... 경영진은 갖잖은 경영정도를 지키려하니 한심하네.... 간단해... 벤츠, BMW, 제네시스 아니더라고 체어맨 옵션 넣고 이가격에  팔아.... 정의 정도 ... 망하는데 뭘간보냐...",3
524,몽골   ★ -  칸 - ★,1
525,조선 랩터,2
526,본넷을 열자마자... 아....,1
527,왜 자꾸 조선이란 말을 쓰는지!,1
528,보면서 저만 안타까운가요??,1
529,여자분 안나오는게 훨 보기 좋습니다.,2
530,저번에 응원해줘서 살아난이후 행태를 보니까 응원해줄 가치도없음,1
531,망한 회사차  시승기라... 할일도  되게없네..,1
532,한국사람들 하나씩 다 사죠,1
533,렉스턴 올블랙 사고싶은데.. 그냥 살까 ㅠㅠ,5
534,제목보솤,2
535,24:32 8년 아닌가용ㅋ 줄어들었나,1
536,아직도 조립중에 담배피고 그걸 제재하는 관리자 멱살잡고 그럼?,3
537,쌍용차 응원하는 사람들 특징 : 본인은 절대 안사고 남이 사길 바람.그냥 빨리 망하는게 상책,6
538,기어봉은 아숩네요 그래도 쌍용힘내서 살아나면 좋겠네요,2
539,은근히 깐다,2
540,진동으로 목소리 벌벌 떨리는거 보소;,1
541,운전중 목떨림...엉망임..,2
542,하뇽이형 목소리가 너무 떨려...,50
543,"센터페시아 네비, 스위치가 6년전 샀던 티볼이랑 똑같네요",2
544,주차장에서 제발 내 차 옆에 주차 안했으면 하는 차...,1
545,저거 사고나서 그릴을 벤츠로 바꿔도 의외 괜찮음,2
546,목소리 음청 떨리시는디..ㅋㅋㅋ,3
547,아 k3페리영상 언제 올라오나요,1
548,아직도 쌍용차  에서   나 소형 화물차 안만나 못만드나 요,1
549,현대의개,2
550,포터도여는디,1
551,망한회사 차를 왜사요?,2
552,말하실때 목소리떨림이...ㄷㄷ,1
553,트럭으로 1차선은 안돼요...,2
554,운전 할사람 아니네 리뷰가 참..,2
555,김여사가 타는차는 아니라서 기본모델사도 괜춘할듯 !,2
556,칸..,1
557,나 지금 떨고있니?....ㄷㄷㄷㄷ,23
558,바보 오르막에놓코 물뿌리면되지~,2
559,네비가 사제 네비 같은디,2
560,어차피 여기댓글단사람중에 살사람없는건 맞자나요,1
561,콜로라도가 들어오고 나서야 기본기도 없는 픽업이구나를 알았죠.,2
562,05:58염소,2
563,별로 안이쁘네요,2
564,계약 준비중,2
565,목소리가 너무 떨리네요.,1
566,저딴걸  누가사,1
567,진작에ㅠㅠ,2
568,목소리 왜케 떨어요?  ㅎㅎ,2
569,목소리가 덜덜덜 ㅎㅎㅎ,24
570,난 좋은데..,9
571,자까님 어디갔나여,1
572,서비스도 제대로 못 받을 차 ㅋㅋㅋㅋㅋㅋㅋㅋㅋㅋㅋㅋ,2
573,랩터  빨아제끼든데,1
574,"솔직히 도로상에서 저 트럭같이생긴차량의 대부분은 급가속에, 급차선변경에난폭운전을 주로 목격하는 차종중에 하나...거기에 아무데나 주차까지...이미지가 좋은차는 아니지요~딱 그수준의 운전습관을 가진사람들이 타는 차량...그래도, 쌍용은 살아야한다!!",2
575,조선?,2
576,이딴걸 사라고 하다니 제정신인가 ㅡㅡ,3
577,옆 모습이 엉망이네,2
578,뭐여,1
579,아직 있네?,2
580,rip,2
581,아닌데요,1
