,comments,likes
1446,차는 현기 타지만 쌍용이 잘되야 현기가 무지성으로 가격을 올리지 않을텐데..안타깝네요,3
1447,"코란도 이모션이나, 뷰티풀코란도는 그놈의 [코란도]만 뗏으면 나름 인기 차종이 되었을 겁니다.",1
1448,픽업 제외 쌍용차 사시는 분 심리가 정말 궁금함,6
1449,쌍용을 응원하긴하지만 현기에 비하면 눈에 띄는 격차가 있긴하네....,1
1450,번창하세요!!!!!!!,3
1451,짜릿해에서 빵터졌네욬ㅋㅋ,1
1452,이모션에 이어 고모션과 외숙모션도...,28
1453,아이오닉5 vs 테슬라 모델3코란도 이모션 vs 아이오닉5뭐가 갭이 더 클까,1
1454,요정도 박수  ㅋㅋㅋ,1
1455,잘생긴 사람한테 못생겼다고 놀리면넝담이지만못생긴 사람한테 못생겼다고 하면싸우자는거.. ㅜㅜ,2
1456,렉스턴스포츠 전동화를 출시했어야지..,1
1457,이차를 사는 사람도 있다는게 참 신기함..,2
1458,렉스턴 스포츠 전기차가 저정도수준에 가격만 괜찮으면 잘 팔릴것 같네요 물론 최대한 빨리 내놓아야 시장 선점을 하겠죠,2
1459,"쌍용은 그냥 스코다처럼, 가성비를 주력으로 내세우자. 렉스턴은 렉스턴대로 팔고!",1
1460,목숨을 건 시승식~~아주 잘 봤습니다저도 목숨을 걸고 봤습니다개그맨 하셔야 겠어요장진택 개그맨님~~,2
1461,과속방지턱을 51km/h로 넘어가면서  세단도 아니고 서스펜션 논하기는 좀..... ㅋ,4
1462,최근에 모 자동차 매체에서 실주행을 하다가 표시거리보다 더 낮은 주행가능 거리 나온것에......쌍용 화이팅...ㅠㅛㅠ,6
1463,안쓰럽네요  190마력 😰😭지금 주종이 400마력인데쌍용아  힘내란 얘기도 못하겠다,14
1464,내부 디자인 ㅜ 어우 10년전 현기차도 저것보단 좋겠네요,1
1465,현.기 싫다면갓성비는 볼트인거 같습니다.,1
1466,왠만하면 전기차 전용 플렛폼으로 만든 제품을 사야됨.,1
1467,KG코란도 뭔가 멋진데,1
1468,쌍용이 잘됬으면 좋겠지만 영상보는 내내 차량을 보고 사고싶다는 느낌이 한구석도 안드네요..아쉽습니다...,1
1469,희귀차로 가치는 있겠네요. 쌍용의 역사적 차이기도 하고...,1
1470,쌍용은 디자인 부서 없나요?,1
1471,별 기대는 안했지만 기대했다고 치기로 한다,1
1472,쌍용은  아직도 정신못 차렸다  도와줄필요없다   고생 많이해야된다,2
1473,택이형 화이팅,1
1474,쌍용이 이지경이 된걸 이 영상만 봐도 알겠다.... 현기차 배짱장사에 르쌍쉐가 일조했다고 봐고 무방하다,8
1475,현대차가 짱이에요 역시 현대기아!최고,2
1476,쌍용 사랑 미디어오토 사랑,1
1477,마지막 말따나 쌍용차 가지고 주식놀이 하는 놈들 때문에 쌍용차 인수가 더 힘들어지는것 같음. ㅠㅠ,2
1478,고모션 홧팅,6
1479,차주님 비닐은 빨리 제거 하시고 타세요~~,1
1480,빨리 누가 인수 투자를 해야 하는데 가족의 생계와 회사의 생계가 달려있네요.중국은 다시는 하지말고요. 시간을 더 달라는 쌍용 쌍용 화이팅,1
1481,전기픽업트럭 만들면 잘팔릴텐데..,1
1482,아...침몰해가는 타이타닉 보는 듯...왜 자꾸 희망을주는지...ㅠㅠ,2
1483,PD님 너어는 진짜.. 피리.. ㅠ,2
1484,뒤처진 기술을 가지고 판매를 하려고 하는데다 배터리 문제로 판매에 영향 까지....... 그래도 구매 하려는 소비층이 있어서 다행이라 생각 해야 하나.... 그러려면 가격이 한 없이 저렴해야 할텐데..........,1
1485,회사 차로 처음 쌍용차를 경험했는데쌍용차는 타는게 아니라는걸 느꼈습니다,1
1486,잘봤습니다.,1
1487,쌍용을 세번 죽이는 영상......,3
1488,3천만원중반이면 넥쏘 산다 ㅋ  쌍용 화잉팅^^,1
1489,이걸 사라고 만든건지 의문스러운 차,1
1490,쌍용차 마지막 리뷰 잘봤습니다,1
1491,일단 디자인 때문이라도 공짜로 줘도 안 함...,1
1492,미니 일렉트릭 보다는 다 좋다,2
1493,11:03 극한직업,2
1494,미니ev 보단 낫단 생각이...,2
1495,이거 사도 문젠게...전장관련 고장나면 쌍용에서 못고칠것 같은데,1
1496,아쉽고~안타깝고~~쌍용이 잘되었으면 좋겠네요,2
1497,신기한 세상이야. 왜 쌍용차인수가 호재라 주식장난질을 치지?쌍용차가 비전이 조금이라도 있다면 삼성.lg.sk가 인수하지.거들떠도 안보는건 다 그만한 이유가 있는건데..,2
1498,번호판 부터 [10호 9xxx] 레알 인정.,2
1499,택시로는 좋을것 같네요,2
1500,파란색 가니쉬 넣었다고 전기차로 봐주는 시대는 지난 것 같은데... 언급하신대로 몇 년 빨리 나왔으면 나름 경쟁력 있었겠지만 참 지금보니 왜 사나 싶네.,5
1501,"좋은건 딱히없고,나쁜건 적당히 가성비 얘기하면서뭐..이정도는..무난..괜찮..뭐ㅎㅎ말끝흐리면서 흐지부지 말돌리기ㅎㅎ영상다찍고 빡시게 현타왔을듯,,",1
1502,만든사람들이 문제가있으니 차에문제가 없을수가 ㅋㅋ,1
1503,"쌍용을 인수한다고 하면 예전 같았으면 화이팅 드디어 살아나는구나 했는데, 이젠 누가 산다고 하면 간보고 주식이나 띄울려고 하는게 눈에 보여서... 에효... 화이팅이지만 이제 웬만하면 놔줘야 할거 같은... 그런 느낌.",1
1504,쌍욕차 수준 ㅋㅋㅋㅋㅋㅋㅋㅋㅋ 싸긴  디자인도 구리고 성능은 구세대 ㅋㅋㅋㅋㅋㅋㅋㅋㅋㅋ,3
1505,쌍용은 이제....보내줘야.....그리고 닛산 전기차랑 주행은 비슷해 보이는 ㅋ,1
1506,꼭 코란도  디자인으로 했어야 했냐~~기아  ev6처럼  디자인해라,1
1507,a ㅏ 쌍용화이팅 ㅋㅋㅋㅋㅋㅋㅋㅋㅋㅋㅋㅋㅋㅋㅋㅋㅋㅋㅋㅋㅋ개웃기넴 ㅋㅋㅋㅋ,1
1508,이번의 사태는 아무런 공지가하나도 없이 쌍용 일방적인계약철회.판매중지등 여러가지불편함이 많네요...무슨생각을 가지고 회사를이끌어가는건지...답답허네...,5
1509,지금이라도 승용차 접고 상용차 1톤 트럭시장을 공략하는게ㅜㅜ 픽업이랑,1
1510,이모셜서스를 gv70서스랑 비교한다는게 ....,1
1511,쌍용은 하는거보면 뭔가 답이없어 ㅋㅋ ㅠ,14
1512,와 이런차를 사는 사람이 있기는 있군요..,2
1513,앞으로 쏟아져나올 본격적인 전기차들을 어떻게 이길려고..,12
1514,짱용 짜요~ㅠ무쏘형님들 화내지마세요 쌍용답없음 ㅋㅋ,2
1515,쌍용 까방권 다시 생겼나 보네요티볼리 이후 없어진걸로 아는데,1
1516,이정도면 멕이는거네요  장점은 저렴하다?,1
1517,쌍용차 직원들과 현기차 노조들 미팅 좀 주선해라.생각이 있는 인간들이면 소주에 삼겹살 츠먹으면서 분명히 느끼는게 있을거다..,2
1518,이 정도면 그냥 사지 말라는 소리네요 ..,2
1519,눈물난다   이젠보내주자   쌍용노조  밖에서  추운밥먹길 바래봅니다.,2
1520,아! 오두산 통일전망대 주차장이네요ㅎㅎㅎ,1
1521,"유채영, 이모션이름 있는 회사로 넘어가면 대우처럼 모델도 브랜드도 사라짐",1
1522,쌍용차 화이티이이이이이이이이이이이이잉 ㅋㅋㅋㅋㅋㅋ,1
1523,와우,1
1524,더블드래곤 화이팅!,1
1525,용자다 용자,1
1526,애초에 경쟁력 상실하고 5-10년은 뒤쳐진 기술수준 된지도 오래.이정도면 정부에서도 돈 많이 썼음. 이제 그냥 사라지는게 도와주는거임.  살고싶으면  잘난 노조들이 인수해야지 ㅋㅋ,2
1527,단점을 말하는건 좋지만 비꼬는건 좀,1
1528,최대한의 쉴드....를 위해 노력하는 안스러운...ㅋㅋ,1
1529,이정도면 놀진않았어는 과한 워딩아닌가싶네요,3
1530,저정도면 인정해줘라..욕봤다..雙龍!!! 당장구매함..가성비 짱..거품없고..브랜드 프리미엄없고..ㅋㅋ,1
1531,"기술력도 문제, 자본력도 문제, 제품 포지닝이나 마케팅 능력도 문제...후발로 전기차를 내놓은데 코란도 모델에 전기 배터리와 전기 모터만 얹어서 내놓는게 말이되나...그런식으로 내놓을려면 이것저것 옵션 다뺴고 아주 간단하게 만들어서 천만원은 더 가격을 낮췄어야지. 기술력이 앞서지 못하지만 그래고 싼맛에 사람들이 살 수 있도록. 그렇게라도 팔아서 일단 기업을 유지해야할 거 아닌가? 싼마이 소리를 듣더라도...그리고 싼마이로 내놀을 거면 코란도라는 이름은 쓰지말자. 그래도 코란도는 쌍용의 역사고 자존심인데...",1
1532,쌍용은 이제 끝이야...,1
1533,디자인이 ㅠㅠ;ㅋㅋ 저런 파란포인트 처음에 전기차 낼때 막 하던건데.. 소나타하브나 니로ev 등등.. 그거별로라 현기는 다 없앳더만 쌍용이또하고잇누,1
1534,차를 사니깐 악기를 하나줬다 ㅋㅋ,2
1535,깔꺼 다까고 감싸주시네 ㅋ,1
1536,쌍용이 잘 되든 말든 저는 이 채널이 더 잘됐으면 좋겠습니다... 김X용 제끼고 더 잘 나갔으면 좋겠음 ㅋ,5
1537,시승회든 신차출시때 초청이런거 받을려면 예쁜포장하기 이해는 되지만쓰읍.. 직접 사서 굴려야 알 수있겠구만,1
1538,애증의 짱용ㅜ,1
1539,이.모쎤 노 데미지!,1
1540,EV6의 돌고래 에디션에 이어 이모션 피리 에디션? ㅎ,1
1541,회사가 망할지 어떨지 모르니..ㅋㅋㅋ,1
1542,진택이형 비닐 떼기 귀찮아서 그런 거 잖아요;;,1
1543,장기렌트는 괜찮은듯............구매는 쫌,1
1544,보조금 받고 코나ev 같은거 원하면 ㄱㅊ,1
1545,회사가 살려면 디자이너부터 몽땅 짤라야 된다.끝.,1
1546,25년에  폭바 추가구매하것슴다.이제 그냥 썅용은 역사속으로 사라지는걸로.. 리튬대체재가 생기면 모르것네 ㅋ,1
1547,리뷰 총평 : 아~~~~~~~~~~~~~~~~ 처음 만들다 보니까........,3
1548,기술이 뒤졌다기보다 저려미로 나온거죠,1
1549,기분 상하지않게 잘 말씀하시네요. 생김새는 조금 저기하군요.,1
1550,그래도 나는 아이오닉5이나 ev6..쿨럭쿨럭,1
1551,다들 응원만하고 사지 않는차..,1
1552,쌍용 먹이지좀 마세요...,2
1553,흠? 장대표님... 영상 화질이 왜이래요? 뭔가 좀 물빠진거 같은 느낌?,1
1554,아......... 화이팅!!! 어........... 음.... 어 화이팅!!!,2
1555,번호판...씹호구....🤫,1
1556,8:34 앜ㅋㅋㅋㅋㅋㅋㅋㅋㅋㅋㅋㅋㅋㅋㅋㅋㅋㅋㅋㅋㅋㅋㅋㅋㅋㅋㅋㅋㅋㅋㅋㅋㅋㅋㅋㅋㅋㅋㅋㅋㅋㅋㅋㅋㅋㅋㅋㅋㅋㅋㅋㅋㅋㅋㅋㅋㅋㅋㅋㅋㅋㅋㅋㅋㅋㅋㅋㅋㅋㅋㅋ,1
1557,티볼리 우려서 전기까지 갔네!,1
1558,참 안타깝네요,1
1559,선좋후감입니다,1
1560,뒷자석 송풍구 비싼것도 아닌데 해주지;;;,1
1561,이제 그만 쌍용을 보내자….,1
1562,애증의 쌍용 하 왜 저래됬는지 모르겠다,1
1563,그돈씨가 절로 나오는 차,2
1564,기자님...  표정은 괜찮아보이지 않습니다....,1
1565,쌍차 관계자들 중에는 캠핑족이 없는걸까???,2
1566,10호구ㅋㅋㅋㅋㅋ,1
1567,부품사 다니는 입장에서 쌍용의 행태를 보면 블쌍한게 아니라 뻔뻔하기 그지없음.  차라리 대 놓고 한푼 주쇼하는 거지가 양심적임...쯧쯧쯧천만원이 아니라 2천만원 저렴해야 맞을듯. 무슨 전기 클래식 카냐 ?,1
1568,주가를 올리는데 망한집 이용하는 양아치는 정말 아니지않나 싶습니다.,1
1569,싸니까 이해하자,2
1570,18:15 백PD가 산다고 합니다.,1
1571,"쌍용 코란도 스포츠 차키 분실해서 주문한지 6개월 지났습니다. 당연히 아직까지 못받았고 언제쯤 줄수 있다는 답변도 못해준다고 합니다. 그냥 무한정 기다리랍니다. 반도체 때문이랍니다. 근데 궁금한점은 그럼 쌍용 새차 주문하면 반도체 때문에 차키 없이 차량만 받겠네요? 근데 새차에 대한 차키는 잘만 받고 있습니다. 그래서 차키 반도체 납품하는 하청 업체 모*텍에 직접 전화했습니다(쌍용에서 알려준 하청업체 연락처). 모*텍은 반도체가 부족한것은 맞지만 쌍용 본사에서 주문한 것은 차곡차곡 조금씩 납품하고 있다고 합니다. 쌍용에서 이 반도체를 가지고 어떻게 사용하는지는 본인도 잘 모른다고 합니다. 결론! 쌍용은 기존 고객에 대해서는 그냥 나몰라라 쓰레기 취급하고, 새차 주문건에 대해서는 문제없이 해결하고 있습니다. 만약 여러분이 쌍용차를 구입하는 순간 고객님이 아니고 호갱님으로 바뀌고 고객 서비스는 이제 꿈도 꾸지 마시고, 차키를 분실 안되게 정말 소중히 잘 관리하세요! 차라리 차를 분실하면 차는 찾을수는 있습니다. ^^ 누가 제발 공론화 해서 차키 좀 받게 해주세요! 다시는 쌍용차 살일도 없고 추천할 일도 없을겁니다. 적극적으로 쌍용차 못사게 말릴겁니다.",1
1572,티볼리 : 이제 그만우려죠...,1
1573,근데 객관적을 너무 별로다...ㅋㅌㅋㅋㅋㅋ,1
1574,저렴해서 사고싶은데 못사네요,1
1575,대놓고 까는 것보다 이런 게 더 악평으로 느껴지는 건.... 나만 그런가?,3
1576,따뜻한리뷰,1
1577,에휴 원래 계획대로 나왔으면 이정도는 아니였을 텐데...,1
1578,코란도스포츠로가서 트럭ㅈ원금받음. 흠,1
1579,코란도 고모션은 없나요??,1
1580,망할회사는 망하는게...,1
1581,8:55 뒷자석 ㅠㅠ,1
1582,그리고 suv는 서스 거기서  거기 같은뎅,1
1583,이런것도 사는 사람이 있구나,1
1584,하필 번호판 이름이...10호9.. . . . .  .그냥 그렇다구요 ㅠ,1
1585,티볼리 전기차.. 티볼리소형 티볼리 중형 티볼리 대형   후.............,1
1586,망해야 할 기업이 살아서 국가의 발목을 잡는거 아닌가요,2
1587,하 ㅆㅂ..쌍용은 왜망하지는지 모르는거야 진짜로?,1
1588,피리소리는 공조기 외기모드???,1
1589,쌍 참 안 쓰러 워요,1
1590,끼욧~,2
1591,"내가 재산이 50조 정도 있는 사람이면 2조에 쌍용인수해서 싹 재정비 시키고 쌍용최초 승용차도 출시하고 할텐데 참 아쉽습니다. 전기차들도 요즘 반도체, 기타부품, 배터리 원료, 원자재 폭등해서 초기보다 그냥 그런 시장성이 형성되고 있다는데 앞으로는 차 받기도 더 힘들어지겠네요. 거기에 푸틴 이자식은 눈치없이 전쟁일으켜서 식품, 철근, 자동차 철판 등등등 세계적으로 난리네요. 자동차도 그렇고 모든 공산품 시장이 올해 내년까지 많이 위축되는 건가요?",1
1592,쌍용은 티볼리 잘팔릴때 바로 전기차 준비했어야했다,3
1593,티볼리 이모션 주행거리도 짧은차 그냥 티볼리인데?,2
1594,차번호 주기네 ㅋㅋ,1
1595,차는 그냥 머 깔끔하게 생기지 않았어요? 괜찮은 것 같애요..아니 장기자님 진심이세요??왜 솔직하게 이야기를 안하세요?하.. 나도 머라 말을 못하겠다...,3
1596,광림화이팅 ㅋ,1
1597,차같지도 않은 철쪼가리를 차라고 하면 안됩니다.,1
1598,언제적 네비인가요,1
1599,네? 문이 어떻게 닫힌다고요?어ㅓㅓ옭오오?,1
1600,자막 담당자 누굽니까 뒷자석이 뭡니까 뒷자석!!!! 뒤에 자석붙어이써????!!?!?!,2
1601,쌍용차는 타구다니면 쪽팔리거같아 ㅠㅠ,2
1602,코란도 디자인이 좀 아쉽습니다.,1
1603,저 티볼리디자인 완전 구리다고~ 왜 고집하고 있는거냐!!,1
1604,안뇽하세욥❗️,2
1605,답도 없는 그놈에 티볼리디자인 그만좀 해라,3
1606,차주님...ㅋㅋㅋㅋㅋ 어휴...,1
1607,고모션은없나용,1
1608,아~~~~~~가 몇번 나오네요 ㅋㅋㅋ,1
1609,죽은 자식 불알 만지는 것도 정도가 있지.. 청산뿐이다 이젠,1
1610,저거 살바엔 차라리 BYD같은거 국내생산이 낫겠다.. 이번에 나올 신차에 목숨 거세요,1
1611,희대의 쓰레기차이걸 판매한다고 만들었냐 ㅋㅋ,1
1612,전볼리였다...ㅜㅜ,1
1613,5030에 맞춰타는 차,1
1614,요약 19:43,1
1615,21:43,1
1616,이걸 왜 사징 차라리 코나 니로 중고를 사는게 나을듯,1
1617,ㅋㅋㅋㅋㅋㅋㅋㅋㅋ,1
1618,뭔가 짠하네,1
1619,하.. 언제적 파란색 느낌이냐..,1
1620,망한 회사 왜하는지.. 자기 회사의 분수도 모르고 있는 회사는 망해야지 왜 살려줘 살려준다해도 안해도된다고 밀어내고 어휴,1
1621,볼트 살께요...,1
1622,8:55 뒷좌석입니다,1
1623,"사료좀 그만줘라 언제까지 공적자금이나 축내고 유지시켜야 하나.기업이 경쟁력이 없고 팔리지가 않으면 망하고 직원들은 해고 되는것이 상식이다.애초에 오래전 정리를 못하고 애물단지로 남겨놓은것이 문제의 시작이였던것.대우도 마찬가지고 이런 회사들은 과감히 정리해버리고 싸고 좋은 외제차들이 수입이 되는것이 맞다.아니면 공적자금없이 스스로 유지가 가능한 회사가 되던지.해고가 그렇게 두렵나? 귀족 노조들이나 그렇겠지... 살면서 구조정리,자진사퇴,권고사직 한번 안하고 사는사람이 몇이나 되겠나.",1
1624,소음 측정기 뭐임 ㅋ,1
1625,코란도 이돈씨,1
1626,8:26 갑자기 여자친구 없음 ㅋㅋㅋㅋㅋ,1
1627,흠.....ㅋㅋㅋㅋ,1
1628,볼트!!!,1
1629,인테리어..🤦🏻‍♂️,1
1630,쌍용 사는 애들 이해가 안간다 진짜ㅋ 회생도 될지 확실하지도 않고 인수도 조리돌림 당하다 또 조리돌림 당할게 뻔한데ㅋ 쌍용 망하면 부품은 어디서 구해서 고칠래?ㅋ,1
1631,정말  한숨밖에  걍 사라져라,1
1632,촌스러운 파란색 일렉트릭감성 디자인..,1
1633,쌍용은 중국전기차회사 BYD 랑협력사이니까 회사살아나면 좀배워라 현기를독점안되게 해야지,1
1634,코란도 e모션? 맞나..? 암튼 이 차량 사제 보강 튜닝으로 제네시스급으로 만들기 프로젝트..!,2
1635,하...쌍용...,1
1636,근데... 그깟 스크린 비닐 떼는 것도 신경 쓰는 애가 신차를 빌려준다고? 말도 안되는 소리지... 글구 시승을 안하면 모르지만... 비닐은 제거하고 해야지... 글구 아무리 디자인 위주로 시승기 쓴다지만... 타이어 브레이크 같은거 조금도 길들이기 안된 차 가지고... 시승한다는 것도 좀...,1
1637,전기 부품 쌍용 개발인가요? 중국 부품 받아 쓰는건가요?,1
1638,다 떠나서 차가 안이뻐..;;,1
1639,쌍용에서 돈 받고 하는 리뷰가 아니니까~걍 졸라 비꼬는 말투네  ㅋㅋㅋㅋㅋㅋ,1
1640,돈주고 타라해도 안타요,1
1641,쌍용차는 아마 판매하면 계속 적자아닐가요?  벌금 안맞으려고 만드는 흉내정도 내는거 아닐까 합니다.   대부분의 전장류도 모비스에서 납품받는다고하는데.... 3~4년의 기술차가 아니라 기술력자체를 검증하기 어려운듯요...ㅠㅠ,2
1642,장진택 기자님 리뷰 참 좋아하는데쌍용 리뷰하는것 만큼은 안보고 싶어요지금까지 했던 쌍용 리뷰들 보면 빈정빈정한 느낌을 많이 받게되더라구요 . . 재미를 위한 요소겠지만 위태위태한 회사 차량 리뷰할때는 좀 더 진중함을 담아서 리뷰해주셨으면 합니다,4
1643,이 차를 성능으로 타나?관심 받으려고 사는거징,1
1644,뒷좌석 입니다. 자동차 전문채널인데 자막좀 수정해주세요.,1
1645,차주님 여자친구 없는데!!!!,1
1646,"기존 내연차 플랫폼에다가 엔진이랑 변속기 빼고 배터리랑 모터를 넣은 게 다니 실내공간 안 나오고 경량화 안 되고 경량화가 안 되니 주행성능이랑 전비도 떨어지고 자율주행  , OTA , V2L 같은 것들을 안 들이밀어도 기본에서도 부터 이미 컷이네요.",15
1647,비슷한 가격의 볼트 euv를 놔두고 살 이유가 전혀 없네요..주행거리도 100키로 차이나고,1
1648,해체가답,1
1649,LG배터리군요.,1
1650,비꼬는거 졸라 보기싫다,3
1651,진짜 이돈이면 쉐보레볼트euv가 생각나긴 하겠다,2
1652,결론 허접 그자체다,1
1653,뭘해도  티볼리    답답하네,1
1654,"솔직히 기존 양산차 브랜드에서 한 15년 전 쯤에 기술실증용 테스트카로 만들었을 법한 수준의 전기차네요... 배터리와 모터야 쌍용이 발전시킨게 아니니 그냥 얻어걸린 성능인거고.. 지금 중국에서 잘나가는 니오나 엑스펑 같은 양산 전기차 보다 많이 뒤떨어지는 느낌이네요..자영업자용으로 실구매가 2000만원 초반대로 구매할수 있는 버전 내놓지 않으면, 솔직히 전혀 승산 없을거 같습니다. 중국차 보다 떨어지는 국산차를 쌍용에서 보게될줄 몰랐네요.. 사브같은 역사와 전통이 있는 회사도 사라지는데.. 쌍용이 뭐라고....산소호흡기 데도 전혀 이상할게 없는 회사입니다.",1
1655,상추했다.,1
1656,쌍용아 빨리 망하고 설비라도 제정신가진 사업자한테 넘겨주라,1
1657,본네트 꼬챙이;;,1
1658,한마디로조까치만들었네 저거샀다가돈만날이겠네,2
1659,저런차를 팔아?,1
1660,필릴리 피리피리 필릴리,1
1661,이모션이냐? 이모냥이냐?,1
1662,진짜 앵간히 못만드네,1
1663,쉐보레 볼트 ev나 euv보다도 싸네? 차크기 땜시 코란도 이모션이 패밀리카로는 더 나을듯,1
1664,얼마나 차에 무지하면 이런차를 살까...,1
1665,쌍용은 거르는 걸루 ㅜㅜ,1
1666,너무 조롱하듯이  리뷰,2
1667,차주 ㅈㄴ 불쌍 그자체,1
1668,티볼리,1
1669,왜 하필 첫차를...... 그나저나 저는 더이상 쌍용을 응원하고 싶지 않네요....,1
1670,헨들링이 엉망은 17인치라서 그런듯 합니다.,1
1671,이걸 왜사..이제 쌍용은 중국차랑 비교해도 중국이 몇수위인듯..,2
1672,걍 답없는 차임. ㅋㅋㅋ,9
1673,GG 를 아직도 안쳤어?,2
1674,"쌍용차는 렉스턴2 191마력 CDPF 달기전 까지  차는 살만했음,,,,,,,,,,,,,,,,,,,,,,,,지금은,,,,,,,,,,,,,,,,,,,,,,,,,,,,,,,,,,,,,,,,,,,,,,,,쌍용화이팅~!",1
1675,As가....,1
1676,오~,1
1677,1등.,2
1678,코란도 계속 저꼴 낼꺼면 그냥 현대한테 싹싹 빌어서 쌍용달고 갤로퍼나 부활 시키는건 어떻냐,1
1679,왜 쌍용은 댓글보면 항상 응원해주지 현기보다 똥을 싸고도 싼 기업인데 ㅋㅋㅋㅋㅋ,1
1680,쌍용은 중국전기차만도 못하구나.,1
1681,와 너무 구리다,1
1682,티볼리네.,1
1683,쌍용차 살릴회사 하나도 없습니다. 다 땅 개발할려고 함. 빨리 청산하길,7
1684,공짜로줘도 안탐ㅋㅋ,5
1685,망,1
1686,쌍용차를 사는 사람들은 도대체 무슨 생각으로 그런 후진 차를 사는걸까? 핵심 기술도 없고 자기들의 요구조건을 관철시키기 위해 삶의 터전에다 불을 지르는 노조는 완전 악마의 새끼들인데 말이다! 난 쌍용차가 망하길 학수고대하고 있다! 정말로!,1
1687,신차 시승기도 좋지만 이렇게 지인 분들의옛 명차 시승기도 너무 재밌고 좋네요👍그때 당시 쌍용 명차를 정확히 아는세대는 아니지만 지금봐도 1세대 체어맨은 고급차의 포스가 흘러넘치는 것 같습니다😄이동희 님은 옛 명차를 두 대나 가지고계시고 차량관리도 너무 잘 하시네요👍 오늘도 감사히 잘 봤습니다😊,53
1688,이런류의 단종된차의 시승기도 종종 또 올려주시면 감사하겠습니다 신차사기 어려운 사람들도 상기형 시승기 좋아하거든요,53
1689,체어맨 특히 1세대 모델 참 좋습니다 디자인도 차분하면서 무게감과 고급스러움등 두루 갖춘 정말 좋은 차량이지요 예전 대형세단의 감성 특히 체어맨 오랜만에 느껴보고 갑니다,16
1690,영상 잘보고 갑니다 당시에 나온 차량 치고는 생각보다 요즘에도 많이 쓰이는 기능이 있어서 신박하네요 그리고 센터페시아 모니터 기능도 그 당시 차량치고는 매우 고급이네요 액정도 칼라가 있고 기능도 많이 있는건 역시 벤츠와 쌍용의 협업이 탁월한 선택이였구나 하면서 절로 감탄사가 나오네요 심지어 아직도 수리및 교채를 했는데도 기능이 작동이 된다는건 다소 충격을 받았네요 여튼 아직도 현역으로도 부족함이 없는 차량인거 확실하네요,23
1691,와 기능 하나하나 설명해주시니 참 그시절의 역작이라는게 느껴집니다,9
1692,"옛날 차 감성 간만에 느껴봅니다.2000년대 중반 이후부터 우리나라 자동차 시트가 탄탄해지고 좀 내구성이 좋아졌는데,과거 90년대 가죽시트 앉아보면 쇼퍼 앉은 부드럽고 몰랑몰랑한 느낌이 일품이었죠.지금은 고급차 타봐도 가죽이 고급스럽긴 하지만 뭐..장기적 관점으로 보자면 눌려서 접히는 부분이 계속 상하고,또 거기에 척추건강에는 탄탄한 시트에 바른 자세로 앉는게 좋기도 하구요.90년대 초중학교 다니던 시절 아버지가 젊으실때 운전하시던 때가 떠오르네요.",16
1693,영상 정말 잘봤습니다 . 앞으로도 신차시승기만 아니라 이런 올드카 명차 시승기 자주자주 해줬으면 합니다 . 이제껏 본 한상기님 시승기중에 개인적으로 최고의 시승  동영상 이었습니다,8
