,comments,likes
728,19:15 멈춥니다 기자님 제대로 알고 사람들한테 소개해야죠.. 리뷰라면 정확한 정보를 전달하셔야지코란도도 경보음 들리면서 알아서 드르륵하면서 잡아주는데지금 영상의 주행조건은 이미 일정 안전거리를  확보한 상태이기 때문에 강제로 세우는 듯한 느낌을 안받는 겁니다.만약 기자님이 후방카메라를 못 본 상태에서 후진을 했으면 강제로 제동이 됐습니다. 확신합니다.,118
729,와우. 무쏘 2도 나왔으면 좋겠네요,2
730,더블랙  직접 보고 시승했는데 솔직히 쌍용이 어려운게  이유가 있구나 생각했습니다 쌍용빠였는데 이가격에 더블랙은 안살것 같음요,3
731,흥해라 쌍용!,1
732,요즘 현기차 가다 서는 하자등을 보면서 현기차 사지말자 하며 쉐보레 살까 삼성살까 보고 있었는데 렉스턴 코란도 만족도가 높군요,1
733,쌍용은 코란도에서 타격을 크개 한방먹어서코란도 하면 지프형 아니라도 좀 클래식한 오프로드 느낌인데..디자인 실패작 랙스턴은 고급진 대형 suv 느낌티볼리는 서민 소형 cuv??이런 느낌이 대중적임아무튼 쌍용 화이팅..,1
734,만들수있는대 왜 안만든겨... 할수있자너! 진짜 이쁘다,14
735,역시 믿고 보는 모카 잘봤습니다 영원하길,3
736,"옆 라인도 변경 했더라면 좋았을것을,,,,,",2
737,너무  멋찐차   갖고싶다,1
738,렉스턴이라는 회사에서 만든 렉스턴 시리즈 차같아서 멋있다. 이왕 렉스턴이라는 독립 브랜드를 만들어도 될거 같은데요? 이야 실내는 화이트가 더 간지 나내요 외형은 블랙이지만,1
739,레알 사고 싶다...,1
740,3가지 모드인데설정하셔합니다~^^    (민감도등..)*  LKAS  차선유지*  CLKA  중앙차선 유지보조*  LDWS  차선이탈경보,89
741,어제 직접 시승했는데  정말 맘에 쏙 들더군요.,1
742,티볼리가 처음 나오고 티볼리 에어가 나왔을때 오~ 쌍용차~ 라 했는데...코란도의 진화? 를 보면서 죄다 티볼리화? 에 적잖은 싫망감에 쌍용차는 신경도 안쓰고 있었습니다. 이번 영상을 보면서 이제야 쌍용이 멀좀 느끼고 있는가~ 있는듯? 싶네요. 잘 봤습니다. 이런 컨텐츠를 부탁드려도 될련지.. 최근 고속도로에서 운행중인 차량 앞유리를 뚫고 들어온 것들 때문에 운전자가 사망한 사건을 언론에서 본적이 있습니다. 이런 상황에 대처할수 있는 방법이 있을까요? 앞유리에 방탄필름 시공을 한다던지 하는 등등으로 말이죠.,1
743,요번에 아버지차오래되서 바꿀려고 신형나왔다고해서 가서보고 계약했음 일단 기어가버튼식이나 다이얼식이 아니라서 마음에들어하시더라고요,1
744,하...  사야되나?  바꾸기엔 살짝 이른감이 있는데  고민될정도로  정말 맘에드네요,1
745,쌍용자동차 대박나세요~~^^ 화이팅 입니다^^*(*^^..,1
746,와 ㅋㅋ 화이트는 펠리느낌도 나네;; 쌍용 잘한다~~ 힘내라!!!!,6
747,정말..진짜 모하비  긴장좀타야겠는걸..가격대만 좀 낮어면 쌍용 장기할부도 많이해주고하든데..강추,2
748,쌍용 도약의 발판이 되길 바랍니다 ~,9
749,마지막 부분에서 기자님 내리시는데 타이밍이 좋았네요 촬영하시는거 끝내는거 아시고 내려주시는 센스,1
750,체어맨도 이쁘게해서 다시 만들어주세요~~,2
751,센터디스플레이쪽이 조금 이질감이 드는거 같긴한데 전체적으론 괜찮네요,1
752,쌍용 렉스턴이 이번엔 정말 잘나왔네... 폭스가 작살,1
753,난 지풔 렉스턴도 디자인 엄청 좋았는데,1
754,쌍용에 애정? 애증? 있는 사람으로서 바램은 렉스턴은 지금처럼 도심형럭셔리 SUV 코란도는 투박한스타일에 2투어 정통 험지용 4륜구동으로 간다면 좋겠음 더 욕심내자면 무쏘 부활도 바라네요,5
755,3.0은 바라지도 않고 XDI270 부활이라도 어떻게 안 되려나... 지금 엔진도 시초는 XDI270에서 기통 하나 잘라낸 거고 270 블럭이면 설계도도 아직 남아있을 것 같은데...,1
756,전면부에 앰블럼 렉스턴 전용 앰블럼으로 하면 더 어울릴것 같은데요,1
757,정말 잘 팔렸으면 하는 차,1
758,이거탄력받아서 예전 코란도 다시나왔으면하네요,1
759,쌍용자동차 대박나세요 광고모델 임영웅 대박나세요 응원합니다 자세한설명 감사합니다 쌍용자동차 대박나세요 응원합니다,1
760,엑셀 리스폰스는 어떤가요? 예전에 제주에서 렌트할때 너무 안좋아서 실망이였거든요 그리고 여전히 힘은 부족한가보네요,4
761,현기차 대안을 보게 되네요~,1
762,자동발판은 안전성에선 패스바닥 걸리면 도어도 안열림랭글러설치해봤는데 다시 고정형으로 교체.,1
763,"렉스턴이 이리 이뻤나?근데, 차값이 좀 비싸고, 가솔린이 없는점이 아쉬움. 그리고, 6기통 3.0엔진 옵션을 넣었어야.",1
764,쌍용 전자식8단변속기 써본적이 없서서 궁금한데 내리막길 내려갈때 1단이나 2단 저속 고정으로 엔진브레이크 사용할려면 어떻게 해야 되나요? bmw전자식 변속기는 D왼쪽에 저속기어가 있던데 렉스턴은 궁금하네요,1
765,탑승발판 완전 간지 좔좔~~  이군요. 옵션이겠죠?,1
766,다음 코란도 기대 해볼만한건가....,10
767,이번에 잘되서 숨통좀 열리면 코란도 라인업만  소비자가 원하는데로 복고풍으로 다시 가봅시다,1
768,쌍용 주주로서 너무 행복합니다ㅠㅠ,5
769,가솔린나오면 진짜 좋겠다,1
770,외관은 블랙이 이쁘고 실내는 화이트가 이쁘다👍,3
771,"차고가 조금만 낮으면 좋을듯,많이 판매되길 바랍니다.",1
772,장난아니네 멋지다...,1
773,많이 팔리면 현대차도 좋아할지도현대 미션에 모비스 전자 부품 그리고 만도까지빨리 하이브리드나 전기차등등 나와야할껀데,1
774,쌍용 진짜 칼을 갈고 내놨다...,25
775,쌍용 파이팅!!!😊🙆‍♂️🙆‍♂️,1
776,내가볼때 지금 쌍용이 현대를 롤모델로 따라가는 거 같다ㄷㄷ,2
777,지프나 렌드로버 디자이너 대려와서 뉴코란도 무쏘 감성 살려서 다시 팔아도 좋긴하겠지만 쌍용이 그럴돈이 없는듯,1
778,더 블랙에 장착되는 저 휠은 전 모델 최고급사양에 장착된 최고급 크롬휠인데...단지 색상만 다크 크롬으로 바뀌었을뿐...디자인은 그대로 나왔다는점...그리도 뒤 리어테일램프 디자인은 싼타페랑 너무 비슷합니다. 90%정도??그래도 이뿝니다!ㅎㅎ,1
779,대형 suv가 인기 있는 요즘 쌍용에게 기회가됐음하네 아직도 디자인은 약간 올드한듯,1
780,Suv의 강자쌍용응원합니다~~,37
781,코란도는 옛날 감성에 엘이디만 잘 넣으면 대박날텐데 왜 이상하게 갈까 ㅠㅠ,3
782,이번엔 쌍용차치곤 꽤 괜찮네,1
783,쌍용차를 살 이유가 있나요  20년전 꼬꼬마 시절에도 도대체 왜 쌍용차를 사지? 그런 느낌이 있었는데지금은 예전에 비해 쌍용차를 선택하지 않아야할 이유가 더 많아졌음 현대차 동급차량에 비해 최소 500만원 이하 싸지 않으면 살 이유가 없다고 봄,2
784,좋은 영상 고맙습니다,2
785,가난한자 재벌 모두가 탈 수 있는 자동차 쌍용 자동차 렉스턴! 화이팅!,2
786,이제 지프차 쫌 주세요 제발ㅠ 투박하면서 야성미 넘치는 차를 보고 싶어요ㅠ,15
787,이제 심장만 업글하면 펠리 모하비보다 많이 팔릴것같네요,2
788,렉스턴은 잘나왔네요 이제 코란도만 어떻게 하면 될듯,78
789,쌍용은 갤럭시와 엘지 v시리즈중 엘지의 포지션의 느낌이 강하게 드네요,1
790,풀옵이 5천이던데 모하비랑 가격이비슷한데 둘줏에 어떤게나은가요..? 근데 가격은비슷한데 등급이 둘다맞는건가요,1
791,시동걸고 예열후 p에서r이나d로 넣게되면 약간 진동이 느껴지는데 이거 변속충격인가요,1
792,잘돼서 오프로드용 suv 하나 개발해주셨으면..,1
793,쌍용도 하이브리드 좀 만들어야할꺼 같은데 ㅠㅠ,1
794,흉기가 하도 삽질을 많이 해서 반사적으로 다른 브랜드차에 관심을 가져 볼까 하는데 쌍용이 배에 모터달고 질주를 하고 있네요.잘 맹글었네!,9
795,쌍용차는 짐을 좀 실었을때 안정감이 있음,1
796,회사가 기사회생하려고 사활을 걸었네요~ 다시한번 가솔린 출시로 진수를 보여주세요~ 물들어올때 노 저어야하니까요...,1
797,레몬법관련해서  다뤄주실수 있을까요?셀토스엔진문제로 고생중인데 현기차는 나몰라라식으로 나오는데 분통이 터지네요ㅜ,1
798,렉스턴 보자마자 미치도록 이쁘다는 생각 밖에는 안드네요..ㄷㄷ,1
799,완전 개간지다 이번에 대받치겠지 제발 코란도도 쫌 바뀌어라 쌍용 제발 다시일어서길 바란다,1
800,코란도도 후측방충돌방지(정지) 기능이 있는데 렉스턴이 없다구요?,5
801,기아 디자인실장님이신 이강 상무님이 가시더니 확바뀌었네요,2
802,스즈키처럼 다양한 파츠 라인업이 잇엇음 좋겟네요,1
803,그래도 다른 리뷰어들 대비 쓴소리 많이 하셨네요유독 쌍용차만 만나면 정직함을 잃어버리는 리뷰어들이 많은데그렇게 지켜준다고 살아날 회사가 아닐뿐더러리뷰어님들한테 속아서 쌍용차 산 고객분들의 피해는누가 책임지나요?,1
804,변속기도 모하비랑 같아서 모하비에 가격부담있는 분들이 사시면 좋겠네요...차 예쁘네!,1
805,올뉴렉스턴에 차로중앙유지하는 기능이 있어요. 김한용님 설정을 못보신 것 같아요. ^.^,1
806,이건 블랙이 간지가 넘치네,6
807,현기는현존하는 대한민국 탑 어쩔수 없는 팩트 하지만 올뉴 렉스턴  방음비용 몇십만원 더 투자해서 뭐라도 현기보다 앞서가는  그런 기종이라도 됐으면 합니다 진심 대기업인 현기가  한손으로  하늘을 가리고 소수 대한민국 국민을 외면하는 행동을 하지 말아야지 ~~!!!!!,1
808,후측방 경보 뿐 아니라 정지도 지원 할겁니다. 코란도에서 전. 후방 정지 다 경험해 봤거든요. 드드드드득! 하면서 브레이크 잡아 줍니다. 윗급인 렉스턴에서 안될리가..^^;;;,10
809,엠블럼 바꾸면 어르신들이 외모만 보고 현대차로 혼동 할 지 모르겠단 생각이 드네요. 전작에 비해 외모는 멋져졌네요. 전자식 4륜이었다면 샀었을지도 모른다는 생각이 듭니다. 시승기 만드느라 고생하셨습니다. 감사합니다.,1
810,"렉스턴은 쌍용에서 완전고급SUV를 맡아줬으면 한다. 고급화로 4인승 or 6인승, 가솔린 하이브리드, 3.0D 등 제네시스를 위협할 정도로 만들어 줬으면...근데 자동차 채널들이 다 10시에 올리는 이유가 있나요??",3
811,차 좋으네요^^.,1
812,이상태로 무쏘도다시나오면 무조건산다,2
813,쌍용 흥해라~!,1
814,1:46에 진짜 현대차 같다ㄷ ㄷ ㄷ,6
815,르쌍쉐도 이제 잘됬으면...,2
816,"기어노브식이 무조건 좋고 버튼식은 무조건 나쁘다고 생각하시는건 행님이 나이가 많아서 그러신겁니다 ㅋㅋㅋ전 운전경력 20년이 좀 넘는 40대중반인대요.. 이제는 버튼식이 너무 좋와요.. 행님은 나이가 ...""늙어서"".. 기어노브가 좋은걸거에요 ㅎㅎㅎ ㅠㅠ죄송 친근한맘에... ㅋㅋ",1
817,엔딩끝나고 요트끌고가는 거 기대하고 있었는데ㅠㅠㅋㅋㅋㄱㅋㅋ,3
818,이번 렉스턴은 잘 나왔나보네요 6기통 좀 어떻게 안되나....,1
819,쌍용차좋아하는사람들 많구나. 취향존중,1
820,01:46 자연스러운거 보소 ㅎㅎㅎㅎ,12
821,전면은 높아서 거대해보이지만 옆면은 높아서 창이 작아 갑갑한것이 버스느낌,1
822,제발 힘좀내서 현기랑 경쟁은 못해도 견제는 해주세요,1
823,쌍용이 진짜 이 갈고 나왔구나 하는 게 보이네!!!,1
824,"파워팩 최적화를 위해서 엔진을 현대 스펙으로 맞췄구만...그릴도 옛날 헥사고날과 비슷하고,현대 변속기를 사주는 조건으로 디자인 및 기술지원 해줬다는 킹리적갓심 해봅니다...",1
825,부디 많이 팔려야 될 텐데,1
826,다좋은디 변속기 미스네 더팔수있는걸 현기 변속기가 옥의티네,4
827,체어맨에 쓰던 가솔린 엔진을 얹어야죠...디젤은 이제 손절할때입니다...,1
828,쌍용차가 미쳤나.. 갑자기 왜이러지..어얼..,4
829,네비가 살짝 아쉽네..현기는 이제 10.25인치로 계속 나오는데 ㅠㅠ,1
830,왠지 올뉴 무쏘 ... 대박차가 하나 나올거같은 느낌은 저만 받나요 ㅋㅋㅋ,2
831,후측방 작동시 제동보조도 작동합니다.....운전자의 브레이크 간섭시 작동 안하는걸로 알고 있어요.ㅎㅎㅎ,1
832,3.0 3.5가솔린 있으면 고민도 안하고 샀을듯,1
833,차가 이뻐서 봤는데4100만원 프레스티지 등급부터주행 중 안전사양이나 편의사양이 다들어가네요;;적어도 안전사양이나 주행중 편의사양은모든 판매등급에 다 넣어야되는거 아닌가싶은데요아니면 옵션으로 빼서 하위등급에서 선택이라도 할수있게 해줬어야 했는거아닌가 싶네요현대기아보다 더 심하네요;;혹시나 하고 줄섰다가패스합니다이건 뭐 무조건 최상위모델 사라는거나다름없는 가격 개실망하고 패스합니다,1
834,기어노브 bmw 따라했다고 욕먹을순 있어도 현기차 버튼식 다이얼식보다 몇배는 세련되고 좋아보임,8
835,G4에 체어맨w 5L엔진 넣는다는 루머는 없나요?,1
836,칭찬을 쥐어짜내서 하시네...ㅎㅎㅎ 칭찬 요손가 다른차에는 기본으로 있는것들,1
837,조금만더 디자인적인 측면에 몰두했다면 현 상황까지 않왔을거같은....,1
838,와이프가 오늘 집에와서 사진들이밀면서 이차뭐냐고 수입차인줄알았다고 멋지다네요,1
839,영웅님 쌍용 광고 이후 우리 동네 쌍용 많이 들어 왔어요 ㅎ,1
840,1:58현대가 떠오르는건 저도 그렇습니다ㅋㅋㅋ,9
841,버튼식 실제로 사용해보면 엄청 편해요.. 금방 익숙해지고 오작동 하기도 힘들고..일단 공간 확보도 용이하고 걸리적거리는게 없어지죠. 차 사기전에 걱정 엄청했는데 기우였습니다.,1
842,오! 사이드스탭이 익스플로러나 레인지로버에서 볼수있는 걸로 달려있군요.22:24 오토캐스트의 이다일 대표님 😁😁,2
843,10년 뒤에도 쌍용차가 살아있을까,1
844,스포티지도 헤드라이트 높아서 눈뽕 빡센데 저건 더 하겠네요....좀 밑으로 내리지 전조등은...,1
845,쌍용도 렉스턴 디자인으로 패밀리카를 만들면 괜찮겠는데..,1
846,드디어 쌍용에서 내 돈을 가져갈 준비가 됐군...   차는 이렇게 뽑는거야 이제알겠니 쌍용,33
847,"이미 현키에서 볼 수 있던, 같은 협력사 부품독창성 없는 디자인.차는 좋아보이고, 실내도 예쁘긴한데.. 시장을 선도하는 느낌은 전혀 없는거 같습니다.실내 너무 예쁜데, 부품하나하나 가만히 보면 현키의 협력사 것 구매한 게...이전에는 부족하고 허술하고 투박한 쌍용의 특징이 잘 보였는 데, 지금은 현기차 2중대 같은 느낌이에요 ㅠㅠ월등하게 좋아지고 예쁜 건 사실인데, 시장을 선도하기보다는 그냥 따라가는 모습이 안타깝기는 합니다.그냥 타협한 느낌.그걸보고 무분별하게 좋다는 댓글들.. 지금은 회사가 어려워서 물렁물렁하게 인기요소만 넣는 게 맞기는 하나나중에 좀 사정이 좋아지면, R&D에도 투자해서 좋은 오프로드 차 꼭 만들어주세요. 적당히 따라가는 회사 말고, 오피니언 리더가 되었으면 합니다.쌍용차 힘내시길....",2
848,"후측방경보 외 충돌 방지 긴급제동, 중앙차로 유지 보조 다 있습니다. 설정하면 됩니다. 지금 더블랙 탑니다.",46
849,코란도도 좀 저렇게 듬직한 인상으로 만들지 안타깝다,1
850,일단 디자이너 뽀나쓰 받고 시작하자~디자이너 의견 묵살하지 않은 임원은 칭찬스티커로 퉁치고... 이제까지 저질러 놓은게 있으니,1
851,기자님 영상 항상 잘 보고있습니다 혹시 g70 페이스 리프트 모델은 시승기 안올라오나요?,2
852,현대차 느낌이 당연히 나죠. 현대 디자인수석팀장님이 이직하셨다고합니다. 디자인팀이 외국인으로 다교체됐다고 하더라구요. 통코불케인가,5
853,와이프 결제에서 실패하였지만 많이 팔려서 쌍용이 부활했으면 좋겠습니다,1
854,아..g4렉스턴인데 바꾸고싶다 ㅠㅠ,9
855,이제 코란도만 제대로  나오면   쌍용은  현기  넘어 섭니다,1
856,코디는 누가 해주시는 건가요? 점점 세련되어 가는 것 같습니다.잘 봤습니다 ㅋ,2
857,이게suv지 요즘차들 디자인도이상하고 승용차랑 별 다르지 않아서 살마음도 안드는데 사고싶게 만든 디자인 이네요,1
858,"펠리세이드 랑 달리올 뉴 렉스턴은  온 로드 주행은조금 불리하다는데,  개인적으로 어떻게 생각하세요???넘 궁금 합니다.속 시원히 풀어 주세요...",2
859,후측방경보 뿐만아니라 긴급제동도하긴해요 ㅎ 코란도랑 같은 기능이라면 ㅎ 꺼억 소리나면서 브레키잡혀요 ㅎ,1
860,이건 무광블랙이 찢겠다ㄷㄷ,6
861,펠리랑 똑같이 출력을 맞춰놔도 부족하다하니ㅜㅜ뭘해도 까이는 차,2
862,10년뒤 나는또 이영상을 보게된다,1
863,흥해라 쌍용~~,1
864,르쌍쉐 분발 좀 해야 현기 견제하지,1
865,꼭살거예요우리영웅님차대박초대박날꺼예요완전대박나세요,1
866,와~~ 괜찮다.,5
867,여기서 잘나왔다는 사람들 갖고싶다는사람들 10명중에 1명이라도 사기를...,2
868,쌍용이 쌍용했다의 좋은 예: 렉스턴쌍용이 쌍용했다의 나쁜 예: 코란도티볼리: 고래싸움에 새우등 터짐,5
869,대장님 행복사 ㅎㅎㅎ,2
870,나는 렉스턴보다 한용이 형이 더 멋있는듯 (쌍용차 힘내세용),3
871,현대가 요새 발적화 해서 차를 만드니까 디자인 좋은 쌍용에 눈이 돌아가겠지 나도 이걸로 살까 하는데 ㅋㅋ,1
872,블랙이 제일 간지! 하지만 고르라면 저는 화이트!,1
873,현기차보다 쌍용차를 사고 싶은데 현재 쌍용회사 문제 너무 많아서.....어쩌죠 사고 싶은데ㅠㅠㅠ,2
874,이번에 디잔인 잘 뺐네요,4
875,결론 기자님 포함 댓글다신분들중 이차 안사는 사람이 다수일듯...,1
876,"실외,내 디자인이 확실히 좋아졌네요.좋은 영상 잘 봤습니다~",1
877,제발 이번 렉스턴 잘나간다고 티볼리 디자인 우려먹은거 처럼 렉스턴 디자인 우려먹지 마라... 현기는 페이스리프트 하기 바쁜데 쌍용은 왜 우려먹기 바쁜가... 이번 기회로 쌍용이 다시 살아나길,1
878,쌍용이 드디어 무쏘이후 해냈다,1
879,정말 다시 부활했으면 하네요 ㅠ,1
880,블랙이 진리네ㅋㅋㅋ,4
881,저가격이면 모하비나 펠리살듯..,1
882,난 그래도 펠리 블랙팩이 더이뻐보인다,1
883,흥해라 쌍용!,1
884,코란도를 중스턴으로 만들고체어맨을 잘뽑아서 하이브리드로 내노시요냉큼 내노시요,1
885,예쁘다ㅋㅋ껍데기자주바꾸는타회사보단낳죠~성능기능엔진을먼저신경쓰는쌍용!이번렉스턴최고네요~~^^,1
886,가솔린은 안 나오나요?ㅜ 디젤은 별로 안 끌림,4
887,렉스턴 vs 펠리세이드어떤 걸로 할까요..ㅜㅡㅜ,1
888,예전 쌍용 느낌 :  쌍용!!지금 쌍용 느낌 : 싸~앙~용~ ~ ~ ~ ~,6
889,어라운드 뷰하면.... PAS 가되다니... 코란도는 ㅜㅜ,1
890,차세대 렉스턴에서는 프레인구조를 개선해서 차고를 낮춘다면 훨씬 좋을 것 같네요.솔직히 지금은 높아도 너무 높아서 최신 흐름에 약간 뒤쳐지는 느낌이 있죠.,1
891,이분 잘모릅니다 근데 제가 시승한거랑 정말비슷하고요 2열 승차감 포기한다면 차 좋습니다,1
892,와 계기판 오지네 ㅋㅋㅋㅋ,1
893,쌍용차가 왜이래 ~~~ㅋㅋ쌍용 다시 부활하고 흥하려고 합니다 무소에서 렉2로 아주 잘터고 있는데 뉴올 렉스텐 대박나길 ..응원합니다 .,3
894,01:53 현대차가 떠오르는 이유 : 엑센트가 있으니까,4
895,그릴은 어쩔수없이 현기 따라가는군요,1
896,번호판을 그릴아래로 내린게 굿~,1
897,L5 270엔진을 부활시켰으면 합니다,1
898,남자 라면 기어는 무조건 말뚝이지~  오프로드 까지 달리니 최고 입니다,1
899,쌍용 대박나세요,1
900,차가 주인공 이었으면 하는 아쉬움이 있네요.카메라가 너무. 김한용씨만 비추는듯 합니다.구지 얼굴보다는 오디오만 나오고 자동차를 구석구석 보여주면 금상첨화일듯합니다.답답해서 보다가 나갑니다.,6
901,21:34초 마치 차주가 창문열고 뭐야 이놈? 할려고 하는거 같았음 ㅋㅋㅋ,1
902,G4 - 덕지덕지올뉴 -  군더더기 없는,1
903,차 간지쩐다;;;,1
904,12:50 여전히 A필러쪽 유리 우글우글하게 보이네,4
905,티볼리 대중소로 정떨어졌다가 이제야 보는데진작 이랬어야죠최악의 내수침체상황이지만 잘 버티고 일어서주세요,1
906,솔직히 레이서마냥 운전할거 아니면 요즘 국산차들이랑 독3사랑 별차이 안나요. 국산차 되게 잘 만듦,9
907,지바겐 닮은 코란도 가자,1
908,"차선중앙유지 관련해서 자막 수정안하시나요? 굉장히 기대하면서 봤는데, 차로중앙유지 안된다고 했다가 다른 분들 영상보니 잘되는데.. 뭐지?  굉장히 실망이네요.  설정도 안알아보고 가시나요?",4
909,아버지께서 쌍용본사직원이셔서 어릴적부터 쌍용이최고라고 주입식교육을받은 30대입니다.저또한 쌍용을 좋아하긴하나 이전까진 아쉬운점이있었다면 요번 렉스턴 정말혁신입니다,1
910,렉스턴 너무 잘나온것 같아요 쌍용자동차도 잘돼었으면 좋겠어요^_^,1
911,급하게 핸들조작시 전복위험성이 너무커요 80키로이상주행시 정말조심하세요,1
912,난 엔진 부밍음이 큰게 좋던데..,2
913,전면부디자인 현대스럽긴 함. 근데 이쁨. 뒤는 좀 바뀌었으면 좋았을 텐데 하는 아쉬움이. 실내는 조금 개선되었으나 촌스럼은 여전한 듯.,1
914,알림과동시에 시청~~^^,4
915,글쎄...  이쁜것도 세련된것도...,1
916,요약1:44 현대차 느낌?2:13 이전 렉스턴은 왜 그랬을까?2:39 쌍용차가 이런 감성이 있었나?4:19 이전 싼타페와 비슷한 느낌?4:34 진실의 손가락6:59 이렇게 까진 해줄필요 없는데11:26 촌스러운 크롬버튼13:25 물귀신 작전13:36 약간 울렁울렁14:29 무게중심이 높다14:46 출력이 아쉽다14:54 3.0디젤 어디갔나15:18 3.0이 없는게 너무 아쉽다15:30 3.0디젤 사와서라도 만들었어야15:34 3.0디젤이 없는게 아쉽다15:42 냄새가 난다16:14 LKAS 왜 작동안돼?16:31 현대차는 두가지로 구분한다17:20 엔진사운드가 굉장히 많이 들어와요17:37 엔진사운드 막아내지않은건 이해힘듬18:47 IT부분을 쌍용은 처리할 생각이 없는거같다19:16 멈추는 기능이 없다20:57 최신플랫폼이 아니라는거21:14 렉스턴으로 이게 끌려와?22:08 올드한 플랫폼,2
917,코란도 전면부는 렉스턴처럼 페리하고 후면 테일램프는 아날로그 식으로 큼지막하게 하면 인기많을꺼 같은데 ㅋ 뉴코란도를 연비생각하고 삿나.. 마니아층이 형성되어 있었잖아..,1
918,스포츠나 칸은 페이스리프트 언제해줄까요 ㅜ,1
919,2.2디젤 겨울철 시동이 힘들게 걸리는거 진동 생각보다 심하다는거 핸들 컬럼 이상한 소음은 잡았으려나....핸들열선은 위아래가 따뜻하고 손잡이쪽은 덜 따뜻하고...,1
920,잘 나왔다 ㅇㅇ,10
921,주간등은 제네시스앞그릴은 싼타페,1
922,21:35 ㅋㅋㅋㅋㅋ,36
923,쌍용 전에 디자인은 정말......어쨌든 정신차려서 다행이다.디자인 인재는 비싼  돈 들여서라도  써야됨.,1
924,1:00 오오오오~~마치 미국 FBI 대기 장소 같네요ㅋㅋㅋㅋㅋ13:54 ㅗㅜㅑ (쌍용 로고만 빼면ㅎㅎㅎ),5
925,옛날 무쏘랑 비슷한 느낌이 나는것 같다. 누가 옆에 물결 스티커 붙여 봤으면,1
926,이건 꼭 공부 평소에 안해서 반에서 꼴찌하던애가 공부좀 하나까 상위권으로 가서 시험지 받아온 느낌이다. 하니까 되잖아 오구오구 이런 기분 ㄷㄷㄷㄷ,5
927,차는 머니머니해도 디자인부터 소비자를 잡아야 성공한다 앞으로 잘하자 쌍용,1
928,현기차 문제가많아서 쌍용차에 기대를 많이하는듯요,5
929,"어 여기 돌아나온곳이 무의도 '오늘,커피'인가 거기 카페집이네요???? 여기서 쭉 가면 짬뽕순두부집 맛있는데 있는데 ㅋㅋㅋㅋ",1
930,무쏘 부활 가자 ㄱㄱ,1
931,모카 시청이 참 편해요,1
