,comments,likes
0,"솔직히 포르쉐는 속도로 타는 차는 아니라 생각해요. 저는 아직 미성년자임에도 불구하고 주위에 718 타시는 친척이 계셔서 가끔 같이 탈때가 있는데, 배기음이나 부드러움, 무엇보다 감성이 미친거 같네요. 뭔가 전문적인 리뷰 잘봤습니다!",8
1,차분하게 설명해주셔서 귀에 더 잘들어오는 것 같아요 리뷰 잘봤습니다~~자주 리뷰해주셨으면 좋겠네요ㅎㅎ,14
2,진짜 뒷바퀴 광폭 타이어 듬직한거 봐라...,3
3,마칸 오너 입니다. Hard surface 도면 에서는 거의 80%이상 토크가 뒷축에 보내집니다. 아우디 Q5 같은 콰트로같은 경우는 반대라고 해야죠. PDK 기어 세팅이 저속에 몰려있는거 같아요. 실제로 제로백이 6초 초반으로 나옵니다.,9
4,깔끔한 리뷰 잘 봤습니다^^ 포르쉐는 포르쉐!ㅎㅎ,8
5,모터리언은 항상 옳습니다~~~감사합니다 좋은영상~~~건강 관리 잘하세요~세분다~~~,12
6,아이러니 하게도 마칸이 카이엔보다도 보기가 흔치않아서 그런지 포르쉐 라인업중에 저렴하다지만 생각보다 많이 보이지 않는단 말이죵.그래도 간혹가다가 보이기는 해여.😄😄,13
7,너무 잘봤습니다. 차분하게 알아듣기 쉽게 리뷰해주시네요.리뷰장소로 와인딩 떠나보고 싶습니다.혹시 알려주실수 있을까요?,9
8,영상 깔끔 합니다 박기자님도^^,7
9,스포츠플러스로 변경할시 엔진오일 온도는 몇도가 적당한가요?,4
10,잘 보았습니다.여러 면을 보았을때같은 엔진급의 벤츠e 클래스 트림 비교하면어떤게 나을까요?,2
11,제가 suv를 좋아하지만 큰차는 싫어하는데 큰개을 두마리 키우거든요. 개털 에디션 티구안을 타다가 지금은 개털에디션 이보크를 타는데 다음차는 꼭 마칸으로 가고 싶습니다. 리뷰 전체가 그냥 저를 위한 차네요. 하지만 돈이 없을듯.,9
12,유럽차는 성능 보단 비싼 맛(?)에 타는 거 같아요.  어느 정도 성능 있는 차는 기본 큰거 한장은 넘게 줘야 하니.,4
13,마칸갬성과 x6디자인 둘중 뭘골라야하는지 고민되네요,3
14,가장 저렴한 모델이라고 해도 ...차선 중앙 유지 기능이 없다는건 좀 그렇네요 ....포터에도 HDA 들어가는 시대인데 ...,4
15,옵션을 최소로 넣을땐 얼마나 들까요,3
16,"5:30 음...? 마칸은 아우디의 DL501을 그대로 가져다 씁니다. 클러치팩이 좀 다르고, 7단에서 코스팅 주행이 가능하도록 살짝 개조됐지만, 하드웨어는 DL501이랑 거의 똑같이 생겼어요. 이걸 포르쉐만의 PDK라고 부르기는 너무 부족한 것 같은데요. 물론 미션 제어는 포르쉐만의 방법으로 제어하는지라, 같은 미션 올라간 아우디랑 비교하면 마칸의 그것이 훨씬 완성도가 높습니다만..그렇다고 하더라도 포르쉐만의 PDK라고 하긴 어렵죠. 그런 식이면 마칸 엔진도 포르쉐만의 4기통 엔진이라고 할 수 있는거 아닌가요?마칸 전기형은 기본 구동비가 15:85입니다. 이건 어드바이저랑 이야기하면서 확인한 부분이구요.이게 2:8이나 3:7으로 바뀐 이유가 무엇일까요?",2
17,여기가 길이 어디죠?? 한번 달려보고 싶네요...,3
18,가장 싸다지만 현실은 옵션 넣으면 마칸도 1억대...,2
19,가격을 떠나 포르쉐는 포르쉐다,7
20,7천대? 우와 갖고싶다~ 하다가 옵션넣고 1억 넘는다는 말씀에 좌절ㅠ,11
21,제일 애매한모델..,2
22,"사실 이가격대에 너무많은 suv살수있음..레인지로버 벨라,x5 x6 gle q8 많은데 포르쉐라는 네임벨류..사실 동급대비 옵션이 너무 약함 전자식 기어봉도아니구 엠비언트도 약하고..ㅜㅜ",2
23,귀한 영상이네요 ㅎㅎ 감사해요,9
24,그리고 리뷰 잘봤습니다~~,2
25,현재 시대에 제로백 6.5초면 그냥 평범한 수치 같아요;;,2
26,22:47 재떨이 저거도 옵션이에요 원래는 그냥 수납공간 ㅋㅋㅋ,9
27,이게 그 싸지만 비싼차네요,33
28,"15분에서 20분사이로 더 높은 텐션으로 힘있고 좀 더 빠르게 진행해주셨으면 좋겠습니다. 너무 힘이 빠집니다. 포르쉐 리뷰 보러왔는데 현대차 느낌이 나네요. 포르쉐 보는 사람이 자율주행에 관심이 가질 않겠죠. 필요없거나 그 차 성격에 반 하는것들은 과감히 떼어내시고 장점, 단점 부각 해주세요. 오디오가 비는것같으면 편집으로 타이트하게 잘라내서 군더더기 없게 해주세요. 역동적인 장면이나 드롱샷은 촬영비용이 많이 들겠죠. 하지만 그건 포르쉐 광고영상에서 볼게요. 그런걸 바라는게 아닙니다. 20여분까지 보다가 그냥 댓글로 마무리합니다.",1
29,죄송한데 이거 전반부 촬영한 장소가 어디인지 알수 있는지요..? 드라이브 가보고 싶네요..,27
30,전교 꼴등이기는 한데.... 학교가 서울대네요ㅎ 가장 느린 제로백 6.5초!!!!!,143
31,잘 보겠습니다. 주말 잘 보내세요 ^^,3
32,인테리어 개편이 필요,7
33,사지말라는 제목 ㅋㅋ 잘볼게요 인트로 길 예쁘네요,9
34,잘보고 있습니다,5
35,와인딩 하신 산길이 어디인지 좀 알려주세요,3
36,휠발란스 보세요~ 휠이 미친듯이 ㅋㅋㅋ,1
37,와우,7
38,오....근데포르쉐카이맨 이랑포르쉐마칸 이랑 너무고민돼서요...뭐가더 낳나요?.......,2
39,"10:40 표지판 보니 동쪽 어드메인 것 같은데, 대관령 옛길일까요?",3
40,포르쉐마크떼면....ㅋㅋ,4
41,가격은?,1
42,영상 처음에 나오는 음악 제목좀 알려주세요~~~~,3
43,가장싸고 느린데 왜 suv가 제로백이 6.5초임?ㅋ,7
44,아직 이정도차급 리뷰는 ㆍㆍㆍ,2
45,2.0을 1억천  카이엔이 훨 낫게네요,3
46,어떻게 뒤태가 한번이 안나오냐 ㅋㅋㅋㅋㅋㅋㅋ,1
47,20 인치 마칸 터보 윌,3
48,혹시 인트로 노래 아시는분 ???,1
49,처음에 나오는 브금 노래아시는분,1
50,애플카 플레이가 50 옵션;;;;;;;; ㅁㅊ ㅋ,12
51,그런데 무스테스트 결과는 그다지,2
52,동영상이 오토뷰랑 똑같네소개 순서도 그렇고,1
53,PDK텍갈이 한 DSG,1
54,마칸이 싸고  느리냐😠😠,1
55,김송은기자 어디갔어!!!!!!!!!!!!!!!,5
56,2천9백~3천중반하는 벨로스터N보다 약간 떨어지거나 비슷한 마력과 성능 + 벨로스터보다 7천만원이상 더 비싼 차. 간단히 설명하면 그렇죠.  이상하게 한국 카튜버들은 외제차에겐 잣대가 그렇게 너그러운지 모르겠네요. 굳이 사대주의 + 자존감을 애기안해도 디자인 평가 승차감 소음 단차 가격 가성비 등엔 말도 못함.에휴,5
57,"가장 싸다?"" 가장 저렴한""이 아닌가요? 싸다란말은 구어체이지,문어체는 아니지않나요..",1
58,디자인만보면 진짜 gv80이 갑이네,2
59,차주입니다. 제가 타면서 평소에 좋다고 느꼈지만 제대로 설명하지 못했던 부분들을 구체적이고 선명하게 잘 표현해주셨네요~ 영상도 너무 이쁘구요~ 새해 시작부터 큰 선물 받은 느낌입니다~ 감사합니다~^^,433
60,Gv70사려고 탑승해봤는데 인테리어나 의자 운전자 신체에 맞게 자동셋팅되고 이런거는 진짜 좋던데.,10
61,Gv70차주 입니다마칸이랑  폴쉐랑  비교 하면  안됩니다넘사벽이니까요  다만70 을  조칸이라고 하는건 그만큼 잘만들어졌다는  뜻이지  마칸이란 비비겠다는 의미는  아니지 싶네요현대도  발전해서  포르쉐처럼  좋은 브랜드가 되길  바라고  마칸과 비교할건  아니지만70 이도  상품성 꽤나 좋은 차입니다만족하며  타고 있네요,36
62,"마칸이 2,900cc 로 380 마력 53Kg 토크를 생성해내는데, GV70 은 3,500cc 배기량이어야 동등한 출력을 발휘한다는 점만봐도 마칸에 비해 기술적으로 비효율 엔진이란걸 알 수 있겠네요.",9
63,예전에 인피니티 qx50을 마칸과 비교해서 저렴하고 반값에 살수있다고 말해서 시승한 기억이 나네요.. 차는 급이 있다는걸 뼈저리게 느꼈죠.. 바로 계약하려고 갔는데 한번타보고 저렴한 승차감에 놀랐습니다.. 미션이 cvt.. 마티즈 미션이 들어있는거 같은 느낌.. 그래도 gv70은 그정도는 아니고 괜찮은데 마칸과는 견줄차가 아니다는거죠.. 2.5 엔진에 적당한 옵션을 선택한다면 괜찬을듯,5
64,비교할껀 아니지만 저도...g70시승 갔다가 그날 530 시승하고 bm 샀는데요...수치제원이 중요한게 아니라 현대가 아쉬운게 직결감이 떨어지는거 같긴 합니다.,17
65,물론 성능도 차이나지만 그만큼 가격도 두배 가까이 차이 나기 때문에 능력껏 사면 될거같아요ㅎㅎ,4
66,"사실 마칸의 미션은 아우디의 DSG를 그대로 쓰는거에요. 하드웨어가 똑같이 생겼어요. 마치 하체리뷰에서 봤던 앞/뒤 서스 모양처럼요.심지어 아우디는 요새 DL382 신형 미션을 쓰는데 마칸의 저건 DL501.. 구형 미션이에요.근데.. 제가 DL501달린 차를 사고, 마칸을 기추하고, 다시 DL501을 DL382달린 차로 기변하고..하면서 느끼는건데...무엇을 쓰냐가 중요한게 아니더라고요.어떻게 쓰냐가 훠워워워월씬 더 중요한 거더라고요.아우디랑 완성도가 차원이 다르더라고요. PDK가 맞는 것 같습니다.",5
67,마력이 어쩌고 가성비가 어쩌고현기랑 비교해도..디자인은 무조건갑이고..마력 제로백은 둘째치고감성은 갑입니다..누구도 인정하실듯..,8
68,"카레라 s 카브리올레마력 458ps, 제로백 3.9s, 최고속 306km/h근데 실제로 일반인이 어떠한 상황에서도, 아무리 막 밟아도 측정기로 제로백 3.3s 나옵니다. 약간 오르막도 3.7s 나오더라고요.최고속은 321까지 나오고요.뭔지는 모르겠지만 뉴트리아 m3랑 카레라s랑 밟아보면 카레라s가 훨씬 빠르게 느껴집니다. 마력도 458이 아니라 558ps 같은 느낌.",2
69,MPI/GDI혼합엔진과  유압자동미션을 사용하는 GV70  과  GDI only 에 DCT 미션을 사용하는  마칸.    거꾸로 되었으면  기술이 앞서고 고급 엔진과 미션 사양을 적용한  마칸이라고 칭찬했을 듯.   그냥 포르쉐 마크가 좋다고 하는게  이해하기 좋을듯.,3
70,애초에 gv70 마칸 구매층이 다르죠구매층 타겟 부분에서 하나도 겹치는 부분이 없는차라 비교는 예능이죠 ㅎㅎ,6
71,"차 가격도 넘사벽이죠... ^^GV70은 5,500 정도에 구매하는게가성비 탑 일것 같습니다.",9
72,"양사의 기술력 차이도 있겠지만, 더 중요한 부분은 지향점이 너무 다르다는 겁니다. 그걸 가지고 비교하면서 넘사라고 하는 게 웃긴 거에요. 진짜 넘사라는 평가를 하시려거든 gv70의 N버전이 나오고 나서 해도 늦지 않습니다. 그게 제대로 된 공평한 비교이니까요.",5
73,"구형 gts오너인데 현존하는 컴팩트suv중에 마칸이랑 비빌수있는 차량은 없어요... x3m,4m glc63도 못 덤비는데 gv70?? 흠... 조금 오바해서 이게 suv가 맞나? 싶을정도로 고성능급 스포츠세단이랑 비교해도 될만큼 운동성능 좋은데...",8
74,차 디자인도 이쁜데 색도 진짜 이쁩니다 ㅠㅠ 박지영 아나운서하고 잘 어울릴거 같아요 흙,8
75,영상을 보고나니 gv70이 더 좋아(가성비) 보이네요ㅋㅋ,34
76,성로님 리뷰 좋아요~ 마칸 뽐뿌겁나 오네요 주식대박나서 사고싶음,4
77,같은급 같은출력 이면 조선의 마칸은 맞음.단지 노하우 셋팅.등 기술력과 가격차이에 따른 부품퀄리티가 다를뿐,3
78,마칸 너무 매력적인것 같습니다.x7타고 있는데포르쉐로 넘어가고 싶네요!  여러 조건을 따지면 파나메라 가고싶은데 아직 넘사벽이네요,4
79,이참에 까만형까지 소환해서 서킷가즈아!! 두차종 서킷 비교 영상 갑시다!,1
80,"비교할 땐 gv80은 풀옵가격, 마칸은 스타팅 가격",85
81,GV70 대단하네 7천만원이상 차이를 생각하면 이정도 비교되어도 나쁘지않다ㅋㅋ,32
82,Pdcc가 들어가면 그만큼 무거워지니 안들어가고 가벼운거나 무거워지고 출력 높아지나 또이또이라서 안들어간게 아닐까하는 생각을 조심히 해봅니다,3
83,gv70 존나 가지고싶다 ㄹㅇ..,8
84,가격차이는 늘 대체적으로 정직하고 현기는 아직 독일차를 따라잡기엔 해보지 않은 아니 못해본 영역이 너무 많음.,2
85,미션의 한계일수도 있고 그 차를  그 회사에서 목표로 하는 타겟층과 선호하는 차의 운전성을 맞혀서 세팅 했을수도 있죠 그걸 한계다라고만 할게 아니죠,1
86,Gv70풀옵션 다 때려넣어봤자 아무도 사지않는 마칸 기본형 살수있겠네요.,173
87,"마칸 2.0과 카이엔하브 탑니다.GV70과의 비교를 떠나서 마칸 기본은 마칸아니라는건 좀^^;마칸 2.0이 마칸중에서는 가볍고 밸런스가 가장 좋아 폭발적인 가속감이 부족한것 빼고는 아주 좋습니다. 같은 PDK. 도심에서는 아주 재미있게 탈수 있습니다 (카이엔노멀과 체감가속 비슷합니다) GTS는 고속도로에서도 재미있겠죠^^개인적으로는 카이엔노멀 시승했다가 2.0마칸과 체감가속차 없어서 하브로 출고했네요. 마칸이 체감가속력이 좋아요. 그리고 이번 카이엔 하브 제대로 물건이구요. 차한대값으로 고마력SUV, 전기차 1+1입니다~덧붙여 마칸 2.0도 최하급옵으로 출고시 9천, 최상급은 1.2억정도. 보통은 9천중반~1억선정도에서 출고합니다.",20
88,가격도 넘사벽이긴함 ㅋ 그냥 좋은건 비싸고 덜비싼건 덜좋은게 자본주의,360
89,외계인을 납치해 만든 미션과 운동성능은 비교불가죠 ㅋㅋㅋ 포르쉐 마력은 엔진마력이아닌 휠마력같은 가속능력을 보여주죠,3
90,약간의 희망사항과 기대가 섞여있는거죠 진심 마칸과 비교하려는건 아닐거에요,33
91,사고싶돠..견적돌리니 1.3억 나오던데ㅎㄷㄷ,2
92,에어서스가 좋기는한데 교환할때 가격이일반 월급쟁이들한테는 무리가있죠,2
93,718박스터s를 7주일 운전해본결과 출력이 다가 아님을 저는 잘 알고 있죠극히 공감됩니다,3
94,PDK by DSG...ZF 께 아니라는게 아쉽...마칸 와이프한테 꼭선물하고 싶은차 1순위,2
95,포르쉐 좋지요 정말 좋아요 저도 드림카가 911 현실은 GV70 3.5 풀옵... 현실은 일정 소화하는데는 역시.... 국산최고 지금까지 만족해요... 만3천타는데 별탈없음,2
96,비엠 포르쉐 현대(현대만)좋아하는 사람으로써 그래도 마칸과gv70비교는 안맞는다고봐요 X3나 glc쿱 q3 링컨 정도가.. 맨 누구경쟁상대네 하면서 제대로 이긴적도없는 쓰레시스,3
97,"GV70을 타보지 않아서 마칸과의 차이에 대해 논할수는 없지만, 마칸을 타본 느낌은 1억이나 주고 살만큼 가치가 있다고는 전혀 생각이 들지않음",16
98,한심하네요 비교 대상이 아니 두 차종을 놓고 비교 한다는 것이 ㅜㅜ,5
99,0:47 와 마칸이 좋은거라고 서서히 상승하네 가끔씩 놀라는거지만 모트라인영상미 쩜,60
100,gv70 구매자들은 마칸이랑 비교 안하고 마칸 구매자들도 gv70이랑 비교 안함.,14
101,가격차이보니 비교대상이 아니네. 우리가 쏘나타랑 e클래스랑 크기가 비슷하다고 비교대상이라고 하진 않죠.,6
102,가칭 GV70 n 나오면  DCT 넣고. 엔진스포츠튠 조금 들어가면. 벨로스터n에서 느낀  그 느낌 나겠네요.,2
103,마칸 GTS 랑 테슬라 X 중 어느걸 선택하는게 좋을까요? 너무 다르긴 하지만..,1
104,마칸 살사람은 마칸이랑 카이엔이랑 고민을 더 많이하죠ㅎㅎ마칸 gts랑 가격이 거의 비슷하니까...좀더 밟는거 좋아하면 마칸으로가정을 꾸린사람은 카이엔으로,2
105,이렇게 제네시스랑 포르쉐랑 같이 이야기하는 것 자체가 현대에겐 개이득현까들에겐 지옥,1
106,와  죽이네요 문제있는차보다 돈좀더 있다면 마칸구매하고싶네요,2
107,와....말 또박또박 잘하네...음량을 적게틀어도 귀에 쏙쏙 박힙니다...칭찬입니다..,15
108,가격도 가격인데... gv70하고 비교하면 마칸 gts말고 그냥 마칸으로. 해줘야되는거 아닐까?... 가장갭이 적은걸로 비교해주야지,1
109,gv70 3.5 겁나 잘나감.. 마칸2.0도 보았지만.. 그거보다는 한표줄수있을듯,2
110,GV70가 Acura RDX보다 좋다면 그것만으로도 성공인듯.,1
111,차량가격은 그리부담되지않는데 수리비가  부담되는...,2
112,아무튼 둘다타보고싶다^^.....,1
113,디자인은 g70이 취향저격이네,1
114,성로형님 질문 있습니다마칸 차는 아니지만소렌토2.5터보 보고있는데순정타이어가 너무 쓰레기던데2륜에 타이어를 바꾸는게 좋은가요그냥4륜을 선택하는게 좋은가요?,1
115,GV70이  6천만원대에선 좋지만1억2천의 마칸과는  비교가 안된다,1
116,마칸이 7500짜리가 어디있어..노말 베이스 모델도 기본옵 최소 9천부터 시작이고옵션좀 넣는다하면 1억~1억1~2천인데옵션값은 노말이 GTS보다 훨씬 비쌉니다 그래서 GTS가 가성비라는 소리가 나올정도인데 ㅋㅋㅋ,3
117,오늘 다시 한 번 알고 갑니다.성로님 에어서스펜션 성애자.ㅋㅋㅋㅋㅋ,4
118,Gv70과 x3 glc q3 등등 비교 가능한가요? 프로모션 받으면 실구매가 비슷한거로 알고있는데.,1
119,모트라인의 타이칸 리뷰도 꼭 보고싶네요.,1
120,"마칸은 완~전 넘사벽인데~gv70과 비교당하는(?)이유는...gv70이 솔직히 좀 비싸다고 느껴서겠죠?...당연히 마칸 기본이 7천 중반이고 옵션 넣으면 1억 가까이 하는 차이기는하지만...""넘!사!벽!""인데 2~3000 밖에(?) 차이가 나지않는다(?)는거겠죠...?^^;;ㅎ",3
121,아직 현차가 갈길은 멀다고 봅니다..ㅠ포르쉐 벤츠 비엠 아이디 폭바 렉서스 토요타등~~ 더 분발하기를..ㅠㅠ,3
122,마칸은 진짜 포르쉐가 요리조리 치이고 치여서 낳은     괴물인듯,3
123,근데 디자인은 gv70도 만만치 않음. 마칸이 더 작아보이는 거 같기도 하고,1
124,"""조선의 마칸이다"" 라고 하는건 표현을 빌린거지 설마 진짜 마칸과 견줄수있다고는 생각안할거에요 ㅋㅋ",42
125,마칸은 검은색이 너무이뻐 했는데 빨강도 미친듯한 아름다움이넹,2
126,이거 보고 gv70 나왔다 와~ 하던 게 엊그제 같은데 왜 벌써 1년이...???,1
127,RPM 올라가는게 저울인줄. 지렸...,3
128,"두차를 비교 하는건 아니죠 ... 컨셉이 다른데,세상에 나쁜차는 없다 ...제네시스 스포츠가 나오면 뭐 상품비교는 해볼수 있을까?",2
129,ㅋㅋㅋㅋㅋ무채색만 있는 도로에서 빨강이가 있으니까 너무 멋있네,14
130,깡통 마칸은 마칸이 아니라는 말이 와닿네요.,9
131,마칸 색상 이쁘네요^^70화이트 스포츠 패키지 계약자인데빨간색 넣고 싶네요,5
132,gv70은 인피니티 fx37이랑 비교해도 최신옵제외하고 더나은점도 없을듯,1
133,아니 형님 마칸이랑은 돈차이가 너무 나지 않습니까 ㅠㅠ,1
134,제목 보면 볼수록 미쳤다 ㅋㅋㅋㅋㅋㅋㅋ,14
135,믿고 보는 모트라인~~,1
136,gv70가격 까려고 검색해서나오는 가격보고 마칸이랑 가격이똑같네 이러는거보고 얼마나웃기던지 매장가서 견적도안받아본사람들이  ㅋㅋㅋㅋㅋ,1
137,아무리 그래도GV70하고 마칸하고  ㅋㅋ넘사벽이란말이  딱 이네용,1
138,차 사이즈만 비슷하지 그외에는 동일 선상에 놓을수 차구만...조선의 마칸이란 말 자체의 어감도 마칸하고 쪼금 비벼 볼수 있다지  마칸급이다가 아니었죠이건 괜히 가만히 있는 g70 엿먹이는 것같은데요,4
139,그쵸... 이게 마칸이죠...GV70 은 맛간(맛이간)이죠...,17
140,벤츠와 BMW 조차도포르쉐에게는 안됩니다.브랜드 레벨시장에서 소비자가 수용하는 가격등그럼 포르쉐도 페라리와 람보르기니그리고 부가티에게는 같은 처지,2
141,사실 gv70만 해도 개 좋은 차임. 인터넷에 너도나도.  독일차얘기 하니 만만하게 보일뿐 .  실제 타보고 운전해보고 견적 내보면.   만만하게 볼 차가 아님.,7
142,전 스포츠 크로노도 없고 PTV도 없는 디젤 사서 잘 타고 다녔는데 ㅜㅜ,2
143,애초에 제네시스 경쟁상대가 독3사랑 렉서스에 대항하기위해 만들어진건데 벌써 포르쉐랑 비교는 너무 이르지,1
144,마칸GTS 가 아닌 그냥 마칸 타는 애들은 패션카와 브랜드 좋아 타는 사람들인걸로.. ㅎㅎ,3
145,포르쉐는  달라  타보면 알아 미션체결감  미쳤는데,1
146,"마칸은, 아니 뭐 포르쉐는, 차 가격보다도 유지비가 도저히 감당이 안됨. 오일필터 하나도 포르쉐에서 나온걸 써야 하는데, 가격들으면 기가막힘. 미국에서 의사하는 동생이 마칸을 일년반 정도 몰다가 유지비 열받아서 처분하고, 지금은 테슬라타고 있음.",3
147,현대 기아는 좀 좋은차 나오면 독일차랑 경쟁하고 비교하는데 정작 독일 브랜드들은 한국차를 경쟁 대상으로 생각 안하는듯,1
148,레드 마칸 절라 갖고싶다 아흐~~넘사벽 디자인,1
149,성로형 잘한다~ 설명 조쿠요오~~~~ㅎㅎ,2
150,20년넘은 포르쉐도 gv70보단 반응이고 직결감 좋음,1
151,가격이  비교대상 차량은 아닌데..,172
152,돌려깎이 장인...성로포스트,19
153,"영상정말 잘봤습니다관심없던차인데 관심가도록 잘찍어주셨네요혹시 마지막에 bgm  가수와 노래제목 알수있을까요,,?아시는분 알려주세요 ㅜㅜ",1
154,역시는역시지!!!포르쉐는단점이없다...단점이있어서도안된다!!!^^포르쉐는!!!^^,2
155,70은 304마력이고 마칸 가격이 넘사벽이구만~,3
156,마칸 관심차종인데 리뷰 감사합니다.,1
157,좋은정보입니다 이건 👍,2
158,"자기만의 감성을 존중해서 비산 가격임에도 산다고 하면서 왜 절반 가격 차랑을 비교하는 건지.. 능력이 안되는데 비교 할만큼 나왔다면 오히려 없던 관심도 생기네요. 그리고 유럽 인건비 및 제조기업 제작비용, 물류비용 감안하면 그들이 느끼는 1억이랑 우리 1억은 다름니다. 기술자에 대한 처우나 공임 대가도 분위기가 달라서 유럽에서 간단한 시공 정비 비용이 만만치 않다고 생각하면 단순 고가이니 더 우수한 성능일거라는건 아닌 것이고 차주의 성향을 고려해야 하지 않을까 생각됩니다.",1
159,조선의 마칸.. 비교가 되야지 뭐 그런가 생각이라도 해보겠는데 이건 뭐... 할말이 없어서...  ㅋㅋ 근데 그걸 또 리뷰해서 요목조목 차이점을 설명해주시는 윤대표님 친절도 하셔라 :-) 리뷰 잘 봤습니다~,1
160,2분전은 못참지잘볼게 햄톨형!,1
161,흠... CV70이와 80이 세단 두대 살 수있는 가격이네 ㅋㅋㅋ 고민된당.,1
162,70도 완전좋은찬데 마칸은 더좋은차죠,1
163,구독박아야겠다 내 기준 영상 10개 찐으로 잘 보고 가면 구독박는데 이건 못참지,2
164,일반 마칸도 아니고 GTS네 다를 수 밖에 ㅎㅎ,1
165,Ppl 너무 자연스러워요 드라마 뺨침ㅋㅋㅋㅋㅋ,2
166,마칸하고 비교는 할수 없는데 가격차이가 너무 나니까 지브이70 가성비갑이네요 실내 고급감은 지브이70도 나뿌지않으니,5
167,그포스트 썸네일과 제목은 과학이다...,93
168,ㅋㅋㅋㅋㅋㅋ 조선의마칸 미친건가...ㅋㅋㅋㅋㅋ 겁나 웃었네요,1
169,둘다 이쁘고 좋음 ㅠㅠㅠ,1
170,2.5 스마트스트림 엔진 2.5 터보도 결함에 포함되는가 아님?,5
171,그냥... 현대하고 포르쉐랑 비교한다는 것 자체가 말이 안되는 거 같은데...,1
172,마칸 베이스 타면서 포니 감성 느끼고 걍 타고다닙니다 마칸 아니라고 하니까...,1
173,마칸gts는 넘사...마칸 노멀 >>>> gv70...비교하지마세요 제발마칸 계속 의문의 패배 중......,2
174,타보기전에는 절대 알수가 없지무조건 마칸이 좋죠..만약에 제네시스에 마칸 동력전달 느낌이 느껴진다면무조건 제네시스 사죠 ㅋㅋ 훨싸고 as좋고 옵션좋으니까,7
175,아 자려고했는데 이시간에 업로드라니 이것만 보고자야지 ㅎ,1
176,마칸급 마출려면 가격이 동급일거임 수리비만 국내라서 좀 싸겠지,1
177,"인싸케이:""세금까지 반올림해서 8000이니 이돈이면 마칸산다""ㅋㅋㅋ앞뒤없이 현까는 과학",31
178,13:10 띵언; 제발 기본스탠다드하고 70풀옵하고 비교하지마세요ㅋㅋㅋㅋ 그렇게 비교하면서 마칸산다할꺼면 기본스탠다드 사던가,1
179,"마칸 페리전 기준이긴 하다만 돈값한다고 생각합니다 물론 순정내비, 인포 ㅂㅅ이긴 하지만 돈값은 충분히 한다고 생각합니다",1
180,형 요즘 재미들었나봐ㅎㅎㅎ 그 포스트 따라지마ㅋㅋㅋㅋㅋ,20
