,comments,likes
1085,사랑해요 막내피디❤️,1
1086,뒷태가LF쏘나타랑 넘 닮았네ㅎㅎ독일차도 국산차랑 가격이 비슷해지는 날이 오겠네,1
1087,흉기차 노조가 만들어낸 기적 ㅋㅋㅋㅋㅋ,8
1088,오늘 신세계에서 점심 맛있게 먹고 있으시더라구요 ㅎㅎ 지나가면서 봤습니다,1
1089,흉기자동차 가격 거품이 얼마나 심한지 보여주는 영상,20
1090,"편집은NF쏘나타로 나오는데, 발음은 LF쏘나타네요.. 테일램프 형상봐서 LF가 맞는듯 하네요",7
1091,고급브랜드의 저가모델이냐저가브랜드의 고급모델이냐이게 엄청난 딜레마지,14
1092,100년 전통의 차와 결함엔진 현기차랑 비교하는게 코미디지..,1
1093,연비는 현기가 폭스바겐 못따라감,1
1094,차만 비싸다 하지말고 요즘 풀타임 알바해도 200이상받는 시대아닌가,1
1095,9:08  개인적으론 NF소나타보다는 초기형 K7 같은 느낌,9
1096,제타 사전 계약 구매한 대부분 오너분들 옵션 내용에 대한 불만이 엄청 많습니다.말그대로 깡통을 국내 아반떼 가격보다 저렴하다는 말로 현혹 시켜서 구매한 오너분들 후회 막심하시다 분통을 터트리시던데요 싸고 좋은차는 없는 법입니다.,2
1097,1.4 tdi 엔진 부스러짐 이슈 있었는디...개선 되었다고는 하지만 내구성이...제타 프로모션 할인 끝남...,2
1098,그냥 국산차가 옵션넣고 얼마나 가격비싼지를 알수있지ㅋㅋㅋ,2
1099,헐 시승장면 보니 D컷 핸들이네요! 고급라인에만 들어가는 D컷 핸들 들어간게 꽤 참신합니다,1
1100,LF쏘나타? 구형k7? 아니죠.1세대 K7테일램프랑 똑같습니다.당연히 그얘기나올줄 알았는데 전혀 다른 얘기해서 깜놀. 아님 편집자님께서 실수로 다른 K7을 보여주신거라 생각할께요.,1
1101,캐딜락 ct5 ct4 리뷰햐주세요ㅠㅠㅠㅠㅠㅠㅠㅠ 우파님이 하는거 보고싶어요ㅠㅠㅠㅠㅠ,12
1102,옵션으로 불만하는 사람들 특징 일단 풀옵으로 지른다. 그리고 사용안한다.그리고 남들에게 나 풀옵으로 뽑았지 라며 동일차량 구매지인들에게도 선을 긋는다ㅋㅋㅋ,5
1103,티구안 얘기하는데 뒤에 바로 있넼ㅋㅋㅋㅋ,5
1104,람보르기니는 진짜 안어울리던데 제타를 타실때는 자기차를 만난듯 너무 잘 어울립니다 일상생활에 편하고 부드러운 제타 타고 다니시고 너무 불편한 아벤타도르는 구독자 증정 이벤트 가즈아~~,3
1105,제타 아반떼 골프 i30 다 타봤지만솔직히 제타는 ... 아반떼 수준 i30 같은 경우는 아반떼나 K3 보다 훨씬 고급도어 트림 발로 차봐도 삐걱거리는게 없음 .. 아반떼나 k3 는 고속으로 달리면손잡이에서 바람 오지게 들어오는데i30 나 골프는 그런게 없음 ...제타 아반떼 개싸구려 플라스틱인데i30 골프는 푹신푹신한 우레탄임 ...탈 현기차 원하면 최소 i30 부터임주유구 마감 이런건 K7 그랜져보다유럽판매용 i30 가 더 꼼꼼하게 되어있음,2
1106,파사트도 ...부탁합니다..폭스바겐님들,1
1107,폭바야 정신못차리는 현기잡자~,66
1108,수리비 소모품 교환비용만. 해결하면.  금상첨화네요,1
1109,현기차 이제 정신쩜 차려야지~,16
1110,"기본기에서 현대랑 폭스바겐이랑 비교불가.. 폭스바겐그룹이 포르쉐,람보르기니,아우디등 가지고 있는것만 봐도",3
1111,계기판 디자인은 진짜 10년된 차 같다..,3
1112,폭파가 쌍용 생산 라인인수해서 폭파라인업 추가하고 국내생산해서 판매하면 현기 점유율50%밑으로 주저않을듯,2
1113,폭바는...연비빼곤..솔직히 볼건 없죠,1
1114,디자인은 80년대 디자인,1
1115,ㅎㄷㄷ한가격때문에 화면이 ㅎㄷㄷ떨리는건가요?,37
1116,리어램프 가 모델3랑 판박인데,1
1117,20대초반 면허딴지 일주일됬는데 제타사면 보험료 얼마나올까요?,1
1118,국산차들이 이젠 너무비싸네요 gv80보다가 지금 에비에이터로 가볼라구요,2
1119,아테온-파사트-제타,2
1120,2300은 작년 프로모션용으로 몇대 행사가고 지금 사려면 3천은 줘야될걸요,1
1121,뭔가 휠은 갑자기 요란하네요,8
1122,제타 좋네 다들 구매 가격은 1500만원 이라합니다 풀옵션이,2
1123,같은가격 옵션으로가면 아무리봐도 아반떼가 더 나은거같은데...,4
1124,개인적으로 nf보다 lf가더ㅜ비슷한느낌,1
1125,쏘렌토 mq타는데그냥  싸게 제타나탈걸높은급 수입은 탈 능력은안대고결함땜시 피곤햐,2
1126,후미등 닮은 차는 LF소나타죠~,1
1127,ㅋㅋ그래도 모든 고급브랜드가 폭스바겐 아래에 있다ㅋㅋ저런 폭스바겐이 저러는 이유는 참교육이다ㅋ,36
1128,21:55 사잉!%;_-미르가ㅋㅋㅋㅋㄱㄲㄱㅋㄱㅋㄱㄱ,2
1129,사이드미러 수동으로 접는거 맞나요?,8
1130,20:41 이래서 폭스바겐 사는 호구들이 많쵸ㅋㅋㅋ 결국 유럽호구들의 국산버전인뎈ㅋㅋㅋ,2
1131,"그래도 아반떼가 옵션은 더많어,,",3
1132,"맥시코산 제타 그리고 한국에 들어오는 제타와 차이가 있습니다.한국에 들어오는 제타는 원가절감해서 들어오는거 같더군요- 맥시코산 제타 엔진커버 있음 > 한국 제타 엔진커버 없음- 맥시코산 제타 차량에 베터리 +,-극이 가려져 있음 > 한국 제타 배터리 +.-극 안가려져 있어서 그냥 보임- 맥시코산 제타 ECU 커버 매탈로 되어 있음 > 한국 제타 ECU 커버 플라스틱- 그리고 흡기필터 크기도 맥시코산 제타가 더 큼",1
1133,당연히 아방이보다 좋다고 봅니다. 무엇보다도 제가 아방이를 싫어하는이유가 고속도로에서의 운전질감 ㅡ.ㅡ 날아갈거같음 신형나올때마다 좋아지고있다고는 하지만 여전함. 그질감을 운전자 어시스트로 잡으려고 한다고봄. 폭바의 좋은점은 밟으면 잘나가고 브레이크도 기똥참. 이말이 뭔말이나면 살짝얹어놨는데도 나도 모르게 100넘겨있고 브레이크도 민감하다 느낄정도로 좋음.,1
1134,벤츠 A-Class 220도 리뷰 한번해주세요~,1
1135,국산중형차 살빠엔 이거 살듯,12
1136,흉기차그랜져랑 제타랑 정면박치기하면 그렌져만 박살남  이게 펙트,2
1137,이건 솔직히 아반떼가 좀 더 나은듯..,11
1138,현기가 가격만 좀 조절했음 대박일텐데 팩트는 저 제타가 가격빼고 나은건 없어...현기야 반성좀해라,3
1139,제타보단 아반떼를 사는게 난 더 낫다고 생각함,7
1140,폭스바겐이 답이다..,1
1141,기본기도 없고 디자인이 산으로 가는 현대차보다는 약 1억배 괜찮네,6
1142,아반떼랑 비교하면 기분나쁠 지경이네요. 제타 진짜 실물 너무 고급지고 좋아요. 아반떼랑 비교하지 말아주세요 ㅠㅠㅠ,2
1143,"폭스바겐 아쉬운점이 작은 수리도 넘 비싸서 너무 아쉬움,, 미국에서 폭바 입지 좁아져서 노선을 튼거같은데 좀 그렇네요",1
1144,제타가 고급차는 아니지그냥 수입차란거지,8
1145,"아반떼 제타는 몰라도 쏘나타는 쏘나타가 압도적.....일단 제타가 수동미러인것만봐도..,",3
1146,현기보다 싸다 제타자!,1
1147,흉기차 진짜 얼마안남았다 ㅋㅋㅋg70도 옵션 다 넣으면 7500이였는데;; 요즘은 외제차가 더 싸다 진짜 ㅋㅋㅋ품질도 낮은 흉기 빠이다~~,14
1148,아반떼 네비랑 싼루프 뚫으면 2600넘을듯 ㅋㅋ 세상은 요지경이다,1
1149,사전예약자만 저 가격이고 원래 2700 2900임 2900해야 후방카메라 들어가고,4
1150,우파님 그 어떤 외제차도 현기차 보다 좋습니다. 중국차랑 비교를 하면 모를까..,1
1151,궁금한거있는데여ㅎ지금은 프레스티지가 2500만원대는아니죠?,1
1152,제타정도면 소나타급아닌강 ㅋ,5
1153,중국에선 제타 브랜드가 별도로 나올정도임....복스바겐 오래된모델로 중국에서 잘볶아 먹은거지,1
1154,같은 값이면 제타 사겠네요서비스기간 길고 관리만 잘해 가면서 타면 돈 안들어 갑니다,1
1155,기본도 안지키는 현기와 독일차를 비교하다니.,15
1156,리어램프 얘기할때 1세대 K7 얘기한거 같은데 영상엔 2세대 전기형 사진을 붙여놔서 뭐가 닮은거야 하게 만들었네 ㅋㅋ,1
1157,아반떼나 개나타나 가스랜저나 원가알면 더충격,1
1158,폭스바겐 앞면이 중국차 디자인이랑 똑같당 ㅋㅋㅋㅋ,6
1159,디자인은 아반떼가 더이뿌긴하네,1
1160,아테온도 리뷰 해주시면 안될까요,1
1161,해외에서 하도 안팔려서 한국에 재고떨이 한 차량인데 돈은없고 외제차탄다는부심 부리고싶어서 완판됬다는 그차량인가요,13
1162,할인에는역시다이유가있지!!!ㅎ,1
1163,예전에는 수입차가 수리비가 비싸다고해서 국산차를 타곤 했는데저도 현대차만 15년타니지금도 수입차가 더 수리비가. 더. 나오나요???,1
1164,사이드미러 수동인건 언급안해주셨네요 제타 다좋은데 사이드미러가 수동ㅋ,19
1165,아무리 독일서민차라고 까여도... 제발 그 흔한 골프나 비3 한번만이라도 타보시면 차이느낌. 고속에서 코너링 짱짱함 안정성은 그냥 넘사벽임. 제발 딱10분만 타고와서 까시길 현빠들아,1
1166,예전에 제타 1.6  디젤 탔는데 같이탄  아우디 a6보다 편했음 ㅋ ㅋ 아우디살바에는 폭스바겐,2
1167,아반때가 비싸다는 증빙,4
1168,소나타 k5정도면 제타가 나을듯,1
1169,현기는 가격이 많이 올랏는데품질은 언제 올려줄려나,9
1170,아무리 싸다고 해도 후방카메라 빠진 건 좀 그렇다잉,3
1171,너무 욕심이겠지만 계기판만 디지털이었어도 바로 구매했을거같다.. 다른 옵션에서 우와 우와 하다가 아날로그계기판 보자마자 흠...,1
1172,ㅋㅋㅋㅋ 현기 아반떼랑 폭스바겐이랑 비교가 됩니까 국뽕으로 먹고사는데 솔직히 폭바가 훨씬 낫지 독일차들이 계속 이렇게 가격낮춰서 팔면 현기 망함,13
1173,사이드미러 자동이 아니라 수동인게 흠입니다..,1
1174,지방 경남  촌동네 사는데 서비스센터가 가까운곳이 1시간30분  2시간거리 사이에 7군데 있네요 서비스센터가 주말에도 운영한다면 살만하다고 보네요,1
1175,줄서면 살수있나요?,13
1176,첫차로 아반떼랑 제타랑 비교하다가 결국 아반떼 사긴 했는데 제타가 디지털계기판만 넣어줬어도 제타로 마음이 기울었을건데...,2
1177,nf쏘나타 말고 lf쏘나타가 더 닮은것 같아요!!! 뉴라이즈 말고 그 전 버전!!!,2
1178,이거 나올줄알앗으면 아반떼 안삿음 ㅠㅠㅠ,68
1179,근데 이차 자체가 북미에서 아반떼 경쟁차종이고...차값도 아반떼보다 약간싼걸로 아는데...? 판매량도 아반테에 밀리고..흠..;;,1
1180,아반떼 살이유가 없네.곧죽어도 독일차인데.200킬로 영역에서도 쫀쫀한 주행감은 아반떼랑 비교할수없을듯.,2
1181,진짜 아방이 따위가 뭔데 제타보다 비싸냐?ㅋㅋㅋㅋ 어이가없네 ㅋㅋㅋ,12
1182,지금은 못사는가요?우파님 덕에 이제 알았는데너무 사고싶네요 ㅡ,2
1183,우파님 2300만원대 지금 사전예약 가능한가요?,1
1184,이제 돈없으면 독일차 타는 시대ㅋ,26
1185,현대보단 괜찮군,1
1186,무제한으로 팔았으면 도로에 아반떼 안보였을듯..,3
1187,관세 배송비 다빼고도 남는 가격일텐데 관세 도없는 현기는 얼마나 남겨먹을까,5
1188,현대일반아방이랑 폭바터보제타랑가격이 비슷한게 말이되나?기본 옵션도 제타가 더 좋아ㅋㅋㅋㅋ,1
1189,150마력... 25토크제타를 120마력... 14.5토크 무슨 압살을해... 현대 알바들..... 입에서 나오는대로 지걸이는구나.... .,6
1190,8:54 NF소나타가 아니라  LF소나타라고 말씀하셨는데 마스크때문에 발음이 부정확해져서 편집자가 NF소나타로 오인하고 자료를 넣은것 같네요. NF보다는 LF소나타 느낌의 테일램프 같습니다~,3
1191,제타가 미친게 아니고 아반떼가 미친거지... 나만 그렇게 생각한거?,1
1192,폭스 파이낸셜 쓰는 사람들에게먼저 차 준다그거하면 이자 비쌈알고 사자,15
1193,현기 기준은 딱. 아반떼였는데 곧 끝나겠네,1
1194,와 미쳤네,1
1195,형 장모님한테 혼날거 감안하고 영상 찍은것 같아요,4
1196,그래서 한달에 몇대 들여오는데 한달에 천대이상 팔면진심인거 인정해줌,1
1197,혹시 폭스바겐 중국공장에서 생산한 중공산아닌가요?,1
1198,ㅆ발 폭스바겐 볼보랑 투톱으로 수리비 개비쌈 무슨 부품에 금칠해놓은 것도 아니고 그리고 제타는 이 전모델 진짜 잔고장 끝판왕이었음 제타는 사는거 아니다,12
1199,실주행모습 보니까 이쁘던뎅,3
1200,확실히 차 자재가 ㅋㅋㅋㅋㅋㅋㅋㅋ 옛날 현대차 느낌인데 엑센트 느낌인데 자재가,1
1201,9:10 LF쏘나타 아닌가용,46
1202,뒷데루등모습은 LF쏘나타 초기모델 같네요,1
1203,선택지가 많아져야됨.,1
1204,와 k3 신차 2350만원에 뽑았는데 ㅋㅋㅋㅋ,8
1205,흉기차 랑 비교하면 무조건 다른차가 좋다.,1
1206,아반떼 신형 베타테스터 vs 검증완료 끝물 제타 답은 나왔지요ㅋㅋ,3
1207,10년전인가 폴로 처음 나왔을때 아버지랑 차구경하러 청주 폭스바겐 전시장 갔다가 아버지랑 나랑 개무시하면서 짜장면 쳐먹다 대충 차 가격이나 싸가지없게 툭툭 말하던 딜러 생각나네. 그땐 지들이 계속 잘 팔릴줄 알았겠지. 견적 떼보자니까 그냥 말로 때우던 별 ㅡㅡ,5
1208,쏘렌토 가격보니 현기 살 이유가 사라진거 같더라,1
1209,아반떼는 무슨 소나타도 못비비지 ㅋㅋㅋㅋ,4
1210,아반떼가 말도 안되게 비싼거죠 뭐,2
1211,진짜 지금 타는 차만 아니었으면 제타샀다 현기차 옵션 장난질 토악질 나온다또 하나 정보 드립니다 저 차량은 브라질에서 조립해서 들어옵니다,1
1212,폭스바겐이 한국에 정비소 투자하면 현기 안타지 ㅋ,5
1213,16년식 라세티 느낌이 많이 나네요,1
1214,현기차는 올라가고 수입차는 내려가거나 그대로거나ㅋ 이제 점점  국산차 안사도 되는 시대가 오겠디,1
1215,제타 디자인은 마크빼면 너무 올드함..옛날 아빠차느낌,9
1216,뒷좌석 에어컨은 없나여 ㄷㄷ,2
1217,후방이 LF소나타같네요,1
1218,우와...,5
1219,편집자가 차를 잘 모르는 듯.. 새로 뽑아야할 것 같네요..,2
1220,외제차인데 부품 바꿀 때 비싸지 않나요?,2
1221,ㅋㅋ 나 cc  4모션 풀옵타는데 안그래도 우습게 보는데 더 우습게 보겠네 제타가 2300에 나왔다고? 몇백 더주고 520i 안간거 존나후회한다  5년따서 이제 바꿀때 됬으니 폭바아우디 절대 안타 ㅅㅂ 폭바는 센터가보면 욕나옴,5
1222,비교할걸해야지 일만아녔음 제타 벌써 구입할건데 아쉽네,1
1223,이젠 돈 없어서 독일차 사는시대가 오겠네요,1
1224,진짜 현기 ㅈ됐네 ㅋㅋ,9
1225,보험비는요저 가격대 구입  차주분들은저런거 신경 안써요보험비 및 가성비죠,1
1226,오.. 차바꿔야 하는 시기가 왔는뎁,1
1227,옵션 착하게 만들엇네현기는 싸게 내놓고 옵션장난질하고 ㅈㄹ인데옵션선택안하면  90년대 차인데 ㅋㅋ,11
1228,"차값도 싼데 보험료는 더 싸고, 저공해인증 받아서 경차수준으로 주차비 및 하이패스 할인되니 안살 이유가 없겠네요대신 마트 같은데서 민폐니깐 한국정서 감안해서 전동사이드미러+전동키로 출시해라아직도 외국감성 렌트카처럼 출고시키지말고",1
1229,오토홀드가 없다니 ㅜㅜ,4
1230,미국리뷰보고 그러면 여기저기서 잡소리 많이난다고하던데 새차라 안나는건가 조용하네요,1
1231,폭스바겐 이뭔지몰랐는데 이제알았넼ㅋㅋㅋㅋㅋㅋ,1
1232,현기  알바들 겁나 많네 아반떼 와 다르게  미션부터 다르다 쯧쯧 알고까라  그리고 이벤트성 차여서 사지도 못한다  첫날 완판이다ㅡㅡ 2650대가   현기 자국민을 위해 차를 만들어라,11
1233,바다 건너 왔는데도 현기보다 싸다?? 그리고 보증은 소모품까지 보장되는데 비교 자체가 실례임...,2
1234,판교전시장..? 지난번에 갔더니 없었는데 있나보네요 ㅎ,1
1235,이미 다 팔려버려서 당분간은 살 수 있는 차가 없는거 아닌가요??,9
1236,아반떼나 크3 제타중에 차 고르라고 하면 제타 간다.,1
1237,아반테 잘 안팔리면 이차때문일것임 ㅋ,2
1238,뒷자석 송풍구가 없네요---,6
1239,근데 궁금한게 아반떼를 굳이 옵션 빵빵하게 넣고 타는 사람이 있나요 🤔,2
1240,현대차타고 폭발해서 인생조지지말자.,2
1241,근데 아반떼가 훨 이쁨. 요즘 현대차 디자인 미쳤거든,5
1242,"폭스바겐 제타,싼타모 좋은자동차지요.",1
1243,수리비 가  많이 나오겠지,1
1244,아무리봐도 아반떼보다 좋은지는 모르겠다. 디자인이 5년전 우리나라차 디자인느낌,6
1245,현기차는 지들의 포지션을 망각하고 있는듯미친 노조때문이라 생각됨,1
1246,요즘 현기차는 디자인만 이뻐서 문제조 오죽하면 출고하고 잔고장 생기고 하면 뽑기 잘못했다고 그러겠어요,1
1247,2300짜리 아반떼에 1표.,4
1248,이젠 돈이없어서. 외제차타는 시대가 왔네.,1
1249,지금 제타를 사고싶은데 지금 살수있을까요?,10
1250,현대디자인 요즘 과함~~  아우디스러운 디자인이 좋은디~~,1
1251,LF소나타랑 2011년 전 모델 K7 얘기하는거같은데 편집자가 자동차 잘 모르는듯,1
1252,"""수동 사이드미러""",31
1253,뒤는 NF가 아니라 K7구형이네요 램프가,1
1254,NF가 아니라 LF랑 똑같습니다.ㅎ,1
1255,아반떼 탈빠엔 제타타지,16
1256,스티어링 휠은 언제쯤 바뀌려나...,1
1257,이제 재발 현기좀 긴장해라 ㅋㅋㅋ,1
1258,단종시킨다고 재고떨이...신차인것처럼 디젤처분 이랍니다..,10
1259,국내차는 결함에 가격이 오르고 외제차는 가격이 내리고 결함이 줄고 ㅋㅋㅋ,1
1260,중국산으로 드려오면  범퍼 등같은 부품이라도... 골프 범퍼가 100만원이 넘으니 전동식은 고장에 부품 값 비쌈,2
1261,아반떼 비교하는건.. 에러지 않니... 국뽕이나 현대 빠돌이나 그렇다 쳐도 이건150마력 25토크하고 126마력인가 14.5토크하고.. 한세단 급이상 차이인대... 현대는 지디아이.... 엔진도 약함... 아무리 중고차 수리비 이래도 엔진하고 미션이 제일 비싼건대.... .,7
1262,테일램프는 1세대 k7 과 if쏘나타 비슷,1
1263,보증끝나면 팔아야하는차 ㅋ,2
1264,아반뗴 더 사구려 프라스틱입니다..... . 공격은 그만.....  심지어 현대 소나타 보다도 재질이나 디자인.. . 고급이에요 이차 재질이... 공격은 그만... .,4
1265,nf가 아니라 lf소나타랑 비슷한거겟죠^^,1
1266,폭바골프 차 엄청좋던데..제타는?,1
1267,저는 2400짜리 아반떼 사겠습니다.,8
1268,제타는 진짜 인기없는 차인데..  항상 폭탄떨이하던데..북미랑 유럽에서 제타는 거의 폭망아닌가? 제타동급차도 많고.. 제타 사느니 골프산다고 ㅈㄴ안팔린다 하던데..한국에선 제고 떨이할려고 가격으로 승부하나...ㅋㅋㅋ,1
1269,근데 국산차 사주는거는 회사측에서 분명 고마워해야할 일인데 새차사는데 옵션 가격이 완전 도둑놈급임 나같으면 옵션을 기본사향으로 넣아서 국산차 장려를 더 하겠다,2
1270,제타판매량하고 아방판매량을 비교하면 아방은 초등학생이지요.,1
1271,현기 차는 까야되 화이팅 우파,2
1272,저 가격이면 국산차 살 이유가 없음ㅋㅋ,3
1273,폭스바겐은 못참지,1
1274,이게 싸긴 한데 자사 파이낸셜 이용해야만 추가 할인 들어가고 또 거기다 파이낸셜 이용한 사람먼저 출고 한다던데..,2
1275,저거 제타 깡통사면 열선도 없어 무조건 풀옵가야되고 1400cc잖아 나도 신형제타는아니고 15년식 제타지만 엔진 미션결함때매 미쳐버리겠다 컨베어벨트도 나가서 덜덜덜덜덜 폭스바겐에 속아서 아무 생각없이 혹하질마시길,1
1276,2300만원 주고 사이드미러 손으로 접으면 참 뿌듯하기도 하겄다,1
1277,NF 가아니고LF소나타 닮은거 같은데요NF 하고는 1도 안닮은듯우파님은 LF소나타 라 말했는데편집자가 NF라 잘못듣고 NF사진 올리신것 같은데요,1
1278,솔직히 아반떼보다 싼건아니지..,2
1279,대신 부품값이나 수리비로 엄청뜯어내는거 아님?,1
1280,알고보면 .. 분노의 질주1 편 나온차임,2
1281,제타를 사야하나 다음 차를~~,1
1282,코로나에 차안팔리믄 현기 차값도 거품빠질래나 ㅎ,1
1283,아 아직도 대기중인데ㅜㅜㅜ,2
1284,제타6세대 5년오너였습니다 단한번도 후회한적없습니다 고질병이네 뭐네 하면서 까는말 엄청많던데 막상타보면 독일차는 독일차입니다 뽑기를잘해서인지는모르디만 잔고장도한번없었습니다 너무 추천드립니다 특히 흉기타실거면 그냥이거타보세요 차체가좀작은게 보여서 여성분들이나 사회입문하신분들께 좋아열근데 저건 성능이디젤이아니라서 잘모르겠네용 디젤이랑은 또다른건지,3
1285,대출업ㅊ체 ㅎH피론 대출 잘해준다해서 갔더만 이자율 미쳤네 ㅋㅋ..절대 이용X,1
1286,뒷데루등이 1세대 까칠이 데루등이랑 너무 비슷한데ㅋ 나만 느끼는건가,1
1287,우파님 혹시 기아봉고3리뷰가능한가요,2
1288,Lf좀더 닮은거 같은데 테일램프,1
1289,현대차 말고 현대차 주식 사는게 이득,1
1290,좋은데 이 한마디로 설명가능,1
1291,2300만원이면 살수있나요?,1
1292,근데 수리비는 아우디 가격 ㅋㅋ폭바 양카들 많기때문에 사고 요주의,1
1293,와! 제타! 아반떼보다 싸다!,1
1294,테일램프.... 전  K7 생각했는데요...흠..ㅎㅎ,1
1295,현기차는 그냥 비싸기만 한 차.,1
1296,자막 오타..후반카메라 → 후방카메라15km → 15만km,1
1297,제타랑 아테온을 비교하시네요 ㅡㅡ,1
1298,현대자동차가 이영상을 싫어 합니다,1
1299,진짜 해 피론에서 절대 대출 받지마세요 선이자 땝니다 그냥 깡패집단..,1
1300,전동사이드미러는 튜닝못하나여?,1
1301,뒷 램프 옛날k7 같다는~~,1
1302,NF 보다 LF를 닮음..,1
1303,형차가이쁘다,2
1304,코나 n라인 리뷰해 주세요,1
1305,솔직히  아반떼 사느니  이거사지,2
1306,구형이 더 이뻐,1
1307,유럽시장에서는 전세대가 판매부진으로 출시도안했고 북미시장 특히 미국시장 공략용인데 아반떼보다 미국에서 안팔리는차량임.... 사실상단종직전 국내에 떨이로파는차량 ㅡ.ㅡ 항상 느끼는거지만 폭스바겐은 우리나라시장 디젤떨이아니면 페리직전차량 떨이로판매하는느낌이어서아까움,1
1308,폭스바겐  다른차와 다르게 제타는  독일산이  아니라는  남미공장에서  생산된거로  아는데~솔직히  제타 타면서  외제차  탄다고  뽑내는건  중국산 휴대폰  쓰면서  외제쓴다고  자랑하는 꼴이지,1
1309,nf가 아니라 lf닮았다고 하는거 아닌감,1
1310,골프  는 언제쯤 출시 될까요?,1
1311,"외제차, 흉기보다 싸다!",2
1312,이거 회색이랑 실버 색상 두개있던데 실버인가요?,1
1313,내차 모닝도 전동 접이 사이드 미러인데 외제차가 수동 접이라니...,3
1314,제타 재고차량 국내에 판거라는얘기 사실이에요?,1
1315,나중에 수리비 2.3배나옴,3
1316,외제차들이 현대차 정신차리게 해줘5으면,1
1317,제타 유럽에서 단종 모델된거  국내 출시 하는거는 압니까?,1
1318,이거 네비완벽한글화에 지원도 계속 하주나요?,1
1319,메모리시트가 있네.....,2
1320,리어콤비네이션램프 설명시 동영상 오류 있는거 같은데LF쏘나타라고 하는데 NF가 나오고K7 1세대일거 같은데 다른 연식으로 보여줌,2
1321,폭스바겐은 골프죠,1
1322,사이드미러 전동접이가 아니라는데 사실인가요?,1
1323,"담차는 무조건 수입차다 흉기여 잘가라,,",1
1324,지금도 살수있나요,1
1325,사이드미러만 사제로 어케 가능하면 좋겠다 제발 한국에서는 필히 접어야하는데 ㅠㅠ 김여사님들 무서움,1
1326,저차 지나갈때 모르는사람이 우와 폭스바겐이다~~하면 저 차 아는사람이 이러겠지 에이 저거 2천 쪼금 넘는 외국차다~~~그러면서 살짝 무시...그게 한국사람이지...^^무조건 비싼거가 좋은줄알고 외국꺼가 좋은줄아는...,1
1327,현지에선 얼마임?,1
1328,아반떼 사려고했는데 제타로 ㄱㄱ,1
1329,제타 사고싶어도못사는차,1
1330,뒤에는 구형 k7하고 비슷하네요;;;,2
1331,외제차는 가격이 내려가고 국산차는 가격이 올라가네,1
1332,👍,1
