,comments,likes
843,골프는 디젤이 쵝오쥐.. 디젤 달달이충 디젤 극혐충 더 많이 늘어났으면 좋겠다... 신차구매 하기수월하고 중고 디젤 고효율 초고연비디젤차 구매하기 쉬워지게 ㅋㅋㅋ 가솔린차 사서 세금 많이 내라..,4
844,GTI는 서민의 포르쉐죠. ㅎ,4
845,폭스바겐 👍,5
846,Tdi가 좋은건 알겠는데 왜 가솔린엔진은 안가지고 오는거야ㅠ,2
847,연비가좋은 이유 = 차가 작고 가벼움 ... 작고 작고 작고,1
848,솔직히 등취합치면 3천중반돈 되는데  이젠 골프는 아닌것같다.가성비 이야기는 골프에는 적합하지 않다 이제3천중반이면 국산차 풀옵살수 있는데 해치백에 직물시트라 음이젠 아닌듯 십년째 폴로 골프 제타 타고있는데 골프가격솔직히 3천 밑이면 좋을듯,7
849,프레스티지!!!!!!등급에 풀직물시트는 좀 아닌듯,2
850,진짜 골프는 gti지 ㅋㅋㅋ,4
851,좋긴하지만 디젤 끝물ㅜ,1
852,형님 사회 초년생  골프 vs k3 gt 골라주세요!,3
853,디젤이랑 직물시트만 어떻게 하면 사겠는데..,7
854,우파님 뉴토러스 궁금합니다,1
855,골프차 트렁크공간에 골프백4개 들어갑니까??,2
856,만든지 3년이 넘은 구형을 왜수입한건지...,3
857,솔직히 급에 비해 비쌈  ㅋㅋㅋ 선택지가 너무 많음 언제부턴가 폭바사면 호구 같아보여...,8
858,‘연비’ 하면 생각나는 차,3
859,우파님 이번에 골프8세대하고 벤츠a200d세단 하고 고민이많아요벤츠가살짝더 끌리긴한데반도채 머다하면서 옵션이 거의 깡통?심지어는 열선도없다는데...머가좋을까요?그리고 벤츠a200d 2022년옵션이진짜 아에 없는지..등등둘중머가좋은지와벤츠옵션이 왜이런건지아시면 답변기다릴께용ㅠ,1
860,오늘 우파님 용인 브래그 !! 오 !!! 볼링 같이 쳐요 ~!,1
861,아니 근데 골프는  왜 통풍하고  차선보조유지 장치를  않넣는지?,1
862,폭스바겐이당 ㅋㅋㅋㅋㅋㅋㅋ,3
863,이 시기에 또 디젤이라니...ㅉㅉㅉ,3
864,와우,3
865,원격시동 되나여?,1
866,디젤 끝물 떨이라는 느낌밖에 안드네..,1
867,통풍시트도 있나요?,1
868,GTI 존버,1
869,연비 빼면 쓰레기임...확실히 인포가 느리면운전하기 짜증남....따라서 골프는 아날로그 시대에 전설인거지 지금은 솔직히 쓰레기같음...,4
870,역사는 골프다디스플레이 터지 아쉽다 우리나라 습관은 삼성이 바꿔낫지 터치하면 바로반응하겟,1
871,다들 작은 차라곤 하지만 유럽에선 이 차 타고 장거리 여행 잘만 다님. 더 작았던 5세대 미만의 시절에도. 서울에서 부산? ㅎㅎㅎㅎㅎ,1
872,세컨카로 그냥 가지고 다닐만하겠지요~~. 가족이 4명이면 이거 좁을건데요 타고다니기에... 특히 장거리는요.. 시내야 그럭저럭 다니겠지만요...  bmw120i가 더 좋을 수도 요즘은요? ㅋ,1
873,BMW iX3 리뷰좀 해주세여,1
874,예뻐서 광고 스킵 안했다.,1
875,이번엥 폭바발 디젤게이트없겟죠??,1
876,한국에선 gti판매 안하나요?,1
877,골프는 신차로타긴 이제는 저물었고.... 무족권 7세대 중고,1
878,제가 티구안타고 장거리 운전햇는대 2시간넘어가면 온몸이 뒤틀리기시작하는대 골프는 어떨까요?부산서 서울 다시 부산오는대 티구안 타고 죽는줄골프는 장거리 어떤지 알려주세요,1
879,리얼레이싱3에 이차가 모바일게임에서 획득미션으로 있어요,1
880,아니 근데 디젤만 타고 다녀서 그런지 모르겠는데.. 굳이 suv나 저런 차 타면서 조용함을 느껴야함?저런건 디젤처럼 엔진음 빵빵하게 들으면서 타야 제맛인데 사람들은 왜그렇게 가솔린의 정숙성을 요구하는거지;; 조용~히 편안하게 타고싶으면 샛기들아 세단을 타라 세단특히 SUV에선 더더욱,11
881,뭐지 봤던거 같은데 다시뜬 것 같은 느낌ㅋ,1
882,이차 왜사는지 이해불가 ㅋㅋㅋㅋㅋㅋㅋㅋㅋ몇년전부터 안보이드라 이유를 알겠지?이차를 3500이 가성비라고? ㅋㅋ 그랜져 살 금액인데또 디젤 ㅋㅋㅋㅋㅋㅋㅋㅋ우리나라에 디젤 다판다 외국사람들,8
883,유럽에선 디젤엔진 퇴출을 주장하는 폭스바겐이완전 우리나라를 호구로보고 디젤차량 마구마구출시하네 또 그걸좋타고 클린디젤이니 어쩌니  하며 좋타고  빨아대는 사람들이 있으니..유럽이나  중국 미국에선 팔지도  못하면서 유럽이나 중국처럼 하이브나 전기차좀 출시해라우리나라에서 디젤엔진 제고떨이나 하지말고,1
884,차는 좋은데 3700주고 사면 상호구.,5
885,실내 bmw 같네요!,1
886,왜 흰색 안 샀어? 그 돈이면 아반떼 사지~라고 함 ㅋㅋ,1
887,"아무리 연비가 좋고 핸들링이 좋대도 디젤이여서 싫다,,,,",5
888,시로코의 부활을 꿈꾸며,1
889,10년전에  i30 풀옵 살까  천만원 더 주고 골프살까 고민 많이 했었지,6
890,예쁘다~!,3
891,디젤이라 시끄러우면..전기차 사야지 뭐,1
892,골프가솔린들어오면바로사야지,1
893,이런 디딸 4기통 똥차를 왜사~~~ 내가 사야지~~ 하고 전화해보면 이미 대기 1년 넘었음 사고싶어도 올해 못삽니다 GTI는 내년재고까지 예약 끝이라는 카더라...,11
894,음 이제 골프는 솔직히 이름값으로 치기에도 가격이 너무 비싸 ㅠㅠ 비슷한 가격에 바레이션이 너무 넓어짐 ㅠ,5
895,유로6 x ☞ 유로 7 통과 👍,1
896,i30N > 골프 gti 아닌가요??!!,5
897,크 넘 이쁘다,1
898,아니 저 등급에 가격 옵션 결정적으로 서민브랜드임을 고려하면 가성비 최악인건데 ㅋㅋ,1
899,생긴 건 왜 .. 쌍용차 느낌일까...,2
900,독일산 아반떼. 그런데 이제 해치백을 곁들인,1
901,솔직히 그냥 아반떼 살듯..,1
902,이쁘네용,2
903,실내디자인 저거 아반떼 아닌가요....?100프로 아반뗀데...?,1
904,디젤 디젤 후후 디젤 디젤 후후,1
905,멀티링크 인가요?,1
906,근데 통풍시트 없는건 왜 얘기 안함,1
907,제스쳐 기능은 말 안해주셧습니다.....,1
908,진차 비호감 끝판 왕.,1
909,해치백의 교과서 ㅠㅠ…,1
910,가솔린은 안 들어오나요?,1
911,네비가없다던데///\\,1
912,테슬라2 출시되면...,1
913,좀 깔삼하게 바뀜,1
914,ㅋㅋㅋㅋㅋㅋ 뭐가 좋다는건지? ㅋㅋ골프좋은건 인정 하지만...떨이 아닌가?  이거 언제 나온지는 알자나?,2
915,와~우,1
916,디젤 처리반 조선,2
917,자동차리뷰 ❌ 댄스 ⭕️,1
918,ㅋㅋ이영상에 아테온광고 나왔네ㅋㅋ,1
919,그돈씨 르블랑,1
920,앗 마인부우다,1
921,혼다 씨빅형제같은 앞모양,1
922,이건 요소수 안먹나?,1
923,손짓하는거 킹받네 ㅋㅋ,1
924,골프 살바엔 조금 보태서 티구안 사겠다,7
925,미니는? 할인안하나,1
926,가솔린좀제발,1
927,뭔 마티즈를 4천만원주고 사냐,1
928,차는 좋은차사고나면 즉사,1
929,직물시트인가여,1
930,"2-3년전만 해도 디젤이 최고지ㅎㅎ하면서 이젠 디젤차 퇴물취급하는 얼간이들 보면 한심하다 ㅋㅋㅋㅋ가솔린은 뭐 극친환경인가?CO2배출량은 디젤보다 많고 연비도 떨어지는데?.전기차 배터리는 뭐 자연분해 되고 전기는 공짜로 만드나? 전기발전의 대부분이 원자력하고 화력 아닌가? LPG는 충전이 어쩌고 하면서 안타고, 수소는 비싸고 충전소도 없고 ㅋㅋㅋ앞으로도 몇년이상 주행거리 많은사람들 한테는 디젤이 최고의 선택이고, 포터 전기가 나왔지만 생계를 위한 디젤 1톤트럭도 몇년은 더 탈 수밖에 없다.",8
931,아니 소나타 풀옵보다 비싼 소형차가 가성비라니 ㅋㅋㅋ저 가격이면 이미 연비고 나발이고 의미없는 수준이다 저렴하고 연비낮은 국산이나 골프나 결국 최종적으로 들어가는 비용은 거기서 거기임,1
932,근데 저급 디젤은 국산이고 타 수입차고 연비 다 저정도 나오니 놀랄정도는 아니지,6
933,아반떼 하이브리드연비 어마어마하던데요?,2
934,그랜져팔고 골프살까?,1
935,휘발유좀 나오지..,1
936,터치 싫어 안사요,1
937,시대가 어떤 시댄대 폭바는 죄다 디젤차만 가지고 오냐골프 하이브리드아테온 가솔린투아렉 하이브리드안가져오고,1
938,요소수때문에그냥 가솔린차량 사라,1
939,왜 한국에는 디젤만 나온건지 의심하는 사람들은 없네 ㅋㅋㅋㅋㅋㅋㅋㅋㅋㅋㅋㅋㅋㅋㅋㅋㅋㅋㅋㅋㅋㅋㅋㅋㅋㅋㅋㅋㅋㅋㅋㅋ,1
940,옹 ㅎㅎ,3
941,제타 윈,1
942,시대가 어느시덴데 아직도 디딸에... 나온지 몇년된걸 이제 들여오고... 시트는 무슨 직물은 쌍팔년도 자동차인가..저걸 3000중반 주고 사는 호구들은 또 누굴지 참 기대됩니다,8
943,이거 살돈이면 N사지 않나.... 이젠 메리트가....,8
944,9등!,2
945,디딸떨이제품구매하는 폭스흑우들많음,4
946,1,1
947,무식한 사람들중에 레이 모닝 스파크가 경차라서 연비 잘나온다라고 하는 사람들은 차가 없거나 운전면허증 조차 없는 사람들입니다. 가솔린 3기통이 디젤 4기통 보다 연비가 잘나온다는 말은 !?!?!?!?!?!?!?!?연비 때문에 경차 산다.!? ㅋㅋㅋㅋㅋㅋ 진짜 멍청한 사람들이죠... 골프 디젤이 연비는 정말 최고입니다. 혹시나 연비 때문에 레이 모닝 스파크 산다는 사람들은 중고 폴로는 사세요. 경차 따면서 옵션 따지는 사람들도 한심합니다. 운전하면서 옵션 버튼으로 방향 틀면서 안가잔아요.! ㅋㅋ,5
948,인증도 풀렸겠다 전형적인 TDI 재고떨이 에휴 폭파 ;;;,2
949,오늘 촬영 흥미롭고 즐거웠습니다!담에도 기회가 되어 좋은 컨텐츠 같이 만들어보면 좋을 것 같네요!우파푸른 구독자님들도 추운날 건강 유념하세요!,112
950,이게 국내차량가격에 혁신을 일으켜줬으면 좋겠네요,61
951,국내 소비자들의 선택지가 많아졌으면 좋겠네요~,3
952,잽싸게 못 산게 아쉬워요 인터넷 배너 나오자마자 전화했는데 다 팔렸다는 ㅋㅋㅋ 사신 분들 대박 정보력 실행력 짱인 듯해요!!!,1
953,사회초년생 제타 차주입니다. 아반떼 CN7과 많은 갈등을 하다가 결국 제타를 선택했는데요~ 생각보다 너무 예쁘고 단단하고 어댑티브 크루즈 컨트롤도 괜찮고! 그놈의 사이드미러 빼곤 모두 만족입니다 하핫🦄,40
954,실제로 보니 프론트 부분이 상당히 길쭉하더군요 확실히 점잖은 디자인이라 아반떼가 부담스러운 사람들한테는 확실히 좋은 니즈가 될듯합니다,1
955,2500만원에 폭스바겐 겜성 느끼면서5년 15만Km면 진짜 모든게 다용서됨.,79
956,차의 본질은 잘달리고 달서고 이게 중요한듯요 그리고 각자 경제 사정에 맞춰서 사면 합리적일듯요 이번 제타 싸긴 싸네요 차도 예쁘고,2
957,"제타 진짜가성비 최고다. 연비며 안전성이며,,",1
958,이차는 엔진과 미션만으로도 가격이 참 좋습니다. 동가격 차량들과 비교해보세요,19
959,이번 제타는 제대로 뽑혔네 마음에 드네요 👍,1
960,"2016식 티구안 13만 키로 아직도 서브카로 개태우고 다니는데 기본기가 너무 좋음. 고급차량 아니기에 실내 허접때기, 옵션이 없어도 너무 없지만 잔고장, 누유 전혀없고 연비 만족, 보험료 저렴, 운전도 편안, 개털이 가득, 중고도 못팜 ㅠㅠ",10
961,제타가 싸게나온것도 맞는데 국산차 가격이 너무 오른것도 맞음,732
962,아반떼 구매자들한테는 정말좋은 차라고  보여지네요,58
963,우~와~ 역시 현기차보다는 폭스바겐차가 갑인듯싶네요 ㅋㅋ,3
964,차량시트만 봐도 차이엄청남..딱봐도 달리기위해 만든차 같음. 시트엄청편해보임 골프세단버전이라 주행능력은 ㅇㅈ,1
965,국산차 가격이 높아져서 이제 수입차를 사는데 부담은 적어져서 좋지만... 수입차는 부품의 단가가 워낙 높으니 무작정 차량의 가격이 싸다고 구입하기도 어려운게 아쉬운 부분이죠ㅠㅠ,2
966,2300에 메모리시트라니~대박 갓성비네요,4
967,5년에 15만km 진짜 씹압살...,72
968,아테온도 한번해주세요!우파 차리뷰가 제일 찰지네요ㅠ,1
969,9:10 NF쏘나타 → LF쏘나타16:29 15km → 15만km,149
970,크으으~~역시 깔꼼 빠삭한 진행!!!,1
971,제타.... 정말 리뷰해달라고 하고싶었던 차인데  감사합니다.,2
972,차라리 휠도 심플하게 갔으면.. 더 완벽한 디자인이었겠네요!,1
973,lf소나타 디자인은 정말 명작이었군요.,1
974,이런 것 좀 많이 들어와야 현기가 정신을 차리는데,1
975,"탄소배출규제떼문에 어쩔 수 없이 파는거죠,실제로 하얀색 봤는데 헐 괜찮던데!!!  입문자용으로 좋겠어요. 왜 내 시절에는 저렇게 싼 수입차가 없었냐ㅎㅎ  수입차는 점점 싸지는 느낌. 독삼 준중형도 5천 중후반 가던게 이제 4천후반 5천정도... 이거이거  미쳤어...",5
976,가성비 진짜 국산차보다 좋네요! 9:22 그와중에 현기 단차 불----편 ㅋㅋㅋ,1
977,차는 수리비랑 사후처리도 알아봐야는게 함정.,2
978,가성비 참 좋은차인거는 맞는데 왜 요즘시대에 뒤쳐지게 디지털계기판 있는 사양 모델은 국내에 안들어 오는가.?,1
979,제타제타 지금 이제 2백km째 타고 있는데 진짜진짜 좋아요!,49
980,제타 옵션은 별로없었지만기름냄새만 맡아도  갈정도로디젤 연비하나는 좋았는데,14
981,"흠.. 요즘 2,300으로 차를 살 수 있다니.... 그것도 수입차를 이건 인정하지 않을수가 없구만유;;",108
982,수입 국민차브랜드는 정말 국민차가격으로 나와야지. 동급보다 비싸도 300~500만원정도만 비싸야지. 예전에도 티구안이 할인하면 싼타페보다 싼적이있고 가격이 공격적으로 현기랑 붙게되면 현기도 무리한 가격상승과 옵션장난을 할 수 없게됨,2
983,우파님 항상 잘 보고 있어요 !,4
984,제타  인기좋은건  어쩔수  없나봐요,3
985,와... 가격 뭐야 진짜 개싸네,3
986,타고싶다ㅜㅜ,3
987,옵션장난 안해서 마음에 드네,76
988,가격이나 옵셥에서 굿입니다마력도 충분만 마력일듯..A/S기간등등종네요.. 굿입니다,2
989,"제발 스코다,오펠,세아트 같이 유럽에서 대중적인 회사들이 한국에도 들어와서 현기 좀 혼내줬으면..",29
990,폭스바겐 국민차 전략으로 많이 나오면 좋겠네 솔직히 폭스바겐 고급화하면 누가사겠어? 아우디사지 그정도는 폭바가 생각할수 있을거라 믿는다잉,90
991,아반떼 2500만원정도와 폭스바겐 제타 2500만원을 비교했을때 아무래도 아반떼는 국산차고 폭스바겐은 수입차인데 유지비같은경우 차이가 많이날까요?? 차 사고가났을때 부품비용이나 서비스비용을 생각했을때는 어떤것이 더 효율적일까요!!,3
992,아반떼 보다 싸더라도 유지비가 결국은 문제겠죠...,2
993,제타사서 소음 음향만 튜닝해서 쓰면 킹왕짱,1
994,어니 가격이 말이 안되는데 너무 좋네요,1
995,근데 이게 가오잡으려고 수입차라고 산 사람들은 후회할듯.. 이미 아반테보다 싸다는게 다 아는 사실이라.. 실용적으로 타실분들은 추천..,4
996,할인에 “폭스바겐 파이낸셜 서비스 이용시 14% 할인” 이라는데  파이낸셜 서비스가 뭔지 영상에 있었으면 하는 아쉬움이 있네요 !  그래도 이영상보고 제타 구매 충동이 느껴집니다 ㅋㅋㅋㅋㅋ,1
997,옵션 필요없고 현기차보다는 기본기 좋은 독일차가 훨씬 좋다고 생각합니다. 가격대 저렇게 나온다면 현기도 긴장해야지,25
998,현대나 폭바나 다들 이익을 추구하는 기업인데...물건너온차가 가격이 이정도면 솔찍히 품질은 좋아보이고 옵션도 비슷해보이는데 자국내 생산차랑 비슷한 가격이라니 얼마나 남겨먹는건지..,1
999,"솔직히 폭바제타랑 현대 아반때 가격이 비슷해서 비교 되지 그 역사와 전통, 기술력은 비교가 안되짘ㅋ",49
1000,누구나 넘볼 수 있는 수입차네요,1
1001,제타가 저렴한게 아니라 현대-기아 차량 가격이 너무 높은거지. 엔진은 크게 변화도 없으면서 옵션가격만 오르니 그냥 독일3사로 넘어가지...,148
1002,한번더 물량 풀어주면 사고싶은 가격이네요,4
1003,요즘 쫌~좋다 그래 리뷰는 이렇게...  👍무라,1
1004,사는게 중요한게 아니라 보증끝나고 수리비가 문제 아닙니까...,2
1005,원래 폭스바겐이 저렇게 싼차파는데인데... 본색을 드러내는군.,3
1006,"처음 취직해 사회 초년일때, 아반테MD로 시작했는데 그때도 2300인가 그랬음..만약 그당시 내 선택지에 제타가 있었다면 닥 제타다. 현기 절대안타지.",1
1007,진짜 제타 현기차보다많이팔려서 가격좀 낮춰주면좋겠다,264
1008,중요한건 수입차라는 인식때문이라도 아반떼보다는 확실히 더 '비싸' 보입니다 ^^,34
1009,진짜 가성비차네,9
1010,실제로 봤는데 겁나 고급짐 아반떼랑 비교도 안됨,43
1011,어떤 회사든간에 절때로 손해보면서 장사하는곳은 없다,1
1012,폭스바겐은 가격대비 괜찮은 차 많이 팔죠,1
1013,진짜 너무 기달렸어 형,4
1014,"보증기간:  5년에 150,000km 소모품 보증 3년 ㄷㄷ",4
1015,이쁘네요  각진 인테리어들 계기판들 그리고 난 조주석이 전동이고운전석은 전동 아니였으면 좋겠는뎅 ㅜㅡㅜ전동 눕거나 세울때 진짜 핵 불편,6
1016,독일차도 앞에 방향지시등 번데기 전구네요 요즘 led추세로 가는데 ..nf소나타보다 k7첫모델 테일램프랑 정말 흡사하네요,1
1017,서비스센터가 좀더 늘어난다면 좋겠네요.. 물량도 많이 들어오고..,4
1018,오우 멋진차,1
1019,이상하게 독3 제외하곤 현기보다 떨어지는 느낌..,2
1020,"폭파는 부품비때문인지 보험쪽으로는 다른외제차보단 가격이싸다고알고있습돠..솔직히 요즘현기 외장?옵션?이쁘고 편리한데 값도 많이올랐을뿐더러 목숨값이라생각하면 솔직히 돈더주더라도 안전한차타고 싶다고생각이듭니다..아직은 국산차타고있지만..다음차량은 국산차는 안사고싶네요..내가족 내새끼타는건데 무리하더라도 무조건 외제차로갈려고합니다. 진심 요즘 현기 불량,사고 뉴스나 유튜브 너무나오는데 내가 그렇게안걸린다는보장은없으니깐요",3
1021,제 인생의 첫차기도 했어요 제타 ㅎㅎ,7
1022,요즘 현기 상태로는.....제타에 한표..,4
1023,6:33 화면 떨림 심해요오늘 영상 너무 감사하고 도움 많이 됐습니다! 앞으로도 많은 영상 부탁해요 ㅎㅎ,2
1024,전 실내가 싸구려 느낌이 나네요..그래도 가격이 좋으니까! 나쁘진 않은 듯!,4
1025,하...이거 사전예약 이틀만에 끝나서 못했는데 우파님이 리뷰해주시네요 ㅠㅠ 리뷰보니까 더 아쉽네요.  ㅠㅠㅠㅠㅠ🥲🥲,2
1026,옵션하고 디자인에서 아반떼에 밀림.. 폭스바겐인건 좋음,1
1027,확실히 옵션이나 실내공간같은 것들은 흉기가 좋긴하네,6
1028,"제타 정말 공격적으로 잘 나왔는데, 진짜 의문점백미러 수동임ㅋㅋㅋㅋㅋㅋㅋㅋ",4
1029,가격대박 우하~,5
1030,진짜 투아렉은 너무 좋은차 같음ㅋㅋ,7
1031,1세대 K7 테일램프랑 거의 흡사 흡사 하네요!!!,20
1032,보험료가 외제차라서 비싸고 수리도 비싸고 부품수급이 현기차보다는 느리다는거 감안하고 사야함,2
1033,처음 봤을땐 아반떼 보다 훨씬 나아보이다가계속보니까 스탑앤고 달린 아반떼가 도심에서 타기 더 괜찮지 않을까 싶기도 하고,2
1034,제타~야타~다타승차감이 좋아야 사죠,2
1035,싸게 판 이유는 걍 저공해차법 때문이고 그마저도 지인 돌려먹기라는게 아쉬울뿐,28
1036,아반때보다 제타가더낫지 ㅋㅋㅋ 현기는 걸르라고들었어요,18
1037,테일램프 NF보단 LF에 더 흡사한..,1
1038,이렇게 잘팔리면 또 디젤게이트 비슷한 공격받을듯 ㅋㅋ,2
1039,오히려 심심한 느낌이 저에겐 더 매력입니다. 미니같이 골프나 제타의 타겟층이 서민형 차량 아닙니까. 그런데 요즘도 폭바차량들...국내 수리비가 많이 비싼가요? 아우디와 같이 엔진룸 설계가 개판이라 정비하기 ㅈㄹ이라는 인식이 있어서리,1
1040,이젠 돈없으면 수입차 사라는 말이 진짜가 되버림,1
1041,우파님 혹시 폭스바겐 아테온도 리뷰가능하실까요...?,9
1042,우파님! 신형 제네시스g70이랑 구형g70 비교 컨텐츠 보고 싶어요! 구형은 재가 드리겠습니다!,2
1043,사이드미러 전동식 + 버튼키로 바꾸면 제타 너는 앞으로 국민제타 된다. (국민아반테 이길려면 그 2개만 업그레이드해서 내놔라),1
1044,가격대비  괜찮은 듯  싼맛이 나긴 하네요  지금팔면 당장구입할듯 딜러분  연락주세요,1
1045,토요일 가지러 갑니다.  ㅎㅎ잘 봤습니다.,2
1046,우파형조심스러울 필요없고지금 한얘기가 맞아요.,1
1047,돈없어서 독일차 산다는 말의 현실화ㅋㅋ,77
1048,"브랜드가 무시 못한다고 말씀 하셨지만, 벤츠A 시리즈 BMW 1시리즈는 무시하는 사람들 많죠!!",1
1049,맞아요 앞으로 현대차 빨아주지 말자구요 너무 비싸요,28
1050,현대가 제일 신경쓰이는 브랜드가 폭스바겐일 듯,6
1051,외관이 정말 멋지네요근데 요즘 다 멋있어여뭐지...?,1
1052,해ㅍㅣ론 진짜 상담할때는 뭐 신불자 무직자 주부 다 가능하다 해서 괜찮네 하고 했다가 선이자 때고 이자율 개미쳤고 진짜 두번다신 이용안하는곳,1
1053,골프 스포츠모드는 엄청 다르던데,1
1054,아 나도 알았으면 갖고있는거 차팔고 사는건데ㅜㅜㅜ 왜 몰랐을까유,2
1055,미국 시장을 중심으로 파는차인데 안팔려서 대략 끝물 밀어내기로 후려친 가격으로 공급했다던데,5
1056,갠적인 리뷰지만 내가 시승한것 같은 리뷰 잘허네,1
1057,같은 2300이어도 편의사항이 아방이 압승같은데🤔🤔🤔,1
1058,요즘 유행에 따라서 2열에 공조기 덕트는 생략되었나요??,1
1059,이거 중고가로나오면 사회초년생차로 개꿀인데 중고차 바닥날듯,2
1060,구형 제타 오너인데 진짜 좋아졌네요.,1
1061,배타고온 제타보다 비싼 아반떼 ㅋㅋㅋㅋ,54
1062,아반떼 소나타 씹어먹겠는대? 쩐다 ㄷㄷ,7
1063,에이 테일램프 완전 구형 k7 똑같이 생겼네요.. 감각있으신분들은 다 떠올릴듯!!!,3
1064,제타하면 생각나는게 아반떼 아반떼하면 생각나는게 우파님께서 장모님께 선물해주신 깡통아반떼가생각나요,1
1065,제타는 아반떼보자 성능만 우월하지 편의기능은 미비. 제타는 아반떼와 쏘나타 중간급. 성능만 놓고보면 무조건 제타지만 기타 편의사항들을 포기해야 하니 확실히 제타와 아반떼는 호불호가 갈림.,2
1066,가격은 좋은데 배기냄새가 견디기힘들정도라ㄷㄷ;;,1
1067,초창기 k7닮았구만유ㅎㅎ테일램프,9
1068,썬루프는 절대 넣으면 안되는 옵션중 하나죠. 사고나서 전복되면 바로 깨져버리는것도 있고 천장엔 에어백도 없기때매 아주 위험합니다.  옆에 창문유리보다 위험합니다;,6
1069,진짜 아반떼 살 바에 제타삽니다,64
1070,판금부터 폭스바겐이 훨씬 좋음 선 날카로운거봐라.,5
1071,"테일램프 닮은꼴 말할때 우파님은 LF쏘나타, 영상은 NF쏘나타...",1
1072,아반떼랑 나란히 세워놓고운전석 문 하나만 열고 닫아봐도확실한 느낌 알수잇을듯...,1
1073,판금도장 기술 내부 조립은 밴츠보다 폭바그룹이지 시설이 더 좋은데,1
1074,해외차가 한국차보다 싼거 실화인가 이래서 한국차를 살바에는 해외차를 사야징,2
1075,국산차가 너무 비싸졌어. 소나타 2천 안하던 시대가 그립다,5
1076,껍데기와 옵션만 번지르한 현기 보다 좋은 선택,8
1077,전 다르게 생각합니다 제타가 가격이 낮은게 아니라 현기차 높은겁니다,1
1078,르쌍쉐차가 현기랑 상대가 안될 정도로 수준이 떨어지니 차라리 폭스바겐이 국내에 공격적으로 마케팅 해서 현기 견제좀 해줬으면 좋겠다,2
1079,우파님 왜 요즘에 코파 컨텐츠는 안 찍으시는 건가요?,1
1080,잘봤습니다. 제타사야겠습니다.,1
1081,진짜 브랜드가 이뻐야돼 브랜드하나로 차 하나가 달라지잖아,5
1082,"자동차하고  전기면도기 회사 공통점이 뭘까요?자동차는 부품으로, 전기면도기는 면도날재구매로 뽑아먹는 방식임!!!!",2
1083,NF쏘나타=>LF쏘나타신형K7 사진=>1세대 K7,2
1084,솔직히 초기형K7 테일램프아닌가?..이상해 이상해 이형은 그냥 학생들 소 한번씩 태워줄때가 꿀맛임,1
