,comments,likes
696,지금까지 꽃혀서 관심있었는데 이 영상 키는순간 ㅡ 아 생각보다 별루네~~싶네요 칼라때문인건지~~조금 마음이 닫히네요,2
697,나는 개인적으로 아반떼 ad디자인이훨씬 아쁜듯 내부는 물론 신형압승이고..이번 신형외관 진짜...문짝 휀다 조금만 박아도 걍 판금은 포기해야된다고 봐야함 ㅋㅋㅋ판금된다고쳐도 문짝비용 나올듯...,1
698,시바 이때까지 무난했으면 이젠 좀 극단적이어도 되잖아?!,2
699,오늘의 명언 : 테슬라가 선녀다,2
700,도시에 사는 특히 여성분들 주차  때문 고생 하는데요  suv엑스^^ 보다 좋아요 왜나면 엘리베터식 주차장  이용이  세단이   엄청편합니다  아무리 좋은 suv도 엘리베터식 주창을 이용  할수 없어 힘들거든요  백화점  영화관 대형식당등 우리나라에서는  주차에 큰장점이 세단이니까요,1
701,그냥 이쁜데 ㅎ,1
702,운전자세가 좀 그렇네.핸들하고 몸이 너무 붙어서 코너링때 힘들겠다,2
703,솔직히 이 가격에 이 정도면 준수한거지 깍아내릴려고만 하는 사람은 자신이 만들어타야지 잘한건 칭찬 좀 하자,1
704,아니 90키로 이상밟았을때 바람소리 얘기하시는데 11:12 위에 천장에 썬루프 뚜껑 케이스 열렸음. 뚜겅닫고 평가하세요.ㅋㅋㅋㅋㅋㅋㅋㅋㅋㅋ  그리고 아벤테인데 왜 나이든 아줌마한테 차 평가를 부탁해요? ㅋㅋㅋㅋㅋㅋ 말도 안된다... 역대급인거 다들 알텐데... 다른 유튜브 영상 봤는데 이거 외관 디자인은 현대 직원이 한겁니다. 외국 디자이너 필요없을듯. 자세히 보면 진짜  아벤타도르 느낌이 좀 있네요.,1
705,요즘현대차 볼때마다느끼는데. . 사고나면 판금은가능하나?? 단순접촉도 무조껀 교환해야할것같이 생겼어;;,1
706,아반떼라서 편견으로 보는건아닌지....?!  아님 초반 저 여성분은돈 많은 갑부이며 비싼 외제차만타고 다닌분은 아닌지요..,1
707,미드나잇 그린이 생각나네요 ㅋㅋ,1
708,한국에서 아이20엔은 몇대 팔릴까? 2대?,1
709,아반떼좋한용,1
710,아무리 풀옵션이어도 아반떼는 아반떼임.. 소나타나 K5갖다 놓고 뭐가 부족하네 어쩌네 하는건 진짜 양심없는 도둑놈 심보....,1
711,역시 디자인은 기아  ㅋ,1
712,👍,1
713,진짜 미안한데 지금 7월 판매량을 보면 답나옴 그랜져 제끼고 1위 디자인이 어쨋다 뭐 어쨋다 개소리임....7월판매량이 만대다 만대 뭐 사람마다 관점이 틀리긴하지만  지금 국산차중에서 제일 잘나가는 차는 cn7이 맞다,1
714,이번아반떼는아주잘나온거같은디,1
715,방금 하이브리드로 계약하고 온 사람입니다.저거 모두 추가하면 여러분이 생각하신 것보다 돈이 더 나올겁니다..,1
716,더뉴K3 랑 디자인 뭔가 비슷한듯,1
717,아반떼 보다가 맥심에 멈췄습니다 ㅎ,1
718,베터리작은게 아쉽,1
719,맞네.. 이거 아반떼지.. ㅋㅋㅋㅋㅋㅋㅋ 아반떼 치고는 어색하다 ㅋㅋㅋㅋㅋㅋ,1
720,맥심 그렇게 보다가 사고나겠어요,1
721,보자마자 지나가는 아주머니가 본인 옛날 구형하고 비슷하다고 하셨는데... 그냥 너무 잘나와서 부러워서 그러신건가하는 의문이 드네요 ㅋㅋㅋㅋ지금까지 여러 아반떼 구형을 봤는데 저런 느낌 받은 적 없었는데;;,3
722,그랜져 그리 까여도 잘만팔리더라...,1
723,.... 장난감처럼 차를 사시다니..,2
724,행인이라고 해서 이름이 행인인 게스트가 나온줄 알았어요 ㅋㅋ,1
725,32만 구독자에 저렇게 자막 오타가 많아서야...,2
726,그냥 본인 마음에 안드는 디자인 아닌가요 ㅋㅋ,1
727,앞모습은 그렌저 + 소나타인듯,1
728,이번 아반떼는 볼때마다 베놈이 생각낰ㅋㅋ,1
729,멋있기만한데 ㅋㅋ,1
730,깜박이 왜저래.. 눈곱인줄..,2
731,번호판 보니까 불날것 같아요...ㅋㅋㅋ,1
732,"머 쏘쏘 나쁘진 않지만,, 나같아도 저렇게 디자인 안할듯 ㅋㅋㅋㅋㅋㅋㅋㅋㅋㅋㅋㅋㅋㅋ",1
733,"미니가 왜 팔릴까  국내차디자인에 혁신적이라 생각함 맨날 벤틀리= 제네, 스포티지= 포르쉐, 일본차와 마세라티 합성된 기아차, 현대도 아이덴티티가 있어야함 이번엔 잘했음 차를 보는 시각도 세대차이 라고봄",1
734,모터그래프에서는 코너링시 쏠림이 심하다는데 김한용은 코너링좋다그러고 누구말이 맞는겨? 그리고 차를타면 거의 다좋다그래서 너무 업체와 타협?하는 느낌 이들어요.,1
735,40대 이상이 사기에 과한 디자인인건 맞다.,2
736,그래도 도전적인 혁신은 좋다조금씩 바뀌는구나!,1
737,완전풀옵션 폴라화이트 내부블랙으로 순번83번받았어요 언제나오려나...,2
738,저희 아버지 두번제 차2007 아반떼,1
739,16:35 !?????? 부럽다.ㅠㅅㅠ,1
740,근데 이 차는 돈을 적게 '드리면서'/아직 판단은 좀 뒤로 약간만 '밀어' 놓도록 하죠. 자막 맞춤법 실화인가요?,2
741,ㅋㅋ 번호판 저거 100도는 웃기다,2
742,현대...너는 다 계획이 있누,3
743,저방장님 궁금해서 그러는데 아반떼 차량 잘보았는데 방장님 키가 몇이세여 ~,1
744,조립품질은...유투브 보면서 만드시는분들이 이 영상을 좀 보면서 만드셨으면....,1
745,11:7 왜 계기판 가린거죠??,2
746,2740...ㄷㄷ..,1
747,지이이인짜 예쁜걸요~~~~~~ ㅎㅎㅎ,1
748,100도...빽도?! 빽도더!!!,1
749,여사님 객원으로 초빙하시죠 ㅋㅋ,1
750,외관은 그랜져앞모습 k3의뒤 소나타3옆 비빔밥? 차값은 넘사벽!,1
751,차번호 기가막히네 100도 ㅋㅋㅋㅋㅋㅋ,2
752,본넷 단차는 디자인 요소로 넣은거라던데..,1
753,근데 다 좋지만 스마트카?해킹 당하면  해커들 맘대로움직일수 잇는것이 아닌가요?ㅡ.ㅡ,1
754,기관 변속기 차동기 조햐기 별로 발전 업음 껍데기 전장품만 발전 출력은 세타 엔진  비해 떨어지고 엠피아이  다중분사 방식 옛날 엑셀 엔진 방식 세타 쓰리 직분사 엔진 발전 시켜야지 다시 원위치 그좋다던 세타 엔진 완벽 하게 발전 시켜 으면 좋을텐데   아쉬워,1
755,디자이너가 삼각형 성애자인가...,1
756,지들 딴에는 선 죽죽 빼놨다 하는데 옆에서 보면 걍 시빅,1
757,;; 잘만든 토션빔 드립 ㅋㅋ 자학인가요,1
758,그냥 좀더 보태서 보잉707 사지..,1
759,아반떼 요즘 몇년할부로가나요,2
760,약간 혼다 차량 보는 것 같은 느낌이...?,1
761,어제 길가다가 CN7 아마존그레이 컬러 봤는데 와.. 20중반 눈에는 고놈 증말 샤프허게 생긴게 진짜 이쁘더이다 허허,2
762,아반떼 살바에야 K5 중하옵 사는게 나아보임 ....,1
763,확실히 젊은 양아X친구들이 차 리뷰 많이보고댓글많이 다는거같네요저걸보고 디자인이 좋다고하니 참왜 스포일러 왕 날개도 다시지일단 작은 선 여러개  먼저 집어넣다보면저런 조악함이 됌. 굵은 메인라인이 먼저 그려저야함. 거꾸로 디자인됀 경우전형적인 디자인실패. ♥이해하기쉽게  중2한테 종이 연필주면오만 잡선 다 집어넣고있지  딱  그런 방식의 디자인,1
764,전혀 과한 느낌이 없는데요?,1
765,디자인은 취향인데 그걸 어케 다 맞춰요멋있다고 생각하는 사람도 있고 아니라는 사람도 있고 그런거지난 좀 튄다고 생각은 했어도 이상하다고까지는 생각하지 않음,1
766,어뎁티브가 머보면 들어 있는지 아나요 저이거 총 2470만원 들었는데요 보험은 빼고 그기능 들어 있을까요?,1
767,2000중반이면 중형차 가격인데,1
768,가운데 손잡이는 오른쪽으로 급 코나바리할때 꽉 잡고하라고 만든거 아닌가요?,1
769,추리닝 에서 케주얼 정장으로 옷만 바꾸고 팔찌에 시계  정도 차고 있을 뿐인데 사람이 달라보이는 정도 일 뿐인데 이렇든 저렇든 거기서 거기 그놈이 그놈이다,2
770,중국에 디디로 많이 팔리겠다,1
771,딋모습은 렉서스 닮은거같아요 개인적으로 소나타보다 디자인은 더나은거같음,1
772,아마존 그레이가 렌더링에는.녹색끼가 보였는데 실상은 그냥 회색이네,1
773,오늘도 빔 빔 빔 칭찬ㅋ.ㅋ,1
774,ㅋㅋㅋ 딱봐도 혼다 씨빅 쿠페 디자인 따라 하려다 산으로 갔구만,1
775,수동쓰면 5단 넣을때 보조석 사람 허벅지에 손 닿는데 보통 남자들이 타기때문에 기분이 나쁘답니다. 그래서 격벽을 만들었음. ㅋㅋㅋ,1
776,여자친구 난입방지 펜스아닌가요 가끔 조수석에서 고쳐앉다가 무릎으로 기어노브 칠때가 있더라고요 ㅋㅋ,1
777,다른건 한시간넘더니 아반째는 짧네.,1
778,차값내고 타는건데 이정도면 만족하래~ㅋㅋㅋㅋ 누가보면 공짜로 타는 줄?? 하여튼 현기 하청 애들이 많아서 덮어놓고 칭찬중,3
779,불만이면 돈 더 들여야지 왜 아반떼 보고 불만인지?  아반떼는 아반떼와 비교해야지 아반떼를 그랜져와 비교하면 안 돼지,1
780,? 디자인 개 멋진데 과한거 하나도 없음이번 리뷰는 너무 너무 주관적임,1
781,역시 현대 삼각때는 변하는게없어 트렁크를 페스트백으로 넣어주던가 저게 뭐여 ㅋㅋ,1
782,운전하실때 한눈파시면 안돼요 ㅋ,1
783,저20댄데 친구들 다 이쁘다고 하는데..ㅎㅎ,3
784,"결론은,,,, 맥심",1
785,기자님 k3페리나 풀체인지는 언제죠?,1
786,카트 파라곤 느낌 씨게 나네 ㅋㅋㅋㅋㅋㅋ,1
787,번호판이 다른 리뷰차랑 같은데유?ㅎㅎ 모징,1
788,가격을 고려해서 리뷰를 하셔야지그냥 막 존나 벤츠급으로생각을하시나,1
789,ㄹㅇ 별 양반 사대부집안 권문세족뿐인가... 꼬우면 돈 처벌어서 그랜저 이상 타고 다니던가 현대 5인승 중에서 가장 낮은 클래쓰보고 외제차 디자인에 하이클래스 옵션에 별 잡소리다하네 나 저 아반때가 역대 아반떼시리즈보다 가장 좋더만,1
790,리뷰영상자체가 애매한거같은데 까고싶은데 어떻게든 포장시키려는것 같은,1
791,경차는 경차고 아반떼는 아반떼다 엥 풀옵션 가격은..아반떼 맞음? 모닝어반 풀옵션도 1800인데 모,1
792,"아빤떼한테 문콕 당하면 큰일나겠네.,,,",1
793,형 그차는 일인용도 이인용도 아님 김한용이야 ㅎㅎㅎㅎㅎㅎ,1
794,단차 빈틈사이로 빗물들어가면 트렁크 홍수나것다,1
795,오프닝부터 저딴걸 넣은건 ㅈㄴ 까고싶어서 그런건가 ㅋㅋㅋ전체적으로 좀 까는 느낌이기도하고ㅋ 저정도 가격에 저정도 성능  세계어디에도 없는데 ㅋㅋ맨날 비싼거 타다보니 서민들 차엔 그닥 관심없어보임 현대먹여살린게 아반떼인데ㅋ,1
796,워후 흰색하길 잘했네,1
797,"싼타페타고있지만 저라면 아반떼보단 삼성으로. ,",1
798,아반떼 운전석과 조수석 사이에 프라스틱 손잡이 그거 꼴보기 싫어서 살까 말까 망설이다 결국은 않샀음페이스 리프트 나올때 기대 해봅니다. 저런 이상한 짓은 더이상 않하고 중간에 프라스틱 경계선 없어 졌기를....,1
799,현대마크가 너무 별로에요 ㅠㅠ 좀 마크가 싸구려같이 보이는거 같아요,1
800,제대로 평가 했네. AD랑 크게 다르지 않다. 껍데기만 바꾼거라고...,1
801,신차를 as받으며 단차를 맞추라고요?맨날 와이파이로 뭐 보면서 조립하니까 맞는게 있을라나...,2
802,신형k3는 언제나오나여??,1
803,현대차는 수명을 다한 듯. 기아차는 현대차에서 주식 몽땅 매입해라. 괜히 옮을라~,1
804,토션빔세팅은 잘됬나요,1
805,차 들이받으면 판금할때 각마추기 드릅게 힘들것네,1
806,디자인이 첨에는 멋있다는 생각들었는데 보면볼수록 별로다,3
807,나도 이거보고 주문했소 나쁘면 책임져 주시요,1
808,이젠 아반떼가 2500 ㅋㅋㅋㅋ...,1
809,군대갔다와서 중고로 뽑을 생각중...,1
810,코너링 한번 볼게요 코너링!!구오오오오오오우?~우우우도오오오옥!? = 구독!👍🖲 ㅋㅋㅋㅋㅋ,1
811,현대차는 벤비아믹스라는 말이 정말 맞네ㅋㅋ 실내 그랜저신형 부터 벤츠e클 따라하더니 이젠 다 저런 일체형 전자계기판으로 하네ㅋㅋ 게다가 앰비언트 라이트까지ㅋㅋ  역시 카피캣 현기,1
812,구형하고 내부가 어찌 똑같지  ....,1
813,볼수록 겸손이 없는사람처럼 보이네요,1
814,너므 비싸졌다 아반떼 가격이,1
815,2019아반떼가 나온이상 이번 아반떼는 무조건 괜찮은거임 그냥 그런거임 묻지마셈 괜찮은게맞음 삼각떼는 리뷰도 몇개없어 ㅋㅋㅋㅋㅋㅋㅋㅋ,2
816,리뷰 잘 해놓고 굳이 그런 장면을 왜? 50대 부장님이 편집하나요?,3
817,그리고 테슬라 단차 말씀 하셨는데 테슬라는 좌우가 다르게 조립될 정도라는거 아시잖아요 넓고 좁고에 문제가 아니라 좌우가 달라요... 현기 직원이 몇명인데 ... 에어백이나 브레이크 안좋은거는 깐다 쳐도 이번거는 허위사실 정도네요  초반 내용이,1
818,근데 내가 본거랑은 틀리네요 앞게기판이 타불렛 처럼 네비와 통합이던데 네가 잘못 봐나 16일 나오니,1
819,까다가 빨다가 오락가락? 디자이너 되시면 만족도 백퍼될려나?,1
820,오잉 엄청이쁘다고생각햇는데..,1
821,차량색상이 뭔지아시나요?  아마...존그래이,1
822,Ad보다  디자인 훨좋은데,1
823,와 칼라죽이네,1
824,ㅋㅋㅋ선녀드립 개꿀잼,1
825,맥심형님...,2
826,아반떼 말고 892조 6974 번호판 2470만원에 살 의향있습니다.,1
827,훨씬 잘팔리고 훨씬 멋있어 이 김한용아,1
828,차가 갈수록 조잡해지네,1
829,나 20대인데 내 동년배들 다 아반떼 잘뽑혔다 그런다,1
830,소나타 오너들만 욕하지 저 가격에 저 디자인이면 잘만든거지 ㅋㅋㅋㅋㅋ 소나타 오너들 아반떼 그만 좀 욕해라 ㅋㅋㅋㅋㅋㅋ 괜히 부들되는거보소 소나타보다눈 잘 만든거 팩트구만 ㅋㅋㅋ,1
831,2500만원짜리 자동차,1
832,현대 협력사 다닙니다; 하 이번 아반떼 제네시스 처럼 만들었습니다. ㅜㅜ,1
833,이분 맛상무님 느낌 나네요,1
834,오 아반떼 갠지나는데? (I'm 디자이너),1
835,차 이쁜디,1
836,난 지금것 역대급으로 예쁜데? 저렴한 차에 자격지심이라도 있는지는 모르겠다만 비싼차보다 이쁘면 안됨? 젊은사람들에게는 예브고 싸고 좋은차일텐데... 나이 높으신분들은 소나타급 이상타실거면서 왜이럴실까,1
837,모닝정도의 풍절음이 나는건가요?,1
838,현실적으로 평가해주는데 빼액충들 왜캐 많냐 ㅋㅋㅋㅋㅋㅋ지차가 아반떼인데 뼈맞아서 빡쳤나,1
839,인생도 마찬가지같음 한번 만만하게 보이면 아반떼꼴남,1
840,엌 맥심 ㅋㅋㅋㅋㅋㅋ,1
841,그랜저 아빠 소나타 엄마 아반떼는 자식,1
842,여자친구랑 손잡고 간다면 가운데 턱은..그만큼에 거리가 멀어질듯 ㅋㅋ가운데 그부분도 탈거가 될거 같은데..절단부위가 있어보이니..김한용기자님 탈거 부분 한번 알아봐주세요~* 탈거 했을때 느낌과 마감을 어떻게 해야될지~*,2
843,난 15~16년도부터 현기 인식이 바뀜 갓임,1
844,뭐 다 좋은데 사고나면 문짝 어떻게하냐...판금안될거같다,1
845,아반떼 가격을 생각하고 댓글좀달지...,2
846,근데 저 아주머니는 리뷰를해달라고 부탁드린건가요? 갑자기와서 저러시는건가요ㅋㅋ,1
847,으잉?난 너무 맘에 드는데,1
848,렉서스 es가 생각나는건 ..........느낌인가요?,1
849,Xm3 압승,3
850,초창기니깐 조립평가를 하지말자?그럼 판매도 안해야지!!!,1
851,뒷태는 확실히 예쁨,1
852,번호판 탐난다...,1
853,암범퍼  라이트  데루등  디자인만잘나오면 뭘하나 누가봐도  아반때다  전제척  실루엣  느낌이  붕떠잇고  어디하나  낮게깔린느낌이 하나도없다  그냥 아반때,2
854,내가 보기엔 이쁜데 지나가던 일반인 한명 가지고 너무 강조하시는 느낌 ㅋㅋㅋ 디자인 호불호 따지면 그 사람이 좀 예외적인 경우 아닐까 생각이 듦. 아반떼급 차에서 저 정도 디자인이면 혜자지,1
855,노력한 티는 많이나긴함,1
856,아반떼는 항상 문열린거처럼 바람소리가 들렸음 그점때매 참 싫음 풍절음만 좀 어떻게 해줬으면;,1
857,현대차는 그만도전하고 디자인컨셉부터 잡으면 좋겠다. 그릴이나 실내가 매번 제각각이네요... ㅡㅡ,1
858,"결론 : 디자인중심의 변화, 그외는 전과 차이 없음?",2
859,슈퍼루키를 위한 차로 기획했는대 왜 슈퍼루저들이 부들부들대면서 까대는거야,1
860,"수출도 해야되니까....토요타 등 일본차의 별 희안한 디자인을 보시라... 특히 토요타 코로나, 혼다 시빅 등에서 볼 수 있는 차체의 확장이라던가 스포티한 디자인....그런데 고객이 또 그걸 사네... 그리고 많이.... 요런식의 디자인 초기에는 젊은 애들이 많이 사고 후에 눈에 익어가다 보니까... 누구나 선택하는 즉 대중화가 되었네... 이제는 이것들보다 상위 모델인 토요타 캠리, 혼다 어코드도 스포티한 디자인으로 바뀜.",1
861,꿀렁꿀렁 출퇴근차 필요하면 쏘나타나 SUV타라 이말씀이야.,1
862,렉서스 es가 생각나는건 ..........느낌인가요?,1
863,20~30대가 무난히 탈만한 아반떼디자인을 무슨 중3~20대초반이 타게끔만들어놧네ㅋㅋ 18년도에나온 k3가 훨씬이쁘네,3
864,2도어 있겠죠?,1
865,00:56  오 번호판 100도 포화혼합물 상태,1
866,난 탈만 하던데 ㅋㅋㅋ,1
867,아반떼 기어 변속기 수동이 아닌 자동이죠?자동 기어 변속기,2
868,일반인에 눈이 아니고. 차에대해모르는 일반인 여자 눈입니다 ㅎㅎㅎㅎㅎ구형 아반테랑 똑같데 ㅎㅎㅎㅎ,1
869,20초 백도 ㅎㅎ,2
870,1년에 4만키로 이상 운전하는 사람입니다고속도로와 고속국도 그리고 산간지방과 그리고 도심주행비중보다 지방지역에 도심주행이 더 큰 저로썬 어댑티브크루즈컨트롤은 사치이며1년에 3번이상 써먹을일도없을뿐더러  이미 운전자체를 즐겨하는 저같은 특별한사람에겐 그 옵션은 무조건 빼야될 옵션이며사용빈도가 차를구매후 팔거나 폐차할때까지 쓸일이 10회이하이며안전을 생각하면 운전자가 정신똑띠 차리고 더 집중을 운전을 해야지요안전을 생각해서 사용하지도않을 옵션을 무조건 선택하라고 강요하는건... 좀 아니지않나 생각해보네요자동차는 주관적이며  개개인마다 판단 그리고 결정 을 짓는건 개개인 마다 다르다는걸 더 강요해주셔야 된다고 생각하는데자동차 리뷰하는데 더 도움이 되지않나 생각해봅니다김한용씨 믿고  드라이브와이즈(200만원상당) 옵션 구매했다가처음 1회 사용후 지금까지 사용빈도를 봣을때 1년에 4만키로 주행중 2번 남들에게 보여주기식 뺴곤사용을 할일이 없었습니다,1
871,일본차 같은느낌이네 디자인이...,1
872,안사유 차가 거기서 거기지유ㅎㅎ,1
873,폭스바겐... 디자인 잘뽑고.. 망한 모텔..... 답습하는게 아닌지.. 걱정되네..... . 겉만 멋지만 안은 그냥 개 사구려 만들어서... .,1
874,4:26 ???: 제 겁니다.,1
875,토션6 ㅋㅋㅋㅋㅋㅋㅋㅋㅋㅋㅋㅋㅋ한번씩 보면 편집자 약빤거 티남,3
876,이 정도면 선방했다고 봄,1
877,k3가 조은지 아반테ㅣ조은지요,1
878,깡통추천,1
879,사이드미러좀 내려주지.ㄷㄷ,1
880,렉서스 es가 생각나는건 ..........느낌인가요?,1
881,테슬라 조립단차 안보고 리뷰하시나;;;;,1
882,이쁘기만하구먼...,2
883,21:18 이 영상을 사모님께서 싫어하십니다,2
884,이것도 과연 언제쯤.. 피스톤스커핑 다다다다 경운기 소리가 날련지 무척 궁금함.. 내차 hd 리콜 해줘라 현대 시끼들아..노이로제 걸림..,1
885,그런데 아반떼야 ㅋㅋㅋ,1
886,색안경이다. 통x인터뷰에서 이상엽 디자이너가 직접 얘기한걸보시라 권한다. 우리가 알게모르게 얼마나 보수적이었는지. 보수적인것만 고집하면 혁신과 발전이 있나?,1
887,저는 xm3보다 이차가 더 예쁜거 같습니다. xm3 처음봤을때는 정말 예뻤는데 아반떼 신형을 보니까 아반떼가 더 예뻐보이네요.,1
888,아방이 동네북ㅋㅋ,1
889,솔직히 헤드라이트 아반떼 ad에 약간의 변형??뭐 그정도??인듯 합니다.캐릭터라인 omg구요 왜 그냥 피타고라스의 정의 라고 하시지요.....아니 만들거면 3:4:5직각의 정의대로 만들던지.....기준기준 하던데 그 기군이 3:4:5인가요???완벽한 직각 삼각형?비율이 3:4:5란건 알고 계신란가요????참 희한한 차가 나왔다 이정도 아닌가요??제가볼땐 ad후속 그이상 그이하도 아닌거 같아 보입니다.....이차의 모토가 반동 인가요????궁굼하네요.,1
890,맥심 ㅋㅋ,1
891,변한거는 전자장비와 외관인데  속은 1990년대거를 신차처럼 사기치는 흉기,1
892,??내 주변은 하나같이 일반인 관점에서 디자인 예쁘다고 난리들인데 ㅋㅋ 누구한테 물어보신 보편적인 일반인 의견이신지,1
893,목  빠지것소..ㅋㅋ,1
894,"디자인만 보면 쏘나타,K5 다 압살 하는거 같은데...K5 실차보면 너무 실망...쏘나타가 이 디자인으로 나왔어야되지 않나 하는 생각...",2
895,콜벳C8  따라한듯..가운데 턱 부분~,1
896,예쁜데 뭘 디자인으로 까냐,1
897,중고 매물 언제쯤 올라올라나,1
898,광고 실화냐...,1
899,디자인에 디자도 모르는새기가 디자인구리다하네ㅋㅋ,1
900,추구했으면 하는 차급 이미지..아반떼 - 젊음.첫차. 약간 과한 디자인소나타 - 애아빠. 곳곳에 디자인 포인트.그랜저 - 중우함속에 숨어있는 과감함. 무난.제네시스 - 비싸보임. 커보임. 좋아보임.그냥 제기준엔아반떼는 잘나왔다고 봅니다.다만소나타는 너무 과감하면서도 어정쩡한 뒷태그랜저는 k7보다 비싼데 너무 젊고 도전적인 디자인.,1
901,전 통풍시트만 있으면 됩니다,1
902,아반떼 뜻이 뭔가요?,1
903,토션6 ㅋㅋㅋ,1
904,"그냥 지나가도 되는데,  틀린부분을 지적이 아닌 알려드리는 마음에서 적습니다. 맘상하시라고 드리는 말씀은 아니고용^^.1분35초.....돈을 많이 들으면(X)----> 들이면(0),   근데 이 차는 돈을 적게 드리면서(X)---> 들이면서(0)...아무래도 자막 작업하시는 분께서 ""들이면, 들이면서, 드리면서""의 사용법을 구분을 못하시는거 같습니다. 어려운 단어 아닌데.......",1
905,디자인이 왜 조랩ㅋㄱㅋㅋㄱㄱㅋㄱㄱㄱ ㅋ ㄱㄱㄱㄱㅋㄱㄱㄱㄱㄱㅋㅋㄱㄱㄲ,1
906,왜 저런 컬러를 갖고 소개하는지... 아쉽,1
907,"현대 정신못차렸네.필러쪽 보면 여전히 무광싸구려 필러.어휴 지겹다,흉기차.",1
908,잘만들어놔도 지랄이야.테슬라 타고 와서 아반떼를 왜 비교하는데,1
909,단차까지 맞으면 아우디지 그러면 누가 아우디 사겟냐 ㅋㅋㅋ,1
910,아반떼 디자인전면: 턱빠진 대머리 .전조등을 자꾸 본넷에서 빠지고 앞범퍼 쪽으로 넣을려고 하는 억지후면 : 닭 궁디? 변기에 앉을려고 할때 자세?자꾸 엉덩이를 치켜든 자세 타이어가 너무 잘 보임 . 앞은 아래쪽으로 엉덩이는 위쪽으로참 과하게.... 우웨~내부는 신선?? 하고  괜챦음,2
911,보닛에 있는거 단차 아니랍니다,1
912,아반떼에 뭘바라냐 저정도면 이타치 아니냐 아 상타치,1
913,아반떼가 테슬라보다 단차가 더좋아차라리 아번떼는 일정하게 두껍지 테슬라는 끝에 몰딩처리도 삐뚤빼뚤함 이상 뚜벅이,1
914,무겁고 중후하고 보수적인 디자인을 뽑으면 젊은 사람이 대부분 뽑는 아반떼를 누가탐 나이먹은사람듷이 이거다저거다 너무 과했다 훈수해봤자 그사람들은 어차피 아반떼안탐 소나타나 그랜저타겠지 ㅋㅋㅋㅋㅋㅋ오히려 이렇게안했다가 처참한꼴난 전시리즈보셈 ㅋㅋ,1
915,근데 진짜 실물은 싼티나보이더라. 사진빨이 더 좋음,1
916,조온나 별로다 조온나 일주일만타면 질릴거같다,1
917,k3차주님...죄송한데...첫등장에 깔깔이 입으신줄...ㅠㅠ 죄송합니다.,1
918,"댓글보니 젊은꼰대들도 많이 보이네 ㅋ아반떼가 젊은층이 많이 탄다고해서 30,40대가 과하다고 평가하면 안되는거야??김한용 기자분도 그저 리뷰어중 한명일 뿐이고 본인 기준에서 과하다고 생각해서 과하다고 한것일 뿐인걸??차의 성능은 몰라도 디자인은 남녀노소 개인취향이 지극히 갈리는건데그걸 지적하고 있네 모지리들 ㅉㅉ",2
919,비싸다,1
920,잘나옴,1
921,하.. 바람소리 ㅋ,1
