,comments,likes
326,댓글보면 아반떼가 1억대 차인줄. 바라는게 너무 많음,525
327,아니 그럼 어떻게 말들라는거야?? 역대급 디자인 이구만..,1
328,와 맥심이다 맥심ㅋㅋㅋㅋㅋㅋㅋㅋㅋㅋㅋㅋㅋㅋㅋㅋ아 미치겠넼ㅋㅋㅋㅋㅋㅋㅋㅋㅋㅋㅋㅋㅋㅋㅋㅋㅋㅋㅋ,7
329,저는 그렌져 하이브리드 타다가 렌트로 아반떼 타봤는데 다 괜찮은데 보조석 무슨 바 같은거 좀 없었으면 좋지않았을까..,2
330,17:06 순간 자율주행인줄 ㅋㅋ,121
331,멋지네요.,3
332,최고트림 안사면 바보되게 만들어놓은 가격표만 빼면다 좋습니다,8
333,"어댑티브 크루즈.. 무조건 선택이 답인거 같긴한데, 오동작 조건, 이럴 때 위험할 수 있다 등..알고 사용해야 합니다. 모르고 사용하다 상당히 위험할 수도...",3
334,cn7 고민중입니다... 이유는 첫번째 내부에 풍절음이 크고 두번째 조수석을 더 좁게 만드는 손잡이... ㅠㅠ,1
335,뒤에 H자 led는 옵션 추가안하면 없는거에요? Led 옵션이 있길래 H자만 있으면 되서 고민중..,1
336,이번에 인스퍼 옵션으로 구매하려고하는데 바퀴는 16인치를 그냥쓰는게 나을까요 17인치로 업하는게 나을까요..?,1
337,3:50초...현대가 언제부터 품질 제일주의였나...유튜브 시청하면서 조립한다는 회사...그동안 흉기로서의 명성!!!,2
338,장난감처럼 접근할.수 있는 차라니 ㅋ ㅋ  암만 유튜브지만 참 거시기 하네 ㅎ,6
339,다음엔 그랜져 어떻게 나올지 기대 해봅니다..,1
340,아반떼 타면서 뭔놈의 지적질이 그리 많아. 이미 졸라게 좋아 진거 같은데..,8
341,잡아돌려도 위와 아래를 손잡이로 생각해서 잡고 타라는거지요. 카이엔에 있는것처럼 ㅋㅋ,1
342,"음...? 내가봤을땐 그냥 개이쁜데 ㅋㅋㅋㅋㅋ. 딱, 유니클로 옷으로 센스입게 옷입은게 명품으로 치장한것보다 더 이쁜느낌.",1
343,깡통차 리뷰가 보고싶다.,1
344,항상 볼때마다 느끼는게  현대차 리뷰하실땐 단점을 얘기하는 듯 하면서 이정도는 문제 없다는식으로 말씀하시는게 많은 것 같아요. 단점은 그냥 단점이다 라고 딱 말해주세용 ㅠㅠ,1
345,운전석 감싸게 만든것이 과하다는 생각이 들어요 옆좌석이 작아 보이기도하고요 사전예약했는데 갈등생기네요ㅠ,1
346,너무 젊어져서 40대 이상은 고민될 듯Ad는 나름 전 연령대였는데,11
347,내년 이맘때 차사려고 돈모으는 사회 초년생으로써 멋있는것 같은데 특히 뒷모습이 저만 그런가요?,1
348,김한용이 이정도로 아쉬운게 많다면 진짜 타면안되는차다,3
349,이쁜긴 한데 넘 영하게나와서 고급지다 보다는 이쁘네~하는차,1
350,이쁨을 가진 대신 품질 쉣!!! ㅋㅋㅋㅋㅋㅋ,1
351,N라인 기대되네요.,1
352,아반떼가 아반떼가 아니네   예전 생각하다보니 가격이  소나타급,6
353,솔직히 현기에서 모닝은 ㅋㅋㅋ 가격은 올라가면서 변하는건 쥐똥만큼도 없으니 까여도됨..ㅋ근데 현대가.. 약간 자자체의 성능보다. 편의기능에 많은 투자를하는것같은게. 아반떼의 주행능력은 비슷한 급에서 괜찮다 정도인데.. 편의 옵션은 그래도 다양하게 있음..오히려  외산브랜드보다 편의옵션은 아반떼가 괜차늠,1
354,"현대차관계자분보시면 기분이~그래도신차나왔는데 기술적,성능적으로예전차또는 동급의차와다른점등 을 팩트를바탕으로 설명해주시면더욱좋았을턴데  ~~ 이분의리뷰는 결론적으로 ,이차별로네, 이런말씀하시고싶은뉘앙스",1
355,"오호, 모터그래프를 넘었네요. 짝짝짝",1
356,이천만원대차에서 3억짜리차 디자인 냄새가 난다면 소비자는 복 받은겁니다. 마치 디자인을 소비자의 요청사항을 받아들여 추가한 느낌이 나네요. 고급브렌드차가 저렇게 나왔다면 칭찬일색이겠죠. 편견이 심한건 국내차니 그러려니 합니다. 이번 엘란트라 디자인트렌드인거고 다음에 또 다른 트렌드로 바뀌겠죠.,2
357,역시 사내는 나이를 먹어도 성적인 본능이 살아있군요^^,3
358,2000초반대차에 저디자인이면 존나예쁜거아닌가??? 저거안예쁘다는사람은 이사람이 처음이다,4
359,suv가 유리하고 세단이 줄어든다고 하셨는데 흠.. 세단은 중형부터는 넓이도 그렇고 괜찮지 않나요? 그리고 결혼 안하고 혼자 사는 사람이 증가하는 추세에서 굳이 애기도 없고 가족도 없으면 suv로 가야되나 하는 생각도 드네여  엄청 좋은 suv는 안타봤지만 아직까진 세단이 suv보단 승차감도 좋고 짐을 실거나 하는 면에선 훨 좋은것 같은 개인적인 생각입니다,1
360,방향등이 옆면에 없네?? 차선변경할때 좀 위험한데,5
361,"20:14 총평 구독, 좋아요 누르고 갑니다~",1
362,현대의 스마트 센서1 이런 기능들은 기존 차에도 장착 가능한가요? 예를 들어 90년식 티코 ㅋㅋㅋㅋ 기술 접목에 대해 궁금해서요,1
363,디자인 왜요? 진짜 그랜저 급으로 멋있는데;; 진짜 너무 잘만들었는데 디자인으로 왜까지;;,1
364,디자이너 이상엽 전무가 앞 후드 단차는 디자인 면으로 놔둔거라고 하네요.,1
365,이차색상 뭔지알수있나요?아마존그레이 계약했는데 녹색빛띤다고해서  고민스럽네요이차색상은 괜찮은거같은데,1
366,1800~2000으로 이정도 차면 도요타 코롤라보다 낫지않냐 인테리어는 찐,4
367,제가 오늘 복정에서 스타렉스 위장막을봤는데 외형은 크게 변하지않았지만 디지털 계기판을 가지고있었습니다  스타리아가 맞는걸까요?,1
368,김한용 기자님 목에 보험이라도 들으셔야 할듯. 정말 듣기 편한 목소리는 자동차 기자님중 최고죠.,1
369,아반떼 존예인디 시트도이쁘고,1
370,워낙 해치백을 좋아하다보니 패스트백은 별로!,1
371,쏘나타가 이 디자인이었어도 엄청 이뻣을거 같은데..,1
372,처음에 언급하신 그대로 아반떼 잖아요 정말 멋있게 내놓은게 틀림없는데 예전아반떼에대한 잔존이미지가 마니 남은 분들도 많은가봐요 일반인들이보기엔... 아무튼 전 눈부신 발전을 했다고봐요 잘만들었어요,8
373,본넷 단차는 라인을 두껍께 뺀게 아닐까요?  선을,1
374,다른분들 리뷰보면 중앙 잡고 잘가던데 모지ㅋㅋ중앙 잘잡는다던딩 ㅎㅎ,3
375,실물로 보면 진짜 이쁘던데 다만 흉기 마크가 좀 아쉽다,1
376,그 풍절음은 혹시 유난히 넓어진 단차에서 오는게 아닌가 싶습니다. 달릴 때 부드럽게 하나로 이어진 표면보다는 아무래도 공기가 지나가면서 한 번걸려서 단차가 생긴 틈 아래쪽을 파고 들테니까요.,1
377,소비자들의 니즈는 차사이즈 엔진 차성능면에서만 등급이있고 그래서 거기서 가격차이가 나길바라지 디자인은 가격에따라 후지고 예쁘고 등급이 나눠지지 않길원하죠 그만큼 디자인이 중요한 요소죠 근데 현실은 디자인도 등급에따라 돈을 더들이면 좋아지는건 사실이니깐 제조회사에서도 어쩔수없죠 그리고 솔직히 아반떼정도면 서민들차니깐 디자인무시하고 가성비로 구입할수있죠 근데 디자인 비평이많은건 아니 아반떼등급에 이런 돈많이들고 어려운디자인을 하면서 이정도밖에 안됬냐 좀더 다르게 했으면 엄청 멋졌을건데 때문에 너무 아쉬워서 비평이 많죠,1
378,충분히 멋잇는데 ㅋㅋ 존멋,35
379,근데 양쪽에서 잡아당긴것같은 그릴이 멋있나요? 개인적으로 너무 메기가 입벌리고있는것같은데.. 현대는 중형이하로는 다 저렇게 가네요. 라이트도 바나나킥 처럼 휘어잇고. 어두운대서 불빛만보면 멋져요. 아디까지나 개인의견입니다..ㅎㅎ,1
380,아반떼 괜찮은데요 실물이 별로인가요,8
381,블루핸즈 밀어 터치겄네. 단차잡으러..그랜저만으로도 벅찬데.. 제발 결함 안나왔으면..,1
382,사람이 참 간사한게...고민고민끝에 결정후 어제 계약하고 왓는데 당연히 좋은소리 듣고 싶고 한데 물론 다 좋다는건 아니지만 나름 차쪽으로 신뢰가고 유명한 유튜버니깐 참고삼아 왓는데 너무 안좋은 애기들만 하시니 참 기분이 거시기 하네요 ㅠㅠ,1
383,역대 아반떼중 최고로 애매한 차ㅋㅋㅋ,2
384,차는 그렇다치고 휠이 진짜 ㅋㅋ 어릴때 그랑조 별그리던 기억 나네요ㅋㅋ 코코샤넬이 마지막 고른 악세사리는 하지말라고 했는데 휠이 약간 그꼴난듯요...,2
385,오늘 가서 아반떼 봣는데딱 아반떼급이고 운전석은 넓어 보이는데조수석은 저 막대기에 무릎이 걸려 답답한 감이 있어요쩍벌을 못하는 느낌 불편해요혼자탈거면 좋은 차 같아보이네요,1
386,어떻게 장난감처럼 아반뗴를 살수 있는거냨ㅋㅋㅋㅋ,38
387,"다른 모 대표와는 다르게 되게 겸손하시네요 .. 내가 뭐라고 평가를 이라고 하시는 거부터가 좋은 자세를 갖추신거 같습니다 ㅠㅠ 누구는 지가 뭐라도 되는거마냥 평가질 하는데 말이죠.. 어느 차가 됐던간에 차의 비용이나 급이 어떻든지 간에 정말 자기 입맛대로 개인적이고 주관이게 일관적으로 보편화해서 평가를 하는것보다 이렇게 객관적으로 어느차이냐에 따라 차급과 차의 컨셉,용도에 따라 그에 맞는 정확한 최고의 평가를 해주시는 거 같습니다 ㅎㅎ",1
388,마지막 맥심에서 웃고갑니다,1
389,20대가 좋아하는 스타일 베리굿,3
390,"기본적인 차량 능력. 쉽게말해 가고, 서고, 돌고, 승차감 등의 기본적인 능력이 없이 새로운 디자인, 기술이 가미된다면 그건 잡기술로 치부되겠죠?많은 시승자들이 좋은 평을 내리는 이유도 잡기술이아닌 기본을 바탕으로 한 뒤에 기술을 넣어서 그렇지 않나 생각드네요",3
391,근데 가격대에 맞게끔 만들어져서 단점은 있어도 운전에 지장갈정도로 치명적이진 않지않아요? 단점없는 장점차 탈라면 돈많이 모아서 좋은차 타면 될걸 왜 가격대에 맞는차를 욕하는지 이유를 모르겠어요,1
392,이인용은 전 MBC 앵커였다가 삼성전자에 영입되어 임원으로 근무한분입니다,5
393,진짜 깡통은 깡통일뿐 풀옵 타보면 저런말 안나옴 천지차이임,1
394,디자인은 정말멋진데. 소나타비하면 정말 멋지다.,1
395,세상에 차가 삼각떼와 신형 아반떼 두종류만 있다면 당신은 뭘 선택할것인가? 답은 이미 나왔다,1
396,조수석 옆에 바는 강아지 넘어오지 말라고 있는 거라고 현대차 딜러분이 설명해주셨어요,1
397,아반떼는 100km넘어가면 바람소리 못잡아주는 종특...,1
398,16:53 장난감처럼 접급 할수 있는 차 ㅠㅠㅠ 장난감 살돈이 모자라요 ㅠㅠ,10
399,EF 쏘나타보다더큰 준중형~~~ 개사기다,2
400,ㅋㅋㅋ 안이쁘다는 사람들 특) 지가 가진 차가 더비싼데 덜이뻐서 배알꼴림 or 꼰대쉑,66
401,이쁘긴 진짜 이쁘네요 센터페시아는 왜 저렇게.만들었는지.의문,2
402,내부가 구형하고 비슷하다니  ㅂㄷㅂㄷ,2
403,혹시 풀옵 가격 얼마인지 아시나요??,1
404,디자인 얘기 안하신다믄서 계속하는거 개웃김 ㅋㅋ,3
405,디자인 잘나옴,1
406,19:59 뒷자리떨어진가방이 다시올라오는 마법!,10
407,젊은사람들은 좋아할만 디자인듯 합니다.개취니까요,1
408,어댑티브 크루즈 컨트롤 설정을 어떡해 하는건가요? 핸들에서 그냥 손만때면 되는건가요? 속도 설정같은건 어떡해하나요?,2
409,"5분25초에 lfa가 딱잡아주지못한다고하셨는데 혹시 다른차(쏘렌토,k5등)는 딱잡아주는지 궁금해요",1
410,"연비 인정, 디자인 쌉인정, 가격 납득, 주행능력 준수하면 솔직히 동급대에 대적가능한 차량은 없음. 센터페시아 이거 왜이러냐 하는데 나는 다르게 생각하는게 그거 편의성보다는 저렇게 배치함으로서 디자인이 더 이쁜게 좋음. 불편함이란 르삼처럼 주행할 때 ㅈ 같이 터치눌러야하는 그런게 불편함인거지 저건 익숙하지 않은거임. 솔직히 일주일만 사용하면 그냥 대충 손 가져다 대도 위치 파악됨. 터치 안되서 주행중에 시바 감속하면서 눈 계속 그리로 돌려야하는게 아니잖아 르삼 ㅂㅅ처럼",1
411,"안정적이려나욤,,? k3랑 아반떼랑 xm3 고민중인데,, 사회초년생입니댜☺ 디자인은 다마음에 드는데 차를잘몰라서 고민이네요ㅠㅠ",1
412,번호판 위치가 너무 아쉽네요ㅜㅜ그릴 아래로 보냈으면 어떨까합니다..,5
413,2천대초반 엔트리 모델에 소나타급 혹은 그 이상의 마감을 원하는게진짜 양심 터진거 아닌가?ㅋㅋ,1
414,전 아반떼 디자인 멋지다고 생각합니다ㅎㅎ,1
415,아무리 잘나와도 아반떼는 아반떼,1
416,개인적으로 현대차는 언제나 엘란트라가 제일 멋진듯 갈수록 디자인만 슈퍼카가 되어가네,1
417,ㅋㅋㅋㅋㅋㅋㅋㅋㅋㅋㅋㅋㅋ 저 손잡이(?) 버스에 있잖아요. 버스 기사님들 큰 각도 돌때 손잡이 잡고 한 손으로 핸들 쉬쉬~ 돌리잖아요.아반떼도 크게 돌때~ 저 손잡이 잡고 돌면 될 것 같습니다.,2
418,현대기아 디자인이 점점미래자동차같은 느낌 확실한건 전기차 로 전부넘어가면 독일3사 넘길거같은 느낌 현대기아 주식사러갑니다 ..,21
419,17:25 요즘 시국이 시국인가 코로나로 들었네요..ㅎㅎ잘보고갑니당~!,1
420,이제 현대차 다자인을 까는건 무식한일이 되어버렸다...예전 현대차가 아니다..,5
421,이것을 패밀리 룩으로. 스텔스기같은 삼각모양 좋은데. 중대형은 앞 뒤만 고급스럽게.,1
422,근데 여기 왜이렇게 깎아놨..ㅋㅋㅋㅋㅋ지나가던 아주머니ㅋㅋㅋ 오프닝부터 빵터지네,98
423,현대가 가장 잘만드는 차,1
424,"삼각떼 아이언그레이 차주입니다....그래도 처음엔 이상했지만, 첫 차라 볼수록 그냥 애착이 갔습니다.   내 자식이 이쁘다고요...... 근데 CN7 신형 보고나서, 요즘 밤마다 잠을 설칩니다 ㅠㅠ이성적으로 생각하면 디자인때문에 다시 아반떼 구매는 아닌거같지만, 흔히들 말씀하시는 갬성때문에 다시사야하나 싶습니다....",1
425,준중형은 그레이빨을 잘 못받는다고 생각했는데 이제 아니네요,2
426,8:23 코너링 할때 속도좀 알려주세요!,4
427,모카는 LFA 기능이 떨어진다고하고모터리언은 정말 최고다라고 하고차에따라 다른건지.. 보는 사람의 따라 다른건지..어렵네요.,1
428,이제 아반테 최고트림 vs k5 중간트림 고민... 아아아,1
429,싼차라 그런가 리뷰가 엄청 대충대충 하는 느낌이네요 그냥 그래요 리뷰 항상 다 보는데 모트라인도 그렇고타 리뷰에 비해 딱히 ㅡ관심 없어ㅡ 이런 느낌?이네요ㅎㅎ,1
430,그냥 아반테야! 딱 거기까지야,2
431,차 진짜 잘나오기는했는데 실내 조수석 타보면 너무 답답함 도대체 실내 운전석과 조수석에있는 선은 무엇일까..  약간 상상해보자면 유럽쪽에서 택시로 쓰면 좋을듯한 ㅋㅋ,1
432,이게 별로면 그냥 돈 많이벌어서 외제차 사라 국산에서 이정도면 탑클이다,5
433,16:53 형님 가격이 2470 만원인데 장난감 처럼 접근 할수 있다는 표현은 좀 그렇습니다,22
434,ㅋㅋㅋ  토션빔 하나로 국내 거의 모든 리뷰어들과 싸우네 난 이렇게 일관성 있는사람이 좋더라,1
435,오근데 색이 너무 이쁜데요,3
436,진짜 삼각떼 디자이너 중국에서도 반성좀 해야할듯...삼각떼 뽑은지 1년만에 풀체인지 계약했습니다 변비걸렸다가 쾌변한 느낌이네요...,1
437,포르쉐도 공간이 1cm가까이 됩니다. 괜찮다고 생각해요.,1
438,중간중간 효과음 에어팟 배터리 다되서 연결해지되는 소리랑 비슷해서 에어팟 만지게되네요,4
439,토션6 (자막 거~! 너무한거 아니오)ㅋㅋㅋ 토션6오너로써 웃프네요.,1
440,그랜저 제네시스도  자기 마음에 안들면 그만입니다,22
441,가성비로 따졌을때 저 자격이니 저런품질이 나올수밖에 없고 저런 품질이지만 디자인은 괜찮다 정도인데요약하자면 2천만원대 치고는 디자인이나 다 괜찮다. 다만 품질은 포기해라.2천만원 이상대의 품질을 원한다면 그에 맞는 돈을 지불하면 되니 결국 2천만원대 차량이다. 그이상을 바라면 안된다가 맞는말인듯,1
442,건담이 또 나오네요 역시 기자님 건담을 좋아하시네영,1
443,"저 가격에 저 인테리어 디자인, 외관 디자인기능들 만나보기 사실 힘들죠 그냥 저 디자인이 싫은거랑사실 속내는 저 디자인 마음에 드는데 로고가 현..저기에 동그라미 4개랑 별이나 방패 달아봐라 ..",1
444,아반떼랑 리스펙코란도  어느거가는게 나을까요...실내디자인은 아반떼가이쁜데  둘중하나만선택해라하면요,2
445,쏘나타도 아반떼 프론트랑 리어익스테리어 & 인테리어 따라가야쥐~,1
446,구아방 이라는 단어가 이제는 점점 잊혀질듯..ㅎ,12
447,19:23 형... 또 어떻게 버틸라고....,12
448,한용이형 포르쉐탈때랑 아반떼 탈때랑 말투가너무달러 흑 ㅠ,1
449,차가 너무 튀는데.. 코너 빠지니 120마력이니 속도가 안붙는구나...  차가 2.0정도 파워면 차가 코너 빠지면서 재가속을 안해도 어느정도 가는데.. 1.6이하는 파워가 딸려 다시한번 어중간하게 밞아야.. 재가속이됨... 경차는 그냥.. 빠지면 힘없으니 다시가속...  페달 턴이 어중간하게 됨.. 전형적인.. 가속감은 보이네... . 당연히2.0정도면 빠르게 코너 빠지고 1.6밞듯이 가속하면.... .,1
450,디자인은 밀레니얼 세대 취향 저격인 거 같은데? 세계적으로도 잘 팔릴듯,12
451,머지않아 이차에 다운스프링에 오버휀더 그리고 배기튜닝까지 하는 차가 도로에 보인다에 500원 겁니다,2
452,16:53 장난감이 2500만원....,39
453,시빅이나 코롤라 비해 어떤가요??? 어차피 경쟁차는 시빅이나 코롤라 일텐데,1
454,하지만 기존에 나왔던 차에는 업데이트를 안해주죠,1
455,장난감치곤 넘 비싸네요 ㅎㅎ,1
456,그냥 자기먀 맘에들면 어떤차가 명차 아니겠니...한다...,1
457,삼각떼는 진짜 별로 였는대 이번 신형은 전면 깜박이 빼고는 다 맘에 드는거 같아요 그리고 생각해보니 스포츠 모델은 안나오나오...??,2
458,왜 난 k3가 더 이뻐 보이냐...ㅠㅠ,6
459,"시승하러 갔을 때, 저 단차에 대해서 물어봤는 데.. 일부로 공간감을 표현할려고 했다네요.. 사람마다 다르게 느낄것 같아요",4
460,자막 맞춤법이 너무 많이 틀리네요ㅠ 좀만 더 신경 써주시길..! 잘봤습니다,5
461,"아반떼, k3 다 잘 나온차는 맞다만, 소형 suv에 비하면 메리트가 떨어지는거도 맞긴 하네요. 분명 잘 만든 차지만 저라면 소형 suv를 고를 거 같습니다.",1
462,실내빼고 실외 디자인 개싼마이 ㅋㅋㅋㅋㅋ,1
463,맥심이다....그리고 고개 안돌리면 남자가 아이지배...ㅎㅎㅎㅎ근데 김한용기자님...가죽 잠바(?) 너무 멋있어요?? 어디서 사신거에요??^^,2
464,14:33 센터 손잡이인가 뭔가하는거구매한뒤  샵에서 튜닝으로 떼어내면됨,3
465,신차 나오는건좋은데. 좁은땅덩어리에 먼차가이리많이나와 내앞길정체구간막지말기를  몇년뒤에 또나올거자나 그때도이차는 뭐 어쩌구저쩌구 뭐가바뀌고 차는말이야  잘굴러가고 잘스고 잔고장안나는차가 좋은차야,2
466,일체감있는 선이 굵은 혁신적 디자인이 디자인을 까는건 잘난척하는거 아니면 보는눈이 없는거임,10
467,스포츠모드도 보여주시죠. 핸들이나 악셀의 변화가 궁금했는데.,1
468,저는 개인적으로  보닛라인을 어느정도 수평을 유지하게 만들었으면 하고 굉장히 아쉽습니다  디테일은 평균적으로 무난하다고 보는데 보닛각도가 너무 꺾어버려 귀엽지도  늘씬하지도 않다고 봅니다 앞쪽은 너무 얄상하고 뒤쪽으로 갈수록 두꺼워져버리니 차를 먼데서 봤을  때  옆라인이 좀 그렇더군요 엄청꺾여도 비틀같은 차는 뒷쪽도 균형을 맞추었기 때문에 귀엽기나하지....제차가 올뉴프라이드라인지라 이런 디자인은 엄청 싫어하거든요 물론 연비를 생각하면 공기 저항을 생각 안 할 수가  없기는 합니다....,1
469,시승기는 주관적인거라... 리뷰 마다 틀리네요.. 직접 타보는게 정답,1
470,이전 삼각떼를 돌아보면 다시 이뻐보인다는 뉴 아방이,1
471,형수님!!!!! 21:15 꼭보세요!!!!!,1
472,초장에 단점 어쩌고 하실 때 좀 불안했는데...이렇게 현기차 출시 때 단점 많이 말씀하신 적이 있었나요?,7
473,아.. 소음이 영상에서부터 확 느껴지네요 ㅠ,5
474,테슬라가 선녀라면 도대체ㅎㅎ,1
475,사고싶네요,1
476,단차가 크면 소음잡기는 힘들까요?,1
477,잘 만든 것은 진실이다.,1
478,돈이 자그마치 2천이넘는데 꿈보다 해몽이 좋네요 사실 가격은 다 받아 쳐먹으면서 가성비 좋은듯 유격이 당연한듯 그런게 별로네요,5
479,8:32 이 영상 열번째는 보는거같은데 구독인지 몰랐네ㅋㅋ 그냥 소리 그대로 쓴줄,1
480,이쁘게 만들어도 뭐라하네....ㅎㅎ,13
481,와이파이 노조들노사협상할때이런 조건 낼지도..조립하기 어렵게 디자인하지마!실내 색상 다양하게 해서조립 헷갈리게 디자인하지마!(실제 실내 좌우 색상 다르게 조립한 차들 자주보임!),1
482,팀장왈: 제가 탈려고 디자인 했습니다.,1
483,겁나이쁘다... 와...,1
484,키큰사람 or 덩치큰사람이 타면 불편하진않겟죠?,1
485,아반떼HD 차주로서 아반떼는 AD가 가장 예쁜 거 같고 신형 아반떼는 너무 구겨놨음,2
486,ㅋㅋㅋㅋ뭔가 웃기긴 한데 괜찮네,4
487,여기서 알수있는 것중에 제일 중요한것 남자와 여자는 보는 눈이 다르다 누가 더 잘났다가 아니라 그냥 보는 눈 자체가 다르다,1
488,17:48 기승전XM3,1
489,스펙공차밖인데 출시일 맞춰야되니 그냥NG품 눈감아주고 사과박스해주시고 납품ok ㅋㅋㅋㅋ그러니 저딴 공차가 생길수밖에 없는거.,2
490,조수석쬐 손잡이 설마 드리프트할때 잡으라는건가 ㅋㅋ,1
491,손잡이. 은근 운전할때 유용합니다 저는 카이엔 gts타는데 카이엔도 저런부분있는거 아시죠 은근 유용합니다,1
492,맥심 화보찍는데 눈을 못때셔 ㅋㅋ,12
493,삼각대건 뭐건 전면 그릴 진심 소름.. 대체 왜 저런 조가튼 그릴 디자인을 고집하는 건지 이해가 안감.,2
494,원래 나이 든 사람들이 봤을때 과하다 특이하다 는건 젊은사람한텐 칭찬이죠 ㅋㅋ반대로 괜찮다라고 하는건 거의다 젊은사람한텐 개성없고 멋없는 경우가 태반예로 타투나 악세사리 등등 젊은 사람들이 봤을 땐 패션이고 개성이지만 나이 많은 분들이 봤을땐 과하다 특이하다 이상하다로 말하는 경우가 많죠,1
495,김한용 기자님! 혹시 기자님께서는 어떤 자동차를 좋아하시는지 여쭤봐도 될까요? 어떤 모델이라기보다는 어떠한 차량을 선호하시는지 여쭤보고싶습니다 혹시 그러한 영상 업로드하신게 있으시면 ㄴ알려주시면 감사하겠습니다!!!!,1
496,준 준형차가 2400만원대면 헐.... 1500(깡통)~2000(풀옵션)만원대로 내려야 한다.단차 간격이 1cm정도 된다는건 뒤틀렸을때 서로 부딪히는걸 방지하기 위함이 아닌가요? 고로 뒤틀림이 심한가?,1
497,단차가 아니라 일부러 저렇게 디자인을 했다고 합니다. 선을 강렬히할려고 저러나 ㅋㅋ,1
498,부분부분 보면 인데 전체적인 라인이 언밸런스하고 앞은 낮고 뒤는 너무 높아서 이상함,5
499,모닝에도 앞에 led 턴시그널이 들어가는데아반떼에 led 턴시그널이 안들어가다니..,1
500,처음에 게스트 누구지 했는데 지나가는 행인 오지랖ㅋㅋㅋㅋㅋㅋㅋ,13
501,근데 바같은경우는 애기들이 기어봉 발로 못찰수있어서 괜찬다고느껴지는데,1
502,19:56 놀라떨어지는  짐가방,1
503,첫차로 아반떼 xm3 비교 원하는사람 많을건데   세단 suv차이로 비교 안한다는건 좀 아쉽네요.  pd분이 원하는건 단순히 차로 비교가 아니고 첫차로 젊은층이 원하는차를 비교해달라는 주문이었을건데. 의도를 못읽으신듯,1
